object_id,ein,RltdOrgnztnNm_BsnssNmLn1Txt,FrgnAddrss_AddrssLn1Txt,FrgnAddrss_CtyNm,FrgnAddrss_CntryCd,IdRltdOrgTxblCrpTr_PrmryActvtsTxt,IdRltdOrgTxblCrpTr_LglDmclFrgnCntryCd,DrctCntrllngEnttyNm_BsnssNmLn1Txt,IdRltdOrgTxblCrpTr_ShrOfTtlIncmAmt,IdRltdOrgTxblCrpTr_ShrOfEOYAsstsAmt,IdRltdOrgTxblCrpTr_OwnrshpPct,IdRltdOrgTxblCrpTr_CntrlldOrgnztnInd
201923169349301547,340714585,33 GROSVENOR PLACE LTD,47 ESPLANADE,ST HELIER,JE,JEI 0BD,LEASE HOLDING COMPANY,JE,CLEVELAND CLINIC UK HOLDINGS LTD,C,-365948520,1.00000,1
201923169349301547,340714585,AKRON GENERAL INNOVATIONS INC,1 AKRON GENERAL AVENUE,AKRON,OH,44307,383928798,PARTNERSHIP INVESTMENTS,OH,AKRON GENERAL PARTNERS,C,0
201923169349301547,340714585,AKRON GENERAL MANAGED CARE ASSOCIATION INC,6801 BRECKSVILLE ROAD,INDEPENDENCE,OH,44131,341784985,SUPPORTING SERVICES,OH,AKRON GENERAL MEDICAL CENTER,C,1
201923169349301547,340714585,CCF BOLTON INC,6801 BRECKSVILLE ROAD,INDEPENDENCE,OH,44131,204596571,BUSINESS SERVICES,OH,CLINIC MEDICAL SOLUTIONS INC,C,1
201923169349301547,340714585,CCHS INDEMNITY CO LTD,23 LIME TREE BAY BOX 1051,GRAND CAYMAN,CJ,KY1-1102,980207086,INSURANCE COMPANY,CJ,THE CLEVELAND CLINIC FOUNDATION,C,59458379,161211932,1.00000,1
201923169349301547,340714585,CELLX TECHNOLOGIES INC,10000 CEDAR AVENUE,CLEVELAND,OH,44106,822405500,MEDICAL TECHNOLOGY,DE,THE CLEVELAND CLINIC FOUNDATION,C,1.00000,1
201923169349301547,340714585,CLEVELAND CLINIC CANADA-TORONTO INC,181 BAY STREET BOX818,TORONTO,CA,M5J 2T3,HEALTH CARE SERVICES,CA,THE CLEVELAND CLINIC FOUNDATION,C,13366909,13445532,1.00000,1
201923169349301547,340714585,CLEVELAND CLINIC EMR INC,6801 BRECKSVILLE ROAD,INDEPENDENCE,OH,44131,204856025,MEDICAL SERVICES,OH,CLINIC MEDICAL SOLUTIONS INC,C,1121837,1
201923169349301547,340714585,CLEVELAND CLINIC HEALTH SYSTEM PHYSICIAN ORGANIZATION,6801 BRECKSVILLE ROAD,INDEPENDENCE,OH,44131,341877409,MEDICAL SERVICES,OH,CLINIC MEDICAL SOLUTIONS INC,C,12508988,11549645,1
201923169349301547,340714585,CLEVELAND CLINIC LONDON LTD,11-12 ST JAMESS SQUARE ST1 3RD,LONDON,UK,SW1Y 4LB,HOSPITAL OPERATING COMPANY,UK,CLEVELAND CLINIC UK HOLDINGS LTD,C,-30560,30079471,1.00000,1
201923169349301547,340714585,CLEVELAND CLINIC SAUDI ARABIA (A LIMITED LIABILITY COMPANY),PO BOX 340340,RIYADH,SA,11333,MEDICAL SERVICES,SA,THE CLEVELAND CLINIC FOUNDATION,C,27061943,44047256,1.00000,1
201923169349301547,340714585,CLEVELAND CLINIC UK HOLDINGS LTD,11-12 ST JAMESS SQUARE ST1 3RD,LONDON,UK,SW1Y 4LB,HOLDING COMPANY,UK,THE CLEVELAND CLINIC FOUNDATION,C,-250817,729438861,1.00000,1
201923169349301547,340714585,CLEVELAND HEALTH NETWORK,6000 WEST CREEK ROAD STE 20,INDEPENDENCE,OH,44131,341770780,MEDICAL SERVICES,OH,N/A,C,1
201923169349301547,340714585,CLEVELAND HEALTH NETWORK MANAGED CARE ORGANIZATION,6000 WEST CREEK ROAD STE 20,INDEPENDENCE,OH,44131,341808138,HEALTH CARE SERVICES,OH,CLEVELAND HEALTH NETWORK,C,1
201923169349301547,340714585,CLINIC MEDICAL SOLUTIONS INC,18101 LORAIN AVENUE,CLEVELAND,OH,44111,341695388,HEALTH CARE SERVICES,OH,THE CLEVELAND CLINIC FOUNDATION,C,13943952,4981757,1
201923169349301547,340714585,CMCD INC,1000 E WASHINGTON STREET,MEDINA,OH,44256,341256599,REAL ESTATE,OH,MEDINA HOSPITAL,C,311040,1.00000,1
201923169349301547,340714585,CORA SENTA TECHNOLOGIES INC,10000 CEDAR AVENUE,CLEVELAND,OH,44106,824335548,INACTIVE,DE,THE CLEVELAND CLINIC FOUNDATION,C,0
201923169349301547,340714585,CUSTOM ORTHOPAEDIC SOLUTIONS INC,10000 CEDAR AVENUE,CLEVELAND,OH,44106,274838981,MEDICAL TECHNOLOGY,DE,THE CLEVELAND CLINIC FOUNDATION,C,0
201923169349301547,340714585,ENHALE MEDICAL INC,10000 CEDAR AVENUE,CLEVELAND,OH,44106,821613340,SLEEP APNEA TREATMENT,DE,THE CLEVELAND CLINIC FOUNDATION,C,1463357,1.00000,1
201923169349301547,340714585,INFUSEON THERAPEUTICS INC,10000 CEDAR AVENUE,CLEVELAND,OH,44106,461776182,SCIENTIFIC RESEARCH,DE,THE CLEVELAND CLINIC FOUNDATION,C,100842,399735,1.00000,1
201923169349301547,340714585,ION-VAC INC,10000 CEDAR AVENUE,CLEVELAND,OH,44106,461560044,SCIENTIFIC RESEARCH,DE,THE CLEVELAND CLINIC FOUNDATION,C,89231,1.00000,1
201923169349301547,340714585,LAKEWOOD HEALTHCARE FOUNDATION,14519 DETROIT AVENUE,LAKEWOOD,OH,44107,341574608,HEALTH CARE SERVICES,OH,LAKEWOOD HOSPITAL ASSOCIATION,C,1
201923169349301547,340714585,MCZ INC,1000 E WASHINGTON STREET,MEDINA,OH,44256,341256598,LEASING,OH,MEDINA HOSPITAL,C,7807,500,1.00000,1
201923169349301547,340714585,MEDINVEST INC,6801 BRECKSVILLE ROAD,INDEPENDENCE,OH,44131,203978297,INACTIVE,OH,CLINIC MEDICAL SOLUTIONS INC,C,1.00000,1
201923169349301547,340714585,MERIDIA HEALTH VENTURES INC,6801 BRECKSVILLE ROAD,INDEPENDENCE,OH,44131,341533871,HEALTH CARE SERVICES,OH,CLEVELAND CLINIC HOME CARE,C,1.00000,1
201923169349301547,340714585,MERLOT ORTHOPEDIX INC,10000 CEDAR AVENUE,CLEVELAND,OH,44106,113779414,MEDICAL DEVICE MANUFACTURING,DE,THE CLEVELAND CLINIC FOUNDATION,C,64784,0.55120,1
201923169349301547,340714585,NEOMEDICS INC,6801 BRECKSVILLE ROAD,INDEPENDENCE,OH,44131,020656818,BUSINESS SERVICES,OH,CLINIC MEDICAL SOLUTIONS INC,C,1.00000,1
201923169349301547,340714585,NEUROTHERAPIA INC,10000 CEDAR AVENUE,CLEVELAND,OH,44106,473977513,MEDICAL TECHNOLOGY,DE,THE CLEVELAND CLINIC FOUNDATION,C,305130,1.00000,1
201923169349301547,340714585,OPTOQUEST CORPORATION,10000 CEDAR AVENUE,CLEVELAND,OH,44106,263589643,SCIENTIFIC RESEARCH,DE,THE CLEVELAND CLINIC FOUNDATION,C,61750,52610,1.00000,1
201923169349301547,340714585,PINE FALLS CONDOMINIUM ASSOCIATES INC,6100 WEST CREEK SUITE 25,INDEPENDENCE,OH,44131,341617589,CONDO RENTALS,OH,THE CLEVELAND CLINIC FOUNDATION,C,0.75000,1
201923169349301547,340714585,RENOVO BIOSCIENCES INC,10000 CEDAR AVENUE,CLEVELAND,OH,44106,341956569,MEDICAL TECHNOLOGY,DE,RENOVO BIOSCIENCES INC,C,1003531,1418755,1.00000,1
201923169349301547,340714585,RENOVO NEURAL INC,10000 CEDAR AVENUE,CLEVELAND,OH,44106,800185146,MEDICAL TECHNOLOGY,DE,THE CLEVELAND CLINIC FOUNDATION,C,148193,1.00000,1
201923169349301547,340714585,SHIELD BIOTECH INC,10000 CEDAR AVENUE,CLEVELAND,OH,44106,462880975,MEDICAL TECHNOLOGY,DE,THE CLEVELAND CLINIC FOUNDATION,C,0.72000,1
201923169349301547,340714585,VIVERE PHARMA INC,10000 CEDAR AVENUE,CLEVELAND,OH,44106,475397125,INACTIVE,DE,THE CLEVELAND CLINIC FOUNDATION,C,1.00000,1
201923169349301547,340714585,CLEVELAND CLINIC UK FINANCING PLC,11-12 ST JAMESS SQUARE ST1 3RD,LONDON,UK,SW1Y 4LB,FINANCING,UK,CLEVELAND CLINIC UK HOLDINGS LTD,C,524516847,1.00000,1
201923169349301547,340714585,UNION CARE CORPORATION,659 BOULEVARD,DOVER,OH,44622,341556177,INACTIVE,OH,THE UNION HOSPITAL ASSOCIATION,C,1.00000,1
201923169349301547,340714585,UNION PHARMACEUTICALCARE INC,659 BOULEVARD,DOVER,OH,44622,043588229,HEALTH CARE SERVICES,OH,THE UNION HOSPITAL ASSOCIATION,C,15157,42127,1.00000,1
201923169349301547,340714585,CASHEL NEURAL INC,6801 BRECKSVILLE ROAD,INDEPENDENCE,OH,44131,824625105,SCIENTIFIC RESEARCH,DE,C,1
201923169349301547,340714585,NEW COS INC,6801 BRECKSVILLE ROAD,INDEPENDENCE,OH,44131,824828042,SCIENTIFIC RESEARCH,DE,C,1263741,519193,1
201923169349301547,340714585,TMAO INC,6801 BRECKSVILLE ROAD,INDEPENDENCE,OH,44111,824850194,INACTIVE,DE,C,1
201923169349301547,340714585,CHARITABLE REMAINDER TRUSTS (14),C/O 6801 BRECKSVILLE ROAD,INDEPENDENCE,OH,44131,OH,T,1
201903199349311455,111635088,RADIOLOGY CONSULTING OF LONG ISLANDPLLC,1000 MONTAUK HIGHWAY,WEST ISLIP,NY,11795,421646134,HEALTHCARE SVC,NY,GOOD SAMARITAN,C-CORP,false
201903199349311455,111635088,SAMARITAN PEDIATRIC SERVICES PC,1000 MONTAUK HIGHWAY,WEST ISLIP,NY,11795,208180263,HEALTHCARE SVC,NY,GOOD SAMARITAN,C-CORP,false
201903199349311455,111635088,SAMARITAN MEDICAL SERVICES PC,1000 MONTAUK HIGHWAY,WEST ISLIP,NY,11795,208088453,HEALTHCARE SVC,NY,GOOD SAMARITAN,C-CORP,false
201903199349311455,111635088,SOUTHWEST SUFFOLK MEDICAL PC,580 UNION BOULEVARD,WEST ISLIP,NY,11795,061603195,HEALTHCARE SVC,NY,GOOD SAMARITAN,C-CORP,false
201903199349311455,111635088,CARDIAC EKG INTERPRETATION PC,992 N VILLAGE AVENUE,ROCKVILLE CENTRE,NY,11570,112924518,HEALTHCARE SVC,NY,GOOD SAMARITAN,C-CORP,false
201903199349311455,111635088,LI REGIONAL ARTHRITIS & OSTEOPOROSIS CAR,1000 MONTAUK HIGHWAY,WEST ISLIP,NY,11795,208964140,HEALTHCARE SVC,NY,GOOD SAMARITAN,C-CORP,false
201903199349311455,111635088,SAMARITAN MANAGEMENT SERVICES,1000 MONTAUK HIGHWAY,WEST ISLIP,NY,11795,112838185,HEALTHCARE SVC,NY,CHSLI,C-CORP,false
201903199349311455,111635088,ADVANCED REHABILIATION MEDICINE PLLC,200 BELLE TERRE ROAD,PORT JEFFERSON,NY,11777,113640709,HEALTHCARE SVC,NY,STCHARLES HOSP,C-CORP,false
201903199349311455,111635088,ST FRANCIS CARDIAC PREVENTION SERVICES,100 PORT WASHINGTON BLVD,ROSLYN,NY,11576,113224885,HEALTHCARE SVC,NY,STFRANCIS HOSP,C-CORP,false
201903199349311455,111635088,SOUTH SHORE PRACTICE MANAGEMENT,1000 MONTAUK HIGHWAY,WEST ISLIP,NY,11795,113307977,HEALTHCARE SVC,NY,SAMARITAN MGMT,C-CORP,false
201903199349311455,111635088,SAMARITAN HOME CARE AMERICA,1000 MONTAUK HIGHWAY,WEST ISLIP,NY,11795,113319259,HEALTHCARE SVC,NY,SAMARITAN MGMT,C-CORP,false
201903199349311455,111635088,MERCY INTERNAL MEDICINE PC,992 N VILLAGE AVENUE,ROCKVILLE CENTRE,NY,11570,510639649,HEALTHCARE SVC,NY,MERCY MED CTR,C-CORP,false
201903199349311455,111635088,LONG ISLAND EMERGENCY CARE PC,1000 N VILLAGE AVE,ROCKVILLE,NY,11571,113633515,PHYSICIAN SVC,NY,MERCY MED CTR,S-CORP,false
201933199349313523,953797687,GIA INSTRUMENT (TAIWAN) CO,3F 270 NANJING EAST ROAD SEC 3,TAIPEI ROC,TW,EDUCATIONAL SERVICES,TW,GEMOLOGICAL INSTITIUTE OF AMERICA INC,C,2161891,1551871,1.00000,1
201933199349313523,953797687,GEMOLOGICAL RESEARCH (THAILAND) COMPANY LTD,U-CHU-LIANG BLDG 10TH FL 968 RAM,SILOM BANGRAK BANGKOK,TH,LIMITED LABORATORY SERVICE,TH,GEMOLOGICAL INSTITIUTE OF AMERICA INC,C,11201895,10284284,1.00000,1
201933199349313523,953797687,GIA HONG KONG LIMITED,3RD FLOOR NEW WORLD TOWER II,QUEENS ROAD CENTRAL,HK,EDUCATIONAL SERVICES,HK,GEMOLOGICAL INSTITIUTE OF AMERICA INC,C,1698677,3495210,1.00000,1
201933199349313523,953797687,GIA BELGIUM NV,LANGE HERENTALSESTRAAT 20-26,B ANTWERP,BE,RESEARCH SERVICES,BE,GEMOLOGICAL INSTITIUTE OF AMERICA INC,C,2655225,5479647,0.84720,1
201933199349313523,953797687,GIA EDUCATION AND LABORATORY LIMITED,STE 201/301 DIAMOND TECHNOLOGY PAR,PT BL INDUSTRIAL GABORONE,BC,EDUCATIONAL AND LABORATORY SERVICES,BC,GEMOLOGICAL INSTITIUTE OF AMERICA INC,C,8503842,4212611,1.00000,1
201933199349313523,953797687,GEMOLOGICAL INSTITUTE INTERNATIONAL INC,5345 ARMADA DR,CARLSBAD,CA,92008,263688898,EDUCATIONAL AND TRAINING SERVICES,CA,GEMOLOGICAL INSTITUTE OF AMERICA INC,C,1425058,544807,1.00000,1
201933199349313523,953797687,GIA INDIA LABORATORY PRIVATE LIMITED,10TH FLOOR TRADE CENTRE BANDRA KUR,BANDRA EAST MUMBAI,IN,LABORATORY SERVICES,IN,GIA HOLDINGS INC,C,1040636,450707,0.00460,1
201933199349313523,953797687,GIA EDUCATION AND LABORATORY (PTY) LTD,1 KRAMER ROAD THE PARAGON 2ND FL,BEDFORDVIEW JOHANNESBURG,SF,EDUCATIONAL AND LABORATORY SERVICES,SF,GEMOLOGICAL INSTITUTE OF AMERICA INC,C,5759954,4073092,1.00000,1
201933199349313523,953797687,GIA TOKYO GODO KAISHA,YAMAGUCHI BLDG 7 11TH FLOOR 19-9,CHOME TAITOKU TOKYO,JA,EDUCATIONAL AND LABORATORY SERVICES,JA,GEMOLOGICAL INSTITUTE OF AMERICA INC,C,6154975,3774331,1.00000,1
201933199349313523,953797687,GIA HONG KONG LABORATORY LIMITED,25TH FLOOR PROSPERITY TOWER,QUEENS ROAD CENTRAL,HK,LABORATORY SERVICES,HK,GEMOLOGICAL INSTITUTE OF AMERICA INC,C,15070549,14422333,1.00000,1
201933199349313523,953797687,GIA CHINA LIMITED,RM4033 8 MIDDLE YIN CHENG ROAD,PU DONG SHANGHAI,CH,MARKETING AND CONSULTING,CH,GIA HONG KONG LIMITED,C,1
201933199349313523,953797687,GIA EDUCATION AND LABORATORY PRIVATE LIMITED,9TH FLOOR TRADE CENTER BANDRA KURL,MUMBAI MAHARASHTRA,IN,EDUCATIONAL AND LABORATORY SERVICES,IN,GIA HOLDINGS INC,C,-2,12,0.01000,1
201933199349301858,221487173,ENGLEWOOD HEALTHCARE ENTERPRISES INC,350 ENGLE STREET,ENGLEWOOD,NJ,07631,222872393,HEALTHCARE SVCS.,NJ,NA,C CORP.,false
201933199349307538,710236856,MULTIMANAGEMENT SERVICES INC,9601 BAPTIST HEALTH DRIVE,LITTLE ROCK,AR,722057299,710599194,MANAGEMENT,AR,BAPTIST HEALTH,C CORPORATION,2188220,143064372,1.00000,true
201933199349307538,710236856,BAPTIST MEDCARE INC,9601 BAPTIST HEALTH DRIVE,LITTLE ROCK,AR,72205,710678160,MEDICAL CARE,AR,NA,C CORPORATION,true
201933199349307538,710236856,HOTEL PROPERTIES INC,9601 BAPTIST HEALTH DRIVE,LITTLE ROCK,AR,72205,710599198,HOTELS,AR,NA,C CORPORATION,true
201933199349307538,710236856,SERVICE FINANCE CORPORATION,9601 BAPTIST HEALTH DRIVE,LITTLE ROCK,AR,72205,710333251,FINANCE SERVI,AR,NA,C CORPORATION,true
201933199349307538,710236856,WESTSIDE PROPERTIES INC,9601 BAPTIST HEALTH DRIVE,LITTLE ROCK,AR,72205,710532013,REAL ESTATE,AR,NA,C CORPORATION,true
201933199349307538,710236856,BAPTIST MEDICAL SYSTEMS HMO INC,9601 BAPTIST HEALTH DRIVE,LITTLE ROCK,AR,72205,710622925,HEALTHCARE SR,AR,NA,C CORPORATION,true
201943199349302004,160743102,OLEAN GENERAL SERVICES CORP,515 MAIN STREET,OLEAN,NY,14760,161447054,JOINT VENTURE HOLDING COMPANY,NY,OLEAN GENERAL HOSPITAL,C,1.00000,0
201943169349302724,541547408,SENTARA HOLDINGS INC,6015 POPLAR HALL DRIVE,NORFOLK,VA,23502,541555638,HOLDING COMPANY,VA,N/A,C,1
201943169349302724,541547408,SENTARA HEALTH PLANS INC,6015 POPLAR HALL DRIVE,NORFOLK,VA,23502,522368125,TPA,VA,N/A,C,1
201943169349302724,541547408,OPTIMA HEALTH GROUP,6015 POPLAR HALL DRIVE,NORFOLK,VA,23502,541473382,HMO,VA,N/A,C,1
201943169349302724,541547408,OPTIMA HEALTH INSURANCE COMPANY,6015 POPLAR HALL DRIVE,NORFOLK,VA,23502,541642752,HEALTH INSURANCE,VA,N/A,C,1
201943169349302724,541547408,OPTIMA BEHAVIORAL HEALTH SERVICES,6015 POPLAR HALL DRIVE,NORFOLK,VA,23502,621382666,MENTAL HEALTH SVCS,VA,N/A,C,1
201943169349302724,541547408,SENTARA VENTURES INC,6015 POPLAR HALL DRIVE,NORFOLK,VA,23502,541688615,HOLDING COMPANY,VA,N/A,C,1
201943169349302724,541547408,SENTARA OBICI PROFESSIONAL CENTER,6015 POPLAR HALL DRIVE,NORFOLK,VA,23502,541445865,RE RENTAL,VA,N/A,C,1
201943169349302724,541547408,SENTARA STRATEGIC SOLUTIONS INC,6015 POPLAR HALL DRIVE,NORFOLK,VA,23502,541020941,HEALTH CARE,VA,N/A,C,1
201943169349302724,541547408,SENTARA HEALTH PLANS OF OHIO INC,6015 POPLAR HALL DRIVE,NORFOLK,VA,23502,471509408,TPA,OH,N/A,C,1
201943169349302724,541547408,SENTARA HEALTH INSURANCE CO OF NC,6015 POPLAR HALL DRIVE,NORFOLK,VA,23502,471888140,HEALTH INSURANCE,NC,N/A,C,1
201943169349302724,541547408,SENTARA HEALTH PLANS OF NC INC,6015 POPLAR HALL DRIVE,NORFOLK,VA,23502,465510421,TPA,NC,N/A,C,1
201943169349302724,541547408,MANAGED CARE SERVICES INC,6015 POPLAR HALL DRIVE,NORFOLK,VA,23502,815421060,ALT HEALTH DELIVERY,VA,N/A,C,1
201943169349302724,541547408,SENTARA SOUTHSIDE HEALTH SERVICES INC,6015 POPLAR HALL DRIVE,NORFOLK,VA,23502,541417772,HEALTH SERVICES,VA,N/A,C,1
201943169349302724,541547408,DOMINION HEALTH MEDICAL ASSOCIATES LTD,6015 POPLAR HALL DRIVE,NORFOLK,VA,23502,541060357,PHYS PRACTICE,VA,N/A,C,1
201943169349302724,541547408,SMG INNOVATIONS INC,6015 POPLAR HALL DRIVE,NORFOLK,VA,23502,203730331,HEALTH CARE,VA,N/A,C,1
201943169349302724,541547408,POTOMAC VENTURES CORP,6015 POPLAR HALL DRIVE,NORFOLK,VA,23502,541441420,PHARMACY,VA,N/A,C,1
201943169349302724,541547408,ROCKINGHAM HEALTH SERVICES INC,6015 POPLAR HALL DRIVE,NORFOLK,VA,23502,541721387,CONTRACTING SVCS,VA,N/A,C,1
201943169349302724,541547408,MARTHA JEFFERSON MEDICAL ENTERPRISES INC,6015 POPLAR HALL DRIVE,NORFOLK,VA,22911,541841528,MEDICAL BILLING SVCS,VA,N/A,C,1
201943169349302724,541547408,BAY PRIMEX INSURANCE COMPANY LTD,PO BOX 1051,GRAND CAYMAN,CJ,KY1-1102,980704114,OTHER INSURANCE FUNDS,CJ,N/A,C,1
201943169349302724,541547408,ALBEMARLE PHYSICIAN SERVICES-SENTARA INC,6015 POPLAR HALL DRIVE,NORFOLK,VA,23502,264592192,PHYS PRACTICE,NC,N/A,C,1
201943169349302724,541547408,THE PORT WARWICK MEDICAL ARTS BUILDING ASSOCIATION,6015 POPLAR HALL DRIVE,NORFOLK,VA,23502,562295574,BUILDING ASSOCIATION,VA,N/A,C,1
201943169349302724,541547408,MEDSTREAMING EGYPT SOFTWARD,15 ANMAR IBN YASSER ST,CAIRO,EG,CONSULTING,EG,N/A,C,1
201943169349302724,541547408,HIGHLAND DIRECT HEDGED EQUITY FUND LTD,27 HOSPITAL ROAD,GEORGE TOWN,CJ,KY1-9008,INVESTMENT,CJ,N/A,C,1
201912889349300246,344429091,THE INN AT OHIO MANAGEMENT COMPANY,401 WEST COLLEGE AVENUE,ADA,OH,45810,263068091,HOTEL/RESTAURANT,OH,ONU,C CORP,514263,157472,1.00000,true
201912889349300246,344429091,CHARITABLE REMAINDER TRUSTS (9),CHAR. REM. TRUSTS,OH,NA,TRUST,false
201912889349300246,344429091,PERPETUAL TRUSTS (2),PERPETUAL TRUSTS,OH,NA,TRUST,false
201913519349300816,750827421,Charitable Remainder Trusts4,3909 Swiss Avenue,Dallas,TX,75204,Charitable Remainder Trusts,TX,N/A,Trust
201913519349300816,750827421,Pooled Life Income Fund1,3909 Swiss Avenue,Dallas,TX,75204,Life Income Fund,TX,N/A,Trust
202001929349301615,231365353,BARGE GANSE VENACAREINC,555 NORTH DUKE STREET,LANCASTER,PA,17604,232113017,HEALTHCARE,PA,LGS Inc,C-Corp,false
202001929349301615,231365353,CLINICAL HEALTH CARE ASSOC OF NJ PC,250 KING OF PRUSSIA RD 4TH FL,RADNOR,PA,19087,232865181,PHYS MGMT,PA,CCA,C-CORP,false
202001929349301615,231365353,DELANCEY CORPORATION,800 SPRUCE STREET,PHILADELPHIA,PA,19106,232060159,RENTAL,PA,PA HOSPITAL,C-CORP,false
202001929349301615,231365353,FRANKLIN CASUALTY INSURANCE CO,PO BOX 530,BURLINGTON,VT,05402,043378984,INSURANCE,VT,TRUSTEES,C-CORP,false
202001929349301615,231365353,LANCASTER GENERAL INSURANCE COMPANY,PO BOX 1109 GT,GRAND CAYMAN,GRAND CAYMAN,CJ,KYI-1102,980176655,INSURANCE,CJ,LG HEALTH,C-CORP,false
202001929349301615,231365353,LANCASTER GENERAL SERVICES INC,555 NORTH DUKE STREET,LANCASTER,PA,17604,232250128,PROPERTY SVCS,PA,LG HEALTH,C-Corp,false
202001929349301615,231365353,NAYA 1740 FUND LTD,PO BOX 309,UGLAND HOUSE,GRAND CAYMAN,CJ,KY1-1104,INVESTMENT,CJ,TRUSTEES,C-CORP,false
202001929349301615,231365353,UPENN HOSPITALITY INC,3401 WALNUT STREET SUITE 440A,PHILADELPHIA,PA,19104,233076589,HOTEL/RESTAURANT,PA,TRUSTEES,C-CORP,false
202001929349301615,231365353,PENN WHARTON CONSULTING (BEIJING) CO LTD,CHINA WORLD TOWER 1 14F,CHAOYANG DIST,BEIJING,CH,100004,BUS. CONSULTING,CH,UPENN INT'L,C-CORP,false
202001929349301615,231365353,PRESBYTERIAN MEDICAL SERVICES,39TH AND MARKET STREET,PHILADELPHIA,PA,19104,232307991,HEALTHCARE,PA,PMC,C-CORP,false
202001929349301615,231365353,QUAKER INSURANCE COMPANY LTD,3451 WALNUT ST ROOM 329,PHILADELPHIA,PA,19104,300708282,SELF-INSURANCE,BD,TRUSTEES,C-CORP,false
202001929349301615,231365353,THE PAM 1740 FUND LTD,PO BOX 309,GEORGE TOWN,GRAND CAYMAN,CJ,KYI-1104,INVESTMENT,CJ,TRUSTEES,C-CORP,false
202001929349301615,231365353,TURK'S HEAD HEALTH SERVICES INC,701 E MARSHALL STREET,WEST CHESTER,PA,19380,232329753,MEDICAL SERVICES,PA,CCH&HS,C-CORP,false
202001929349301615,231365353,LANCASTER GENERAL 457 DEFERRED COMP PLAN,555 NORTH DUKE STREET,LANCASTER,PA,17604,232250941,TRUST,PA,LG HEALTH,TRUST,false
202001929349301615,231365353,ARCM 1740 FUND LTD,27 HOSPITAL ROAD,GRAND CAYMAN,CJ,KY1-9008,INVESTMENT,CJ,TRUSTEES,C-CORP,false
202001929349301615,231365353,PRINCETON HEALTH INC & SUBS,ONE PLAINSBORO ROAD,PLAINSBORO,NJ,08536,223450093,MEDICAL,NJ,PHCS HOLDING,C-CORP,false
202001929349301615,231365353,PHI PHARMACY INC,ONE PLAINSBORO ROAD,PLAINSBORO,NJ,08536,223467899,INACTIVE,NJ,PHCS HOLDING,C-CORP,false
202001929349301615,231365353,CIRCLE MEDICAL ASSURANCE CO,2929 WALNUT STREET SUITE 460,PHILADELPHIA,PA,19104,833556286,INSURANCE,PA,TRUSTEES,C-CORP,false
202001929349301615,231365353,PENN MEDICINE LONDON LIMITED,RADIUS COMM SRVCS LTD 11TH FL,WHITEFRIARS LEWINS MEAD,BRISTOL,UK,BS1 2NT,HEALTHCARE,UK,UPENN INT'L,LIMITED COMPANY,false
201913169349306776,550643304,Allied Health Services Inc,PO Box 782,Morgantown,WV,26507,550652017,Medical Lab,WV,N/A,C Corp,false
201913169349306776,550643304,West Virginia United Insurance Services Inc,3040 University Ave Suite 3200,Morgantown,WV,26505,550756055,Provider Network,WV,N/A,C Corp,false
202041979349305184,042103542,Amherst Inn Company - DE,Amherst College 155 Pleasant Stree,Amherst,MA,01002,272334296,Real Estate,DE,Trustees of AC,C Corp,5387604,16989683,1.00000,true
202041979349305184,042103542,Charitable Unitrusts - CA (4),PO BOX 5000,AMHERST,MA,01002,Charitable Trust,CA,NA,Trust,true
202041979349305184,042103542,Charitable Unitrusts - CT (4),PO BOX 5000,AMHERST,MA,01002,Charitable Trust,CT,NA,Trust,true
202041979349305184,042103542,Charitable Unitrusts - FL (4),PO BOX 5000,AMHERST,MA,01002,Charitable Trust,FL,NA,Trust,true
202041979349305184,042103542,Charitable Unitrusts - GA (1),PO BOX 5000,AMHERST,MA,01002,Charitable Trust,GA,NA,Trust,true
202041979349305184,042103542,Charitable Unitrusts - MA (9),PO BOX 5000,AMHERST,MA,01002,Charitable Trust,MA,NA,Trust,true
202041979349305184,042103542,Charitable Unitrusts - MI (1),PO BOX 5000,AMHERST,MA,01002,Charitable Trust,MI,NA,Trust,true
202041979349305184,042103542,Charitable Unitrusts - NC (1),PO BOX 5000,AMHERST,MA,01002,Charitable Trust,NC,NA,Trust,true
202041979349305184,042103542,Charitable Unitrusts - NJ (2),PO BOX 5000,AMHERST,MA,01002,Charitable Trust,NJ,NA,Trust,true
202041979349305184,042103542,Charitable Unitrusts - NY (2),PO BOX 5000,AMHERST,MA,01002,Charitable Trust,NY,NA,Trust,true
202041979349305184,042103542,Charitable Unitrusts - OH (3),PO BOX 5000,AMHERST,MA,01002,Charitable Tr,OH,NA,Trust,true
202041979349305184,042103542,Charitable Unitrusts - PA (2),PO BOX 5000,AMHERST,MA,01002,Charitable Trust,PA,NA,Trust,true
202041979349305184,042103542,Charitable Unitrusts - TX (1),PO BOX 5000,AMHERST,MA,01002,Charitable Trust,TX,NA,Trust,true
202041979349305184,042103542,Charitable Unitrusts - WA (1),PO BOX 5000,AMHERST,MA,01002,Charitable Trust,WA,NA,Trust,true
202041979349305184,042103542,Charitable Unitrusts - MA (113),PO Box 5000,Amherst,MA,01002,Charitable Trust,MA,NA,Trust,true
202041979349307414,951664112,CHARITABLE REMAINDER TRUST (113),SPLIT INT TRUST,CA,NA,Trust,true
202041979349307414,951664112,POOLED INCOME FUND (2),SPLIT INT TRUST,CA,NA,Trust,true
202021929349302767,820200907,CHARITABLE REMAINDER TRUSTS (25),INVESTMENTS,ID,NORTHWEST NAZARENE UNIVERSITY INC,T,1
202001929349302775,521272129,MedStar Pharmacies Inc,10980 GRANTCHESTER WAY,Columbia,MD,21044,521513056,Drug Sales,MD,NA,C Corp
202001929349302775,521272129,ExtenCare Inc,10980 GRANTCHESTER WAY,Columbia,MD,21044,521556228,Medical SVCS,MD,NA,C Corp
202001929349302775,521272129,Helix Resources Management Inc,10980 GRANTCHESTER WAY,Columbia,MD,21044,521913070,Admin SVCS,MD,NA,C Corp
202001929349302775,521272129,HelixCare Medical Group LLC,10980 GRANTCHESTER WAY,Columbia,MD,21044,521955580,Medical SVCS,MD,NA,C Corp
202001929349302775,521272129,HelixCare Properties LLC,10980 GRANTCHESTER WAY,Columbia,MD,21044,521966695,Medical SVCS,MD,NA,C Corp
202001929349302775,521272129,Parkway Ventures Inc,10980 GRANTCHESTER WAY,Columbia,MD,21044,521893569,Holding CO.,MD,NA,C Corp
202001929349302775,521272129,Physicians Administrative Services Inc,10980 GRANTCHESTER WAY,Columbia,MD,21044,237042074,Billing SVCS,MD,NA,C Corp
202001929349302775,521272129,MedStar Family Choice Inc,10980 GRANTCHESTER WAY,Columbia,MD,21044,521995521,Managed Care,MD,NA,C Corp
202001929349302775,521272129,Medstar Enterprises Inc,4061 Powdermill Road Suite 210,Calverton,MD,20705,522139841,Admin SERVICE,MD,NA,C Corp,0,155081,1.00000,false
202001929349302775,521272129,SiTeL Inc,10980 GRANTCHESTER WAY,COLUMBIA,MD,21044,900753340,EDUCATIONAL,MD,NA,C Corp
202001929349302775,521272129,Star Billing Inc,4061 Powdermill Road Suite 210,Calverton,MD,20705,521850113,Billing SVCS,MD,NA,C Corp,0,0,1.00000,false
202001929349302775,521272129,Washington Risk Network Management Inc,4061 Powdermill Road Suite 210,Calverton,MD,20705,522132677,Medical SVCS,MD,NA,C Corp,0,16547,1.00000,false
202001929349302775,521272129,Washington Hospital Center Physician Hos,100 Irving Street NW,Washington,DC,20010,521931000,Medical SVCS,MD,NA,C Corp,19091540,25465822,1.00000,false
202001929349302775,521272129,Medstar Physician Partners Inc,4061 Powdermill Road Suite 210,Calverton,MD,20705,522030809,Medical SVCS,MD,NA,C Corp,0,853367,1.00000,false
202001929349302775,521272129,Franklin Square Drive Land Condo Associa,10980 GRANTCHESTER WAY,Columbia,MD,21044,760756352,CONDOMINIUMS,MD,NA,C Corp
202001929349302775,521272129,MGH Diversified Services Inc,18101 Prince Philip Drive,Olney,MD,20832,521943602,Medical SVCS,MD,NA,C Corp
202001929349302775,521272129,St Mary's Health Alliance Inc,25500 Point Lookout Road,Leonardtown,MD,20650,521930331,Medical SVCS,MD,NA,C Corp
202001929349302775,521272129,Greenspring Financial Insurance Limited,23 LIME TREE BAY AVENUE PO BOX 1051,GRAND CAYMAN,CJ,KY1-1102,980188617,Insurance,CJ,NA,C Corp
202001929349302775,521272129,ST MARY'S CONDO ASSN,25500 POINT LOOKOUT RD,LEONARDTOWN,MD,20650,273377216,CONDOMINIUMS,MD,NA,C CORP
202001929349302775,521272129,MEDSTAR HEALTH MASTER RETIREMENT TRUST,103 SOUTH CHURCH ST,Grand Cayman,CJ,KY1-1002,981371657,INVESTMENTS,CJ,NA,C CORP
202001929349302775,521272129,MEDSTAR HEALTH INC - INVESTMENT FUND I,103 SOUTH CHURCH ST,Grand Cayman,CJ,KY1-1002,981310273,INVESTMENTS,CJ,NA,C CORP
202041069349300824,160743040,CHARITABLE REMAINDER TRUST (2),CRAT,NY,NA,Trust,true
202041069349300824,160743040,CHARITABLE REMAINDER UNITRUST (4),CRUT,NY,NA,Trust,true
202041069349300824,160743040,POOLED INCOME FUND,POOLED INCOME,NY,NA,TRUST,true
202020699349301007,042111203,Charitable Remainder Trust (19),950 Main Street,Worcester,MA,01610,Charitable Trust,MA,N/A,T,0
201943189349303504,131624135,MEDICAL INDEMNITY ASSURANCE COMPANY LTD,535 EAST 70TH STREET,NEW YORK,NY,10021,981050215,SELF-INDEMNITY,CJ,NA,C,0,0,true
201943189349303504,131624135,HSS VENTURES,535 EAST 70TH STREET,NEW YORK,NY,10021,061624300,HEALTH CARE,NY,NA,C,0,0,true
201943189349303504,131624135,CHARITABLE TRUST,INVESTMENT/CHARIT,OH,NA,T,false
201943189349303504,131624135,LIVING TRUST,INVESTMENT/CHARIT,CA,NA,T,false
201923179349308327,742358522,NMSI dba Northcare,1801 16th Street,Greeley,CO,80634,742354291,Medical claims processing,CO,NCMC Inc,C,12661,1.00000,1
202011689349300911,630312914,Charitable remainder trust (7),trust,AL,Samford University,Trust,true
