object_id,ein,DsrgrddEnttyNm_BsnssNmLn1Txt,USAddrss_AddrssLn1Txt,USAddrss_CtyNm,USAddrss_SttAbbrvtnCd,USAddrss_ZIPCd,IdRltdTxExmptOrg_EIN,IdRltdTxExmptOrg_PrmryActvtsTxt,IdRltdTxExmptOrg_LglDmclSttCd,IdRltdTxExmptOrg_ExmptCdSctnTxt,IdRltdTxExmptOrg_PblcChrtySttsTxt,DrctCntrllngEnttyNm_BsnssNmLn1Txt,IdRltdTxExmptOrg_CntrlldOrgnztnInd
201821359349308937,310643552,CINCINNATI CHRISTIAN UNIVERSITY FOUNDATION,2700 GLENWAY AVENUE,CINCINNATI,OH,45204,453985463,PROVIDE FINANCIAL AND OTHER SUPPORT FOR CINCINNATI CHRISTIAN UNIVERSITY,OH,501(C)(3),"LINE 12A, I",CINCINNATI CHRISTIAN UNIVERSITY,1
201821359349306337,341226547,Sisters of St Francis Sylvania,6832 Convent Blvd,Sylvania,OH,43560,344450609,Religious,OH,501(c)(3),1,N/A,0
201811319349301601,231355135,Phila College Osteopathic Med Foundation,4170 City Avenue,Philadelphia,PA,19131,222691757,Investment,PA,501(C)(3),12A,NA,false
201811319349301601,231355135,Overmont Corporation,4001 Monument Road,Philadelphia,PA,19131,231922689,Housing,PA,501(C)(3),09,NA,false
201821359349311892,530204707,WASHINGTON RESEARCH LIBRARY CONSORTIUM,901 COMMERCE DRIVE,UPPER MARLBORO,MD,20774,521559828,LIBRARY SERVICES,DC,501 (C)(3),"Line 11B, II",N/A,0
201821359349311892,530204707,HOward University International,2400 6th Street NW,WASHINGTON,DC,20059,Education,DC,501 (C)(3),Howard University,0
201821359349311802,911160585,Heritage U Leverage Lender,3240 Fort RD,Toppenish,WA,98948,475284384,Leverage Lending Support for Heritage University,WA,501(c)(3),"Line 12d, III-O",Heritage University,1
201821359349311802,911160585,Heritage U Building Support,3240 Fort RD,Toppenish,WA,98948,475071980,Building support for Heritage University,WA,501(c)(3),"Line 12a, I",Heritage University,1
201811349349302076,141340095,RENSSELAER HARTFORD GRADUATE CENTER INC,275 WINDSOR STREET,HARTFORD,CT,06120,060766747,GRADUATE INSTRUCTION,CT,501(c)(3),170-b(1)(A)ii,NA,false
201811349349302326,060766747,Rensselaer Polytechnic Institute,110 Eighth Street,Troy,NY,12180,141340095,Education,NY,501(c)(3),2,NA,false
201841929349301304,251094922,POINT PARK UNIVERSITY FOUNDATION,201 WOOD STREET,PITTSBURGH,PA,15222,473515830,"TO PROMOTE, SUPPORT, AND FURTHER THE PURPOSES OF POINT PARK UNIVERSITY",PA,501(C)(3),509(A)(3),POINT PARK UNIVERSITY,0
201821989349301182,391353508,EWU FOUNDATION INC,819 SOUTH WABASH AVENUE,CHICAGO,IL,60605,452954962,TITLE HOLDING COMPANY,IL,501(c)(2),EAST WEST UNIVERSITY,1
201831359349305303,340714670,Hiram College Property Management,PO Box 1808,Hiram,OH,44234,341676973,Property Rental,OH,501(c)(2),Hiram College,0
201841669349300744,464671972,Living Way Ministries,14800 Sherman Way,Van Nuys,CA,91405,237448576,Media ministry,CA,501(c)(3),Line 1,0
201841669349300744,464671972,The King's University,2121 East Southlake Blvd,Southlake,TX,76092,954663290,Private school,CA,501(c)(3),Line 2,0
201801359349306815,630366652,GENERAL CONFERENCE OF SEVENTH-DAY ADVENTISTS,12501 OLD COLUMBIA PIKE,SILVER SPRINGS,MD,20904,RELIGIOUS ACTIVITIES,MD,501(C)(3),0
201801359349306815,630366652,GENERAL CONFERENCE CORPORATION OF SEVENTH-DAY ADVENTISTS,12501 OLD COLUMBIA PIKE,SILVER SPRINGS,MD,20904,RELIGIOUS ACTIVITIES IN A FIDUCIARY CAPACITY,MD,501(C)(3),0
201801359349307265,570314422,SC CONFERENCE OF THE UNITED METHODIST CHURCH,4908 Colonial Drive,Columbia,SC,29203,church,SC,501(c)(3),1,N/A,0
201811939349300106,111630906,Community Legal Assistance Corporation,108 Hofstra University,Hempstead,NY,11549,112267282,Education,NY,501(c)(3),11(a),na,true
201811939349300106,111630906,Hofstra Law Access to Justice Incubator,108 Hosftra University,Hempstead,NY,11549,463390636,Education,NY,501 (C)(3),11(a),na,true
201811349349308191,750827409,POUCH CORPORATION,900 N GRAND,SHERMAN,TX,75090,751627120,PRIVATE CLASS,TX,501(C)(7),AUSTIN COLLEGE,0
201801359349307500,480543729,The Kansas Wesleyan Univ Fdn,100 E Claflin Avenue,Salina,KS,67401,481032245,Fundraising,KS,501(c)(3),11-III FI,NA,false
201801359349307510,262258318,UNIVERSITY OF LOUISVILLE FOUNDATION INC,215 CENTRAL AVENUE SUITE 212,LOUISVILLE,KY,40208,237078461,ENHANCEMENT OF UNIVERSITY OF LOUISVILLE'S MISSION,KY,501(C)(3),LINE 5,N/A,0
201801359349307510,262258318,ULH INC,215 CENTRAL AVENUE SUITE 212,LOUISVILLE,KY,40208,310926171,STUDENT HOUSING,KY,501(C)(3),"LINE 12B, II",UNIVERSITY OF LOUISVILLE FOUNDATION INC,0
201801359349307510,262258318,THE NUCLEUS REAL PROPERTIES INC,215 CENTRAL AVENUE SUITE 212,LOUISVILLE,KY,40208,463070346,REAL ESTATE,KY,501(C)(3),"LINE 12B, II",UNIVERSITY OF LOUISVILLE FOUNDATION INC,0
201831349349308948,362182171,BILLY GRAHAM CENTER,501 COLLEGE AVENUE,WHEATON,IL,60187,362982217,RESEARCH,IL,501(c)(3),Type I,WHEATON COLLEGE,true
201831349349308948,362182171,WHEATON COLLEGE ALUMNI ASSOCIATION,501 COLLEGE AVENUE,WHEATON,IL,60187,366127340,ALUMNI ASSOC,IL,501(c)(3),Type I,WHEATON COLLEGE,true
201831359349302893,383519708,AVE MARIA SCHOOL OF LAW FOUNDATION,1025 COMMONS CIRCLE,NAPLES,FL,34119,383487577,PROVIDES FINANCIAL SUPPORT TO AMSOL,MI,501(c)(3),"Line 12c, III-FI",0
201831359349302893,383519708,Ave Maria University Inc,5050 Ave Maria Blvd,ave maria,FL,34142,030482006,University Education,FL,501(c)(3),Line 5,0
201831359349305693,941156617,BRONCO BENCH FOUNDATION,Santa Clara University,Santa Clara,CA,95053,946121957,Fundraising,CA,501(c)(3),"Line 12b, II",President-Board of Trustee Santa Clara College,1
201831359349305693,941156617,JESUIT SCHOOL OF THEOLOGY OF SANTA CLARA,1735 Le roy ave,berkeley,CA,94709,941156462,Education,CA,501(c)(3),Line 1,President-Board of Trustee Santa Clara College,1
201811319349301821,231353385,Susquehanna University & Ortenzio Charitable Trust,4718 Gettysburg Road Ste 405,Mechanicsburg,PA,17055,806155309,Supports Susquehanna University,PA,501(c)(3),"Line 12a, I",Susquehanna University,0
201831349349306218,361408475,MUNDELEIN COLLEGE,820 N MICHIGAN AVE,CHICAGO,IL,60611,362179799,EDUCATION,IL,501(c)(3),2,LUC,true
201831349349306218,361408475,KRASA FAMILY TRUST,PO BOX 803878,CHICAGO,IL,60680,366828217,SUPPORT LUC,IL,501(c)(3),12d,NA,true
201831349349306218,361408475,LOYOLA ROME CENTER FOUNDATION,VIA MASSIMI 114/A,ROME,IT,IT,999999999,SUPPORT,IT,501(c)(3),LUC,true
201801359349309915,810703802,GREAT RIVER LAND TRUST INC,1 RIVERSide Drive,EAST HARTFORD,CT,06118,454128786,LAND PRESERVATION,CT,501(c)(3),Line 7,GOODwin college inc,0
201801359349309915,810703802,GOODWIN COLLEGE FOUNDATION INC,ONE RIVERSIDE DRIVE,EAST HARTFORD,CT,06118,061599388,fundraising,CT,501(c)(3),Line 10,gOODwin college inc,0
201801359349309915,810703802,GOODWIN COLLEGE INC,ONE RIVERSIDE DRIVE,EAST HARTFORD,CT,06118,061627882,EDUCATION,CT,501(c)(3),Line 2,0
201801359349309915,810703802,GOODWIN COLLEGE EDUCATION SERVICES INC,ONE RIVERSIDE DRIVE,EAST HARTFORD,CT,06118,810703551,SUPPORT FOR GOODWIN COLLEGE MAGNET SCHOOLS,CT,501(c)(3),"Line 12b, II",GOODWIN college inc,0
201801359349309915,810703802,connecticut training center inc,1137 main street,easT HARTFORD,CT,06108,223235660,education,CT,501(c)(3),Line 2,N/A,0
201811349349304776,410711610,NORTHWESTERN FOUNDATION,3003 SNELLING AVENUE NORTH,ST PAUL,MN,55113,411878924,EDUCATION FOUNDATION,MN,501(C)(3),LINE 7,UNIVERSITY OF NORTHWESTERN - ST PAUL,1
201821359349308372,630400608,Miles Law School,5500 Myron Massey Blvd,Fairfield,AL,35064,630829631,School of Law,AL,501c3,2,N/A,false
201821359349308372,630400608,Miles College Community Development,4901 Lloyd Nolan Parkway,Birmingham,AL,35064,264379022,Real Estate Mgmt.,AL,501c3,7,Miles College,false
201821949349300902,131624202,The Columbia Teachers College Foundation in HK,Jardine House 26th Fl 1 Connaught P,Central,HK,EDUCATION,HK,true
201821949349300902,131624202,Every Voice Choirs Inc,211 West 106th Street Apt 11C,New York,NY,10025,460114758,MUSIC EDUCATION,NY,501(c)(3),509(a)(2),Teachers College CU,true
201811989349300986,381988915,SIXTY PLUS INC,300 S CAPITOL AVE 6TH FLOOR,LANSING,MI,48933,382245744,LEGAL SERVICES FOR THE ELDERLY,MI,501(c)(3),7,1
201821359349305527,741161941,Concordia University Texas Foundation,11400 Concordia University Dr,Austin,TX,78726,273255819,Support COncordia University Texas,TX,501(c)(3),"Line 12a, I",Concordia University Texas,1
201801359349303955,311146505,UNIVERSITY OF KENTUCKY,301 PETERSON SERVICE BUILDING,LEXINGTON,KY,40506,616001218,HIGHER ED,KY,6,NA,false
201811909349301136,362167854,AUDITORIUM THEATRE OF ROOSEVELT UNIVERSITY INC,50 EAST CONGRESS PKWY,CHICAGO,IL,60605,363145476,PERFORMING ARTS,IL,501(c)(3),7,ROOSEVELT UNIVERSITY,true
201811909349301136,362167854,ROOSEVELT UNIVERSITY DEVELOPMENT CORPORATION,430 SOUTH MICHIGAN AVENUE,CHICAGO,IL,606051315,274036050,CHARITABLE AND EDUCATIONAL,IL,501(c)(3),Type I,ROOSEVELT UNIVERSITY,true
201811909349301136,362167854,EDUCATIONAL ADVANCEMENT FUND INC,525 S STATE STREET,CHICAGO,IL,60605,364480416,UNIVERSITY HOUSING,IL,501(c)(3),Type II,NA,false
201821359349302247,581357177,LUCAS THEATRE FOR THE ARTS INC,32 ABERCORN STREET,SAVANNAH,GA,31401,581775851,CULTURAL,GA,501(C),LINE 10,SAVANNAH COLLEGE OF ART AND DESIGN INC,1
201821359349302247,581357177,SCAD FOUNDATION (HONG KONG) LIMITED,292 TAI PO ROAD,N KOWLOON,N. KOWLOON,HK,EDUCATION,HK,EXEMPT,LINE 2,SAVANNAH COLLEGE OF ART AND DESIGN INC,1
201811949349301011,362167817,RUBICON INSURANCE COMPANY,2020 RIDGE AVENUE,EVANSTON,IL,60208,363694409,PROVIDING MEDICAL MALPRACTICE COVERAGE,IL,501(c)(3),Type II,NORTHWESTERN UNIVERSITY,true
201811949349301011,362167817,STUDENTS PUBLISHING COMPANY,1999 SHERIDAN RD,EVANSTON,IL,60208,366002654,PUBLISHES STUDENT PERIODICALS,IL,501(c)(3),Type II,N/A,false
201811949349301011,362167817,MCGAW MEDICAL CENTER OF NORTHWESTERN UNIVERSITY,420 E SUPERIOR ST,CHICAGO,IL,60611,362656113,COORDINATION OF MEDICAL RESIDENTS,IL,501(c)(3),Type I,N/A,false
201811949349301011,362167817,NORTHWESTERN GLOBAL HEALTH FOUNDATION,PO BOX 1969,EVANSTON,IL,60204,273159956,DEVELOPING MEDICAL DEVICES FOR PEOPLE IN NEED IN DEVELOPING COUNTRIES,IL,501(c)(3),9,NORTHWESTERN UNIVERSITY,true
201811949349301011,362167817,THE BIG TEN CONFERENCE INC,1500 W HIGGINS RD,PARK RIDGE,IL,60068,363640583,FACILITATE QUALITY INTERCOLLEGIATE ATHLETIC COMPETITION,IL,501(c)(3),Type II,N/A,false
201811949349301011,362167817,NORTHWESTERN UNIVERSITY EMPLOYEES BENEFIT TRUST,PO BOX 803878,CHICAGO,IL,60680,363180819,PROVIDING HEALTH INSURANCE BENEFITS TO CURRENT AND FORMER ELIGIBLE EMPLOYEES,IL,501(c)(9),NORTHWESTERN UNIVERSITY,true
201811949349301011,362167817,NORTHWESTERN UNIVERSITY EMPLOYEES BENEFIT TRUST DENTAL,PO BOX 803878,CHICAGO,IL,60680,363591834,PROVIDING HEALTH INSURANCE BENEFITS TO CURRENT AND FORMER ELIGIBLE EMPLOYEES,IL,501(c)(9),NORTHWESTERN UNIVERSITY,true
201811949349301011,362167817,NORTHWESTERN UNIVERSITY DISABILITY TRUST,135 S LASALLE ST,CHICAGO,IL,60603,366784987,PROVIDING DISABILITY BENEFITS TO CURRENT AND FORMER ELIGIBLE EMPLOYEES,IL,501(c)(9),NORTHWESTERN UNIVERSITY,true
201811949349301011,362167817,COMMITTEE ON INSTITUTIONAL COOPERATION,1819 S NEIL ST,CHAMPAIGN,IL,61820,463254996,ACADEMIC CONSORTIUM TO ADVANCE MISSION OF MEMBER INSTITUTIONS,IL,501(c)(3),Type III-FI,N/A,false
201811949349301011,362167817,WOMANS EDUCATIONAL AID ASSOC,804 OAKTON ST 1E,EVANSTON,IL,60202,363049387,PROVIDING FINANCIAL AID TO STUDENTS,IL,501(c)(3),Type II,N/A,false
201831949349301013,113354073,congregation bnos yehudah,1213 elm avenue,brooklyn,NY,11230,113160436,PLACE OF WORSHIP,NY,501 c 3,PUBLIC CHARITY,N/A,false
201831949349301013,113354073,bais yaakov academy,1213 elm avenue,brooklyn,NY,11230,113122562,EDUCATIONAL INSTITUTION K THRU 12,NY,501 C 3,PUBLIC CHARITY,N/A,false
201821309349303902,112553515,New York State,1 Commerce Plz 99 Washington Ave,Albany,NY,12231,146013200,Government,NY,501(C)(1),N/A,NA,false
201821309349303902,112553515,Stony Brook Urology UFPC,PO Box 1554,Stony Brook,NY,11790,112644371,Healthcare,NY,501(C)(3),10,NYS,false
201821309349303902,112553515,Stony Brook Clin Pract Mgmt Realty Corp,PO Box 1554,Stony Brook,NY,11790,113285712,Rlty Holding,NY,501(C)(25),N/A,CPMP,false
201821309349303902,112553515,Stony Brook Dermatology Associates UFPC,PO Box 1554,Stony Brook,NY,11790,113011790,Healthcare,NY,501(C)(3),10,NYS,false
201821309349303902,112553515,Stony Brook Surgical Holding Corp,PO Box 1554,Stony Brook,NY,11790,116434538,Rlty Holding,NY,501(C)(25),N/A,CPMP,false
201821309349303902,112553515,SB Clinical Practice Management Plan Inc,PO Box 1554,Stony Brook,NY,11790,461787308,Mgmt Activity,NY,501(C)(3),10,NA,false
201821309349303902,112553515,Stony Brook Emergency Physicians UFPC,PO Box 1554,Stony Brook,NY,11790,113066770,Healthcare,NY,501(C)(3),10,NYS,false
201821309349303902,112553515,Stony Brook Family Medical Group UFPC,PO Box 1554,Stony Brook,NY,11790,112552321,Healthcare,NY,501(C)(3),10,NYS,false
201821309349303902,112553515,Stony Brook Internists UFPC,PO Box 1554,Stony Brook,NY,11790,112558775,Healthcare,NY,501(C)(3),10,NYS,false
201821309349303902,112553515,New York Spine and Brain Surgery UFPC,PO Box 1554,Stony Brook,NY,11790,112645930,Healthcare,NY,501(C)(3),10,NYS,false
201821309349303902,112553515,Stony Brook Preventive Med Srvc UFPC,PO Box 1554,Stony Brook,NY,11790,112822992,Healthcare,NY,501(C)(3),10,NYS,false
201821309349303902,112553515,Neurology Assoc of Stony Brook UFPC,PO Box 1554,Stony Brook,NY,11790,112587430,Healthcare,NY,501(C)(3),10,NYS,false
201821309349303902,112553515,Univ Assoc in Obst & Gynecology UFPC,PO Box 1554,Stony Brook,NY,11790,112569522,Healthcare,NY,501(C)(3),10,NYS,false
201821309349303902,112553515,Stony Brook Pathologists UFPC,PO Box 1554,Stony Brook,NY,11790,112647243,Healthcare,NY,501(C)(3),10,NYS,false
201821309349303902,112553515,Stony Brook Ophthalmology UFPC,PO Box 1554,Stony Brook,NY,11790,112658697,Healthcare,NY,501(C)(3),10,NYS,false
201821309349303902,112553515,Stony Brook Orthopaedic Associates UFPC,PO Box 1554,Stony Brook,NY,11790,112593061,Healthcare,NY,501(C)(3),10,NYS,false
201821309349303902,112553515,Stony Brook Children's Service UFPC,PO Box 1554,Stony Brook,NY,11790,112571524,Healthcare,NY,501(C)(3),10,NYS,false
201821309349303902,112553515,Stony Brook Psychiatric Associates UFPC,PO Box 1554,Stony Brook,NY,11790,112590096,Healthcare,NY,501(C)(3),10,NYS,false
201821309349303902,112553515,Stony Brook Radiation Oncology UFPC,PO Box 1554,Stony Brook,NY,11790,112664726,Healthcare,NY,501(C)(3),10,NYS,false
201821309349303902,112553515,Stony Brook Radiology UFPC,PO Box 1554,Stony Brook,NY,11790,112548304,Healthcare,NY,501(C)(3),10,NYS,false
201821309349303902,112553515,Stony Brook Surgical Associates UFPC,PO Box 1554,Stony Brook,NY,11790,112552333,Healthcare,NY,501(C)(3),10,NYS,false
201841949349300314,237428512,The New York Association for Analytical,28 East 39th Street,NEW YORK,NY,10016,510243845,A professional society of Jungian analysts,NY,N/A,false
201801359349314570,560603922,African Methodist Episcopal Zion Church,3225 Sugar Creek Road,Charlotte,NC,28269,581734680,Contributor,NC,501c3,1,N/A,false
201801359349314560,943477000,ALLIANCE GERTZ-RESSLER RICHARD MERKIN 6-12 COMPLEX,601 S FIGUEROA STREET 4TH FLOOR,LOS ANGELES,CA,90017,200846362,EDUCATION,CA,501(C)(3),2,ALLIANCE FOR COLLEGE READY PUBLIC SCHOOLS,0
201801359349314560,943477000,ALLIANCE COLLINS FAMILY COLLEGE-READY HIGH SCHOOL,601 S FIGUEROA STREET 4TH FLOOR,LOS ANGELES,CA,90017,010833582,EDUCATION,CA,501(C)(3),2,ALLIANCE FOR COLLEGE READY PUBLIC SCHOOLS,0
201801359349314560,943477000,ALLIANCE JUDY IVIE BURTON TECHNOLOGY ACADEMY HIGH SCHOOL,601 S FIGUEROA STREET 4TH FLOOR,LOS ANGELES,CA,90017,010833578,EDUCATION,CA,501(C)(3),2,ALLIANCE FOR COLLEGE READY PUBLIC SCHOOLS,0
201801359349314560,943477000,ALLIANCE DR OLGA MOHAN HIGH SCHOOL,601 S FIGUEROA STREET 4TH FLOOR,LOS ANGELES,CA,90017,721616709,EDUCATION,CA,501(C)(3),2,ALLIANCE FOR COLLEGE READY PUBLIC SCHOOLS,0
201801359349314560,943477000,ALLIANCE PATTI AND PETER NEUWIRTH LEADERSHIP ACADEMY,601 S FIGUEROA STREET 4TH FLOOR,LOS ANGELES,CA,90017,510581150,EDUCATION,CA,501(C)(3),2,ALLIANCE FOR COLLEGE READY PUBLIC SCHOOLS,0
201801359349314560,943477000,ALLIANCE OUCHI O'DONOVAN 6-12 COMPLEX,601 S FIGUEROA STREET 4TH FLOOR,LOS ANGELES,CA,90017,510581153,EDUCATION,CA,501(C)(3),2,ALLIANCE FOR COLLEGE READY PUBLIC SCHOOLS,0
201801359349314560,943477000,ALLIANCE JACK H SKIRBALL MIDDLE SCHOOL,601 S FIGUEROA STREET 4TH FLOOR,LOS ANGELES,CA,90017,510581154,EDUCATION,CA,501(C)(3),2,ALLIANCE FOR COLLEGE READY PUBLIC SCHOOLS,0
201801359349314560,943477000,ALLIANCE MARC AND EVA STERN MATH AND SCIENCE SCHOOL,601 S FIGUEROA STREET 4TH FLOOR,LOS ANGELES,CA,90017,510581156,EDUCATION,CA,501(C)(3),2,ALLIANCE FOR COLLEGE READY PUBLIC SCHOOLS,0
201801359349314560,943477000,ALLIANCE PIERA BARBAGLIA SHAHEEN HEALTH SERVICES ACADEMY,601 S FIGUEROA STREET 4TH FLOOR,LOS ANGELES,CA,90017,943476912,EDUCATION,CA,501(C)(3),2,ALLIANCE FOR COLLEGE READY PUBLIC SCHOOLS,0
201801359349314560,943477000,ALLIANCE MORGAN MCKINZIE HIGH SCHOOL,601 S FIGUEROA STREET 4TH FLOOR,LOS ANGELES,CA,90017,943476915,EDUCATION,CA,501(C)(3),2,ALLIANCE FOR COLLEGE READY PUBLIC SCHOOLS,0
201801359349314560,943477000,ALLIANCE LEICHTMAN-LEVINE FAMILY FOUNDATION ENVIRONMENTAL SCIENCE HIGH SCHO,601 S FIGUEROA STREET 4TH FLOOR,LOS ANGELES,CA,90017,943476918,EDUCATION,CA,501(C)(3),2,ALLIANCE FOR COLLEGE READY PUBLIC SCHOOLS,0
201801359349314560,943477000,ALLIANCE COLLEGE-READY MIDDLE ACADEMY #5,601 S FIGUEROA STREET 4TH FLOOR,LOS ANGELES,CA,90017,943477005,EDUCATION,CA,501(C)(3),2,ALLIANCE FOR COLLEGE READY PUBLIC SCHOOLS,0
201801359349314560,943477000,ALLIANCE CINDY AND BILL SIMON TECHNOLOGY ACADEMY HIGH SCHOOL,601 S FIGUEROA STREET 4TH FLOOR,LOS ANGELES,CA,90017,273723511,EDUCATION,CA,501(C)(3),2,ALLIANCE FOR COLLEGE READY PUBLIC SCHOOLS,0
201801359349314560,943477000,ALLIANCE TENNENBAUM FAMILY TECHNOLOGY HIGH SCHOOL,601 S FIGUEROA STREET 4TH FLOOR,LOS ANGELES,CA,90017,273723566,EDUCATION,CA,501(C)(3),2,ALLIANCE FOR COLLEGE READY PUBLIC SCHOOLS,0
201801359349314560,943477000,ALLIANCE SUSAN AND ERIC SMIDT TECHNOLOGY HIGH SCHOOL,601 S FIGUEROA STREET 4TH FLOOR,LOS ANGELES,CA,90017,274320694,EDUCATION,CA,501(C)(3),2,ALLIANCE FOR COLLEGE READY PUBLIC SCHOOLS,0
201801359349314560,943477000,ALLIANCE TED K TAJIMA HIGH SCHOOL,601 S FIGUEROA STREET 4TH FLOOR,LOS ANGELES,CA,90017,274320744,EDUCATION,CA,501(C)(3),2,ALLIANCE FOR COLLEGE READY PUBLIC SCHOOLS,0
201801359349314560,943477000,ALLIANCE FOR COLLEGE-READY PUBLIC SCHOOLS,601 S FIGUEROA STREET 4TH FLOOR,LOS ANGELES,CA,90017,954779029,EDUCATION,CA,501(C)(3),7,N/A,0
201801359349314560,943477000,ALLIANCE RENEE AND MEYER LUSKIN ACADEMY HIGH SCHOOL,601 S FIGUEROA STREET 4TH FLOOR,LOS ANGELES,CA,90017,453138991,EDUCATION,CA,501(C)(3),2,ALLIANCE FOR COLLEGE READY PUBLIC SCHOOLS,0
201801359349314560,943477000,ALLIANCE MARGARET M BLOOMFIELD TECHNOLOGY ACADEMY HIGH SCHOOL,601 S FIGUEROA STREET 4TH FLOOR,LOS ANGELES,CA,90017,453324807,EDUCATION,CA,501(C)(3),2,ALLIANCE FOR COLLEGE READY PUBLIC SCHOOLS,0
201801359349314560,943477000,ALLIANCE FOR COLLEGE-READY PUBLIC SCHOOLS FACILITIES CORPORATION,601 S FIGUEROA STREET 4TH FLOOR,LOS ANGELES,CA,90017,452947371,EDUCATION,CA,501(C)(3),11A,ALLIANCE FOR COLLEGE READY PUBLIC SCHOOLS,0
201801359349314560,943477000,ALLIANCE COLLEGE-READY MIDDLE ACADEMY #12,601 S FIGUEROA STREET 4TH FLOOR,LOS ANGELES,CA,90017,463157726,EDUCATION,CA,501(C)(3),2,ALLIANCE FOR COLLEGE READY PUBLIC SCHOOLS,0
201801359349314560,943477000,ALLIANCE COLLEGE-READY MIDDLE ACADEMY #8,601 S FIGUEROA STREET 4TH FLOOR,LOS ANGELES,CA,90017,463138259,EDUCATION,CA,501(C)(3),2,ALLIANCE FOR COLLEGE READY PUBLIC SCHOOLS,0
201801359349314560,943477000,ALLIANCE KORY HUNTER MIDDLE SCHOOL,601 S FIGUEROA STREET 4TH FLOOR,LOS ANGELES,CA,90017,463174499,EDUCATION,CA,501(C)(3),2,ALLIANCE FOR COLLEGE READY PUBLIC SCHOOLS,0
201801359349314560,943477000,ALLIANCE LEADERSHIP MIDDLE ACADEMY,601 S FIGUEROA STREET 4TH FLOOR,LOS ANGELES,CA,90017,463193388,EDUCATION,CA,501(C)(3),2,ALLIANCE FOR COLLEGE READY PUBLIC SCHOOLS,0
201801359349314560,943477000,ALLIANCE ALICE M BAXTER COLLEGE-READY HIGH SCHOOL,601 S FIGUEROA STREET 4TH FLOOR,LOS ANGELES,CA,90017,460599798,EDUCATION,CA,501(C)(3),2,ALLIANCE FOR COLLEGE READY PUBLIC SCHOOLS,0
201801359349314560,943477000,ALLIANCE MARINE - INNOVATION AND TECHNOLOGY 6-12 COMPLEX,601 S FIGUEROA STREET 4TH FLOOR,LOS ANGELES,CA,90017,472892698,EDUCATION,CA,501(C)(3),2,ALLIANCE FOR COLLEGE READY PUBLIC SCHOOLS,0
201801989349301675,272818359,SKEMA BUSINESS SCHOOL,60 RUE DOSTOIEVSKI 06902,SOPHIA ANTIPOLIS CEDEX,FR,SCHOOL,FR,501(c)(3),EDUCATIONAL,N/A,0
201811349349308086,540505990,HAMPTON UNIVERSITY MUSEUM FOUNDATION INC,QUEEN AND TYLER STREET,HAMPTON,VA,23668,541854945,SUPPORT HAMPTON UNIVERSITY MUSEUM,VA,501 (C) (3),11A,HAMPTON UNIVERSITY,1
201811349349308086,540505990,HAMPTON COMMUNITY DEVELOPMENT CORPORATION,QUEEN AND TYLER STREET,HAMPTON,VA,23668,541667250,TO ENHANCE QUALITY OF LIFE IN THE CITY OF HAMPTON,VA,501 (C) (3),7,HAMPTON UNIVERSITY,1
201831349349303133,231639911,Viola Foulke Trust,c/o Bryn Mawr Trust Co 1 E Chocolat,hershey,PA,17033,236964516,To provide support to the University of the Arts,PA,501(c)(3),PF,N/A,0
201801359349309370,381359081,COLCHESTER PROPERTIES INC,611 EAST PORTER STREET,ALBION,MI,49224,382025320,REAL ESTATE HOLDING,MI,501(c)(2),N/A,ALBION COLLEGE,1
201802279349301135,061331677,ASCENSION HEALTH ALLIANCE,PO BOX 45998,ST LOUIS,MO,63145,453358926,NATIONAL HEALTH SYSTEM,MO,501(c)(3),Type I,NA,false
201802279349301135,061331677,ASCENSION HEALTH,PO BOX 45998,ST LOUIS,MO,63145,311662309,NATIONAL HEALTH SYSTEM,MO,501(c)(3),Type I,ASCENSION HEALTH ALLIANCE,false
201802279349301135,061331677,ST VINCENT'S MEDICAL CENTER,2800 MAIN STREET,BRIDGEPORT,CT,06606,060646886,HOSPITAL & SYSTEM PARENT,CT,501(c)(3),3,ASCENSION HEALTH,false
201802279349301135,061331677,ST VINCENT'S HEALTH SERVICES CORPORATION,2800 MAIN STREET,BRIDGEPORT,CT,06606,222558134,HOLDING COMPANY,CT,501(c)(3),Type I,ST VINCENT'S MEDICAL CENTER,true
201802279349301135,061331677,ST VINCENT'S MULTISPECIALTY GROUP INC,2800 MAIN STREET,BRIDGEPORT,CT,06606,800458769,PHYSICIAN PRACTICES,CT,501(c)(3),Type I,ST VINCENT'S MEDICAL CENTER,true
201802279349301135,061331677,ST VINCENT'S MEDICAL CENTER FOUNDATION,2800 MAIN STREET,BRIDGEPORT,CT,06606,222558132,FUNDRAISING,CT,501(c)(3),7,ST VINCENT'S HEALTH SERVICES CORP,true
201802279349301135,061331677,ST VINCENT'S DEVELOPMENT INC,95 MERRITT BOULEVARD,TRUMBULL,CT,06611,222554128,REAL ESTATE HOLDINGS,CT,501(c)(25),ST VINCENT'S HEALTH SERVICES CORP,true
201802279349301135,061331677,ST VINCENT'S SPECIAL NEEDS CENTER INC,95 MERRITT BOULEVARD,TRUMBULL,CT,06611,060702617,PROGRAMS FOR SPECIAL NEEDS INDIVIDUALS,CT,501(c)(3),10,ST VINCENT'S HEALTH SERVICES CORP,true
201821359349300232,440545271,International Chapter PEO Sisterhood,3700 Grand Avenue,Des Moines,IA,503122899,420453829,Promotes womens education,IA,501c(4),N/A,0
201821359349309447,042103542,Woodside Children's Center,155 Woodside Avenue,Amherst,MA,01002,042888548,children's daycare,MA,501(c)(3),509(a)(3)III-O,N/A,1
201821359349309447,042103542,Amherst College Foundation Trust,JP Morgan Svcs Inc,PO Box 6089,Newark,DE,197146089,516522862,supporting organization,NY,501(c)(3),PF,N/A,1
201821359349309447,042103542,Amherst College Harry Elwin Harkness class of 1898,PNC Bank NA,620 Liberty Avenue,Pittsburgh,PA,152222705,222891327,supporting organization,PA,501(c)(3),509(a)(3) lll-FI,N/A,1
201821359349309447,042103542,Associated Kyoto Program Inc,Controllers Office,Smith College,Northampton,MA,01063,042996114,supporting organization,MA,501(c)(3),509(a)(3)lll,N/A,0
201801359349302395,311308555,ADVANTAGE HEALTHSAINT MARY'S MEDICAL GROUP,245 STATE ST SE,GRAND RAPIDS,MI,49503,272491974,HEALTH CARE SERVICES,MI,501(C)(3),LINE 10,TRINITY HEALTH-MICHIGAN,1
201801359349302395,311308555,ALLEGANY FRANCISCAN MINISTRIES INC,33920 US HIGHWAY 19 NORTH SUITE 269,PALM HARBOR,FL,34684,581492325,GRANT MAKING,FL,501(C)(3),"LINE 12A, I",TRINITY HEALTH CORPORATION,1
201801359349302395,311308555,ASYLUM HILL FAMILY MEDICINE CENTER INC,114 WOODLAND STREET,HARTFORD,CT,06105,061450170,HEALTH CARE SERVICES,CT,501(C)(3),LINE 3,TRINITY HEALTH OF NEW ENGLAND CORP INC,1
201801359349302395,311308555,BAUM HARMON MERCY HOSPITAL,255 NORTH WELCH AVENUE,PRIMGHAR,IA,51245,421500277,HEALTH CARE AND HOSPITAL SERVICES,IA,501(C)(3),LINE 3,MERCY HEALTH SERVICES-IOWA CORP,1
201801359349302395,311308555,BAUM HARMON MERCY HOSPITAL AND CLINICS FOUNDATION,255 NORTH WELCH AVENUE,PRIMGHAR,IA,51245,262973307,FOUNDATION,IA,501(C)(3),"LINE 12A, I",BAUM HARMON MERCY HOSPITAL,1
201801359349302395,311308555,BEECHWOOD INC,2212 BURDETT AVE,TROY,NY,12180,141651563,TITLE HOLDING COMPANY,NY,501(C)(2),N/A,LTC (EDDY) INC,1
201801359349302395,311308555,BETHLEHEM HAVEN OF PITTSBURGH,905 WATSON STREET,PITTSBURGH,PA,15219,251436685,HOMELESS SHELTER,PA,501(C)(3),LINE 7,PITTSBURGH MERCY HEALTH SYSTEM INC,1
201801359349302395,311308555,BEVERWYCK INC,40 AUTUMN DRIVE,SLINGERLANDS,NY,12159,141717028,SENIOR LIVING COMMUNITY,NY,501(C)(3),LINE 10,LTC (EDDY) INC,1
201801359349302395,311308555,BRIGHTSIDE INC,1221 MAIN STREET SUITE 213,HOLYOKE,MA,01040,042182395,HEALTH CARE SERVICES,MA,501(C)(3),LINE 10,THE MERCY HOSPITAL INC,1
201801359349302395,311308555,CAPITAL REGION GERIATRIC CENTER INC,421 WEST COLUMBIA ST,COHOES,NY,12047,141701597,LONG TERM CARE,NY,501(C)(3),LINE 10,LTC (EDDY) INC,1
201801359349302395,311308555,CARING PARTNERS HOME HEALTH INC,1200 EARHART RD,ANN ARBOR,MI,48105,201681131,HOME HEALTH SERVICES,MI,501(C)(3),LINE 10,GLACIER HILLS INC,1
201801359349302395,311308555,CATHERINE MCAULEY HEALTH SERVICES CORP,PO BOX 995,ANN ARBOR,MI,48106,382507173,HEALTH CARE SERVICES,MI,501(C)(3),LINE 3,TRINITY HEALTH-MICHIGAN,1
201801359349302395,311308555,CATHOLIC HEALTH MINISTRIES,20555 VICTOR PARKWAY,LIVONIA,MI,48152,GOVERNANCE AND MANAGEMENT OF TRINITY HEALTH SYSTEM,VT,501(C)(3),LINE 1,N/A,0
201801359349302395,311308555,COLUMBUS ACQUISITION CORP,111 CENTRAL AVENUE,NEWARK,NJ,07102,262616342,INACTIVE ENTITY,NJ,501(C)(3),LINE 10,SAINT MICHAEL'S MEDICAL CENTER,1
