object_id,ein,RltdOrgnztnNm_BsnssNmLn1Txt,USAddrss_AddrssLn1Txt,USAddrss_CtyNm,USAddrss_SttAbbrvtnCd,USAddrss_ZIPCd,IdRltdOrgTxblPrtnrshp_EIN,IdRltdOrgTxblPrtnrshp_PrmryActvtsTxt,IdRltdOrgTxblPrtnrshp_LglDmclSttCd,IdRltdOrgTxblPrtnrshp_PrdmnntIncmTxt,IdRltdOrgTxblPrtnrshp_ShrOfTtlIncmAmt,IdRltdOrgTxblPrtnrshp_DsprprtntAllctnsInd,IdRltdOrgTxblPrtnrshp_GnrlOrMngngPrtnrInd,IdRltdOrgTxblPrtnrshp_OwnrshpPct
201801979349301170,941156365,LSF V DHB HOLDINGS LP,2711 N HASKELL AVE STE 1700,DALLAS,TX,75204,272858604,INVESTMENTS,DE,STANFORD,EXCLUDED,0,111437,false,0,false,0.61875
201801979349301170,941156365,OUTLAWS CASINO LTD,3160 PORTER DR,PALO ALTO,CA,94304,841457498,HOLDING COMPANY,CO,HP OUTLAWS LLC,0,0,false,0,false
201801979349301170,941156365,PALO ALTO LP,13 CASTLE STREET,ST HELIER JERSEY,JE,981126622,INVESTMENTS,JE,STANFORD,EXCLUDED,0,6534647,false,0,false,0.98880
201801979349301170,941156365,PROJECT EDISON PARTNERS FUND LP,55 E 52ND ST,NEW YORK,NY,10055,473184706,INVESTMENTS,DE,STANFORD,EXCLUDED,-257901,0,false,0,false,0.66620
201801979349301170,941156365,RMS FOREST GROWTH II LP,30 INVERNESS CENTER PARKWAY STE 36,BIRMINGHAM,AL,35242,200841908,INVESTMENTS,CA,STANFORD,EXCLUDED,1781173,73147897,false,0,false,0.64370
201801979349301170,941156365,SANDPIPER FUND LP,2000 MCKINNEY AVE STE 2125,DALLAS,TX,75201,260341626,INVESTMENT,TX,STANFORD,EXCLUDED,-87480737,12602557,false,0,false,0.99430
201801979349301170,941156365,SAROFIM MULTIFAMILY PARTNERS LP,8115 PRESTON RD ST400,DALLAS,TX,75225,201929002,RE DEVELOPMENT,TX,STANFORD,EXCLUDED,0,280536,false,0,false,0.63750
201801979349301170,941156365,SCP REAL ASSETS FUND (A) LP,2498 SAND HILL RD,MENLO PARK,CA,94025,203949682,INVESTMENTS,DE,STANFORD,EXCLUDED,0,8389510,false,249746,false,0.62610
201801979349301170,941156365,SEQUOIA MFM OPERATING COMPANY LLC,770 WELCH ROAD LPCH- ADMIN MC5551,PALO ALTO,CA,94304,475060529,MFM PROGRAM,CA,LPCH,0,0,false,0,false
201801979349301170,941156365,SIC SNOWCREEK VIII LLC,635 KNIGHT WAY,STANFORD,CA,94305,275431605,RE DEVELOPMENT,CA,STANFORD,EXCLUDED,-87115551,350000,false,-399541,false,0.99870
201801979349301170,941156365,SP SMC PARTNERS LLC,2711 CENTERVILLE RD STE 400,WILMINGTON,DE,19808,473103791,INVESTMENTS,DE,STANFORD,EXCLUDED,718096,48305072,false,-220504,false,0.99900
201801979349301170,941156365,STANFORD EMANUEL RAD ONCOLOGY CENTER,825 DELBON AV,TURLOCK,CA,95382,208885091,RADIOLOGY,CA,SHC,0,0,false,0,false
201801979349301170,941156365,STANFORD PET-CT LLC,300 PASTEUR DR MC 5555,STANFORD,CA,94305,611423414,MED. DIAGNOST,CA,STANFORD,RELATED,0,0,false,0,false,0.50000
201801979349301170,941156365,STANFORD-STARTX FUND LLC,3145 PORTER DR,PALO ALTO,CA,94304,464297719,INVESTMENTS,DE,STANFORD,EXCLUDED,-711863,91419347,false,0,true,0.66667
201801979349301170,941156365,SUMIT HOLDING INTERNATIONAL LLC,1400 PAGE MILL ROAD MC5713,PALO ALTO,CA,94304,263934706,HOLDING COMPANY,DE,SHC,0,0,false,0,false
201801979349301170,941156365,VEDA INVESTORS FUND LP,ONE FAWCETT PL,GREENWICH,CT,06830,811810345,INVESTMETNS,DE,STANFORD,EXCLUDED,14219569,523245300,false,0,false,1.00000
201801979349301170,941156365,VERMILION PEAK MASTER FUND,635 KNIGHT WAY,STANFORD,CA,943057297,INVESTMENTS,DE,VERMILION PEAK,0,0,false,0,false
201801979349301170,941156365,WOLFF REAL ESTATE PARTNERS III A LP,635 KNIGHT WAY,STANFORD,CA,943057297,474780701,INVESTMENTS,DE,STANFORD,EXCLUDED,0,23832013,false,0,false,0.92200
201841979349300874,580566256,FOREST HILL STRATEGIC VALUE FUND,100 Morgan Keegan Dr 430,LITTLE ROCK,AR,72202,453638016,INVESTMENTS,DE,FOREST HILL CAP,EXCLUDED,37780565,135407320,false,0,false,0.68220
201841979349300874,580566256,ES REHABILITATION INC,201 DOWMAN DRIVE,ATLANTA,GA,30322,463808267,HEALTHCARE,GA,EMORY HEALTH,RELATED,1863387,8471254,false,0,false,0.51000
201841979349300874,580566256,CALMWATER REAL ESTATE CREDIT FUND II,11755 WILSHIRE BLVD STE 1400,LOS ANGELES,CA,90025,371778274,INVESTMENTS,DE,CALMWATER REAL,EXCLUDED,5505541,62884104,false,0,false,0.96000
201841979349300874,580566256,TENZING GLOBAL INVESTORS,90 NEW MONTGOMERY ST STE 650,SAN FRANCISCO,CA,94105,364708131,INVESTMENTS,DE,TENZING GLOBAL,INVESTMENTS,8197049,41198078,false,0,false,0.50780
201841979349300874,580566256,GRANITE STATE CAPITAL,529 FIFTH AVE 7TH FLOOR,NEW YORK,NY,10017,813995451,INVESTMENTS,DE,GRANITE MASTER,INVESTMENTS,0,0,false,0,false,0.91200
201841979349300874,580566256,THL Credit Direct Lending CoInvest III E,100 FEDERAL ST 31ST FLOOR,BOSTON,MA,02110,320510874,INVESTMENTS,DE,THL CREDIT DIR,INVESTMENTS,0,0,false,0,false,0.99980
201811359349313576,510581154,ALLIANCE FOR COMMUNITY IMPACT LLC,601 S FIGUEROA STREET 4TH FLOOR,LOS ANGELES,CA,90017,461999451,COMMUNITY DEVELOPMENT,CA,ALLIANCE FOR COLLEGE-READY PUBLIC SCHOOLS,0,1,0.99990
201831349349306853,113011790,SB HLTHCARE IPA LLC,PO Box 1554,STNY BRK,NY,11790,113499101,Healthcare,NY,CPMP,related,0,0,false,0,false,0.00000
201831319349303833,590624364,6484 Indian Creek Drive LTD,11300 NE 2nd Avenue,Miami Shores,FL,33161,650669854,Real Estate,FL,Barry University,Excluded,33247,341546,0,1,0.51540
201831359349306623,741613878,BCM TECHNOLOGIES I LP,2 GRNWY PZ 910,HOUSTON,TX,77030,205541490,INVESTMENT,TX,BCM TECHNO,EXCLUDED,0,0,false,false,0.90100
201831359349306623,741613878,BCM VENTURES MGMT,2 GRNWY PZ 910,HOUSTON,TX,77030,205541357,INVESTMENT,TX,BCM TECHNO,EXCLUDED,0,0,false,true,0.40700
201811349349306016,541666531,ART STATION LLC,700 W GRACE STREET,RICHMOND,VA,232843040,462661466,RENTAL REAL ESTATE,VA,VCU REAL ESTATE FOUNDATION,RELATED,11442,667517,0,1,0.99000
201801359349312415,560532129,BLACKWELL PARTNERS LLC - SERIES A - 20-8075455,280 S MANGUM ST STE 210,DURHAM,NC,27701,INVESTMENTS,DE,N/A,N/A,0,0
201801359349312415,560532129,CANYON BLUE INV FD 27-0186996,AVE OF STARS,LA,CA,90067,INVESTMENTS,DE,N/A,N/A,0,0
201801359349312415,560532129,CD FUND LP - 27-0130641,MCKINNEY AVE,DALLAS,TX,75201,INVESTMENTS,TX,N/A,N/A,0,0
201801359349312415,560532129,LIQUID REALTY PTR 05-0537755,LINDA MESA,DANVILLE,CA,94526,INVESTMENTS,DE,N/A,N/A,0,0
201801359349312415,560532129,LYRICAL BLUE RL PT 27-2994514,32 N DEAN ST,ENGLEWOOD,NJ,07631,INVESTMENTS,DE,N/A,N/A,0,0
201801359349312415,560532129,LYRICAL-BLUE RGNT 45-3626577,32 N DEAN ST,ENGLEWOOD,NJ,07631,INVESTMENTS,DE,N/A,N/A,0,0
201801359349312415,560532129,OCTAVIAN BLUE FD 27-2408711,5TH AVENUE,NY,NY,10151,INVESTMENTS,DE,N/A,N/A,0,0
201801359349312415,560532129,SBER LUCKY STRIKE 20-3891303,310 BLACKWELL ST,DURHAM,NC,27701,REAL ESTATE,NC,N/A,N/A,0,0
201801359349312415,560532129,MANGUM II LLC - 46-5135858,280 S MANGUM STREET STE 210,DURHAM,NC,27701,INVESTMENTS,NC,N/A,N/A,0,0
201801359349312415,560532129,LS INVESTOR LLC 20-3891381,310 BLACKWELL ST,DURHAM,NC,27701,REAL ESTATE,NC,N/A,N/A,0,0
201801359349312415,560532129,DILWEG BLUE PF LP 47-1225569,5310 S ALSTON AVE STE 210,DURHAM,NC,27713,INVESTMENTS,DE,N/A,N/A,0,0
201801359349312415,560532129,LYRICAL BLUE RL PT IV 47-2172270,32 N DEAN ST,ENGLEWOOD,NJ,07631,INVESTMENTS,DE,N/A,N/A,0,0
201801359349312415,560532129,LYRICAL BLUE CHP PT 35-2503856,32 N DEAN ST,ENGLEWOOD,NJ,07631,INVESTMENTS,DE,N/A,N/A,0,0
201801359349312415,560532129,BLACKWELL PARTNERS LLC - SERIES C - 81-1264533,280 S MANGUM ST STE 210,DURHAM,NC,27701,INVESTMENTS,DE,N/A,N/A,0,0
201801359349312415,560532129,GPE HOLDCO LLC - 47-5652832,2000 AVE OF THE STARS 11TH FL,LOS ANGELES,CA,90067,INVESTMENTS,DE,N/A,N/A,0,0
201801359349312415,560532129,LIQUID RLT PTR II TE - 20-4362819,10 MARKET ST 769 CAMANA BAY,GRAND CAYMAN,CJ,KY1-9006,INVESTMENTS,DE,N/A,N/A,0,0
201801359349312415,560532129,STRATUS CAPITAL PARTNERS C LP,50 LOTHIAN ROAD FESTIVAL SQUARE,EDINBURGH,UK,EH3 9WJ,INVESTMENTS,UK,N/A,N/A,0,0
201801359349312415,560532129,ALTOS HYBRID D LLC - 47-3996176,2882 SAND HILL ROAD SUITE 100,MENLO PARK,CA,94025,INVESTMENTS,DE,N/A,N/A,0,0
201801359349312415,560532129,BLACKWELL PARTNERS LLC - SERIES B - 47-2530719,280 S MANGUM ST STE 210,DURHAM,NC,27701,INVESTMENTS,DE,N/A,N/A,0,0
201801359349312415,560532129,BLACKWELL PARTNERS LLC - SERIES D - 81-3385353,280 S MANGUM ST STE 210,DURHAM,NC,27701,INVESTMENTS,DE,N/A,N/A,0,0
201801359349312415,560532129,BLACKWELL PARTNERS LLC - SERIES E - 81-1511048,280 S MANGUM ST STE 210,DURHAM,NC,27701,INVESTMENTS,DE,N/A,N/A,0,0
201822229349301222,951643307,MILLARD PLACE LLC,127 N MADISON AVE STE 200,PASADENA,CA,91101,463059045,REAL ESTATE,CA,WILSON AVE INV,EXCLUDED,0,0,false,0,false
201831359349311388,231352630,3509 SPRING GARDEN LP,3201 ARCH STREET STE 420,PHILADELPHIA,PA,19104,462116704,REAL ESTATE,PA,0,0
201831359349311388,231352630,3509 SPRING GARDEN MT LP,3201 ARCH STREET STE 420,PHILADELPHIA,PA,19104,463273473,REAL ESTATE,PA,0,0
201831359349311388,231352630,DREXEL UNIVERSITY CITY DEVELOPMENT LLC,3201 ARCH STREET STE 420,PHILADELPHIA,PA,19104,464883724,REAL ESTATE INVESTMENT,PA,0,0
201831359349311388,231352630,1200 CHESTNUT STREET I LP,3201 ARCH STREET STE 420,PHILADELPHIA,PA,19104,814692503,REAL ESTATE,PA,0,0
201831359349309423,951816009,CR CHELSEA HEIGHTS COMMUNITIES LLC,444 West Beech Street Suite 300,San Diego,CA,92101,462336775,Multifamily Residential Real Estate,CA,LLU MULTIFAMILY PROPERTIES IV LLC,related,28959,9188048,0,0,0.52300
201831359349309423,951816009,CR DESEO COMMUNITIES LLC,444 West Beech Street Suite 300,San Diego,CA,92101,460923187,Multifamily Residential Real Estate,CA,LOMA LINDA TEXAS PROPERTIES LLC,related,-42578,14930066,0,0,0.50220
201831359349309423,951816009,CR RIVERCREST MEADOWS HOLDINGS LLC,444 West Beech Street Suite 300,San Diego,CA,92101,461842027,Multifamily Residential Real Estate,CA,LLU MULTIFAMILY PROPERTIES III LLC,related,-1713,30309669,0,0,0.50600
201831359349309423,951816009,CR THORNBRIDGE HOLDINGS LLC,444 West Beech Street Suite 300,San Diego,CA,92101,473461854,Multifamily Residential Real Estate,CA,CR THORNBRIDGE HOLDINGS LLC,related,-4286,26076502,0,0,0.50170
201831359349309423,951816009,CR WESTBURY COMMUNITIES LLC,444 West Beech Street Suite 300,San Diego,CA,92101,473409746,Multifamily Residential Real Estate,CA,LLU WESTBURY MULTIFAMILY PROPERTY LLC,related,120271,12622425,0,0,0.50760
201831359349309423,951816009,MFLLE-MAITLAND LLC,353 North Clark Street,Chicago,IL,60654,320493144,Multifamily Residential Real Estate,IL,LLU Maitland Multifamily Property LLC,related,1,8751145,0,0,0.66670
201831359349309423,951816009,SPLLU CROSSPOINTE LLC,701 Fifth Avenue Suite 5700,Seattle,WA,98104,812966721,Multifamily Residential Real Estate,WA,LLU CROSSPOINTE MULTIFAMILY PROPERTY LLC,related,27109,9889691,0,0,0.54440
201831359349309423,951816009,SPLLU CROSSPOINTE LLC,701 Fifth Avenue Suite 5700,Seattle,WA,98104,812951324,Multifamily Residential Real Estate,WA,LLU RIVERPOINTE MULTIFAMILY PROPERTY LLC,Related,56173,12795524,0,0,0.56180
201831359349309423,951816009,Mountain Park 450 LLC,9460 Wilshire Blvd Suite 850,Beverly Hills,CA,90212,800945038,Multifamily Residential Real Estate,CA,LLU Mountain Park Multifamily Property LLC,related,6283418,0,0,0.80000
201831359349309423,951816009,CR LAUREL CANYON COMMUNITIES LLC,446 West Beech Street Suite 300,San Diego,CA,92101,462142467,Multifamily Residential Real Estate,CA,Loma Linda Texas Properties III LLC,related,-131409,11453260,0,0,0.60550
201831359349309423,951816009,CR CHAZAL COMMUNITIES LLC,447 West Beech Street Suite 300,San Diego,CA,92101,464295930,Multifamily Residential Real Estate,CA,LLU Chazal Multifamily Property,related,-146802,10769560,0,0,0.61610
201831359349309423,951816009,CR HOUSTON HOUSE HOLDINGS LLC,448 West Beech Street Suite 300,San Diego,CA,92101,464123275,Multifamily Residential Real Estate,CA,LLU Houston House,related,-422108,32012717,0,0,0.61600
201831359349300423,560529988,PEACE COLLEGE&FOUNDATION INVESTMENT POOL,15 EAST PEACE STREET,RALEIGH,NC,27604,943481706,investment,NC,N/A,INVESTMENT,346881,15927357,false,false,0.80297
201811359349301861,430654872,West Locust Lofts Invest LLC,3545 Lindell Blvd,St Louis,MO,63103,431765509,Apartment Rental,MO,SLU Blocker I,38704,34683,false,0,0.95000
201811359349301861,430654872,West Locust Lofts Master Tenant,3545 Lindell Blvd,St Louis,MO,63103,271658170,Apartment Rental,MO,SLU Blocker I,34953,82464,false,0,0.95000
201811359349301861,430654872,West Locust Lofts Capital LLC,3545 Lindell Blvd,St Louis,MO,63103,273007276,Apartment Rental,MO,SLU Blocker I,-1715,0,false,0,0.95000
201811359349301861,430654872,West Locust State Member,3545 Lindell Blvd,St Louis,MO,63103,271964701,Apartment Rental,MO,SLU Blocker I,-115,0,false,0,0.95000
201811359349301861,430654872,Moto Hotel Investors LLC,3545 Lindell Blvd,St Louis,MO,63103,273017741,Hotel,MO,SLU Blocker I,-216500,13657052,false,0,0.95000
201811359349301861,430654872,Moto Hotel Master Tenet LLC,3545 Lindell Blvd,St Louis,MO,63103,270781295,Hotel,MO,SLU Blocker I,-112736,2232261,false,0,0.95000
201811359349301861,430654872,Moto Hotel Subtenant LLC,3545 Lindell Blvd,St Louis,MO,63103,275431531,Hotel,MO,SLU Blocker I,-252554,377400,false,0,0.95000
201811359349301861,430654872,Hotel Ignacio Investors LLC,3545 Lindell Blvd,St Louis,MO,63103,275431979,Hotel,MO,SLU Blocker I,-14500,1316462,false,0,0.95000
201811359349301861,430654872,Hotel Ignacio State MemberLLC,3545 Lindell Blvd,St Louis,MO,63103,271963945,Hotel,MO,SLU Blocker I,106963,2311147,false,0,0.95000
201811359349301861,430654872,West Locust Lofts Developer,3545 Lindell Blvd,St Louis,MO,63103,275430630,Apartment Rental,MO,SLU Blocker I,29,0,false,0,0.75000
201811359349301861,430654872,Moto Hotel Developer LLC,3545 Lindell Blvd,St Louis,MO,63103,Hotel,MO,SLU Blocker I,-115,655,false,0,0.75000
201811359349301861,430654872,INTO SLU LLC,3721 Lallede Ave,St Louis,MO,63108,383982089,Recruitment,DE,INTO SLU LLC,-1184895,4257152,false,0,0.50000
201811359349314711,943477005,ALLIANCE FOR COMMUNITY IMPACT LLC,601 S FIGUEROA STREET 4TH FLOOR,LOS ANGELES,CA,90017,461999451,COMMUNITY DEVELOPMENT,CA,ALLIANCE FOR COLLEGE-READY PUBLIC SCHOOLS,0,1,0.99990
201831359349310403,951644037,ANDURIL HOLDINGS LLC,310 ALDER ROAD PO BOX 841,DOVER,DE,19904,010935824,INVESTMENTS,DE,PEPPERDINE UNIVERSITY,EXCLUDED,12374,1096081,0,0,0.99000
201811349349300206,560532138,Verger Capital Management LLC,PO Box 7354,Winston Salem,NC,27109,464037343,Asset Management,DE,Wake Forest Univ,Excluded,190504,5281889,false,false,1.00000
201811349349300206,560532138,Verger Capital Fund LLC,1834 Wake Forest Rd Starling Hall,Winston Salem,NC,27109,464027021,Endowment investing,DE,Verger Fund I,Excluded,56694125,782327064,false,2980744,false,0.62681
201811349349300206,560532138,Wake Forest Technology Development Prog,2520 Meridian Pkwy 400,Durham,NC,27713,475437596,Tech Devel.,NC,WFU Health Sciences,false,false
201811349349300206,560532138,Verger Fund II LLC,P O Box 7354,WinstonSalem,NC,27109,352514227,Endowment investing,DE,WFU Health Sciences,Excluded,false,false
201811349349300206,560532138,Wake Forest Ambulatory VTR LLC,Medical Center Blvd,WinstonSalem,NC,27157,820777206,Healthcare,NC,WFU Health Sciences,false,false
201811359349307301,593069793,Clear Creek MOB Ltd,2201 S Clear Creek Rd,Killeen,TX,76549,742609195,Real Estate,TX,N/A
201811359349307301,593069793,Endoscopy Center at Porter LLC (11-32916),1001 South Park Drive,Littleton,CO,80120,205855038,Medical Services,CO,N/A
201811359349307301,593069793,Florida Hospital DMERT LLC,500 Winderley Place Ste 324,Maitland,FL,32751,202392253,Medical Equipment,FL,N/A
201811359349307301,593069793,Florida Hospital Home Infusion LLP,500 Winderley Place Ste 324,Maitland,FL,32751,593142824,Home Infusion Services,FL,N/A
201811359349307301,593069793,Functional Neurosurgical Ambulatory Surgery Center LLC,777 S Williams St,Denver,CO,80209,464426708,Surgery Center,CO,N/A
201811359349307301,593069793,PAHSLarkin Ventures LLC,9100 E Mineral Cir,Centennial,CO,80112,474211060,Medical Services,CO,N/A
201811359349307301,593069793,PAHSUSP Surgery Centers LLC,15305 Dallas Pkwy Ste 1600 LB 28,Addison,TX,75010,263057950,Medical Services,CO,N/A
201811359349307301,593069793,San Marcos MRI LP,1330 Wonder World Dr Ste 202,San Marcos,TX,78666,770597972,Imaging & Testing,TX,N/A
201831359349300728,050258809,MR ARGENT OFFSHORE FUND CB 04 LP,900 THIRD AVENUE 11TH FLOOR,NEW YORK,NY,10022,981328058,INVESTMENTS,NY,BROWN UNIVERSIT,INVESTMENTS,-897530,29102470,0,false,0.98360
201821919349301182,464071746,ADOM PARTNERS LP,500 MADISON AVENUE,NEW YORK,NY,10022,813083288,INVESTMENTS,DE,NA
201821919349301182,464071746,ALBUS SELECT FUND LP,750 MENLO AVENUE,MENLO PARK,CA,94025,812064357,INVESTMENTS,DE,NA
201821919349301182,464071746,ARCOLA RESIDENTIAL VENTURE LLC,635 KNIGHT WAY,STANFORD,CA,943057297,900818278,INVESTMENTS,DE,NA
201821919349301182,464071746,ARCOLA VENTURE LLC,635 KNIGHT WAY,STANFORD,CA,943057297,371689632,RE DEVELOPMENT,DE,NA
201821919349301182,464071746,CANARY SC FUND LP,399 PARK AVENUE,NEW YORK,NY,10022,475662144,INVESTMENTS,DE,NA
201821919349301182,464071746,CANARY SC MASTER FUND LP,635 KNIGHT WAY,STANFORD,CA,943057297,INVESTMENTS,CJ,NA
201821919349301182,464071746,CARLSBAD CO-INVEST LP,51 JOHN F KENNEDY PARKWAY SUITE 2,SHORT HILLS,NJ,07078,471702425,INVESTMENTS,DE,NA
201821919349301182,464071746,CEE EQUITY HOLDINGS LP,ELIZABETH HOUSE 9 CASTLE ST,ST HELIER,JERSEY,JE,JE4 2QP,INVESTMENTS,JE,NA
201821919349301182,464071746,CLAIRVUE CAPITAL PARTNERS II-TE 1 LP,150 CALIFORNIA STREET STE 850,SAN FRANCISCO,CA,94111,800909516,INVESTMENTS,DE,NA
201821919349301182,464071746,CLAIRVUE CAPITAL PARTNERS II-TE 2 LP,150 CALIFORNIA STREET STE 850,SAN FRANCISCO,CA,94111,800909556,INVESTMENTS,DE,NA
201821919349301182,464071746,ENERGY CAPITAL PARTNERS III (SENDERO CO-,51 JOHN F KENNEDY PARKWAY SUITE 2,SHORT HILLS,NJ,07078,471702425,INVESTMENTS,DE,NA
201821919349301182,464071746,EUCALIPTO FUND LTD,635 KNIGHT WAY,STANFORD,CA,943057297,INVESTMENTS,CJ,NA
201821919349301182,464071746,EZP OPPORTUNITY LP,635 KNIGHT WAY,STANFORD,CA,943057297,INVESTMENTS,DE,NA
201821919349301182,464071746,FORTRESS IW COINVESTMENT (FUND B) LP,1345 AVE OF THE AMERICAS 45TH FL,NEW YORK,NY,10105,980509639,INVESTMENTS,CJ,NA
201821919349301182,464071746,FOUR CROSSINGS INSTITUTIONAL PARTNERS V,635 KNIGHT WAY,STANFORD,CA,943057297,943106323,INVESTMENTS,DE,NA
201821919349301182,464071746,FOXLANE LP,635 KNIGHT WAY,STANFORD,CA,943057297,813314647,INVESTMENTS,DE,NA
201821919349301182,464071746,HHBG-II INVESTMENT LP,635 KNIGHT WAY,STANFORD,CA,943057297,INVESTMENTS,DE,NA
201821919349301182,464071746,KEB INVESTORS II LP,WASHINGTON MALL STE 304 7 REID ST,HAMILTON,HM 11,BD,941156365,INVESTMENTS,BD,NA
201821919349301182,464071746,LSF V DHB HOLDINGS LP,2711 N HASKELL AVE STE 1700,DALLAS,TX,75204,272858604,INVESTMENTS,DE,NA
201821919349301182,464071746,OUTLAWS CASINO LTD,3160 PORTER DR,PALO ALTO,CA,94304,841457498,HOLDING COMPANY,CO,NA
201821919349301182,464071746,PALO ALTO LP,13 CASTLE STREET,ST HELIER JERSEY,JE,981126622,INVESTMENTS,JE,NA
201821919349301182,464071746,PROJECT EDISON PARTNERS FUND LP,55 E 52ND ST,NEW YORK,NY,10055,473184706,INVESTMENTS,DE,NA
201821919349301182,464071746,RMS FOREST GROWTH II LP,30 INVERNESS CENTER PARKWAY STE 36,BIRMINGHAM,AL,35242,200841908,INVESTMENTS,CA,NA
201821919349301182,464071746,SANDPIPER FUND LP,2000 MCKINNEY AVE STE 2125,DALLAS,TX,75201,260341626,INVESTMENT,TX,NA
201821919349301182,464071746,SAROFIM MULTIFAMILY PARTNERS LP,8115 PRESTON RD ST400,DALLAS,TX,75225,201929002,RE DEVELOPMENT,TX,NA
201821919349301182,464071746,SCP REAL ASSETS FUND (A) LP,2498 SAND HILL RD,MENLO PARK,CA,94025,203949682,INVESTMENTS,DE,NA
201821919349301182,464071746,SEQUOIA MFM OPERATING COMPANY LLC,770 WELCH ROAD LPCH- ADMIN MC5551,PALO ALTO,CA,94304,475060529,MFM PROGRAM,CA,NA
201821919349301182,464071746,SIC SNOWCREEK VIII LLC,635 KNIGHT WAY,STANFORD,CA,94305,275431605,RE DEVELOPMENT,CA,NA
201821919349301182,464071746,SP SMC PARTNERS LLC,2711 CENTERVILLE RD STE 400,WILMINGTON,DE,19808,473103791,INVESTMENTS,DE,NA
201821919349301182,464071746,STANFORD EMANUEL RAD ONCOLOGY CENTER,825 DELBON AV,TURLOCK,CA,95382,208885091,RADIOLOGY,CA,NA
201821919349301182,464071746,STANFORD PET-CT LLC,300 PASTEUR DR MC 5555,STANFORD,CA,94305,611423414,MED. DIAGNOST,CA,NA
201821919349301182,464071746,STANFORD-STARTX FUND LLC,3145 PORTER DR,PALO ALTO,CA,94304,464297719,INVESTMENTS,DE,NA
201821919349301182,464071746,SUMIT HOLDING INTERNATIONAL LLC,1400 PAGE MILL ROAD MC5713,PALO ALTO,CA,94304,263934706,HOLDING COMPANY,DE,NA
201821919349301182,464071746,VEDA INVESTORS FUND LP,ONE FAWCETT PL,GREENWICH,CT,06830,811810345,INVESTMETNS,DE,NA
201821919349301182,464071746,VERMILION PEAK MASTER FUND,635 KNIGHT WAY,STANFORD,CA,943057297,INVESTMENTS,DE,NA
201821919349301182,464071746,WOLFF REAL ESTATE PARTNERS III A LP,635 KNIGHT WAY,STANFORD,CA,943057297,474780701,INVESTMENTS,DE,NA
201832119349300248,541744996,OLD DOMINION UNIV REAL ESTATE FOUNDATION TRI-CITIES CENTER PROJECT II LLC,4417 MONARCH WAY 4TH FLOOR,NORFOLK,VA,23529,134352381,TO ASSIST THE UNIVERSITY IN DEVELOPING TRI-CITIES CENTER HIGHER ED FACILITY,VA,OLD DOMINION REAL ESTATE FOUNDATION,RELATED,1,0,0.99900
201831279349300403,231433899,NEW CHURCH INVESTMENT FUND,PO BOX 711 PITCAIRN HALL,BRYN ATHYN,PA,19009,236438575,INVESTMENT MANAGER,PA,N/A,INVESTMENT,4971428,143161049,0,55822,1
201831359349305763,530196603,CROSSROADS 1997 LP,325 N PAUL ST,DALLAS,TX,75201,061506073,INVESTING,DE,GU,Excluded,5441,286717,false,false,0.5445
201821949349300022,900790361,SEE PART VII,201 DOWMAN,Atlanta,GA,30322,463808276,Medical Rehab,GA,EMORYHEALTHCARE,RELATED,1863387,8471254,false,0,true,0.51000
201831319349302403,113066770,SB HLTHCARE IPA LLC,PO Box 1554,STNY BRK,NY,11790,113499101,healthcare,NY,CPMP,RELATED,0,0,false,0,false,0.00000
201831349349304998,340714363,APOLLO THEATER LLC,173 W LORAIN ST,OBERLIN,OH,44074,453182023,RENTAL,OH,APOLLO THEATER HOLDINGS INC,EXCLUDED,-388660,7479152,0,1,0.98800
201801359349306295,210634501,PETROTIGER III LTD,1 HOUSTON CTR 1221 MCKINNEY SUITE,HOUSTON,TX,77010,760328789,INVESTMENT,TX,NA,EXCLUDED FROM TAX,-26719,1750628,false,-508137,false,0.99000
201801359349306295,210634501,NASSAU CAPITAL FUNDS,22 CHAMBERS STREET 4TH FLOOR,PRINCETON,NJ,08542,223344912,INVESTMENT,DE,NA,EXCLUDED FROM TAX,8247696,74782597,false,-999,false,0.95402
201801359349306295,210634501,DYNAMO BRASIL I LLC,2711 CENTERVILLE ROAD SUITE 400,WILMINGTON,DE,19808,980515400,INVESTMENT,DE,NA,EXCLUDED FROM TAX,24206004,211576374,false,false,1.00000
201801359349306295,210634501,PB INSTITUTIONAL LP,10 ST JAMES AVE STE1700,BOSTON,MA,02116,043425688,INVESTMENT,DE,NA,EXCLUDED FROM TAX,48467037,1111268343,false,4093160,false,0.97722
201801359349306295,210634501,VARDE FUND VI-A LP,8500 NORMANDALE LAKE BLVD SUITE 15,MINNEAPOLIS,MN,55437,412022693,INVESTMENT,DE,NA,EXCLUDED FROM TAX,31304933,412274621,false,1756627,false,0.89782
201801359349306295,210634501,FARALLON CAP INST PARTIII,ONE MARITIME PLAZA SUITE 2100,SAN FRANCISCO,CA,94111,943253905,INVESTMENT,DE,NA,EXCLUDED FROM TAX,8528926,639712779,false,-5764,false,0.95781
201801359349306295,210634501,WHITECREST PARTNERS LP,222 BERKELEY STREET 21ST FL,BOSTON,MA,02116,043585396,INVESTMENT,DE,NA,EXCLUDED FROM TAX,51253354,935324766,false,4793666,false,0.85555
201801359349306295,210634501,ALEXANDER STREET PARTNERS LTD,4306 PABLO OAKS COURT,JACKSONVILLE,FL,32224,593374725,INVESTMENT,FL,NA,EXCLUDED FROM TAX,23987401,441560253,false,false,0.77005
201801359349306295,210634501,LAXEY UNIVERSAL VALUE LP,1209 ORANGE STREET,WILMINGTON,DE,19801,210634501,INVESTMENT,DE,NA,EXCLUDED FROM TAX,-2486265,1837558,false,false,0.91050
201801359349306295,210634501,BPI LTD,103 S CHURCH STPO BOX 1034 GT,GR,CJ,CAYMAN ISLANDS,INVESTMENT,CJ,NA,EXCLUDED FROM TAX,72357119,847206228,false,false,1.00000
201801359349306295,210634501,PETROTIGER IV LTD,1 HOUSTON CENTER-1221 MCKINNEY 37,HOUSTON,TX,77010,760495639,INVESTMENT,TX,NA,EXCLUDED FROM TAX,-415671,1723658,false,false,0.82600
201801359349306295,210634501,PETROTIGER I LTD,1 HOUSTON CENTER 1221 MCKINNEY 3,HOUSTON,TX,77010,760230203,INVESTMENT,TX,NA,EXCLUDED FROM TAX,-1362673,18350476,false,false,0.99800
201801359349306295,210634501,FARALLON SPECIAL SITUATION PARTNERS,1 MARITIME PLAZA SUITE 2100,SAN FRANCISCO,CA,94111,943244687,INVESTMENT,CA,NA,EXCLUDED FROM TAX,3671277,3172409,false,false,0.98576
201801359349306295,210634501,GEOLOGIC RESOURCE OPPORTUNITIES FUNDLTD,c/o Goldman Sachs caymanTrustltd,Gardenia courtSte Market st,Ca,CJ,KY1-1103,investment,CJ,na,EXCLUDED FROM TAX,3124676,19187752,false,false,0.52374
201801359349306295,210634501,THE ORANGE PARTNERS FUND LTD,PO BOX 309GT UGLAND HOUSE,GRAND CAYMAN,CA,CJ,investment,CJ,NA,EXCLUDED FROM TAX,149735513,415271998,false,false,0.98310
201801359349306295,210634501,PC II-B LP,AUGUSTINE HOUSE AUSTIN FRIARS,LONDON,UK,EC2N 2HA,984330376,Investment,UK,NA,EXCLUDED FROM TAX,123869,788700,false,false,0.52360
201801359349306295,210634501,Tigris Realty Partners LP,477 MADISON AVE SUITE 320,NEW YORK,NY,10022,812932006,Investment,NY,NA,EXCLUDED FROM TAX,-144245,62933650,false,false,0.98490
201801359349306295,210634501,NW UK Regional (No2) LP,1819 WAZEE ST 2ND FL,DENVER,CO,80202,981208214,Investment,CO,NA,EXCLUDED FROM TAX,-13669,12657000,false,false,0.98701
201801359349306295,210634501,GC Venture(s) LLC,20 UNIVERSITY RD SUITE 450,CAMBRIDGE,MA,02138,814449331,Investment,MA,NA,EXCLUDED FROM TAX,0,24057731,false,false,0.59998
201801359349306295,210634501,Brait IV Fund LP,PO BOX 908 GT WALKER HOUSE,GRAND CAYMAN,CJ,980485165,Investment,CJ,NA,EXCLUDED FROM TAX,-1716890,29459428,false,false,0.52890
201831349349302698,721173156,HEART HOSPITAL OF ACADIANA LLC,1105 KALISTE SALOOM ROAD,LAFAYETTE,LA,70508,300442368,HEALTHCARE,LA,LOURDES,N/A
201831349349302698,721173156,PERKINS PLAZA IMAGING DEVELOPMENT LLC,5000 HENNESSY BOULEVARD PLAZA 2,BATON ROUGE,LA,70808,203894521,REAL ESTATE,LA,OLOL,N/A
201831349349302698,721173156,P&S SURGERY CENTER LLC,312 GRAMMONT STREET,MONROE,LA,71201,721387870,HEALTHCARE,LA,SFMC,N/A
201831349349302698,721173156,LOURDES IMAGING DEVELOPMENT LLC,4801 AMBASSADOR CAFFERY PKWY,LAFAYETTE,LA,70508,208326287,REAL ESTATE,LA,LOURDES,N/A
