object_id,ein,DsrgrddEnttyNm_BsnssNmLn1Txt,USAddrss_AddrssLn1Txt,USAddrss_CtyNm,USAddrss_SttAbbrvtnCd,USAddrss_ZIPCd,IdRltdTxExmptOrg_EIN,IdRltdTxExmptOrg_PrmryActvtsTxt,IdRltdTxExmptOrg_LglDmclSttCd,IdRltdTxExmptOrg_ExmptCdSctnTxt,IdRltdTxExmptOrg_PblcChrtySttsTxt,DrctCntrllngEnttyNm_BsnssNmLn1Txt,IdRltdTxExmptOrg_CntrlldOrgnztnInd
201841359349303859,135598093,CENTERS FOR INTERNATIONAL PROJECTS TRUST,APT 101 K-62 HAUZ KHAS ENCLAVE,NEW DELHI,IN,110016,RESEARCH,IN,N/A,N/A,CIP,true
201841359349303859,135598093,COLUMBIA GLOBAL CENTER IN INDIA,630 W 168TH STREET,NEW YORK,NY,10032,RESEARCH,IN,N/A,N/A,CGC LLC,true
201841359349303859,135598093,COLUMBIA UK FUND LTD,615 WEST 131ST STREET MC8741,NEW YORK,NY,10027,FUNDRAISING,UK,N/A,N/A,COLUMBIA,true
201841359349303859,135598093,COLUMBIA UNIVERSITY HONG KONG FUND,GPO BOX 5314,CONNAUGHT PLACE,HK,FUNDRAISING,HK,N/A,N/A,COLUMBIA,true
201841359349303859,135598093,MSPH SWAZILAND,615 WEST 131ST STREET MC8741,NEW YORK,NY,10027,HEALTHCARE,WZ,N/A,N/A,CIP,true
201841359349303859,135598093,FUNDACION COLUMBIA U GLOBAL CTR - CHILE,AVDAG HAMMASKJOLD 32691ST FL,SANTIAGO,CI,RESEARCH,CI,N/A,N/A,COLUMBIA,true
201841359349303859,135598093,INSTITUTE ON MEDICINE AS A PROFESSION,C/O 630 WEST 168TH STREET PS BOX,NEW YORK,NY,10032,331033330,HEALTHCARE,DE,501(C)(3),12C,NA,false
201841359349303859,135598093,COLUMBIA GLOBAL CENTERS INITIATIVE,615 WEST 131ST STREET MC8741,NEW YORK,NY,10027,RESEARCH,FR,N/A,N/A,COLUMBIA,true
201841359349303859,135598093,COL GLOBAL CENTER EASTERN & SOUTH AFRICA,PO BOX 51412,NAIROBI,KE,00100,RESEARCH,KE,N/A,N/A,COLUMBIA,true
201841359349303859,135598093,CU MIDDLE EAST RESEARCH CENTER,5 MOHD AL SAD AL-BATAYNEH STREET,AMMAN,JO,11814,EDUC SUPPORT,JO,N/A,N/A,COLUMBIA,true
201841359349303859,135598093,CENTER FOR INTL PROGRAMS ZIMBABWE TRUST,39 Lawson Av 42 Bates St,Harare,ZI,HLTH/RESEARCH,ZI,N/A,N/A,COLUMBIA,true
201841359349303859,135598093,ASSOC OF CLLBTV STUDIO X PRJCTS BRAZIL,RUA MARIA EUGENIA 90301,RIO DE JANEIRO,BR,22261,EDUCATION,BR,N/A,N/A,STUDIOGSAPP,true
201841359349303859,135598093,KNIGHT FIRST AMDMT INST AT COLUMBIA,615 WEST 131ST STREET MC8741,NEW YORK,NY,10027,814759386,EDU/PMT EXPR,NY,501(C)(3),12A,COLUMBIA,true
201821029349300127,350868158,SISTER MARIA PIETA SCOTT CSC SCHOLARSHIP TRUST,C/O SPRING VALLEY BANK PO BOX 830,JASPER,IN,47547,351769494,GRANT-GIVING,IN,501(c)(3),PF,NA,false
201821219349301497,410969244,Sisters of the order of saint benedict,104 Chapel Lane,Saint Joseph,MN,56374,410695523,Religious Women's Monastery,MN,501(c)(3),Line 1,N/A,0
201821219349301482,314379537,EMERSON AND EVELYN EVANS AND SONS FNDT,218 NORTH COLLEGE AVENUE,RIO GRANDE,OH,45674,311017994,SUPPORT ORG.,OH,501(c)(3),11,UNIVERSITY OF RIO GRANDE,true
201831229349300948,310820394,FILM COUNCIL OF GREATER COLUMBUS,60 CLEVELAND AVENUE,COLUMBUS,OH,43215,310881079,CURATE AND MANAGE THE COLUMBUS INTERNATIONAL FILM AND VIDEO FESTIVAL,OH,501(C)(3),LINE 10,COLUMBUS COLLEGE OF ART AND DESIGN,0
201801149349300730,231352648,SISTERS SERVANTS OF IHM,VILLA MARIA GENERALATE 1140 KING RD,IMMACULATA,PA,19345,231352569,Religious,PA,501(c)(3),02,NA,false
201801149349300730,231352648,ENSERV INC,PO BOX 665,IMMACULATA,PA,19345,232731906,WATER TREAT.,PA,501(c)(3),02,IMMACULATA,true
201821149349300702,580593414,Enotah Properties Foundation Inc,1 College St,Young Harris,GA,305820068,810811529,College Facilities (Rollins Campus Center),GA,501(c)(3),"Line 12a, I",Young Harris College,1
201830969349300733,260466209,Moravian College,1200 Main Street,Bethlehem,PA,18018,240795460,Post secondary education-private 4 year college,PA,501 (c) (3),2,N/A,0
201820899349300022,260152908,CHAPMAN UNIVERSITY,ONE UNIVERSITY DRIVE,ORANGE,CA,92866,951643992,EDUCATION,CA,501(C)(3),2,NA,false
201820899349300022,260152908,CHAPMAN UNIVERSITY FOUNDATION,ONE UNIVERSITY DRIVE,ORANGE,CA,92866,300563618,SUPPORT ORG,CA,501(C)(3),11A,NA,false
201820899349300022,260152908,IRVIN C CHAPMAN FOUNDATION,ONE UNIVERSITY DRIVE,ORANGE,CA,92866,953801337,SUPPORT ORG,CA,501(C)(3),11A,NA,false
201821159349300317,251125048,PACEM IN TERRIS INSTITUTE,9000 BABCOCK BOULEVARD,PITTSBURGH,PA,15237,251733322,PROVIDE STUDENT AID FOR HIGHER LEARNING,PA,501(c)(3),"Line 12a, I",N/A,0
201821159349300317,251125048,Congregation of Divine Providence,9000 BABCOCK BOULEVARD,pITTSBURGH,PA,15237,250965565,prOVIDE STUDENT AID FOR HIGHER LEARNING,PA,501(c)(3),"Line 12a, I",N/A,0
201821179349300822,870212470,Bill and Vieve Gore Endowment Fund,1840 South 1300 East,Salt Lake City,UT,841053617,876213067,Endowment earnings to Westminster College of Salt Lake City,UT,501(c)(3),509(a)(3)Type I,N/A,false
201821179349300822,870212470,Westminster Support Foundation Inc,595 S Riverwoods pkwy Ste 400,Logan,UT,84321,464875631,Provide financial support to Westminster,UT,501(c)(3),509(a)(3)Type I,N/A,false
201831239349300013,741109620,Village Real Property Inc,6100 Main Street,Houston,TX,77005,760353959,Real estate title holding,TX,501(c)(2),William Marsh Rice University,true
201831239349300013,741109620,Village Project Inc,6100 Main Street,Houston,TX,77005,760371337,Real estate title holding,TX,501(c)(2),William Marsh Rice University,true
201831239349300013,741109620,JTVP Corporation,6100 Main Street,Houston,TX,77005,760258573,Real estate title holding,TX,501(c)(2),William Marsh Rice University,true
201831239349300013,741109620,Village Venturers Inc,6100 Main Street,Houston,TX,77005,760258561,Real estate title holding,TX,501(c)(2),William Marsh Rice University,true
201831239349300013,741109620,Rice Land Lumber Co,6100 Main Street,Houston,TX,77005,746045400,Timber,TX,501(c)(2),William Marsh Rice University,true
201831239349300013,741109620,RU Corporation,6100 Main Street,Houston,TX,77005,746081393,Real estate title holding,TX,501(c)(2),William Marsh Rice University,true
201831239349300013,741109620,Rice Trust Inc,6100 Main Street,Houston,TX,77005,741698122,Trust company,TX,501(c)(4),William Marsh Rice University,true
201831239349300013,741109620,CCR Inc,6100 Main Street,Houston,TX,77005,383751177,Type 1 supporting organization,TX,501(c)(3),Type I,William Marsh Rice University,true
201831239349300013,741109620,HATRC,6100 Main Street,Houston,TX,77005,455431287,Type 1 supporting organization,TX,501(c)(3),Type I,William Marsh Rice University,true
201831219349301108,391467668,Herbert V Prochnow Educational Foundation,5315 Wall Street Suite 280,Madison,WI,53718,391466758,"Support the mission of the Graduate School of Banking, Inc.",WI,501(c)(3),"11A, Type 1",Graduate School of Banking Inc,1
201831209349301683,270716971,HTH LEARNING,2861 WOMBLE RD,SAN DIEGO,CA,92106,912162731,SUPPORT HTH SCHOOLS,CA,501 (C) 3,LINE 7,N/A,false
201831209349301683,270716971,HIGH TECH HIGH,2861 WOMBLE RD,SAN DIEGO,CA,92106,330866664,OPERATE SCHOOLS,CA,501 (C) 3,LINE 2,HTH LEARNING,false
201831209349301683,270716971,HIGH TECH HIGH FOUNDATION,2861 WOMBLE ROAD,SAN DIEGO,CA,92106,330866869,SUPPORT HTH SCHOOLS,CA,501 (C) 3,LINE 11A,HIGH TECH HIGH,false
201801139349301200,364570934,VOCATIONAL INSTRUCTION PROJECT COMMUNITY SERVICES INC,1910 ARTHUR AVENUE,BRONX,NY,10457,133224700,SOCIAL SERVICES AND LOW INCOME HOUSING,NY,501(C)(3),LINE 10,N/A,0
201801139349301200,364570934,1807 CLINTON HDFC,1910 ARTHUR AVENUE,BRONX,NY,10457,133795086,LOW INCOME HOUSING,NY,501(C)(3),LINE 10,VIP COMMUNITY SERVICES INC,0
201801139349301200,364570934,1870 CROTONA AVENUE HDFC,1910 ARTHUR AVENUE,BRONX,NY,10457,134124414,LOW INCOME HOUSING,NY,501(C)(3),LINE 10,VIP COMMUNITY SERVICES INC,0
201801139349301200,364570934,CASA ESPERANZA HOUSING DEVELOPMENT FUND COMPANY,1910 ARTHUR AVENUE,BRONX,NY,10457,133962366,SHELTER FOR WOMEN PREPARING FOR INDEPENDENT LIVING,NY,501(C)(3),"LINE 12A, I",VIP COMMUNITY SERVICES INC,0
201801139349301200,364570934,445 VIP HDFC,1910 ARTHUR AVENUE,BRONX,NY,10457,133680210,LOW INCOME HOUSING,NY,501(C)(3),LINE 10,VIP COMMUNITY SERVICES INC,0
201801139349301200,364570934,VIP WEST 184TH STREET HDFC,1910 ARTHUR AVENUE,BRONX,NY,10457,043754294,LOW INCOME HOUSING,NY,501(C)(3),LINE 10,VIP COMMUNITY SERVICES INC,0
201801139349301200,364570934,CASA & CLINTON HOUSING DEVELOPMENT,1910 ARTHUR AVENUE,BRONX,NY,10457,461606237,LOW INCOME HOUSING,NY,501(C)(3),LINE 10,VIP COMMUNITY SERVICES INC,0
201801139349301200,364570934,ABRAHAM APARTMENTS HDFC,1910 ARTHUR AVENUE,BRONX,NY,10457,463742490,LOW INCOME HOUSING,NY,501(C)(3),LINE 10,VIP COMMUNITY SERVICES INC,0
201801019349301010,710239383,ELROD FAMILY FOUNDATION - 71-0848708,410 OUACHITA STREET,ARKADELPHIA AR,AR,71998,710848708,TO BENEFIT OUACH. BAPTIST UNIVERSITY,AR,501(C)3,509(A)3 TYPE II,N/A,false
201801209349300815,452459482,COLUMBUS COLLEGIATE ACADEMY,1469 E MAIN ST,COLUMBUS,OH,43205,208068507,EDUCATION,OH,170(b)(1)(A)(ii),501(c)(3),NA,false
201801209349300815,452459482,UNITED SCHOOLS NETWORK,1469 E MAIN ST,COLUMBUS,OH,43205,462265149,EDUCATION,OH,170(b)(1)(A)(vi),501(c)(3),NA,false
201801209349300815,452459482,UNITED PREPARATORY ACADEMY,300 DANA AVE,COLUMBUS,OH,43223,463123354,EDUCATION,OH,170(b)(1)(A)(ii),501(c)(3),NA,false
201841359349310024,570324915,COLUMBIA COLLEGE FOUNDATION INC,1301 COLUMBIA COLLEGE DR,COLUMBIA,SC,29203,570736261,SPECIAL PROJECT FUNDRAISING TO BENEFIT COLUMBIA COLLEGE,SC,501(C)(3),LINE 7,0
201841359349310024,570324915,SC CONFERENCE - UNITED METHODIST CHURCH,4908 COLONIAL DRIVE SUITE 101,COLUMBIA,SC,29203,570327882,PROVIDES ANNUAL SUPPORT TO THE COLLEGE,SC,501(C)(3),LINE 1,0
201841359349310254,330413730,GENERAL CONFERENCE OF SDA,12501 OLD COLUMBIA PIKE,SILVER SPRINGS,MD,20904,520643036,CHURCH,MD,501(c)(3),1,false
201841359349310254,330413730,NAD OF SDA,12501 OLD COLUMBIA PIKE,SILVER SPRINGS,MD,20904,203164300,CHURCH,MD,501(c)(3),1,false
201841359349310254,330413730,PACIFIC UNION CONFERENCE OF SDA,2686 TOWNSGATE ROAD,WESTLAKE VILLAGE,CA,92505,951816033,CHURCH,CA,501(c)(3),1,false
201820939349300322,310971599,CHURCHES OF CHRIST IN CHRISTIAN UNION,1553 LANCASTER PIKE,CIRCLEVILLE,OH,45601,314443130,PROVIDES SPIRITUAL AND FINANCIAL SUPPORT TO UNIVERSITY,OH,501(C)(3),170(B)(1)(A)(I),0
201841159349301069,210634981,Conference for Mercy Higher Education,8630 Fenton Street 934,Silver Spring,MD,20190,431973007,Sponsorship,MD,501(c)(3),1,NA,false
201821029349300832,111630830,St John's Bread & Life Program Inc,795 Lexington Avenue,Brooklyn,NY,11221,113174514,Meals/SVCS,NY,501(c)(3),7,SJU NY,true
201801319349304870,133838740,TOURO COLLEGE,500 7TH AVE,NEW YORK,NY,10018,132676570,EDUCATION,NY,501 (C)(3),2,NA,false
201801319349304870,133838740,TOURO UNIVERSITY NEVADA,500 7TH AVE,NEW YORK,NY,10018,200362127,EDUCATION,NV,501 (C)(3),2,TOUROCOLLEGE,true
201801319349304870,133838740,TOURO COLLEGE AND UNIVERSITY SYSTEM INC,500 7TH AVE,NEW YORK,NY,10018,680646771,EDUCATION,NJ,501 (C)(3),2,TOUROCOLLEGE,true
201801319349304870,133838740,YESHIVAS OHR HACHAIM,500 7TH AVE,NEW YORK,NY,10018,112808947,EDUCATION,NY,501 (C)(3),2,TOUROCOLLEGE,true
201801319349304870,133838740,RABBI DOV REVEL YESHIVA OF FOREST HILLS,500 7TH AVE,NEW YORK,NY,10018,111681674,EDUCATION,NY,501 (C)(3),2,TOUROCOLLEGE,true
201801319349304870,133838740,TOURO COLLEGE FDN FOR JEWISH STUDIES,500 7TH AVE,NEW YORK,NY,10018,133639225,SUPPORT,NY,501 (C)(3),12A,TOUROCOLLEGE,true
201801319349304870,133838740,NYMC LLC,500 7TH AVE,NEW YORK,NY,10018,271481147,ASSIST TOURO,DE,501 (C)(3),12B,TOUROCOLLEGE,true
201801319349304870,133838740,NEW YORK MEDICAL COLLEGE,40 SUNSHINE COTTAGE ROAD,VALHALLA,NY,10595,131099420,EDUCATION,NY,501 (C)(3),2,NYMC LLC,true
201801319349304870,133838740,THE PARTNERSHIP FOR A HEALTHY POPULATION,40 SUNSHINE COTTAGE ROAD,VALHALLA,NY,10595,134038993,HEALTH RELATE,NY,501 (C)(3),4,TOUROCOLLEGE,true
201801319349304870,133838740,TOURO LAW CENTER DEVELOPMENT FOUNDATION,500 7TH AVE,NEW YORK,NY,10018,133922718,SUPPORT,NY,501 (C)(3),12A,TOUROCOLLEGE,true
201801319349304870,133838740,TOURO COLLEGE BERLIN GGMBH BERLIN,AM RUPERHORN 4 14055,BERLIN,GM,EDUCATIONAL,GM,501 (C)(3),TOUROCOLLEGE,true
201801319349304870,133838740,HEBREW THEOLOGICAL COLLEGE,7135 NORTH CARPENTER ROAD,SKOKIE,IL,60077,362167095,EDUCATIONAL,IL,501 (C)(3),2,TOUROCOLLEGE,true
201801319349304870,133838740,THE BIOTECHNOLOGY INCUBATOR AT NYMC INC,40 SUNSHINE COTTAGE ROAD,VALHALLA,NY,10595,471682208,INCUBATOR,NY,501 (C)(3),10,NA,false
201810759349300126,800477644,The Chicago School - California Inc,617 W 7th Street,Los Angeles,CA,90017,900394713,Education,CA,501(c)(3),Line 2,TCS Education System,0
201810759349300126,800477644,The Chicago School of Professional Psychology,325 North Wells,Chicago,IL,60654,363005527,Education,IL,501(c)(3),Line 2,The Chicago School - California Inc,0
201810759349300126,800477644,TCSPP Counseling Centers,1990 Westwood Blvd Suite 330,Los Angeles,CA,90025,952556403,Education,CA,501(c)(3),Line 2,The Chicago School - California Inc,0
201810759349300126,800477644,Pacific Oaks Education Corporation,55 Eureka Street,Pasadena,CA,91103,951716809,Education,CA,501(c)(3),Line 2,TCS Education System,0
201810759349300126,800477644,Santa Barbara & Ventura Colleges of Law,4475 Market Street,Ventura,CA,93003,952592468,Education,CA,501(c)(3),Line 2,TCS Education System,0
201810759349300126,800477644,TCS Education System,350 North Orleans Suite 1050,Chicago,IL,60654,270717860,Supporting Organization,IL,501(c)(3),"Line 12a, I",N/A,0
201810759349300126,800477644,TCS Education - Texas Inc,350 North Orleans Suite 1050,Chicago,IL,60654,364769956,Education,TX,501(c)(3),Line 2,TCS Education System,0
201810759349300126,800477644,Saybrook University,475 14th Street,Oakland,CA,94612,942155109,Education,CA,501(c)(3),Line 2,TCS Education System,0
201831139349300013,410693856,KATE L DUNWOODY TRUST,PO BOX 64713,ST PAUL,MN,55164,416014903,PERPETUAL TRUST,MN,501(C)(3),PF,DUNWOODY COLLEGE OF TECHNOLOGY,1
201831139349300523,231522643,Bernardine Sisters of the Third Order of St Francis,460 Saint Bernardine Street,Reading,PA,19607,231691743,Religious Order,PA,501(c)(3),Line 1,N/A,0
201841359349303004,741357323,UNITED STATES CATHOLIC CONFERENCE,9541 CHURCH CIRCLE DRIVE,BELLEVILLE,IL,62223,522133725,CHURCH OPERATIONS,IL,501(C)(3),0
201810449349300436,610444825,Bingham Fund for Excellence in Teaching at Transylvania University,300 N Broadway,Lexington,KY,40508,611129707,Promote excellence in teaching,KY,501(c)(3),509(a)(2),Transylvania University
201811139349300801,240795445,BEN FRANKLIN TECHNOLOGY PARTNERS NE PA,116 RESEARCH DRIVE,BETHLEHEM,PA,18015,232517422,ECONOMIC DEV,PA,501(C)(3),7,NA,true
201811139349300801,240795445,MANUFACTURERS RESOURCE CENTER,961 MARCON BLVD SUITE 200,ALLENTOWN,PA,18109,232514764,ECONOMIC DEV,PA,501(C)(3),7,NA,true
201811139349300801,240795445,LEHIGH & NORTHAMPTON CNTIES REVOLV LOAN,621 TAYLOR STREET RAUCH BUSINESS CT,BETHLEHEM,PA,18015,232461494,ECONOMIC DEV,PA,501(C)(4),N/A,NA,true
201811139349300801,240795445,LEHIGH UNIVERSITY ALUMNI ASSOCIATION,27 MEMORIAL DRIVE WEST,BETHLEHEM,PA,18015,240796860,ALUMNI RELAT,PA,501(C)(3),"12c, III FI",NA,true
201821139349300632,381308480,THE WALSH COLLEGE FOUNDATION,3838 LIVERNOIS,TROY,MI,480077006,200664128,RAISE FUNDS FOR SCHOLARSHIPS AND GENERAL SUPPORT OF WALSH COLLEGE,MI,501(C)(3),7,WALSH COLLEGE,1
201831169349300418,510413351,American College Dublin,2 merrion square,dublin,EI,University providing education,EI,501(c)(3),Line 2,1
201801299349300645,150532082,CORNELL CENTER OF NEW YORK,6 EAST 44TH ST,NEW YORK,NY,10017,161301416,SOCIAL CLUB,NY,501(c)(7),9,CORNELL UNIV,true
201801299349300645,150532082,MRSI MANAGEMENT INC,575 LEXINGTON AVE,NEW YORK,NY,10022,133366821,MEDICAL SERV,NY,501(c)(3),12d TYPEIII,CORNELL UNIV,true
201801299349300645,150532082,CORNELL REAL PROPERTY SERVICES INC,15 THORNWOOD DR,ITHACA,NY,14850,161450535,PROPERTY SERV,NY,501(c)(3),12d TYPEIII,CORNELL UNIV,true
201801299349300645,150532082,CORNELL RESEARCH FOUNDATION INC,CORNELL UNIV DAY HALL,ITHACA,NY,14850,166050703,HOLDS IP PROP,NY,501(c)(2),9,CORNELL UNIV,true
201801299349300645,150532082,SAMUEL CURTIS JOHNSON FOUNDATION,130 SENECA PLACE,ITHACA,NY,14850,222572815,SUPPORT ORG,NY,501(c)(3),12c TYPEIII,CORNELL UNIV,true
201801299349300645,150532082,CORNELL UNIVERSITY FOUNDATION,130 SENECA PLACE,ITHACA,NY,14850,222848738,SUPPORT ORG,NY,501(c)(3),12a TYPE I,CORNELL UNIV,true
201801299349300645,150532082,ROBERT J MIN MD PC,575 LEXINGTON AVE,NEW YORK,NY,10022,133366820,MEDICAL SERV,NY,501(c)(3),9,CORNELL UNIV,true
201801299349300645,150532082,THE FRNDS OF THE CORNELL LAB OF ORN INC,1209 ORANGE ST,WILMINGTON,DE,19801,461979945,SUPPORT ORG,DE,501(c)(3),12a TYPE I,CORNELL UNIV,true
201801299349300645,150532082,NY WEILL CORNELL MEDICAL CTR FUND INC,575 LEXINGTON AVENUE SUITE 9TH FL,NEW YORK,NY,10022,136094042,SUPPORT ORG,NY,501(C)(3),12A TYPE I,CORNELL UNIV,true
201801299349300645,150532082,CORNELL MEDICAL BENEFITS TRUST,10 S DEARBORN IL1-0117,CHICAGO,IL,60603,161457001,SUPPORT ORG,IL,501(C)(3),12A TYPE I,CORNELL UNIV,true
201801319349302455,250965591,UNIVERSITY OF PITTSBURGH AND UPMC MEDICAL AND HEALTH SCIENCES FOUNDATION,3600 FORBES AVE SUITE 8084 FORBES T,PITTSBURGH,PA,15213,113708851,TO INTEGRATE FUNDRAISING FOR THE UNIVERSITY OF PITTSBURGH AND UPMC,PA,501(C)(3),12A,0
201801319349302455,250965591,BRADFORD EDUCATIONAL FOUNDATION,300 CAMPUS DRIVE,BRADFORD,PA,16701,251399653,TO SUPPORT THE UNIVERSITY OF PITTSBURGH AT BRADFORD,PA,501(C)(3),12C,0
201801319349302455,250965591,JOHNSTOWN EDUCATIONAL FOUNDATION,UPJ266 BLACKINGTON HALL,JOHNSTOWN,PA,15904,251513720,TO SUPPORT THE UNIVERSITY OF PITTSBURGH AT JOHNSTOWN,PA,501(C)(3),12C,UNIVERSITY OF PITTSBURGH,1
201801319349302455,250965591,EYE AND EAR FOUNDATION,BIOMEDICAL SCIENCES TOWER 203 LOTHR,PITTSBURGH,PA,15213,251439732,ADVANCE EFFORTS OF OTOLARYNGOLOGY AND OPTHALMOLOGY DEPARTMENTS,PA,501(C)(3),12C,0
201801319349302455,250965591,UNIVERSITY OF PITTSBURGH TRUST,5TH AVE AND BIGELOW,PITTSBURGH,PA,15260,251465279,OVERSIGHT OF CERTAIN UNIVERSITY AFFILIATED ENTITIES AND ASSETS,PA,501(C)(3),12C,UNIVERSITY OF PITTSBURGH,1
201801319349302455,250965591,UNIVERSITY DENTAL HEALTH SERVICES,3501 TERRACE STREET,PITTSBURGH,PA,15261,251762396,TO PROVIDE TEACHING AND PATIENT CARE IN A TEACHING AND RESEARCH SETTING,PA,501(C)(3),3,UNIVERSITY OF PITTSBURGH,1
201801319349302455,250965591,PITTSBURGH SKIN & CANCER FOUNDATION,190 LOTHROP STREET STE 145,PITTSBURGH,PA,15213,250965472,"SUPPORT OF PROGRAMS, RESEARCH, AND EDUCATION WITHIN DERMATOLOGY",PA,501(C)(3),7,UNIVERSITY OF PITTSBURGH,1
201801319349302455,250965591,PITTSBURGH TISSUE ENGINEERING INITIATIVE INC,100 TECHNOLOGY DRIVE NO 200,PITTSBURGH,PA,15219,251789285,FOSTER RESEARCH PERTAINING TO TISSUE ENGINEERING,PA,501(C)(3),12A,1
201801319349302455,250965591,MPC CORPORATION,5000 FORBES AVENUE,PITTSBURGH,PA,15213,251128244,RESEARCH ACTIVITIES TO AID EDUCATIONAL AND ECONOMIC DEVELOPMENT IN PA,PA,501(C)(3),12A,1
201801319349302455,250965591,UPMC,600 GRANT STREET 58TH FLOOR,PITTSBURGH,PA,15219,251423657,"SUPPORTING SUBSIDIARIES HEALTHCARE, EDUCATION, AND RESEARCH PROGRAMS",PA,501(C)(3),12C,0
201801319349302455,250965591,DIETRICH FOUNDATION,600 GRANT STREET NO 5360,PITTSBURGH,PA,15219,364711746,TO BENEFIT HIGHER EDUCATION AND OTHER CHARITABLE PURPOSES.,PA,501(C)(3),12A,0
201821139349300807,231365954,SANDIA FOUNDATION,6211 SAN MATEO BLVD NE SUITE 100,ALBUQUERQUE,NM,87109,856009907,FOUNDATION,NM,501(C)(3),"LINE 12D, III-O",N/A,0
201841369349300249,141340095,RENSSELAER HARTFORD GRADUATE CENTER INC,275 WINDSOR STREET,HARTFORD,CT,06120,060766747,GRADUATE INSTRUCTION,CT,501(c)(3),170-b(1)(A)ii,NA,false
201801299349302485,350845258,INDEPENDENT COLLEGES OF INDIANA,30 SOUTH MERIDIAN STREET,INDIANAPOLIS,IN,46204,310901001,EDUCATION,IN,501 (C) (3),12A,NA,false
201841359349302244,475271468,THE JOHNSON FOUNDATION INC,7900 JOHNSON DRIVE,KNOXVILLE,TN,37998,581767548,PROVIDES CHARITABLE GRANTS TO JOHNSON UNIVERSITY,TN,501(C)(3),OTHER TAXABLE PF,N/A,0
201841359349305574,640364542,SOUTHEASTERN BAPTIST COLLEGE FOUNDATION INC,155 ARROWHEAD TRAIL,BRANDON,MS,39047,640624699,FOUNDATION FOR SCHOOL,MS,501(C)(3),170(B)(1)(A)(IV),0
201841359349300329,150543659,Beacon Institute for Rivers and Estuaries,199 Main Street,Beacon,NY,12508,141883215,Environmental Education,NY,501(c)(3),170(b)(1)(A)(vi),N/A,1
201841359349300144,221529785,sisters of charity of saint elizabeth,Po Box 476,convent station,NJ,07961,221487343,church,NJ,501(c)(3),Line 1,N/A,0
201831079349301603,741109661,Incarnate Word High School,727 East Hildebrand,San Antonio,TX,78212,742864481,Secondary Ed.,TX,501(c)(3),2,CCVI,false
201831079349301603,741109661,St Anthony Catholic High School,3200 McCullough Ave,San Antonio,TX,78212,200234338,Secondary Ed.,TX,501(c)(3),2,UIW,true
201831079349301603,741109661,Congregation of the Sisters of Charity,4503 Broadway,San Antonio,TX,78209,741676917,Religious Ord,TX,501(c)(3),1,NA,false
201831079349301603,741109661,Incarnate Word Education Foundation,4301 Broadway,San Antonio,TX,78209,271891305,Support Org.,TX,501(c)(3),12A-TYPE I,UIW,true
201831079349301603,741109661,UIW International Inc,4301 Broadway,San Antonio,TX,78209,743012580,Support Org.,TX,501(c)(3),12A-Type I,UIW,true
201831079349301603,741109661,Universidad Liceo Cervantino,Carretera Panamericana 6553,Irapuato,MX,Education,MX,501(C)(3),2,UIW Int'l,false
201831079349301603,741109661,Texas Institute for Graduate Medical Ed,4301 Broadway CPO 315,San Antonio,TX,78209,811424767,Support Org.,TX,501(c)(3),7,UIW,true
201801299349302860,560543261,MONTREAT COLLEGE FOUNDATION,PO BOX 1267,MONTREAT,NC,28757,561324199,TO SUPPORT THE EDUCATIONAL PURPOSE OF MONTREAT COLLEGE,NC,501(C)(3),"11, TYPE II",MONTREAT COLLEGE,1
201801299349301500,570314404,Newberry College Foundation Inc,2100 College Street,Newberry,SC,29108,576026382,To support the mission of the College,SC,501(c)(3),"Line 12a, I",Newberry College,0
201841359349301234,720423889,TULANE MURPHY FOUNDATION,1030 AUDUBON STREET,NEW ORLEANS,LA,70118,237113317,TO SUPPORT THE EDUCATIONAL MISSION OF TULANE UNIVERSITY,LA,501 (c) (3),N/A,0
201841359349301234,720423889,THE TULANE LAW REVIEW ASSOCIATION,6823 ST CHARLES AVENUE,NEW ORLEANS,LA,70118,PUBLISHING LAW REVIEW,LA,501 (c) (3),N/A,0
201841359349301234,720423889,SAMUEL Z STONE CIPR SUPPORT TRUST,1330 BOYLSTON STREET,C/O SAMET AND COMPANY,BOSTON,MA,02110,206070361,TO SUPPORT TULANE PROGRAMS AND RESEARCH,LA,501 (c) (3),N/A,0
201841359349301234,720423889,HENDERSON EDUCATION FUND FBO TULANE UNIV,c/o JP MORGAN CHASE NA,PO BOX 303,MILWAUKEE,WI,53201,726017995,SUPPORT MISSION OF TULANE UNIVERSITY,LA,4947 (a)(1),N/A,0
201811039349300741,231657958,SISTERS OF ST FRANCIS OF PHILADELPHIA,609 S Convent Road,Aston,PA,19014,CONGREGATION OF CATHOLIC WOMEN RELIGIOUS,PA,501(c)(3),Line 1,N/A,0
201821349349302552,741233796,Southwestern Foundation,1001 East University Avenue,Georgetown,TX,78626,742736740,Property,TX,501(c)(3),12-I,SU,true
201801069349301410,770342669,Lincoln Law School of San Jose Endowment Foundation,384 S 2nd Street,San JOse,CA,951132711,821158391,support Lincoln Law School of San Jose,CA,501(c)(3),Line 10,None,0
201841209349301159,060646587,CONNECTICUT COLLEGE COMMUNITY RADIO INC,270 MOHEGAN AVENUE BOX 5256,NEW LONDON,CT,06320,260117596,RADIO STATION,CT,501(c)(3),7,NA,true
201841209349301159,060646587,OAKLEAF ENDOWMENT TRUST FOR CT COLLEGE,1800 IDS CENTER,MINNEAPOLIS,MN,55402,416429969,TRUST,MN,501(c)(3),12A,NA,true
201841209349301159,060646587,CONNECTICUT COLLEGE EMPOYER-CONTRIBUTION,270 Mohegan Avenue,New London,CT,06320,047025787,VEBA,CT,501(c)(9),NA,true
201841209349301159,060646587,ASSOCIATED KYOTO PROGRAM,173 WEST LORAIN AVE,OBERLIN,OH,44074,042996114,EDUCATION,OH,501(c)(9),12(c),NA,false
201841209349301159,060646587,PHI BETA KAPPA,270 MOHEGAN AVENUE,NEW LONDON,CT,06320,066103682,HONOR SOCIETY,CT,501(c)(3),7,NA,false
201831079349300123,710236897,Hendrix Murphy Foundation,1600 Washington Avenue,Conway,AR,72032,710534984,Provide for support of language and literature at Hendrix College,AR,501(c)3,11,N/A
201831079349300123,710236897,Warrior Booster Club,1600 Washington Avenue,Conway,AR,72032,710633030,Fundraising for Intercollegiate Athletics,AR,501(c)3,11,N/A
201841089349300119,621504678,TEMPLE BAPTIST CHURCH,1700 WEST BEAVER CREEK DRIVE,POWELL,TN,37849,620844405,A CHURCH,TN,501(C)(3),LINE 1,N/A,0
201841089349300119,621504678,CROWN SCHOOL OF TRADES AND TECHNOLOGY,2307 WEST BEAVER CREEK DRIVE,POWELL,TN,37849,352470212,TRADE SCHOOL,TN,501(C)(3),LINE 2,N/A,0
201821059349300117,570933257,Clemson University,108 Perimeter RD,Clemson,SC,29634,576000254,Research University,SC,170(c)(1),N/A,0
201821059349300117,570933257,Clemson University Foundation,PO Box 1889,Clemson,SC,296331889,570426335,Support missions of CU,SC,501(c)(3),Line 5,N/A,0
201821059349300117,570933257,Clemson University Land Stewardship Foundation Inc,PO Box 1889,Clemson,SC,296331889,274127041,"To receive, hold, develop, manage, or sell real estate for CU",SC,501(c)(3),"Line 12a, I",CU and CUF,0
201831179349300428,208096718,LUTHERAN THEOLOGICAL SEMINARY AT GETTYSBURG,61 SEMINARY RIDGE,GETTYSBURG,PA,17325,231365169,RELIGIOUS EDUCATIONAL INSTITUTION,PA,501(c)(3),Line 1,N/A,0
201831179349300428,208096718,THE LUTHER INSTITUTE,61 SEMINARY RIDGE,GETTYSBURG,PA,17325,521339615,EDUCATION,DC,501(c)(3),Line 7,LUTHERAN THEOLOGICAL SEMINARY AT GETTYSBURG,0
201831179349300428,208096718,SEMINARY RIDGE HISTORIC PRESERVATION FOUNDATION,61 SEMINARY RIDGE,GETTYSBURG,PA,17325,233011270,PRESERVE CIVIL WAR PROPERTIES,PA,501(c)(3),"Line 12b, II",LUTHERAN THEOLOGICAL SEMINARY AT GETTYSBURG,0
201841359349308124,471804087,Jewell Educational Fund,1050 W Bristol Rd,Flint,MI,48507,382958545,Financial,MI,501(c)(3),12 Type 1,Baker College,0
201841359349308124,471804087,Baker College,1050 W Bristol Rd,flint,MI,48507,381948719,Education,MI,501(c)(3),2,N/A,0
201841359349308124,471804087,Baker of Auburn Hills,1500 University Drive,Auburn Hills,MI,48326,383474279,School,MI,501(c)(3),2,Baker College,0
201841359349308124,471804087,Baker of Allen Park,4500 Enterprise Dr,Allen Park,MI,48101,743075712,school,MI,501(c)(3),2,Baker College,0
