object_id,ein,RltdOrgnztnNm_BsnssNmLn1Txt,USAddrss_AddrssLn1Txt,USAddrss_CtyNm,USAddrss_SttAbbrvtnCd,USAddrss_ZIPCd,IdRltdOrgTxblPrtnrshp_EIN,IdRltdOrgTxblPrtnrshp_PrmryActvtsTxt,IdRltdOrgTxblPrtnrshp_LglDmclSttCd,IdRltdOrgTxblPrtnrshp_PrdmnntIncmTxt,IdRltdOrgTxblPrtnrshp_ShrOfTtlIncmAmt,IdRltdOrgTxblPrtnrshp_DsprprtntAllctnsInd,IdRltdOrgTxblPrtnrshp_GnrlOrMngngPrtnrInd,IdRltdOrgTxblPrtnrshp_OwnrshpPct
201801309349302165,311778403,AUDUBON LAND COMPANY LLC,630 SOUTHPOINTE COURT 200,COLORADO SPRINGS,CO,80906,841513085,REAL ESTATE,CO,N/A
201801309349302165,311778403,AVON EMERGENCY AND URGENT CARE CENTER LLC,9100 E MINERAL CIRCLE,CENTENNIAL,CO,80112,811727282,HEALTHCARE SRVC,CO,N/A
201801309349302165,311778403,BAYLOR CHI ST LUKES HEALTH SERVICES LLC,6624 FANNIN ST STE 1100,HOUSTON,TX,77030,472079184,HEALTHCARE SRVC,TX,N/A
201801309349302165,311778403,BERGAN MERCY SURGERY CENTER LLC,7710 MERCY RD STE 200,OMAHA,NE,68124,208671994,AMBUL SURG CTR,NE,N/A
201801309349302165,311778403,BERYWOOD OFFICE PROPERTIES LLC,2501 CITICO AVE,CHATTANOGA,TN,37404,621875199,PHYS OFFICE,TN,N/A
201801309349302165,311778403,BLUEGRASS REGIONAL IMAGING CENTER,1218 SOUTH BRDWAY STE 310,LEXINGTON,KY,40504,611386736,DIAGNOSTIC IMAGING,KY,N/A
201801309349302165,311778403,CATHOLIC HEALTH INITIATIVES PHYSICIAN SERVICES LLC,198 INVERNESS DRIVE WEST,ENGLEWOOD,CO,80112,462945938,PRACTICE MGMT SRVC,DE,N/A
201801309349302165,311778403,CENTRAL NEBRASKA REHABILITATION SERVICES INC,3004 W FAIDLEY AVENUE,GRAND ISLAND,NE,68803,810653461,PHYSICAL THERAPY,NE,N/A
201801309349302165,311778403,CENTURA-SCA HOLDINGS LLC,569 BROOK VILLAGE STE 901,BIRMINGHAM,AL,35209,474823023,OP SURGERY CENTER,AL,N/A
201801309349302165,311778403,CHI OPERATING INVESTMENT PROGRAM LP,198 INVERNESS DRIVE WEST,ENGLEWOOD,CO,80112,470727942,INVESTMENTS,CO,N/A
201801309349302165,311778403,CHI ST LUKE'S HEALTH EMERGENCY CENTER LLC,6624 FANNIN ST STE 1100,HOUSTON,TX,77030,810743412,URGENT CARE,TX,N/A
201801309349302165,311778403,CHICAMSURG SURGERY CENTERS LLC,1A BURTON HILLS BLVD,NASHVILLE,TN,37215,465683027,SURGERY CENTER,CO,N/A
201801309349302165,311778403,CHICLARKIN VENTURES LLC,901 E MINERAL CIRCLE,CENTENNIAL,CO,80112,474210888,URGENT CARE,CO,N/A
201801309349302165,311778403,COLORADO SPRINGS CK LEASING LLC,630 SOUTHPOINTE COURT 200,COLORADO SPRINGS,CO,80906,262982714,REAL ESTATE,CO,N/A
201801309349302165,311778403,HC SL VINTAGE I LLC,18000 W SARAH LANE STE 250,BROOKFIELD,WI,53045,270453767,PROPERTY HOLDING,WI,N/A
201801309349302165,311778403,HEALTHCARE SUPPORT SERVICES,PO BOX 9804,GRAND ISLAND,NE,68802,721546196,LAUNDRY,NE,N/A
201801309349302165,311778403,HEARTLAND ONCOLOGY LLC,2337 E CRAWFORD ST,SALINA,KS,67401,464265403,ONCOLOGY,KS,N/A
201801309349302165,311778403,HIGHLINE IMAGING LLC,PO BOX 184,BRUSH PRAIRIE,WA,98606,200460005,DIAGNOSTIC IMAGING,WA,N/A
201801309349302165,311778403,LAKESIDE AMBULATORY SURGICAL CENTER LLC,17031 LAKESIDE HILLS DR,OMAHA,NE,68130,204267902,AMBUL SURG CTR,NE,N/A
201801309349302165,311778403,LAKESIDE ENDOSCOPY CENTER LLC,17001 LAKESIDE HILLS PLZ STE 201,OMAHA,NE,68130,205544496,ENDOSCOPY SRVC,NE,N/A
201801309349302165,311778403,LINCOLN CK LEASING LLC,555 SOUTH 70TH ST,LINCOLN,NE,68510,262496856,REAL ESTATE,NE,N/A
201801309349302165,311778403,NEBRASKA SPINE HOSPITAL LLC,6901 N 72ND ST,OMAHA,NE,68122,270263191,SPINE HOSPITAL,NE,N/A
201801309349302165,311778403,NORTH RIVER SURGERY CENTER LLC,2209 WILDWOOD AVE,SHERWOOD,AR,72120,710799771,AMBUL SURG CTR,AR,N/A
201801309349302165,311778403,ORTHOCOLORADO LLC,11650 WEST 2ND PLACE,LAKEWOOD,CO,80255,371577105,ORTHO HOSPITAL,CO,N/A
201801309349302165,311778403,PENINSULA RADIATION ONCOLOGY LLC,315 MLK JR WAY STE 111,TACOMA,WA,98405,870808610,HEALTHCARE SRVC,WA,N/A
201801309349302165,311778403,PENRAD IMAGING,1390 KELLY JOHNSON BLVD,COLORADO SPRINGS,CO,80920,841072619,MEDICAL IMAGING,CO,N/A
201801309349302165,311778403,PMC HOSPITAL LLC,3100 MAIN ST STE 500,HOUSTON,TX,77002,273280598,HOSPITAL,TX,N/A
201801309349302165,311778403,PRAIRIE HEALTH VENTURES LLC,421 S 9TH ST STE 102,LINCOLN,NE,68508,204962103,TECH SRVC,NE,N/A
201801309349302165,311778403,PUEBLO AMBULATORY SURGERY CENTER LLC,25 MONTEBELLO RD,PUEBLO,CO,81003,621488737,SURGERY CENTER,CO,N/A
201801309349302165,311778403,SAINT JOSEPH - PAML LLC,200 ABRAHAM FLEXNER WAY,LOUISVILLE,KY,40202,452116736,MGMT SVCS,KY,N/A
201801309349302165,311778403,SAINT JOSEPH - SCA HOLDINGS LLC,1451 HARRODSBURG RD,LEXINGTON,KY,40503,453801157,OP SURGERY,DE,N/A
201801309349302165,311778403,SAINT JOSEPH-ANC HOME CARE SERVICES,1700 EDISON DR,MILFORD,OH,45150,263330545,HOME HEALTH,KY,N/A
201801309349302165,311778403,SCA PREMIER SURGERY CENTER OF LOUISVILLE LLC,200 ABRAHAM FLEXNER WAY,LOUISVILLE,KY,40202,721386840,SURGERY CENTER,KY,N/A
201801309349302165,311778403,ST FRANCIS LAND COMPANY,5390 N ACADEMY BLVD STE 300,COLORADO SPRINGS,CO,80918,263134100,REAL ESTATE,CO,N/A
201801309349302165,311778403,ST FRANCIS MEDICAL CENTER ASSOCIATES,1717 SOUTH J ST,TACOMA,WA,98405,911352698,MED OFFICE,WA,N/A
201801309349302165,311778403,ST LUKE'S DIAGNOSTIC CATH LAB LLP,6624 FANNIN ST STE 800,HOUSTON,TX,77030,710959365,DIAGNOSTICS,TX,N/A
201801309349302165,311778403,ST LUKE'S LAKESIDE HOSPITAL LLC,6624 FANNIN STE 2505,HOUSTON,TX,77030,300427437,HOSPITAL,TX,N/A
201801309349302165,311778403,ST LUKE'S THE WOODLANDS SLEEP CENTER LLC,6624 FANNIN STE 800,HOUSTON,TX,77030,462795726,DIAGNOSTICS,TX,N/A
201801309349302165,311778403,SUPERIOR MEDICAL IMAGING LLC,5000 NORTH 26TH ST,LINCOLN,NE,68521,262884555,OP DIAGNOSTICS,NE,N/A
201801309349302165,311778403,SURGERY CENTER OF LEXINGTON LLC,200 ABRAHAM FLEXNER WAY,LOUISVILLE,KY,40202,621179539,SURGERY CENTER,DE,N/A
201801309349302165,311778403,SURGERY CENTER OF LOUISVILLE LLC,200 ABRAHAM FLEXNER WAY,LOUISVILLE,KY,40202,621179537,SURGERY CENTER,KY,N/A
201801309349302165,311778403,FRANCISCAN SPECIALITY CARE LLC,680 SOUTH FOURTH ST,LOUISVILLE,KY,40202,813725123,HEALTHCARE SRVC,WA,N/A
201801309349302165,311778403,THREE SPRING IMAGING LLC,1 MERCADO ST STE 200A,DURANGO,CO,81301,811174301,HEALTHCARE SRVC,CO,N/A
201801309349302165,311778403,HEALTHCARE SOLUTIONS NETWORK LLC,619 OAK STREET,CINCINNATI,OH,45206,472103334,PHYSICIAN HOSPITAL ORGANIZATION,OH,N/A
201841289349301584,430652675,Personal Pharmacist LLC,4588 Parkview Place,St Louis,MO,63110,384008130,Pharmaceutical and scientific community learning,MO,Related,0,0,0.50000
201811309349302511,520595110,ASTHMA CENTER LP,3910 KESWICK ROAD N4327-B,BALTIMORE,MD,21211,521542228,REAL ESTATE,MD,N/A,RELATED,-9160,87568,0,1,0.01000
201811309349302511,520595110,ASTHMA CENTER LP,3910 KESWICK ROAD N4327-B,BALTIMORE,MD,21211,521542228,REAL ESTATE,MD,N/A,RELATED,-677872,6480032,0,0,0.74000
201811309349302511,520595110,550 BROADWAY LP,3910 KESWICK ROAD N4327-B,BALTIMORE,MD,21211,521794353,N/A,MD,N/A
201811309349302511,520595110,JHMI UTILITIES LLC,3910 KESWICK ROAD N4327-B,BALTIMORE,MD,21211,521542228,UTILITIES SERVICES TO MEMBERS,MD,N/A,RELATED,2770606,169316957,0,4047,1,0.50000
201811309349302511,520595110,JOHNS HOPKINS HEALTHCARE LLC,3910 KESWICK ROAD N4327-B,BALTIMORE,MD,21211,521542228,MEDICAL SERVICES,MD,N/A,RELATED,9787555,123031810,0,1128895,1,0.50000
201811309349302511,520595110,JOHNS HOPKINS MEDICINE INTL LLC,3910 KESWICK ROAD N4327-B,BALTIMORE,MD,21211,383711488,"INTERNATIONAL HEALTH CARE, EDUCATION",MD,N/A,RELATED,1529983,52049048,0,-7865637,1,0.50000
201811309349302511,520595110,HOWARD COUNTY NEONATAL SERVICES LLC,3910 KESWICK ROAD N4327-B,BALTIMORE,MD,21211,521794353,CLINICAL SERVICES,MD,N/A,RELATED,-199891,53662,0,1,0.50000
201811309349302511,520595110,JH BROADWAY ACQUIS & DEVELOP LLC,3910 KESWICK ROAD N4327-B,BALTIMORE,MD,21211,202814243,LAND HOLDING AND DEVELOPMENT,MD,N/A,RELATED,-1786295,7907111,0,1,0.50000
201811309349302511,520595110,JOHNS HOPKINS MEDICINE ALLIANCE FOR PATIENTS LLC,3910 KESWICK ROAD N4327-B,BALTIMORE,MD,21211,521899357,MEDICAL SERVICES,MD,N/A,RELATED,0,1,0.50000
201811309349302511,520595110,JOHNS HOPKINS SURGERY CENTER SERIES LLC,3910 KESWICK ROAD N4327-B,BALTIMORE,MD,21211,522144849,CLINICAL SERVICES,MD,N/A,RELATED,225622,921548,0,1,0.50000
201811309349302511,520595110,MEDBIQUITOUS CONSORTIUM LLC,3910 KESWICK ROAD N4327-B,BALTIMORE,MD,21211,522239402,INTERNET PUBLISHING,MD,N/A,RELATED,5224,5657,0,1,0.50000
201811309349302511,520595110,NEPHROLOGY INVESTMENTS OF ABERDEEN LLC,3910 KESWICK ROAD N4327-B,BALTIMORE,MD,21211,522284576,INVESTMENT HOLDING,MD,N/A,UNRELATED,341090,314549,0,341027,1,0.60260
201811309349302511,520595110,JOHNS HOPKINS HEALTH CARE AND SURGERY CENTER DEVELOPMENT LLC,3910 KESWICK ROAD N4327-B,BALTIMORE,MD,21211,821388814,REAL ESTATE,MD,N/A,RELATED,-37,8279001,0,1,0.50000
201821299349303057,061645496,ARI 1740 FUND,N SETSON AVE STE 5500,CHICAGO,IL,60601,320472404,INVESTMENT,IL,NA,N/A,false,false
201821299349303057,061645496,DVG 1740 FUND LP,ONE FAWCETT PLACE,GREENWICH,CT,06830,800961539,INVESTMENT,CT,NA,N/A,false,false
201821299349303057,061645496,EAST MARSHALL STREET PARTNERSHIP LP,929 SOUTH HIGH STREET,WEST CHESTER,PA,19382,232902742,INVESTMENT,PA,NA,N/A,false,false
201821299349303057,061645496,FERN HILL PARTNERSHIP III LP,929 SOUTH HIGH STREET,WEST CHESTER,PA,19382,300409614,RENTAL,PA,NA,N/A,false,false
201821299349303057,061645496,FERN HILL LLC,929 SOUTH HIGH STREET,WEST CHESTER,PA,19382,233005147,RENTAL,PA,NA,N/A,false,false
201821299349303057,061645496,GALLOPAVO LP,2000 McKINNEY AVE STE 2125,DALLAS,TX,75201,464621967,INVESTMENT,TX,NA,N/A,false,false
201821299349303057,061645496,LANCASTER PET PARTNERSHIP LLP,PO BOX 4216,LANCASTER,PA,17604,233102793,MEDICAL SERVICES,PA,NA,N/A,false,false
201821299349303057,061645496,LG HEALTH COMMUNITY CARE COLLABORATIVE,555 NORTH DUKE STREET,LANCASTER,PA,17604,455542179,ACO,PA,NA,N/A,false,false
201821299349303057,061645496,LIONVILLE MED OFFICE BLDG PARTNERSHIP,929 SOUTH HIGH STREET,WEST CHESTER,PA,19383,161640799,INVESTMENT,PA,NA,N/A,false,false
201821299349303057,061645496,MRI GROUP LLP,PO BOX 4216,LANCASTER,PA,17604,331011386,MEDICAL SERVICES,PA,NA,N/A,false,false
201821299349303057,061645496,NEIGHBRHD PRES & DEV FUND LP,240 NEW YORK DR STE 1,FORT WASHINGTON,PA,19034,233037919,RENTAL,PA,NA,N/A,false,false
201821299349303057,061645496,OAKLANDS WAY MEDICAL BUILDING ASSOCIATES,929 SOUTH HIGH STREET,WEST CHESTER,PA,19382,830490251,RENTAL,PA,NA,N/A,false,false
201821299349303057,061645496,SISU CAP PRIV EQUITY FUND B,1 RED PLACE,LO,UK,W1K 6PL,INVESTMENT,UK,NA,N/A,false,false
201821299349303057,061645496,SISU CAP PRIV EQUITY FUND E,1 RED PLACE,LO,UK,W1K 6PL,INVESTMENT,UK,NA,N/A,false,false
201821299349303057,061645496,SRP INVESTORS FUND A LP,2001 ROSS AVE SUITE 2800,DALLAS,TX,75201,611748291,INVESTMENT,TX,NA,N/A,false,false
201821299349303057,061645496,JOG V C LIMITED PARTNERSHIP,2300-440 2ND AVE SW,CALGARY,AL,CA,T2P5E9,INVESTMENT,CA,NA,N/A,false,false
201821299349303057,061645496,TURK'S HEAD SURGERY CENTER LLC,915 OLD FERN HILL ROAD BLDG B,PHILADELPHIA,PA,19106,MEDICAL SERVICES,PA,NA,N/A,false,false
201821359349304307,260812968,Keystone Accountable Care Org LLC,100 North Academy Avenue MC 49-70,Danville,PA,17822,455484165,ACO,PA,N/A
201821359349304307,260812968,Lifesource Geisinger Blood Center LLC,100 North Academy Avenue MC 49-70,Danville,PA,17822,364718005,Blood Collection,PA,N/A
201821359349304307,260812968,Meridian Geisinger Health Network LLC,100 North Academy Avenue MC 49-70,Danville,PA,17822,454475297,Org Del System,NJ,N/A
201821359349304307,260812968,Healthsouth GHS LLC,100 North Academy Avenue MC 49-70,Danville,PA,17822,721398803,Phy Therapy,PA,N/A
201821359349304307,260812968,Evangelical-Geisinger Health LLC,100 North Academy Avenue MC 49-70,Danville,PA,17822,460567687,Healthcare,PA,N/A
201821359349304307,260812968,Lemed II,100 North Academy Avenue MC 49-70,Danville,PA,17822,232391766,Rental,PA,N/A
201821359349304307,260812968,Geisinger-SCA Holdings LLC,100 North Academy Avenue MC 49-70,Danville,PA,17822,461615328,Management,DE,N/A
201821359349304307,260812968,Camp Hill Ambulatory Surgery Center LLC,569 Brookwood Village Suite 901,Birmingham,AL,35209,521597478,Healthcare,PA,N/A
201821359349304307,260812968,Grandview Surgery Center Ltd,569 Brookwood Village Suite 901,Birmingham,AL,35209,521597483,Healthcare,PA,N/A
201821359349304307,260812968,Lackawanna Physicians Ambulatory Surgery Center LLC,569 Brookwood Village Suite 901,Birmingham,AL,35209,233024998,Healthcare,PA,N/A
201821359349304307,260812968,South Jersey Oncology Properties LLC,2500 English Creek Avenue,Egg Harbor Township,NJ,08234,943463625,Healthcare,NJ,N/A
201821359349304307,260812968,AtlantiCare Surgery Center LLC,2500 English Creek Avenue,Egg Harbor Township,NJ,08234,223491867,Healthcare,NJ,N/A
201821359349304307,260812968,Cooperative Health Services of Southern Jersey,1301 Atlantic Avenue,Atlantic City,NJ,08401,223619231,Wholesale Purchasing,NJ,N/A
201831269349300303,310536715,GCM GROSVENOR DAYTON INVESTMENT FUND LP,767 FIFTH AVE 14TH FLOOR,NEW YORK,NY,10153,272764289,INVESTMENTS,NY,Univ of Dayton,Excluded,3179592,23233214,false,960502,false,0.995
201831269349300303,310536715,Concord Dayton Hotel II LLC,11410 Common Oaks Drive,Raleigh,NC,27614,472197148,hotel management,OH,1414 South Patterson LLC,Unrelated,477660,2570791,false,477660,false,0.9
201831269349300303,310536715,Dayton Hotel II LLC,11410 Common Oaks Drive,Raleigh,NC,27614,472510987,real estate,OH,1414 South Patterson LLC,Unrelated,-362433,35012742,false,-362433,false,0.9
201822019349300547,900790361,SEE PART VII,201 DOWMAN,Atlanta,GA,30322,463808276,Medical Rehab,GA,EMORYHEALTHCARE,RELATED,1863387,8471254,false,0,true,0.51000
201812129349300801,541954969,MAVI CONSULTING LLC,4401 VILLAGE DRIVE,FAIRFAX,VA,22030,841669841,MANAGERIAL AND REAL ESTATE,VA,VIRGINIA INTERNATIONAL UNIVERSITY,EXCLUDED,-328116,7207625,0,1,0.70000
201821359349306377,381673400,V & V CROSSINGS LLC,7110 PLACID POINTE CT SE,CALEDONIA,MI,49416,113646887,COMMERCIAL REAL ESTATE RENTAL,MI,GRACE BIBLE COLLEGE,INVESTMENT,6735,0,0
201811319349301601,231355135,PCOM Primary Care Innovation Fund LLC,4170 City Avenue,Philadelphia,PA,19131,320505991,Investments,DE,na,n/a
201811319349301601,231355135,PCOM Fund Manager LLC,4170 City Avenue,Philadelphia,PA,19131,320505886,Investments,DE,na,n/a
201811349349304986,314379585,STUYVESANT HALL LLC,61 S SANDUSKY ST,DELAWARE,OH,43015,364713349,REAL ESTATE,OH,OWU,EXCLUDED,-92814,10407439,0,0,0.60000
201811349349304986,314379585,OWU FUND LP,61 S SANDUSKY ST,DELAWARE,OH,43015,454089884,INVESTMENTS,OH,OWU,EXCLUDED,4190221,153802541,0,953,0,0.99990
201801359349307510,262258318,CAMPUS ONE LLC,600 N HURSTBOURNE PKWY SUITE 300,LOUISVILLE,KY,40222,273900405,REAL ESTATE,KY,N/A
201811319349304631,010215213,TP PARTNERSHIP,PO BOX 770,ASHLAND,KY,41105,550648835,INVESTING,KY,NA,"EXCL. 512, 513, 514",1,44200,false,0,true,0.56022
201811949349301011,362167817,Kuramo Africa Opportunity Fund II LP,500 5th Ave 44th Fl,New York,NY,10110,Investment,NY,Northwestern University,Unrelated,-68642,2162698,false,false,0.9899
201821309349303902,112553515,SB HLTHCARE IPA LLC,PO Box 1554,STNY BRK,NY,11790,113499101,Healthcare,NY,CPMP,RELATED,0,0,false,0,false
201801359349314560,943477000,ALLIANCE FOR COMMUNITY IMPACT LLC,601 S FIGUEROA STREET 4TH FLOOR,LOS ANGELES,CA,90017,461999451,COMMUNITY DEVELOPMENT,CA,ALLIANCE FOR COLLEGE-READY PUBLIC SCHOOLS,0,1,0.99990
201811349349308086,540505990,HAMPTON CENTRE ASSOCIATES LP,222 CENTRAL PARK AVENUE STE 2100,VIRGINIA BEACH,VA,23462,541401504,COMMERICAL RENTAL REAL ESTATE,VA,ATLANTIC REAL ESTATE LLC (SMLLC OF HU),INVESTMENT,489247,0,1,0.96740
201811349349308086,540505990,27TH STREET HOTEL ASSOCIATES LLC,222 CENTRAL PARK AVENUE STE 2100,VIRGINIA BEACH,VA,23462,464270584,COMMERCIAL RENTAL REAL ESTATE,VA,HAMPTON UNIVERSITY,INVESTMENT,0,0,0.70400
201821359349309447,042103542,Amherst Inn Owner LLC,155 South Pleasant Street,Amherst,MA,01002,452737986,real estate,MA,N/A
201821359349309447,042103542,Amherst Inn Tenant LLC,155 South Pleasant Street,Amherst,MA,01002,452738046,nonresidential rental,MA,N/A
201801359349302395,311308555,ADVENT REHABILITATION LLC,607 DEWEY AVENUE SUITE 300,GRAND RAPIDS,MI,49504,383306673,REHABILITATION THERAPY SERVICES,MI,N/A
201801359349302395,311308555,BIG RUN MEDICAL OFFICE BUILDING LIMITED PARTNERSHIP,793 W STATE STREET,COLUMBUS,OH,43222,311608125,MEDICAL OFFICE BUILDING RENTAL,OH,N/A
201801359349302395,311308555,CATHERINE HORAN BUILDING ASSOCIATES LP,1221 MAIN STREET SUITE 105,HOLYOKE,MA,01040,042723429,PROPERTY MANAGEMENT,MA,N/A
201801359349302395,311308555,CENTENNIAL SURGUNIT LLC,502 CENTENNIAL BLVD SUITE 1,VOORHEES,NJ,08043,223580847,HEALTH CARE SERVICES,NJ,N/A
201801359349302395,311308555,CENTER FOR DIGESTIVE CARE LLC,5300 ELLIOTT DRIVE,YPSILANTI,MI,48197,030447062,PROVIDE GASTROINTESTINAL SERVICES,MI,N/A
201801359349302395,311308555,CENTRAL NEW JERSEY HEART SERVICES LLC,PO BOX 148,BAYONNE,NJ,07002,208525458,CARDIAC PROGRAM,NJ,N/A
201801359349302395,311308555,CLINTON IMAGING SERVICES LLC,615 VALLEY VIEW DR STE 202,MOLINE,IL,61265,412044739,MRI DIAGNOSTIC SERVICES,IA,N/A
201801359349302395,311308555,DIAGNOSTIC IMAGING OF SOUTHBURY LLC,385 MAIN STREET SOUTH,SOUTHBURY,CT,06488,061487582,IMAGING CENTER,CT,N/A
201801359349302395,311308555,FOREST PARK IMAGING LLC,1000 4TH STREET SW,MASON CITY,IA,50401,134365966,X-RAY AND MAMMOGRAPHY SERVICES,IA,N/A
201801359349302395,311308555,FRANCES WARDE MEDICAL LABORATORY,300 WEST TEXTILE ROAD,ANN ARBOR,MI,48104,382648446,LABORATORY,MI,N/A
201801359349302395,311308555,GATEWAY HEALTH PLAN LP,444 LIBERTY AVE SUITE 2100,PITTSBURGH,PA,15222,251691945,MEDICAID & MEDICARE/SPECIAL NEEDS MANAGED CARE ORGANIZATION,PA,N/A
201801359349302395,311308555,GREATER HARTFORD LITHOTRIPSY LLC,144 WOODLAND ST,HARTFORD,CT,06105,061578891,LITHOTRIPSY SERVICES,CT,N/A
201801359349302395,311308555,HAWARDEN REGIONAL HEALTH CLINICS LLC,1122 AVENUE L,HAWARDEN,IA,51023,201444339,MEDICAL CLINIC,IA,N/A
201801359349302395,311308555,IDAHO ASC HOLDINGS LLC,1055 N CURTIS ROAD,BOISE,ID,83706,364729605,HOLDING COMPANY FOR AMBULATORY SURGERY,ID,N/A
201801359349302395,311308555,INNOVATIVE HEALTH ALLIANCE OF NEW YORK LLC,14 COLUMBIA CIRCLE DRIVE,ALBANY,NY,12203,465676066,ACCOUNTABLE CARE ORGANIZATION,NY,N/A
201801359349302395,311308555,LOYOLA AMBULATORY SURGERY CENTER AT OAKBROOK LP,569 BROOKWOOD VILLAGE SUITE 901,BIRMINGHAM,AL,35209,364119522,SURGICAL SERVICES,IL,N/A
201801359349302395,311308555,MAGNETIC RESONANCE SERVICES PARTNERSHIP,1416 SIXTH STREET SW,MASON CITY,IA,50401,421328388,MRI SERVICES,IA,N/A
201801359349302395,311308555,MASON CITY AMBULATORY SURGERY CENTER LLC,990 4TH STREET SW,MASON CITY,IA,50401,201960348,SURGERY-SAME DAY,IA,N/A
201801359349302395,311308555,MCE MOB IV LIMITED PARTNERSHIP,793 W STATE STREET,COLUMBUS,OH,43222,421544707,MEDICAL OFFICE BUILDING RENTAL,OH,N/A
201801359349302395,311308555,MDRMRI TECHNICAL SERVICES LLC,5640 EAST TAFT ROAD 3770,SYRACUSE,NY,13220,161590982,MRI SERVICES,NY,N/A
201801359349302395,311308555,MEDILUCENT MOB I,793 W STATE STREET,COLUMBUS,OH,43222,204911370,MEDICAL OFFICE BUILDING RENTAL,OH,N/A
201801359349302395,311308555,MEDWORKS LLC,375 EAST CEDAR STREET,NEWINGTON,CT,06111,061490483,REHABILITATION SERVICES,CT,N/A
201801359349302395,311308555,MERCY ADVANCED MRI LLC,2525 SOUTH MICHIGAN AVE,CHICAGO,IL,60616,262116721,SUBLEASE MRI EQUIPMENT,IL,N/A
201801359349302395,311308555,MERCY HEART CTR OP SERVICES LLC,1000 4TH STREET SW,MASON CITY,IA,50401,134237594,CARDIOVASCULAR SERVICES,IA,N/A
201801359349302395,311308555,MERCYMANOR PARTNERSHIP,PO BOX 10086,TOLEDO,OH,43699,521931012,NURSING HOME,PA,N/A
201801359349302395,311308555,MERCYUSP HEALTH VENTURES LLC,15305 DALLAS PARKWAY STE 1600 LB 28,ADDISON,TX,75001,471290300,OUTPATIENT SURGERY,IA,N/A
201801359349302395,311308555,MOUNT CARMEL EAST POB III LIMITED PARTNERSHIP,793 W STATE STREET,COLUMBUS,OH,43222,311369473,MEDICAL OFFICE BUILDING RENTAL,OH,N/A
201801359349302395,311308555,NAUGATUCK VALLEY MRI LIMITED PARTNERSHIP,1389 WEST MAIN ST,WATERBURY,CT,06708,061239526,IMAGING CENTER,CT,N/A
201801359349302395,311308555,NAZARETH MEDICAL OFFICE BUILDING ASSOCIATES LP,C/O NAZARETH HOSP 2601 HOLME AVE,PHILADELPHIA,PA,19152,232388040,MEDICAL OFFICE BUILDING,PA,N/A
201801359349302395,311308555,OSWEGO HEALTH HOME CARE LLC,113 SCHUYLER STREET,FULTON,NY,13069,472463736,HOME HEALTH CARE,NY,N/A
201801359349302395,311308555,PHYSICIANS OUTPATIENT SURGERY CENTER LLC,1000 NE 56TH STREET,OAKLAND PARK,FL,33334,352325646,AMBULATORY SURGERY CENTER,FL,N/A
201801359349302395,311308555,RADISSON SJH PROPERTIES LLC,5000 CAMPUSWOOD DRIVE SUITE 100,EAST SYRACUSE,NY,13057,461892799,MEDICAL OFFICE BUILDING,NY,N/A
201801359349302395,311308555,SARMED OUTPATIENT PHARMACY LLC,999 N CURTIS RD STE 102,BOISE,ID,83706,510483218,PHARMACY,ID,N/A
201801359349302395,311308555,SIXTY FOURTH STREET LLC,2373 64TH ST STE 2200,BYRON CENTER,MI,49315,202443646,PROVIDE OUTPATIENT SURGICAL CARE,MI,N/A
201801359349302395,311308555,SJLS LLC,7650 SE 27TH ST STE 200,MERCER ISLAND,WA,98040,201796650,DIALYSIS SERVICES,NY,N/A
201801359349302395,311308555,SJV MANAGEMENT LLC,200 CENTURY PKWY STE 200E,MOUNT LAUREL,NJ,08054,202273476,RADIOLOGY,NJ,N/A
201801359349302395,311308555,SMMC MOB II LP,1201 LANGHORNE-NEWTOWN ROAD,LANGHORNE,PA,19047,364559869,INVESTMENT AND OPERATION OF A MEDICAL BUILDING,PA,N/A
201801359349302395,311308555,ST AGNES LONG-TERM INTENSIVE CARE LLP,C/O MHS ONE WEST ELM ST STE 100,CONSHOHOCKEN,PA,19428,200984882,LONG TERM INTENSIVE CARE,PA,N/A
201801359349302395,311308555,ST ALPHONSUS CALDWELL CANCER CTR LLC,3123 MEDICAL DR,CALDWELL,ID,83605,820526861,HEALTH CARE SERVICES,ID,N/A
201801359349302395,311308555,ST ANN'S MEDICAL OFFICE BLDG II LIMITED PARTNERSHIP,793 W STATE STREET,COLUMBUS,OH,43222,311603660,MEDICAL OFFICE BUILDING RENTAL,OH,N/A
201801359349302395,311308555,ST JOSEPH'S IMAGING ASSOCIATES PLLC,104 UNION AVE SUITE 905,SYRACUSE,NY,13203,161104293,RADIOLOGY SERVICES,NY,N/A
201801359349302395,311308555,ST MARY REHABILITATION HOSPITAL LLP,680 SOUTH FORTH STREET,LOUISVILLE,KY,40202,273938747,HEALTH CARE SERVICES,DE,N/A
201801359349302395,311308555,ST PETER'S AMBULATORY SURGERY CENTER LLC,1375 WASHINGTON AVENUE STE 201,ALBANY,NY,12206,460463892,OUTPATIENT SURGERY,NY,N/A
201801359349302395,311308555,TAMARACK MEDICAL CLINIC LLC,402 LAKE CASCADE PARKWAY,CASCADE,ID,83611,201637921,OUTPATIENT MEDICAL SERVICES,ID,N/A
201801359349302395,311308555,THE AMBULATORY SURGERY CENTER AT ST MARY LLC,1203 LANGHORNE-NEWTOWN ROAD,LANGHORNE,PA,19047,232871206,OUTPATIENT SURGERY,PA,N/A
201801359349302395,311308555,TRINITY HEALTH PARTNERS LLC,20555 VICTOR PARKWAY,LIVONIA,MI,48152,472798085,POPULATION HEALTH MANAGEMENT,DE,N/A
201801359349302395,311308555,WOODLAND IMAGING CENTER LLC,5301 E HURON RIVER DR,ANN ARBOR,MI,48106,760820959,RADIOLOGY/ IMAGING,MI,N/A
201831359349302378,231352635,NW gateway project,po box 3003,lancaster,PA,17604,611625128,land acquisition,PA,N/A,excluded,420,31612373,0,1,0.50000
201831349349303718,042103558,Alchemy Plan (Crusader) LP,TRAFALGAR COURT,LES BANQUES,GK,GY1 3QL,900401997,Investing,GK,NA,Excluded,-83071,3497142,true,0,false,0.99500
201801979349301170,941156365,ADOM PARTNERS LP,500 MADISON AVENUE,NEW YORK,NY,10022,813083288,INVESTMENTS,DE,STANFORD,EXCLUDED,0,294050786,false,0,false,1.00000
201801979349301170,941156365,ALBUS SELECT FUND LP,750 MENLO AVENUE,MENLO PARK,CA,94025,812064357,INVESTMENTS,DE,STANFORD,EXCLUDED,0,226237526,false,0,false,1.00000
201801979349301170,941156365,ARCOLA RESIDENTIAL VENTURE LLC,635 KNIGHT WAY,STANFORD,CA,943057297,900818278,INVESTMENTS,DE,STANFORD,EXCLUDED,0,0,false,0,false,1.00000
201801979349301170,941156365,ARCOLA VENTURE LLC,635 KNIGHT WAY,STANFORD,CA,943057297,371689632,RE DEVELOPMENT,DE,STANFORD,EXCLUDED,0,57178912,false,0,false,0.88750
201801979349301170,941156365,CANARY SC FUND LP,399 PARK AVENUE,NEW YORK,NY,10022,475662144,INVESTMENTS,DE,STANFORD,EXCLUDED,-527997,22397884,false,0,false,1.00000
201801979349301170,941156365,CANARY SC MASTER FUND LP,635 KNIGHT WAY,STANFORD,CA,943057297,INVESTMENTS,CJ,CANARY SC FUND,0,0,false,0,false
201801979349301170,941156365,CARLSBAD CO-INVEST LP,51 JOHN F KENNEDY PARKWAY SUITE 2,SHORT HILLS,NJ,07078,471702425,INVESTMENTS,DE,STANFORD,EXCLUDED,-21855,339542,false,-18983,false,0.63690
201801979349301170,941156365,CEE EQUITY HOLDINGS LP,ELIZABETH HOUSE 9 CASTLE ST,ST HELIER,JERSEY,JE,JE4 2QP,INVESTMENTS,JE,STANFORD,EXCLUDED,163035,89963,false,0,false,1.00000
201801979349301170,941156365,CLAIRVUE CAPITAL PARTNERS II-TE 1 LP,150 CALIFORNIA STREET STE 850,SAN FRANCISCO,CA,94111,800909516,INVESTMENTS,DE,STANFORD,EXCLUDED,303108,5414395,false,0,false,0.98620
201801979349301170,941156365,CLAIRVUE CAPITAL PARTNERS II-TE 2 LP,150 CALIFORNIA STREET STE 850,SAN FRANCISCO,CA,94111,800909556,INVESTMENTS,DE,STANFORD,EXCLUDED,61459,1080686,false,0,false,0.66660
201801979349301170,941156365,EUCALIPTO FUND LTD,635 KNIGHT WAY,STANFORD,CA,943057297,INVESTMENTS,CJ,SBFF LTD,0,0,false,0,false
201801979349301170,941156365,EZP OPPORTUNITY LP,635 KNIGHT WAY,STANFORD,CA,943057297,INVESTMENTS,DE,STANFORD,EXCLUDED,0,10631983,false,0,false,0.99100
201801979349301170,941156365,FORTRESS IW COINVESTMENT (FUND B) LP,1345 AVE OF THE AMERICAS 45TH FL,NEW YORK,NY,10105,980509639,INVESTMENTS,CJ,STANFORD,EXCLUDED,0,1,false,0,false,0.71640
201801979349301170,941156365,FOUR CROSSINGS INSTITUTIONAL PARTNERS V,635 KNIGHT WAY,STANFORD,CA,943057297,943106323,INVESTMENTS,DE,STANFORD,EXCLUDED,0,479168624,false,0,false,0.97800
201801979349301170,941156365,FOXLANE LP,635 KNIGHT WAY,STANFORD,CA,943057297,813314647,INVESTMENTS,DE,STANFORD,EXCLUDED,0,264333558,false,0,false,0.97500
201801979349301170,941156365,HHBG-II Investment LP,635 KNIGHT WAY,STANFORD,CA,943057297,INVESTMENTS,DE,STANFORD,EXCLUDED,0,132708433,false,0,false,0.75000
201801979349301170,941156365,KEB INVESTORS II LP,WASHINGTON MALL STE 304 7 REID ST,HAMILTON,HM 11,BD,941156365,INVESTMENTS,BD,STANFORD,EXCLUDED,1557189,366860,false,0,false,0.63820
