object_id,ein,RltdOrgnztnNm_BsnssNmLn1Txt,USAddrss_AddrssLn1Txt,USAddrss_CtyNm,USAddrss_SttAbbrvtnCd,USAddrss_ZIPCd,IdRltdOrgTxblPrtnrshp_EIN,IdRltdOrgTxblPrtnrshp_PrmryActvtsTxt,IdRltdOrgTxblPrtnrshp_LglDmclSttCd,IdRltdOrgTxblPrtnrshp_PrdmnntIncmTxt,IdRltdOrgTxblPrtnrshp_ShrOfTtlIncmAmt,IdRltdOrgTxblPrtnrshp_DsprprtntAllctnsInd,IdRltdOrgTxblPrtnrshp_GnrlOrMngngPrtnrInd,IdRltdOrgTxblPrtnrshp_OwnrshpPct
201713199349300126,550753754,Women and Children's Medical Office Building Partnership,PO Box 1547,Charleston,WV,253261547,550669065,Medical Office Building,WV,N/A,N/A,0,0
201713199349300126,550753754,General Division Medical Office Building Partnership,PO Box 1547,Charleston,WV,253261547,550623949,Medical Office Building,WV,N/A,N/A,0,0
201733189349311103,421351526,ADVANCED IMAGING CENTER LLC,615 VALLEY VIEW DRIVE,MOLINE,IL,61265,364356301,DIAGNOSTIC RADIOLOGY CENTER,IA,N/A
201733189349311103,421351526,ALLEN MEMORIAL HOSPITAL ORTHOPEDIC CO-MANAGEMENT CO LLC,1825 LOGAN AVE,WATERLOO,IA,50703,453237125,ORTHOPEDIC MANAGEMENT & ADMINISTRATIVE SERVICES,IA,N/A
201733189349311103,421351526,CENTRAL IOWA CARDIOVASCULAR CO-MANAGEMENT CO LLC,1200 PLEASANT ST,DES MOINES,IA,50309,273625869,CARDIOVASCULAR MANAGEMENT & ADMINISTRATIVE SERVICES,IA,N/A
201733189349311103,421351526,CENTRAL IOWA ONCOLOGY CO-MANAGEMENT COMPANY,1200 PLEASANT STREET,DES MOINES,IA,50309,453017991,ONCOLOGY MANAGEMENT & ADMINISTRATIVE SERVICES,IA,N/A
201733189349311103,421351526,CENTRAL IOWA SURGICAL SERVICES CO-MANAGEMENT CO LLC,1200 PLEASANT ST,DES MOINES,IA,50309,471608704,SURGICAL MANAGEMENT & ADMINISTRATIVE SERVICES,IA,N/A
201733189349311103,421351526,DUBUQUE ENDOSCOPY CENTER LC,1515 DELHI STREET SUITE 500,DUBUQUE,IA,52001,201597161,AMBULATORY SURGERY CENTER,IA,N/A
201733189349311103,421351526,ENSEVA - HIAWATHA LLC,755 METZGER DRIVE,HIAWATHA,IA,52233,453437363,COLLOCATION FACILITY,IA,N/A
201733189349311103,421351526,FINLEY DEPT OF SURGERY CO-MGMT CO LLC,350 N GRANDVIEW AVE,DUBUQUE,IA,52001,422808785,SURGERY DEPARTMENT MANAGEMENT SERVICES,IA,N/A
201733189349311103,421351526,HEALTH CARE AFFILIATES OF THE TRI-STATES LLC,350 N GRANDVIEW AVE,DUBUQUE,IA,52001,421428503,PROVIDE ACCESS TO LICENSED SOFTWARE,IA,N/A
201733189349311103,421351526,IOWA DIAGNOSTIC IMAGING AND PROCEDURE CENTER LC,1200 PLEASANT STREET,DES MOINES,IA,50309,030482623,OUTPATIENT DIAGNOSTIC IMAGING,IA,N/A
201733189349311103,421351526,IOWA HEALTH SYSTEM CONTRACTING SERVICES LC,1776 WEST LAKES PKWY 400,WEST DES MOINES,IA,50266,421511142,GROUP PURCHASING,IA,N/A
201733189349311103,421351526,LAKEVIEW SURGERY CENTER LC,1200 PLEASANT STREET,DES MOINES,IA,50309,421516120,SURGERY CENTER,IA,N/A
201733189349311103,421351526,MERITER UW PHYSICIANS CONTRACTING COMPANY LLC,202 SOUTH PARK STREET,MADISON,WI,53715,391998819,HEALTH SERVICES,WI,N/A
201733189349311103,421351526,MISSISSIPPI VALLEY SLEEP DISORDER CENTER LC,3400 DEXTER COURT,DAVENPORT,IA,52807,421489697,MEDICAL LABORATORY SERVICES,IA,N/A
201733189349311103,421351526,MMCI ORTHOPEDIC CO-MANAGEMENT COMPANY LLC,221 NE GLEN OAK AVE,PEORIA,IL,61636,461219459,ORTHOPEDIC MANAGEMENT & ADMINISTRATIVE SERVICES,IL,N/A
201733189349311103,421351526,MMCI SURGERY CO-MANAGEMENT COMPANY LLC,221 NE GLEN OAK AVE,PEORIA,IL,61636,471323385,SURGERY MANAGEMENT & ADMINISTRATIVE SERVICES,IL,N/A
201733189349311103,421351526,MR ASSOCIATES LLP,1956 1ST AVENUE NE,CEDAR RAPIDS,IA,52402,421260463,OWN AND OPERATE MR UNIT,IA,N/A
201733189349311103,421351526,ORTHOPAEDIC OUTPATIENT SURGERY CENTER LC,1200 PLEASANT STREET,DES MOINES,IA,50309,421508092,AMBULATORY SURGERY CENTER,IA,N/A
201733189349311103,421351526,REGIONAL HEALTH PARTNERS LLC,1258 W SOUTH ST,KEWANEE,IL,61443,800899158,AMBULATORY HEALTH CLINICS,IL,N/A
201733189349311103,421351526,REHABILITATION THERAPY SERVICES LLC,416 ST MARKS CT 110,PEORIA,IL,61603,810584193,REHABILATION THERAPY,IL,N/A
201733189349311103,421351526,SLRMC CARDIOVASCULAR CO-MANAGEMENT COMPANY LLC,2720 STONE PARK BLVD,SIOUX CITY,IA,51104,455322324,CARDIOVASCULAR MANAGEMENT & ADMINISTRATIVE SERVICES,IA,N/A
201733189349311103,421351526,THE OUTPATIENT SURGERY CENTER OF CEDAR RAPIDS LLC,1075 FIRST AVENUE SE,CEDAR RAPIDS,IA,52403,721550812,AMBULATORY SURGERY CENTER.,IA,N/A
201733189349311103,421351526,TRINITY ANESTHESIOLOGY SERVICES CO-MANAGEMENT COMPANY LLC,2701 17TH STREET,ROCK ISLAND,IL,61201,300932074,ANESTHESIOLOGY SERVICE LINES ADMINISTRATIVE SERVICES,IL,N/A
201733189349311103,421351526,TRINITY ONCOLOGY SERVICES CO-MANAGEMENT COMPANY LLC,500 JOHN DEERE ROAD,MOLINE,IL,61265,900953327,ONCOLOGY MANAGEMENT SERVICES,IL,N/A
201733189349311103,421351526,UNITYPOINT AT WORK LC,1825 LOGAN AVE,WATERLOO,IA,50703,472181113,OCCUPATIONAL MEDICINE,IA,N/A
201733189349311103,421351526,UPHT-SCA HOLDINGS LLC,569 BROOKWOOD VILLAGE SUITE 901,BIRMINGHAM,AL,35209,473564984,AMBULATORY SURGERY CENTER INVESTMENT,DE,N/A
201733189349311103,421351526,WEST HOSPITAL ORTHOPEDIC CO-MANAGEMENT COMPANY LLC,1660 60TH STREET,WEST DES MOINES,IA,50266,271414600,ORTHOPEDIC SERVICE LINES MANAGEMENT,IA,N/A
201733189349311103,421351526,WEST LAKES SLEEP CENTER LLC,5950 UNIVERSITY AVENUE SUITE 2,WEST DES MOINES,IA,50266,263193923,SLEEP DISORDER DIAGNOSTIC TESTING FACILITY,IA,N/A
201723199349309337,810661056,LOMA LINDA UNIVERSITY HEALTH NETWORK LLC,11234 ANDERSON ST,LOMA LINDA,CA,92354,330807213,INACTIVE COMPANY,CA,N/A,INTEREST,0,0
201723199349309337,810661056,PHYSICIANS HOSPITAL OF MURRIETA,28062 BAXTER RD,MURRIETA,CA,92653,202859948,ACUTE CARE HOSPITAL,CA,LOMA LINDA UNIVERSITY MEDICAL CENTER,PATIENT SERVICE REVE,0,0
201713189349310926,810994377,ADVANCED IMAGING CENTER LLC,615 VALLEY VIEW DRIVE,MOLINE,IL,61265,364356301,DIAGNOSTIC RADIOLOGY CENTER,IA,N/A
201713189349310926,810994377,ALLEN MEMORIAL HOSPITAL ORTHOPEDIC CO-MANAGEMENT CO LLC,1825 LOGAN AVE,WATERLOO,IA,50703,453237125,ORTHOPEDIC MANAGEMENT & ADMINISTRATIVE SERVICES,IA,N/A
201713189349310926,810994377,CENTRAL IOWA CARDIOVASCULAR CO-MANAGEMENT CO LLC,1200 PLEASANT ST,DES MOINES,IA,50309,273625869,CARDIOVASCULAR MANAGEMENT & ADMINISTRATIVE SERVICES,IA,N/A
201713189349310926,810994377,CENTRAL IOWA ONCOLOGY CO-MANAGEMENT COMPANY,1200 PLEASANT STREET,DES MOINES,IA,50309,453017991,ONCOLOGY MANAGEMENT & ADMINISTRATIVE SERVICES,IA,N/A
201713189349310926,810994377,CENTRAL IOWA SURGICAL SERVICES CO-MANAGEMENT CO LLC,1200 PLEASANT ST,DES MOINES,IA,50309,471608704,SURGICAL MANAGEMENT & ADMINISTRATIVE SERVICES,IA,N/A
201713189349310926,810994377,DUBUQUE ENDOSCOPY CENTER LC,1515 DELHI STREET SUITE 500,DUBUQUE,IA,52001,201597161,AMBULATORY SURGERY CENTER,IA,N/A
201713189349310926,810994377,ENSEVA - HIAWATHA LLC,755 METZGER DRIVE,HIAWATHA,IA,52233,453437363,COLLOCATION FACILITY,IA,N/A
201713189349310926,810994377,FINLEY DEPT OF SURGERY CO-MGMT CO LLC,350 N GRANDVIEW AVE,DUBUQUE,IA,52001,422808785,SURGERY DEPARTMENT MANAGEMENT SERVICES,IA,N/A
201713189349310926,810994377,HEALTH CARE AFFILIATES OF THE TRI-STATES LLC,350 N GRANDVIEW AVE,DUBUQUE,IA,52001,421428503,PROVIDE ACCESS TO LICENSED SOFTWARE,IA,N/A
201713189349310926,810994377,IOWA DIAGNOSTIC IMAGING AND PROCEDURE CENTER LC,1200 PLEASANT STREET,DES MOINES,IA,50309,030482623,OUTPATIENT DIAGNOSTIC IMAGING,IA,N/A
201713189349310926,810994377,IOWA HEALTH SYSTEM CONTRACTING SERVICES LC,1776 WEST LAKES PKWY 400,WEST DES MOINES,IA,50266,421511142,GROUP PURCHASING,IA,N/A
201713189349310926,810994377,LAKEVIEW SURGERY CENTER LC,1200 PLEASANT STREET,DES MOINES,IA,50309,421516120,SURGERY CENTER,IA,N/A
201713189349310926,810994377,MERITER UW PHYSICIANS CONTRACTING COMPANY LLC,202 SOUTH PARK STREET,MADISON,WI,53715,391998819,HEALTH SERVICES,WI,N/A
201713189349310926,810994377,MISSISSIPPI VALLEY SLEEP DISORDER CENTER LC,3400 DEXTER COURT,DAVENPORT,IA,52807,421489697,MEDICAL LABORATORY SERVICES,IA,N/A
201713189349310926,810994377,MMCI ORTHOPEDIC CO-MANAGEMENT COMPANY LLC,221 NE GLEN OAK AVE,PEORIA,IL,61636,461219459,ORTHOPEDIC MANAGEMENT & ADMINISTRATIVE SERVICES,IL,N/A
201713189349310926,810994377,MMCI SURGERY CO-MANAGEMENT COMPANY LLC,221 NE GLEN OAK AVE,PEORIA,IL,61636,471323385,SURGERY MANAGEMENT & ADMINISTRATIVE SERVICES,IL,N/A
201713189349310926,810994377,MR ASSOCIATES LLP,1956 1ST AVENUE NE,CEDAR RAPIDS,IA,52402,421260463,OWN AND OPERATE MR UNIT,IA,N/A
201713189349310926,810994377,ORTHOPAEDIC OUTPATIENT SURGERY CENTER LC,1200 PLEASANT STREET,DES MOINES,IA,50309,421508092,AMBULATORY SURGERY CENTER,IA,N/A
201713189349310926,810994377,REGIONAL HEALTH PARTNERS LLC,1258 W SOUTH ST,KEWANEE,IL,61443,800899158,AMBULATORY HEALTH CLINICS,IL,N/A
201713189349310926,810994377,REHABILITATION THERAPY SERVICES LLC,416 ST MARKS CT 110,PEORIA,IL,61603,810584193,REHABILATION THERAPY,IL,N/A
201713189349310926,810994377,SLRMC CARDIOVASCULAR CO-MANAGEMENT COMPANY LLC,2720 STONE PARK BLVD,SIOUX CITY,IA,51104,455322324,CARDIOVASCULAR MANAGEMENT & ADMINISTRATIVE SERVICES,IA,N/A
201713189349310926,810994377,THE OUTPATIENT SURGERY CENTER OF CEDAR RAPIDS LLC,1075 FIRST AVENUE SE,CEDAR RAPIDS,IA,52403,721550812,AMBULATORY SURGERY CENTER.,IA,N/A
201713189349310926,810994377,TRINITY ANESTHESIOLOGY SERVICES CO-MANAGEMENT COMPANY LLC,2701 17TH STREET,ROCK ISLAND,IL,61201,300932074,ANESTHESIOLOGY SERVICE LINES ADMINISTRATIVE SERVICES,IL,N/A
201713189349310926,810994377,TRINITY ONCOLOGY SERVICES CO-MANAGEMENT COMPANY LLC,500 JOHN DEERE ROAD,MOLINE,IL,61265,900953327,ONCOLOGY MANAGEMENT SERVICES,IL,N/A
201713189349310926,810994377,UNITYPOINT AT WORK LC,1825 LOGAN AVE,WATERLOO,IA,50703,472181113,OCCUPATIONAL MEDICINE,IA,N/A
201713189349310926,810994377,UPHT-SCA HOLDINGS LLC,569 BROOKWOOD VILLAGE SUITE 901,BIRMINGHAM,AL,35209,473564984,AMBULATORY SURGERY CENTER INVESTMENT,DE,N/A
201713189349310926,810994377,WEST HOSPITAL ORTHOPEDIC CO-MANAGEMENT COMPANY LLC,1660 60TH STREET,WEST DES MOINES,IA,50266,271414600,ORTHOPEDIC SERVICE LINES MANAGEMENT,IA,N/A
201713189349310926,810994377,WEST LAKES SLEEP CENTER LLC,5950 UNIVERSITY AVENUE SUITE 2,WEST DES MOINES,IA,50266,263193923,SLEEP DISORDER DIAGNOSTIC TESTING FACILITY,IA,N/A
201723199349317422,956137481,LL Nunn LLC,HC 72 Box 45001,Dyer,NV,89010,770493230,Landlord/Tenant,CA,Deep Springs Corporation,Related,-62531,1303225,0,1,0.57610
201800269349301025,420680404,BVU FUND LP,C/O CAMBRIDGE ASSOCIATES LLC 125 HI,BOSTON,MA,02110,462921999,INVESTMENTS,DE,CAMBRIDGE ASSOC,EXCLUDED FROM TAX,916835,129654094,false,-206440,false,0.99999
201800119349300615,540505892,E&H STATE INVESTOR LLC,30461 GARNAND DR,EMORY,VA,24327,812600783,REAL ESTATE INVESTMENT,VA,FOSS VA 2016 FUND LLC,Unrelated,-9,1,0,1,0.01
201800119349300615,540505892,E&H MASTER TENANT LLC,30461 GARNAND DR,EMORY,VA,24327,812517927,RENTAL REAL ESTATE,VA,ENHANCED CAPITAL HTC FUND I LLC,Unrelated,-517,46974,0,1,0.01
201800119349300615,540505892,E&H LANDLORD LLC,30461 GARNAND DR,EMORY,VA,24327,475488168,RENTAL REAL ESTATE,VA,E&H MANAGER LLC,Unrelated,-78334,28672052,0,1,0.89
201820689349301122,237213309,The First Longwood Innovation Metals LP,175 Longwood Rd S Ste 105,Hamilton,On,CA,L8P 0A1,Real Estate,CA,Longwood Trust,Related,-3819825,43059157,false,0,false,1.00000
201820689349301122,237213309,First Longwood Warehouse Redevelopment,175 Longwood Rd S Ste 105,Hamilton,Ontario,CA,Bldg management,CA,Longwood Trust,Related,77645,3597774,false,0,false,1.00000
201810749349300911,350867954,HWH Business LP,216 Summerlake Circle,Anderson,IN,46011,352084392,Real estate,IN,Anderson University,Excluded,-1349061,2569203,0,0,0.91000
201820659349300437,231352641,GETTYSBURG HOTEL INVESTORS LP,ONE LINCOLN SQUARE,GETTYSBURG,PA,17325,232571553,REAL ESTATE,PA,SEE PART VII,EXCL. UNDER 512(B)13,594195,4685962,false,false
201840959349300134,520591608,HOOD COLLEGE LP,401 ROSEMONT AVENUE,FREDERICK,MD,21701,521969014,INVESTING,MD,INVESTMENT,0,1,0.99000
201800199349300900,310840764,1544 Central Parkway LLC,20918 State Route 251,St Martin,OH,45118,364787505,"Ownership, rehabilitation and rental of historic structure",OH,Chatfield FM Property LLC,Investment,-325,35080,0,1,0.01000
201820789349300017,930845182,GLOBE HOTEL LLC,1001 SE WATER AVE 120,PORTLAND,OR,97214,263750501,PROPERTY DEVELOPMENT,OR,GLOBE BUILDING LLC,INVESTMENT,-325616,8825964,0,0,0.86000
201801019349300235,362167770,LFC Investment Holdings LP,550 S Tryon St Suite 3500,Global Endowment,Charlotte,NC,28202,364797996,Investments,DE,N/A,Related,0,0,1
201820969349300722,580566205,NONE
201830529349300828,942356338,Commons at Fair Oaks,9200 Fair Oaks Blvd,Fair Oaks,CA,95628,471623128,Holding school real property,CA,Rudolf Steiner College,Related,6263403,0,1,0.51000
201800609349300130,340714681,MH MANAGER LLC,1 JOHN CARROLL BLVD,UNIVERSITY HEIGHTS,OH,44118,472542966,HOLDINGS,OH,MHH INC,"299,174",295584,17970296,false,0,true,0.98800
201800609349300130,340714681,MH LLC,1 JOHN CARROLL BLVD,UNIVERSITY HEIGHTS,OH,44118,471049178,RENTAL,OH,MH MANAGER LLC,6489,5840,28497608,false,false,0.90000
201800969349300345,930386972,WUE Investments Holdings LP,550 S Tryon Street Suite 3500,Charlotte,NC,28202,331168742,Investment,DE,Global Endowment Management,excluded,5300896,243866021,0,0,0.99980
201830649349300718,520591694,WMC Conference Center LP,2 College Hill,Westminster,MD,21157,521698697,Hotel Services,MD,N/A
201830819349300548,135562314,PACE UNIV FUND LP,125 HIGH ST,BOSTON,MA,02110,463422188,INVESTMENTS,DE,PACE UNIVERSITY,EXCLUDED,1889394,145985928,false,-38025,false,0.99999
201800609349301550,951643992,CHAPMAN FILMED ENTERTAINMT LLC,ONE UNIVERSITY DRIVE,ORANGE,CA,92866,454860703,FILM PRODUCTION,DE,CUE,RELATED,-93171,147444,false,0,true,0.84382
201810469349300946,741400699,HB HOUSING PARTNERSHIP I LTD,7502 FONDREN RD,HOUSTON,TX,77074,760503221,APARTMENT RENTAL,TX,UNRELATED,0,0
201841359349301734,951642394,USCSCA SURGICAL HOLDINGS LLC,1510 SAN PABLO ST,LOS ANGELES,CA,90033,SURGERY CENTER,CA,USC,RELATED,-2034704,-2025,false,0,true,0.51000
201841359349301734,951642394,LAZARD EMERGING MARKETS INST,20 TRAFALGAR SQ STE 449,NASHUA,NH,03063,208047848,INVESTMENTS,NH,USC,RELATED,-1193109,39983448,false,0,false,0.88940
201841359349301734,951642394,WELLINGTON TRUST COMPANY NA CTF REAL TO,200 CONGRESS STREET,BOSTON,MA,02210,463970058,INVESTMENTS,MA,USC,RELATED,-1577773,30202463,false,0,false,0.98574
201801069349300430,720408915,CENTENARY SIF LP,125 HIGH ST,BOSTON,MA,02110,472401486,INVESTMENTS,DE,CENTENARY,EXCLUDED,-103110,95665210,false,-8091,false,0.99990
201841229349300149,580593438,HISTORIC PORTER HOUSE LLC,231 TUCKER ROAD,MACON,GA,31210,810853774,REHABILITA,GA,N/A,false,false,0.01000
201821039349301102,750827465,GCM GROSVENOR - TCU INVESTMENT FUND LP,767 FIFTH AVE 14TH FLOOR,NEW YORK,NY,10153,263345349,INVESTMENTS,DE,NONE,Excluded,2007003,20947578,false,-54668,false,0.9579
201821039349301102,750827465,TRITIUM I-A LP,303 COLORADO STREET SUITE 2075,AUSTIN,TX,78701,470990592,INVESTMENTS,DE,NONE,Excluded,-293819,6398060,false,0,false,0.5105
201821039349301102,750827465,BW Gas and Convenience Offshore Fund LP,138 Conant Street 3RD floor,Beverly,MA,01915,474441031,INVESTMENTS,DE,NONE,Excluded,802390,10519871,false,0,false,0.5181
201841019349300114,231352688,ALDWYN LANE LP,800 LANCASTER AVENUE,VILLANOVA,PA,190851676,233101682,RENT REAL EST,PA,NA,UNRELATED,1208839,5884651,false,true
201841019349300114,231352688,VILLANOVA PRIVATE ASSETS FUND LP,320 PARK AVENUE 15TH FLOOR,NEW YORK,NY,10022,231352688,INVESTMENTS,NY,N/A,UNRELATED,1288260,52788776,false,184508,true,0.96893
201841039349301029,042300472,Amp UP NYC LLC,855 Boylston Street,Boston,MA,02116,463537796,Education,DE,NA,RELATED,127755,147882,false,0,true,0.50000
201841359349308224,421315493,PLEASANT PLAIN INVESTMENT LTD,2000 NORTH COURT 20D,FAIRFIELD,IA,52556,421326047,RENTS,IA,MAHARISHI,UNIVERSITY OF MANAGEMENT,EXCLUDED,548012,253160,false,false,0.99000
201831009349300713,350867977,FIELDHOUSE LANDLORD LLC,4600 SUNSET AVENUE,INDIANAPOLIS,IN,46208,465062614,LEASING,IN,FIELDHOUSE MGR,RELATED,207000,36258912,false,0,true,0.80000
201831009349300713,350867977,FIELDHOUSE ASSOCIATES LLC,4600 SUNSET AVENUE,INDIANAPOLIS,IN,46208,465073784,LEASING,IN,FHC HTC,RELATED,-3055,false,0,true,0.01000
201841359349303859,135598093,AP MC FUND I LP,ENTSUJI GADELIUS BLDG 1F 2-39,AKASAKA CHOME TOKYO,MI,JA,107-0052,980504300,INVESTMENTS,JA,COLUMBIA,EXCLUDED,1,0,false,0,false
201841359349303859,135598093,MERIT ENERGY PARTNERS V LP,13727 NOEL ROAD SUITE 1200,DALLAS,TX,75240,752411038,INVESTMENTS,TX,COLUMBIA,EXCLUDED,1632173,15693663,false,0,false,0.99091
201841359349303859,135598093,SANJEEVINI INVESTMENT HOLDING,IFS COURT TWENTYEIGHT,CY,MP,EBENE,981113898,INVESTMENTS,MP,COLUMBIA,EXCLUDED,17745,12951704,false,0,false,0.91749
201841359349303859,135598093,GCM GROSVENOR BLUE LP,767 FIFTH AVENUE 14TH FLOOR,NEW YORK,NY,10010,300773582,INVESTMENTS,DE,COLUMBIA,EXCLUDED,3954049,45450420,false,-15,false,0.99451
201841359349303859,135598093,Q INDIA EQUITY FUND LIMITED,LETOILE DE MAHE GROUND FL,COASTAL FLIC EN FLACREPUBLIC OF,MA,MP,980494924,INVESTMENTS,MP,COLUMBIA,EXCLUDED,5030785,62264837,false,0,false,0.63707
201841359349303859,135598093,CANAAN RESOURCES PARTNERS DRILLING FD,1101 N Broadway Suite 300,OKLAHOMA CITY,OK,73103,364777388,INVESTMENTS,OK,COLUMBIA,EXCLUDED,5629165,31852227,false,0,false,0.99000
201841359349303859,135598093,VECTRA ENG DRL FD I LP,2305 WEST BERRY AVENUE,LITTLETON,CO,80120,471901248,INVESTMENTS,DE,COLUMBIA,UNRELATED,-25699,93048,false,-25699,false,0.97500
201841359349303859,135598093,VECTRA EN DR FD I-A LP,2305 WEST BERRY AVENUE,LITTLETON,CO,80120,471842822,INVESTMENTS,DE,COLUMBIA,UNRELATED,103259,119472,false,52487,false,0.99900
201841359349303859,135598093,DAVIS INVESTMENT VENTURES FUND III-B LP,125 High Street 21st Floor,Boston,MA,02110,474999894,INVESTMENTS,DE,COLUMBIA,EXCLUDED,76855,9704240,false,-30750,false,0.30423
201841359349303859,135598093,STAR ASIA OPPORTUNITY FUND III LP,125 Gaither Drive Suite L,Mount Laurel,NJ,08054,981291896,INVESTMENTS,HK,COLUMBIA,EXCLUDED,3802,79770857,false,0,false,0.98770
201821149349300702,580593414,Young Harris College Real Estate LLC,1 College St,Young Harris,GA,305820068,474423681,College Facilities (Rollins Campus Center),GA,Young Harris College,Related,-539475,41341318,0,1,0.99940
201820899349300022,260152908,CHAPMAN FILMED ENTERTAINMENT LLC,ONE UNIVERSITY DRIVE,ORANGE,CA,92866,454860703,FILM PRODUCTION,CA,NA
201831239349300013,741109620,WMR Redcar I LLC,C/O Redcar WMR Venture LLC,PO Box 531847,Los Angeles,CA,90053,474181408,Real estate,DE,William Marsh Rice University,Excluded,-720941,57931001,false,false,0.95
201831239349300013,741109620,WMRBNA LLC,1033 Demonbreun Suite 600,Nashville,TN,37203,472747122,Real estate,DE,William Marsh Rice University,Excluded,3320541,0,false,false,0.95
201831239349300013,741109620,WMR Redcar II LLC,PO Box 531847,Los Angeles,CA,90053,812828751,Real estate,DE,William Marsh Rice University,Excluded,-230251,9158953,false,false,0.98
201831239349300013,741109620,WMRBNA II GP,1033 Demonbreun Suite 600,Nashville,TN,37203,814219211,Real estate,TN,William Marsh Rice University,Excluded,113671,9635879,false,false,0.95
201831239349300013,741109620,WMRBNA Fund III Holdings LLC,1033 Demonbreun Suite 600,Nashville,TN,37203,822127638,Real estate,DE,William Marsh Rice University,Excluded,89341,70633313,false,false,0.98
201831239349300013,741109620,BCOM Investment Partners LLC,3655 Research Drive,Genesis C,Las Cruces,NM,88003,472077446,Medical school,DE,William Marsh Rice University,Unrelated,-9596627,39541735,false,-9921317,false,0.4773
201831239349300013,741109620,WMR ACME I LLC,c/o Acme WMR Ventures LLC,2227 60th Avenue SE,Mercer Island,WA,98040,611779912,Real estate,DE,William Marsh Rice University,Excluded,-480858,43215548,false,false,0.95
201831239349300013,741109620,WMR Falcon Ridge LLC,c/o William K Hoeg,2029 Queen Avenue South,Minneapolis,MN,55405,820650932,Real estate,DE,Willliam Marsh Rice University,Excluded,0,0,false,false,0.95
201831239349300013,741109620,LVA4 Co-Investment III LP,100 Waugh Drive Suite 600,Houston,TX,77007,475564692,Real estate,DE,William Marsh Rice University,Excluded,23450,4707272,false,false,0.9999
201811139349300801,240795445,MSP CO-INVESTPARTN V-A LP,440 S LASALLE ST,CHICAGO,IL,60605,205095093,INVESTMENT,DE,LEHIGH UNIV,UNRELATED,false,false,0.98787
201801299349300645,150532082,ITHACA LP,35 THORNWOOD,ITHACA,NY,14850,INVESTMENTS,JE,CORNELL UNIV,related,-2753277,4968623,false,0,false,0.99690
201801299349300645,150532082,Hudson Cornell Residential JV,826 Broadway,NY,NY,10003,Real Estate,NY,Cornell Univ,related,-1121218,37406890,false,0,false,0.85590
201801299349300645,150532082,Cayuga 1993 LP,555 Main St,Racine,WI,53403,Investments,WI,Cornell Univ,related,1089511,13137881,false,0,false,0.62970
201831079349300123,710236897,TVH Rowhouses LLC,1600 Washington Avenue,Conway,AR,72032,454269230,Residential rental property,AR,N/A,Unrelated,-21897,1212806,0,0.695
201831079349300123,710236897,Mckennon Properties LLC,1600 Washington Avenue,Conway,AR,72032,471409457,Commerical and Residential Rental Real Estate,AR,N/A,Unrelated,3352,1578551,0,0.684
201831179349300428,208096718,LTSG LANDLORD LP,61 SEMINARY RIDGE,GETTYSBURG,PA,17325,300717501,REAL ESTATE,PA,N/A
201831179349300428,208096718,LTSG LANDLORD LP,61 SEMINARY RIDGE,gETTYSBURg,PA,17325,371663204,rEAL ESTATE,PA,N/A
201821349349303922,363649217,Nebraska Health Network,8511 West Dodge Road,Omaha,NE,68114,271784907,Healthcare Svc,NE,NH Partners,Related,0,0
201821349349303922,363649217,NC Lab LLC,8303 Dodge Street,Omaha,NE,68114,461173104,Diagnostic Svc,NE,NMC,Related,0,0
201801349349300925,350868188,IPND Leverage Lender LLC,Controllers Office,724 Grace Hall,Notre Dame,IN,46556,271678084,Finance,IN,University of Notre Dame du Lac,Excluded,-14381166,0,false,true,0.999
201801349349300925,350868188,Magna NYC Co-Investment LP,300 Centerville Road,Suite 300 East,Warwick,RI,02886,261523052,Real estate investment,DE,GP Magna NYC Co-Investment LLC,Excluded,18810326,85786540,false,false,0.7939
201801349349300925,350868188,Merit Energy Partners VIII LP,13727 Noel Rd,Suite 1200,Dallas,TX,75240,752530212,Direct energy investments,DE,Merit Partners LP,Excluded,-2071261,91146377,false,false,0.99
201801349349300925,350868188,Qiming II Investor Holdings LLC,350 106th Ave NE,First Floor,Bellevue,WA,98004,270464551,Feeder fund,WA,University of Notre Dame du Lac,Excluded,331308,3103504,false,true,1
201801349349300925,350868188,Thor Palmer House Co-Investor LP,25 West 39th Street,11th Floor,New York,NY,10018,203283109,Real estate investment,DE,Thor Palmer House Co-Investor GP LLC,Excluded,390229,41892035,false,false,0.6872
201801349349300925,350868188,Bridgewater Corporate Bond Fund LLC,One Glendenning Place,Westport,CT,06880,522317130,Investments,DE,Bridgewater Associates LP,Excluded,6791587,114899901,false,false,0.6554
201801349349300925,350868188,NDFPR LP,PO Box 194170,San Francisco,CA,941194170,611769730,Investments,DE,BART Partners VIII LLC,Excluded,1193834,97818343,false,false,0.999
201801349349300925,350868188,VMG Stone Brewing Coinvestment LP,39 Mesa Street,Suite 310,San Francisco,CA,94129,812802402,Investments,DE,VMG Partners III GP LP,Unrelated,-1087153,58097447,false,-1087153,false,0.648
201801349349300925,350868188,Adveq EEM I LP,50 Lothian Road,Festival Square,Endinburgh,UK,EH39WJ,Investments,UK,Schroder Adveq Management Jersey Ltd,Excluded,0,2142258,false,false,0.99
201801349349300925,350868188,Level Equity Sub-Debt Co-Investment I,Two Grand Central Tower,140 E 45th St 39th Floor,New York,NY,10017,Investments,DE,Level Equity Management LLC,Excluded,0,0,false,false,0.95
201821349349303772,516000297,Arlington Fund 1 LLC,125 High Street,Boston,MA,02110,470900223,Investment,DE,Univer of DE,Investment,8797,false,true
201821349349303772,516000297,First State Marine Wind LLC,2050 Cabot Boulevard West,Langhorne,PA,19047,383809186,PWR Generation,DE,Blue Hen Wd,Electric Generation,-8522,3972863,false,false,0.97500
201821349349305152,231352651,1100 WALNUT ASSOC,C/O TJU601 WALNUT STSTE 925E,PHILADELPHIA,PA,19106,232332396,MEDICAL OFFICE,PA,NA
201821349349305152,231352651,JEFF UNIV RAD ASSOC,840 CRESCENT CTR DR,FRANKLIN,TN,37067,412043518,HEALTH SVCS.,PA,NA
201821349349305152,231352651,JEFF COMP CONC CTR,4050 S 26TH ST,PHILADELPHIA,PA,19145,464254983,HEALTH SVCS.,PA,NA
201821349349305152,231352651,RIVERVIEW SURG CTR LP,3 CRESCENT DR,PHILADELPHIA,PA,19112,263910345,HEALTH SVCS.,PA,NA
201821349349305152,231352651,RIVERVIEW SURG CTR LLC,3 CRESCENT DR,PHILADELPHIA,PA,19112,263911509,HEALTH SVCS.,PA,NA
201821349349305152,231352651,ROTHMAN ORTHO SPEC HOSP,11221 ROE AVE,LEAWOOD,KS,66211,270260289,HEALTH SVCS.,PA,NA
201821349349305152,231352651,MLJH LLC,C/O TJU601 WALNUT STSTE 925E,PHILADELPHIA,PA,19106,821445171,HEALTH SVCS.,PA,NA
201821349349305152,231352651,JUNIATA MED BLD,3 VILLAGE RD,HORSHAM,PA,19044,232450132,MEDICAL OFFICE,PA,NA
201821349349305152,231352651,TMB ENTERPRISE,3 VILLAGE RD,HORSHAM,PA,19044,232400586,MEDICAL OFFICE,PA,NA
201821349349305152,231352651,MED IMAGING ASSOC,2451 GRANT AVE,PHILADELPHIA,PA,19114,232491498,HEALTH SVCS.,PA,NA
201821349349305152,231352651,JEFFHEDGE LLC,1301 2ND AVE,SEATTLE,WA,98101,453214379,INVESTMENTS,DE,TJU,RELATED,3656949,66418907,false,0,true,0.75192
201801349349309290,540534105,sbc restoration lessee llc,PO BOX 1090,SWEET BRIAR,VA,24595,465731000,renovations,VA,SWEET BRIAR,40000,721187,false,0,0.99000
201801349349301675,160743209,EXCELL INNOVATE NY FUND LP,222 WEST RIDGE ROAD SUITE 156,ROCHESTER,NY,14615,462405519,FUNDING START UPS,NY,ETV INC
201801349349301675,160743209,EXCELL MINORITY AND WOMEN OWNED BUSINESS,222 WEST RIDGE RD BLDG 28 SUITE 1,ROCHESTER,NY,14615,810723223,FUNDING START UPS,NY,ETV INC
201801349349301675,160743209,EXCELL PARTNERS INNOVATIVE TC FUND LP,222 WEST RIDGE ROAD BLDG 28SUITE,ROCHESTER,NY,14615,810711015,FUNDING START UPS,NY,ETV INC
201821349349306102,340714334,MCCULLOUGH CENTER LLC,11610 EUCLID AVE,CLEVELAND,OH,44106,261627336,REAL ESTATE,OH,MCCULLCTRMGR,EXCLUDED,-918974,24942435,0,1,0.90000
