object_id,ein,ExpnsAmt,GrntAmt,RvnAmt,Dsc
201502129349301030,410682405,"-The CPA hosted free public-screenings and discussions of the film The Anonymous People, which performs a public service for those in recovery from addiction by highlighting successful recovery stories and empowering those in recovery to speak out, share their own stories, and advocate for recovery-favorable policies. The Social Community hosted a free online screening of the film as well. Over 5,700 people logged on to watch, and afterward, many of them participated in an online discussion featuring several experts.-Not all of the Center's efforts were focused on national public policy. In Minnesota, the Hazelden Betty Ford Foundation has played a leading role with state lawmakers in making the case for the efficacy and cost effectiveness of substance abuse treatment in these tight budgetary times. The Foundation also argued for an increase in state alcohol taxes, with the proceeds to be used to prevent and treat abuse and addiction. In addition, the CPA hosted and participated in a recovery advocacy seminar in St. Paul.-Throughout 2014, the Center's Willam C. Moyers spoke to national conventions, state trade associations, local civic and education groups, and gatherings of people in recovery about the importance of standing up and speaking out for treatment and recovery.-In 2014, Moyers and the Center also engaged the news media in a wide variety of other policy efforts, serving as a key media spokesperson and being featured in newspapers and magazines nationwide. In addition, Moyers authored a weekly syndicated column, ""Beyond Addiction,"" that was distributed nationally. Dean Peterson, former Chief of Staff to retired Congressman Jim Ramstad, has been an energetic presence on behalf of the Foundation and the wider treatment community both in Washington D.C. and Minnesota.-Under the direction of the Hazelden Betty Ford Foundation Speakers Bureau, 34 employees presented to nearly 18,000 attendees at 123 events in 23 states on a broad range of subjects including drug trends, prevention, the opioid crisis, treatment advances, and recovery issues. Community Relations Services: -Through its community relations services, the Hazelden Betty Ford Visitors Program in Center City scheduled and conducted 30 tours for 224 individuals. Volunteers at facilities in Minnesota, Illinois, New York, Oregon and Florida donated 9,436 hours valued at $234,107.-Educational scholarships from Hazelden were awarded totaling $5,200 to students at six high schools in the Twin Cities and the surrounding Center City area. -The Foundation continues its involvement with the Partners for a Drug Free Chisago County, providing expertise, hosting meetings and allowing staff to serve on the organization's board. Publishing: -Hazelden Publishing is the leading publisher of state-of-the-art resources for preventing, treating, and managing addiction and closely related issues. Translating research into practice, we help organizations treat the whole client by offering information, guidance, tools, and support to meet their unique needs. With 141 new offerings in 2014, our publications continue to provide inspiration, guidance and encouragement to millions around the world every day. In 2014, Hazelden Publishing generated 41 new products, 45 new distributed products, 8 new services and trainings, 19 new e-books, 5 new apps, 12 translation rights, and 11 new subscriptions. If not for the Hazelden Betty Ford Foundation's mission, much of this material would not be published and available to consumers because of its limited appeal to mainstream publishers. Hazelden Publishing's materials also reach underserved populations, including many customers in the community treatment, faith-based and corrections markets.-In 2014, through its BookAid program, Hazelden sent 6,113 packages of over 18,000 products that reached the lives of more than 200,000 people through 76 libraries serving programs and institutions in need. BookAid resources were sent to individuals and organizations in the United States and around the world. Hazelden Publishing received over $40,000 in donations for the BookAid program.Hazelden Betty Ford Website: -A new website at hazeldenbettyford.org was launched in 2014 and will become the primary website of the new organization by the end of 2015. The new site is built on state-of-the-art technology and offers a personalized experience for each visitor. In addition to information about the products and services of the Hazelden Betty Ford Foundation, the site continues to provide daily inspirational readings, research findings, a bookstore, and informational articles, as well as access to career opportunities, webinars, a social community, an alcohol screening tool, and online professional education. Over 7 million visits were recorded across all Hazelden Betty Ford Foundation websites in 2014. -The Hazelden Betty Ford Foundation's Social Community-an online network for people interested in recovery from substance use disorders-features blogs, discussion boards, a book club, and online meetings that are accessible to anyone from anywhere in the world. By year's end, 43,000 people had joined the community since its inception 14 years ago. The Hazelden Betty Ford Foundation's Facebook, Twitter, YouTube, and LinkedIn accounts, along with our award-winning mobile apps, provide additional access to recovery resources, providing daily inspiration, information, and fellowship to our diverse constituencies.Resource Center: -In 2014, Hazelden Betty Ford Foundation's Resource Center received more than 203,000 calls and more than 11,000 online inquiries from people seeking information, assistance and products related to addiction issues. Part of the Resource Center's work is connecting people with the help they need, in the form of products, services and free information. For those in need of resources beyond what the Foundation provides, the Resource Center searches its database of more than 30,000 agencies to locate other possible assistance."
201501359349303335,261672457,340933,112267,"OTHER PROGRAMS INCLUDE PUBLISHING THE ANTIOCH REVIEW, OPERATION OF THE OLIVE KETTERING LIBRARY AND THE MAINTENENCE AND SAFE-KEEPING OF THE ANTIOCHIANA HISTORICAL ARCHIVES AND COLLECTIONS."
201501359349303885,430817015,3614702,4360899,OPERATIONS AND MAINTENANCE - AUXILIARY
201501359349303885,430817015,SUPPORT FOR MAINTENANCE OF CAMPUS
201511359349303201,580814544,874647,"Academic support - ITC is dedicated to producing public theologians - men and women who are intellectually keen, politically sophisticated, economically savvy, culturally sensitive, family friendly, technologically literate, and spiritually astute. A key role of these public theologians is to serve as liaisons - facilitators of new alliances - between America's churches and other nonprofit organizations, corporations, foundations, and government entities."
201541359349306169,480577656,1989402,"INSTITUTIONAL SUPPORT - FOR CENTRAL CHRISTIAN COLLEGE OF KANSAS IS PROVIDED BY THE VARIOUS ADMINISTRATIVE OFFICES INCLUDING PRESIDENT, BUSINESS OFFICE, AND THE DEVELOPMENT OFFICE. IN ADDITION TO PROVIDING THE GENERAL ADMINISTRATION OF THE INSTITUTION, THESE SUPPORT OFFICES ARE ALSO INSTRUMENTAL IN RAISING THE ADDITIONAL CONTRIBUTED FUNDS THAT ARE NECESSARY FOR CONTINUED EXISTENCE OF THE COLLEGE."
201511369349300851,951744370,509199,"ESL, CERTIFICATE PROGRAMS AND OTHERS"
201501359349301045,550419865,1681219,1399347,"STUDENT SERVICES- TO PROVIDE SUPPORT FUNCTIONS FOR STUDENT HOUSING, DINING, AND ALL ASPECTS OF STUDENT LIFE INCLUDING INTRAMURAL ATHLETICS, THEATER, FINANCIAL SERVICES, AND OTHER STUDENT GROUPS AND ACTIVITIES."
201531359349307478,956002998,2818638,56381,2254301,"OTHER GRADUATE PROGRAMS, INCLUDING: RELIGION (LEADERSHIP STUDIES OR THEOLOGICAL STUDIES) CLINICAL PSYCHOLOGY, ORGANIZATIONAL PSYCHOLOGY, AND NURSING. STUDENTS IN THE GRADUATE PROGRAMS AT VANGUARD CAN COMPLETE THEIR MASTERS IN JUST TWO YEARS. COURSES ARE OFFERED AT CONVENIENT TIMES INCLUDING EVENINGS AND WEEKENDS."
201541359349305739,363108821,456018,173585,Auxilliary Services
201541359349305739,363108821,1517554,Workforce Training and Adult Education
201541359349305739,363108821,437138,Other Program Services
201541359349305739,363108821,1461943,"Academic Support - includes the expenses/activities for academic administration and computing support, the Learning Resource Center, and our various locations that support students' educational needs outside of direct instruction."
201541359349308934,951890710,24615418,23174689,AUXILIARY ENTERPRISES AND ACADEMIC SUPPORT.
201531359349306928,131693134,6739279,5902298,AUXILLIARY SERVICES - PROVIDES SERVICES AND AMENITIES FOR THE CONVENIENCE OF THE VISITING PUBLIC
201521359349301782,042103639,1047192,0,1033296,"Personal Social Services: Expenses incurred in connection with sponsored activities such as: research, public service and student internships."
201511359349305286,951230865,232590,"OTHER PROGRAM SERVICES INCLUDE THE PLANT FUND WHICH IS USED FOR THE ACQUISITION OF PHYSICAL PROPERTIES AS WELL AS FUNDS EXPENDED AND INVESTED IN PHYSICAL PROPERTIES FOR THE GENERAL FUND AND CAMPUS PROGRAMS FUND, AS WELL AS THE SPONSORED PROGRAMS FUND WHICH INCLUDES FUNDS RESTRICTED BY DONORS FOR SPECIFIC PURPOSES."
201502189349300105,020222215,2036305,4865230
201532159349301183,344434288,382112,397612,REHABILITATION
201541359349304524,231409675,6206570,"Academic Support - Funds expended to provide support services for the core, instructional mission of the University including operation of libraries and laboratories, instructional technologies, assessment, and academic administration."
201521359349306227,370673506,7533620,8758079,"THE HOSPITAL OPERATES A 24 HOUR EMERGENCY DEPARTMENT WHICH HAD 15,036 PATIENTS REGISTERED TO THE ED IN FISCAL YEAR 2014."
201502259349300635,060646715,100349039,141242129,"In towns across central Connecticut, MidState Medical Center (MMC) is committed and focused on efforts to promote health and wellness in the communities the hospital serves. Each year, MidState makes a concerted effort to go above and beyond its call to the community. Our physicians, nurses, and staff reach out to thousands of individuals every year through health-related programs and special events. Additionally, MMC has partnered with various community organizations to improve the quality of life of its residents. These include key opinion leaders, faith communities, business leaders, government officials, and a variety of social service organizations. Financial Assistance - MidState Medical Center is the leading safety net provider of acute medical care for the communities it serves. MidState routinely provides services to uninsured patients and to people covered under government programs for which it does not receive full payment. Eligibility for the financial assistance programs is dependent on income and other personal circumstances."
201532259349302863,060646768,242912815,240829826,"Other routine services such as inpatient and outpatient medical and surgical, maternity, newborn, psychiatric and pediatric and anciliary services provided to patients."
201522229349300222,042790311,136629705,140291881
201542259349303169,721025017,2818326
201542519349300609,150532254,298228496,14094,380680900
201542749349300524,541743079,5416780,THE LAW SCHOOL WAS ESTABLISHED TO PROVIDE POST GRADUATE EDUCATION IN THE STUDY OF LAW AS WELL AS MAINTAIN AN ENVIRONMENT CENTERED ON STUDENTS AND ENGAGE IN SCHOLARSHIP AND CONTRIBUTE TO THE COMMUNITY AND PROFESSION THROUGH SERVICE ACTIVITIES.
201522269349303182,042103612,798627,2783897
201521699349300742,030179592,5206258,1444395,3624790,"The Experiment in International Living - World Learning's founding program has been offering immersive cross-cultural exchanges, fun and thought-provoking adventures, and experiential learning programs since 1932. Today, EIL provides three-to-five-week summer programs for high school students in over 25 countries worldwide. The program's mission: create meaningful, dynamic experiences for students eager to challenge themselves and engage their sense of global citizenry. Each program is an authentic journey challenging participants to develop a close connection with the people and culture of another country. Through home stays, community service, language training, outdoor adventure, art, and experiential learning, students build leadership and communication skills, gain essential international experience, increase self-confidence, and enhance global awareness. The Experiment has introduced more than 70,000 young people to international issues. Annually, over $1.5 million in scholarships are funded by the philanthropic generosity of former Experimenters and other World Learning supporters. Learn more at www.experimentinternational.org."
201521699349300742,030179592,5642022,14750,6660421,"International Honors Programs - International Honors Program (IHP), a program within World Learning/Study Abroad, offers undergraduate students a unique comparative learning opportunity to analyze and contrast today's global conditions, evaluate issues and challenges, and compare solutions across countries and cultures. IHP participants study issues relating to public health, the environment, globalization, urban planning, governance, social justice, and human rights. Learn more about IHP at http://studyabroad.sit.edu/sn/programs/locations/ihp-comparative/"
201521699349300742,030179592,6621948,0,1108355,"Other program services, including SIT program support and auxiliary student services."
201531119349300103,560529933,151162,268920,"STUDENT SERVICES: ENROLLMENT SERVICES, STUDENT SERVICES, FINANCIAL AID, HOUSING AND FOOD SERVICES, POST OFFICE, COLLEGIATE ATHLETICS, AND OTHER ACTIVITIES."
201530219349300608,410693962,2328921,48500,1952990,"OTHER SERVICES - RESEARCH, PUBLIC SERVICES, POST OFFICE, ETC."
201530589349300528,150532204,27215435,"STUDENT SERVICES: STUDENT SUPPORT SERVICES INCLUDING ADMISSIONS, REGISTRAR, ATHLETICS, AND STUDENT CLUBS. THESE SERVICES CONTRIBUTE TO THE STUDENT'S EMOTIONAL AND PHYSICAL WELL-BEING."
201530419349301518,410693960,7310975,0,4732925,"Auxiliaries - Expenditures for primarily student housing, etc."
201530419349301518,410693960,682826,0,0,Other Program Services - Expenditures of those offices and activities whose primary purpose is to support the program activities of the University.
201530859349300013,580593414,6186840,236650,"Student Services: Funds expended for innovative programs and services which challenge students culturally, athletically and spiritually. The College strives to recruit and retain excellent students and empower them to reach their full potential. These expenditures provide support for extracurricular activities and student related services at the College which are essential to the students' well being and contribute to the quality of life outside the formal academic programs. Also, expenditures for student involvement in projects that impact the local community are included."
201530859349300013,580593414,6594244,8619004,"Auxiliary Services: Funds expended for meal services and the operation, repair and maintenance of the College's residence halls, dining hall, and recreation facility."
201530909349300763,570474291,2328215,77385,"Academic Support: The University library (approximately 250,000 volumes held) is support for the principal academic divisions."
201530909349300763,570474291,6107041,9420598,"Auxiliary Enterprises: The University residence halls, dining hall, and campus bookstore are the major auxiliary enterprises serving the University community."
201531049349300608,610482955,3767193,1037900,"ACADEMIC SUPPORT, LIBRARY AND COMPUTER TECHNOLOGY SERVICES, SUPPORT FOR THE FOUR ACADEMIC DIVISIONS"
201531059349300718,160746864,13331094,2629788,ACADEMIC SUPPORT & STUDENT SERVICES: TO SUPPORT THE INSTRUCTION FUNCTION.
201501349349300335,951699394,675211,0,576948,Psychological Center - Student trainees provided counseling services to members of the community.
201501349349300335,951699394,764932,95127,128963,Urban Youth Certification Program
201501349349300335,951699394,223650,223650,287076,Other Miscellaneous Programs
201501349349300335,951699394,354983,Conference and Event Program Revenue
201501349349300335,951699394,444625,Miscellaneous Income
201501349349300335,951699394,454883,Cost Recovery Revenues
201501349349300335,951699394,19307,Sales of Instructional Materials
201501349349300335,951699394,19060,Miscellaneous Royalties on Educational Publications
201501319349301400,231352294,6189071,1992799,SEE SCHEDULE O
201501059349300115,520591623,3043900,6670,0,Research and development programs provided by faculty and public service programs performed to benefit the public in general
201501349349305800,131624067,4566179,0,219386,Student performing arts productions
201501349349308665,520895834,1679219,23215
201510979349300431,580633971,1720915,594546,ARTS FOR LEARNING
201511349349305646,941186179,806592,130177,GENERAL INSTITUTIONAL SUPPORT.
201511349349306841,630417508,54448,THE UNIVERSITY FURNISHES A BOOKSTORE FROM WHICH STUDENTS ARE ABLE TO PURCHASE THE BOOKS AND SUPPLIES NECESSARY FOR THEIR STUDIES.
201511349349306841,630417508,59254,"THE UNIVERSITY FURNISHES DINING FACILITIES FOR THE CONVENIENCE OF STUDENTS, FACULTY AND STAFF."
201511349349300721,350868188,120989351,6960050,19663385,"Public service - The University's Institute for Educational Initiatives strives to improve the K-12 education of all young people, particularly the disadvantaged through a variety of programs. The largest such program is the ACE program, a two-year service program offering college graduates the opportunity to serve as full-time teachers in under-resourced schools across the United States and several foreign countries. Additionally, the University provides volunteers and financial support for other organizations, both directly and through its Donor Advised Fund Program.Academic support - The University operates library facilities containing approximately 2,000,000 volumes, serving the University and local community. The University publishes numerous academic periodicals and volumes and operates a museum of art housing over 21,000 works."
201511059349300201,741159753,67708611,2661014,117279073,"OTHER EXPENSES CONTAINED HEREIN ARE COMPRISED OF THE FOLLOWING: RESEARCH, PUBLIC SERVICES, AND AUXILIARY ENTERPRISES. BAYLOR ENGAGES IN RESEARCH WORK SPONSORED BY NUMEROUS FEDERAL, STATE, AND LOCAL AGENCIES. ADDITIONALLY, BAYLOR PROVIDES NON-INSTRUCTIONAL SERVICES THAT BENEFIT INDIVIDUALS AND GROUPS EXTERNAL TO BAYLOR. AUXILIARY ENTERPRISES ARE COMPRISED GENERALLY OF THE FOLLOWING ITEMS: RESIDENCE HALLS, DINING SERVICES, BOOKSTORE, AND VENDING SERVICES."
201510489349301101,362662739,3050402,1148623,Retail Shop & Events
201510939349300121,362170136,19766454,0,23040916,"STUDENT SERVICES:- THIS PROGRAM PROVIDES HEALTH, ACADEMIC, TRANSITIONAL ASSISTANCE, STUDENT ORIENTATION AND OTHER STUDENT SERVICES INCLUDING THE STUDENT FINANCE CENTER, ADMISSIONS, AND REGISTRATION. IN ADDITION, THESE SERVICES ALSO INCLUDE THE DEAN OF STUDENTS AND STUDENT ACTIVITIES AND MINORITY PROGRAMS."
201510939349300121,362170136,10744911,0,13243842,"AUXILIARY SERVICES:- THIS PROVIDES FOR CAMPUS HOUSING AND DINING FOR THE STUDENTS AND INCLUDES RESIDENCE HALLS AND A DINING ROOM, APARTMENT-STYLE BUILDINGS, FIVE FRATERNITY HOUSES, AND TWO SORORITY HOUSES."
201511349349304441,160743088,17034314,0,433802,"All other program expenses, includes Student Services, Academic Support and Arts Center. Student Services pertains to offices serving students including Registrar, Student Development, Center for Civic Engagement, Career Services, Enrollment Management and Center for Student Success. Athletic expenses are also reflected in this category. Academic support pertains to library services, Academic Advisement, the Center for International Education and the offices of the deans, among others. The Arts Center is a premier presenter of world-class dance, children's theatre, and international entertainment. The Arts Center houses the College's departments of Art, Music, and Theatre Arts. (2569 Total Student FTE's)"
201521249349300957,470376583,21520434,0,8351247,Sponsored Research and Other Education and General
201521359349304622,362387148,1653517,2910221,Adult Studies Undergraduate Higher Education:Trinity's adult studies program is a non-traditional program serving adults age 23 and older and offering accelerated degree completion programs in business and education as well as certification and endorsement programs.
201520929349300437,930386839,14914785,0,-690280,"Admissions, Housing, Food Service and M&G"
201521349349308967,231352689,194833,"Upholding the Truth, LLC or ""UTT""The purpose of UTT is to study, promote, and advance the truth and ethics of a biblically consistent worldview in all spheres of life and when appropriate, to do so with allied individuals, groups, and organizations that are committed to the same perspective. Representative projects include an annual conference devoted to the intersection of science and faith and TheTruthAboutDaVinci.com, a website debunking myths perpetuated by Dan Brown's bestselling book The DaVinci Code."
201520429349301752,010355980,244411,12500,314990,"OTHER PROGRAMS INCLUDE A COMPOSITE BOATBUILDING APPRENTICESHIP PROGRAM, CONTINUING EDUCATION COURSES, SALE OF BOATS AND OTHER REVENUE."
201521259349301812,350868107,10275499,0,13838455,"COMMUNITY SERVICES IS THE PUBLIC SERVICE ARM OF THE UNIVERSITY, IT CONSISTS OF PROVIDING SERVICE TO THE COMMUNITY AT LARGE, ESPECIALLY PROVIDING SERVICES FOR THE AGING THROUGH THE CENTER FOR AGING AND COMMUNITY. THROUGH GRANT AND CONTRACTS WITH THE STATE AND PRIVATE AGENCIES, ASSISTANCE AND TRAINING IS PROVIDED FOR THE AGING BOTH IN QUALITY OF LIVING AND STAYING ENGAGED IN THE WORKFORCE. AUXILIARY SERVICES CONSIST MAINLY OF THE HOUSING AND DINING FACILITIES THAT SERVE STUDENTS ON CAMPUS. THE MAIN FUNCTION IS TO PROVIDE A HEALTHY AND PLEASANT ENVIRONMENT TO ENHANCE THE STUDENTS' ACADEMIC AND SOCIAL NEEDS."
201521179349300342,231352118,11493070,930609,5191272,"DRUG AND ALCOHOL REHABILITATION OFFERS SOLUTIONS TO ADULTS SEEKING TREATMENT FOR OPIATE ADDICTION, INCLUDING GROUP, INDIVIDUAL AND FAMILY THERAPY IN AN OUTPATIENT METHADONE MAINTENANCE PROGRAM SETTING. PATIENTS ALSO RECEIVE PHYSICAL, MEDICATION EVALUATION, AND PSYCHIATRIC EVALUATIONS AND HIV COUNSELING, TESTING AND EDUCATION. THESE PROGRAMS SERVE APPROXIMATELY 772 INDIVIDUALS EACH YEAR. WORK AND RECOVERY PROGRAMS OFFER VOCATIONALLY-ORIENTED SERVICES TO INDIVIDUALS WITH EMOTIONAL AND DEVELOPMENTAL DISABILITIES. RECOVERY PROGRAMS UTILIZE PSYCHIATRIC EVIDENCE-BASED PRACTICES TO EQUIP INDIVIDUALS TO BETTER MANAGE THEIR ILLNESS OR DISABILITY WHILE WORKING TOWARD THEIR PERSONAL AND VOCATIONAL GOALS. WORK SERVICES INCLUDE VOCATIONAL EVALUATION, JOB EXPLORATION, JOB FINDING ASSISTANCE, AND JOB RETENTION SERVICES. THESE PROGRAMS SERVE 407 INDIVIDUALS EACH YEAR."
201521329349301617,930386892,3059029,2854609,Clinics - Part of Curriculum
201520759349301212,042103585,233295,196429,PROVIDED FACILITIES FOR OTHER EDUCATIONAL ORGANIZATIONS TO CONDUCT EDUCATIONAL PROGRAMS AND TO PROVIDE HOUSING TO STUDENTS.
201521329349302427,231352648,317821,Food Service- Catering
201521329349302427,231352648,268810,Food Service- Cash Receipts
201521329349302427,231352648,67572,Bookstore Commission
201521329349302427,231352648,2105,Vending and Non Credit Workshops
201520789349300532,591023117,1658763,0,2277891,"CLASSICAL MUSIC IS PROVIDED TO THE UNIVERSITY COMMUNITY AS WELL AS THE GENERAL PUBLIC BY STUDENTS AND FACULTY IN THE LYNN UNIVERSITY CONSERVATORY OF MUSIC. ADDITIONALLY, PROFESSIONAL ACTORS AND MUSICIANS PERFORM ON CAMPUS IN THE PERFORMING ARTS CENTER. MANY OPPORTUNITIES ARE PROVIDED IN THE REALM OF ""IDEAS,"" THROUGH LECTURES AND COMMUNITY DISCOURSE. DURING THE SUMMER MONTHS BETWEEN ACADEMIC YEARS FOR TRADITIONAL COLLEGE STUDENTS, A PORTION OF THE UNIVERSITY'S EDUCATIONAL FACILITIES ARE USED TO PROVIDE INSTRUCTION TO A COMBINED ENROLLMENT OF APPROXIMATELY 1,500 CHILDREN ATTENDING THREE THREE-WEEK SUMMER CAMP SESSIONS AND TO GROUPS OF ADULTS ENROLLED IN SPECIAL EDUCATIONAL PROGRAMS."
201521359349302302,520591672,3849376,HIGHER EDUCATION: ACADEMIC SUPPORT FOR INSTRUCTIONAL PROGRAMS
201521359349302302,520591672,1020940,INSTITUTIONAL SUPPORT
201520889349300252,231352204,577546586,588184489,"EXPENSES ARE FOR TREATING INPATIENTS, OUTPATIENTS AND EMERGENCY PATIENTS"
201540129349300024,542052107,3632164,0,431254,OTHER RESEARCH AND PUBLIC SERVICES
201540129349300314,953890724,471754,12255,THIS PROGRAM IS TO TEACH AND TRAIN STUDENTS IN THEOLOGICAL COURSES FOR SERVICE IN CHRISTIAN MINSTRY. IT HAD ABOUT 90 STUDENTS ENROLLED IN 26 CLASSES IN EACH QUARTER.
201531339349301738,520591613,679768,0,389751,The college provides summer programming to a variety of constituencies.
201531359349308993,550357072,703451,OTHER PROGRAM SERVICES
201540459349300244,131624158,33653815,10163960,AUXILIARY ENTERPRISES-HOUSING ON CAMPUS FOR SINGLE AND MARRIED STUDENTS;OFF CAMPUS HOUSING FOR FACULTY AND OTHER UNIVERSITY PERSONNEL; FOOD SERVICE CONSISTS OF CAFETERIA DINING FACILITIES; PRESS INCLUDES JOURNALS AND SUBSCRIPTIONS.
