object_id,ein,ExpnsAmt,GrntAmt,RvnAmt,Dsc
201532299349302483,581249683,3527774,Other program services
201530139349300813,132553815,135522,135522,PROVIDE SUPPORT FOR CHILDREN'S CENTER
201530139349300813,132553815,51420,STUDENT ACCIDENT INSURANCE
201530139349300813,132553815,2742786,STUDENT ACTIVITY FEES-USED TO FUND ALL PROGRAM SERVICES
201500129349301310,390806297,5155464,1752055,PROVIDE ACADEMIC SUPPORT TO 1500 STUDENTS THROUGH LIBRARY FACILITIES AND COMPUTER SERVICES
201520149349301257,560532303,8107597,"ACADEMIC SUPPORT - EXPENSES INCURRED TO PROVIDE SUPPORT SERVICES FOR THE INSTITUTION'S PRIMARY MISSION OF INSTRUCTION, INCLUDING THE LIBRARY, MEDIA SERVICES, AND TECHNOLOGY."
201520129349301107,240795495,1485451,"HIGHER EDUCATION, PUBLIC SERVICE - FUNDS EXPENDED FOR ACTIVITIES ESTABLISHED PRIMARILY TO PROVIDE NON-INSTITUTIONAL SERVICES BENEFICIAL TO INDIVIDUALS AND GROUPS EXTERNAL TO THE UNIVERSITY. THESE EXPENSES DO NOT INCLUDE OVER 175,000 COMMUNITY SERVICE HOURS PROVIDED BY UNIVERSITY STUDENTS."
201520129349301107,240795495,7109480,1887465,"HIGHER EDUCATION; ACADEMIC SUPPORT - INCLUDES EXPENSES APPLICABLE TO AN INTEGRAL PART OF THE UNIVERSITY'S PRIMARY MISSION OF INSTRUCTION, RESEARCH, OR PUBLIC SERVICE THAT ARE NOT CHARGED DIRECTLY TO THESE PROGRAMS."
201520129349301107,240795495,5972531,"HIGHER EDUCATION; LIBRARY - EXPENSES INCURRED IN OPERATING AN 80,000 SQ. FT. UNIVERSITY LIBRARY. THE LIBRARY CONTAINS OVER 633,035 VOLUMES, 203,507 FULL-TEXT ONLINE BOOKS, AND A MEDIA COLLECTION HOLING 22,544 NON-PRINT ITEMS AND 9,085 STREAMING MEDIA PROGRAMS FOR STUDENT AND GENERAL PUBLIC STUDY AND RESEARCH."
201520129349301107,240795495,16161923,HIGHER EDUCATION; STUDENT SERVICES AND ACTIVITIES - EXPENDITURES OR ACTIVITIES WHOSE PURPOSE IS TO CONTRIBUTE TO STUDENTS' EMOTIONAL AND PHYSICAL WELL-BEING AND DEVELOPMENT OUTSIDE THE CLASSROOM.
201520279349300737,610673886,847809,221426,237481,"Community Investment: Brighton Center at its very core is a community based agency. The people in our community and their needs are the driving force behind the work we do. Trends and fads will come and go but Brighton Center will always provide services the community needs and wants. Every day, Brighton Center works to engage all members of the community from young children to seniors so that real change can become reality. During the fiscal year of 2014, Our Community Investment program served 37,753 individuals, of which 11,611 received assistance through our Clothing Closet and 6,464 individuals were made aware of our impact through the efforts of our Community Organizing. This program is focused on bringing individuals talents, resources, and skills together, in order to transform their own lives and their community. We also were fortunate enough to have 3,124 volunteers across the agency."
201520279349300737,610673886,934880,814165,"Brighton Recovery Center for Women: The Brighton Recovery Center for Women is part of the Recovery Kentucky network that was instituted to help chronically homelessness women combat substance abuse. The 100 bed facility uses the intensive Recovery Dynamics curriculum and a peer driven community that helps instill accountability, responsibility and structure in the lives of women as they change their behavior, attitudes and lifestyle to overcome addiction and any other barriers toward reaching self-sufficiency. A training component around culinary was created to help women secure employment. This is accomplished through the Center Table Catering. During the fiscal year 2014, The Brighton Recovery Center served 311 women and after 6 months, 87% reported no relapse after completion of Phase One of the program."
201520279349300737,610673886,709328,19477,"Family Center: For a family struggling to make ends meet, survival becomes a daily or even hourly battle of hard decisions. With a limited income, families often make sacrifices between eating, staying warm and paying for the roof over their heads. The rising cost of everyday and essential items make it even harder as incomes are not able to keep up. Our Family Center provides a vital point of entry to so many families who need immediate help, but we take it a step further by providing resources for the long-term to help families overcome the many barriers that have brought them to the brink. The Family Center brings together many vital services that help to put families on the right path so that their future is not only brighter but their dreams are also achievable. During the fiscal year of 2014, 9,217 individuals were served through the Family Center. Of those numbers, 6,805 were provided Emergency Assistance."
201520279349300737,610673886,592905,195746,"Financial Services: Brighton Center helps families reach financial stability through a variety of services that aim to educate, encourage and empower families to take charge of their money by making smart, informed decisions. When unexpected life events like unemployment, expensive medical bills or housing expenses create a barrier to achieving or maintaining a healthy financial picture, families can turn to Brighton Center for renewed hope and guidance to navigate tough situations. During the fiscal year of 2014, 2,587 were served through our Financial Services program. Of those, 98% of individuals increased their knowledge of and skills with budgeting, credit and banking, and 1,000 individuals were provided with foreclosure prevention counseling. Also our Volunteer Income Tax Assistance program completed 851 returns for a total of $1,092,128 in tax refunds."
201520289349300407,941021164,2414543,3174572,AUXILIARY: HOUSING AND FOOD SERVICES
201500309349301800,042111203,12662747,0,14047147,"Auxiliary Services includes providing high quality residence halls, food service, and book store services to Clark students. There are program expenditures of $12,662,747 and offsetting revenue of $14,047,147."
201500309349301800,042111203,11932432,0,2747586,"Student Services program supports an environment for students that encourages them to become active, involved and responsible citizens in global communities. Resources are expended to provide students support in achieving their non-academic goals and providing a balanced and healthy social environment."
201500359349301115,131988190,45031522,3803912,2472514,"STUDENT ADMINISTRATION (SS) - EXPENSES INCLUDE THOSE INCURRED FOR THE ADMINISTRATION OF STUDENT AFFAIRS AND FOR SERVICES TO STUDENTS, INCLUDING EXPENSES OF SUCH ACTIVITIES AS DEAN OF STUDENTS, ADMISSIONS, REGISTRAR, COUNSELING AND PLACEMENT SERVICES, STUDENT ADVISERS, STUDENT HEALTH AND INFIRMARY SERVICES, CATALOGS, AND COMMENCEMENT AND CONVOCATIONS."
201500359349301115,131988190,20061992,399870,2694939,"PROGRAMS AND PROJECTS FINANCED BY FEDERAL AND NON-FEDERAL AGENCIES AND ORGANIZATIONS, WHICH INVOLVE THE PERFORMANCE OF WORK OTHER THAN INSTRUCTION, ORGANIZED RESEARCH AND SPONSORED TRAINING.EXAMPLES OF SUCH PROGRAMS AND PROJECTS ARE HEALTH SERVICE PROJECTS AND COMMUNITY SERVICE PROGRAMS."
201500349349300965,910473310,28000,171882
201530369349300718,362181973,3870111,5368740,"OTHER PROGRAM SERVICE REVENUES AND EXPENSES INCLUDE INTEREST ON STUDENT LOANS AND PENALTIES, STUDENT HOUSING REVENUE AND OTHER PROGRAM SERVICES."
201510369349301501,930309970,893463,457922,"CONTINUING EDUCATION, AUXILIARY ENTERPRISES AND OTHER PROGRAMS."
201530349349300408,410693977,14815132,"PUBLIC SERVICE, ACADEMIC SUPPORT, AND STUDENT SERVICES (COMBINED)"
201500349349300345,742599785,2099213,"MISCELLANOUS INCOME-FACILITY USE FEES, CONFERENCE FEES, FORGIVENESS OF DEBT"
201530309349301318,620479365,0,0,FINANCIAL AID
201520419349301982,540505922,8370953,0,0,"Includes student services which consists of enrollment services, registrar, health and counseling services, student activities, sports, and recreation."
201520419349301982,540505922,3760349,0,0,"Includes academic support which consists of the College's library, art gallery, academic advising, career services, and other support services for the academic divisions."
201510409349300516,850197752,114726,678,Workforce Development Training - implements a multi-state workforce that will assist low-income individuals gain entry-level jobs in the that will assist low-income individuals gain entry-level jobs in the that will assist low-income individuals gain entry-level jobs in the
201530409349300913,310536647,7508520,Student Services
201510419349300416,440545914,1677289,782208,HARRIMAN-JEWELL PERFORMING SERIES
201510419349300416,440545914,137587,172600,PRYOR LEADERSHIP PROGRAM
201510419349300416,440545914,45218,160497,OTHER COMMUNITY PROGRAMMING
201500439349301630,660379122,119984,119984,"THE ORGANIZATION PROVIDES GRANTS TO LOW-INCOME STUDENTS, BASED ON ELIGIBILITY AND GRANTS FOR STUDENTS WITH ACADEMIC EXCELLENCE."
201530429349300323,382410852,25422317,179936,3982322,"All other Program Services includes Academic Support, Student Services, Institutional Services, and Auxiliary Services."
201500409349300435,540505945,3202187,0,0,"Other - Research, Public Support and Academic Support"
201520379349301252,381374230,18293787,0,53836361,"These additional program service expenses include, but are not limited to auxiliary services (bookstore, residential, dining), and plant and maintenance of campus grounds and buildings."
201500379349301315,530199507,7295498,48440,0,Research
201500379349301315,530199507,4336465,700,925172,Public Services
201540449349301939,941312349,5596120,0,0,Other services to students
201510479349302316,950549600,10604101,2727838,12998243,Cook School of Intercultural Studies
201510479349302316,950549600,6861277,1765020,8410383,School of Education
201510479349302316,950549600,6255407,1609164,7667722,Crowell School of Business
201510479349302316,950549600,1562351,401905,1915091,Interterm
201510479349302316,950549600,1462983,376343,1793288,Summer School
201520479349301632,570314374,"OTHER SERVICES INCLUDE A WIDE RANGE OF PROGRAMS INCLUDING RESEARCH, LIBRARY SERVICES, PUBLIC SERVICES, AND ACADEMIC SUPPORT."
201510449349302496,530196640,3585184,3317842,"AUXILIARY ENTERPRISES - THE COLLEGE'S DOMITORIES, DINING HALL AND THE TRINITY CENTER FOR WOMEN AND GIRLS IN SPORTS ARE THE MAJOR AUXILIARY ENTERPRISES SERVING THE CAMPUS COMMMUNITY. STUDENTS HAVE LIVING QUARTERS IN FOUR BUILDINGS ON CAMPUS."
201510449349302496,530196640,3961847,"ACADEMIC SUPPORT INCLUDES A 200,000 VOLUME ON-LINE LIBRARY, COMPUTER CENTER AND ADMINISTRATIVE OFFICE."
201530479349301393,362593545,4529332,1200793,"OTHER PROGRAM EXPENSES: - CENTER FOR CHILDREN AND FAMILIES - NEW SCHOOLS PROJECT - FUSSY BABY - FOSTER CHILD DEVELOPMENT, MONITORING & ASSESSMENTS - PROFESSIONAL DEVELOPMENT"
201540449349301824,620502739,8470235,10930300,"AUXILIARY SERVICES - OPERATED FOR THE CONVENIENCE OF STUDENTS, FACULTY, AND STAFF. INCLUDING RESIDENCE HALLS, DINING HALLS, CAMPUS BOOKSTORE, AND THE TELEPHONE SYSTEM"
201540449349301184,750827409,11062034,1035766,"STUDENT SERVICES SUCH AS EXTRA-CURRICULAR PROGRAMMING, HEALTH SERVICES, LOAN CANCELLATIONS FOR STUDENTS, OPERATION AND MAINTENANCE OF FACILITIES FOR INSTRUCTIONAL PURPOSES AS WELL AS ACADEMIC SUPPORT FACILITES."
201530449349301713,540506306,4483637,0,0,"Academic support areas at Bridgewater College include the academic advising center, the Alexander Mack Library, the writing center, the information technology center, the office of career services and the academic support center."
201510449349300026,141468399,296565,0,1095018,"OTHER SOURCES OF INCOME SUCH AS COMMUNITY EDUCATION, SUMMER CAMPS, AND INDIRECT COST RECOVERY."
201540449349301429,410747165,6724651,OTHER PROGRAM SERVICES INCLUDE OPERATIONS AND MAINTENANCE OF PLANT AND INSTITUTIONAL SUPPORT. THESE PROGRAMS PROVIDE SERVICES TO OPERATE AND MAINTAIN BUILDINGS AND GROUNDS AND TO SUPPORT INSTITUTIONAL OPERATIONS OTHER THAN MANAGEMENT AND GENERAL.
201520449349301697,741180151,1924791,OPERATION AND MAINTENANCE OF PLANT
201520449349300407,231433899,2010338,116222,1287601,MIXED USE FACILITIES
201500579349300805,362225483,97023,"POLICY AND ADVOCACY-THE DEVELOPMENT AND IMPLEMENTATION OF EDUCATION REFORM, JOBS, HOUSING AND GOVERNMENT PROJECTS"
201500579349300805,362225483,62500,GRANTS AND AWARDS
201520489349300107,236297362,"THE COUNCIL FOR RELATIONSHIPS PROVIDES A VARIETY OF RELATIONSHIP EDUCATION AND PERSONAL EMPOWERMENT PROGRAMS FOR THE GENERAL PUBLIC. IN ADDITION, THE COUNCIL MEETS THE NEED OF SPECIALIZED POPULATIONS SUCH AS VETERANS AND HOMELESS AND FORMERLY HOMELESS FAMILIES. THE COUNCIL PARTNERS WITH HEALTH AND SOCIAL SERVICE PROVIDERS TO BRING NEEDED COUNSELING SERVICES TO THEIR COMMUNITY LOCATIONS."
201500559349300515,420680466,410617,"PUBLIC SERVICE: OFFERINGS TO THE BROADER COMMUNITY INCLUDE A COLLEGE RADIO STATION, CONFERENCES AND SEMINARS, A PERFORMING ARTS SERIES, AND A VARIETY OF PROGRAMS IN THE ARTS, ATHLETICS, SCIENCES, AND LEADERSHIP DEVELOPMENT FOR HIGH SCHOOL STUDENTS."
201500559349300515,420680466,431992,"RESEARCH: THE COLLEGE RECEIVES GRANTS FOR FACULTY/STUDENT RESEARCH COLLABORATION, PARTICULARLY IN THE SCIENCES. THE COLLEGE DEDICATES SPACE, RESOURCES, AND FACULTY TIME FOR COLLABORATIVE INVESTIGATION WITH STUDENTS. RESEARCH PROJECTS ACROSS THE CURRICULUM OCCUR DURING THE ACADEMIC YEAR AND IN THE SUMMER."
201510449349301706,381459365,2038727,410767,"STUDENT SERVICES - ASSISTS STUDENTS AND PARENTS IN NAVIGATING THE WORLD OF COLLEGE FINANCES AND COURSEWORK. STUDENTS CAN REQUEST A TRANSCRIPT, MAKE A PAYMENT, RECEIVE FINANCIAL AID, BE ASSIGNED A WORK-STUDY JOB AND RECEIVE HELP WITH REGISTERING FOR CLASSES."
201510639349300336,952962604,11098492,116062,4631569,"HIGHER EDUCATION ACADEMIC SUPPORT DEPARTMENTS INCLUDE UNIVERSITY LIBRARY, COMPUTER & MEDIA LABS, AND FACULTY DEVELOPMENT PROGRAMS. PUBLIC SERVICE DEPARTMENTS INCLUDE THE DAY CARE CENTER, KCLU (PUBLIC RADIO STATION) AND EVENT SERVICES TO SERVE THE COMMUNITY (CLU ENROLLMENTS FOR FALL 2012 WERE 4,103 STUDENTS, 163 FULL-TIME & 210 ADJUNCT FACULTY, AND 347 STAFF)."
201510589349300401,751081109,4922175,4480960,OTHER PROGRAM SERVICES INCLUDE
201510589349300401,751081109,TRANSACTIONS INVOLVED WITH SUMMER
201510589349300401,751081109,"AND SPORTS CAMPS, EDUCATIONAL"
201510589349300401,751081109,"TRIPS, GOVERNMENT AND PRIVATE"
201510589349300401,751081109,"GRANTS FOR RESEARCH, AND THE"
201510589349300401,751081109,UNIVERSITY'S PERFORMING ARTS
201510589349300401,751081109,CENTER.
201530619349300303,910564993,11333620,0,0,Higher Education: Student Services for On-Campus and Extension Students leading to undergraduate and graduate degrees.
201500639349300210,582624570,7811754,227543,"Academic support - Expenditures integral to the operation and support of the academic services of the University.Auxiliary enterprises - Expenditures to provide services to student, faculty, and staff including housing, cafeteria, and bookstore."
201540659349300524,420681046,5010907,"STUDENT SERVICES: ATHLETICS, HEALTH SERVICES, ADMISSIONS AND FINANCIAL AID."
201500699349300310,240795506,10221573,"ACADEMIC SUPPORT INCLUDES FUNDS EXPENDED TO PROVIDE SUPPORT SERVICES FOR THE INSTITUTION'S PRIMARY MISSION OF INSTRUCTION, RESEARCH, AND PUBLIC SERVICE. THE ACADEMIC ADMINISTRATION OF THE UNIVERSITY INCLUDING THE ACADEMIC DEANS BUT NOT DEPARTMENT CHAIRS THAT ARE CHARGED TO THEIR PRIMARY FUNCTION CATEGORY ARE FOUND IN THIS PROGRAM. ALL SALARIES, BENEFITS, AND OTHER EXPENSES FOR THE LIBRARY ARE ALSO CONSIDERED ACADEMIC SUPPORT."
201500699349300310,240795506,1034944,"RESEARCH INCLUDES ALL EXPENDITURES FOR ACTIVITIES SPECIFICALLY ORGANIZED TO PRODUCE RESEARCH, WHETHER COMMISSIONED BY AN AGENCY EXTERNAL TO THE INSTITUTION OR SEPARATELY BUDGETED WITHIN THE UNIVERSITY. CHARGED TO THIS PROGRAM ARE EXPENDITURES RELATED TO THE INSTITUTE FOR PUBLIC POLICY AND ECONOMIC DEVELOPMENT, A PARTNERSHIP AMONG SEVERAL LOCAL COLLEGES WITH THE FUNCTION OF PRODUCING RESEARCH TO ASSIST COMMUNITY LEADERS IN MAKING INFORMED DECISIONS. IN ADDITION TO THIS, THE EXPENSES OF SEVERAL RESEARCH GRANTS ARE RECORDED TO THE RESEARCH CLASSIFICATION."
201500699349300310,240795506,773307,"PUBLIC SERVICE INCLUDES FUNDS EXPENDED FOR ACTIVITIES ESTABLISHED PRIMARILY TO PROVIDE NON-INSTRUCTIONAL SERVICES BENEFICIAL TO INDIVIDUALS AND GROUPS EXTERNAL TO THE UNIVERSITY. THE EXPENSES OF THE SMALL BUSINESS DEVELOPMENT CENTER, RADIO AND TELEVISION STUDIOS AND SEVERAL COMMUNITY LECTURE SERIES ARE AMONG THOSE POSTED TO THIS PROGRAM."
201520689349300347,930401259,9651339,0,0,"Student Services Programs: The University of Portland provides comprehensive support programs for our students to enable and promote their academic pursuits as well as their personal growth. Expenses in this category include International Student Services, Health and Career Services, Admissions, Registrar, Student Government and Activities, Financial Aid, and Intramurals."
201520689349300347,930401259,4149804,0,0,"Library Programs: The Wilson W. Clark Memorial Library serves the University of Portland community as a dynamic teaching library. The library accomplishes this through interactive instruction, by acquiring and organizing multi-format collections that support the curriculum, and by facilitating access to resources in the library and beyond."
201520659349300107,042103830,1638649,194450,2036836,"OTHER PROGRAM SERVICES SUCH AS BOOKBINDING, CARPENTRY MAKING, JEWELRY MAKING, LOCKSMITHING, PIANO TECHNOLOGY, VIOLIN, AND GALLERY."
201520659349300232,750926755,4459482,9105523,"AUXILIARY AND OTHER SUPPORT SERVICES: INCLUDES HOUSING AND BOARD REVENUE, RESEARCH AND ROME FACILITIES EXPENSES AND OTHER ASSOCIATED EXPENSES."
201520659349300232,750926755,673607,787033,"INSTITUTIONAL SUPPORT SERVICES: INCLUDES COSTS ASSOCIATED WITH THE UNIVERSITY EXECUTIVE OFFICE, ADMINISTRATIVE OFFICE AND BUSINESS OFFICE."
201530729349300518,660201206,17027954,1605246,201097,"Student Service - These are the expenditures for activities other than formal instruction that contribute to the student's emotional and physical well-being and to their intellectual, cultural and social development such as: student activities, cultural events, intramural athletics and others."
201530729349300518,660201206,15612540,175695,3942522,"Public Services - These are the expenditures mainly incurred for the operation of a non commercial television station providing educational and cultural programs to students and the community. Also included under this category are expenditures from activities developed for community service, mainly high school dropout students, socially and economically challenged students, academically outstanding students, and others."
201530729349300518,660201206,8256103,263129,7864912,"Academic Support - These are the expenditures incurred for activities and services to pursue the primary mission of the institution: instruction and research. Includes expenditures such as library books, audiovisual materials, those related to students retention, preservation and display of educational and historical materials, scientific displays and art objects."
201530729349300518,660201206,7437446,36935,388016,Research - These are expenditures incurred for activities developed to generate research outcomes that are carried out within academic departments. The research projects are commissioned by external agencies or separately budgeted by an organizational unit within the Institutions.
201530729349300518,660201206,2073160,48260,3404932,"Auxiliary Enterprises - These are the expenditures incurred for essentially self supporting operations of the institutions that exist to furnish a service to students, faculty and staff of the institutions, and incidentally to the general public. They include cafeterias, parkings, bookstores, and a printing shop."
201520769349300712,370661496,14568855,"PUBLIC SERVICE EVENTS CONSIST OF MUSIC AND/OR COMEDY CONCERTS, BUSINESS COALITION LUNCHES AND FAMILY FUN NIGHTS WHICH PROVIDE ENTERTAINMENT/ACTIVITIES THAT ARE OPEN TO THE GENERAL PUBLIC. DIFFERENT EVENTS ARE HELD THROUGHOUT THE ENTIRE ACADEMIC YEAR."
201530769349301008,930386858,21562327,53300,3194071,"OTHER EXPENSES RELATED TO (1) SCHOLARLY RESEARCH, (2) CAMPUS EVENTS FOR THE BENEFIT OF THE LOCAL COMMUNITY AND GENERAL PUBLIC, AND (3) AUXILIARY SERVICES SUCH AS RESIDENCE HALLS, FOOD SERVICE, CAMPUS BOOKSTORE, CONFERENCES AND COMPUTER PURCHASING PROGRAM."
201520729349300742,730739626,263819,0,0,"Research - Costs incurred to conduct biomedical, academic, and other related research."
201520729349300742,730739626,2228179,0,3449934,"GEB America - Costs to broadcast television programming that seeks to equip, empower, and educate through Spirit-Empowered Edu-tainment that will help viewers to live well - Spirit, Mind, and Body."
201520729349300602,610444708,1999113,17520,THE COLLEGE PROVIDES AUXILIARY SERVICES FOR STUDENTS AND FACULTY. THESE SERVICES INCLUDE FOOD SERVICES AND RESIDENCE HALL ACTIVITIES.
201510729349300421,530196549,61981368,Academic Support
201510729349300421,530196549,42185778,Student Services
201510729349300421,530196549,44023916,Institutional Support
201510729349300421,530196549,72553750,31175338,Research & Public Service
201520789349300747,620599339,14270516,14270516,"GRANTS & ALLOCATIONS - PROVIDES ASSISTANCE THROUGH FUNDED AND UNFUNDED SCHOLARSHIPS AND AWARDS TO THE APPROX 1,502 STUDENTS AND THROUGH GOVT FUNDED STUDENT FINANCIAL AID PROGRAMS TO APPROX 824STUDENTS QUALIFYING FOR GOVT ASSISTANCE."
201500839349300720,351087173,3018429
201540909349300434,860931108,805892,"OTHER PROGRAMS INCLUDE AGRICULTURAL EXTENSION SERVICES OFFERED TO THE COMMUNITY ($275,484) AND VARIOUS AUXILIARY SERVICES THAT CONTRIBUTE TO TOCC'S PROGRAM EXECUTION ($530,408)."
201540829349300234,273792158,82262,0,61680,"During this fiscal year, AIE - WA continued its work with Seattle Public Schools, offering a Work Skill Center, which caters to juniors and seniors in the school district. The Skill Center was established to educate Seattle high school students in the subject of interactive media, including game art and design and game programming. Interactive media represents a wide variety of new and emerging interactive industries and sectors, including video games, animation, film making, and other creative 3D applications. Students use a hands-on approach and work in a studio setting, emulating a real-world work environment. Students learn to use industry standard software, work independently and in teams, and develop a portfolio for ongoing educational and career opportunities. Additionally, program graduates earn high school credit upon successful completion of the course. This fiscal year, twenty four (24) students of the forty one (41) students who started the class successfully completed the course."
201540829349300234,273792158,30848,0,25564,"During the fiscal year, AIE-WA delivered 10 weeks of Summer Cyber Camps to approximately 52 high school students, of which several have attended multiple weeks. These camps were hosted at AIE - WA. Summer Cyber Camp is geared toward high school students seeking knowledge in 3D programing and computer animation and is one week in length. These short courses promote school exposure to the community it serves and is an introduction to courses students will enjoy at the college level. Successful Summer Cyber Camps are important to the school's purpose and mission as they are often the first contact students have with the school and its staff."
201540869349300429,382025701,1061543,24000,704629
201500899349300745,710239576,5311868,"Academic Support - JBU enriches the students' educational experience through academic support in the form of library services, registrar services, IT support, and faculty professional development."
201500899349300745,710239576,4247117,2150710,"Public Service - The University is also the home to two endowed centers, The Center For Relationship Enrichment, and the Soderquist Center for Business and Ethics. The University also owns and operates KLRC radio, a 100,000 watt FM radio station."
201540999349301034,720642832,999360,"ACADEMIC SUPPORT - PROFESSIONAL AND TECHNICAL SERVICES WERE DELIVERED TO STUDENTS THROUGH LIBRARY, COMPUTER AND SCIENTIFIC LABORATORIES, AUDIO-VISUAL, COUNSELING AND CAREER AND PLACEMENT ACTIVITIES WITHIN THE COLLEGE.TOTAL EXPENSES DURING THE CURRENT YEAR RELATED TO THE OTHER PROGRAM SERVICES LISTED ABOVE ARE:"
201520839349300777,910565571,7609010,596492,"#1 : OPERATION AND MAINTENANCE OF PLANT INCLUDING DEPRECIATION OF $5,068,648#2: RESEARCH#3: PUBLIC SERVICE#4: OTHER INSTITUTIONAL SUPPORT EXPENSES $7,609,010. INCLUDING GRANTS OF $ 0. REVENUE $596,492."
201520849349300107,660349669,8745719,0,11035119,Other program services - expenses incurred by the university in order to perform activities to complement its educational exempt purpose. Each program activities reported contributed importantly to the accomplishment of the UCC exempt purpose.
201530899349300023,362166962,9321839,0,8677221,"HIGHER EDUCATION: STUDENT SERVICES - SERVES THE STUDENT COMMUNITY BY PROVIDING REGISTRATION ASSISTANCE, COUNSELING, CAREER PLANNING, INTERNSHIPS, FINANCIAL ASSISTANCE, MULTICULTURAL PROGRAMMING, ORIENTATION AND ADVISING, INTRAMURAL SPORTS, AND OTHER RELATED PROGRAMS. (2,500 STUDENTS) HIGHER EDUCATION: PUBLIC SERVICES - INCLUDES A CENTER FOR COMMUNICATIVE DISORDERS, ART PROGRAMS, ALUMNI PROGRAMS, COMMUNITY SERVICE AND A NATIONAL PUBLIC RADIO STATION SERVING THE STUDENTS AND COMMUNITY. (2500 STUDENTS) HIGHER EDUCATION: RESEARCH - SUPPORTS EXTENSIVE OPPORTUNITIES FOR STUDENTS AND FACULTY TO CONDUCT RESEARCH ON AND OFF CAMPUS. (2,500 STUDENTS)"
201540989349300024,410695524,4132792,0,0,"4d: Gustavus offers a number of activities that enhance the curricular program, including various public service events and miscellaneous services provided to students."
201510989349300631,420680389,7733377,0,0,"Student Services Auxiliary Enterprises: Auxiliary enterprises including housing, food services and conferencing facilities available for student use. (1,773 students)"
