object_id,ein,ExpnsAmt,GrntAmt,RvnAmt,Dsc
201510859349300331,135562314,46449395,5829148,ACADEMIC SUPPORT
201510859349300331,135562314,41965940,5512133,STUDENT SERVICES
201510859349300331,135562314,4429431,1580442,RESEARCH
201520839349300852,420707114,542083,594405,TRIO GRANT PROGRAMS
201520839349300852,420707114,59701,COLISEUM OPERATIONS
201520829349300727,272990527,2001,0,20728,"During the fiscal year, AIE - LA delivered 6 weeks of Summer Cyber Camps to an approximately 70 high school students. AIE - LA in collaboration with Louisiana State University (LSU) and University of Louisiana - Lafayette (UL) delivered 3 weeks at the UL location and 3 weeks at the LSU location. Summer Cyber Camp is geared toward high school students seeking knowledge in 3D programing and computer animation and is one week in length. These short courses promote school exposure to the community it serves and is an introduction to courses students will enjoy at the college level. Successful Summer Cyber Camps are important to the school's purpose and mission as they are often the first contact students have with the school and its staff."
201501049349300005,160755807,11400922,855283,"STUDENT SERVICES INCLUDE ADMINISTRATION OF FINANCIAL AID PROGRAMS, ORIENTATION PROGRAMS, STUDENT COUNSELING, ADMISSIONS, AND RECORDS OFFICE."
201521049349300802,251120678,53556298,927171,"AUXILIARY ENTERPRISES: RESIDENCE HALLS, DINING HALLS, RECREATIONAL"
201521049349300802,251120678,"ACADEMIC SUPPORT: THESE ARE NOT DIRECT COSTS OF INSTRUCTION BUT COSTS THAT SUPPORT THE SCHOOLS BUT IN AND OF THEMSELVES GENERATE NO REVENUE. COSTS INCLUDE ACADEMIC SUPPORT COSTS SUCH AS THE DEANS OF THE SCHOOLS, IT, THE LIBRARY AND A LARGE PERCENTAGE OF INSTITUTIONAL SUPPORT (INSTITUTIONAL ADVANCEMENT, PUBLIC RELATIONS, HR, OFFICE OF PROVOST, FINANCIAL ADMINISTRATION, PUBLIC SAFETY, OFFICE OF PRESIDENT, GENERAL UNIVERSITY ADMIN #3250) AND AUXILIARY (FOOD SERVICE, GROUNDS AND BUILDING COSTS, CONFERENCE CENTERS, ISC OPERATIONS)."
201521049349300802,251120678,151454,0,0,"PUBLIC SERVICES: INCLUDES EXPENSES FOR ACTIVITIES THAT ARE ESTABLISHED PRIMARILY TO PROVIDE NON-INSTRUCTIONAL SERVICES BENEFICIAL TO INDIVIDUAL AND GROUPS EXTERNAL TO THE UNIVERSITY (CONFERENCES, INSTITUTES AND HIGH SCHOOL PROGRAMS)"
201531039349300733,111630830,167588363,78611826,"Higher Education: (Other Program Services) - St. Johns University is a Catholic Vincentian Metropolitan non-profit institution of higher learning. Approximately 15,773 undergraduate and 4,956 graduate students are currently enrolled in courses. (20,729 Students)"
201521009349300537,750800689,14850135,10459442,"ORGANIZED ACTIVITIES: ORGANIZED ACTIVITIES MAKE AVAILABLE TO THE PUBLIC VARIOUS RESOURCES THAT EXIST WITHIN THE UNIVERSITY SUCH AS SEMINARS, CONFERENCES AND CAMPS."
201501059349300245,362167770,10760271,0,11568798,"Auxiliary services are primarily the cost of providing housing to the students. 72% of the students lived on campus. Students come from 47 states and 79 countries. Other auxiliary programs include costs for faculty housing, printing services, summer conferences, and other services not directly related to the instruction of students."
201501049349301045,942356338,57850,PRESS - PRINT INSTRUCTIONAL MATERIALS AND TEXTS AND ARTICLES REALTED TO WALDORF METHOD OF EDUCATION.
201511059349301106,420680412,12986412,105128,6762053,"OTHER PROGRAM SERVICES INCLUDE AUXILIARY PROGRAMS SUCH AS HOUSING AND FOOD SERVICE, RESEARCH, PUBLIC SERVICE AND INSTITUTIONAL SUPPORT."
201521039349300437,370711798,MISCELLANEOUS
201541059349301404,741109661,15647149,1996161,Higher education: Student services:
201541059349301404,741109661,"Enrollment services, registrar, athletics,"
201541059349301404,741109661,health services and counseling.
201541049349300039,237121060,22064,SEE ADDITIONAL EXPLANATION ON SCHEDULE O FOR
201541049349300039,237121060,"FORM 990, PART III, LINE 4D"
201541009349300514,460280847,36459,Other student fees and program support revenue
201511039349300006,756001300,7353132,10163257,"AUXILIARY SERVICES - IN ORDER TO PROMOTE INTEGRATION OF FAITH AND LEARNING IN THE ACADEMIC SETTING, DBU PROVIDES AUXILIARY SERVICES TO OUR STUDENTS IN THE FORM OF RESIDENCE HALLS, APARTMENTS, TOWNHOMES AND DINING SERVICES. THESE SERVICES CREATE A COMFORTABLE ENVIRONMENT FOR ACADEMIC PURSUITS WHILE FOSTERING A SENSE OF COMMUNITY AMONG OUR DIVERSE STUDENT POPULATION, ENRICH THE COLLEGE EXPERIENCE AND PROVIDE LEADERSHIP OPPORTUNITIES TO SERVE THE ON-CAMPUS STUDENT BODY."
201531059349300223,340714626,21917589,3304590,"OTHER SERVICES: ACADEMIC SUPPORT, STUDENT SERVICES, ADMINISTRATIVE SERVICES AND OTHER AUXILIARY SERVICES."
201511049349301106,750827465,33008636,2675381,SEE SCHEDULE O
201501049349300235,362167048,51538327,32823073,Auxiliary Services
201501049349300235,362167048,64162437,5268428,Student Services
201501049349300235,362167048,9660903,111601,Public Service
201501049349300235,362167048,10436733,27432,Research
201521049349301037,141338562,51617275,93725,30577363,"HIGHER EDUCATION: OTHER: INCLUDES STUDENT SERVICES, ACADEMIC SUPPORT AND OTHER AUXILIARY ENTERPRISES. STUDENT SERVICES INCLUDES EXPENSES FOR ORGANIZATIONAL UNITS THAT PROVIDE SUPPORT TO STUDENTS. THESE UNITS INCLUDE HEALTH SERVICES, COUNSELING CENTER, ATHLETICS, INTERFAITH PROGRAMS, ETC. ACADEMIC SUPPORT INCLUDES ALL EXPENSES FOR ALL ACTIVITIES THAT ARE PART OF THE COLLEGE'S ACADEMIC MISSION. AUXILIARY ENTERPRISES INCLUDES EXPENSES FOR ORGANIZATIONAL UNITS THAT EXIST TO FURNISH GOODS OR SERVICES TO STUDENTS, FACULTY AND STAFF, AND THAT CHARGE A FEE DIRECTLY RELATED TO THE COST OF THE GOODS OR SERVICES. FACILITIES INCLUDE ELEVEN DORMS AND APARTMENT COMPLEXES PROVIDING HOUSING TO APPROXIMATELY 2150 STUDENTS, TWO DINING HALLS, A BOOKSTORE, SNACK BAR, CHILD CENTER, AND TELEPHONE SERVICES."
201531059349300108,042104149,3415012,429820,ACADEMIC SUPPORT: THE COLLEGE OFFERS SEVERAL ACADEMIC SUPPORT PROGRAMS INCLUDING STRUCTURED SEMESTER PROGRAMS AS WELL AS INDIVIDUALIZED TUTORING PROGRAMS. THE STUDENTS ALSO HAVE ACCESS TO A FULL SERVICE LIBRARY LEARNING CENTER AND ACADEMIC COMPUTING.
201531079349300308,581216007,373523,96600,RESEARCH
201531039349300443,590624458,231183143,17107398,167916800,"Expenses primarily represent auxiliary enterprises, including intercollegiate athletics, parking, student housing and student dining. Other program services revenues primarily represent auxiliary enterprises revenue, investment income, and investment losses."
201511279349301381,420703280,8997182,16182369,"AUXILIARY ENTERPRISES & ACTIVITIES: ST. AMBROSE UNIVERSITY PROVIDES FOOD SERVICE AND HOUSING FOR AN APPROXIMATE CAPACITY OF 1,700 STUDENTS."
201511279349301381,420703280,703883,INSTITUTIONAL SUPPORT OF THE UNIVERSITY IS ALSO PROVIDED BY THE OFFICES OF THE VICE PRESIDENT FOR ACADEMIC AND STUDENT AFFAIRS AND THE VICE PRESIDENT OF ENROLLMENT MANAGEMENT.
201511279349301381,420703280,2395291,OTHER PROGRAM SERVICES INCLUDES INTEREST EXPENSE.
201511279349301381,420703280,4660978,ACADEMIC SUPPORT
201511209349301156,430652667,4468733,"OTHER: OTHER SERVICES, INCLUDING ACADEMIC SUPPORT"
201511209349301156,430652667,1691479,LIBRARIES: LIBRARIES ON COLLEGE AND SCHOOL CAMPUS TO SUPPORT INSTRUCTIONAL ACTIVITIES
201521189349300822,951684064,1783541,2547485,"CONFERENCE CENTER:THE AMERICAN JEWISH UNIVERSITY CONFERENCE PROGRAM CONSISTS OF TWO CONFERENCE CENTERS; ONE AT THE FAMILIAN CAMPUS AND THE OTHER AT THE BRANDEIS-BARDIN CAMPUS.THE CONFERENCE CENTER AT THE FAMILIAN CAMPUS CAN ACCOMMODATE FACILITATES, CONVENTIONS, SEMINARS AND OTHER EDUCATIONAL AND CULTURAL MEETINGS.THE CONFERENCE CENTER AT THE BRANDEIS-BARDIN CAMPUS IS NATIONALLY RECOGNIZED AS A CENTER DEVOTED TO JEWISH LEARNING AND CULTURE. THIS LOCATION IS EQUIPPED FOR CELEBRATING JEWISH LIFECYCLE EVENTS AND AN IDEAL ENVIRONMENT FOR CREATIVE THINKING AND PRODUCTIVE COLLABORATION."
201521189349300822,951684064,421921,476290,STUDENT HOUSING
201521189349300822,951684064,750491,447644,216652,"OTHER PROGRAMS:THE PLATT AND BORSTEIN GALLERIES - PRESENT EXHIBITIONS AND EDUCATIONAL PROGRAMS IN THE VISUAL ARTS. SELECTED JEWISH AND NON-JEWISH ARTISTS BRING INSIGHT INTO CURRENT TRENDS AS WELL AS AN HISTORICAL PERSPECTIVE TO COMMUNITY LIFE. THE GALLERIES PROVIDE A VALUABLE AND NECESSARY AESTHETIC COMPONENT TO THE EDUCATIONAL GOALS OF AMERICAN JEWISH UNIVERSITY.UNIVERSITY WOMEN: HAS BEEN AN INTEGRAL PART OF AMERICAN JEWISH UNIVERSITY FOR 50 YEARS. THE MEMBERSHIP IS COMPRISED OF VOLUNTEERS WHO SEEK TO EXPRESS THEIR CULTURAL, ARTISTIC AND COMMUNITY INTERESTS WHILE SUPPORTING THE PROGRAMS OF AN INSTITUTION DEDICATED TO ACADEMIC EXCELLENCE.THE PROGRAMS AT UNIVERSITY WOMEN INCLUDE YOUNG ARTIST CONCERTS, SPECIAL INTEREST CLASSES AND PROGRAM MEETINGS WITH DISTINGUISHED SPEAKERS, AS WELL AS A HIGHLY REGARDED AUTHOR/ARTIST LUNCHEON."
201521199349301252,540525605,8419927,0,1416872,Shenandoah University's other program services not detailed in Part III include the maintenance of Shenandoah University's campuses.
201541249349300324,250981156,5030805,4208740,"ACADEMIC SUPPORT - SUPPORT FOR INSTRUCTION AND RESEARCH BY THE FOLLOWING DEPARTMENTS: DEAN OF THE COLLEGE, LIBRARY AND INFORMATION SYSTEMS, FACULTY DEVELOPMENT, ART GALLERY, HONORS PROGRAM, CHEMICAL HYGIENE, CULTURAL ARTIFACTS AND THE LEARNING CENTER."
201511249349301136,956151774,5405257,"CHARLES R. DREW UNIVERSITY IS ACTIVELY COMMITTED TO TRAINING FUTURE GENERATIONS TO MAKE A DIFFERENCE THROUGH A NUMBER OF NOVEL AND INNOVATIVE YOUTH EDUCATION ""PIPELINE PROGRAMS"" WHICH ARE UNIQUE AMONG MEDICAL EDUCATION PROGRAMS IN SOUTHERN CALIFORNIA. THE PIPELINE PROGRAMS HAVE TWO IMPORTANT GOALS: EXPOSE URBAN MINORITY STUDENTS TO SCIENCE STUDIES WHILE HELPING THEM DEVELOP A STRONG INTEREST IN SCIENCE AND RESEARCH, AND IMPROVE OPPORTUNITIES FOR URBAN MINORITY STUDENTS WHO WISH TO PURSUE CAREERS IN MEDICINE AND SCIENCE. THE PROGRAMS ARE A SERIES OF EDUCATIONAL STEPS THAT ESTABLISH AN ACADEMIC CONTINUUM IN MEDICAL EDUCATION. THE ACADEMIC CONTINUUM STARTS AT PRESCHOOL WITH THE SATURDAY SCIENCE ACADEMY (SSA) PROGRAMS, INCLUDING THE SSA JUNIOR WHITE COAT CEREMONY, AND EXTENDS UPWARD THROUGH THE LINCOLN-DREW ELEMENTARY SCHOOL (GRADES K-6). LINCOLN-DREW MIDDLE SCHOOL (GRADES 7 THROUGH 9) AND THE KING/DREW MAGNET HIGH SCHOOL OF MEDICINE AND SCIENCE (GRADES 10 THROUGH 12). THE WHITE COAT CEREMONY IS A NATIONWIDE MEDICAL SCHOOL ACTIVITY TO SIGNAL THE TRANSITION OF MEDICAL STUDENTS FROM BOOK LEARNING AND LAB WORK TO THE WORLD OF CLINICAL PRACTICE AND DIRECT INTERACTION WITH REAL PATIENTS. THE SSA JUNIOR WHITE COAT CEREMONY SEEKS TO EMBRACE THE SPIRIT OF THIS EXERCISE THROUGH ENCOURAGING STUDENTS TO COMMIT TO LIFELONG LEARNING."
201521219349300137,341018992,216078628,950786,"OTHER SPONSORED PROGRAMS: THE UNIVERSITY'S LIBRARY SYSTEM IS COMPOSED OF FOUR PRIMARY UNITS:' THE UNIVERSITY LIBRARY, THE CLEVELAND HEALTH SCIENCES LIBRARY, THE SCHOOL OF LAW LIBRARY AND THE LILLIAN & MILFORD HARRIS LIBRARY IN THE MANDEL SCHOOL OF APPLIED SOCIAL SCIENCES. THE LIBRARIES OF THE UNIVERSITY SUPPORT THE UNDERGRADUATE, GRADUATE AND PROFESSIONAL PROGRAMS AND CONTAIN 2.75 MILLION VOLUMES. CASE WESTERN RESERVE UNIVERSITY OFFERS ASSISTANCE TO ITS STUDENTS TO HELP MEET FINANCIAL NEED OR TO RECOGNIZE OUTSTANDING ACADEMIC ACHIEVEMENT AND PROMISE. ACADEMIC EXCELLENCE IS RECOGNIZED BY THE ACADEMIC AWARDS PROGRAM AND OTHER SCHOLARSHIP PROGRAMS OF THE UNDERGRADUATE COLLEGES AND BY VARIOUS ASSISTANTSHIPS, FELLOWSHIPS, SCHOLARSHIPS AND OTHER AWARDS OF INDIVIDUAL DEPARTMENTS IN THE SCHOOL OF GRADUATE STUDIES AND SEVERAL OF THE PROFESSIONAL SCHOOLS. CASE WESTERN RESERVE UNIVERSITY ACTIVELY PROMOTES THE DEVELOPMENT OF SERVICES AND PROGRAMS TO SUPPORT THE PHYSICAL, EMOTIONAL AND INTELLECTUAL WELL-BEING OF ITS STUDENTS.' THE PROGRAMS AND SERVICES ARE AVAILABLE TO UNDERGRADUATE, GRADUATE AND PROFESSIONAL STUDENTS ALIKE AND ARE DESIGNED TO PROVIDE POSITIVE, DEVELOPMENTAL OPPORTUNITIES BOTH TO SUPPLEMENT THE ACADEMIC EXPERIENCE AND ENRICH CAMPUS LIFE."
201540509349300304,330143620,45917
201531219349301403,390806428,1509603,"ACADEMIC SUPPORT: THE ACADEMIC DEAN'S OFFICE, LIBRARY SERVICES, AND ACADEMIC TECHNOLOGY, SUPPORTS THE INSTRUCTIONAL PROGRAM BY PROVIDING RESOURCES TO RECRUIT AND DEVELOP FACULTY AND OFFER ADDITIONAL LEARNING OPPORTUNITIES TO STUDENTS. OPPORTUNITIES ABROAD HAVE INCREASED FOR STUDENTS THROUGH MORE FORMAL COLLABORATIVE INSTRUCTIONAL AGREEMENTS WITH PARTNERS THAT ALLOW STUDENTS TO PARTICIPATE IN SEMESTERS AWAY, IN COUNTRIES/REGIONS WHOSE ECOLOGICAL SYSTEMS PRESENT RICH AND UNIQUE LEARNING OPPORTUNITIES. PUBLIC SERVICE: THROUGH COURSES, INTERNSHIPS, AND PROJECTS THAT SUPPORT REGIONAL ENVIRONMENTAL EFFORTS, WE ENCOURAGE STUDENT LEARNING IN WAYS THAT HAVE A POSITIVE IMPACT ON NATURE. TO PROVIDE A FOUNDATION FOR PERSONAL FULFILLMENT AND PROFESSIONAL SUCCESS, NORTHLAND GRADUATES ARE LEADERS IN GOVERNMENT, NOT-FOR-PROFIT ORGANIZATIONS, AND GREEN BUSINESSES. THESE PROGRAMS HELP COMMUNITY LEADERS CREATE AND EFFECT POSITIVE ENVIRONMENTAL CHANGE. ONE LONG-STANDING PROJECT IS LOONWATCH. OVER 300 CITIZEN SCIENTISTS COLLECT DATA ON WISCONSIN LAKES BY OBSERVING LOONS. THESE DATA BUILD CAPACITY FOR COLLABORATION BETWEEN STUDENTS, CITIZENS, AND LAKE MANAGERS TO WORK ON RESTORING AND PROTECTING AQUATIC SYSTEMS."
201521629349300312,951644037,14201776,0,3282182,PUBLIC SERVICE
201511189349300146,361521940,1558735,607637,"CLINIC OPERATIONS - LOMBARD CLINIC, LOMBARD RADIOLOGY CLINIC, AURORA CLINIC, CHICAGO CLINIC, ST PETERSBURG CLINIC, PINELLAS PARK CLINIC"
201511189349300146,361521940,1426869,1579080,"AUXILIARY ENTERPRISES - NUHS JOURNALS, RESIDENCE HALLS, RENTAL PROPERTIES, PARKING LOTS, CAMPUS BOOKSTORE"
201511189349300146,361521940,982231,"ACADEMIC SUPPORT - LEARNING RESOURCE CENTER, INSTITUTIONAL ANALYSIS, TRAINING AND ASSESSMENT CENTER"
201511189349300146,361521940,521510,"RESEARCH - GENERAL RESEARCH, RESEARCH GRANTS"
201511539349300616,370662594,"INSTRUCTION TO OVER 2,000 STUDENTS FOR BACCALAUREATE DEGREES IN THE LIBERAL ARTS AND SCIENCES, NURSING, FINE ARTS, DRAMA AND MUSIC. STUDENT SERVICES INCLUDE EDUCATION, HOUSING, AND BOARD."
201501349349306810,250983069,1063318,Public Service
201501349349306810,250983069,8753333,8753333,Student Assistance
201501349349306810,250983069,8855448,6128945,Auxiliary Service (Room and Board)
201501349349306620,042452884,4123307,INSTITUTIONAL SUPPORT RELATED EXPENSE
201511329349302751,251035663,8070947,91823,"MEDIA AND COMMUNICATION PROGRAMS, GENERAL/OTHER: PUBLIC SERVICE, PUBLIC RESEARCH PROGRAMS, 2,675 PHARMACY CUSTOMERS, 40,167 PRESCRIPTIONS DISPENSED, LAW LIBRARY PROGRAMS"
201511329349302751,251035663,7585833,4708,"SCIENCE & TECHNOLOGY RESEARCH, GENERAL/OTHER: RESEARCH -DHEW, NSF AND OTHER RESTRICTED FUNDS FOR RESEARCH (113 FUNDING AGENCIES)"
201501289349300145,237001501,2806470,19802,328286,RESEARCH AND CONFERENCES IN THE FIELD OF EARLY CHILDHOOD EDUCATION.
201501639349300970,942340692,1238323,194915,"GRONOWSKI CENTER -THE GRONOWSKI CENTER IS A PSYCHOLOGY TRAINING CLINIC DEDICATED TO PROVIDING COMPASSIONATE COUNSELING, SYCHOTHERAPY AND ASSESSMENT SERVICES TO ADULTS, OLDER ADULTS, COUPLES, ADOLESCENTS, CHILDREN AND FAMILIES IN SANTA CLARA COUNTY AND SAN MATEO COUNTY.THE CLINIC OFFERS SERVICES ON A SLIDING SCALE BASIS AS A PART OF ITS COMMUNITY MISSION. SERVICES ARE PROVIDED BY DOCTORAL LEVEL PSYCHOLOGY STUDENTS UNDER THE SUPERVISION OF LICENSED PSYCHOLOGISTS."
201511349349304781,042103594,114743000,2543000,212172000,"THIS ITEM CONSISTS OF OTHER EXPENDITURES (INCLUDING GRANTS) INCURRED, AND REVENUES GENERATED IN CONNECTION WITH MIT'S OTHER PROGRAM SERVICES RELATED TO VARIOUS ACTIVITIES IN FURTHERANCE OF AND IN SUPPORT OF MIT'S EXEMPT MISSION WHICH INCLUDED BUT WERE NOT LIMITED TO SUCH THINGS AS FEES AND SERVICES (FOR EXAMPLE, MEDICAL DEPARTMENT, TECHNOLOGY LICENSING OFFICE), AUXILIARY ENTERPRISES (FOR EXAMPLE, HOUSING, DINING), AND OTHER MISCELLANEOUS PROGRAM SERVICE REVENUE."
201521339349302947,363649217,21761930,12949504,14702252,SEE DESCRIPTION IN NOTE BELOW
201521339349302947,363649217,institution dedicated to programs
201521339349302947,363649217,of study including but not
201521339349302947,363649217,"limited to, degrees of nursing."
201501339349302930,042103607,2414682,2788421,"ENTERPRISE:THE MUSEUM'S RETAIL OPERATIONS OFFER FOR SALE IN ITS SHOPS OR THROUGH ITS WEB-BASED OUTLET A WIDE VARIETY OF MERCHANDISE RELATED TO THE MUSEUM'S COLLECTIONS AND SPECIAL EXHIBITIONS WHICH CONTRIBUTE IMPORTANTLY TO THE ACHIEVEMENT OF THE MUSEUM'S EXEMPT EDUCATIONAL PURPOSE BY MAKING WORKS OF ART FAMILIAR TO A BROADER SEGMENT OF THE PUBLIC. OFFERING AT THE SHOP INCLUDING ART BOOKS, POSTERS, CARDS, GLASS, TEXTILES, JEWELRY AND SCULPTURE.THE MUSEUM IS EXEMPT AS AN EDUCATIONAL ORGANIZATION ON THE BASIS OF ITS OWNERSHIP, MAINTENANCE, AND EXHIBITION FOR PUBLIC VIEWING OF WORKS OF ART. THE SALES OF SUCH ITEMS CONTRIBUTES IMPORTANTLY TO THE ACHIEVEMENT TO THE MUSEUM'S EXEMPT EDUCATIONAL PURPOSES BY STIMULATING AND ENHANCING PUBLIC AWARENESS, INTEREST, AND APPRECIATION OF ART. MOREOVER, A BROADER SEGMENT OF THE PUBLIC MAY BE ENCOURAGED TO VISIT THE MUSEUM ITSELF TO SHARE IN ITS EDUCATIONAL FUNCTIONS AND PROGRAMS AS A RESULT OF SEEING THE ITEMS SOLD."
201501339349302930,042103607,38451430,"OPERATING SUPPORT:OPERATING SUPPORT CONSISTS OF ALL OTHER AREAS OF THE MUSEUM, INCLUDING PROTECTIVE SERVICES, FACILITIES AND OTHER AREAS WHICH SUPPORT THE OPERATIONS OF THE MUSEUM AND ITS MISSION."
201501339349302930,042103607,966935,3681853,"PARKING FACILITIES:THE MUSEUM OWNS A PARKING GARAGE AND HAS TWO OPEN AIR PARKING LOTS. ALL OF THESE FACILITIES ARE OPEN TO MEMBERS AND VISITORS TO THE MUSEUM. THE OPERATION OF ADJACENT PARKING LOTS BY THE MUSEUM IN AREA OF INSUFFICIENT PARKING SPACES FOR THE USE OF ITS VISITORS CONTRIBUTES IMPORTANTLY TO THE MUSEUM'S EXEMPT PURPOSE BY ENCOURAGING VISITATION AND LONGER PERIODS VIEWING OF ITS COLLECTIONS, AND SPECIAL EXHIBITIONS. ANY PROFITS FROM THE FEE CHARGED FOR THE USE OF THE LOT IS PLACED IN THE GENERAL OPERATING FUND. ENCOURAGEMENT TO MUSEUM VISITATION, OF COURSE, IS PROVIDED THROUGH CONVENIENT PARKING."
201501339349302930,042103607,1149032,2560737,"FOOD SERVICES:THE MUSEUM IS ORGANIZED AND OPERATED AS AN ART MUSEUM. THE EATING FACILITIES ARE OPEN TO THE MUSEUM STAFF, EMPLOYEES, AND MEMBERS OF THE PUBLIC VISITING THE MUSEUM AND ARE OF A SIZE COMMENSURATE WITH ACCOMMODATION OF THESE SPECIAL GROUPS OF PATRONS. THE FACILITIES ARE ACCESSIBLE FROM THE MUSEUM'S GALLERIES AND OTHER PUBLIC AREAS BUT NOT DIRECTLY ACCESSIBLE FROM THE STREET. THE PATRONAGE OF THE EATING FACILITIES BY THE GENERAL PUBLIC IS NOT DIRECTLY NOR SOLICITED NOR ARE THE FACILITIES CONTEMPLATED OR DESIGNED TO SERVE AS A PUBLIC RESTAURANT BUT MERELY TO SERVE THE EXEMPT PURPOSES OF THE MUSEUM. THIS ALLOWS VISITORS TO DEVOTE MORE TIME TO THE MUSEUM'S EDUCATIONAL EXHIBITS, AND ENHANCES EFFICIENT MUSEUM OPERATION BY ENABLING STAFF TO REMAIN ON-SITE THROUGHOUT THE DAY. THE OPERATION OF THE EATING FACILITIES WITHIN THE MUSEUM PREMISES HELPS TO ATTRACT VISITORS TO THE MUSEUM EXHIBITS. BECAUSE THERE ARE PLACES OF REFRESHMENT IN THE MUSEUM VISITORS ARE ABLE TO DEVOTE A GREATER PORTION OF THEIR TIME AND ATTENTION TO THE MUSEUM'S COLLECTION, EXHIBITS AND OTHER EDUCATIONAL FACILITIES. THE MUSEUM CREATES AN EDUCATIONAL PROGRAM FOR ITS PARTICIPANTS, FOCUSING ON AN EXHIBIT, LECTURE OR TOUR FOR PRIVATE AND CORPORATE FUNCTIONS."
201501339349302930,042103607,3808229,6750693,"MEMBERSHIP & VISITORS:OVER 1,132,000 VISITORS ATTENDED THE MUSEUM DURING FISCAL YEAR 2014. THE MUSEUM HAS AN ADMISSION CHARGE; HOWEVER DURING THE FISCAL YEAR 2014, THERE WERE TEN COMMUNITY DAYS DURING WHICH ADMISSION CHARGES WERE WAIVED, AND THE MUSEUM HAS FREE ADMISSION ""PAY AS YOU WISH"" EACH WEDNESDAY EVENING. THE MUSEUM HAS 67,334 ACTIVE MEMBERS HOUSEHOLDS. THERE ARE 5 LEVELS OF ANNUAL MEMBERSHIP WITH FEES RANGING FROM $75 TO $2,999. EACH CATEGORY OFFERS A WIDE VARIETY OF PRIVILEGES, SUCH AS FREE ADMISSION, PUBLICATIONS, RECIPROCAL MEMBER BENEFITS AT OTHER MAJOR ART MUSEUM AROUND THE U.S. AND SPECIAL EVENTS."
201501339349302930,042103607,3792128,5172214,OTHER MISC. PROGRAM SERVICES:
201511339349306106,951664112,28494804,0,184066,OTHER-PUBLIC SERVICE
201511349349308446,470757164,200600882,19368627,218013356,"ALEGENT CREIGHTON HEALTH GIVES BACK TO OUR COMMUNITY THROUGH A VARIETY OF MEDICAL SERVICES AND PARTNERSHIPS. ALEGENT HEALTH QUICK CARE PROVIDES URGENT MEDICAL TREATMENTS, SCREENINGS AND ADULT IMMUNIZATIONS FOR PATIENTS 18 MONTHS AND OLDER. THROUGH OUR COLLABORATION WITH OTHER LOCAL COMMUNITY ORGANIZATIONS SUCH AS BOYS TOWN, CREIGHTON UNIVERSITY, OUR HEALTHY COMMUNITY PARTNERSHIP AND ONE WORLD COMMUNITY HEALTH CENTER, ALEGENT CREIGHTON HEALTH IS HELPING TO IDENTIFY AND ADDRESS COMMUNITY HEALTH NEEDS. IN ADDITION, ALEGENT CREIGHTON HEALTH ALSO PROVIDES THE FOLLOWING SERVICES: MATERNITY CARE SERVICES, MENTAL AND BEHAVIORAL HEALTH CARE, ONCOLOGY, PROCEDURE CENTER AND INPATIENT FACILITIES INCLUDING INTENSIVE CARE."
201501349349304930,580566167,29197305,3135244,Research
201501349349304930,580566167,47018706,34475424,Auxiliary Services
201501349349304930,580566167,23454922,Student Services
201501349349304930,580566167,5232767,Public Services
201501349349304930,580566167,440654,Other
201521329349301227,231355135,154834,190270,Continuing Medical Education
201521339349303632,591083502,144138922,13707779,31038827,"Other program services include: Public Service, Research and Agency Services. Nova Southeastern University goes beyond its primary mission of providing school and university curricula by reaching out to the community with diverse service and clinical programs, community-based research, and resources. NSU is designated by Carnegie Foundation with it's prestigious ""community-engaged"" designation, has been rated one of the Top 20 Colleges in the Nation Committed to Community Service by BestCollegesOnline, and most recently, was named to the 2013 President's Higher Education Community Service Honor Roll. The university continues to grow its research activities. In 2014, NSU broke ground on the new Center for Collaborative Research, a 215,000-square-foot facility that will house an IBM supercomputer, one of Florida's largest wet labs, the NSU Technology Incubator and some of the world's most accomplished researchers."
201511329349302781,741233796,6991604,13102399,Auxiliary Enterprises
201511349349300326,250965600,11917952,0,38075698,"OTHER PROGRAM SERVICES INCLUDE A MULTITUDE OF ACTIVITIES PERFORMED BY THE HOSPITAL TO DO BUSINESS IN THE COMMUNITY AND PROVIDE VALUABLE COMMUNITY BENEFITS. ACTIVITIES IN THIS CATEGORY INCLUDE, BUT ARE NOT LIMITED TO, A TEENAGE ABSTINENCE EDUCATION PROGRAM, A FAMILY PRACTICE RESIDENCY PROGRAM, A SCHOOL OF NURSING, A SCHOOL FOR X-RAY TECHNICIANS, HOSPICE SERVICES, CERTAIN EMERGENCY DEPARTMENT SERVICES, OPERATION OF A WELLNESS CENTER, RENTAL ACTIVITIES, AND OPERATION OF AN EMPLOYEE CAFETERIA."
201511349349300336,450273403,12322313,272235,761462,"Educational Plant Operations, Financial Affairs, General Institutional, Public Affairs, Enrollment Services, and all other services including General Administration, Academic Affairs, Student Development, and Student Senate."
201501349349307970,340714654,11702962,299508,2112772,"Research Programs, Public & Academic Support"
201511339349303971,540505972,758486,80322,"AUXILIARY SERVICES - OPERATION OF RESIDENCE HALLS, BOOKSTORE AND DINING FACILITIES FOR THE BENEFIT OF STUDENTS."
201511349349301561,250969449,18002458,0,16579250,"OTHER PROGRAM SERVICES:OTHER FEES AND MEMBERSHIPS, EXTERNAL SUPPORT AND SERVICES AND OTHER MISCELLANEOUS PROGRAM SERVICE REVENUE THAT SUPPORTS THE INSTRUCTION, RESEARCH, AND AUXILIARY FUNCTIONS OF THE UNIVERSITY."
201511339349305561,581825259,18944071,3134866,"OTHER PROGRAM SERVICES: ADDITIONAL PROGRAM SERVICES EXPENDITURES AT CLARK ATLANTA UNIVERSITY INCLUDE PUBLIC SERVICE ($1,798,196), ACADEMIC SUPPORT ($8,635,177) AND STUDENT SERVICES ($8,510,698)"
201511349349303201,570352247,940782,1214951,"PINE VIEW APARTMENTS IS A 136-UNIT HOUSING COMMUNITY LOCATED ON THE WOODED HILLSIDES ADJACENT TO THE CORE CAMPUS. DURING THE 2013-2014 SCHOOL YEAR, IT SERVED AS HOME TO 350 CIU STUDENTS, STAFF MEMBERS, AND THEIR FAMILY MEMBERS."
