object_id,ein,ExpnsAmt,Dsc
201641379349306174,430719506,2407705,63800,"Academic support: The College works to provide students with academic support at every stage of their Covenant education. In addition to highly qualified staff, the Covenant library is networked with more than 18,000 other institutions worldwide, providing interlibrary loan access and document delivery services to over 1.3 billion library items. Our library was eleventh in the world to go live with the Online Computer Library Center's new cloud-based operating system, Web-scale Management Service. Covenant's writing center is located in the library, providing students one-on-one tutoring for essays, research papers, and any writing-related assignments. The Office of Academic Affairs at Covenant works to provide support for deans and faculty members as they seek to provide a rigorous education to Covenant students. Covenant's master of education and master of arts in teaching degrees offered by the graduate school of education at Covenant provide students with the exceptional opportunity of completing a master's degree in one year.Covenant's Maclellan Scholars program offers courses designed to encourage critical thinking and develop the skills of potential Christian leaders. Students in the program travel internationally while at Covenant and demonstrate leadership through student-initiated projects."
201631379349304383,540506457,10859317,13267848,"AUXILIARIES - THE TWO MAJOR AREAS OF AUXILIARIES ARE RESIDENCE LIFE AND DINING SERVICES. RESIDENCE LIFE INCLUDES RESIDENTIAL FACILITIES AND STAFF THAT SUPPORT THE ON CAMPUS STUDENT HOUSING EXPERIENCE. DINING SERVICES INCLUDES FOOD COST, STAFF THAT SUPPORT THE PREPARATION AND SERVING OF MEALS TO STUDENTS, FACULTY, AND STAFF AS WELL AS OTHER EXPENSES ASSOCIATED WITH THIS SERVICE. SUBWAY AND PAPA JOHN'S ARE TWO FRANCHISES THAT PROVIDE ADDITIONAL DINING OPTIONS FOR DINING ON CAMPUS. THERE ARE ALSO VARIOUS VENDING MACHINE LOCATIONS, A NEWS CAFE, AND A FERRUM MERCANTILE DINING FACILITY. SUMMER PROGRAMS, BOTH RELATED AND UNRELATED, ARE INCLUDED. RENTAL INCOME FROM FACULTY/STAFF HOUSING IS PART OF THE AUXILIARY REVENUE AND EXPENSE."
201601379349308470,430652617,4598434,4399249,"AUXILIARY OPERATIONS- RESIDENCE HALLS, BOOK STORE, DINING HALL."
201601379349308470,430652617,2280035,ACADEMIC SUPPORT - NUMBER BENEFITED - 944 STUDENTS FALL 2014 AND 888 STUDENTS SPRING 2015
201611349349300231,160743088,18162187,1116737,"ALL OTHER PROGRAM EXPENSES, INCLUDES STUDENT SERVICES, ACADEMIC SUPPORT AND ARTS CENTER. STUDENT SERVICES PERTAINS TO OFFICES SERVING STUDENTS INCLUDING REGISTAR, STUDENT DEVELOPMENT, CENTER FOR CIVIC ENGAGEMENT, CAREER SERVICES, ENROLLMENT MANAGEMENT AND CENTER FOR STUDENT SUCCESS. ATHLETIC EXPENSES ARE ALSO REFLECTED IN THIS CATEGORY. ACADEMIC SUPPORT PERTAINS TO LIBRARY SERVICES, ACADEMIC ADVISEMENT, THE CENTER FOR INTERNATIONAL EDUCATION AND THE OFFICES OF THE DEANS, AMONG OTHERS. THE ARTS CENTER IS A PREMIER PRESENTER OF WORLD-CLASS DANCE, MUSIC, CHILDREN'S AND FAMILY THEATRE, AND INTERNATIONAL ENTERTAINMENT. THE ARTS CENTER HOUSES THE COLLEGE'S DEPARTMENTS OF ART, MUSIC, AND THEATRE ARTS. (2582 TOTAL STUDENT FTE'S)"
201611379349308726,741238438,2983304,833736,Student Support Services and Auxilliary Enterprises This function shall include funds expended for all This function shall include funds expended for all This function shall include funds expended for all This function shall include funds expended for all This function shall include funds expended for all
201601379349303135,911160585,4798665,1250625,"GENERAL INSTITUTION AND OPERATING EXPENSES AND INCOME, ALONG WITH AUXILARY ENTERPRISES."
201631379349302098,630417508,53597,THE UNIVERSITY FURNISHES A BOOKSTORE FROM WHICH STUDENTS ARE ABLE TO PURCHASE BOOKS AND SUPPLIES NECESSARY FOR THEIR STUDIES:
201631379349302098,630417508,58709,"THE UNIVERSITY FURNISHES DINING FACILITIES FOR THE CONVENIENCE OF STUDENTS, FACULTY AND STAFF:"
201631379349303163,951890710,26969468,54882189,AUXILIARY ENTERPRISES AND ACADEMIC SUPPORT.
201641349349302639,112157078,18059800,18059800,18059800,SCHOLARSHIPS & TUITION REDUCTIONS
201641349349305484,061627882,278307,"THE GOODWIN COLLEGE SENIOR MAGNET ACADEMY IS A PROGRAM FOR COLLEGE-READY HIGH SCHOOL SENIORS OFFERING A CHOICE OF CREDIT-BEARING GOODWIN COLLEGE COURSES IN ENGLISH, MATHEMATICS, PSYCHOLOGY, BUSINESS ADMINISTRATION, CRIMINAL JUSTICE, ADVANCED MANUFACTURING, SOCIOLOGY, AND COMPUTER LITERACY. STUDENTS CAN TAKE FOUR 3-CREDIT COURSES THROUGH THE FALL, SPRING, AND SUMMER SEMESTERS WHILE REMAINING AT THEIR OWN HIGH SCHOOLS FOR ALL OTHER ACTIVITIES. SPECIALIZED ACADEMIC SUPPORTS ARE AVAILABLE AND PARTICIPANTS CAN UTILIZE ALL CAMPUS RESOURCES. STUDENTS MUST BE IDENTIFIED THROUGH PARTICIPATING HIGH SCHOOL GUIDANCE DEPARTMENTS AS MEETING GOODWIN COLLEGE ACADEMIC REQUIREMENTS."
201621379349306147,480577656,2240385,56761,158851,"INSTITUTIONAL SUPPORT - FOR CENTRAL CHRISTIAN COLLEGE OF KANSAS IS PROVIDED BY THE VARIOUS ADMINISTRATIVE OFFICES INCLUDING PRESIDENT, BUSINESS OFFICE, AND THE DEVELOPMENT OFFICE. IN ADDITION TO PROVIDING THE GENERAL ADMINISTRATION OF THE INSTITUTION, THESE SUPPORT OFFICES ARE ALSO INSTRUMENTAL IN RAISING THE ADDITIONAL CONTRIBUTED FUNDS THAT ARE NECESSARY FOR CONTINUED EXISTENCE OF THE COLLEGE."
201601349349301610,742599785,222585,"MISCELLANOUS INCOME-FACILITY USE FEES, CONFERENCE FEES"
201601379349302905,741180151,2302221,OPERATION AND MAINTENANCE OF PLANT
201621379349310107,951816009,113647106,9939608,62074875,"LLU ALSO OPERATES SCHOOLS OF BEHAVIORAL HEALTH, NURSING, PUBLIC HEALTH, PHARMACY AND RELIGION. OUR INTEGRATED FOUNDATION DIVISION MANAGES OUR TRUST AND ENDOWMENT PORTFOLIOS, AND REAL ESTATES AND RETAIL SERVICES (SUCH AS THE BOOK STORE AND MARKET). SUPPORTING SERVICES OPERATED BY LLU INCLUDE STUDENT SERVICES ACADEMIC AFFAIRS, ATHLETIC FACILITIES, FOOD SERVICES, GENERAL AND FINANCIAL ADMINISTRATION, INFORMATION SYSTEMS, CO-GENERATION FACILITY AND MAINTENANCE."
201611349349304156,060647016,24201,OTHER
201601269349301005,550792184,27411,TUITION
201641379349303869,540534105,8178233,734303,"Student Services - admissions, financial aid,"
201641379349303869,540534105,"career planning, Chaplain, Dean, Health"
201641379349303869,540534105,center and Registrar
201611389349300446,042103639,1768510,0,1893766,"Personal Social Services: Expenses incurred in connection with sponsored activities such as: research, public service and student internships."
201641239349300714,431781928,13028,OPERATING A CHRISTION COLLEGE
201621349349303092,231413680,175099,hafter center fees
201600469349301925,410693960,7788799,0,4931517,"Auxiliaries - Expenditures for primarily student housing, etc."
201600469349301925,410693960,1404243,0,0,Other Program Services - Expenditures of those offices and activities whose primary purpose is to support the program activities of the University.
201611339349301696,660349669,7974949,0,9318150,Other program services - expenses incurred by the university in order to perform activities to complement its educational exempt purpose. Each program activities reported contributed importantly to the accomplishment of the UCC exempt purpose.
201621069349300322,610482955,4961594,1927467,"ACADEMIC SUPPORT, LIBRARY AND COMPUTER TECHNOLOGY SERVICES, SUPPORT FOR THE FOUR ACADEMIC DIVISIONS"
201621069349300332,362167770,10099322,0,12134599,"Auxiliary services are primarily the cost of providing housing to the students. 72% of the students lived on campus. Students come from 47 states and 79 countries. Other auxiliary programs include costs for faculty housing, printing services, summer conferences, and other services not directly related to the instruction of students."
201601199349300415,540525605,8905443,0,1013380,Shenandoah University's other program services not detailed in Part III include the maintenance of Shenandoah University's campuses.
201610819349300216,912157623,68230,0,66252,"PINCHOT UNIVERSITY BEGAN OFFERING THE ORGANIZATION SYSTEMS RENEWAL (OSR) GRADUATE PROGRAM, A MASTER OF ARTS IN ORGANIZATIONAL LEADERSHIP DEGREE, IN JANUARY 2013. OSR'S MISSION IS TO DEVELOP COMPETENCE AND CONFIDENCE IN DESIGNING AND LEADING ORGANIZATIONS. FURTHERMORE, THE INTENTION OF THE OSR PROGRAM IS TO HELP STUDENTS DEVELOP AND EXPAND THEIR LEADERSHIP SKILLS AND CAPACITIES IN ORDER TO BECOME INSTRUMENTS OF INNOVATION, RENEWAL, HEALTH, AND WHOLENESS IN ORGANIZATIONS AND IN THE WORLD."
201610819349300216,912157623,44307,0,20146,"PINCHOT HAS CONTINUED TO EXPAND ITS EDUCATIONAL PURPOSE AND PROGRAMS THROUGH THE CONTINUING DEVELOPMENT AND DEPLOYMENT OF CURRICULUM AND OTHER EDUCATIONAL RESOURCES FOCUSED ON SUSTAINABILITY. SUSTAINABILITY REFERS TO BOTH ENVIRONMENTAL PROTECTION AND SOCIAL JUSTICE, WITH A PARTICULAR FOCUS ON POVERTY ALLEVIATION AND OTHER ASPECTS OF HUMAN HEALTH AND WELFARE. AS HAS BEEN THE CASE FROM ITS INCEPTION, THESE NEW EDUCATIONAL ACTIVITIES INITIATED BY PINCHOT INCLUDE BOTH ACADEMIC AND SERVICE LEARNING ELEMENTS.IN APRIL 2013, PINCHOT ESTABLISHED THE CENTER FOR INCLUSIVE NTREPRENEURSHIP (CIE). CIE OFFERS WORKSHOPS AND ONE-TO-ONE OPPORTUNITIES THROUGH WHICH PINCHOT CURRICULUM AND OTHER RESOURCES SERVE SOCIETY'S INTEREST IN REDUCING POVERTY THROUGH SELF-EMPLOYMENT AND VERY SMALL SCALE ENTERPRISE, PARTICULARLY WHERE INDIVIDUALS FROM LOW-INCOME COMMUNITIES HAVE NO MEANINGFUL PATH OUT OF POVERTY THROUGH EMPLOYMENT. CIE PROCEDURES ARE INTENDED TO SCREEN PARTICIPANTS SO THAT ONLY LOW-INCOME INDIVIDUALS PARTICIPATE IN CIE PROGRAMS. CIE PROGRAM PARTICIPANTS ARE NOT CHARGED FOR THE EDUCATION AND TRAINING CIE PROVIDES.CIE'S ACTIVITIES INCLUDE THE DEVELOPMENT OF ADDITIONAL EDUCATIONAL PROGRAMS AND RESOURCES TO SERVE THIS POVERTY ALLEVIATION MISSION. THE SUBJECT MATTER OF THE MORE RECENTLY DEVELOPED PROGRAMS AND CURRICULA, OFFERED OR USED IN BOTH GROUP AND ONE-TO-SETTINGS, INCLUDE WORKER-OWNED COOPERATIVES AND SMALL SCALE FOOD PROCESSING, IN EACH CASE CONSISTENT WITH THE MISSION OF IMPROVING THE WELFARE OF INDIVIDUALS IN POVERTY. FORMALLY AND OTHERWISE, PINCHOT STUDENTS HAVE BECOME INVOLVED IN CIE ACTIVITY AS A PART OF THEIR EDUCATIONAL EXPERIENCE."
201620479349302407,541257935,275099,0,All other expenses
201600479349301710,620488046,9264932,0,0,"Public, Society Benefit Programs, General/Other: Funds expended for activities that are established primarily to provide non-instructional services beneficial to individuals and groups external to the institution. Cost of providing health services to the community. (Number of patient encounters for year: 176,974)."
201610849349301006,591023117,1724514,2285629,"CLASSICAL MUSIC IS PROVIDED TO THE UNIVERSITY COMMUNITY AS WELL AS THE GENERAL PUBLIC BY STUDENTS AND FACULTY IN THE LYNN UNIVERSITY CONSERVATORY OF MUSIC. ADDITIONALLY, PROFESSIONAL ACTORS AND MUSICIANS PERFORM ON CAMPUS IN THE PERFORMING ARTS CENTER. MANY OPPORTUNITIES ARE PROVIDED IN THE REALM OF ""IDEAS,"" THROUGH LECTURES AND COMMUNITY DISCOURSE. DURING THE SUMMER MONTHS BETWEEN ACADEMIC YEARS FOR TRADITIONAL COLLEGE STUDENTS, A PORTION OF THE UNIVERSITY'S EDUCATIONAL FACILITIES ARE USED TO PROVIDE INSTRUCTION TO A COMBINED ENROLLMENT OF APPROXIMATELY 1,500 CHILDREN ATTENDING THREE THREE-WEEK SUMMER CAMP SESSIONS AND TO GROUPS OF ADULTS ENROLLED IN SPECIAL EDUCATIONAL PROGRAMS."
201611339349304371,430654854,4155078,5116111,HIGHER EDUCATION AUXILIARY EXPENSES - EXPENSES FOR ROOM AND BOARD FOR OVER 600 STUDENTS LIVING ON CAMPUS
201611339349304371,430654854,1434051,384237,"EDUCATIONAL DELIVERY, GENERAL/OTHER ACADEMIC SUPPORT - MISCELLANEOUS OTHER SUPPORT FOR EDUCATIONAL PROGRAMS"
201611379349302081,720423889,116600000,0,77554000,"Higher Education: Auxiliary Enterprises: This category includes services that support educational activities and athletic expenditures. Services include bookstore, student housing, vending and food administration and campus recreation. (13,449 students)"
201610889349300236,160746864,14088640,2707412,ACADEMIC SUPPORT & STUDENT SERVICES: TO SUPPORT THE INSTRUCTION FUNCTION.
201611379349302956,580603153,7651273,7651273,"Financial Aid - Scholarships and other financial assistance for students attending the University. (1,064 students)"
201601349349306155,581825259,17920674,2221371,"OTHER PROGRAM SERVICES: ADDITIONAL PROGRAM SERVICES EXPENDITURES AT CLARK ATLANTA UNIVERSITY INCLUDE PUBLIC SERVICE ($1,946,124), ACADEMIC SUPPORT ($8,299,606) AND STUDENT SERVICES ($7,674,944)"
201610919349300916,135562314,45945839,7041217,ACADEMIC SUPPORT
201610919349300916,135562314,41073659,5383735,STUDENT SERVICES
201610919349300916,135562314,4253166,1785397,RESEARCH
201611339349305586,580566243,420729,PUBLIC SERVICE
201611339349305586,580566243,7902675,ACADEMIC SUPPORT
201611339349305586,580566243,11286459,STUDENT SERVICES
201611339349305586,580566243,3999795,RETURN OF GIFT
201620509349301202,751081109,5079614,4489380,OTHER PROGRAM SERVICES INCLUDE
201620509349301202,751081109,TRANSACTIONS INVOLVED WITH SUMMER
201620509349301202,751081109,"AND SPORTS CAMPS, EDUCATIONAL"
201620509349301202,751081109,"TRIPS, GOVERNMENT AND PRIVATE"
201620509349301202,751081109,"GRANTS FOR RESEARCH, AND THE"
201620509349301202,751081109,UNIVERSITY'S PERFORMING ARTS
201620509349301202,751081109,CENTER.
201610459349300726,941312349,4647962,0,0,Other services to students
201610929349300431,381308480,642751,2478,"THE WALSH COLLEGE LIBRARY COLLECTION CONSISTS OF APPROXIMATELY 32,000 VOLUMES TOTALLY FOCUSED TO SUPPORT THE BUSINESS PROGRAMS OFFERED AT WALSH. IN ADDITION, THERE ARE OVER 2,000 E-BOOKS AND 73 ONLINE DATABASES."
201611379349304986,880435559,1417516,587418,PUBLIC SERVICES
201620889349300332,410695524,2572892,0,0,"Gustavus offers a number of activities that enhance the curricular program, including various public service events and miscellaneous services provided to students."
201621249349300032,941156266,13103511,0,0,RESEARCH: INCLUDES EXPENDITURES FOR ACTIVITIES SPECIFICALLY DESIGNED TO PRODUCE HIGH-QUALITY RESEARCH OUTCOMES WHILE PROVIDING HANDS-ON RESEARCH TRAINING TO BOTH UNDERGRADUATE AND GRADUATE STUDENTS.
201621249349301257,350868107,12560775,17457379,"COMMUNITY SERVICES IS THE PUBLIC SERVICE ARM OF THE UNIVERSITY, IT CONSISTS OF PROVIDING SERVICE TO THE COMMUNITY AT LARGE, ESPECIALLY PROVIDING SERVICES FOR THE AGING THROUGH THE CENTER FOR AGING AND COMMUNITY. THROUGH GRANT AND CONTRACTS WITH THE STATE AND PRIVATE AGENCIES, ASSISTANCE AND TRAINING IS PROVIDED FOR THE AGING BOTH IN QUALITY OF LIVING AND STAYING ENGAGED IN THE WORKFORCE. AUXILIARY SERVICES CONSIST MAINLY OF THE HOUSING AND DINING FACILITIES THAT SERVE STUDENTS ON CAMPUS. THE MAIN FUNCTION IS TO PROVIDE A HEALTHY AND PLEASANT ENVIRONMENT TO ENHANCE THE STUDENTS' ACADEMIC AND SOCIAL NEEDS."
201601379349308465,580566116,8040834,87522,9183441,OTHER PROGRAM SERVICES
201611319349302376,520591613,312246,0,397535,The College provides summer programming to a variety of constituencies.
201611069349300826,942356338,50197,527316,119586
201611329349302281,210650678,16836681,67517,27371958,"ACADEMIC SUPPORT (EXPENSES $15,168,365 INCLUDING GRANTS $0) (REVENUE $24,660,280) - GENERAL SUPPORT TO THE STUDENTS. THESE INCLUDE ACADEMIC INFORMATION TECHNOLOGY, DEAN'S OFFICES, LIBRARIES, THEATER, ART GALLERY, TV STUDIO, AND OTHER SIMILAR ACADEMIC ACTIVITIES.RESEARCH (EXPENSES $1,668,316 INCLUDING GRANTS $67,517) (REVENUE $2,711,678) - RESEARCH PERFORMED BY FACULTY AND STUDENTS."
201611329349302326,520595110,47493000,LIBRARIES
201611349349305746,540505990,15194001,33007295,"STUDENT SERVICES - ALL OFFICES WHICH RENDER SERVICES TO THE EMOTIONAL WELL-BEING OF OUR STUDENTS: VICE PRESIDENT FOR STUDENT AFFAIRS, DEAN OF ADMISSIONS, REGISTRAR, TESTING, ETC."
201620979349300707,581216007,532415,104551,RESEARCH
201600979349300030,590624458,245113566,23427544,235751287,"Expenses primarily represent auxiliary enterprises, including intercollegiate athletics, parking, student housing and student dining. Other program services revenues primarily represent auxiliary enterprises revenue, investment income, and investment losses."
201620609349300622,410695527,6368964,1362381,"INSTITUTIONAL SUPPORT, INCLUDING OPERATION OF PLANT AND DEPRECIATION."
201621009349300217,756001300,7377426,10394215,"AUXILIARY SERVICES - IN ORDER TO PROMOTE INTEGRATION OF FAITH AND LEARNING IN THE ACADEMIC SETTING, DBU PROVIDES AUXILIARY SERVICES TO OUR STUDENTS IN THE FORM OF RESIDENCE HALLS, APARTMENTS, TOWNHOMES AND DINING SERVICES. THESE SERVICES CREATE A COMFORTABLE ENVIRONMENT FOR ACADEMIC PURSUITS WHILE FOSTERING A SENSE OF COMMUNITY AMONG OUR DIVERSE STUDENT POPULATION, ENRICH THE COLLEGE EXPERIENCE AND PROVIDE LEADERSHIP OPPORTUNITIES TO SERVE THE ON-CAMPUS STUDENT BODY."
201640639349300019,462847593,3058839,MEMBERSHIP DUES FROM MEMBER SCHOOLS.
201611059349300821,420680412,13264872,136508,6516860,"OTHER PROGRAM SERVICES INCLUDE AUXILIARY PROGRAMS SUCH AS HOUSING AND FOOD SERVICE, RESEARCH, PUBLIC SERVICE AND INSTITUTIONAL SUPPORT."
201641379349302134,942340692,1432657,214017,"GRONOWSKI CENTER -THE GRONOWSKI CENTER IS A PSYCHOLOGY TRAINING CLINIC DEDICATED TO PROVIDING COMPASSIONATE COUNSELING, SYCHOTHERAPY AND ASSESSMENT SERVICES TO ADULTS, OLDER ADULTS, COUPLES, ADOLESCENTS, CHILDREN AND FAMILIES IN SANTA CLARA COUNTY AND SAN MATEO COUNTY.THE CLINIC OFFERS SERVICES ON A SLIDING SCALE BASIS AS A PART OF ITS COMMUNITY MISSION. SERVICES ARE PROVIDED BY DOCTORAL LEVEL PSYCHOLOGY STUDENTS UNDER THE SUPERVISION OF LICENSED PSYCHOLOGISTS."
201641389349300609,920158414,TO PROVIDE HIGH QUALITY EDUCATION AND VOCATIONAL/TECHNICAL TRANING THAT HELPS STUDENTS GAIN EMPLOYMENT.
201641259349301404,540506306,4669394,0,0,"Academic support areas at Bridgewater College include the academic advising center, the Alexander Mack Library, the writing center, the information technology center, the office of career services and the academic support center."
201641339349303694,930386892,2985879,2933001,CLINICS-PART OF CURRICULUM
201641339349303844,350868188,96684714,298301,13179455,"Academic support - The University operates library facilities containing approximately 3,300,000 volumes, serving the University and the local community. The University publishes numerous academic periodicals and volumes and operates a museum of art housing over 27,000 works."
201641339349303844,350868188,27550271,5976851,6042346,"Public service - The University's Institute for Educational Initiatives strives to improve the K-12 education of all young people, particularly the disadvantaged through a variety of programs. The largest such program is the ACE program, a two-year service program offering college graduates the opportunity to serve as full-time teachers in under-resourced schools across the United States and several foreign countries. Additionally, the University provides volunteers and financial support for other organizations, both directly and through its Donor Advised Fund Program."
201601359349300220,341018992,72731533,55369733,"OTHER SPONSORED PROGRAMS: THE UNIVERSITY'S LIBRARY SYSTEM IS COMPOSED OF FOUR PRIMARY UNITS: THE UNIVERSITY LIBRARY, THE CLEVELAND HEALTH SCIENCES LIBRARY, THE SCHOOL OF LAW LIBRARY AND THE LILLIAN & MILFORD HARRIS LIBRARY IN THE MANDEL SCHOOL OF APPLIED SOCIAL SCIENCES. THE LIBRARIES OF THE UNIVERSITY SUPPORT THE UNDERGRADUATE, GRADUATE AND PROFESSIONAL PROGRAMS AND CONTAIN OVER 3 MILLION VOLUMES. CASE WESTERN RESERVE UNIVERSITY OFFERS ASSISTANCE TO ITS STUDENTS TO HELP MEET FINANCIAL NEED OR TO RECOGNIZE OUTSTANDING ACADEMIC ACHIEVEMENT AND PROMISE. ACADEMIC EXCELLENCE IS RECOGNIZED BY THE ACADEMIC AWARDS PROGRAM AND OTHER SCHOLARSHIP PROGRAMS OF THE UNDERGRADUATE COLLEGES AND BY VARIOUS ASSISTANTSHIPS, FELLOWSHIPS, SCHOLARSHIPS AND OTHER AWARDS OF INDIVIDUAL DEPARTMENTS IN THE SCHOOL OF GRADUATE STUDIES AND SEVERAL OF THE PROFESSIONAL SCHOOLS. CASE WESTERN RESERVE UNIVERSITY ACTIVELY PROMOTES THE DEVELOPMENT OF SERVICES AND PROGRAMS TO SUPPORT THE PHYSICAL, EMOTIONAL AND INTELLECTUAL WELL-BEING OF ITS STUDENTS.' THE PROGRAMS AND SERVICES ARE AVAILABLE TO UNDERGRADUATE, GRADUATE AND PROFESSIONAL STUDENTS ALIKE AND ARE DESIGNED TO PROVIDE POSITIVE, DEVELOPMENTAL OPPORTUNITIES BOTH TO SUPPLEMENT THE ACADEMIC EXPERIENCE AND ENRICH CAMPUS LIFE."
201621349349305702,720642832,1507298,TOTAL EXPENSES DURING THE CURRENT YEAR RELATED TO THE OTHER PROGRAM SERVICES LISTED ABOVE ARE:
201630999349300543,362593545,4730476,1513959,OTHER PROGRAM EXPENSES: - CENTER FOR CHILDREN AND FAMILIES - NEW SCHOOLS PROJECT - FUSSY BABY - PROFESSIONAL DEVELOPMENT
201641349349301624,516000297,76919199,Academic support
201641349349301624,516000297,51988146,Extension and public service
201641349349301624,516000297,34969859,Student services
201641349349301624,516000297,148911097,148911097,Student Aid
201641349349302329,570314395,549386,495160,5335768
201641379349308059,131099420,2449680,0,4774563,Student Housing facilities
201601339349304190,454971921,77217,5117,MASTERS & SCHOLARS
201641379349309394,910565553,1960839,0,2573415,"Public Service: The University operates a conference services program at its Seattle campus and at its 77 acre campus on Whidbey Island, known as ""Camp Casey Conference Center"". This center provides opportunities for students to further their studies in biological sciences and other disciplines, as well as providing a facility for diverse groups of nonprofit organizations to build community and provide educational opportunities for their constituents. The center offers all these groups a place to reflect, excel, discover and grow. This year there were 367 groups that utilized these facilities."
201641379349309394,910565553,0,0,606933,Gain on sale of assets other than inventory. These assets had been used for the University's exempt purpose.
201621059349301367,520591623,2668505,0,0,RESEARCH & DEVELOPMENT AND PUBLIC SERVICE
201641449349300129,141340095,33674771,215415,13733488,"AUXILIARYNUMBER OF HOUSING UNITS AVAILABLE: DORM ROOMS 2,761 SINGLE APTS 850NUMBER OF STUDENTS ON MEAL PLANS: 3,059OTHER PROGRAM SERVICES INCLUDE ACTIVITIES THAT FURTHER RENSSELAER'S EXEMPT PURPOSE."
201641349349306349,560529933,137593,238855,"STUDENT SERVICES: ENROLLMENT SERVICES, STUDENT SERVICES, FINANCIAL AID, HOUSING AND FOOD SERVICES, POST OFFICE, CO-CURRICULAR ACTIVITIES IN STUDENT LIFE, AND COLLEGIATE ATHLETICS. NCAA DIVISION II WITH 8 MEN'S VARSITY TEAMS AND 8 WOMEN'S VARSITY TEAMS."
201641349349307109,141338587,81343138,64200,7466715,OTHER PROGRAM SERVICES INCLUDE RESEARCH AND AUXILIARY ENTERPRISE EXPENDITURES AND OTHER MISCELLANEOUS REVENUE.
201641389349300324,231365971,255809000,110405000,104121000,OTHER PROGRAM SERVICES Listed Below:
201631259349301753,741233796,7017081,11303257,Auxiliary Enterprises
201631309349300108,362182171,3241294,0,8779558,"ARTIST SERIES, THE COMMUNITY SCHOOL OF THE ARTS AND SUMMER SPORTS CAMPS. MINOR PROGRAMS, APPLICATION FEES, TUITION INSTALLMENT PLAN FEES, PARKING FINES, PARKING PERMITS AND LIBRARY FINES."
201631019349300303,411607453,2164249,833722,-WE COMPLETED THE DESIGN AND BIDDING OF THE MAIN BUILDING THIRD FLOOR MEDIA RENOVATION THEN OVERSAW THE BEGINNING PHASES OF CONSTRUCTION.-WE OVERSAW THE SPECIFICATION AND INSTALLATION OF NEW ELECTRICAL PANELS AND UTILITY DISCONNECTS IN VARIOUS LOCATIONS ON CAMPUS IN DECEMBER OF 2013.-WE COMPLETED MOVING TWO RESIDENTIAL HOUSES TO OFF CAMPUS PROPERTIES THEN LANDSCAPING THAT AREA OF CAMPUS.-WE MANAGED THE IMPLEMENTATION OF THE CITY OF MINNEAPOLIS'S NEW ENERGY POLICY THAT REQUIRES REPORTING OF THE ENERGY CONSUMPTION FOR THE COLLEGE'S MAIN BUILDING.-WE UPDATED AND PRESENTED THE COLLEGE'S DEFERRED MAINTENANCE PLAN.-WE OVERSAW IMPLEMENTATION OF AN ONLINE CARD ACCESS SYSTEM.-WE MANAGED STORM DAMAGE RECOVERY IN JUNE OF 2013 THAT CAUSED DAMAGE TO THE CAMPUS GROUNDS.
201640439349301414,141468399,369818,0,1156271,"OTHER SOURCES OF INCOME SUCH AS COMMUNITY EDUCATION, SUMMER CAMPS, AND INDIRECT COST RECOVERY."
201640539349300144,381459365,2000438,334892,"STUDENT SERVICES - ASSISTS STUDENTS AND PARENTS IN NAVIGATING THE WORLD OF COLLEGE FINANCES AND COURSEWORK. STUDENTS CAN REQUEST A TRANSCRIPT, MAKE A PAYMENT, RECEIVE FINANCIAL AID, BE ASSIGNED A WORK-STUDY JOB AND RECEIVE HELP WITH REGISTERING FOR CLASSES."
201630719349300503,530196640,3733114,3962039,"AUXILIARY ENTERPRISES - THE COLLEGE'S DOMITORIES, DINING HALL AND THE TRINITY CENTER FOR WOMEN AND GIRLS IN SPORTS ARE THE MAJOR AUXILIARY ENTERPRISES SERVING THE CAMPUS COMMMUNITY. STUDENTS HAVE LIVING QUARTERS IN FOUR BUILDINGS ON CAMPUS."
201630719349300503,530196640,4160452,"ACADEMIC SUPPORT INCLUDES A 200,000 VOLUME ON-LINE LIBRARY, COMPUTER CENTER AND ADMINISTRATIVE OFFICE."
201631379349303923,060776644,36945537,35634870,OTHER GENERAL AND AUXILIARY SERVICES.
201631069349300758,251120678,53538391,1293718,"AUXILIARY ENTERPRISES: RESIDENCE HALLS, DINING HALLS, RECREATIONAL"
201631069349300758,251120678,"ACADEMIC SUPPORT: THESE ARE NOT DIRECT COSTS OF INSTRUCTION BUT COSTS THAT SUPPORT THE SCHOOLS BUT IN AND OF THEMSELVES GENERATE NO REVENUE. COSTS INCLUDE ACADEMIC SUPPORT COSTS SUCH AS THE DEANS OF THE SCHOOLS, IT, THE LIBRARY AND A LARGE PERCENTAGE OF INSTITUTIONAL SUPPORT (INSTITUTIONAL ADVANCEMENT, PUBLIC RELATIONS, HR, OFFICE OF PROVOST, FINANCIAL ADMINISTRATION, PUBLIC SAFETY, OFFICE OF PRESIDENT, GENERAL UNIVERSITY ADMIN #3250) AND AUXILIARY (FOOD SERVICE, GROUNDS AND BUILDING COSTS, CONFERENCE CENTERS, ISC OPERATIONS)."
201631069349300758,251120678,"PUBLIC SERVICES: INCLUDES EXPENSES FOR ACTIVITIES THAT ARE ESTABLISHED PRIMARILY TO PROVIDE NON-INSTRUCTIONAL SERVICES BENEFICIAL TO INDIVIDUAL AND GROUPS EXTERNAL TO THE UNIVERSITY (CONFERENCES, INSTITUTES AND HIGH SCHOOL PROGRAMS)"
201640759349300429,160743045,2463917,ACADEMIC SUPPORT AND COMMUNITY SERVICE.
