object_id,ein,ExpnsAmt,Dsc
201630149349300013,420680466,390297,"PUBLIC SERVICE: OFFERINGS TO THE BROADER COMMUNITY INCLUDE A COLLEGE RADIO STATION, CONFERENCES AND SEMINARS, A PERFORMING ARTS SERIES, AND A VARIETY OF PROGRAMS IN THE ARTS, ATHLETICS, SCIENCES, AND LEADERSHIP DEVELOPMENT FOR HIGH SCHOOL STUDENTS."
201630149349300013,420680466,522813,"RESEARCH: THE COLLEGE RECEIVES GRANTS FOR FACULTY/STUDENT RESEARCH COLLABORATION, PARTICULARLY IN THE SCIENCES. THE COLLEGE DEDICATES SPACE, RESOURCES, AND FACULTY TIME FOR COLLABORATIVE INVESTIGATION WITH STUDENTS. RESEARCH PROJECTS ACROSS THE CURRICULUM OCCUR DURING THE ACADEMIC YEAR AND IN THE SUMMER."
201630289349300838,954580540,4825,SUBLEASING PORTION OF LEASED PROPERTY
201610419349301386,383001876,0,0,0,Other program services
201543459349300904,986001141,160129000,49018000,Other Program Services include maintenance and amortization on equipment and buildings and expenses related to non-credit courses provided by the University
201542579349300219,205614856,2300,SEE ABOVE
201610129349301556,953104298,3201638,"TEACHING CHRISTIAN THEOLOGICAL THEORY, CHURCH MUSIC, EARLY CHILDHOOD EDUCATION AND MINISTRY FOR THE BACHELOR AND MASTER'S DEGREE."
201630329349301058,570474291,2276060,0,101528,"Academic Support: The University library (approximately 250,000 volumes held) is support for the principal academic divisions."
201600279349300230,231352664,10219047,0,0,"Operation and maintenance of physical plant: educational and administrative buildings and grounds (97 buildings). The beautiful 91 acre campus is highlighted by Gothic architecture and its signature historical buildings the Haas College Center, Baker Center for the Arts and Egner Memorial Chapel. Recent additions include a state of the art science building, additions to the Seegers Union building including a beautiful new campus restaurant, and eight spectacular new residence halls over the past decade."
201610429349301716,741277664,16064457,16064457,STUDENT INSTITIONAL AID AND ASSISTANCE
201630839349300708,410708577,345130,345130,0,SUPPORT TO BETHEL UNIVERSITY FOUNDATION:SUPPORT SERVICES TO THE FOUNDATION INCLUDING PROVIDING OFFICE SPACE AND ASSOCIATED EXPENSES AT NO COST.
201610979349300026,250981156,4632160,3715801,"ACADEMIC SUPPORT - SUPPORT FOR INSTRUCTION AND RESEARCH BY THE FOLLOWING DEPARTMENTS: DEAN OF THE COLLEGE, LIBRARY AND INFORMATION SYSTEMS, FACULTY DEVELOPMENT, ART GALLERY, HONORS PROGRAM, CHEMICAL HYGIENE, CULTURAL ARTIFACTS AND THE LEARNING CENTER."
201601309349300340,231352294,9139022,1989260,SEE SCHEDULE O
201601309349302370,580566167,30492026,3195657,Research
201601309349302370,580566167,49588896,37323312,Auxiliary Services
201601309349302370,580566167,24516362,Student Services
201601309349302370,580566167,4874241,Other
201620969349300137,362167048,52027314,33850062,Auxiliary Services
201620969349300137,362167048,57969164,5413656,Student Services
201620969349300137,362167048,8593097,132790,Public Service
201620969349300137,362167048,10652494,69916,Research
201620839349301102,952962604,11733891,185646,5455072,"HIGHER EDUCATION ACADEMIC SUPPORT DEPARTMENTS INCLUDE UNIVERSITY LIBRARY, COMPUTER & MEDIA LABS, AND FACULTY DEVELOPMENT PROGRAMS. PUBLIC SERVICE DEPARTMENTS INCLUDE THE DAY CARE CENTER, KCLU (PUBLIC RADIO STATION) AND EVENT SERVICES TO SERVE THE COMMUNITY."
201630989349300543,370661494,12798884,3875382,2123755,"INTERCOLLEGIATE ATHLETICS - PROVIDES FOR INTERCOLLEGIATE ATHLETIC ACTIVITY DIVISION I SPORTS OF MEN'S BASKETBALL, TENNIS, TRACK, GOLF, BASEBALL AND SOCCER AND WOMEN'S BASKETBALL, VOLLEYBALL, CROSS-COUNTRY, GOLF, SOFTBALL AND TENNIS."
201630989349300543,370661494,1442108,0,430166,"OTHER EDUCATIONAL BENEFITS - PROVIDES TECHNICAL SUPPORT FOR FACULTY, STAFF AND STUDENTS, CHILDCARE CENTER FOR TRAINING OPPORTUNITIES, AND EMPLOYMENT CENTER FOR STUDENTS."
201630989349300543,370661494,6545375,0,6027574,"OTHER DEPARTMENT PROGRAMS - PROVIDES SERVICES FOR TRANSCRIPTS, CULTURAL PROGRAMS OFFERED TO CAMPUS AND PUBLIC, CONTINUING EDUCATION PROGRAMS, AND MISCELLANEOUS OTHER PROGRAMS."
201601069349300540,240795495,1533186,"HIGHER EDUCATION, PUBLIC SERVICE - FUNDS EXPENDED FOR ACTIVITIES ESTABLISHED PRIMARILY TO PROVIDE NON-INSTITUTIONAL SERVICES BENEFICIAL TO INDIVIDUALS AND GROUPS EXTERNAL TO THE UNIVERSITY. THESE EXPENSES DO NOT INCLUDE OVER 175,000 COMMUNITY SERVICE HOURS PROVIDED BY UNIVERSITY STUDENTS."
201601069349300540,240795495,8359174,2318788,"HIGHER EDUCATION; ACADEMIC SUPPORT - INCLUDES EXPENSES APPLICABLE TO AN INTEGRAL PART OF THE UNIVERSITY'S PRIMARY MISSION OF INSTRUCTION, RESEARCH, OR PUBLIC SERVICE THAT ARE NOT CHARGED DIRECTLY TO THESE PROGRAMS."
201601069349300540,240795495,6271060,"HIGHER EDUCATION; LIBRARY - EXPENSES INCURRED IN OPERATING AN 80,000 SQ. FT. UNIVERSITY LIBRARY. THE LIBRARY CONTAINS OVER 633,035 VOLUMES, 203,507 FULL-TEXT ONLINE BOOKS, AND A MEDIA COLLECTION HOLING 22,544 NON-PRINT ITEMS AND 9,085 STREAMING MEDIA PROGRAMS FOR STUDENT AND GENERAL PUBLIC STUDY AND RESEARCH."
201601069349300540,240795495,18439992,HIGHER EDUCATION; STUDENT SERVICES AND ACTIVITIES - EXPENDITURES OR ACTIVITIES WHOSE PURPOSE IS TO CONTRIBUTE TO STUDENTS' EMOTIONAL AND PHYSICAL WELL-BEING AND DEVELOPMENT OUTSIDE THE CLASSROOM.
201610939349300221,930386858,20338108,32762,2726592,"OTHER EXPENSES RELATED TO (1) SCHOLARLY RESEARCH, (2) CAMPUS EVENTS FOR THE BENEFIT OF THE LOCAL COMMUNITY AND GENERAL PUBLIC, AND (3) AUXILIARY SERVICES SUCH AS RESIDENCE HALLS, FOOD SERVICE, CAMPUS BOOKSTORE, CONFERENCES AND COMPUTER PURCHASING PROGRAM."
201601329349301715,030179298,41815407,16341315,"Auxiliary enterprises represent expenses of dormitories, and the expenses and revenue from recreational facilities and food services. Also included is the grant commitment to support the bridge for the Town of Middlebury."
201621339349302817,951699394,740238,0,660952,Psychological Center - Student trainees provided counseling services to members of the community.
201621339349302817,951699394,951655,70277,97816,Urban Youth Certification Program
201621339349302817,951699394,35335,35335,160368,Other Miscellaneous Programs
201621339349302817,951699394,0,0,10740,Royalty Income
201621339349302817,951699394,0,0,134377,Conference and Program Events
201621339349302817,951699394,0,0,253377,Miscellaneous Program Income
201621339349302817,951699394,0,0,391715,Cost Recovery Revenues
201621339349302817,951699394,0,0,496,Sales of Instructional Materials
201640749349300419,530196549,56257927,Academic Support
201640749349300419,530196549,43603996,Student Services
201640749349300419,530196549,51249915,Institutional Support
201640749349300419,530196549,77978100,2760957,33466470,Research & Public Service
201601099349300730,910565571,21435041,"1.) OPERATIONS AND MAINTENANCE OF PLANT INCLUDING DEPRECIATION, INTEREST EXPENSE AND AMORTIZATION2.) RESEARCH3.) PUBLIC SERVICE"
201620899349300602,240795506,10149020,"ACADEMIC SUPPORT INCLUDES FUNDS EXPENDED TO PROVIDE SUPPORT SERVICES FOR THE INSTITUTION'S PRIMARY MISSION OF INSTRUCTION, RESEARCH, AND PUBLIC SERVICE. THE ACADEMIC ADMINISTRATION OF THE UNIVERSITY INCLUDING THE ACADEMIC DEANS BUT NOT DEPARTMENT CHAIRS THAT ARE CHARGED TO THEIR PRIMARY FUNCTION CATEGORY ARE FOUND IN THIS PROGRAM. ALL SALARIES, BENEFITS, AND OTHER EXPENSES FOR THE LIBRARY ARE ALSO CONSIDERED ACADEMIC SUPPORT."
201620899349300602,240795506,914918,"RESEARCH INCLUDES ALL EXPENDITURES FOR ACTIVITIES SPECIFICALLY ORGANIZED TO PRODUCE RESEARCH, WHETHER COMMISSIONED BY AN AGENCY EXTERNAL TO THE INSTITUTION OR SEPARATELY BUDGETED WITHIN THE UNIVERSITY. CHARGED TO THIS PROGRAM ARE EXPENDITURES RELATED TO THE INSTITUTE FOR PUBLIC POLICY AND ECONOMIC DEVELOPMENT, A PARTNERSHIP AMONG SEVERAL LOCAL COLLEGES WITH THE FUNCTION OF PRODUCING RESEARCH TO ASSIST COMMUNITY LEADERS IN MAKING INFORMED DECISIONS. IN ADDITION TO THIS, THE EXPENSES OF SEVERAL RESEARCH GRANTS ARE RECORDED TO THE RESEARCH CLASSIFICATION."
201620899349300602,240795506,727421,"PUBLIC SERVICE INCLUDES FUNDS EXPENDED FOR ACTIVITIES ESTABLISHED PRIMARILY TO PROVIDE NON-INSTRUCTIONAL SERVICES BENEFICIAL TO INDIVIDUALS AND GROUPS EXTERNAL TO THE UNIVERSITY. THE EXPENSES OF THE SMALL BUSINESS DEVELOPMENT CENTER, RADIO AND TELEVISION STUDIOS AND SEVERAL COMMUNITY LECTURE SERIES ARE AMONG THOSE POSTED TO THIS PROGRAM."
201621059349300512,420703280,8867672,16299509,"AUXILIARY ENTERPRISES & ACTIVITIES: ST. AMBROSE UNIVERSITY PROVIDES FOOD SERVICE AND HOUSING FOR AN APPROXIMATE CAPACITY OF 1,700 STUDENTS."
201621059349300512,420703280,443584,INSTITUTIONAL SUPPORT OF THE UNIVERSITY IS ALSO PROVIDED BY THE OFFICES OF THE VICE PRESIDENT FOR ACADEMIC AND STUDENT AFFAIRS AND THE VICE PRESIDENT OF ENROLLMENT MANAGEMENT.
201621059349300512,420703280,3001457,OTHER PROGRAM SERVICES INCLUDES INTEREST EXPENSE.
201621059349300512,420703280,4830413,ACADEMIC SUPPORT
201631339349303588,231355135,180894,170830,Continuing Medical Education
201611329349303016,710239576,5477483,"Academic Support - JBU enriches the students' educational experience through academic support in the form of library services, registrar services, IT support, and faculty professional development."
201611329349303016,710239576,4492264,2232117,"Public Service- The University is also the home to two endowed centers, The Center for Healthy Relationships and the Soderquist Leadership Center. The University also owns and operates KLRC radio, a 100,000 watt FM radio station."
201601349349304085,591083502,142344898,17635551,31151682,"Other program services include: Public Service, Research and Agency Services. Nova Southeastern University goes beyond its primary mission by reaching out to the community with diverse service programs and community-based research. NSU has been designated by the Carnegie Foundation for the Advancement of Teaching with its prestigious ""community engaged and ""high research activity"" designations. NSU delivers tangible benefits, including junior kindergarten through doctoral education, physical infrastructure, a professional workforce, employment opportunities, delivery of health care and law services in Broward and Miami-Dade counties, lifelong learning options, community-service initiatives, and public access to cultural and scholarly experiences. NSU continues to grow its research activities. More than 200 research projects are currently under way at NSU, including studies on cardiovascular disease, anti-cancer therapies, chronic fatigue syndrome, autism, coral reef restoration, stem cells, and wildlife DNA forensics, among other subjects. The university's commitment to scientific and technological exploration led to the opening of NSU's Guy Harvey Oceanographic Center building and the Center for Collaborative Research (CCR), slated to open in 2016. The CCR is expected to bring multiple disciplines together, with students and NSU faculty members partnering with professionals and organizations outside of the NSU community-furthering cutting-edge research and developing technologies that will benefit the global community."
201641099349301239,340714626,23763647,3910451,"OTHER SERVICES: ACADEMIC SUPPORT, STUDENT SERVICES, ADMINISTRATIVE SERVICES AND OTHER AUXILIARY SERVICES."
201601349349306080,430743910,123142,13718,"Athletics: Providing varsity sports programs, NCCAA Division 2 athletics, including Men's & Women's Basketball, Men's Soccer, Women's Volleyball and Men's & Women's Cross Country. In the 2014-2015 fiscal year our Women's Basketball Team won Regional's and placed 2nd at the NCCAA Division 2 Nationals."
201641279349300749,250496976,844396,0,0,"Other Program Services Research. Research is conducted on a project basis, primarily by members of the Schools of Science and Engineering. Projects are supported by grants, principally from local industries and regional business development organizations."
201601349349304810,520591672,3826581,ACADEMIC SUPPORT
201601349349304810,520591672,1483738,51250,INSTITUTIONAL SUPPORT
201641329349303314,251035663,4745577,89820,"MEDIA AND COMMUNICATION PROGRAMS, GENERAL/OTHER: PUBLIC SERVICE, PUBLIC RESEARCH PROGRAMS, 3109 PHARMACY CUSTOMERS, 45422 PRESCRIPTIONS DISPENSED, LAW LIBRARY PROGRAMS"
201641329349303314,251035663,8257246,14127,"SCIENCE & TECHNOLOGY RESEARCH, GENERAL/OTHER: RESEARCH -DHEW, NSF AND OTHER RESTRICTED FUNDS FOR RESEARCH (122 FUNDING AGENCIES)"
201641329349302009,540506306,4669394,0,0,"Academic support areas at Bridgewater College include the academic advising center, the Alexander Mack Library, the writing center, the information technology center, the office of career services and the academic support center."
201610439349300646,381374230,19344244,0,15948366,"These additional program service expenses include, but are not limited to auxiliary services (bookstore, residential, dining), and plant and maintenance of campus grounds and buildings."
201600929349300010,390806428,1611756,"ACADEMIC SUPPORT: THE ACADEMIC DEAN'S OFFICE, LIBRARY SERVICES, AND ACADEMIC TECHNOLOGY, SUPPORTS THE INSTRUCTIONAL PROGRAM BY PROVIDING RESOURCES TO RECRUIT AND DEVELOP FACULTY AND OFFER ADDITIONAL LEARNING OPPORTUNITIES TO STUDENTS. OPPORTUNITIES ABROAD HAVE INCREASED FOR STUDENTS THROUGH MORE FORMAL COLLABORATIVE INSTRUCTIONAL AGREEMENTS WITH PARTNERS THAT ALLOW STUDENTS TO PARTICIPATE IN SEMESTERS AWAY, IN COUNTRIES/REGIONS WHOSE ECOLOGICAL SYSTEMS PRESENT RICH AND UNIQUE LEARNING OPPORTUNITIES.PUBLIC SERVICE: THROUGH THE SIGURD OLSON ENVIRONMENTAL INSTITUTE, MARY GRIGGS BURKE CENTER FOR FRESHWATER INNOVATION, NATIVE AMERICAN INDIGENEOUS CULTURES CENTER, AND CENTER FOR RURAL COMMUNITIES, PROVIDE COURSES, INTERNSHIPS, AND OPPORTUNITIES FOR STUDENTS TO SERVE THE REGION VIA GRANT-FUNDED, EXPERIENTIAL PROJECTS THAT SUPPORT SUSTAINABILITY AND IMPROVE THE ENVIRONMENT."
201641179349300604,131740285,NONE
201601169349300225,361521940,1414897,466446,"CLINIC OPERATIONS - LOMBARD CLINIC, LOMBARD RADIOLOGY CLINIC, AURORA CLINIC, CHICAGO CLINIC, ST PETERSBURG CLINIC, PINELLAS PARK CLINIC"
201601169349300225,361521940,927122,"ACADEMIC SUPPORT - LEARNING RESOURCE CENTER, INSTITUTIONAL ANALYSIS, TRAINING AND ASSESSMENT CENTER"
201601169349300225,361521940,519820,"RESEARCH - GENERAL RESEARCH, RESEARCH GRANTS"
201601169349300225,361521940,1361989,1603244,"AUXILIARY ENTERPRISES - NUHS JOURNALS, RESIDENCE HALLS, RENTAL PROPERTIES, PARKING LOTS, CAMPUS BOOKSTORE"
201621339349305612,370661496,103473,"PUBLIC SERVICE EVENTS CONSIST OF MUSIC AND/OR COMEDY CONCERTS, BUSINESS COALITION LUNCHES AND FAMILY FUN NIGHTS WHICH PROVIDE ENTERTAINMENT/ACTIVITIES THAT ARE OPEN TO THE GENERAL PUBLIC. DIFFERENT EVENTS ARE HELD THROUGHOUT THE ENTIRE ACADEMIC YEAR."
201610439349302431,951684064,2018735,676538,"WHIZIN CENTER:WHIZIN CENTER IS DEDICATED TO CREATING PROGRAMS TO EXPAND THE BOUNDS OF INTELLECT, PASSIONS, CREATIVITY, SKILLS, SENSE OF CONNECTION AND COMMUNITY. THROUGH CLASSES, SEMINARS, LECTURES, WORKSHOPS, TOURS, EXCITING GUEST SPEAKERS AND THRILLING PERFORMANCES, THE WHIZIN CENTER OFFERS PROVOCATIVE PROGRAMMING FOR EVERY INTEREST. SERVING OUR COMMUNITY IS OUR MISSION, PASSION AND PRIVILEGE. OUR PROGRAMS ENRICH SO MANY LIVES, MEET SO MANY NEEDS, AND TOUCH SO MANY DIFFERENT COMMUNITIES WITHIN OUR CITY."
201610439349302431,951684064,435232,396607,STUDENT HOUSING
201610439349302431,951684064,712478,368309,189067,"OTHER PROGRAMS:THE PLATT AND BORSTEIN GALLERIES - PRESENT EXHIBITIONS AND EDUCATIONAL PROGRAMS IN THE VISUAL ARTS. SELECTED JEWISH AND NON-JEWISH ARTISTS BRING INSIGHT INTO CURRENT TRENDS AS WELL AS AN HISTORICAL PERSPECTIVE TO COMMUNITY LIFE. THE GALLERIES PROVIDE A VALUABLE AND NECESSARY AESTHETIC COMPONENT TO THE EDUCATIONAL GOALS OF AMERICAN JEWISH UNIVERSITY.UNIVERSITY WOMEN: HAS BEEN AN INTEGRAL PART OF AMERICAN JEWISH UNIVERSITY FOR 50 YEARS. THE MEMBERSHIP IS COMPRISED OF VOLUNTEERS WHO SEEK TO EXPRESS THEIR CULTURAL, ARTISTIC AND COMMUNITY INTERESTS WHILE SUPPORTING THE PROGRAMS OF AN INSTITUTION DEDICATED TO ACADEMIC EXCELLENCE.THE PROGRAMS AT UNIVERSITY WOMEN INCLUDE YOUNG ARTIST CONCERTS, SPECIAL INTEREST CLASSES AND PROGRAM MEETINGS WITH DISTINGUISHED SPEAKERS, AS WELL AS A HIGHLY REGARDED AUTHOR/ARTIST LUNCHEON."
201640919349300604,580566143,3021676,10000,1120159,Auxiliary Enterprises - Enrichment programs and other support for the instructional programs of the University.
201620969349300632,911036794,2517069,1209796,RESEARCH AND TRAINING IN COMPLEMENTARY AND ALTERNATIVE MEDICINE.
201600909349300905,420680387,16904920,16500536,OTHER PROGRAM SERVICES INCLUDE AUXILIARY ENTERPRISES SUCH AS HOUSING AND FOOD SERVICES.
201631309349300143,250969449,18653281,0,15005626,"OTHER PROGRAM SERVICES:OTHER FEES AND MEMBERSHIPS, EXTERNAL SUPPORT AND SERVICES AND OTHER MISCELLANEOUS PROGRAM SERVICE REVENUE THAT SUPPORTS THE INSTRUCTION, RESEARCH, AND AUXILIARY FUNCTIONS OF THE UNIVERSITY."
201641279349300784,237126805,614952,824576,"COMMUNITY EDUCATION (NON-DEGREE) PROGRAM: PROVIDE A NUMBER OF NON-DEGREE CERTIFICATE PROGRAMS, GMAT AND GRE PREPARATORY CLASSES. PERSONS BENEFITTED: APPROXIMATELY 830 STUDENTS AND MEMBERS OF THE ALBUQUERQUE COMMUNITY."
201600689349300140,237213309,42457606,8999913,10349596,Other
201631349349305408,042103594,120964000,5637000,230140000,"THIS ITEM CONSISTS OF OTHER EXPENDITURES (INCLUDING GRANTS) INCURRED, AND REVENUES GENERATED IN CONNECTION WITH MIT'S OTHER PROGRAM SERVICES RELATED TO VARIOUS ACTIVITIES IN FURTHERANCE OF AND IN SUPPORT OF MIT'S EXEMPT MISSION WHICH INCLUDED BUT WERE NOT LIMITED TO SUCH THINGS AS FEES AND SERVICES (FOR EXAMPLE, MEDICAL DEPARTMENT, TECHNOLOGY LICENSING OFFICE), AUXILIARY ENTERPRISES (FOR EXAMPLE, HOUSING, DINING), AND OTHER MISCELLANEOUS PROGRAM SERVICE REVENUE."
201601339349304315,550357039,11028777,OTHER PROGRAM SERVICES
201601069349301310,141338562,50733370,76666,31694184,"HIGHER EDUCATION: OTHER: INCLUDES STUDENT SERVICES, ACADEMIC SUPPORT AND OTHER AUXILIARY ENTERPRISES. STUDENT SERVICES INCLUDES EXPENSES FOR ORGANIZATIONAL UNITS THAT PROVIDE SUPPORT TO STUDENTS. THESE UNITS INCLUDE HEALTH SERVICES, COUNSELING CENTER, ATHLETICS, INTERFAITH PROGRAMS, ETC. ACADEMIC SUPPORT INCLUDES ALL EXPENSES FOR ALL ACTIVITIES THAT ARE PART OF THE COLLEGE'S ACADEMIC MISSION. AUXILIARY ENTERPRISES INCLUDES EXPENSES FOR ORGANIZATIONAL UNITS THAT EXIST TO FURNISH GOODS OR SERVICES TO STUDENTS, FACULTY AND STAFF, AND THAT CHARGE A FEE DIRECTLY RELATED TO THE COST OF THE GOODS OR SERVICES. FACILITIES INCLUDE TWELVE DORMS AND APARTMENT COMPLEXES PROVIDING HOUSING TO APPROXIMATELY 2150 STUDENTS, TWO DINING HALLS, A BOOKSTORE, SNACK BAR, CHILD CENTER, AND TELEPHONE SERVICES."
201640859349300019,042103585,573414,394365,PROVIDED FACILITIES FOR OTHER EDUCATIONAL ORGANIZATIONS TO CONDUCT EDUCATIONAL PROGRAMS AND TO PROVIDE HOUSING TO STUDENTS.
201600979349300415,150532204,28737697,"STUDENT SERVICES: STUDENT SUPPORT SERVICES INCLUDING ADMISSIONS, REGISTRAR, ATHLETICS, AND STUDENT CLUBS. THESE SERVICES CONTRIBUTE TO THE STUDENT'S EMOTIONAL AND PHYSICAL WELL-BEING."
201601169349301400,133297197,43390795,41801399,AUXILIARY REVENUE FOR DORMS AND HEALTH SERVICES.
201621099349301252,250965430,22964901,49053,1307148,All other program related activities.
201600559349300410,820309302,391709,81879,STUDENT ACTIVITIES.
201600549349301015,362181973,4062276,0,5816454,"OTHER PROGRAM SERVICE REVENUES AND EXPENSES INCLUDE INTEREST ON STUDENT LOANS AND PENALTIES, STUDENT HOUSING REVENUE AND OTHER PROGRAM SERVICES."
201601349349306290,340714654,11844421,452597,2164244,"Research Programs, Public & Academic Support"
201641259349300234,910654200,65603,56716
201640509349300704,420707114,578122,423850,TRIO GRANT PROGRAMS
201640509349300704,420707114,57986,COLISEUM OPERATIONS
201631049349300778,231352688,138379419,6882565,66681155,Other Program Services
201601379349303170,362191242,2151095,0,2159343,"Early Childhood Education, General/Other: Operation of childcare, early childhood, and primary programs for children, all of which includes a strong educational component, as well as a Christian core value component. Last year, the Early Childhood Center served nearly 600 children."
201621059349301057,741159753,63724528,2777679,129956820,"OTHER EXPENSES CONTAINED HEREIN ARE COMPRISED OF THE FOLLOWING: RESEARCH, PUBLIC SERVICES, AND AUXILIARY ENTERPRISES. BAYLOR ENGAGES IN RESEARCH WORK SPONSORED BY NUMEROUS FEDERAL, STATE, AND LOCAL AGENCIES. ADDITIONALLY, BAYLOR PROVIDES NON-INSTRUCTIONAL SERVICES THAT BENEFIT INDIVIDUALS AND GROUPS EXTERNAL TO BAYLOR. AUXILIARY ENTERPRISES ARE COMPRISED GENERALLY OF THE FOLLOWING ITEMS: RESIDENCE HALLS, DINING SERVICES, BOOKSTORE, AND VENDING SERVICES."
201611049349300126,237121060,1630217,22399,SEE ADDITIONAL EXPLANATION ON SCHEDULE O FOR
201611049349300126,237121060,"FORM 990, PART III, LINE 4D"
201621379349300642,580531392,4872328,149502,"Academic Support - Academic Enrichment Services include honor's courses, developmental studies, and learning assistance (tutoring in English and Math), and special support services. Academic enrichment services are designed to promote and strengthen the development of learning skills in areas that are basic to college success, and to enhance the overall academic environment."
201621379349300642,580531392,"Student Services - Student services include offices of admissions and the registrar and student activities, cultural events, student newspapers, intramural athletics, student organizations, intercollegiate athletics, counseling and career guidance, and student health service."
201621339349303557,410693970,20006491,0,949408,"OTHER PROGRAM SERVICES: ACADEMIC SUPPORT PROVIDED TO THE UNIVERSITY COMMUNITY INCLUDING LIBRARY FACILITIES, ACADEMIC ADVISING, AND THE FACULTY DEVELOPMENT CENTER. THE UNIVERSITY PROVIDES PUBLIC SERVICES INCLUDING THE SENIOR CITIZEN CENTER, LOAVES AND FISHES, SERVICE LEARNING, AND VISION TRIPS. THE UNIVERSITY ALSO PROVIDES OTHER PROGRAMS TO FURTHER THEIR EDUCATIONAL PURPOSES."
201641249349301314,450314233,7023955,TECHNICAL ASSISTANCE TO INDIAN ORGANIZATIONS AND JOB TRAINING
201601379349301290,042103629,30505637,55672,19175287,"ACADEMIC SUPPORT AND STUDENT SERVICES: INCLUDES EXPENDITURES FOR ACTIVITIES THAT SUPPORT AND ENHANCE THE STUDENT'S EDUCATION, AS WELL AS CONTRIBUTE TO THEIR EMOTIONAL AND PHYSICAL WELL-BEING. INCLUDED IN THIS CATEGORY IS THE COLLEGE LIBRARY WHICH HOUSES OVER 223,000 PRINT VOLUMES, SUBSCRIBES TO 257 PRINT JOURNALS, AND PROVIDES ACCESS TO 73,000 E-JOURNALS, 30,000 E-BOOKS, AND 94 ELECTRONIC DATABASES FOR ARTICLES, REFERENCE CONTENT, STATISTICS AND BEYOND. DURING FISCAL YEAR 2015, STUDENTS CHECKED OUT 16,675 BOOKS AND ACCESSED COURSE RESERVE ITEMS 15,199 TIMES. ALSO INCLUDED IN THIS CATEGORY IS THE COLLEGE'S HEALTH CENTER WHOSE STAFF HANDLED 4132 STUDENT/PATIENT VISITS DURING FISCAL YEAR 2015. ANOTHER COMPONENT OF THIS CATEGORY IS THE CAREER EDUCATION CENTER WHICH HAD 2,323 STUDENT CONTACTS DURING FISCAL YEAR 2015 THROUGH MULTIPLE CHANNELS SUCH AS CAREER COACHING, IN-CLASS WORKSHOPS, RECRUITMENT ACTIVITIES AND CAREER FAIRS."
201641329349302024,236002304,280000,280000,0,Higher Education: Grants paid from donor advised funds to other 501(c)(3) charities. (5 charities)
201601349349303980,570314404,378930,40000,"Academic SupportNOTEWORTHYNEWBERRY COLLEGE HITS RECORD HIGH FRESHMAN ENROLLMENTSeptember 8, 2014Newberry College welcomed a record high 379 new students to campus this fall, a 19 percent increase compared to this time last year and the largest incoming class in the 157 year history of the College.NEWBERRY COLLEGE RECEIVES ACCREDITATION REAFFIRMATIONDecember 8, 2014Record-breaking enrollment and fundraising results helped fuel accrediting agencys decision.Newberry College has been fully reaffirmed for accreditation by the Southern Association of Colleges and Schools Commission on Colleges (SACSCOC) the accrediting agency today announced. The College will next be reviewed as part of the regular SACSCOC five-year review process and undergo the complete reaffirmation process as normal in 2022."
201601349349303980,570314404,114019,"Public ServiceNOTEWORTHY:THREE NEWBERRY ART PROFESSORS FEATURED IN REGIONAL EXHIBITIONApril 20, 2015Newberry College Art faculty are part of a show featuring 25 recent works by four regional artists at an exhibition on the campus of Spartanburg Methodist College in Ellis Hall Gallery. The exhibition runs now through May 15; it is free and open to the public.NEWBERRY COLLEGE PROFESSOR'S BIZCAMP SETS OUT TO TEACH YOUNG ADULTS FUNDAMENTALS OF BUSINESSJuly 17, 2014By: Kelly Petty of ColaDaily.comA group of Midlands students gathered at the Richland Library this week to learn the fundamentals of business ownership. Newberry College professor Paul Smith teamed up with Palmetto Citizens Federal Credit Union to host the third annual BizCamp to teach young people entrepreneurship and financial literacy."
201610479349300811,362166962,9949601,14528007,"HIGHER EDUCATION: STUDENT SERVICES - SERVES THE STUDENT COMMUNITY BY PROVIDING REGISTRATION ASSISTANCE, COUNSELING, CAREER PLANNING, INTERNSHIPS, FINANCIAL ASSISTANCE, MULTICULTURAL PROGRAMMING, ORIENTATION AND ADVISING, INTRAMURAL SPORTS, AND OTHER RELATED PROGRAMS. (2,500 STUDENTS) HIGHER EDUCATION: PUBLIC SERVICES - INCLUDES A CENTER FOR COMMUNICATIVE DISORDERS, ART PROGRAMS, ALUMNI PROGRAMS, COMMUNITY SERVICE AND A NATIONAL PUBLIC RADIO STATION SERVING THE STUDENTS AND COMMUNITY. (2500 STUDENTS) HIGHER EDUCATION: RESEARCH - SUPPORTS EXTENSIVE OPPORTUNITIES FOR STUDENTS AND FACULTY TO CONDUCT RESEARCH ON AND OFF CAMPUS. (2,500 STUDENTS)"
