object_id,ein,ExpnsAmt,Dsc
201533209349302238,200683049,8698,ALL OTHER EDUCATIONAL PURPOSE ONLY.
201543149349301819,620511454,433184,737694,STUDENT HOUSING AND FOOD SERVICES:COST ASSOCIATED WITH COLLEGE RESIDENCE HALLS AND FOOD SERVICES. THE COLLEGE OFFERS DOUBLE AND PRIVATE ROOMS TO STUDENTS. MEAL PLANS ARE PROVIDED FOR RESIDENTIAL AND COMMUTER STUDENTS. AFTER HOURS FOOD SERVICES ARE PROVIDED THROUGH THE CAMPUS SNACK BAR AND RESIDENCE HALL EVENTS.
201543149349301819,620511454,82834,"ACADEMIC SUPPORT - LIBRARY AND COMPUTER SYSTEM:A CENTRALLY LOCATED LIBRARY PROVIDES ACCESS TO BOTH ON CAMPUS AND MULTIPLE ELECTRONIC DATABASES FOR USE BY STUDENTS; FOUR COMPUTER LABS PROVIDE ACCESS TO STUDENTS; CAMPUS-WIDE ACCESS TO LEARNING MANAGEMENT SYSTEM FOR FACULTY, STAFF AND STUDENTS."
201543149349301819,620511454,509268,67528,"PLANT OPERATIONS:COSTS ASSOCIATED WITH REPAIRS, MAINTENANCE, HOUSEKEEPING AND GROUNDS."
201543149349301819,620511454,220757,"DEPRECIATION:DEPRECIATION OF THE COLLEGE'S PROPERTY AND EQUIPMENT IS COMPUTED BY MEANS OF THE STRAIGHT-LINE METHOD, BASED ON THE EXPECTED USEFUL LIVES AS FOLLOWS: ROADS, WALKS AND LANDSCAPING 25 YEARS, BUILDINGS 25 TO 50 YEARS, FURNITURE AND EQUIPMENT 15 YEARS AND LIBRARY BOOKS 10 YEARS."
201503019349301075,150532053,713556,15650,"RESEARCH: AUBURN'S APPLIED RESEARCH PROVIDES GREATER UNDERSTANDING OF THE MOST EFFECTIVE WAYS TO EQUIP LEADERS OF FAITH AND MORAL COURAGE FOR TODAY'S COMPLEX, MULTIFAITH WORLD. NEW RESEARCH INITIATIVES ARE EXPLORING PUBLIC THEOLOGICAL ENGAGEMENT WITH PRESSING SOCIAL ISSUES AND BRIGHT SPOTS IN THEOLOGICAL EDUCATION TO IDENTIFY AND DISSEMINATE EFFECTIVE NEW MODELS FOR LEADERSHIP DEVELOPMENT. THE CENTER FOR THE STUDY OF THEOLOGICAL EDUCATION (CSTE) IS NATIONALLY KNOWN FOR APPLIED RESEARCH ON THE NEEDS OF THEOLOGICAL INSTITUTIONS, THEIR LEADERS, STUDENTS AND STAKEHOLDERS, INCLUDING STUDENT LIFE AND DEBT, EDUCATIONAL AND ADMINISTRATIVE LEADERSHIP, AND THE PUBLIC ROLE OF THEOLOGICAL SCHOOLS. AUBURN CONSULTANTS HELP SCHOOLS EVALUATE PROGRAMS, DEVELOP STRATEGIES, FORGE NEW INSTITUTIONAL PARTNERSHIPS, AND SUPPORT THEIR SENIOR LEADERSHIP. THE CROSSCURRENTS COLLOQUIUM CONVENES RELIGION SCHOLARS, SOCIOLOGISTS, CLERGY, ACTIVISTS AND OTHERS FOR SCHOLARLY RESEARCH AND EXPLORATION ON CONTEMPORARY CRITICAL CONCERNS.REPORTS, PUBLICATIONS AND VIDEOS ARE WIDELY DISTRIBUTED AND AVAILABLE IN PRINT AND/OR ON-LINE.THE NUMBER OF PERSONS BENEFITED: GRADUATE THEOLOGICAL SCHOOLS IN THE U.S. AND CANADA DEPENDING ON CSTE FOR THE LATEST RESEARCH ON THEOLOGICAL EDUCATION: 275TWO RESEARCH REPORTS WERE PUBLISHED IN THIS FISCAL YEAR. PRESIDENTS, ADMINISTRATORS, DEANS, AND FACULTY OF THEOLOGICAL SCHOOLS, AS WELL AS RELIGIOUS INSTITUTION OFFICES AND OTHERS INTERESTED IN THE TRAINING OF RELIGIOUS LEADERS IN NORTH AMERICA, RECEIVING COPIES OF CSTE REPORTS (DISTRIBUTION NUMBERS): 1,600SCHOOLS OR INSTITUTIONS RECEIVING CSTE CONSULTANT SERVICES: 6PEOPLE ATTENDING AUBURN RESEARCH CONFERENCE PRESENTATIONS: 205NOTE: THESE RESEARCH AND CONSULTING RESULTS BENEFIT THE THOUSANDS OF FACULTY, ADMINISTRATORS, BOARD MEMBERS AND STUDENTS OF THE ABOVE U.S./CANADIAN SEMINARIES, THEIR RELIGIOUS COMMUNITIES, AND LEADERSHIP DEVELOPMENT INSTITUTIONS NATIONWIDE."
201512789349300866,770495799,98921,47908,95000,LEADERSHIP SEMINARS
201512789349300866,770495799,13299,1428,0,ARCHIVE
201512789349300866,770495799,163374,1429,12000,RESEARCH
201512789349300866,770495799,22921,1429,0,JEFFERSON LINCOLN AWARDS
201542759349300634,020344073,90879,DELIVERY OF EDUCATION AND SERVICES TO STUDENTS.
201502819349301100,161476258,6263751,0,11528002,"Auxilliary Enterprises Expenses $6,263,751 including grants $0 Revenue $11,528,002"
201533029349301343,561388743,TO EDUCATE INDIVIDUALS TO KNOW AND APPLY GOD'S WORD IN THE CONTEXT OF EFFECTIVE LOCAL CHURCH MINISTRY.
201503179349307680,620476661,0,0,23165379
201503209349313205,620789275,138786,"Other program services consist of other fees, Federal Work Study reimbursement, and miscellaneous revenues."
201513209349314151,261251815,SUPPORT ACTIVITIES FOR 1ST EXEMPT PURPOSE.
201503159349301005,580865852,89216,UNDERGRADUATE AND GRADUATE COURSES AND RELIGIOUS COURSES AND STUDIES
201503159349302510,410698301,593553,59322,397461,"OTHER PROGRAM SERVICES INCLUDE: CENTER FOR HEALTH CARE & INNOVATION, PERFORMING ARTS, AND COMMUNITY EDUCATIONAL SERVICES."
201513149349303106,954559065,DEPRECIATION
201523159349303112,800957275,146683,146683,SUPPORT OF COE COLLEGE
201503169349302985,810231774,2043286,1350583,OTHER PROGRAMS
201503149349302635,200617900,234264,51000,FREE SPIRIT
201503149349302635,200617900,184195,16000,RESEARCH & PUBLICATIONS
201503149349302635,200617900,50181,OLE MISS CENTER
201503149349302635,200617900,58201,OTHER PROGRAMS
201523159349300987,260069167,5573490,10800,OPERATION OF PHARMACY SCHOOL - SECONDARY EDUCATIONAL INSTITUTION.
201543149349301889,530174589,PUBLIC AFFAIRS & DEVELOPMENT- THE PUBLIC AFFAIRS AND DEVELOPMENT PROGRAM PROVIDES RESOURCES TO ASSIST AND DEVELOPMENT PROGRAM PROVIDES RESOURCES TO ASSIST AND DEVELOPMENT PROGRAM PROVIDES RESOURCES TO ASSIST AND DEVELOPMENT PROGRAM PROVIDES RESOURCES TO ASSIST AND DEVELOPMENT PROGRAM PROVIDES RESOURCES TO ASSIST AND DEVELOPMENT PROGRAM PROVIDES RESOURCES TO ASSIST
201543149349301889,530174589,"LIBRARY SERVICES - WBC LIBRARY FACILITIES PROVIDES OVER 94,000 ITEMS AND SUBSCRIBES TO ABOUT 182 PUBLICATIONS OVER 94,000 ITEMS AND SUBSCRIBES TO ABOUT 182 PUBLICATIONS OVER 94,000 ITEMS AND SUBSCRIBES TO ABOUT 182 PUBLICATIONS"
201543159349301319,550357056,404119,INSTRUCTIONAL SERVICES TO STUDENTS
201543169349304754,370706154,9691131,7086776,AUXILIARY ENTERPRISES- COST OF DINING SERVICES AND RESIDENCE HALL OPERATIONS
201533179349305328,470377991,1703089,"OTHER PROGRAM SERVICES ACADEMIC SUPPORT: INCLUDES THE COLLEGE LIBRARY, TECHNOLOGY SERVICES, ACADEMIC DEAN'S OFFICE AND SUPPORT FOR ALL ACADEMIC DIVISIONS."
201523209349308027,362167855,5260176,6055775,"AUXILIARY SERVICES - AUXILIARY SERVICES INCLUDES STUDENT HOUSING AND CAMPUS DINING. THE UNIVERSITY OFFERS FOUR CAMPUS RESIDENCE HALL OPTIONS. HOUSING INCLUDES A VARIETY OF OPTIONS RANGING FROM SUITES TO SINGLE ROOMS. THE STUDENT MEAL PLAN CAN BE TAILORED FOR A NUMBER OF FLEX MEAL ARRANGEMENTS AND CAN BE USED AT SEVERAL CAMPUS DINING FACILITIES. APPROXIMATELY 26% OF ALL UNDERGRADUATE STUDENTS POPULATION TAKES ADVANTAGE OF HOUSING OPPORTUNITIES. AUXILIARY SERVICES ALSO INCLUDES THE ACTIVITY OF THE PERFORMING ARTS CENTER, WHICH OFFERS A VARIETY OF MUSICAL AND THEATER ACTS TO THE UNIVERSITY AND NEARBY COMMUNITIES. THEATER PRODUCTIONS ARE INTEGRATED WITH THE UNDERGRADUATE THEATER PROGRAM AND UTILIZE MANY STUDENTS AS PART OF THE PRODUCTIONS. THEATER STUDENTS ALSO LEARN AND ASSIST WITH BOX OFFICE, STAGE CREW, AND AUDIENCE/GUEST ARTIST, AND SUPPORT ALL MUSICAL EVENTS."
201533209349315408,260833212,431743,TOTAL PROGRAM EXPENSES
201533179349308878,640329300,3664192,"EXPENSES FOR OTHER PROGRAM SERVICES INCLUDE ACADEMIC SUPPORT, STUDENT SERVICES, GRANTS AND CONTRACTS, AND OTHER EXPENSES."
201543209349316059,731679393,3431,DEPRECIATION
201523149349303137,420681049,6327288,7051400,"AUXILIARY SERVICES AVAILABLE TO STUDENTS INCLUDING ROOM, BOARD AND BOOKSTORE SERVICES"
201523149349303137,420681049,28126,MANAGEMENT FEES ON THE PROGRAM RELATED PORTION OF THE ENDOWMENT
201533209349314783,610461768,97000,APPROXIMATELY 750 UNDERGRADUATE & 450 GRADUATE STUDENTS 247 TOTAL STUDENTS GRADUATED WITH DEGREES IN 2014-2015
201513289349300321,390806297,5352827,1793258,PROVIDE ACADEMIC SUPPORT TO 1500 STUDENTS THROUGH LIBRARY FACILITIES AND COMPUTER SERVICES.
201533439349300103,590624459,31150631,0,41000639,"AUXILIARY SERVICES AT THE UNIVERSITY OF TAMPA OFFER THE STUDENTS DINING, A BOOKSTORE, STUDENT LIFE SERVICES AND VARIOUS ACTIVITIES. THE PURPOSE OF THE AUXILIARY SERVICES OFFICE IS TO PROVIDE THE STUDENTS WITH SERVICES AND ACTIVITIES THAT TAKE PLACE OUTSIDE THE CLASSROOM, ENHANCING LIFE AT THE UNIVERSITY. DINING SERVICES OFFER A VARIETY OF DINING VENUES FOR THE STUDENTS AND VISITORS. CAMPUS HOUSING IS LIMITED AND IS OFFERED ONLY TO FULL TIME STUDENTS. THE UNIVERSITY OF TAMPA HAS ELEVEN RESIDENTIAL HALLS FROM WHICH TO CHOOSE. VARIOUS ATHLETIC PROGRAMS ARE ALSO OFFERED FOR THE STUDENTS."
201533359349300443,850164940,87870,78468,MISCELLANEOUS EDUCATION RELATED PROGRAM SERVICES
201543519349300144,530196583,28318571,30444215,"AUXILIARY SERVICES: UNIVERSITY DORMITORIES CONSIST OF 18 RESIDENCE HALLS WHICH PROVIDE LIVING QUARTERS FOR 2,037 STUDENTS. OCCUPANCY RATE AS OF FALL 2014 WAS 95%. THE UNIVERSITY ALSO PROVIDES RECREATIONAL FACILITIES, DINING SERVICES, PARKING, AND OTHER SELF-SUPPORTING FACULTY, STAFF AND STUDENT SERVICES."
201543439349300619,470553011,410719,14628,15541,"OTHER PROGRAMS SUCH AS THE SCHOOL COMMUNITY INTERVENTION PROGRAM, YOUNG FAMILY'S PROGRAM AND CONTINUING MEDICAL HEALTH EDUCATION."
201513439349300141,980042539,9766483,0,13822622,"Student Services Programs: The University provides services to students, such as residences, bookstore, printing, parking, and food services. (12,068 Students)"
201513439349300141,980042539,11690356,300588,0,"Scholarship Programs: The University receives donations specifically to provide scholarships and bursaries to its students to encourage continued learning. (12,068 Students)"
201513349349300641,710430687,104487,84402,OTHER PROGRAM ACTIVITIES (450 STUDENTS) - MISCELLANEOUS ACTIVITIES DIRECTLY RELATED TO OVERALL MISSION OF ORGANIZATION.
201503489349301060,610492351,4230141,2306284,"STUDENT AID EXPENSES 2,056,888. INCLUDING GRANTS OF 2,056,888. REVENUE 0. ACADEMIC EXPENSES 655,872. INCLUDING GRANTS OF 130,857. REVENUE 0. ADMISSIONS EXPENSES 557,642. INCLUDING GRANTS OF 49,205. REVENUE 0. JUNE BUCHANAN EXPENSES 959,739. INCLUDING GRANTS OF 69,334. REVENUE 0."
201503559349300620,620485733,13443521,"ACADEMIC SUPPORT:INCLUDES ACADEMIC COUNSELING & TESTING SERVICES, ACADEMIC PROGRAM DEVELOPMENT, UNIVERSITY DEANS, INSTRUCTIONAL TECHNOLOGY, LIBRARY SERVICES, AND OTHER AREAS DESIGNED TO ENHANCE A STUDENT'S LEARNING EXPERIENCE AND THE OVERALL QUALITY OF A STUDENT'S EDUCATION."
201503559349300620,620485733,1901342,"PUBLIC SERVICES:INCLUDES COMMUNITY OUTREACH ACTIVITIES, SPIRITUAL FORMATION ACTIVITIES, AND SUSTAINABILITY WHERE LIPSCOMB CAN POSITIVELY IMPACT COMMUNITIES AND THE ENVIRONMENT."
201503559349300620,620485733,RESEARCH:INCLUDES POTENTIAL DISCOVERIES OF NEW OUTCOMES WITH A GOAL OF ADVANCING PROGRESS BOTH INSTITUTIONALLY AND GLOBALLY.
201513529349300801,362170999,4227782,3937592,"AUXILIARY ENTERPRISES: RESIDENCE EDUCATION, STUDENT HOUSING, FOOD SERVICES, THE BOOKSTORE, AND CONFERENCING SERVICES ARE INCLUDED IN AUXILIARY SERVICES. 383 STUDENTS FILLED STUDENT HOUSING TO 95% CAPACITY IN 2015. NEW MIX OF DINING OPTIONS AND MORE OPTIONS FOR STUDENTS WITH FOOD ALLERGIES WERE ADDED TO THE MENU DURING THE YEAR. FOOD SERVICES ARE PROVIDED TO STUDENTS, FACULTY AND STAFF 16 HOURS PER DAY."
201503569349300310,580644897,3176898,203314
201523179349301942,570314374,"OTHER SERVICES INCLUDE A WIDE RANGE OF PROGRAMS INCLUDING RESEARCH, LIBRARY SERVICES, PUBLIC SERVICES, AND ACADEMIC SUPPORT."
201522889349301517,420680323,3912486,802855,ACADEMIC SUPPORT
201502969349301100,710887547,14700,14700,6637,"PETTIGREW SCHOLARSHIP: AWARDED TO INTERNS TO REIMBURSE THEM FOR THE COST OF TAKING THE ARCHITECTURAL REGISTRATION EXAM, WHICH ASSISTS THEM IN BECOMING LICENSED ARCHITECTS"
201513029349300706,390978445,4518892,561214,"ACADEMIC SUPPORT, FINE ARTS, AND OTHER PUBLIC SERVICES"
201533149349302508,061149131,EDUCATION OF MEN TO THE ROMAN CATHOLIC PRIESTHOOD.
201600129349300900,310840764,412555,439308,STUDENT SERVICES
201600139349300330,420680389,7245311,0,0,"Student Services Auxiliary Enterprises: Auxiliary enterprises including housing, food services and conferencing facilities available for student use. (1,725 students)"
201640099349300004,420680400,129429,0,1742587,Expenses consist of a Fair Value Hedge expense interest due to an interest rate exchange agreement for some longterm debt and a number of other smaller transactions
201640149349300229,930386890,1914102,42797,"WARNER PACIFIC CONTINUES TO BE RECOGNIZED FOR DIVERSITY AND VALUE. ""ONE OF THE BEST ONLINE COLLEGES IN OREGON BY AFFORDABLE COLLEGES ONLINE ""BEST COLLEGE FOR VETERANS - WEST BY US NEWS & WORLD REPORT BEST COLLEGES 2016 EDITION ""BEST VALUE SCHOOL - WEST FOR 2016 BY US NEWS & WORLD REPORT BEST COLLEGES 2016 EDITION ""TOP 10 REGIONAL COLLEGES IN THE WEST BY US NEWS & WORLD REPORT BEST COLLEGES 2016 EDITION ""BEST BANG FOR THE BUCK COLLEGE BY THE OTHER COLLEGE GUIDE 2015, RANKING 5TH FOR THE OREGON ""37TH IN THE NATION BY WASHINGTON MONTHLY'S COLLEGE GUIDE WHICH IDENTIFIES THE MOST PUBLIC-MINDED INSTITUTIONS EMBRACING THE ETHOS OF SERVICE TO THE COMMUNITY ""HONORED FOR EDUCATIONAL EXCELLENCE BY COLLEGES OF DISTINCTION COLLEGE GUIDE ""PRESIDENT COOK NAMED A 2015 ORCHID AWARD WINNER BY THE PORTLAND BUSINESS JOURNAL ""BEST ONLINE CHRISTIAN COLLEGE BY CHRISTIAN UNIVERSITIES ONLINE ""NAMED TO THE MILITARY FRIENDLY SCHOOLS LIST FOR THE 6TH CONSECUTIVE YEAR STUDENTS AT WARNER PACIFIC PARTICIPATE IN HANDS-ON SERVICE THROUGHOUT OUR COMMUNITY. TUTORING AT LOCAL SCHOOLS, PROVIDING FACILITIES IMPROVEMENTS TO NON-PROFIT ORGANIZATIONS, AND GETTING TO KNOW OUR FRIENDS WHO LIVE OUTDOORS ARE JUST A FEW OF THE WAYS THAT OUR STUDENTS HELP MAKE PORTLAND A BETTER PLACE. IN 2015, THE LOCAL CONNECT PROGRAM WAS LAUNCHED, WHICH LINKS STUDENTS TO MEANINGFUL LOCAL, LONG-TERM SERVICE OPPORTUNITIES THAT ALIGN WITH THEIR UNIQUE SKILLS AND INTERESTS. WARNER PACIFIC BELIEVES THAT CIVIC ENGAGEMENT EMPOWERS STUDENTS TO DEVELOP AND APPLY THEIR EDUCATIONAL SKILLS OUTSIDE OF THE CLASSROOM IN A PRACTICAL ENVIRONMENT, NETWORK LOCALLY, GAIN REAL-WORLD EXPERIENCE, AND EFFECTIVELY WORK TOWARD LASTING POSITIVE SOCIAL CHANGE. IN ADDITION TO CLOSE FACULTY RELATIONSHIPS, WARNER PACIFIC COLLEGE ALSO OFFERS FIRST-YEAR LEARNING COMMUNITIES (FYLCS) TO HELP STUDENTS BUILD A FOUNDATION OF SUCCESS AND SUPPORT THROUGHOUT THEIR COLLEGE EXPERIENCE. FYLCS ARE COHORTS OF 12-15 STUDENTS WHO PARTICIPATE TOGETHER IN LEARNING ACTIVITIES THAT EXTEND OUTSIDE THE TRADITIONAL CLASSROOM SETTING. ATHLETICS ARE ALSO A MAJOR PART OF CAMPUS LIFE. THE WARNER PACIFIC KNIGHTS ARE MEMBERS OF THE CASCADE COLLEGIATE CONFERENCE, WHICH IS PART OF THE NATIONAL ASSOCIATION OF INTERCOLLEGIATE ATHLETICS (NAIA) DIVISION II. WARNER PACIFIC STUDENT-ATHLETES ARE BOTH DEVOTED STUDENTS AND DEDICATED ATHLETES, REPRESENTING THE KNIGHTS ACROSS 13 MEN'S AND WOMEN'S VARSITY SPORTS. ""17 ATHLETES EARNED ACADEMIC ALL-CONFERENCE RECOGNITION FROM OUR CONFERENCE ""MEN'S BASKETBALL COACH, JARED VALENTINE, NAMED CCC COACH OF THE YEAR ""WOMEN'S SOCCER COACH, HOLLY POPENUK, NAMED CCC CO-COACH OF THE YEAR"
201600159349300645,620599339,13439547,13439547,"GRANTS & ALLOCATIONS - PROVIDES ASSISTANCE THROUGH FUNDED AND UNFUNDED SCHOLARSHIPS AND AWARDS TO THE APPROX 1,178 STUDENTS AND THROUGH GOVT FUNDED STUDENT FINANCIAL AID PROGRAMS TO APPROX 824 STUDENTS QUALIFYING FOR GOVT ASSISTANCE."
201600159349300625,560532303,7711664,1743711,"ACADEMIC SUPPORT - EXPENSES INCURRED TO PROVIDE SUPPORT SERVICES FOR THE INSTITUTION'S PRIMARY MISSION OF INSTRUCTION, INCLUDING THE LIBRARY, MEDIA SERVICES, AND TECHNOLOGY."
201503229349300230,420680408,1275804,0,Academic support programs
201503179349304600,743095284,109160,OFFERS A 2 YEAR COLLEGE DEGREE IN BUSINESS RELATED PROGRAMS. THE PROGRAMS ARE APPROVED AND ACCREDITATED BY THE NEW YORK STATE BOARD OF REGENTS. JOB COUNSELING AND JOB PLACEMENT SERVICES ARE PROVIDED TO ALL THE STUDENTS.
201503519349300545,730739626,2136711,3324663,"Golden Eagle Broadcasting America - Broadcast television programming that seeks to equip, empower, and educate through Spirit-Empowered Edu-tainment that will help viewers to live well - Spirit, Mind, and Body."
201503519349300545,730739626,216086,"Research - Conduct biomedical, academic, and other related research."
201503579349300400,521010577,212856,212561,COMMUNITY EDUCATION: COMMUNITY EDUCATION AND CONTINUING EDUCATION PROGRAMS ARE PROVIDED TO THE GENERAL PUBLIC AND ALUMNI.
201512789349300856,980149857,691128,0,148390,FINCA LA Flor
201512789349300856,980149857,1011753,0,1010133,Continuing Education Program (PEP)
201512789349300856,980149857,1055288,1055288,0,Support of Earth University Foundation
201513099349301686,562195966,2645,GRACE COLLEGE OF DIVINITY IS A BIBLICAL HIGHER EDUCATION INSTITUTION DEDICATED TO PREPARING EMERGING LEADERS TO CHANGE THE WORLD USING SKILLS LEARNED THROUGH THE COLLEGE'S CURRICULUM.
201523179349309127,953608910,23804,KOREAN PRESBYTERIAN THEOLOGICAL SEMINARY OFFERS RELIGIOUS STUDY PROGRAM
201610419349302106,590668483,16208318,1114988,5125872,"Education, General/Other: Institutional Support. Infrastructure to support the University and carryout it's primary goal of educating students. (~1500 students). Includes auxiliary expenses, business & fiscal, and presidents office under Depts. 100, 300, & 500 as well. Also includes student aid & discounts (shown contra-revenue in financial statements)."
201640219349300324,730579264,508662,0,2100826,"Institutional support for all services provided to approximately 2,000 students."
201630219349301003,020223339,108883,120744,"OTHER PROGRAM SERVICES INCLUDE (A) CONFERENCES AND WORKSHOPS, MOST OF WHICH OCCUR DURING THE SUMMER MONTHS, (B)BOOKSTORE SPACE RENTAL, (C)YOUTH SPORTS CAMPS RUN BY THE ATHLETIC DEPARTMENT DURING THE SUMMER, (D) RECOVERY OF ACCOUNTS RECEIVABLE EXPENSED IN PRIOR YEARS (E)STUDENT DORMITORY POLICY VIOLATION FEES, AND (F) STUDENT CLUB DUES AND REVENUES."
201610419349300716,610444650,10048808,1042894,"ACADEMIC SUPPORT - INCLUDES EXPENDITURES FOR THE ACADEMIC VICE PRESIDENT AND DEAN OF FACULTY'S OFFICE, LIBRARY, MEDIA SERVICES, STUDENT LAPTOP COMPUTER PROGRAM, AND OTHER RELATED ACTIVITIES THAT SUPPORT THE INSTRUCTIONAL MISSION OF THE COLLEGE."
201610419349300716,610444650,8959144,8239186,RESIDENCE HALLS AND DINING SERVICE FOR STUDENTS.
201610419349300716,610444650,4346449,4346449,3700000,"STUDENT AID-EXPENDITURES FOR SCHOLARSHIPS, GRANTS AND AWARDS TO STUDENTS. EXPENSES REPORTED INCLUDE PRIMARILY DIRECT STUDENT AID TO ASSIST WITH ROOM AND BOARD, BOOKS AND SUPPLIES. IN ADDITION, ALL DEGREE-SEEKING BEREA COLLEGE STUDENTS RECEIVE A FULL-TUITION SCHOLARSHIP, ALSO KNOWN AS A COST OF EDUCATION SCHOLARSHIP, THAT IS FUNDED PRIMARILY FROM THE SPENDABLE RETURN FROM THE ENDOWMENT. THE AMOUNT OF FULL-TUITION SCHOLARSHIPS FOR THE FISCAL YEAR WAS $38,993,800. THESE EXPENSES ARE PRIMARILY INCLUDED IN THE AREAS OF INSTRUCTION, STUDENT SERVICES, ACADEMIC SUPPORT, ETC."
201610419349300716,610444650,3950728,3111668,STUDENT INDUSTRIES COST OF OPERATIONS (EXCLUDING COST OF SALES) WHICH PROVIDE LABOR OPPORTUNITIES FOR STUDENTS.
201620339349301002,042111203,12791829,0,13965751,"Auxiliary Services includes providing high quality residence halls, food service, and book store services to Clark students. There are program expenditures of $12,791,829 and offsetting revenue of $13,965,751."
201620339349301002,042111203,12299788,0,2951202,"Student Services programs support an environment for students that encourages them to become active, involved and responsible citizens in global communities. Resources are expended to provide students support in achieving their non-academic goals and providing a balanced and healthy social environment."
201600429349301700,530199507,7036481,50536,0,Research
201600429349301700,530199507,4471672,500,798137,Public Services
201600289349301255,570324915,3622194,2904492,"AUXILIARY ENTERPRISES - EXPENDITURES FOR THE OPERATION OF STUDENT HOUSING, FOOD SERVICES, TELEPHONE SYSTEM, AND CAMPUS SHOP"
201600289349301255,570324915,2174820,ACADEMIC SUPPORT - EXPENDITURES IN CONNECTION WITH THE OPERATION OF THE COLLEGE'S LIBRARY.
201640129349300344,421457548,114597,134922
201630209349300733,952113260,2093342,63280,"ACADEMIC SUPPORT RELATING TO ACTIVITIES DESCRIBED ON LINE 4A, INCLUDING SERVING AS THE FISCAL AGENT TO PROJECT GRAD LOS ANGELES, A NONPROFIT INSTITUTION WHOSE PRIMARY OBJECTIVE IS TO HELP UNDERPRIVILEGED SCHOOL CHILDREN ACHIEVE HIGH SCHOOL GRADUATION AND SUCCESSFUL UNIVERSITY ENROLLMENT."
201620309349300107,454135256,267808,771976,"(A) GRANT HEALTHCARE-RELATED DEGREES INCLUDING THE DOCTOR OF MEDICINE DEGREE TO STUDENTS WHO SATISFACTORILY COMPLETE THE INSTITUTION'S DEGREE-SPECIFIC PROGRAMS OF MEDICAL EDUCATION AND TRAINING;(B) PROVIDE AND CONDUCT CONTINUINIG EDUCATION AND TRAINING PROGRAMS FOR HEALTHCARE PROVIDERS; (C) CHARGE AND COLLECT TUITION FROM PERSONS ENROLLED AS STUDENTS IN ITS EDUCATIONAL PROGRAMS AND AWARD SCHOLARSHIP AND FELLOWSHIPS TO STUDENTS;(D) HAVE AFFILIATIONS WITH HOSPITALS, MEDICAL CENTERS AND PRIVATE PHYSICIAN PRACTICES WHERE STUDENTS, RESIDENTS, AND FELLOWS CAN RECEIVE PRACTICAL EXPERIENCE AND TRAINING AS A PART OF THEIR EDUCATION;"
201600419349300925,931139187,1954386,1065838,"ACADEMIC SERVICES - CERTAIN SUPPORT SERVICES ARE AN INTEGRAL PART OF THE COLLEGE'S MISSION OF INSTRUCTION BUT ARE NOT CHARGED DIRECTLY TO THESE PRIMARY PROGRAMS. THESE INCLUDE THE LIBRARY, GALLERY, COMPUTER ARTS CENTER, ACADEMIC DEVELOPMENT, ACADEMIC COMPUTING SUPPORT, COURSE AND CURRICULUM DEVELOPMENT, STUDENT HOUSING, AND ACADEMIC ADMINISTRATION."
201630269349300208,930401259,9820057,0,0,"Student Services Programs: The University of Portland provides comprehensive support programs for our students to enable and promote their academic pursuits as well as their personal growth. Expenses in this category include International Student Services, Health and Career Services, Admissions, Registrar, Student Government and Activities, Financial Aid, and Intramurals."
201630269349300208,930401259,4260433,0,0,"Library Programs: The Wilson W. Clark Memorial Library serves the University of Portland community as a dynamic teaching library. The library accomplishes this through interactive instruction, by acquiring and organizing multi-format collections that support the curriculum, and by facilitating access to resources in the library and beyond."
201600269349300910,042108346,8090621,9355081,"AUXILIARY ENTERPRISES - DORMITORY, DINING HALLS, BOOKSTORE, STUDENT CENTER, ANIMAL HOSPITAL & CLINIC, DAYCARE CENTER, AND SNACKBAR"
201610269349301001,390821861,8341805,240164,OTHER PROGRAM SERVICES TO PROVIDE OPERATIONAL AND MAINTENANCE SUPPORT OF THE PLANT FOR HOLDING COURSES AND EDUCATIONAL COMMUNITY EVENTS.
201640149349301044,390806297,5352827,1793258,PROVIDE ACADEMIC SUPPORT TO 1500 STUDENTS THROUGH LIBRARY FACILITIES AND COMPUTER SERVICES.
201610409349301421,030197728,2943883,2798647,278,"SCHOLARSHIPS TO ASSIST STUDENTS WITH TUITION AND FEES. - COSTS TO OPERATE AND MAINTAIN FACILITIES, INCLUDES A LIBRARY FOR THE CONTINUED EDUCATION AND USE OF STUDENTS."
201600119349301160,381977050,RECRUITING COSTS AND SCHOLARSHIPS
201543179349303344,800470195,27199,THE TRAINING OF RELIGIOUS CLERGY TO DEAL WITH THE CURRENT ENVIRONMENT AND WORLD SITUATION
201533209349305753,231352008,2145726,883694,Integrated Learning Platform - Provides customized training and education to client companies in the financial services arena utilizing the College's resources.Certified Financial Analyst - Provides educational products for individuals preparing for the three levels testing that comprise the CFA examination.
201543149349303379,383790195,22700,48325,0,Compiled research for various clinical trials
201533139349302193,042104451,22410358,19019127,9974954,"AUXILIARY ENTERPRISES-PROVIDE DINING SERVICES, RESIDENTIAL HALL SERVICES, CHILDREN'S LEARNING CENTER, BOOKSTORE SERVICES, TELECOMMUNICATIONS SERVICES FOR APPROXIMATELY 2,070 STUDENTS."
201533139349302193,042104451,"OTHER PROGRAM SERVICES-SCHOLARSHIP AND GRANTS TO APPROXIMATELY 2,070 STUDENTS."
201533099349301973,953890724,478829,2719,THIS PROGRAM IS TO TEACH AND TRAIN STUDENTS IN THEOLOGICAL COURSES FOR SERVICE IN CHRISTIAN MINSTRY. IT HAD ABOUT 90 STUDENTS ENROLLED IN 26 CLASSES IN EACH QUARTER.
201533069349301488,362310478,0,0,78452,"THE ORGANIZATION RECEIVES OTHER PROGRAM SERVICE REVENUE RELATED TO ITS BOOKSTORE, FACULTY RESEARCH, STUDENT LOANS AND ADMINISTRATION OF ILLINOIS EYE INSTITUTE AND ILLINOIS EYE INSTITUTE FOUNDATION."
201610159349301806,410693962,2183531,54000,1809296,"OTHER SERVICES - RESEARCH, PUBLIC SERVICES, POST OFFICE, ETC."
201600409349301625,930309970,970137,569907,"CONTINUING EDUCATION, AUXILIARY ENTERPRISES AND OTHER PROGRAMS."
201610369349300826,750827421,2581893,281122,"STUDENT SERVICES: The mission of student services is to ensure that every student has the opportunity to develop as a godly servant-leader through his or her social, cultural, spiritual, physical, and emotional life. We provide advisement, programming, and services to enrich community, family life, personal interaction, social development, cultural awareness, physical development and campus diversity. The admissions department works to recruit and then equip entering students with the resources needed to have a successful graduate-studies experience. The registrar and counseling offices provide advising, counseling and testing services to facilitate personal, family and professional development. The Chaplains office encourages campus community life, worship, and spiritual development through chapel programming. The Dean of Students office provides opportunities for student participation in decision-making and leadership development through student groups."
201543209349313589,416059072,4000,4000,SCHOLARSHIPS TO STUDENTS
201610239349300401,351087173,3096970
201610099349300306,391399196,31130175,31130175,0,"Student Financial Aid Programs, General/Other: Scholarships and grants (2,106 students)"
201543439349300014,430817015,4099808,4633681,OPERATIONS AND MAINTENANCE - AUXILIARY
201543439349300014,430817015,SUPPORT FOR MAINTENANCE OF CAMPUS
201630289349300723,020344073,90879,DELIVERY OF EDUCATION AND SERVICES TO STUDENTS.
