object_id,ein,ExpnsAmt,Dsc
201641279349300629,161532850,3051684,0,1385954,"Other Program Services consists of: 1). The ""Presidents' Forum"" which provides higher education institutions the opportunity to exchange knowledge and perceptions of current models and tools for successful operation in an online environment; 2). The College's ""Educators Serving Educators"" program which works with higher education institutions to develop and deliver online programs and courses specializing in assisting institutions that serve individuals traditionally underrepresented in higher education; 3). The ""National Cybersecurity Institute at Excelsior College"" is an academic research center dedicated to assisting government, industry, military, and academic sectors meet the challenges in cybersecurity policy, technology, and education; 4). The Excelsior College Press which publishes contemporary nonfiction in areas, such as nursing, health care, business & technology, cybersecurity, alternative education, and military interest, that support the academic interests of the College; 5). The College collects interest on student loans."
201611349349307526,660561027,898595,"DURING 2014 THE ORGANIZATION REGULARLY EDUCATED THE PUBLIC IN PREVENTIVE HEALTH PROGRAMS AND PERFORMED INVESTIGATIONS TO IMPROVE THE QUALITY OF HEALTH SERVICES OFFERED TO THE CITIZENS. FURTHERMORE, THE ORGANIZATION EXPANDED AND IMPROVED THE SERVICES OFFERED TO PEDIATRIC AND OBSTETRIC PATIENTS, ACQUIRED NEW EQUIPMENT TO IMPROVE THE QUALITY OF SERVICES OFFERED, SUCH AS CARDIAC MONITORS AND MICROSCOPES. THE ORGANIZATION DEVELOPED THE NUTRITIONAL MANAGEMENT AND SKIN CARE COMMITTEE AND COMPLIED WITH THE INSTITUTIONAL PROGRAMS OF QUALITY AND RISK CONTROL, INFECTION CONTROL AMONG OTHERS. ADDITIONALLY DURING THE YEAR, THE ORGANIZATION MADE SEVERAL INFRASTRUCTURE IMPROVEMENTS TO THE HOSPITAL FACILITIES."
201600469349301835,620502739,8607023,11157411,"AUXILIARY SERVICES - OPERATED FOR THE CONVENIENCE OF STUDENTS, FACULTY, AND STAFF. INCLUDING RESIDENCE HALLS, DINING HALLS, CAMPUS BOOKSTORE, AND THE TELEPHONE SYSTEM"
201601379349302080,383071514,4312261,287945,1106088,"PUBLIC SERVICE: INSTITUTIONALLY, PRIVATELY, AND GOVERNMENT FUNDED SERVICE PROJECTS (94 PUBLIC SERVICE PROJECTS)"
201640999349300864,941156628,2716667,1865,SPONSORED RESEARCH INCLUDES EXPENDITURES FOR RESEARCH AND TRAINING.
201601069349300520,042199867,8818410,210152,ACADEMIC SUPPORT
201621259349300407,620479189,53117166,20861910,"CARSON-NEWMAN COLLEGE INTEGRATES ITS STUDENTS INTO BENEVOLENT MINISTRIES THAT IT OPERATES TO SERVICE THE INDIGENT (APPALACHIAN OUTREACH SPONSORS MISSION TRIPS, PROVIDES HOME REPAIR, A FOOD PANTRY, CLOTHING, HOUSEHOLD GOODS AND EDUCATIONAL PROGRAMS THAT INCLUDE TUTORING AND LIFE SKILLS TRAINING AND ITS SAMARITAN HOUSE PROVIDES TEMPORARY HOUSING FOR HOMELESS FAMILIES IN EAST TENNESSEE)."
201621099349300962,840404231,20751259,0,25712692,"RESEARCH AND PUBLIC SERVICE: THE UNIVERSITY OF DENVER FACULTY MEMBERS RECEIVED SUBSTANTIAL FUNDING FROM GOVERNMENTAL AND PRIVATE SOURCES TO SUPPORT THEIR SCHOLARSHIP. THE UNIVERSITY HAS LONG PROMOTED A TEACHER/SCHOLAR MODEL FOR ITS FACULTY, ENCOURAGING PROFESSIONS TO EXCEL IN THE CLASSROOM AND IN RESEARCH. MUCH OF THE FACULTY SCHOLARSHIP CONTRIBUTES TO THE UNIVERSITY OF SERVING THE PUBLIC GOOD."
201621099349300962,840404231,35166161,0,53551551,"AUXILIARY ACTIVITIES 2014-2015 ACADEMIC YEAR: THE AUXILIARY ENTERPRISES AT THE UNIVERSITY OF DENVER EXIST TO FURNISH GOODS OR SERVICES TO STUDENTS, FACULTY, STAFF, INSTITUTIONAL DEPARTMENTS AND THE PUBLIC. THE MOST PROMINENT OF THESE ENTERPRISES PROVIDE SUPPORT TO OUR STUDENTS WHICH INCLUDES; A UNIVERSITY HEALTH CENTER AND RESIDENCE AND FOOD FACILITIES. THE UNIVERSITY ALSO HAS A PERFORMING ARTS CENTER THAT HOSTS PERFORMANCES BY THE FACULTY AND STUDENTS OF THE UNIVERSITY AND THE REGION'S FINEST PERFORMING ARTS ORGANIZATIONS. A SMALL CONFERENCE AND EVENTS SERVICES DEPARTMENT ROUNDS OUT THE UNIVERSITY'S AUXILIARY ENTERPRISE ACTIVITIES."
201611049349301001,750800653,1180524,192272,Provide academic support through library and various academic departments of the university.
201621269349301047,470376583,18885641,0,15583744,Sponsored Research and Other Education and General
201640999349300444,750926755,5334429,9432215,"AUXILIARY AND OTHER SUPPORT SERVICES: INCLUDES HOUSING AND BOARD REVENUE, RESEARCH AND ROME FACILITIES EXPENSES AND OTHER ASSOCIATED EXPENSES AS WELL AS THE COST ASSOCIATED WITH THE UNIVERSITY EXECUTIVE OFFICE, ADMINISTRATIVE OFFICE AND BUSINESS OFFICE."
201611339349301626,363649217,21395867,12751855,14387012,"Institution dedicated to programs of study including but not limited to, degrees of nursing."
201641209349300309,580593414,6686076,398245,"Student Services: Funds expended for innovative programs and services which challenge students culturally, athletically and spiritually. The College strives to recruit and retain excellent students and empower them to reach their full potential. These expenditures provide support for extracurricular activities and student related services at the College which are essential to the students' well being and contribute to the quality of life outside the formal academic programs. Also, expenditures for student involvement in projects that impact the local community are included."
201641209349300309,580593414,7240601,10055186,"Auxiliary Services: Funds expended for meal services and the operation, repair and maintenance of the College's residence halls, dining hall, and recreation facility."
201641059349301029,750827465,42494796,6328262,SEE SCHEDULE O
201621379349308012,540505941,0,0,0
201601339349304195,580566133,33393981,33393981,0,"Higher Education: Scholarships and Student Aid allow Berry to meet its goal of making an excellent private liberal-arts education accessible to talented students from a wide range of social and economic backgrounds. (2,134 students)"
201601339349304195,580566133,0,0,1016395,Higher Education: Other program service revenue.
201601319349300510,135647700,19350526,AUXILIARY PROJECTS
201600499349300715,562244952,206520,239154,"CPCC PRESS PUBLICATION, ACA 122: COLLEGE TRANSFER SUCCESS, WAS ADOPTED BY SIX NC COMMUNITY COLLEGES; AS A RESULT OF THE ACA 122 COLLEGE TRANSFER SUCCESS BECOMING A REQUIRED COURSE FOR STUDENTS ENROLLED IN A.A. OR A.S. DEGREE PROGRAMS."
201600499349300715,562244952,103161,115180,EXPANDED COLLEGIATE TEST PREP BY ADDING GRE AND ACT EXAM PREPS TO OUR COURSE OFFERINGS AND EXPERIENCED SIGNIFICANT GROWTH IN STUDENT ENROLLMENT.
201600499349300715,562244952,44268,62123,THE ORGANIZATION EXPERIENCED A DRAMATIC INCREASE IN STEM CAMPS OFFERINGS AND NUMBER OF CAMPERS ENROLLED.
201600499349300715,562244952,520483,520483,CONTRIBUTIONS TRANSFERRED TO SUPPORT CPCC
201600499349300715,562244952,51741,330929,OTHER PROGRAMS
201601269349301925,420681046,5183994,"STUDENT SERVICES: ATHLETICS, HEALTH SERVICES, ADMISSIONS AND FINANCIAL AID."
201601319349302115,231352685,1196121403,311647000,1045951041,"PATIENT CARE- THE HOSPITAL OF THE UNIVERSITY OF PENNSYLVANIA (""HUP""), THE FLAGSHIP OF THE UNIVERSITY OF PENNSYLVANIA HEALTH SYSTEM'S FOUR HOSPITALS, WAS ESTABLISHED IN 1874 AS A TEACHING HOSPITAL TO COMPLEMENT THE MEDICAL EDUCATION RECEIVED BY STUDENTS AT THE UNIVERSITY OF PENNSYLVANIA'S MEDICAL SCHOOL, THE PERELMAN SCHOOL OF MEDICINE. IT HAS 18 CLINICAL DEPARTMENTS AND PROVIDES TRAINING IN MORE THAN 40 CLINICAL SPECIALTIES. MAJOR AREAS OF INVESTIGATION INCLUDE HEART DISEASE, CANCER, AND DISEASES OF AGING INCLUDING ALZHEIMER'S DISEASE, WOMEN'S HEALTH, DIABETES AND OBESITY. THE HEALTH SYSTEM, WITH 1,893 LICENSED HOSPITAL BEDS, IS A VALUED HEALTH-CARE RESOURCE, ESPECIALLY TO PEOPLE RESIDING IN THE GREATER PHILADELPHIA AREA. DURING THE COURSE OF A YEAR, IT ADMITS 84,000 PATIENTS AND ACCOUNTS FOR OVER 2.8 MILLION OUTPATIENT VISITS, MORE THAN 179,000 EMERGENCY ROOM VISITS AND MORE THAN 9,000 BIRTHS. HUP IS THE ONLY HOSPITAL IN THIS AREA THAT PERFORMS TRANSPLANTS OF ALL MAJOR ORGANS. PENN MEDICINE'S LEVEL 1 TRAUMA CENTER, WHICH OPERATES AROUND THE CLOCK TO CARE FOR PATIENTS WHO'VE BEEN CRITICALLY INJURED IN CAR ACCIDENTS, FALLS, AND THROUGH BLUNT AND PENETRATING TRAUMAS, IS NOW LOCATED AT PENN PRESBYTERIAN MEDICAL CENTER. THE CENTER CARES FOR MORE THAN 2,100 PATIENTS ANNUALLY, SEVERAL HUNDRED OF WHOM ARE TRANSFERRED FROM OTHER HOSPITALS VIA THE FLEET OF PENNSTAR MEDICAL HELICOPTERS AND GROUND AMBULANCES. BOTH HUP AND PENN PRESBYTERIAN MEDICAL CENTER ALSO CARE FOR A LARGE NUMBER OF PATIENTS WHO ARE TRANSFERRED HERE WITH TIME-SENSITIVE CARDIAC AND SURGICAL EMERGENCIES. IN KEEPING WITH ITS CHARITABLE PURPOSE, THE UNIVERSITY OF PENNSYLVANIA HEALTH SYSTEM (UPHS) (WHICH INCLUDES THE HUP AND CLINICAL PRACTICES OF THE UNIVERSITY OF PENNSYLVANIA (CPUP) DIVISIONS OF THE TRUSTEES OF THE UNIVERSITY OF PENNSYLVANIA), AS WELL AS CERTAIN AFFILIATES, ACCEPTS PATIENTS IN SERIOUS NEED OF MEDICAL CARE REGARDLESS OF THEIR FINANCIAL STATUS. THIS DEFINITION INCLUDES THOSE PATIENTS SUFFERING FROM A MEDICAL CONDITION MANIFESTING ITSELF BY ACUTE SYMPTOMS OF SUFFICIENT SEVERITY (INCLUDING SEVERE PAIN) SUCH THAT THE ABSENCE OF IMMEDIATE MEDICAL ATTENTION COULD REASONABLY BE EXPECTED TO RESULT IN (1) PLACING THE HEALTH OF THE INDIVIDUAL (OR, WITH RESPECT TO A PREGNANT WOMAN, THE HEALTH OF THE WOMAN OR HER UNBORN CHILD) IN SERIOUS JEOPARDY, OR (2) SERIOUS IMPAIRMENT TO BODILY FUNCTIONS. UPHS ALSO PROVIDES CARE TO PATIENTS WHO DO NOT HAVE HEALTH INSURANCE OR MEET THE CRITERIA TO QUALIFY FOR ITS CHARITY CARE POLICY, AND CERTAIN AMOUNTS CHARGED FOR SUCH SERVICES ARE DEEMED TO BE UNCOLLECTIBLE. UPHS MAINTAINS RECORDS TO IDENTIFY AND MONITOR THE LEVEL OF CHARITY CARE THEY PROVIDE. THESE RECORDS INCLUDE THE AMOUNT OF PAYMENT FORGONE, BASED ON ESTABLISHED RATES, FOR SERVICES AND SUPPLIES FURNISHED UNDER ITS CHARITY CARE POLICY. IN ADDITION TO PROVIDING DIRECT PATIENT CHARITY CARE, IN FURTHERANCE OF ITS EXEMPT PURPOSE TO BENEFIT THE COMMUNITY, THE UNIVERSITY OF PENNSYLVANIA HEALTH SYSTEM RECENTLY COMPLETED A COMMUNITY HEALTH NEEDS ASSESSMENT TO IDENTIFY THE MOST PRESSING HEALTH NEEDS IN THE SERVICE AREA AND DETERMINE HOW BEST TO ADDRESS THOSE NEEDS. THE UNIVERSITY OF PENNSYLVANIA HEALTH SYSTEM OPERATES EMERGENCY ROOMS OPEN TO THE PUBLIC 24 HOURS A DAY, 7 DAYS A WEEK; MAINTAINS RESEARCH FACILITIES FOR THE STUDY OF DISEASE AND INJURIES; PROVIDES FACILITIES FOR TEACHING AND TRAINING VARIOUS STUDENTS AND MEDICAL PERSONNEL; FACILITATES THE ADVANCEMENT OF MEDICAL AND SURGICAL EDUCATION; AND PROVIDES VARIOUS COMMUNITY SERVICES SUCH AS PROVIDING BASIC MEDICAL CARE FOR THE HOMELESS, TREATING OF CHRONIC DISEASE FOR LOW-INCOME RESIDENTS, AND PROVIDING WOMEN'S HEALTH SERVICES TO UNINSURED AND LOW-INCOME WOMEN OF ALL AGES; SCREENINGS FOR THE DETECTION OF BREAST, COLORECTAL, AND SKIN CANCER, CANCER SUPPORT GROUPS, A TOLL FREE NUMBER FOR CANCER INFORMATION, FREE IMMUNIZATION SHOTS, TRAINING PROGRAMS FOR THE CITY FIRE AND POLICE DEPARTMENTS, HEALTH EDUCATION CLASSES AND SPEECHES."
201601349349301855,550419865,1831354,1516575,"STUDENT SERVICES- TO PROVIDE SUPPORT FUNCTIONS FOR STUDENT HOUSING, DINING, AND ALL ASPECTS OF STUDENT LIFE INCLUDING INTRAMURAL ATHLETICS, THEATER, FINANCIAL SERVICES, AND OTHER STUDENT GROUPS AND ACTIVITIES."
201610449349300631,362662739,4377311,998,1814536,Other Program Services
201631209349300303,231352688,138379419,6882565,66681155,Other Program Services
201631339349302873,231352648,311437,Food Service- Catering
201631339349302873,231352648,276541,Food Service- Cash Receipts
201631339349302873,231352648,64488,Bookstore Commission
201631339349302873,231352648,18983,Vending and Non Credit Workshops
201600769349300305,251186257,1894978,FOOTNOTE ATTACHED
201600749349300900,660201206,17949437,1368613,239473,"Student Service - These are the expenditures for activities other than formal instruction that contribute to the student's emotional and physical well-being and to their intellectual, cultural and social development such as: student activities, cultural events, intramural athletics and others."
201600749349300900,660201206,15707646,132741,3465420,"Public Services - These are the expenditures mainly incurred for the operation of a non commercial television station providing educational and cultural programs to students and the community. Also included under this category are expenditures from activities developed for community service, mainly high school dropout students, socially and economically challenged students, academically outstanding students, and others."
201600749349300900,660201206,7361676,234510,30533979,"Academic Support - These are the expenditures incurred for activities and services to pursue the primary mission of the institution: instruction and research. Includes expenditures such as library books, audiovisual materials, those related to students retention, preservation and display of educational and historical materials, scientific displays and art objects."
201600749349300900,660201206,6633592,36479,265267,Research - These are expenditures incurred for activities developed to generate research outcomes that are carried out within academic departments. The research projects are commissioned by external agencies or separately budgeted by an organizational unit within the Institutions.
201600749349300900,660201206,1906961,27249,3744987,"Auxiliary Enterprises - These are the expenditures incurred for essentially self supporting operations of the institutions that exist to furnish a service to students, faculty and staff of the institutions, and incidentally to the general public. They include cafeterias, parkings, bookstores, and a printing shop."
201611339349304446,042452884,4129160,INSTITUTIONAL SUPPORT RELATED EXPENSE
201621379349303347,060646973,416175995,2731001,114604918
201611049349300816,460280847,44708,Other student fees and program support revenue
201601209349301025,203979266,3273,.
201631339349302453,362177139,510852821,842660,158939245,THE OTHER PROGRAM SERVICES THAT SUPPORT THE MISSION OF INSTRUCTION AND RESEARCH ARE:AUXILIARY ENTERPRISESLIBRARYOTHER STUDENT SERVICESINFORMATION SERVICESOPERATION AND MAINTENANCE OF PLANT
201601189349300540,231352668,9179293,INSTITUTIONAL SUPPORT/AUXILARY ENTERPRISE/RESEARCH
201611069349300511,042104149,3414119,362385,ACADEMIC SUPPORT: THE COLLEGE OFFERS SEVERAL ACADEMIC SUPPORT PROGRAMS INCLUDING STRUCTURED SEMESTER PROGRAMS AS WELL AS INDIVIDUALIZED TUTORING PROGRAMS. THE STUDENTS ALSO HAVE ACCESS TO A FULL SERVICE LIBRARY LEARNING CENTER AND ACADEMIC COMPUTING.
201640399349300884,410747165,2215263,OTHER PROGRAM SERVICES INCLUDE OPERATIONS AND MAINTENANCE OF PLANT AND INSTITUTIONAL SUPPORT. THESE PROGRAMS PROVIDE SERVICES TO OPERATE AND MAINTAIN BUILDINGS AND GROUNDS AND TO SUPPORT INSTITUTIONAL OPERATIONS OTHER THAN MANAGEMENT AND GENERAL.
201610499349300601,910564993,11060490,0,0,Higher Education: Student Services for On-Campus and Extension Students leading to undergraduate and graduate degrees.
201620679349300757,910473310,214236,177647
201610649349300321,951643992,22227270,33659688,AUXILIARY ENTERPRISES
201640439349300939,480543728,2212232,287165,"INSTITUTIONAL SUPPORT - INCLUDES EXPENSES FOR PRESIDENT, ACADEMIC ADMINISTRATION, TELEPHONE, SUPPLIES, POSTAGE, TRAVEL, INTEREST, PROFESSIONAL MEMBERSHIPS, ETC."
201600479349301495,660379122,18808056,18808056,"THE ORGANIZATION PROVIDES GRANTS TO LOW-INCOME STUDENTS, BASED ON ELIGIBILITY AND GRANTS FOR STUDENTS WITH ACADEMIC EXCELLENCE."
201631099349300518,741109661,16492240,2555717,Higher education: Student services:
201631099349300518,741109661,"Enrollment services, registrar, athletics,"
201631099349300518,741109661,health services and counseling.
201611119349300931,951643389,28609754,0,110443,PUBLIC SUPPORT AND STUDENT SERVICES
201631069349300518,750800689,17126715,10317199,"ORGANIZED ACTIVITIES: ORGANIZED ACTIVITIES MAKE AVAILABLE TO THE PUBLIC VARIOUS RESOURCES THAT EXIST WITHIN THE UNIVERSITY SUCH AS SEMINARS, CONFERENCES AND CAMPS."
201600759349301200,941021164,5215629,3659445,"Auxiliary, housing, and food services."
201630649349300243,362170136,20453172,21470108,"STUDENT SERVICES:- This program provides health, academic, transitional assistance, student orientation and other student services including the student finance center, admissions, and registration. In addition, these services also include the dean of students and student activities and minority programs."
201630649349300243,362170136,18665565,15282281,"AUXILIARY SERVICES:- This provides for campus housing and dining for the students and includes residence halls and a dining room, apartment-style buildings, six fraternity houses, and three sorority houses."
201640439349301729,131624158,34314064,9441362,AUXILIARY ENTERPRISES-HOUSING ON CAMPUS FOR SINGLE AND MARRIED STUDENTS;OFF CAMPUS HOUSING FOR FACULTY AND OTHER UNIVERSITY PERSONNEL; FOOD SERVICE CONSISTS OF CAFETERIA DINING FACILITIES; PRESS INCLUDES JOURNALS AND SUBSCRIPTIONS.
201640419349301304,222586208,1200445,38158,1429254,Other programs offered during the year
201620409349300007,540505945,3386251,0,0,"Other - Research, Public Support and Academic Support"
201640369349300524,382410852,26239857,192345,4553430,"All other Program Services includes Academic Support, Student Services, Institutional Services, and Auxiliary Services."
201611379349302336,620475697,3936406,104210,1031167,OTHER PROGRAM SERVICES: OTHER PROGRAM EXPENSES ARE PRIMARILY COMPRISED OF EXPENSES RELATED TO FACULTY RESEARCH ACTIVITIES AND OF EXPENSES RELATED TO PLANT MAINTENANCE AND OPERATION.
201611379349305386,580814544,644231,"Academic support - ITC is dedicated to producing public theologians - men and women who are intellectually keen, politically sophisticated, economically savvy, culturally sensitive, family friendly, technologically literate, and spiritually astute. A key role of these public theologians is to serve as liaisons - facilitators of new alliances - between America's churches and other nonprofit organizations, corporations, foundations, and government entities."
201600499349300215,750827409,13271720,1040489,"STUDENT SERVICES SUCH AS EXTRA-CURRICULAR PROGRAMMING, HEALTH SERVICES, LOAN CANCELLATIONS FOR STUDENTS, OPERATION AND MAINTENANCE OF FACILITIES FOR INSTRUCTIONAL PURPOSES AS WELL AS ACADEMIC SUPPORT FACILITES."
201601309349301480,620476822,379426831,168187851,"Other program services include public service, academic support, institutional support, student services, room and board, and other auxiliary services. Vanderbilt University engages in a variety of public service projects, including, but not limited to: supporting HIV care and treatment programs in rural Mozambique and Nigeria, Africa; developing training materials for current and future K-12 school leaders; formulating new approaches to increase health, safety, quality and outcomes, while decreasing total costs; and many other sponsored community health and educational programs."
201621339349305877,231352689,16995,56299,"Student HousingWestminster Seminary offers limited housing at our Church Road campus in Glenside, PA. Currently we can accommodate nine men in Machen Hall and five women in the Church Road gatehouse."
201621379349307557,450273403,13166536,347483,2014142,"Educational Plant Operations, Financial Affairs, General Institutional, Public Affairs, Enrollment Services, and all other services including General Administration, Academic Affairs, Student Development, and Student Senate."
201641339349302039,580619030,3054746,29097,"Academic Support - Students study the traditional liberal arts and sciences, and selected professional and pre-professional programs. Faculty serve as teachers, mentors, and scholars promoting intellectual inquiry that develops the mind and spirit. Activities both inside and outside the classroom, facilitated by faculty and staff, afford students opportunities for intellectual, social, emotional, physical, and spiritual growth that prepare them for meaningful service to their local, regional, and global communities."
201631379349305533,131624067,4914468,0,398699,Student performing arts productions
201631379349305533,131624067,5193211,0,161556,Digital and International Education Initiatives
201641339349305709,956002998,2732092,322343,2533899,"OTHER GRADUATE PROGRAMS, INCLUDING: RELIGION (LEADERSHIP STUDIES OR THEOLOGICAL STUDIES) CLINICAL PSYCHOLOGY, ORGANIZATIONAL PSYCHOLOGY, AND NURSING. STUDENTS IN THE GRADUATE PROGRAMS AT VANGUARD CAN COMPLETE THEIR MASTERS IN JUST TWO YEARS. COURSES ARE OFFERED AT CONVENIENT TIMES INCLUDING EVENINGS AND WEEKENDS."
201630509349300803,270115197,217635,105400,"NON-PROFIT EDUCATIONAL INSTITUTION SPECIALIZING IN THE FIELD OF HUMANITIES AND OFFERS DISTANCE EDUCATION THROUGH E-LEARNING AND M-LEARNING TO AKK INDEPENDENT SELF-LEARNERS IN THE WORLD. SUPPORTS INDEPENDENT LIFELONG LEARNING IN THE FIELD OF HUMANITIES. THE HUMANITIES INSTITUTE WAS FOUNDED IN ORDER TO PROVIDE, AT NO COST IN ANY OF ITS COURSES OR PROGRAMS, OPPORTUNITIES FOR ADVANCED STUDY IN THE LIBERAL ARTS TO THOSE WHO FOR VARIOUS REASONS ARE UNABLE TO PURSUE CONVENTIONAL FORMS OF EDUCATION. HUMANITIES UNIVERSITY ""OPEN COURSE WARE"" OFFERS HIGH QUALITY COURSE MATERIALS IN ORDER TO MAKE ONLINE EDUCATION IN THE HUMANITIES AVAILABLE TO ALL INDEPENDENT LEARNERS THROUGHOUT THE WORLD AT NO COST TO THE STUDENT."
201631339349302048,042103731,7186359,Academic Support Expenditures
201611349349305551,231386178,20101592,19891125,"AUXILIARY SERVICES - EXPENSES INCURRED PRIMARILY FOR HOUSING AND FEEDING ON AVERAGE OF 1,600 STUDENTS PER SEMESTER, AS WELL AS OPERATING THE CAMPUS BOOKSTORE."
201641339349301409,250965591,582988007,172036122,132597587,"EXPENSES GRANTS REVENUESTUDENT SERVICES 145,837,606 SCHOLARSHIPS AND FELLOWSHIPS 171,132,871 171,132,871AUXILIARY ENTERPRISES 131,538,843 132,597,587LIBRARIES 48,522,413 PUBLIC SERVICE 85,956,274 903,251"
201641339349302479,951664112,OTHER: PUBLIC SERVICE INSTITUTIONAL
201641339349302479,951664112,29629553,213470,& ACADEMIC SUPPORT
201611379349308936,530196603,90444761,2110632,56062412,"OTHER PROGRAM SERVICES: Including student services expenditures for activities whose primary purpose is to contribute to the student's emotional and physical well-being and to his or her intellectual, cultural, and social development outside the context of the formal instruction program."
201611379349308936,530196603,68640206,0,107592262,"AUXILIARY SERVICES: VARIOUS GOODS AND SERVICES ARE PROVIDED FOR THE BENEFIT OF STUDENTS, FACULTY AND STAFF. THE PRIMARY CATEGORIES INCLUDED ARE FOOD AND VENDING SERVICES, BANKING SERVICES, MAIL SERVICES, PRINTING AND GRAPHICS SERVICES, BOOKSTORES, PARKING FACILITIES, TRANSPORTATION SERVICES AND A CONFERENCE CENTER AND GUEST FACILITY."
201611379349308936,530196603,14020759,0,0,"PUBLIC SERVICE: PRIMARILY THROUGH THE RECEIPT OF GOVERNMENT AND PRIVATE GRANTS AND CONTRACTS, GEORGETOWN UNIVERSITY IS ABLE TO PROVIDE COMMUNITY SERVICE PROGRAMS AND NON-INSTRUCTIONAL SERVICES BENEFICIAL TO INDIVIDUALS AND GROUPS EXTERNAL TO THE UNIVERSITY."
201601379349308720,941186179,780118,427851,GENERAL INSTITUTIONAL SUPPORT.
201631349349303358,135598093,65319047,0,0,LIBRARY
201631349349303358,135598093,255957496,0,0,CAMPUS OPERATIONS
201631349349303358,135598093,294829392,0,0,INSTITUTIONAL SUPPORT
201631349349303358,135598093,110157402,0,157434287,AUXILIARY ENTERPRISES
201631349349303358,135598093,138260173,1691638,4184559,OTHER SOURCES
201641349349303979,362387148,2128522,3060446,"Off Campus Programs: Trinity offers both domestic and international off campus programs. Trinity's proximity to downtown Chicago provides access to internships, cultural experiences, and career and service opportunities. The Chicago Semester program enables students to gain real- world experience through living and working in the city for an entire semester. Students gain hands-on learning through the global opportunities to study abroad for a semester in countries worldwide."
201621379349306817,231352635,12408634,0,23106990,"AUXILIARY OPERATIONS: ACADEMIC SUPPORT, RESEARCH, PUBLIC SERVICE, AND INSTITUTIONAL SUPPORT."
201621379349306817,231352635,6462119,4207,9138,ACADEMIC SUPPORT
201621379349306817,231352635,3754388,549671,0,RESEARCH
201621379349306817,231352635,1091287,910,0,PUBLIC SERVICE
201621379349306817,231352635,1523922,330194,2655360,INSTITUTIONAL SUPPORT
201611629349300141,951644037,14900298,0,2742928,"PUBLIC SERVICE - THE UNIVERSITY OFFERS NUMEROUS SERVICES TO THE GENERAL PUBLIC, INCLUDING ART EXHIBITS, CONCERTS, PRODUCTIONS, AND OTHER PUBLIC BENEFIT ACTIVITIES"
201611349349302416,250983069,1000424,Public Service
201611349349302416,250983069,9237351,9237351,Student Assistance
201611349349302416,250983069,9119294,6171616,Auxiliary Service (Room and Board)
201601379349304365,550357072,547662,OTHER PROGRAM SERVICES
201611599349300916,370662594,"INSTRUCTION TO OVER 1,850 STUDENTS FOR BACCALAUREATE DEGREES IN THE LIBERAL ARTS AND SCIENCES, NURSING, FINE ARTS, DRAMA AND MUSIC. STUDENT SERVICES INCLUDE STUDENT PROGRAMMING, HOUSING, AND BOARD."
201621379349301582,381359081,12515292,442060,VARIOUS OTHER PROGRAM SERVICES RELATING TO THE ORGANIZATION'S MISSION.
201611379349305351,363108821,98714,103378,Auxilliary Services
201611379349305351,363108821,2134450,Workforce Training and Adult Education
201611379349305351,363108821,1480590,"Academic Support - includes the expenses/activities for academic administration and computing support, the Learning Resource Center, and our various locations that support students' educational needs outside of direct instruction."
201611379349305351,363108821,705685,Other Program Services
201631379349301333,930386839,15654947,0,1251850,"ADMISSIONS, HOUSING, FOOD SERVICE AND MANAGEMENT & GENERAL."
