object_id,ein,RcpntBsnssNm_BsnssNmLn1Txt,USAddrss_AddrssLn1Txt,USAddrss_CtyNm,USAddrss_SttAbbrvtnCd,USAddrss_ZIPCd,RcpntTbl_RcpntEIN,RcpntTbl_IRCSctnDsc,RcpntTbl_CshGrntAmt,RcpntTbl_PrpsOfGrntTxt
201500449349302610,610444650,MCCREARY COUNTY FISCAL COURT,PO BOX 579,WHITLEY CITY,KY,42653,610955941,KY STATE GOVT ENTITY,4000,SUPPORT OF ORGANIZATION WORKING TO IMPROVE GENERAL WELFARE WITHIN THE APPALACHIAN REGION
201500449349302610,610444650,MORGAN COUNTY AGROTOURISM AND LOCAL HERITAGE,PO BOX 309,WEST LIBERTY,KY,41472,270605653,501(C)(3),6700,SUPPORT OF ORGANIZATION WORKING TO IMPROVE GENERAL WELFARE WITHIN THE APPALACHIAN REGION
201500449349302610,610444650,NATIONAL CENTER FOR APPROPRIATE TECHNOLOGY INC,3040 CONTINENTAL DRIVE,BUTTE,MT,59701,810361047,501(C)(3),11550,SUPPORT OF ORGANIZATION WORKING TO IMPROVE GENERAL WELFARE WITHIN THE APPALACHIAN REGION
201500449349302610,610444650,NEW LIBERY BAPTIST SUNDAY,300 COLLINS ST,RICHMOND,KY,40475,260664637,501(C)(3),5000,SUPPORT OF ORGANIZATION WORKING TO IMPROVE GENERAL WELFARE WITHIN THE APPALACHIAN REGION
201500449349302610,610444650,NEW OPPORTUNITY SCHOOL,204 CHESTNUT ST,BEREA,KY,40403,611323868,501(C)(3),25000,SUPPORT OF ORGANIZATION WORKING TO IMPROVE GENERAL WELFARE WITHIN THE APPALACHIAN REGION
201500449349302610,610444650,OWSLEY COUNTY BOARD OF EDUCATION,RR3 BOX 340,BOONEVILLE,KY,41314,616001246,KY STATE GOVT ENTITY,12000,SUPPORT OF ORGANIZATION WORKING TO IMPROVE GENERAL WELFARE WITHIN THE APPALACHIAN REGION
201500449349302610,610444650,PAINT LICK FAMILY CLINIC,11652 HWY 52 PO BOX 65,PAINT LICK,KY,40461,611362819,501(C)(3),16500,SUPPORT OF ORGANIZATION WORKING TO IMPROVE GENERAL WELFARE WITHIN THE APPALACHIAN REGION
201500449349302610,610444650,PEOPLE ENCOURAGING PEOPLE INC,PO BOX 285,BEATTYVILLE,KY,41311,311737260,501(C)(3),15212,SUPPORT OF ORGANIZATION WORKING TO IMPROVE GENERAL WELFARE WITHIN THE APPALACHIAN REGION
201500449349302610,610444650,PINE MOUNTAIN SETTLEMENT SCHOOL,36 HIGHWAY 510,BLEDSOE,KY,40810,610444789,501(C)(3),52610,SUPPORT OF ORGANIZATION WORKING TO IMPROVE GENERAL WELFARE WITHIN THE APPALACHIAN REGION
201500449349302610,610444650,PROJECT WORTH OUTREACH,PO BOX 28,MEANS,KY,40346,611262974,501(C)(3),43726,SUPPORT OF ORGANIZATION WORKING TO IMPROVE GENERAL WELFARE WITHIN THE APPALACHIAN REGION
201500449349302610,610444650,PULASKI COUNTY COOPERATIVE EXTENSION SERVICE,PO BOX 720,SOMERSET,KY,42502,611077656,KY STATE GOVT ENTITY,350,SUPPORT OF ORGANIZATION WORKING TO IMPROVE GENERAL WELFARE WITHIN THE APPALACHIAN REGION
201500449349302610,610444650,RED BIRD MISSION,70 QUEENDALE CTR,BEVERLY,KY,40913,610674373,501(C)(3),48753,SUPPORT OF ORGANIZATION WORKING TO IMPROVE GENERAL WELFARE WITHIN THE APPALACHIAN REGION
201500449349302610,610444650,RED BIRD MOUNTAIN MEDICAL CENTER,53 QUEENDALE CENTER,BEVERLY,KY,40913,610945454,501(C)(3),22000,SUPPORT OF ORGANIZATION WORKING TO IMPROVE GENERAL WELFARE WITHIN THE APPALACHIAN REGION
201500449349302610,610444650,ROMAN CATHOLIC DIOCESE OF LEXINGTON,203 SOUTH CENTRAL AVE,LEXINGTON,KY,42501,611132894,501(C)(3),5000,SUPPORT OF ORGANIZATION WORKING TO IMPROVE GENERAL WELFARE WITHIN THE APPALACHIAN REGION
201500449349302610,610444650,RURAL RESOURCES INC,2870 HOLLEY CREEK RD,GREENEVILLE,TN,37745,621546161,501(C)(3),8330,SUPPORT OF ORGANIZATION WORKING TO IMPROVE GENERAL WELFARE WITHIN THE APPALACHIAN REGION
201500449349302610,610444650,SAINT JOSEPH BEREA HOSPITAL FOUNDATION INC,305 ESTILL STREET,BEREA,KY,40403,260152877,501(C)(3),10000,SUPPORT OF ORGANIZATION WORKING TO IMPROVE GENERAL WELFARE WITHIN THE APPALACHIAN REGION
201500449349302610,610444650,SCOTT CHRISTIAN CARE CENTER,PO BOX 5373,ONEIDA,TN,37841,453574908,501(C)(3),84706,SUPPORT OF ORGANIZATION WORKING TO IMPROVE GENERAL WELFARE WITHIN THE APPALACHIAN REGION
201500449349302610,610444650,ST VINCENT MISSION INC,PO BOX 232,DAVID,KY,41616,610961940,501(C)(3),30730,SUPPORT OF ORGANIZATION WORKING TO IMPROVE GENERAL WELFARE WITHIN THE APPALACHIAN REGION
201500449349302610,610444650,STATE OF WEST VIRGINIA DEPARTMENT DEPT OF AGRICULTURE,1900 KANAWHA BLVD EAST,CHARLESTON,WV,25305,556000765,WV STATE GOVT ENTITY,9850,SUPPORT OF ORGANIZATION WORKING TO IMPROVE GENERAL WELFARE WITHIN THE APPALACHIAN REGION
201500449349302610,610444650,STEP BY STEP INC,1701 FIFTH AVE,CHARLESTON,WV,25312,550746556,501(C)(3),41335,SUPPORT OF ORGANIZATION WORKING TO IMPROVE GENERAL WELFARE WITHIN THE APPALACHIAN REGION
201500449349302610,610444650,SUSTAINABLE PIKE COUNTY INC,237 2ND ST,PIKEVILLE,KY,41501,464956888,501(C)(3),5025,SUPPORT OF ORGANIZATION WORKING TO IMPROVE GENERAL WELFARE WITHIN THE APPALACHIAN REGION
201500449349302610,610444650,TEACH FOR AMERICA,309 PINE ST,HAZARD,KY,41701,133541913,501(C)(3),3500,SUPPORT OF ORGANIZATION WORKING TO IMPROVE GENERAL WELFARE WITHIN THE APPALACHIAN REGION
201500449349302610,610444650,THE CIVIC GARDEN CENTER OF GREATER CINCINNATI,2715 READING RD,CINCINNATI,OH,45206,310559893,501(C)(3),6700,SUPPORT OF ORGANIZATION WORKING TO IMPROVE GENERAL WELFARE WITHIN THE APPALACHIAN REGION
201500449349302610,610444650,THE DAVID SCHOOL,PO BOX 1,DAVID,KY,41616,310889471,501(C)(3),34000,SUPPORT OF ORGANIZATION WORKING TO IMPROVE GENERAL WELFARE WITHIN THE APPALACHIAN REGION
201500449349302610,610444650,UNIVERSITY OF KENTUCKY- DIABETES IN CHILDREN,219 STURGILL DEVELOPMENT BLDG,LEXINGTON,KY,40506,616001218,KY STATE GOVT ENTITY,15000,SUPPORT OF ORGANIZATION WORKING TO IMPROVE GENERAL WELFARE WITHIN THE APPALACHIAN REGION
201500449349302610,610444650,UNION CHURCH,213 PROSPECT ST,BEREA,KY,40403,610444677,501(C)(3),9000,SUPPORT OF ORGANIZATION WORKING TO IMPROVE GENERAL WELFARE WITHIN THE APPALACHIAN REGION
201500449349302610,610444650,UNION COUNTY INDUSTRIAL FOUNDATION INC,100 WEST MAIN ST,MORGANFIELD,KY,42437,611181470,501(C)(3),11916,SUPPORT OF ORGANIZATION WORKING TO IMPROVE GENERAL WELFARE WITHIN THE APPALACHIAN REGION
201500449349302610,610444650,VIRGINIA POLYTECHNIC INSTITUTE AND STATE UNIVERSITY,300 TURNER ST,BLACKSBURG,VA,24061,546001805,VA STATE GOVT ENTITY,6000,SUPPORT OF ORGANIZATION WORKING TO IMPROVE GENERAL WELFARE WITHIN THE APPALACHIAN REGION
201500449349302610,610444650,WESTCARE KENTUCKY INC,108 MAIN ST,IRVINE,KY,40336,202080016,501(C)(3),41750,SUPPORT OF ORGANIZATION WORKING TO IMPROVE GENERAL WELFARE WITHIN THE APPALACHIAN REGION
201500449349302610,610444650,WILLIAMSON HEALTH & WELLNESS CENTER,PO BOX 722,WILLIAMSON,WV,25661,452849701,501(C)(3),6120,SUPPORT OF ORGANIZATION WORKING TO IMPROVE GENERAL WELFARE WITHIN THE APPALACHIAN REGION
201501359349306860,540946734,GRACE CITY CHURCH,PO BOX 97815,LAS VEGAS,NV,89193,453753315,501(C)(3),5000,STUDENT INTERNSHIPS
201501359349306860,540946734,SIM (SERVING IN MISSIONS),PO BOX 7900,CHARLOTTE,NC,28241,221936391,501(C)(3),10998,ADVANCE THE GOSPEL OF JESUS CHRIST
201501359349306860,540946734,WORLD HELP,PO BOX 501,FOREST,VA,24551,541615454,501(C)(3),72430,SUPPORT OF STUDENTS IN CHRISTIAN MISSIONS
201501359349306860,540946734,TEENPACT,610 MOOREFIELD PARK DRIVE,RICHMOND,VA,23236,582252295,501(C)(3),20000,STUDENT LEADERSHIP SCHOOLS
201501359349306860,540946734,ACADEMY OF FINE ARTS,600 MAIN ST,LYNCHBURG,VA,24504,237061145,501(C)(3),170681,SUPPORT THE FINE ARTS OF LYNCHBURG
201501359349306860,540946734,SOUTHERN BAPTIST CONSERVATIVES OF VA,4956 DOMINION BLVD,GLEN ALLEN,VA,23060,541672892,501(C)(3),34000,STUDENT INTERNSHIPS
201501359349306860,540946734,P & B FOUNDATION,2004 VALENCIA TERRACE,CHARLOTTE,NC,28226,237083912,501(C)(3),500000,GLOBAL MISSIONS
201501359349306860,540946734,LIBERTY UNIVERSITY FOUNDATION,1971 UNIVERSITY BLVD,LYNCHBURG,VA,24515,541939910,501(C)(3),1056981,GENERAL SUPPORT
201501359349306860,540946734,OLD TIME GOSPEL HOUR,1971 UNIVERSITY BLVD,LYNCHBURG,VA,24515,237293001,501(C)(3),12596,GENERAL SUPPORT
201501359349306860,540946734,THOMAS ROAD BAPTIST CHURCH,1 MOUNTAIN VIEW RD,LYNCHBURG,VA,24502,260061907,501(C)(3),60000,GENERAL SUPPORT
201501359349306860,540946734,UNITED WAY,1010 MILLER PARL SQUARE,LYNCHBURG,VA,24501,540505923,501(C)(3),25000,DISASTER RELIEF
201501359349306860,540946734,LIBERTY GODPARENT HOME,1971 UNIVERSITY BLVD,LYNCHBURG,VA,24515,521372460,501(C)(3),102328,CHRISTIAN OUTREACH FOR UNWED MOTHERS
201501319349302635,231352187,PENN STATE UNIVERSITY,201 OLD MAIN,UNIVERSITY PARK,PA,16802,246000376,501C3,10000,BREAST CANCER AWAREN
201501319349302635,231352187,ALL OTHER CONTRIBUTIONS COMBINED,EACH INDIVIDUALLY 5000 OR LESS,DANVILLE,PA,17822,9909
201501359349300300,942955205,SHIN SHIN EDUCATION FOUNDATION,433 CALIFORNIA ST,SAN FRANCISCO,CA,94104,770524748,501(C)(3),50000,"DONATION TO RENOVATE ELEMENTARY SCHOOLS IN REMOTE, RURAL AND DESPONDENT REGIONS IN CHINA"
201501359349300935,460224604,MITCHELL TECH INSTITUTE FOUNDATION,1800 E SPRUCE ST,MITCHELL,SD,57301,460452950,501(C)(3),45000,DONATION
201501359349300935,460224604,DE SMET COMMUNITY FOUNDATION,PO BOX 42,DE SMET,SD,57231,461401425,501(C)(3),25000,DONATION
201501359349300935,460224604,DAKOTA WESLEYAN UNIVERSITY,1200 W UNIVERSITY AVE,MITCHELL,SD,57301,460224589,501(C)(3),28500,DONATION
201501329349302005,520595110,3 PHOENIX INC,14585 AVION PARKWAY,CHANTILLY,VA,201511132,201633533,84880,0,N/A,N/A,RESEARCH SPONSORED SUB-AWARD
201501329349302005,520595110,3D IMAGING DRUG DESIGN AND,8060 COUNTS MASSIE RD,MAUMELLE,AR,721136657,208888150,24504,0,N/A,N/A,RESEARCH SPONSORED SUB-AWARD
201501329349302005,520595110,3TEX INC,208 LAUREL HILLS DR,RUTHERFORDTON,NC,28139,561990412,27915,0,N/A,N/A,RESEARCH SPONSORED SUB-AWARD
201501329349302005,520595110,99999 CONSULTING LLC,7032 BRADWOOD COURT,SPRINGFIELD,VA,22151,455428863,229083,0,N/A,N/A,RESEARCH SPONSORED SUB-AWARD
201501329349302005,520595110,ABINGTON MEMORIAL HOSPITAL,1200 OLD YORK RD,ABINGTON,PA,190013720,231352152,44203,0,N/A,N/A,RESEARCH SPONSORED SUB-AWARD
201501329349302005,520595110,ABSL POWER SOLUTIONS INC DBA ABSL SPACE PRODUCTS,1751 S FORDHAM STREET,LONGMONT,CO,80503,203905678,785753,0,N/A,N/A,RESEARCH SPONSORED SUB-AWARD
201501329349302005,520595110,ABT ASSOCIATES INC,55 WHEELER ST,CAMBRIDGE,MA,02138,042347643,33951,0,N/A,N/A,RESEARCH SPONSORED SUB-AWARD
201501329349302005,520595110,AC CENTER INC,259 MONROE AVE,ROCHESTER,NY,14607,161356734,81864,0,N/A,N/A,RESEARCH SPONSORED SUB-AWARD
201501329349302005,520595110,ACCURATE INFRASTRUCTURE DATA INC,1100 BATAVIA FARM ROAD,BALTIMORE,MD,212372816,202155441,51645,0,N/A,N/A,RESEARCH SPONSORED SUB-AWARD
201501329349302005,520595110,ACOUSTIC MEDSYSTEMS INC,206 N RANDOLPH ST STE 301,CHAMPAIGN,IL,618203979,371365835,229753,0,N/A,N/A,RESEARCH SPONSORED SUB-AWARD
201501329349302005,520595110,ADCOLE CORPORATION,PO BOX 39,MARLBOROUGH,MA,01752,042224182,901810,0,N/A,N/A,RESEARCH SPONSORED SUB-AWARD
201501329349302005,520595110,ADVANCED ACOUSTIC CONCEPTS LLC,425 OSER AVENUE,HAUPPAUGE,NY,11788,204992653,122213,0,N/A,N/A,RESEARCH SPONSORED SUB-AWARD
201501329349302005,520595110,ADVANCED SPINAL TECHNOLOGY LLC,7601 OSLER DR JORDAN 167,TOWSON,MD,21204,522189296,30800,0,N/A,N/A,RESEARCH SPONSORED SUB-AWARD
201501329349302005,520595110,ADVENTIST DEVELOPMENT AND RELIEF,12501 OLD COLUMBIA PIKE,SILVER SPRING,MD,21703,521314847,1608265,0,N/A,N/A,RESEARCH SPONSORED SUB-AWARD
201501329349302005,520595110,AEGIS TECHNOLOGIES GROUP,13062 HIGHWAY 290 WEST,AUSTIN,TX,78737,630985776,18277,0,N/A,N/A,RESEARCH SPONSORED SUB-AWARD
201501329349302005,520595110,AEROFLEX COLORADO SPRINGS INC,PO BOX 30907,HARTFORD,CT,061500907,840822182,18500,0,N/A,N/A,RESEARCH SPONSORED SUB-AWARD
201501329349302005,520595110,AEROJET ROCKETDYNE INC,PO BOX 201452,DALLAS,TX,753201452,951751500,495865,0,N/A,N/A,RESEARCH SPONSORED SUB-AWARD
201501329349302005,520595110,AEROVIRONMENT INC,181 W HUNTINGTON DRIVE,MONROVIA,CA,91016,952705790,96014,0,N/A,N/A,RESEARCH SPONSORED SUB-AWARD
201501329349302005,520595110,AETHERCOMM INC,3205 LIONSHEAD AVENUE,CARLSBAD,CA,92010,330862210,71653,0,N/A,N/A,RESEARCH SPONSORED SUB-AWARD
201501329349302005,520595110,AGILENT TECHNOLOGIES,2850 CENTERVILLE RD,WILMINGTON,DE,198081644,770518772,170789,0,N/A,N/A,RESEARCH SPONSORED SUB-AWARD
201501329349302005,520595110,ALABAMA DEPT OF EDUCATION,50 N RIPLEY ST,MONTGOMERY,AL,361302101,636000619,1103207,0,N/A,N/A,RESEARCH SPONSORED SUB-AWARD
201501329349302005,520595110,ALAMEDA CO MED CTR,1411 E 31ST ST,OAKLAND,CA,94602,943302014,29308,0,N/A,N/A,RESEARCH SPONSORED SUB-AWARD
201501329349302005,520595110,ALBERT EINSTEIN COLLEGE OF MEDICINE,1300 MORRIS PARK AVE,BRONX,NY,10461,131624225,105714,0,N/A,N/A,RESEARCH SPONSORED SUB-AWARD
201501329349302005,520595110,ALLEGHENY SINGER RESEARCH INSTITUTE,PO BOX 951765,CLEVELAND,OH,44193,251320493,187923,0,N/A,N/A,RESEARCH SPONSORED SUB-AWARD
201501329349302005,520595110,ALLIANT TECHSYSTEMS OPERATIONS LLC,55 THIOKOI ROAD,ELKTON,MD,21921,274026908,8445506,0,N/A,N/A,RESEARCH SPONSORED SUB-AWARD
201501329349302005,520595110,AMERICAN ACADEMY OF PEDIATRICS,37925 EAGLE WAY,CHICAGO,IL,606781379,362275597,200860,0,N/A,N/A,RESEARCH SPONSORED SUB-AWARD
201501329349302005,520595110,AMERICAN CANCER SOCIETY INC,250 WILLIAMS ST NW STE 400,ATLANTA,GA,303031002,131788491,312864,0,N/A,N/A,RESEARCH SPONSORED SUB-AWARD
201501329349302005,520595110,AMERICAN COLLEGE OF NURSE MIDWIVES,8403 COLESVILLE RD STE 1550,SILVER SPRING,MD,209106374,741685515,487211,0,N/A,N/A,RESEARCH SPONSORED SUB-AWARD
201501329349302005,520595110,AMERICAN COLLEGE OF OBSTETRICIANS,409 12TH ST SW,WASHINGTON,DC,20024,362217981,81983,0,N/A,N/A,RESEARCH SPONSORED SUB-AWARD
201501329349302005,520595110,AMERICAN COLLEGE OF RADIOLOGY IMAGI,1891 PRESTON WHITE DR,RESTON,VA,20191,362261602,211913,0,N/A,N/A,RESEARCH SPONSORED SUB-AWARD
201501329349302005,520595110,AMERICAN COLLEGE OF SURGEONS,633 N ST CLAIRE ST,CHICAGO,IL,60611,362192800,79182,0,N/A,N/A,RESEARCH SPONSORED SUB-AWARD
201501329349302005,520595110,AMERICAN LUNG ASSOCIATION,14 WALL ST,NEW YORK,NY,10005,131632524,971100,0,N/A,N/A,RESEARCH SPONSORED SUB-AWARD
201501329349302005,520595110,AMERICAN REFUGEE COMMITTEE,615 1ST AVE NE STE 500,MINNEAPOLIS,MN,55413,363241033,1175639,0,N/A,N/A,RESEARCH SPONSORED SUB-AWARD
201501329349302005,520595110,AMERICAN RELIANCE INC,3445 FLETCHER AVENUE,EL MONTE,CA,91731,954020451,108832,0,N/A,N/A,RESEARCH SPONSORED SUB-AWARD
201501329349302005,520595110,AMETEK SCP INC,52 AIRPORT ROAD,WESTERLY,RI,02891,050471273,77746,0,N/A,N/A,RESEARCH SPONSORED SUB-AWARD
201501329349302005,520595110,ANDERSON MATRIX CONSULTING,115 EMERALD CHASE CIRCLE,JOHNSON CITY,TN,37615,262489155,251334,0,N/A,N/A,RESEARCH SPONSORED SUB-AWARD
201501329349302005,520595110,ANNE ARUNDEL HEALTH SYSTEM INST INC,PO BOX 37181,BALTIMORE,MD,212973181,521646304,22220,0,N/A,N/A,RESEARCH SPONSORED SUB-AWARD
201501329349302005,520595110,APPLIED COHERENT TECHNOLOGY CORPORATION,112 ELDEN STREET,HERNDON,VA,20170,541534159,1398719,0,N/A,N/A,RESEARCH SPONSORED SUB-AWARD
201501329349302005,520595110,APPLIED MATHEMATICS INC,1622 ROUTE 12,GALES FERRY,CT,063350637,061023352,119341,0,N/A,N/A,RESEARCH SPONSORED SUB-AWARD
201501329349302005,520595110,APPLIED RESEARCH ASSOCIATES INC,4300 SAN MATEO BLVD NE,ALBUQUERQUE,NM,871101295,850276434,144264,0,N/A,N/A,RESEARCH SPONSORED SUB-AWARD
201501329349302005,520595110,APPLIED VISIONS INC,6 BAYVIEW AVENUE,NORTHPORT,NY,11768,112089203,12512,0,N/A,N/A,RESEARCH SPONSORED SUB-AWARD
201501329349302005,520595110,AQUITAS SOLUTIONS,10 GLENLAKE PKWY,ATLANTA,GA,30328,203971141,74009,0,N/A,N/A,RESEARCH SPONSORED SUB-AWARD
201501329349302005,520595110,AR CHILDRENS HOSPITAL RESEARCH INST,1 CHILDRENS WAY FINANCIAL SERVICES,LITTLE ROCK,AR,722023591,710694931,88982,0,N/A,N/A,RESEARCH SPONSORED SUB-AWARD
201501329349302005,520595110,ARGON ST INC,12701 FAIR LAKES CIRCLE,FAIRFAX,VA,22033,381873250,7377,0,N/A,N/A,RESEARCH SPONSORED SUB-AWARD
201501329349302005,520595110,ARIZONA BOARD OF REGENTS UNIVERSITY OF ARIZONA,1111 N CHERRY AVE,TUCSON,AZ,857223520,742652689,30970,0,N/A,N/A,RESEARCH SPONSORED SUB-AWARD
201501329349302005,520595110,ARIZONA STATE UNIV,PO BOX 873503,TEMPE,AZ,852873503,860196696,179918,0,N/A,N/A,RESEARCH SPONSORED SUB-AWARD
201501329349302005,520595110,ARMTEC COUNTERMEASURES COMPANY,PO BOX 849169,LOS ANGELES,CA,900849169,481266479,175864,0,N/A,N/A,RESEARCH SPONSORED SUB-AWARD
201501329349302005,520595110,ATK SPACE SYSTEMS INC,1365 TECHNOLOGY COURT,DAYTON,OH,45424,330517898,493404,0,N/A,N/A,RESEARCH SPONSORED SUB-AWARD
201501329349302005,520595110,AUBURN UNIVERSITY,115 QUAD COURT,AUBURN,AL,36849,636000724,22773,0,N/A,N/A,RESEARCH SPONSORED SUB-AWARD
201501329349302005,520595110,AVID LLC,120 NEWSOME DRIVE,YORKTOWN,VA,236925007,161637406,852843,0,N/A,N/A,RESEARCH SPONSORED SUB-AWARD
201501329349302005,520595110,BACK NINE ENGINEERING INC,11800 BRISTOLWOOD TERRACE,LAUREL,MD,207083182,205997219,228339,0,N/A,N/A,RESEARCH SPONSORED SUB-AWARD
201501329349302005,520595110,BAE SYSTEMS IESI,65 SPIT BROOK RD,NASHUA,NH,030610868,522268742,369534,0,N/A,N/A,RESEARCH SPONSORED SUB-AWARD
201501329349302005,520595110,BALL AEROSPACE & TECHNOLOGIES CORP,PO BOX 905677,CHARLOTTE,NC,282905677,841315001,40041,0,N/A,N/A,RESEARCH SPONSORED SUB-AWARD
201501329349302005,520595110,BALTIMORE CHESAPEAKE BAY,1900 EAGLE DR,BALTIMORE,MD,21207,342007841,30137,0,N/A,N/A,RESEARCH SPONSORED SUB-AWARD
201501329349302005,520595110,BALTIMORE CITY PUBLIC SCHOOLS,200 E NORTH AVE,BALTIMORE,MD,21202,522064235,338401,0,N/A,N/A,RESEARCH SPONSORED SUB-AWARD
201501329349302005,520595110,BANNER GOOD SAMARITAN MC,901 E WILLETTA ST,PHOENIX,AZ,85006,270036499,14000,0,N/A,N/A,RESEARCH SPONSORED SUB-AWARD
201501329349302005,520595110,BARBARA ANN KARMANOS CANCER CENTER,4100 JOHN R,DETROIT,MI,48201,381613280,91475,0,N/A,N/A,RESEARCH SPONSORED SUB-AWARD
201501329349302005,520595110,BATTELLE MEMORIAL INSTITUTE CPHRE,505 KING AVE,COLUMBUS,OH,432012693,314379427,61061,0,N/A,N/A,RESEARCH SPONSORED SUB-AWARD
201501329349302005,520595110,BAY AREA ENVIROMENTAL RESEARCH INSTITUTE,596 1ST STREET W,SONOMA,CA,954766619,943176058,22000,0,N/A,N/A,RESEARCH SPONSORED SUB-AWARD
201501329349302005,520595110,BAYLOR COLLEGE OF MEDICINE,ONE BAYLOR PLAZA BCM505,HOUSTON,TX,77030,741613878,2514658,0,N/A,N/A,RESEARCH SPONSORED SUB-AWARD
201501329349302005,520595110,BAYSTATE MEDICAL CENTER INC,759 CHESNUT ST,SPRINGFIELD,MA,01199,042790311,24679,0,N/A,N/A,RESEARCH SPONSORED SUB-AWARD
201501329349302005,520595110,BBN TECHNOLOGIES CORP,10 MOULTON ST,CAMBRIDGE,MA,02138,412126829,876152,0,N/A,N/A,RESEARCH SPONSORED SUB-AWARD
201501329349302005,520595110,BECK POWELL & PARSONS INC,29 WEST SUSQUEHANNA AVE,TOWSON,MD,212045217,520957991,71301,0,N/A,N/A,RESEARCH SPONSORED SUB-AWARD
201501329349302005,520595110,BECKMAN RESEARCH INST OF THE,1500 E DUARTE RD,DUARTE,CA,91010,953432210,12600,0,N/A,N/A,RESEARCH SPONSORED SUB-AWARD
201501329349302005,520595110,BETH ISRAEL DEACONESS MEDICAL CTR,330 BROOKLINE AVE,BOSTON,MA,02215,042103881,6875,0,N/A,N/A,RESEARCH SPONSORED SUB-AWARD
201501329349302005,520595110,BIG BROTHERS BIG SISTERS OF THE CHE,3600 CLIPPER MILL RD STE 250,BALTIMORE,MD,212111946,520631265,40000,0,N/A,N/A,RESEARCH SPONSORED SUB-AWARD
201501329349302005,520595110,BIG BROTHERS BIG SISTERS SEPA,123 S BROAD ST STE 2180,PHILADELPHIA,PA,19109,231352034,30000,0,N/A,N/A,RESEARCH SPONSORED SUB-AWARD
201501329349302005,520595110,BIOFIRE DIAGNOSTICS INC,390 WAKARA WAY,SALT LAKE CITY,UT,84108,820439851,1175250,0,N/A,N/A,RESEARCH SPONSORED SUB-AWARD
201501329349302005,520595110,BIOMEDICAL RESEARCH INSTITUE,12111 PARKLAWN DR,ROCKVILLE,MD,20852,362229561,339624,0,N/A,N/A,RESEARCH SPONSORED SUB-AWARD
201501329349302005,520595110,BLACK CLOUD INC,318 KENT DRIVE,COCOA BEACH,FL,32931,232938240,572360,0,N/A,N/A,RESEARCH SPONSORED SUB-AWARD
201501329349302005,520595110,BNR TECHNOLOGIES LLC,2602 WYNFIELD ROAD,WEST FRIENDSHIP,MD,21794,841723954,97980,0,N/A,N/A,RESEARCH SPONSORED SUB-AWARD
201501329349302005,520595110,BOEING COMPANY,12214 LAKEWOOD BLVD,DOWNEY,CA,907407644,910425694,187605,0,N/A,N/A,RESEARCH SPONSORED SUB-AWARD
201501329349302005,520595110,BOSARGE BOATS INC,1703 PASCAGOULA STREET,PASCAGOULA,MS,39567,640607441,84250,0,N/A,N/A,RESEARCH SPONSORED SUB-AWARD
201501329349302005,520595110,BOSTON CONSULTING GROUP INC,ONE BEACON STREET,BOSTON,MA,02108,042432614,1536000,0,N/A,N/A,RESEARCH SPONSORED SUB-AWARD
201501329349302005,520595110,BOSTON PUBLIC SCHOOLS,26 COURT ST,BOSTON,MA,021082505,043444082,415447,0,N/A,N/A,RESEARCH SPONSORED SUB-AWARD
201501329349302005,520595110,BOSTON UNIVERSITY,25 BUICK ST,BOSTON,MA,02215,042103547,1761268,0,N/A,N/A,RESEARCH SPONSORED SUB-AWARD
201501329349302005,520595110,BOSTON UNIVERSITY MEDICAL CENTER,660 HARRISON AVE 2ND FL,BOSTON,MA,02118,042103547,981931,0,N/A,N/A,RESEARCH SPONSORED SUB-AWARD
201501329349302005,520595110,BRIGHAM AND WOMENS HOSPITAL INC,75 FRANCIS ST,BOSTON,MA,02115,042312909,388083,0,N/A,N/A,RESEARCH SPONSORED SUB-AWARD
201501329349302005,520595110,BROWN UNIVERSITY,OFC RES ADMIN BOX 1929,PROVIDENCE,RI,02912,050258809,433493,0,N/A,N/A,RESEARCH SPONSORED SUB-AWARD
201501329349302005,520595110,BUCCANEER COMPUTER SYSTEMS AND SERV,6799 KENNEDY RD STE J,WARRENTON,VA,20187,541977239,117781,0,N/A,N/A,RESEARCH SPONSORED SUB-AWARD
201501329349302005,520595110,BUCKNELL UNIV,MOORE AVE,LEWISBURG,PA,17837,240772407,23447,0,N/A,N/A,RESEARCH SPONSORED SUB-AWARD
201501329349302005,520595110,CS DRAPER LABORATORY INC,555 TECHNOLOGY SQUARE,CAMBRIDGE,MA,021393563,042505372,179751,0,N/A,N/A,RESEARCH SPONSORED SUB-AWARD
201501329349302005,520595110,CALIFORNIA INSTITUTE OF TECHNOLOGY,1200 E CALIFORNIA BLVD,PASADENA,CA,91125,951643307,1960541,0,N/A,N/A,RESEARCH SPONSORED SUB-AWARD
201501329349302005,520595110,CALIFORNIA PACIFIC MEDICAL CENTER,475 BRANNAN ST STE 220,SAN FRANCISCO,CA,94107,940562680,221842,0,N/A,N/A,RESEARCH SPONSORED SUB-AWARD
201501329349302005,520595110,CALLEO GROUP,14712 CARRIAGE MILL DRIVE,WOODBINE,MD,21797,272171403,151053,0,N/A,N/A,RESEARCH SPONSORED SUB-AWARD
201501329349302005,520595110,CAMBRIDGE HEALTH ALLIANCE,1493 CAMBRIDGE ST,CAMBRIDGE,MA,02139,043167608,12997,0,N/A,N/A,RESEARCH SPONSORED SUB-AWARD
201501329349302005,520595110,CANCER INST OF NEW JERSEY,195 LITTLE ALBANY ST,NEW BRUNSWICK,NJ,08901,462354111,73355,0,N/A,N/A,RESEARCH SPONSORED SUB-AWARD
201501329349302005,520595110,CARAHSOFT TECHNOLOGY CORP,1890 PRESTON WHITE DR,RESTON,VA,20191,522189693,74330,0,N/A,N/A,RESEARCH SPONSORED SUB-AWARD
201501329349302005,520595110,CARBON-CARBON ADVANCED TECHNOLOGIES INC,4704 EDEN ROAD,KENNEDALE,TX,76140,752181484,1252878,0,N/A,N/A,RESEARCH SPONSORED SUB-AWARD
201501329349302005,520595110,CARNEGIE INST OF WASHINGTON,3520 SAN MARTIN DR,BALTIMORE,MD,21218,530196523,20111,0,N/A,N/A,RESEARCH SPONSORED SUB-AWARD
201501329349302005,520595110,CARNEGIE MELLON UNIVERSITY,5000 FORBES AVE,PITTSBURGH,PA,15213,250969449,113426,0,N/A,N/A,RESEARCH SPONSORED SUB-AWARD
201501329349302005,520595110,CAROLINAS MEDICAL CENTER,1010 EDGEHILL RD N,CHARLOTTE,NC,28207,560554229,717411,0,N/A,N/A,RESEARCH SPONSORED SUB-AWARD
201501329349302005,520595110,CASE WESTERN RESERVE UNIVERSITY,2500 METROHEALTH DR,CLEVELAND,OH,44109,346004382,1400923,0,N/A,N/A,RESEARCH SPONSORED SUB-AWARD
201501329349302005,520595110,CATHOLIC RELIEF SERVICES,228 W LEXINGTON ST,BALTIMORE,MD,212013443,135563422,258624,0,N/A,N/A,RESEARCH SPONSORED SUB-AWARD
201501329349302005,520595110,CAUSASCI LLC,PO BOX 627,ELLICOTT CITY,MD,210410627,203263417,297049,0,N/A,N/A,RESEARCH SPONSORED SUB-AWARD
201501329349302005,520595110,CDI LABORATORIES INC,177 BALBOA ST,MAYAGUEZ,PR,00680,660617961,2413754,0,N/A,N/A,RESEARCH SPONSORED SUB-AWARD
201501329349302005,520595110,CEDARS SINAI MEDICAL CENTER,8700 BEVERLY BLVD,LOS ANGELES,CA,90048,951644600,75175,0,N/A,N/A,RESEARCH SPONSORED SUB-AWARD
201501329349302005,520595110,CENTER FOR MEDICAL TECHNOLOGY POLIC,401 E PRATT ST STE 631,BALTIMORE,MD,21202,261409553,337409,0,N/A,N/A,RESEARCH SPONSORED SUB-AWARD
201501329349302005,520595110,CEPHEID CO,904 CARIBBEAN DR,SUNNYVALE,CA,94089,770441625,72364,0,N/A,N/A,RESEARCH SPONSORED SUB-AWARD
201501329349302005,520595110,CFD RESEARCH CORPORATION,215 WYNN DR NW,HUNTSVILLE,AL,35805,630944385,187184,0,N/A,N/A,RESEARCH SPONSORED SUB-AWARD
201501329349302005,520595110,CGI FEDERAL INC,12601 FAIR LAKES CIRCLE,FAIRFAX,VA,220334902,540856778,312248,0,N/A,N/A,RESEARCH SPONSORED SUB-AWARD
201501329349302005,520595110,CHESAPEAKE BAY ENVIRONMENTAL CENTER,600 DISCOVERY LN,GRASONVILLE,MD,21638,521188939,11480,0,N/A,N/A,RESEARCH SPONSORED SUB-AWARD
201501329349302005,520595110,CHILDRENS HOSP OF PHILADELPHIA,34TH ST CIVIC CTR BLVD,PHILADELPHIA,PA,19104,231352166,114973,0,N/A,N/A,RESEARCH SPONSORED SUB-AWARD
201501329349302005,520595110,CHILDRENS HOSPITAL CORPORATION,300 LONGWOOD AVE,BOSTON,MA,02115,042774441,20291,0,N/A,N/A,RESEARCH SPONSORED SUB-AWARD
201501329349302005,520595110,CHILDRENS HOSPITAL LA,4650 SUNSET BLVD,LOS ANGELES,CA,90027,951690977,544510,0,N/A,N/A,RESEARCH SPONSORED SUB-AWARD
201501329349302005,520595110,CHILDRENS HOSPITAL MEDICAL CENTER,ONE PERKINS SQ,AKRON,OH,44308,340714357,19800,0,N/A,N/A,RESEARCH SPONSORED SUB-AWARD
201501329349302005,520595110,CHILDRENS HOSPITAL OF BOSTON,RESEARCH FINANCE,BOSTON,MA,02241,042774441,773621,0,N/A,N/A,RESEARCH SPONSORED SUB-AWARD
201501329349302005,520595110,CHILDRENS MEMORIAL HOSPITAL,2300 CHILDRENS PLAZA MB 37,CHICAGO,IL,60614,362170833,77897,0,N/A,N/A,RESEARCH SPONSORED SUB-AWARD
201501329349302005,520595110,CHILDRENS RESEARCH INST,111 MICHIGAN AVE NW,WASHINGTON,DC,20010,521654453,45460,0,N/A,N/A,RESEARCH SPONSORED SUB-AWARD
201501329349302005,520595110,CHRISTIANA CARE HEALTH SERVICES,MAP2 STE 3203,NEWARK,DE,19713,510103684,6576,0,N/A,N/A,RESEARCH SPONSORED SUB-AWARD
201501329349302005,520595110,CHRISTOPHER CONSULTANTS LTD,9900 MAIN ST,FAIRFAX,VA,22031,541208482,8000,0,N/A,N/A,RESEARCH SPONSORED SUB-AWARD
201501329349302005,520595110,CINCINNATI CHILDRENS HOSPITAL,3333 BURNET AVE,CINCINNATI,OH,45229,310833936,179857,0,N/A,N/A,RESEARCH SPONSORED SUB-AWARD
201501329349302005,520595110,CITY YEAR INC,287 COLUMBUS AVE,BOSTON,MA,02116,222882549,4187521,0,N/A,N/A,RESEARCH SPONSORED SUB-AWARD
