object_id,ein,FrmAndLnRfrncDsc,ExplntnTxt
201720529349300707,362167048,GRANTS AND ASSISTANCE BENEFITING INTERESTED PERSONS,"Schedule L, Part III: The University has established a tuition benefits plan for all full-time employees, including officers and key employees. The plan provides tuition waivers for employees, their eligible dependents and either a spouse or unrelated second domiciled adult. Tuition benefits, including those provided to eligible dependents and either a spouse or second domiciled adult, are either reported as or excluded from taxable earnings, by the University, pursuant to the rules and regulations under sections 127 and 117(d) of the internal revenue code."
201720529349300707,362167048,BUSINESS TRANSACTIONS INVOLVING INTERESTED PERSONS,"Schedule L, Part IV: Mr. Peter Argianas, a trustee of the University, is the Chairman, President and CEO of Gold Coast Bank. During the 2009/10 fiscal year the University established a relationship with Gold Coast Bank to utilize the bank for investing University funds in the Certificate of Deposit Registry Service (CDARS) program. Pursuant to the agreement between Gold Coast Bank and the University, the bank received no fees directly from the University, but may earn fees from one or more entities receiving deposits through the CDARS program. The University continues to research competitive offerings and utilizes Gold Coast Bank when its rates are equal to or better than that available elsewhere. As such, the relationship has been in the best interest of the University. Bryan Kozoman is an employee of the University and is the son of Robert Kozoman, an officer of the University during the fiscal year. Mr. Kozoman has no direct involvement in the determination of his sons University compensation. Caileen Crecco is a current employee of the University and is a relative of Erin Moran, who served as the interim officer of the University during FY 2014/15. Ms. Moran has no direct involvement in the determination of her relative's University compensation. Kyle Janis is an employee of the University and is the son of Bob Janis, a current officer of the University. Mr. Janis has no direct involvement in the determination of his sons University compensation. Michael and Eugene Lenti are employees of the University and the brothers of Jean Lenti-Ponsetto, a key employee of the University. Ms. Lenti-Ponsetto has no direct involvement in the determination of her brothers University compensation. Ms. Karen M. Atwood, a University trustee, is the President of Blue Cross Blue Shield of Illinois, which provides medical insurance services to the University. The amount shown in Part IV is pursuant to transactions that were conducted at arm's length between the University and Blue Cross Blue Shield of Illinois and to which Ms. Atwood had no direct involvement. Ms. Anne R. Pramaggiore, a University trustee, is the President and CEO of Commonwealth Edison, which provides electrical utility service to the University. The amount in Part IV is pursuant to transactions that were conducted at arm's length between the University and Commonwealth Edison and to which Ms. Pramaggiore had no direct involvement. All transactions with the listed substantial contributors are at arms length."
201700879349300920,410693979,"Schedule L, Part V Supplemental Information",North Sky -- Former Regent Piper is Advisor
201740409349301019,660362666,Part IV,"The Organization operates the Graduate School and the Landscape Architecture Program in premises belonging to a corporation owned by the President of the Organization. Both leases expire on October 5, 2021 with a monthly fixed minimum rent of $7,000 each."
201730479349301168,951643992,"FORM 990, SCHEDULE L, PART IV",OFFICERS OF THE UNIVERSITY THAT MAY HAVE A CONFLICT OF INTEREST REGARDING THE COMPENSATION PACKAGES FOR FAMILY MEMBERS DO NOT PARTICIPATE IN THE DETERMINATION OF THE COMPENSATION PAID TO THOSE FAMILY MEMBERS.
201740839349300334,370681530,"Schedule L, Part III","All scholarships are awarded on an objective and nondiscriminatory basis based on pre-established criteria. These criteria include financial need, academic merit, criteria set by donors, and other factors. No scholarships are awarded on the basis of a student's familial relationships. Scholarships reported in Schedule L, represent 0.15% of total scholarship expense."
201710679349300781,344431169,"Schedule L, Part III, Column (a) NAME OF INTERESTED PERSON AND RELATIONSHIP","COLLEGES, UNIVERSITIES, AND PRIMARY AND SECONDARY SCHOOLS ARE NOT REQUIRED TO IDENTIFY INTERESTED PERSONS TO WHOM THEY PROVIDED SCHOLARSHIPS, FELLOWSHIPS, AND SIMILAR FINANCIAL ASSISTANCE. PURSUANT TO THE INSTRUCTIONS TO FORM 990, SCH L, PART III, COLUMNS(A) AND (B) HAVE BEEN LEFT BLANK."
201701089349301300,362722198,"SCHEDULE L, PART IV, LINE 1, COLUMN D:","DANIEL GOODWIN IS A DIRECTOR AND OFFICER OF BENEDICTINE UNIVERSITY AND CHAIRMAN OF INLAND INVESTMENT ADVISORS, INC. CERTAIN OTHER INVESTMENTS WERE MANAGED BY INLAND INVESTMENT ADVISORS. THE ORGANIZATION PAID INLAND INVESTMENT ADVISORS, INC. $147,577 IN INVESTMENT FEES DURING THE FISCAL YEAR."
201711049349301001,381895805,"Schedule L, Part III, Column (a) NAME OF INTERESTED PERSON","AS PER IRS INSTRUCTIONS FOR 990 SCHEDULE L, SCHOOLS ARE NOT REQUIRED TO IDENTIFY INTERESTED PERSONS TO WHOM THEY PROVIDED SCHOLARSHIPS, FELLOWSHIPS, AND SIMILAR FINANCIAL ASSISTANCE. THEREFORE, COLUMNS (A) AND (B) HAVE BEEN LEFT BLANK FOR THESE LINES."
201711029349300736,750800689,"SCHEDULE L, PART V","SCHEDULE L, PART III THE AMOUNT REPORTED ON PART III, LINE 1(C) REPORTS TUITION WAIVERS GRANTED ON THE SAME BASIS AS TO ANY OTHER BENEFIT-ELIGIBLE EMPLOYEE. THE AMOUNT REPORTED ON PART III, LINE 2(C) REPORTS THE MERIT SCHOLARSHIPS AWARDED ON AN OBJECTIVE AND NON-DISCRIMINATORY BASIS BASED ON PRE-ESTABLISHED CRITERIA AND REVIEWED BY A SELECTION COMMITTEE."
201701089349301005,570314406,"Schedule L, Part II","Vlad Sabou, husband of Michelle Sabou (VP of Business Affairs) had a staff improvement loan, which is forgiven based on years of service, from the organization with a balance of $1,000 as of 5/31/2015."
201721089349300832,741161940,"SCHEDULE L, PART III, GRANTS OR ASSISTANCE BENEFITTING INTERESTED PERSONS",A MERIT SCHOLARSHIP/GRANT WAS AWARDED TO ONE OFFICER/TRUSTEE RELATIVE IN THE NORMAL COURSE OF SCHOLARSHIP GUIDELINES.A NEED BASED SCHOLARSHIP/GRANT WAS AWARDED TO ONE OFFICER/TRUSTEERELATIVE IN THE NORMAL COURSE OF SCHOLARSHIP GUIDELINES. A NON-NEED BASED SCHOLARSHIP/GRANT WAS AWARDED TO ONE OFFICER/TRUSTEERELATIVE IN THE NORMAL COURSE OF SCHOLARSHIP GUIDELINES.DISCOUNTED TUITION WAS AWARDED TO FOUR OFFICER/TRUSTEE RELATIVESACCORDING TO TUITION REMISSION BENEFITS OFFERED TO ALL FULL-TIMEFACULTY AND STAFF.
201741329349304819,251698677,"SCHEDULE L, PART V","MARY ECKERT, TRUSTEE AND OFFICER OF LAKE ERIE COLLEGE OF OSTEOPATHIC MEDICINE (LECOM), ALSO SERVES ON THE VANTAGE BOARD. VANTAGE SELLS MEDICAL SERVICES AND SUPPLIES TO LECOM AND RENTS PROPERTY FROM LECOM. ADDITIONALLY, LECOM HOLDS A 12.15% OWNERSHIP INTEREST IN VANTAGE FOR WHICH A 39,442 SHAREHOLDER DISTRIBUTION WAS PAID DURING THE FISCAL YEAR ENDED JUNE 30, 2016. PNC BANK MANAGES CERTAIN INVESTMENTS HELD BY LECOM. MARLENE MOSCO WAS THE PRESIDENT OF PNC BANK IN ERIE, PA UNTIL EARLY 2016 AND SERVES AS A TRUSTEE OF LECOM. RICHARD FERRETTI, AN EMPLOYEE OF LECOM, HAS A FAMILY RELATIONSHIP WITH DR. ANTHONY J. FERRETTI, D.O., A HIGHLY COMPENSATED EMPLOYEE OF LECOM. THOMAS WEDZIK, TRUSTEE OF LAKE ERIE COLLEGE OF OSTEOPATHIC MEDICINE, IS ALSO THE PRESIDENT OF FIRST NATIONAL BANK (FNB). FNB MANAGES CERTAIN INVESTMENTS HELD BY LECOM."
201701099349300840,221494428,"Schedule L, Part III Columns (a) & (b) - Schools","Colleges aren't required to identify interested persons to whom they provided scholarships, fellowships, and similar financial assistance. In accordance with the instructions, these fields have been left blank."
201701049349300805,383177823,"Schedule L, Part III, Column (a) NAME OF INTERESTED PERSON","AS PER IRS INSTRUCTIONS FOR 990 SCHEDULE L, SCHOOLS ARE NOT REQUIRED TO IDENTIFY INTERESTED PERSONS TO WHOM THEY PROVIDED SCHOLARSHIPS, FELLOWSHIPS, AND SIMILAR FINANCIAL ASSISTANCE. THEREFORE, COLUMNS (A) AND (B) HAVE BEEN LEFT BLANK FOR THESE LINES."
201741329349305774,131740451,"SCHEDULE L, PART II",(A) NAME OF PERSON: STEPHEN FREEDMAN (B) RELATIONSHIP WITH ORGANIZATION: PROVOST OF FORDHAM UNIVERSITY (C) PURPOSE OF LOAN: This transaction represents the Universitys equity interest in his residence and is not a loan. Repayment is triggered under certain circumstances.
201741329349305774,131740451,"SCHEDULE L, PART IV","JILL LOGAN IS A FAMILY MEMBER OF PATRICIA NAZEMETZ, CURRENT TRUSTEE"
201701249349301410,240804602,"SCH L, PART IV, BUSINESS TRANSACTIONS INVOLVING INTEREST PERSONS:","(A) NAME OF PERSON: SCOTT HENRY(D) DESCRIPTION OF TRANSACTION: MR. HENRY IS THE OWNER OF FM COACH TRAILWAYS. THE COLLEGE PAID FM COACH TRAILWAYS FOR TRANSPORTATION SERVICES. ALL TRANSACTIONS WERE CONDUCTED AT ARM'S LENGTH.(A) NAME OF PERSON: JOSEPH KLUGER(D) DESCRIPTION OF TRANSACTION: MR. KLUGER IS A PARTNER AT THE LAW FIRM OF HOURIGAN, KLUGER, AND QUINN. THE COLLEGE PAID FOR LEAGAL SERVICES PERFORMED BY HOURIGAN, KLUGER, AND QUINN. ALL TRANSACTIONS WERE CONDUCTED AT ARM'S LENGTH.(A) NAME OF PERSON: GERTRUDE MCGOWAN(D) DESCRIPTION OF TRANSACTION: MS. MCGOWAN IS A VICE PRESIDENT OF BLUE CROSS OF NEPA. BLUE CROSS OF NEPA (THROUGH ITS SUBSIDIARY FIRST PRIORITY) PROCESSES MEDICAL CLAIMS ON BEHALF OF THE COLLEGE. THE PAYMENT AMOUNT REPRESENTS AN ADMINISTRATIVE FEE PAID. THE COLLEGE IS SELF-INSURED AND PAYS ALL MEDICAL CLAIMS. ALL TRANSACTIONS WERE CONDUCTED AT ARM'S LENGTH."
201701289349301840,041958460,"Schedule L, Part IV","The Institute engages in activities in the normal course of business with organizations whose Officers, Directors or Trustees may be Officers, Directors or Trustees of the Institute. As such, the Institute had contracts for construction services with Bond Brothers, Inc. whose President, Robert Murray is a Trustee of the Institute. This contract resulted from a competitive bid process and through the normal procurement process. The Institute's decision to award the construction contract to Bond Brothers, Inc. was made in consultation with the Institute's independent Audit Committee Chair."
201741229349301759,350868202,"SCHEDULE L, PART III",FINANCIAL AID TO INTERESTED PERSONS AND/OR FAMILY MEMBERS: THE AMOUNT LISTED IN PART III REPRESENTS FINANCIAL AID THAT WAS AWARDED TO INTERESTED PERSONS AND/OR FAMILY MEMBERS. THE ONLY AMOUNTS AWARDED ARE SCHOLARSHIPS AND FINANCIAL AID AWARDS. THESE FUNDS ARE DISBURSED BY THE COLLEGE'S FINANCIAL AID DEPARTMENT IN STRICT ADHERENCE TO ALL FEDERAL AND STATE REGULATIONS.
201711029349300706,350868158,"Schedule L, Part II LOAN TO INTERESTED PERSON",RELATIONSHIP WITH ORGANIZATION (COLUMN B): CHIEF INFORMATION OFFICER PURPOSE OF LOAN (COLUMN C): BRIDGE LOAN FOR HOUSE PURCHASE THE DIFFERENCE BETWEEN THE BALANCE DUE AND THE ORIGINAL PRINCIPAL AMOUNT REPRESENTS ACCRUED INTEREST.
201711029349300706,350868158,"Schedule L, Part III GRANTS OR ASSISTANCE BENEFITING INTERESTED PERSONS","PER THE IRS INSTRUCTIONS FOR SCHEDULE L, COLLEGES, UNIVERSITIES, AND PRIMARY AND SECONDARY SCHOOLS ARE NOT REQUIRED TO IDENTIFY INTERESTED PERSONS TO WHOM THEY PROVIDED SCHOLARSHIPS, FELLOWSHIPS, AND SIMILAR FINANCIAL ASSISTANCE. INSTEAD, THESE ORGANIZATIONS MUST GROUP EACH TYPE OF FINANCIAL ASSISTANCE PROVIDED TO INTERESTED PERSONS IN SEPARATE LINES. FOR EACH LINE, THE SCHOOL IS TO REPORT IN COLUMN (C) THE TYPE OF ASSISTANCE AND AGGREGATE DOLLAR AMOUNT OF THAT ASSISTANCE; COLUMNS (A) AND (B) ARE TO BE LEFT BLANK."
201731089349301408,420680332,"SCHEDULE L, PART V","FORM 990, SCHEDULE L, PART IV, LINE (1) THE UNIVERSITY RECEIVES COMPETITIVE BIDS AND ALL WORK AWARDED TO TAFT-WILEY IS BASED ON LOWEST BID. DON WILEY, BOARD TRUSTEE, IS THE BROTHER OF THE OWNER OF TAFT-WILEY, INC., A COMPANY THAT PROVIDED COOLING AND HEATING SERVICES FOR THE UNIVERSITY FOR THE CURRENT YEAR-END. FORM 990, SCHEDULE L, PART IV, LINE (2) DON WILEY, BOARD TRUSTEE, IS ALSO A BOARD MEMBER FOR TWO RIVERS BANK AND TRUST. THE UNIVERSITY OBTAINED A 2,750,000 REVOLVING NOTE FROM TWO RIVERS BANK AND TRUST. MR. WILEY ABSTAINS FROM ALL VOTING REGARDING TRANSACTIONS BETWEEN THE BANK AND THE UNIVERSITY. THE CURRENT BALANCE AS OF MAY 31, 2016 WAS 2,221,482."
201701309349303620,362177139,"SCHEDULE L, PART IV","JAMES S. CROWN, A TRUSTEE OF THE UNIVERSITY, AND HIS FAMILY OWN AN INDIRECT INTEREST IN TISHMAN SPEYER CROWN EQUITIES LLC (TISHMAN SPEYER), WHICH THROUGH A SUBSIDIARY OWNS AN OFFICE BUILDING IN WASHINGTON D.C. IN WHICH THE UNIVERSITY OF CHICAGO LEASES OFFICE SPACE. THE LEASE BETWEEN THE UNIVERSITY AND TISHMAN SPEYER WAS NEGOTIATED AT ARMS' LENGTH AND WAS CONCLUDED ON FAIR MARKET TERMS. THE UNIVERSITY PAID TISHMAN SPEYER A TOTAL OF $235,024 IN RENT, TAXES AND EXPENSES FOR THIS PROPERTY DURING THE TAX YEAR ENDED JUNE 30, 2016. THE UNIVERSITY ALSO LEASES OFFICE SPACE IN NEW YORK, NEW YORK FROM TISHMAN SPEYER. THE LEASE BETWEEN THE UNIVERSITY AND TISHMAN SPEYER WAS NEGOTIATED AT ARMS' LENGTH AND WAS CONCLUDED ON FAIR MARKET TERMS. THE UNIVERSITY PAID TISHMAN SPEYER A TOTAL OF $ 363,029 IN RENT, TAXES AND EXPENSES FOR THIS PROPERTY DURING THE TAX YEAR ENDED JUNE 30, 2016.PETER W. MAY, A TRUSTEE OF THE UNIVERSITY, IS PRESIDENT AND FOUNDING PARTNER OF TRIAN PARTNERS, AN INVESTMENT MANAGEMENT FIRM WITH WHICH THE UNIVERSITY HAS INVESTED A PORTION OF ITS ENDOWMENT. TRIAN PARTNERS RECEIVED APPROXIMATELY $848,500 IN MANAGEMENT AND INCENTIVE FEES IN CONNECTION WITH THE UNIVERSITY'S INVESTMENT FOR THE TAX YEAR ENDED JUNE 30, 2016. EMMANUEL ROMAN, A TRUSTEE OF THE UNIVERSITY, WAS DURING THE TAX YEAR THE CHIEF EXECUTIVE OFFICER OF MAN GROUP PLC, AN ALTERNATIVE INVESTMENT MANAGEMENT FIRM WITH WHICH THE UNIVERSITY HAS INVESTED A PORTION OF ITS ENDOWMENT. THE MAN GROUP PLC RECEIVED APPROXIMATELY $943,000 IN FEES IN CONNECTION WITH THE UNIVERSITY'S INVESTMENT FOR THE TAX YEAR ENDED JUNE 30, 2016.DAVID M. RUBENSTEIN, A TRUSTEE OF THE UNIVERSITY, IS A CO-FOUNDER AND CO-CEO OF THE CARLYLE GROUP, A PRIVATE EQUITY FIRM WITH WHICH THE UNIVERSITY HAS INVESTED A PORTION OF ITS ENDOWMENT. THE CARLYLE GROUP RECEIVED APPROXIMATELY $358,000 IN FEES IN CONNECTION WITH THE UNIVERSITY'S INVESTMENT FOR THE TAX YEAR ENDED JUNE 30, 2016.PAUL YOVOVICH, A TRUSTEE OF THE UNIVERSITY, IS PRESIDENT, PRINCIPAL, AND CO-FOUNDER OF LAKE CAPITAL, A PRIVATE EQUITY FIRM WITH WHICH THE UNIVERSITY HAS INVESTED A PORTION OF ITS ENDOWMENT. LAKE CAPITAL RECEIVED APPROXIMATELY $192,000 IN FEES IN CONNECTION WITH THE UNIVERSITY'S INVESTMENT FOR THE TAX YEAR ENDED JUNE 30, 2016.SHADI BARTSCH-ZIMMER, THE WIFE OF THE UNIVERSITY OF CHICAGO PRESIDENT ROBERT J. ZIMMER, IS EMPLOYED BY THE UNIVERSITY AS A PROFESSOR OF CLASSICS. MS. BARTSCH-ZIMMER WAS PAID A GROSS SALARY OF $290,972 FOR THE CALENDAR YEAR 2015 IN CONNECTION WITH HER EMPLOYMENT.SUMATI MURLI, THE WIFE OF SUNIL KUMAR, DEAN OF THE BOOTH SCHOOL OF BUSINESS DURING THE TAX YEAR ENDED JUNE 30, 2016, WAS EMPLOYED BY THE UNIVERSITY AS A DIRECTOR FOR CLINICAL RESEARCH OPERATIONS. MS. MURLI WAS PAID $158,067 FOR THE CALENDAR YEAR 2015 IN CONNECTION WITH HER EMPLOYMENT.TAMAR POLONSKY, THE DAUGHTER OF KENNETH POLONSKY, DEAN AND EXECUTIVE VICE PRESIDENT FOR MEDICAL AFFAIRS, IS EMPLOYED BY THE UNIVERSITY AS AN ASSISTANT PROFESSOR IN THE DEPARTMENT OF MEDICINE. DR. POLONSKY WAS PAID $227,307 FOR THE CALENDAR YEAR 2015 IN CONNECTION WITH HER EMPLOYMENT.TAMARA VOKES, THE WIFE OF EVERETT VOKES, THE FORMER DEAN AND VICE PRESIDENT OF MEDICAL AFFAIRS, IS EMPLOYED BY THE UNIVERSITY AS A PROFESSOR IN CLINICAL MEDICINE. DR. VOKES WAS PAID $262,304 FOR THE CALENDAR YEAR 2015 IN CONNECTION WITH HER EMPLOYMENT.JESSICA DARROW, THE DAUGHTER OF KATHARINE DARROW, A TRUSTEE OF THE UNIVERSITY, IS EMPLOYED BY THE UNIVERSITY AS A LECTURER IN THE UNIVERSITY'S SCHOOL OF SOCIAL SERVICE ADMINISTRATION. MS. DARROW WAS PAID $96,521 IN COMPENSATION FOR THE CALENDAR YEAR 2015 IN CONNECTION WITH HER EMPLOYMENT."
201701039349301605,741159753,"Schedule L, Part III, Column (d) Description of Transaction","Officer L. Gregory Jones started as an officer of the University in May 2016. Prior to his start date as an officer, he performed services for the University as an independent contractor."
201741359349303614,410693970,"SCH L, PART III, GRANTS OR ASSISTANCE BENEFITTING INTERESTED PERSONS:",ISSUANCE OF ACADEMIC SCHOLARSHIPS TO FAMILY MEMBERS OF EMPLOYEES AND TRUSTEES IS DETERMINED ON THE SAME BASIS AND CRITERIA FOR ALL STUDENTS AT THE UNIVERSITY.
201741359349303614,410693970,"SCH L, PART IV, BUSINESS TRANSACTIONS INVOLVING INTERESTED PERSONS:","AMY GOLDMAN HAS A FAMILY MEMBER WHO HAS A BENEFICIAL INTEREST IN OPUS HOLDINGS, LLC, WHICH PROVIDES CONSTRUCTION SERVICES TO THE UNIVERSITY.PATRICK RYAN IS AN OWNER OF RYAN COMPANIES US, WHICH PROVIDES CONSTRUCTION AND DESIGN SERVICES TO THE UNIVERSITY."
201711239349301431,950549600,"Schedule L, Part IV Equipment Purchases",THE UNIVERSITY PURCHASED HOUSING FURNITURE FROM A BUSINESS IN WHICH ADAM MORRIS HAS A FINANCIAL INTEREST. THE UNIVERSITY BELIEVES THE PRODUCTS ARE THE BEST AVAILABLE VALUE.
201711239349300326,640303069,"Schedule L, Part IV, Line 1","MMI Dining Systems, LLC- Board members, Gaines P. Sturdivant and Cal Wells, are greater than 35% owners of MMI Dining Systemes, LLC. MMI Dining Systems, LLC was also a substantial contributor to the University during the year."
201741159349300209,362167855,"FORM 990, SCHEDULE L, PART II","THE PURPOSE OF THE LOAN WAS TO PROVIDE A VICE PRESIDENT SUPPORT FOR ADVANCED EDUCATION IN THE FIELD OF EDUCATIONAL LEADERSHIP, AND TO ENHANCE HER PORTFOLIO FOR GREATER LEADERSHIP RESPONSIBILITIES IN THE FUTURE."
201711189349300111,150533561,"Schedule L, Part V Supplemental Information","PART IV LINE(1) EMPLOYEE COMPENSATION IS PROVIDED TO A FAMILY MEMBER OF MARGARET DRUGOVICH, PRESIDENT LINE(2)EMPLOYEE COMPENSATION IS PROVIDED TO A FAMILY MEMBER OF BETHANY LILLY METZGAR, TRUSTEE"
201731239349300308,350868152,"Schedule L, Part III GRANTS OR ASSISTANCE BENEFITING INTERESTED PERSONS","PER THE IRS INSTRUCTIONS FOR SCHEDULE L, COLLEGES, UNIVERSITIES, AND PRIMARY AND SECONDARY SCHOOLS ARE NOT REQUIRED TO IDENTIFY INTERESTED PERSONS TO WHOM THEY PROVIDED SCHOLARSHIPS, FELLOWSHIPS, AND SIMILAR FINANCIAL ASSISTANCE. INSTEAD, THESE ORGANIZATIONS MUST GROUP EACH TYPE OF FINANCIAL ASSISTANCE PROVIDED TO INTERESTED PERSONS IN SEPARATE LINES. FOR EACH LINE, THE SCHOOL IS TO REPORT IN COLUMN (C) THE TYPE OF ASSISTANCE AND AGGREGATE DOLLAR AMOUNT OF THAT ASSISTANCE; COLUMNS (A) AND (B) ARE TO BE LEFT BLANK."
201701249349301395,240795460,"Schedule L, Part IV","Part IV line 1-3 (d) The following transactions occurred between Moravian College and Moravian College Housing Inc. (MCHI). The aggregate amounts are reported once in Part IV, line 1 (c). Equity Contribution to MCHI $4,035,338; Accrued Interest on $1,000,000 note receivable $26,667; Reimbursement of expenses incurred on behalf of MCHI $26,593; Lease of classrooms $25,140"
201741079349300819,231352615,"FORM 990, SCHEDULE L, PART IV:",CURRENT TRUSTEES: JOHN P. WEIDENHAMMER CHRIST G. KRARAS JOHN K. ROESSNER IIIFORMER TRUSTEES: JOHN BAILEY JOHN D. SCHOLL
201741169349300129,361408475,"FORM 990, SCHEDULE L, PART IV","BUSINESS TRANSACTIONS WITH INTERESTED PERSONS CECILIA RODRIGUEZ, WIFE OF RICHARD RODRIGUEZ, TRUSTEE, IS EMPLOYED BY THE REPORTING ORGANIZATION. MR. RODRIGUEZ HAS NO DIRECT CONTROL OVER HER COMPENSATION. JENNIFER BOYLE, WIFE OF PATRICK BOYLE, INTERIM PROVOST, IS EMPLOYED BY THE REPORTING ORGANIZATION. MR. BOYLE HAS NO DIRECT CONTROL OVER HER COMPENSATION."
201721189349300207,150532078,NOTE 1,FISCAL YEAR 2016 COMPENSATION AS AN EMPLOYEE OF COLGATE UNIVERSITY.
201721189349300207,150532078,NOTE 2,CONDUCTED SERVICES TO AUTHOR THE HISTORY OF COLGATE FOR ITS UPCOMING BICENTENNIAL CELEBRATION.
201741329349304869,952544535,"SCHEDULE L, PART III - GRANTS OR ASSISTANCE BENEFTING INTERESTED PERSONS:","PER THE 990 INSTRUCTIONS, THE UNIVERSITY IS NOT REQUIRED TO IDENTIFY THE INTERESTED PERSONS WHO RECEIVED SCHOLARSHIPS, FELLOWSHIPS, AND SIMILAR FINANCIAL ASSISTANCE. INSTEAD, THE UNIVERSITY MUST GROUP EACH TYPE OF ASSISTANCE PROVIDED TO INTERESTED PERSONS. THIS IS DONE IN ORDER TO PROTECT THE IDENTITY OF THE STUDENTS."
201741329349304869,952544535,"SCHEDULE L, PART III - BUSINESS TRANSACTION INVOLVING INTERESTED PERSONS:","ANDREW T. ALLEN, VICE PRESIDENT AND PROVOST, IS RELATED TO DENISE DIMON, HIS WIFE, WHO IS ALSO AN EMPLOYEE AT THE UNIVERSITY. SHE IS A PROFESSOR OF ECONOMICS, THE ASSOCIATE PROVOST FOR INTERNATIONAL AFFAIRS, AND THE DIRECTOR OF THE AHLERS CENTER FOR INTERNATIONAL BUSINESS. THE AMOUNT SHOWN REPRESENTS IRS FORM W-2 BOX 5 WAGES FOR CALENDAR YEAR 2015 FOR DENISE DIMON."
201731089349301118,620465076,"Schedule L, Part III GRANTS OR ASSISTANCE BENEFITING INTERESTED PERSONS","COLLEGES, UNIVERSITIES, AND PRIMARY AND SECONDARY SCHOOLS ARE NOT REQUIRED TO IDENTIFY INTERESTED PERSONS TO WHOM THEY PROVIDED SCHOLARSHIPS, FELLOWSHIPS, AND SIMILAR FINANCIAL ASSISTANCE. PURSUANT TO THE INSTRUCTIONS TO FORM 990, SCH L, PART III, COLUMNS(A) AND (B) HAVE BEEN LEFT BLANK."
201711229349300631,221500645,PART IV Business Transactions Involving Interested Persons,"The brother of Mary Ann Christopher, trustee/Regent, is a partner in the Law Firm of Gibbons P.C. Seton Hall University paid Gibbons P.C. $128,252 for legal services in the year ended June 30, 2016. Robert J. Sloan, regent, is a Vice President at AT&T. Seton Hall University paid AT&T $504,735 for telephone charges in the year ended June 30, 2016. Thomas Sharkey, Sr., Regent Emeritus, and his son Thomas Sharkey, Jr., are the Chairman and President, respectively, of the Insurance Brokerage Company, Meeker Sharkey & Hurley. Seton Hall deals directly with them for its Long Term Disability benefits. The carrier is CIGNA. Meeker Sharkey & Hurley received $25,386 in brokerage fees for this arrangement. The wife and daughter of Dr. Larry A. Robinson, Provost & executive V.P., served as an employees of the University. In fiscal year 2016, They received total compensation and benefits of $26,977 and $64,600, respectively. The daughter-in-law and two sisters of Dr. Tracy H. Gottlieb, V.P. for Student Services, served as employees of the University. In fiscal year 2016, they received total compensation and benefits of $51,319, $107,678, and $58,087, respectively."
201711229349300631,221500645,Part III Grants or Assistance Benefiting Interested Persons,"The child of Patrick Hobbs, a former key employee, was awarded a merit scholarship amounting to $7,500. His position as a former Dean of the Law School had no bearing in the award process nor was he involved in the process at all."
201711239349300331,042103731,"Schedule L, Part III",Scholarships Benefitting Interested Persons The college granted merit scholarships to two students who are the children of current members of the board of trustees. The college ensures the grants were awarded based on merit to eligible students who met the required academic standing. The trustees do not have any influence in the decision making process for awarding scholarships.
201701089349300795,470405319,"SCHEDULE L, PART III, GRANTS OR ASSISTANCE BENEFITING INTERESTED PERSONS:",CERTAIN FAMILY MEMBERS OF OFFICERS ATTEND THE COLLEGE AND RECEIVE SCHOLARSHIPS ON THE SAME TERMS AND CRITERIA AS OTHER STUDENTS AT THE COLLEGE.
201721039349301037,630288811,"Sch. L, Part IV, Business Transactions Involving Interested Persons","(A) Name of Person: J.T. Stephens (B) Relationship Between Interested Person and Organization: BSC-Board trustee (C) Amount of transaction: $217,791 (D) Description of Transaction: Mr. Stephens is chairman of the board of EBSCO Industries. The College contracts with EBSCO Industries for subscription services, databases, printing and information packaging."
201740889349300324,640428676,"Part II, Line (1), Column (c):",Purpose of loan: Assistance with relocation of residence for the benefit of the organization.
201740889349300324,640428676,"Part IV, Line (1), Column (b):","Relationship between interested person and the organization: Son of J. Scott Redd, Sr., board member."
201740889349300324,640428676,"Part IV, Line (1), Column (d):","Description of transaction: Compensation was paid to a family member of a board member in excess of $10,000."
201741049349301044,314379584,"Schedule L, Part III Grants or assistance benefiting interested persons","During Fiscal Year 2016, $81,180 of discounted tuition was received by family members of interested persons."
201741049349301044,314379584,"Schedule L, Part III, Column (a) Name of Interested Person and Relationship","Colleges, Universities, and Primary and secondary schools are not required to identify interested persons to whom they provided scholarships, fellowships, and similar financial assistance. Pursuant to the instructions to Form 990, Sch L, Part III, columns (A) and (B) have been left blank."
201731049349300213,380321740,"Schedule L, Part III, Column (a) NAME OF INTERESTED PERSON","AS PER IRS INSTRUCTIONS FOR 990 SCHEDULE L, SCHOOLS ARE NOT REQUIRED TO IDENTIFY INTERESTED PERSONS TO WHOM THEY PROVIDED SCHOLARSHIPS, FELLOWSHIPS, AND SIMILAR FINANCIAL ASSISTANCE. THEREFORE, COLUMNS (A) AND (B) HAVE BEEN LEFT BLANK FOR THESE LINES."
201721089349301602,250965430,"Schedule L, Part IV","(1) William Jeffress is the spouse of Trustee Andrea Jeffress, M.D. and he is an employee of Mercyhurst University. (2) Judith Thomas is the spouse of key employee James Adovasio and she is an employee of Mercyhurst University. (3) Heidi Hosey-McGurk is the spouse of Trustee Joanne Hosey-McGurk and she is an employee of Mercyhurst University."
