object_id,ein,FrmAndLnRfrncDsc,ExplntnTxt
201701329349301270,250965591,SCHEDULE L PART IV,"(A) NAME OF INTERESTED PERSON: JOSHUA COCHRAN(B) RELATIONSHIP BETWEEN INTERESTED PERSON AND ORGANIZATION: FAMILY MEMBER OF JEROME COCHRAN, FORMER EXECUTIVE VICE CHANCELLOR.(C) AMOUNT OF TRANSACTION: $27,409(D) DESCRIPTION OF TRANSACTION: EMPLOYMENT(E) SHARING OF ORGANIZATION'S REVENUES? NO(A) NAME OF INTERESTED PERSON: ERIN NORDENBERG(B) RELATIONSHIP BETWEEN INTERESTED PERSON AND ORGANIZATION: FAMILY MEMBER OF MARK NORDENBERG, FORMER CHANCELLOR.(C) AMOUNT OF TRANSACTION: $42,255(D) DESCRIPTION OF TRANSACTION: EMPLOYMENT(E) SHARING OF ORGANIZATION'S REVENUES? NO(A) NAME OF INTERESTED PERSON: MICHAEL NORDENBERG(B) RELATIONSHIP BETWEEN INTERESTED PERSON AND ORGANIZATION: FAMILY MEMBER OF MARK NORDENBERG, FORMER CHANCELLOR.(C) AMOUNT OF TRANSACTION: $18,073(D) DESCRIPTION OF TRANSACTION: EMPLOYMENT(E) SHARING OF ORGANIZATION'S REVENUES? NO(A) NAME OF INTERESTED PERSON: ANITA P. COURCOULAS, MD(B) RELATIONSHIP BETWEEN INTERESTED PERSON AND ORGANIZATION: FAMILY MEMBER OF IRA J. GUMBERG, A TRUSTEE.(C) AMOUNT OF TRANSACTION: $195,103(D) DESCRIPTION OF TRANSACTION: EMPLOYMENT(E) SHARING OF ORGANIZATION'S REVENUES? NO(A) NAME OF INTERESTED PERSON: MARYJEAN LOVETT(B) RELATIONSHIP BETWEEN INTERESTED PERSON AND ORGANIZATION: FAMILY MEMBER OF ROBERT G. LOVETT,A TRUSTEE.(C) AMOUNT OF TRANSACTION: $40,199(D) DESCRIPTION OF TRANSACTION: EMPLOYMENT(E) SHARING OF ORGANIZATION'S REVENUES? NO(A) NAME OF INTERESTED PERSON: ROBIN MAIER(B) RELATIONSHIP BETWEEN INTERESTED PERSON AND ORGANIZATION: FAMILY MEMBER OF JAMES V. MAHER, JR., A FORMER OFFICER.(C) AMOUNT OF TRANSACTION: $65,121(D) DESCRIPTION OF TRANSACTION: EMPLOYMENT(E) SHARING OF ORGANIZATION'S REVENUES? NO(A) NAME OF INTERESTED PERSON: JOHN MAIER(B) RELATIONSHIP BETWEEN INTERESTED PERSON AND ORGANIZATION: FAMILY MEMBER OF JAMES V. MAHER, JR., A FORMER OFFICER.(C) AMOUNT OF TRANSACTION: $96,786(D) DESCRIPTION OF TRANSACTION: EMPLOYMENT(E) SHARING OF ORGANIZATION'S REVENUES? NO(A) NAME OF INTERESTED PERSON: JASON RICHARDS(B) RELATIONSHIP BETWEEN INTERESTED PERSON AND ORGANIZATION: FAMILY MEMBER OF THOMAS RICHARDS, A TRUSTEE.(C) AMOUNT OF TRANSACTION: $87,536(D) DESCRIPTION OF TRANSACTION: EMPLOYMENT(E) SHARING OF ORGANIZATION'S REVENUES? NO(A) NAME OF INTERESTED PERSON: LINDSAY RICHARDS(B) RELATIONSHIP BETWEEN INTERESTED PERSON AND ORGANIZATION: FAMILY MEMBER OF THOMAS RICHARDS, A TRUSTEE.(C) AMOUNT OF TRANSACTION: $97,300(D) DESCRIPTION OF TRANSACTION: EMPLOYMENT(E) SHARING OF ORGANIZATION'S REVENUES? NO(A) NAME OF INTERESTED PERSON: JOHN GREFENSTETTE(B) RELATIONSHIP BETWEEN INTERESTED PERSON AND ORGANIZATION: FAMILY MEMBER OF EDWARD GREFENSTETTE, A TRUSTEE.(C) AMOUNT OF TRANSACTION: $100,380(D) DESCRIPTION OF TRANSACTION: EMPLOYMENT(E) SHARING OF ORGANIZATION'S REVENUES? NO (A) NAME OF INTERESTED PERSON: PARKHURST DINING SERVICES(B) RELATIONSHIP BETWEEN INTERESTED PERSON AND ORGANIZATION: TRUSTEE SUZANNE W. BROADHURST SERVES ON THE BOARD OF DIRECTORS OF PARKHURST DINING SERVICES.(C) AMOUNT OF TRANSACTION: $770,127(D) DESCRIPTION OF TRANSACTION: FOOD SERVICE(E) SHARING OF ORGANIZATION'S REVENUES? NO"
201741299349302849,590624412,"Schedule L, Part III GRANTS OR ASSISTANCE BENEFITING INTERESTED PERSONS","COLLEGES, UNIVERSITIES, AND PRIMARY AND SECONDARY SCHOOLS ARE NOT REQUIRED TO IDENTIFY INTERESTED PERSONS TO WHOM THEY PROVIDED SCHOLARSHIPS, FELLOWSHIPS, AND SIMILAR FINANCIAL ASSISTANCE. PURSUANT TO THE INSTRUCTIONS TO FORM 990, SCHEDULE L, PART III, COLUMNS (A) AND (B) HAVE BEEN LEFT BLANK."
201741309349303924,210634584,Supplemental Information,All transactions disclosed on schedule l are made at arms-length terms and none are influenced by the relationships that exist with the interested persons.
201731319349301563,231353385,"Sch L, Part IV, BUSINESS TRANSACTIONS INVOLVING INTERESTED PERSONS:",THE RELATIONSHIPS IDENTIFIED ABOVE WERE DISCLOSED TO THE BOARD AND IN THE FINANCIAL STATEMENTS.
201721329349302762,570314404,"Schedule L, Part IV, Business Transactions with Interested Persons:",Oakland Mill Master Tenant and West Electrical Company/West Development are 100% owned by Misty West and family members.
201741289349300994,250964126,"SCHEDULE L, PART IV COLUMN B:","MEMBER OF THE BOARD, CO-OWNER OF THE PITTSBURGH STEELERS AND COUSEL WITH BUCHANAN, INGERSOLL & ROONEY PC"
201731359349301753,010211497,"Schedule L, Part II",Mortgages to officers are issued in accordance with a program available to all continuing faculty and staff.
201741319349303099,530196584,"SCHEDULE L, PART II, LINE 1, COLUMN C","PURPOSE OF LOAN: UPON RECRUITMENT AND RELOCATION, GW PROVIDED ASSISTANCE WITH PURCHASE OF RESIDENCE."
201741319349303099,530196584,"SCHEDULE L, PART IV, LINES 1-2, COLUMN B",1) RELATIONSHIP BETWEEN INTERESTED PERSON AND THE ORGANIZATION: THE INDIVIDUAL IS A FAMILY MEMBER OF INTERIM OFFICER FORREST MALTZMAN. 2) RELATIONSHIP BETWEEN INTERESTED PERSON AND THE ORGANIZATION: THE INDIVIDUAL IS A FAMILY MEMBER OF FORMER KEY EMPLOYEE PAUL SCHIFF BERMAN.
201731329349305998,042133255,BUSINESS TRANSACTIONS WITH INTERESTED PERSONS,"DURING THE YEAR, SUFFOLK UNIVERSITY OBTAINED PUBLIC RELATIONS SERVICES FROM REGAN COMMUNICATIONS INC., OF WHICH JULIE KAHN, A TRUSTEE OF THE UNIVERSITY, IS EXECUTIVE VP/STRATEGY, SPORTS & MEDIA. JULIE KAHN RECUSED HERSELF FROM ANY DISCUSSION OF REGAN COMMUNICATIONS BUSINESS AT THE BOARD AND OTHERWISE COMPLIED WITH THE BOARD'S CONFLICT OF INTEREST POLICY. THE AMOUNT PAID TO REGAN COMMUNICATIONS FOR SERVICES RENDERED WAS $159,828 FOR THE YEAR ENDED 6/30/16. ALL TRANSACTIONS WERE ENTERED INTO AT ARMS LENGTH AND PAYMENT FOR SERVICES WAS AT FAIR MARKET VALUE."
201731329349304438,050259080,PART IV:,"THE UNIVERSITY FOLLOWS A STRICT POLICY FOR HIRING FACULTY AND STAFF. IN ADDITION, SALVE REGINA UNIVERSITY IS AN EQUAL OPPORTUNITY/AFFIRMATIVE ACTION EMPLOYER. CANDIDATES ARE HIRED INTO POSITIONS USING BOTH INTERNAL TRANSFERS AND EXTERNAL CANDIDATES. ALL EMPLOYEES ARE INTERVIEWED AND EVALUATED BASED UPON THE QUALIFICATIONS INCLUDED IN THE JOB DESCRIPTION FOR THE POSITION OFFERED. ALL EMPLOYEES ARE HIRED AT AN ARM'S LENGTH AND ARE FULLY QUALIFIED FOR THE POSITION THAT THEY FILL."
201711329349305706,042103594,"Schedule L, Part III LINE 1 - CHILDREN'S SCHOLARSHIPS","ALTHOUGH THERE MAY BE RECIPIENTS WHO ARE RELATED TO PERSONS HAVING AN INTEREST IN THE INSTITUTE, SUCH RECIPIENTS ARE SELECTED ON THE BASIS OF ACADEMIC ACHIEVEMENT, FINANCIAL NEED, AND OTHER SIMILAR STANDARDS."
201711329349305706,042103594,"Schedule L, Part IV PART IV","MS. PAMELA EVANS IS A RESEARCH GROUP LEADER AT MIT LINCOLN LABORATORY. MS. EVANS IS A FAMILY MEMBER OF AN MIT KEY EMPLOYEE. IN FY 2016, SHE RECEIVED COMPENSATION AND BENEFITS IN THE AMOUNT OF $259,163."
201731319349302163,570314395,"SCHEDULE L, PART V","SCH L, PART III THE UNIVERSITY HAS AN EMPLOYEE DEPENDENT TUITION REMISSION BENEFIT PLAN, WHICH IS AVAILABLE TO ALL EMPLOYEES AND ELIGIBLE DEPENDENTS. SCH L, PART IV JUAN JOHNSON CONSULTING AND FACILITATION, LLC - UNIVERSITY TRUSTEE JUAN JOHNSON IS AN OFFICER OF JUAN JOHNSON CONSULTING AND FACILITATION, LLC. THE COMPANY PROVIDES DIVERSITY LEADERSHIP TRAINING THROUGH THE RICHARD W. RILEY INSTITUTE OF GOVERNMENT, POLITICS AND PUBLIC LEADERSHIP AT FURMAN UNIVERSITY. COURTNEY TOLLISON: SPOUSE OF UNIVERSITY TRUSTEE SEAN HARTNESS, WAS PAID WAGES FOR HER EMPLOYMENT WITH THE FILING ORGANIZATION. WILLIAM MERKT: SPOUSE OF OFFICER MARY LOU MERKT, WAS PAID WAGES FOR HIS EMPLOYMENT WITH THE FILING ORGANIZATION. ERICA MEDVED: SPOUSE OF HEAD BASKETBALL COACH AND KEY EMPLOYEE NIKO MEDVED, WAS PAID WAGES FOR HER EMPLOYMENT WITH THE FILING ORGANIZATION."
201721359349302167,381381271,"SCH L, PART IV, BUSINESS TRANSACTIONS INVOLVING INTERESTED PERSONS:","(A) NAME OF PERSON: EMILIE D. WIERDA(B) RELATIONSHIP BETWEEN INTERESTED PERSON AND ORGANIZATION: EMILIE D. WIERDA IS A BOARD MEMBER OF HOPE COLLEGE(C) AMOUNT OF TRANSACTION $321,469(D) DESCRIPTION OF TRANSACTION: EMILIE D. WIERDA IS A BOARD MEMBER OF HOPE COLLEGE AND IS THE DAUGHTER OF ELSA PRINCE BROEKHUIZEN WHO IS THE MAJORITY OWNER OF LUMIR CORPORATION FROM WHOM THE COLLEGE RENTS STUDENT HOUSING.(E) SHARING OF ORGANIZATION REVENUES? = NO(A) NAME OF PERSON: RICHARD A. FROST(B) RELATIONSHIP BETWEEN INTERESTED PERSON AND ORGANIZATION: RICHARD A. FROST IS A KEY EMPLOYEE OF HOPE COLLEGE(C) AMOUNT OF TRANSACTION $10,436,085(D) DESCRIPTION OF TRANSACTION: RICHARD A. FROST IS A KEY EMPLOYEE OF HOPE COLLEGE AND IS THE CHAIRPERSON OF CREATIVE DINING SERVICES. FINANCIAL ARRANGEMENT IS COMPETITIVELY PRICED. (E) SHARING OF ORGANIZATION REVENUES? = NO"
201731289349300113,240772407,"Schedule L, Part V Supplemental Information","Part IV - Although not a 35% controlled entity: Geisinger Health Plan - The President of Bucknell University (John C. Bravman) and another member of Bucknell University's Board of Trustees (Christopher B. Sullivan), are members of that healthcare organization's board of directors. The healthcare organization provides certain healthcare services, insurance services and healthcare claims administration services to the university. Amounts paid to the healthcare organization and its affiliates for services totaled $3,143,905 for year ended June 30, 2016.Also, the University and the healthcare organization conduct certain programs whereby University students and faculty participate with the healthcare organization in educational and research activites related to medical and healthcare endeavors. The healthcare organization provides approximately 75% of the grant revenues to support these University programs. University expenditures for the year ended June 30, 2016 for those programs totaled $325,367."
201731299349301533,231352354,"SCH L, PART IV, BUSINESS TRANSACTIONS INVOLVING INTERESTED PERSONS:","(A) NAME OF PERSON: RON DRNEVICH(D) DESCRIPTION OF TRANSACTION: RON DRNEVICH IS A BOARD MEMBER OF CAPITAL BLUE CROSS, THE COLLEGE'S MEDICAL INSURANCE PROVIDER. ALL TRANSACTIONS ARE COMPLETED AT AN ARM'S LENGTH BASIS. PAYMENTS MADE TO BLUE CROSS DURING THE YEAR AMOUNTED TO $2,719,445. (A) NAME OF PERSON: WENDIE HOLSINGER(D) DESCRIPTION OF TRANSACTION: WENDIE HOLSINGER SERVES ON THE LEBANON DIVISION OF THE FULTON BANK ADVISORY BOARD, THE COLLEGE'S FINANCIAL INSTITUTION. ALL TRANSACTIONS ARE COMPLETED AT AN ARM'S LENGTH BASIS. INTEREST AND FEES PAID TO FULTON EQUAL $1,892,280 FOR THE YEAR ENDED 6/30/2016."
201721319349300142,020222182,"Schedule L, Part III","The College granted a scholarship to a student who is the child of a current board trustee. The college ensured the grant was awarded based on merit to the eligible student, who met the required academic standing. The trustee does not have any influence in the decision making process for awarding scholarships."
201711319349300811,231352661,"Schedule L, Part I, Line 2","Compensation presented within Schedule L is per the respective organization tax year. Messiah College's fiscal year end is 6/30 and Rider Musser Development LLC's fiscal year end is 12/31. Compensation is considered fair market value and is determined pursuant to the respective organization's Human Resources compensation practices. (Line 6) Listed individuals are not supervised by their respective spouse. Rider Musser Development LLC is a for profit corporation whose purpose is ""to create a new residential neighborhood and business park that will generate tax revenue and jobs, while enhancing the community by offering conveniences to local residents, as well as students and faculty of nearby Messiah College"". Rider Musser Development Corporation LLC is presented in the College's Financial Statements as one of its real estate related investments. The College's investment in Rider Musser Development LLC was approved by the College's Board of Trustees in keeping with the College's conflict of interest policy. Although Messiah College is the chief investor (as of the date of this return), Rider Musser Development LLC is a separate entity and seeks to maintain an ""arms length"" relationship with the College. Rider Musser Development LLC is governed by a joint resolution and operating agreement which delegates powers of Messiah College to an independent Board of Directors as allowed under Pennsylvania law."
201721359349301912,231177930,"SCHEDULE L, PART III",Grants for tuition and fees are provided on the same criteria for all students based on academic achievement and financial need.
201721319349305152,951644035,"Schedule L Part II, Explanation of loan to DRC Partners","During the tax year ended 6/30/2015, the University made a $3,500,000 loan to DRC Partners. There was no similar loan in prior years. Legal counsel was consulted during the formation of the loan."
201731289349301003,620476822,"Schedule L, Part III","(a) Name of interested person:Education assistance provided to four interested persons(b) Relationship between interested person and the organization:Employees, dependents, family members(c) Amount of assistance:$94,013(d) Type of assistance:Merit-based and need-based scholarships and awards(e) Purpose of assistance:Scholarships and awards to assist individuals fund education costs(a) Name interested person:Tuition assistance provided to three interested persons(b) Relationship between interested person and the organization:Employees and qualifying dependents of eligible employees(c) Amount of assistance:$117,653(d)Type of assistance:Tuition assistance(e) Purpose of assistance:Tuition to assist individuals fund education costs"
201731289349301003,620476822,"Schedule L, Part IV","(a) Name of Person: Andrea Birch(b)Relationship between interested person and Organization: Family member of trustee Adolpho A. Birch, III(c) Amount of transaction: $425,416(d) Description of transaction: Employment at Vanderbilt(e) Sharing of Organization revenues? = No(a) Name of Person: Gary Robert Kimball III(b)Relationship between interested person and Organization: Family member of trustee Carroll E. Kimball(c) Amount of transaction: $165,812(d) Description of transaction: Employment at Vanderbilt(e) Sharing of Organization revenues? = No(a) Name of Person: Stacey McCarty(b) Relationship between interested person and Organization: Family member of former officer Richard McCarty(c) Amount of transaction: $59,529(d) Description of transaction: Employment at Vanderbilt(e) Sharing of Organization revenues? = No(a) Name of Person: Gail P. Carr-Williams, JD(b) Relationship between interested person and Organization: Family member of current officer David Williams, II(c) Amount of transaction: $136,642(d) Description of transaction: Employment at Vanderbilt(e) Sharing of Organization revenues? = No"
201721319349303957,141338580,"Schedule L, Part IV - Interested Persons","Vice President of Finance and Administration Diane Blake's brother-in-law, Scott Montgomery, is an employee of the College. amounts reported on schedule L represent the W-2, Box 5 wages plus benefits paid on behalf of Mr. Montgomery. President, Stephen Ainlay's spouse, Judith Ainlay, is an employee of the College. Amounts reported on schedule L represent the W-2, Box 5 wages plus benefits paid on behalf of Ms. Ainlay."
201711319349304686,363377698,"Schedule L, Part IV","INTERESTED PERSON: THE LAW OFFICE OF BARBARA L. MCCLOUD, PLLC. RELATIONSHIP: Barbara L. McCloud IS THE OWNER/FOUNDER of the LAW OFFICE OF BARBARA L. MCCLOUD, PLLC. IN JUNE, 2015 SHE BECAME THE VICE PRESIDENT AND GENERAL COUNSEL OF MIDWESTERN UNIVERSITY. THE LAW OFFICE OF BARBARA L. MCCLOUD PROVIDES LEGAL SERVICES TO MIDWESTERN UNIVERSITY. TRANSACTION: THE UNIVERSITY PAYS THE LAW OFFICE OF BARBARA L. MCCLOUD FOR LEGAL SERVICES PROVIDED PRIOR TO HER EMPLOYMENT BY THE UNIVERSITY. THE AMOUNTS LISTED ON SCHEDULE L, COLUMN (C) THAT ARE REFERRED TO HERE ARE FOR THOSE SERVICES DURING THE TAXABLE YEAR. MS. MCCLOUD WAS NOT AN OFFICER OR EMPLOYEE OF THE UNIVERSITY WHEN FEE AGREEMENTS WITH THE LAW OFFICE OF BARBARA L. MCCLOUD WERE ENTERED INTO WITH THE UNIVERSITY. INTERESTED PERSON: Chanen Construction Company, Inc. RELATIONSHIP: STEVEN R CHANEN IS THE President and Chief Executive Officer of Chanen Construction Company, Inc. AND A MEMBER OF THE BOARD OF TRUSTEES OF MIDWESTERN UNIVERSITY. CHANEN CONSTRUCTION COMPANY, INC. HAS PROVIDED GENERAL CONTRACTING SERVICES ON NUMEROUS MAJOR UNIVERSITY CONSTRUCTION PROJECTS OVER MANY YEARS. TRANSACTION: THE UNIVERSITY PAYS CHANEN CONSTRUCTION COMPANY, INC. AS THE GENERAL CONTRACTOR FOR UNIVERSITY CONSTRUCTION PROJECTS. THE AMOUNTS LISTED ON SCHEDULE L, COLUMN (C) THAT ARE REFERRED TO HERE ARE FOR THOSE SERVICES DURING THE TAXABLE YEAR. MR. CHANEN WAS ELECTED TO THE UNIVERSITY'S BOARD OF TRUSTEES AS OF JANUARY 16, 2015. UNDER THE UNIVERSITY'S CONFLICT OF INTEREST POLICY, MR. CHANEN DOES NOT PARTICIPATE IN THE APPROVAL BY THE BOARD OF TRUSTEES OF THE UNIVERSITY'S CONTRACTING AGREEMENTS WITH CHANEN CONSTRUCTION FOR ANY OF THE SERVICES PROVIDED BY CHANEN CONSTRUCTION. ARRANGEMENTS BETWEEN CHANEN CONSTRUCTION AND THE UNIVERSITY HAVE ALWAYS BEEN AND CONTINUE TO BE CONDUCTED ON AN ARMS LENGTH, FAIR MARKET VALUE BASIS."
201721309349302567,310536715,"Schedule L, Part III GRANTS OR ASSISTANCE BENEFITING INTERESTED PERSONS","PER THE IRS INSTRUCTIONS FOR SCHEDULE L, COLLEGES, UNIVERSITIES, AND PRIMARY AND SECONDARY SCHOOLS ARE NOT REQUIRED TO IDENTIFY INTERESTED PERSONS TO WHOM THEY PROVIDED SCHOLARSHIPS, FELLOWSHIPS, AND SIMILAR FINANCIAL ASSISTANCE. INSTEAD, THESE ORGANIZATIONS MUST GROUP EACH TYPE OF FINANCIAL ASSISTANCE PROVIDED TO INTERESTED PERSONS IN SEPARATE LINES. FOR EACH LINE, THE SCHOOL IS TO REPORT IN COLUMN (C) THE TYPE OF ASSISTANCE AND AGGREGATE DOLLAR AMOUNT OF THAT ASSISTANCE; COLUMNS (A) AND (B) ARE TO BE LEFT BLANK."
201721359349313622,860186050,"Schedule L, Pt. II","All of the notes payable reported on Schedule L, Pt. II began in the current tax year. The balances due in column f have therefore not decreased from the original principal amount in column e."
201721359349305002,560532129,"SCH L, PART III, GRANTS OR ASSISTANCE BENEFITING INTERESTED PERSONS:","(A) NUMBER OF RECIPIENTS: 10(B) RELATIONSHIP BETWEEN INTERESTED PERSON AND ORGANIZATION: GRANT SELECTION COMMITTEE MEMBERS(C) AMOUNT OF GRANT: $250,634(D) TYPE OF ASSISTANCE: GRANTS(E) PURPOSE OF ASSISTANCE: GENERAL SUPPORT(A) NUMBER OF RECIPIENTS: 1(B) RELATIONSHIP BETWEEN INTERESTED PERSON AND ORGANIZATION: FAMILY MEMBER OF TRUSTEE(C) AMOUNT OF GRANT: $70,770(D) TYPE OF ASSISTANCE: SCHOLARSHIP(E) PURPOSE OF ASSISTANCE: SCHOLARSHIP"
201721359349305002,560532129,"SCH L, PART IV, BUSINESS TRANSACTIONS INVOLVING INTERESTED PERSONS:","(A) NAME OF INTERESTED PERSON: CYNTHIA BRODHEAD(B) RELATIONSHIP BETWEEN INTERESTED PERSON AND ORGANIZATION: CYNTHIA BRODHEAD IS A FAMILY MEMBER OF A DUKE UNIVERSITY OFFICER(C) AMOUNT OF TRANSACTION: $171,335(D) DESCRIPTION OF TRANSACTION: PAYMENT FOR SALARY AND BENEFITS(E) SHARING OF ORGANIZATION REVENUE? = NO(A) NAME OF INTERESTED PERSON: LORI LEACHMAN(B) RELATIONSHIP BETWEEN INTERESTED PERSON AND ORGANIZATION: LORI LEACHMAN IS A FAMILY MEMBER OF A DUKE UNIVERSITY FORMER OFFICER(C) AMOUNT OF TRANSACTION: $57,420(D) DESCRIPTION OF TRANSACTION: PAYMENT FOR SALARY AND BENEFITS(E) SHARING OF ORGANIZATION REVENUE? = NO(A) NAME OF INTERESTED PERSON: DEBORAH JAKUBS(B) RELATIONSHIP BETWEEN INTERESTED PERSON AND ORGANIZATION: DEBORAH JAKUBS IS A FAMILY MEMBER OF A DUKE UNIVERSITY KEY EMPLOYEE(C) AMOUNT OF TRANSACTION: $307,500(D) DESCRIPTION OF TRANSACTION: PAYMENT FOR SALARY AND BENEFITS(E) SHARING OF ORGANIZATION REVENUE? = NO(A) NAME OF INTERESTED PERSON: BERNARD MATHEY-PREVOT(B) RELATIONSHIP BETWEEN INTERESTED PERSON AND ORGANIZATION: BERNARD MATHEY-PREVOT IS A FAMILY MEMBER OF A DUKE UNIVERSITY KEY EMPLOYEE(C) AMOUNT OF TRANSACTION: $162,713(D) DESCRIPTION OF TRANSACTION: PAYMENT FOR SALARY AND BENEFITS(E) SHARING OF ORGANIZATION REVENUE? = NO(A) NAME OF INTERESTED PERSON: MOLLY M WALSH(B) RELATIONSHIP BETWEEN INTERESTED PERSON AND ORGANIZATION: MOLLY M WALSH IS A FAMILY MEMBER OF A DUKE UNIVERSITY OFFICER(C) AMOUNT OF TRANSACTION: $26,000(D) DESCRIPTION OF TRANSACTION: PAYMENT FOR SALARY AND BENEFITS(E) SHARING OF ORGANIZATION REVENUE? = NO(A) NAME OF INTERESTED PERSON: JAMES MATTHEW GIBSON(B) RELATIONSHIP BETWEEN INTERESTED PERSON AND ORGANIZATION: JAMES MATTHEW GIBSON IS A FAMILY MEMBER OF A DUKE UNIVERSITY KEY EMPLOYEE(C) AMOUNT OF TRANSACTION: $35,057(D) DESCRIPTION OF TRANSACTION: PAYMENT FOR SALARY AND BENEFITS(E) SHARING OF ORGANIZATION REVENUE? = NO"
201721329349301252,042103558,Part IV Line 1,"Terry Blackwell, an employee of the College is related to an officer and received compensation for his services totaling 47,823 during calendar year 2015."
201721329349302607,240795509,"SCH L, PART IV, BUSINESS TRANSACTIONS INVOLVING INTEREST PERSONS:","(A) NAME OF PERSON: JEFFREY METZ(D) DESCRIPTION OF TRANSACTION : JEFFREY METZ IS THE OWNER OF METZ CULINARY MANAGEMENT, A FOOD SERVICE CONTRACTOR WITH WHOM THE ORGANIZATION DOES BUSINESS."
201721259349300622,640303084,"PART IV, LINE 1, COLUMNS (B) & (D)","Board member, William Yates, is a more than 35% owner of W.G. Yates & Sons Construction. In February of 2016, the Board authorized the College to enter into a design/build contract with Yates Construction for the renovation of the Christian Center (a historic academic building on campus). The funds for the building will be paid in part by a contribution from the Yates family. Mr. Yates abstained from voting or taking part of any decisions related to this project."
201721329349303852,060731360,GRANTS OR ASSISTANCE BENEFITTING INTERESTED PERSON,"FORM 990, SCHEDULE L, PART III, LINE 1, $9,500 NEED-BASED STUDENT SCHOLARSHIPS FORM 990, SCHEDULE L, PART III, LINE 2, $89,804 MERIT-BASED STUDENT SCHOLARSHIPS FORM 990, SCHEDULE L, PART III, LINE 3, $7,381 DISCOUNTED STUDENT TUITION"
201721359349304687,210634501,Loans to and/or from interested persons,"Schedule L, Part II In accordance with a mortgage loan program, the University provides home financing assistance on residential properties in the area surrounding the University to eligible employees, including officers and key employees, under the authority of resolutions adopted by the Committee on Finance of the Board of Trustees."
201731039349300833,231352654,"FORM 990,PART IV, LINE 28 C AND SCHEDULE L, PART IV","SMART DEVINE LLC - ENTITY OVER 35% CONTROLLED BY JAMES SMART. JAMES SMART HAS ACKNOWLEDGED THROUGH SIGNING A POTENTIAL CONFLICT OF INTEREST DISCLOSURE, THAT HE HAS A DIRECT BUSINESS RELATIONSHIP WITH THE UNIVERSITY, OTHER THAN HIS ROLE AS TRUSTEE. SMART DEVINE LLC PROVIDES LIMITED ACCOUNTING SUPPORT ON A LIMITED PROJECT BASIS FOR LA SALLE UNIVERSITY, AS APPROVED BY THE BOARD OF TRUSTEES. William Sautter, Board of Trustee Member, has acknowledged through signing a potential conflict of interest disclosure, that he has a direct business relationship with the University through his 35% controlled company Elliot-Lewis Corporation. Elliot-Lewis Corporation performs mechanical maintenance, repair and installation services for La Salle University."
201731319349303098,430654872,BUSINESS TRANSACTIONS INVOLVING INTERESTED PERSONS,"SCHEDULE L, PART IV ALL TRANSACTIONS LISTED ON SCHEDULE L, PART IV WERE COMPLIANT WITH THE CONFLICT OF INTEREST POLICY. ANY TRANSACTIONS REQUIRING BOARD APPROVAL WERE APPROVED BY AN INDEPENDENT BOARD. ROBERT N. FOX, TRUSTEE, WAS THE OWNER AND CEO OF NEWSPACE, INC., WHICH PROVIDED SERVICES TO THE UNIVERSITY IN THE AMOUNT OF $195,817."
201741359349311824,450323401,"Schedule L, Part V Supplemental Information","SCH L, PART IV, BUSINESS TRANSACTIONS INVOLVING INTERESTED PERSONS:(A) NAME OF PERSON: WANDA LADUCER(B) RELATIONSHIP BETWEEN INTERESTED PERSON AND ORGANIZATION: FAMILY MEMBER OF BOARD MEMBER(C) AMOUNT OF TRANSACTION $68,446(D) DESCRIPTION OF TRANSACTION: FAMILY MEMBER IS COMPENSATED AS AN EMPLOYEE OF THE ORGANIZATION.(E) SHARING OF ORGANIZATION REVENUES? = NO"
201731319349305143,362169157,"Schedule L, Part III GRANTS OR ASSISTANCE BENEFITING INTERESTED PERSONS","ALTHOUGH THERE MAY BE RECIPIENTS WHO ARE RELATED TO PERSONS HAVING AN INTEREST IN THE INSTITUTION, SUCH RECIPIENTS ARE SELECTED ON AN EQUAL, OBJECTIVELY DETERMINABLE BASIS WITH OTHER RECIPIENTS. ALL STUDENTS RECEIVING SCHOLARSHIPS AND FELLOWSHIPS ARE JUDGED WORTHY BY THE INSTITUTION'S ASSESSMENT ON THE BASIS OF ACADEMIC ACHIEVEMENT, FINANCIAL NEED AND OTHER SIMILAR STANDARDS. ANY SCHOLARSHIP COMMITTEE MEMBER WHO HAS A RELATIONSHIP WITH ANY POTENTIAL RECIPIENT OF SCHOLARSHIP MONEY IS NOT INCLUDED IN THE SELECTION PROCESS FOR THAT PARTICULAR CANDIDATE."
201731319349305643,210634981,"FORM 990, PART VI","ERIN QUINN CRITCHETT BONCZEK IS EMPLOYED BY THE UNIVERSITY AND FAMILY MEMBERS OF EVELYN SAUL QUINN, VP FOR MISSION INTERGRATION"
201731359349301003,240795965,"SCH L, PART IV, BUSINESS TRANSACTIONS INVOLVING INTERESTED PERSONS:","CAROLYN KAY LUNDY'S SON, FRANK LUNDY III, IS THE VICE PRESIDENT OF LUNDY CONSTRUCTION. LUNDY CONSTRUCTION PERFORMS CONSTRUCTION WORK FOR VARIOUS BUILDING PROJECTS AT THE COLLEGE."
201731339349301213,150532081,BUSINESS TRANSACTIONS WITH INTERESTED PERSONS,"PART IV DRUMLINS, INC.'S BOARD MEMBERS INCLUDE LOUIS G. MARCOCCIA, DAVID J. SMITH, JAMIE CYR, JEAN B. GALLIPEAU AND GWENN JUDGE WHO DO NOT HAVE A PERSONAL INTEREST IN DRUMLINS BUT ARE OFFICERS OF SYRACUSE UNIVERSITY AND DRUMLINS INC. THE ABOVE TRANSACTIONS WITH ALLIANCE ENERGY TRANSMISSION SYRACUSE, DANIEL J. FRENCH & ASSOCIATES, LLC, HUEBER-BREUER CONSTRUCTION CO. INC. AND LOON CREEK PROPERTIES HAVE BEEN MANAGED IN ACCORDANCE WITH UNIVERSITY POLICIES AND FULLY COMPLIED WITH THE UNIVERSITY'S EXISTING CONFLICT OF INTEREST POLICY."
