object_id,ein,FrmAndLnRfrncDsc,ExplntnTxt
201700729349300315,440589787,"SCHEDULE L, PART IV, LINES 1 & 2",FAMILY RELATIONSHIP: ERICA AND JEREMY HARRIS ARE THE DAUGHTER AND SON-IN-LAW OF BOARD MEMBER RAYMOND SCHMIDGALL. THEY ARE BOTH EMPLOYED AS PROFESSORS WITH THE ORGANIZATION. MICHAEL MCCORCLE IS THE BROTHER OF BOARD MEMBER MARC MCCORCLE. MICHAEL IS EMPLOYED AS THE PROVOST OF THE UNIVERSITY.
201700419349301120,591237047,"SCHEDULE L, PART II",LOANS TO INTERESTED PERSONS DR. EDWARD W. DADEZ - VP STUDENT SERVICES THE LOAN TO DR. DADEZ IS AN AGREEMENT THAT SAINT LEO UNIVERSITY ENTERED SO THAT THEY WERE ABLE TO RETAIN HIS SPECIALTY AND KNOWLEDGE DEALING WITH OUR MILITARY AND CIVILIAN CENTERS. THE LOAN HAS A REPAYMENT PROVISION THAT PROTECTS SAINT LEO'S INTERESTS.
201720979349300617,454971921,"SCHEDULE L, PART V","RICHARD ""TRENT"" WILBANKS IS A FAMILY MEMBER OF JOHN WHITE III AND TRUDY WHITE, OFFICERS AND DIRECTORS. MR. WILBANKS IS REVIEWED ANNUALLY BY AN INDEPENDENT PARTY. HIS SALARY IS ALSO DETERMINED BY AN INDEPENDENT PARTY."
201741089349300209,591023117,"Schedule L, Part III GRANTS OR ASSISTANCE BENEFITING INTERESTED PERSONS","COLLEGES, UNIVERSITIES AND PRIMARY AND SECONDARY SCHOOLS ARE NOT REQUIRED TO IDENTIFY INTERESTED PERSONS TO WHOM THEY PROVIDED SCHOLARSHIPS, FELLOWSHIPS, AND SIMILAR FINANCIAL ASSISTANCE. PURSUANT TO THE INSTRUCTIONS TO FORM 990, SCHEDULE L, PART III, COLUMNS (A) AND (B) HAVE BEEN MARKED N/A."
201721039349301212,150545841,"SCHEDULE L, PART IV","LE MOYNE COLLEGE PAID PIONEER MANAGEMENT GROUP LLC $314,000 DURING THE YEAR FOR CONSTRUCTION MANAGEMENT SERVICES. NOREEN FALCONE IS A TRUSTEE OF LE MOYNE COLLEGE AND HER FAMILY OWNS PIONEER MANAGEMENT GROUP LLC. PRIOR TO LE MOYNE COLLEGE HIRING PIONEER, THE BOARD OF TRUSTEES REVIEWED THE SERVICES PERFORMED BY PIONEER AND THE RELATIONSHIP WITH NOREEN FALCONE AND APPROVED THE SERVICES TO OCCUR. PIONEER MANAGEMENT GROUP LLC DOES NOT SHARE IN THE REVENUES OF LE MOYNE COLLEGE."
201741359349307984,951890710,"SCHEDULE L, PART V",PART IV - BUSINESS TRANSACTIONS WITH INTERESTED PERSONS: (1) RACHEL KEYS IS THE DAUGHTER OF TRUSTEE J.T. REED. (2) VICKIE CLEVELAND IS THE WIFE OF OFFICER ART CLEVELAND. (3) DARLA DONALDSON IS THE WIFE OF DEAN OF ENGINEERING DR. ANTHONY DONALDSON LOANS ARE MADE AVAILABLE TO CBU STAFF AND FACULTY FOR HIGHER EDUCATION DEGREES. THE LOANS ARE PAID TO THE INDIVIDUAL AND THEY SIGN A PROMISORY NOTE. EACH PROMISORY NOTE SIGNED IS FOR THREE YEARS. AT THE END OF EACH THREE YEAR PERIOD THE LOAN IS FORGIVEN AND THE AMOUNT IS REPORTED AS COMPENSATION ON THE EMPLOYEES W2.
201741329349304894,042103552,PART IV,"THE UNIVERSITY ENGAGES FAMILY MEMBERS OF OFFICERS OR TRUSTEES OF THE UNIVERSITY, IN THE ORDINARY COURSE OF BUSINESS, AS FOLLOWS: MARGOT T. DAVIS, SPOUSE OF UNIVERSITY TRUSTEE JONATHAN G. DAVIS, IS EMPLOYED BY THE UNIVERSITY AS A PART-TIME SENIOR RESEARCH ASSOCIATE. DR. DAVIS RECEIVED EMPLOYEE COMPENSATION OF $69,351. TRUSTEE DAVIS DOES NOT PARTICIPATE IN ESTABLISHING THE COMPENSATION OF DR. DAVIS."
201731359349305328,135598093,NOTES TO SCHEDULE L,"ALL AMOUNTS SHOWN ON SCHEDULE L REPRESENT PAYMENTS BY THE UNIVERSITY TO THE INTERESTED PERSON. THE SPOUSE OF THE KEY EMPLOYEE LISTED IN SCHEDULE L WAS AN EMPLOYEE OF THE UNIVERSITY DURING THE REPORTING PERIOD. HER COMPENSATION REPORTED ON SCHEDULE L WAS DETERMINED IN ACCORDANCE WITH THE UNIVERSITY'S REGULAR COMPENSATION PRACTICES APPLICABLE TO SIMILARLY SITUATED EMPLOYEES. NO UNIVERSITY OFFICIAL WHO WAS ALSO AN OFFICER OR DIRECTOR OF AN INTERESTED PERSON PARTICIPATED IN OR INFLUENCED THE UNIVERSITY'S DECISION ABOUT ANY TRANSACTION. SCHEDULE L, PART II THE LOAN REPORTED FOR JOHN COATSWORTH IN PART II IS INTEREST BEARING AND SECURED BY AN INTEREST IN A PRIMARY RESIDENCE. THE LOAN REPORTED FOR DAVID MADIGAN IN PART II IS INTEREST BEARING AND WAS MADE IN CONNECTION WITH A PRIMARY RESIDENCE."
201741329349304304,560532138,"Schedule L, Part V Supplemental Information","Part IIIThe University has an employee dependent tuition remission benefit plan, which is available to all employees and their eligible dependents. Various listed persons have dependents currently receiving tuition discounts under this plan.The filing organization awards scholarships for various purposes. As noted in Form 990, Part III, about 59% of our graduate and undergraduate students receive scholarships or other financial aid. Various listed persons have dependents who have received merit scholarships, summer intern scholarships or study abroad scholarships.Part IVJulia Hatch: Family member of the organization's president, Nathan O. Hatch, was paid wages for her employment with the filing organization.Angela J. Lynde: Family member of the organization's key employee, Ronald D. Wellman, was paid wages for her employment with the filing organization.Barbara P. Holding: Family member of organization's trustee, Frank B. Holding Jr., was paid wages for her employment with the filing organization."
201740459349301474,560530003,"PART IV, LINE 1: BUSINESS TRANSACTIONS INVOLVING INTERESTED PERSONS","Caroline is a partner at Robinson Bradshaw & Hinson, PA (RBH). RBH regularly PROVIDES CONSULTING SERVICES TO Queens on various issues. Michael Marsicano is the President of Foundation for the Carolinas and past Board Chair of Queens University of Charlotte. The investment assets of the Queens University of Charlotte Endowment are managed by the Foundation for the Carolinas."
201711039349301161,941156628,"Schedule L, Part IV REVIEW BY THE COMPENSATION COMMITTEE OF THE BOARD OF TRUSTEES","THE COMPENSATION COMMITTEE OF THE BOARD OF TRUSTEES IS RESPONSIBLE FOR ALL MATTERS OF EXECUTIVE COMPENSATION. THE COMPENSATION COMMITTEE IS COMPRISED SOLELY OF INDEPENDENT TRUSTEES, NONE OF WHOM HAVE A CONFLICT OF INTEREST WITH RESPECT TO THE COMPENSATION ARRANGEMENT; THE COMPENSATION COMMITTEE IS ACCOUNTABLE FOR SETTING REASONABLE COMPENSATION PACKAGES FOR OFFICERS, Disqualified individuals (DEFINED UNDER SECTION 4958 OF THE INTERNAL REVENUE CODE OF 1986, AS AMENDED), AND KEY EMPLOYEES (INCLUDING THE UNIVERSITY PRESIDENT). BECAUSE THE INDIVIDUALS LISTED IN SCHEDULE L, PART IV ARE FAMILY MEMBERS OF DISQUALIFIED INDIVIDUALS, THE COMPENSATION COMMITTEE IS ALSO ACCOUNTABLE FOR SETTING THE REASONABLE COMPENSATION PACKAGES FOR THESE INDIVIDUALS. THE COMPENSATION COMMITTEE DEVELOPS, CONSISTENT WITH THE UNIVERSITY'S VISION, MISSION, AND VALUES, THE ANNUAL PERFORMANCE GOALS AND CRITERIA TO BE USED IN DETERMINING MERIT INCREASES AND VARIABLE COMPENSATION CRITERIA FOR THESE INDIVIDUALS. THE COMPENSATION COMMITTEE (IN COORDINATION WITH THE UNIVERSITY'S HUMAN RESOURCES DEPARTMENT) ALSO REVIEWS COMPARABLE COMPENSATION AND BENEFITS INFORMATION TO ANALYZE AND PROVIDE BENCHMARKING DATA FOR THE TOTAL COMPENSATION AND BENEFITS PACKAGES OF THESE INDIVIDUALS. APPROPRIATE COMPARABILITY DATA IS OBTAINED FROM INDEPENDENT EXPERTS, INCLUDING TOTAL ECONOMIC BENEFITS PAID BY SIMILARLY SITUATED ORGANIZATIONS (BOTH TAXABLE AND TAX-EXEMPT) FOR SIMILAR JOB RESPONSIBILITIES. KEY DELIBERATIONS OF THE COMPENSATION COMMITTEE ARE contemporaneously DOCUMENTED IN MINUTES WHICH ARE APPROVED AT THE NEXT COMPENSATION COMMITTEE MEETING."
201711039349301161,941156628,"Schedule L, Part IV Business Transaction with Interested Person","The son of a Member of the Board of Trustees is the Founder and Managing General Partner of Ten Eleven Ventures, LLC, a venture capital fund in which the University has invested. All decisions to invest in this Venture Capital Fund were made in accordance with the University's Conflict of Interest Policy, which includes the following procedures: (1) the conflicting interest is fully disclosed to the Board of Trustees; (2) the interested person responds to factual questions related to the substance of the transaction or arrangement being considered, after which he shall leave the meeting; (3) the person with the conflict of interest is excluded from the discussion and approval of any proposed transaction; (4) alternatives to the proposed transaction are investigated, competitive bids or comparable valuations are obtained; (5) any conflicting issues arising during the course of a Board of Trustees' meeting which cannot be resolved are referred to the Executive Committee of the Board of Trustees; and (6) the transaction or action must be approved by a majority of disinterested persons. Contemporaneous written minutes of all Board of Trustee meeting are maintained by the Office of the President."
201741359349303454,060646973,"SCHEDULE L, PART II","ALL LOANS REPORTED ON SCHEDULE L, PART II WERE MADE AND APPROVED PURSUANT TO UNIVERSITY COMPENSATION POLICIES."
201741359349303454,060646973,"SCHEDULE L, PART III","THE SCHOLARSHIP GRANTS REPRESENT AMOUNTS AWARDED TO INTERESTED PERSONS UNDER THE UNIVERSITY'S NONDISCRIMINATORY QUALIFIED TUITION REDUCTION PLAN COVERING ALL ELIGIBLE FACULTY AND STAFF WITH SIX OR MORE YEARS OF SERVICE.IN ADDITION, A PRIZE/AWARD WAS AWARDED TO AN INTERESTED PERSON."
201701019349301250,951643992,"FORM 990, SCHEDULE L, PART IV",OFFICERS OF THE UNIVERSITY THAT MAY HAVE A CONFLICT OF INTEREST REGARDING THE COMPENSATION PACKAGES FOR FAMILY MEMBERS DO NOT PARTICIPATE IN THE DETERMINATION OF THE COMPENSATION PAID TO THOSE FAMILY MEMBERS.
201731249349301603,221494434,"SCHEDULE L, PART III, LINE 1B","THE UNIVERSITY OFFERS EMPLOYEE TUITION GRANTS PURSUANT TO I.R.C. SEC. 117(d) TO ALL FULL-TIME EMPLOYEES, PART-TIME EMPLOYEES AND FACULTY. SOME LISTED PERSONS HAVE DEPENDENTS THAT RECEIVE TUITION GRANTS UNDER THIS PLAN. THE AMOUNT IN PART III, COLUMN (d) REPRESENTS THE PORTION ATTRIBUTABLE TO THE SIX MONTHS FOLLOWING CALENDAR 2015 WHICH IS NOT REPORTED AS COMPENSATION IN PART VII, SECTION A (TAXABLE AND NONTAXABLE FRINGE BENEFITS TREATED AS COMPENSATION)."
201701219349300410,941156266,"Schedule L, Part IV BUSINESS TRANSACTIONS INVOLVING INTERESTED PERSONS","EDWARD LELAND , DIRECTOR OF ATHLETICS, AN OFFICER, IS RELATED TO AMANDA LELAND, HIS DAUGHTER, WHO IS ALSO AN EMPLOYEE AT THE UNIVERSITY. THE AMOUNT SHOWN REPRESENTS IRS FORM W-2 BOX 5 WAGES FOR CALENDAR YEAR 2015 FOR AMANDA LELAND. CYNTHIA WEICK, DIRECTOR OF POWELL SCHOLARS PROGRAM, A FORMER KEY EMPLOYEE, IS RELATED TO BRIAN WEICK, HER HUSBAND, WHO IS ALSO AN EMPLOYEE AT THE UNIVERSITY. THE AMOUNT SHOWN REPRESENTS IRS FORM W-2 BOX 5 WAGES FOR CALENDAR YEAR 2015 FOR BRIAN WEICK. RONALD BERBERIAN AND BARRY RUHL, BOARD MEMBERS, OWN BRUBECK COMMONS LLC, WHO WAS PAID FOR OFF CAMPUS HOUSING PROVIDED TO THE UNIVERSITY'S STUDENTS. THE AMOUNT SHOWN REPRESENTS ALL PAYMENTS MADE IN FISCAL YEAR 2016. NADER NADERSHAHI, DEAN DUGONI SCHOOL OF DENTISTRY, KEY EMPLOYEE, IS RELATED TO FATEHM N. NADERSHAHI, HIS WIFE, WHO IS ALSO AN EMPLOYEE AT THE UNIVERSITY. THE AMOUNT SHOWN REPRESENTS IRS FORM W-2 BOX 5 WAGES FOR CALENDAR YEAR 2015 FOR FATEHM N. NADERSHAHI. DANIEL EBBERS, INTERIM DEAN OF THE CONSERVATORY OF MUSIC, A KEY EMPLOYEE IS RELATED TO JESSISCA EBBERS, HIS WIFE, WHO IS ALSO AN EMPLOYEE AT THE UNIVERSITY. THE AMOUNT SHOWN REPRESENTS IRS FORM W-2 BOX 5 WAGES FOR CALENDAR YEAR 2015 FOR JESSICA EBBERS. JOSE HERNANDEZ, A BOARD MEMBER, IS RELATED TO LETICIA CORONA, HIS SISTER, WHO IS AN EMPLOYEE AT THE UNIVERSITY. THE AMOUNT SHOWN REPRESENTS IRS FORM W-2 BOX 5 WAGES FOR CALENDAR YEAR 2015 FOR LETICIA CORONA. FRANCIS MOOTZ, DEAN MCGEORGE SCHOOL OF LAW, KEY EMPLOYEE, IS RELATED TO LETICIA SAUCEDO, HIS WIFE, WHO IS ALSO AN EMPLOYEE AT THE UNIVERSITY. THE AMOUNT SHOWN REPRESENTS IRS FORM W-2 BOX 5 WAGES FOR CALENDAR YEAR 2015 FOR LETICIA SAUCEDO. NADER NADERSHAHI, DEAN DUGONI SCHOOL OF DENTISTRY, KEY EMPLOYEE, IS RELATED TO NAVID KNIGHT, HIS BROTHER, WHO IS ALSO AN EMPLOYEE AT THE UNIVERSITY. THE AMOUNT SHOWN REPRESENTS IRS FORM W-2 BOX 5 WAGES FOR CALENDAR YEAR 2015 FOR NAVID KNIGHT."
201701219349300410,941156266,"Schedule L, Part II LOANS TO AND/OR FROM INTERESTED PERSONS","THE HOME LOAN PROVIDED TO THE PROVOST IS FOR A TERM OF 30 YEARS WITH A THEN MARKET INTEREST RATE OF 4%. THE LOAN BALANCE OF $40,000 WAS FORGIVEN AND LOAN PAID IN FULL DURING THE UNIVERSITY'S TAX YEAR."
201701219349300410,941156266,"Schedule L, Part III GRANTS OR ASSISTANCE BENEFTING INTERESTED PERSONS","PER THE 990 INSTRUCTIONS, THE UNIVERSITY IS NOT REQUIRED TO IDENTIFY THE INTERESTED PERSONS WHO RECEIVED SCHOLARSHIPS, FELLOWSHIPS, AND SIMILAR FINANCIAL ASSISTANCE. INSTEAD, THE UNIVERSITY MUST GROUP EACH TYPE OF ASSISTANCE PROVIDED TO INTERESTED PERSONS. THIS IS DONE IN ORDER TO PROTECT THE IDENTITY OF THE STUDENTS."
201740879349300319,362170136,"Schedule L, Part IV BUSINESS TRANSACTIONS WITH INTERESTED PERSONS","BUSINESS TRANSACTIONS WITH INTERESTED PERSONS SCHEDULE L, PART IV THE TRANSACTIONS LISTED IN SCHEDULE L, PART IV, BUSINESS TRANSACTIONS INVOLVING INTERESTED PERSONS, WERE CONSISTENT WITH THE CONFLICT OF INTEREST POLICY DESCRIBED IN SCHEDULE O. ILLINOIS INSTITUTE OF TECHNOLOGY REQUIRES COMPLIANCE WITH THE CONFLICT OF INTEREST POLICY FOR ALL BUSINESS TRANSACTIONS WITH INTERESTED PERSONS. IN FY 2016, IN ADDITION TO BEING A TRUSTEE ON THE UNIVERSITY'S BOARD OF TRUSTEES, MR. OLIN WAS THE CHAIRMAN OF SIERRA INSTRUMENTS, INC., WHICH WAS AWARDED A CONTRACT IN MAY 2014 FOR THE PURCHASE OF CERTAIN AUTOMOTIVE TESTING EQUIPMENT. SIERRA INSTRUMENTS, INC. SOLD SUCH EQUIPMENT TO THE UNIVERSITY DURING FY 2016 THAT WAS USED BY THE FACULTY FOR RESEARCH PURPOSES. IN FY 2016, BRYAN R. DUNN, TRUSTEE OF THE UNIVERSITY, WAS MARRIED TO M. ELLEN MITCHELL, WHO WAS A PROFESSOR IN THE DEPARTMENT OF PSYCHOLOGY OF THE LEWIS COLLEGE. IN FY 2016, IN ADDITION TO BEING A TRUSTEE ON THE UNIVERSITY'S BOARD OF TRUSTEES, MR. GODREJ HAD AN OWNERSHIP INTEREST IN GODREJ & BOYCE MANUFACTURING CO. LTD., WHICH AWARDED A MULTI-YEAR CONTRACT TO THE UNIVERSITY TO CONDUCT VARIOUS TRAINING PROGRAMS AND WORKSHOPS FOR ITS EMPLOYEES."
201721039349301027,231352688,Part IV,"MICHAEL CAMPBELL, ESQ., DANIELLE MORRO, COLLEEN SHEEHAN, PH.D., AND MAURA TOPPER ARE EMPLOYEES OF THE UNIVERSITY AND RECEIVE COMPENSATION."
201721329349306027,221487164,"Form 990, Schedule L, Part IV",Interested Persons Suzanne MERTZ Spero is a university trustee and her brother-in-law is a university employee.
201731359349312403,610444671,"Schedule L, Part III GRANTS OR ASSISTANCE BENEFITING INTERESTED PERSONS","COLLEGES, UNIVERSITIES AND PRIMARY AND SECONDARY SCHOOLS ARE NOT REQUIRED TO IDENTIFY INTERESTED PERSONS TO WHOM THEY HAVE PROVIDED SCHOLARSHIPS, FELLOWSHIPS AND SIMILAR FINANCIAL ASSISTANCE PURSUANT TO THE INSTRUCTIONS TO FORM 990, SCH L, PART III, COLUMNS (A) AND (B) HAVE BEEN LEFT BLANK."
201731359349302893,810235407,"Schedule L, Part V Supplemental Information","Barb Skelton (Trustee) and her husband own Intermountain Equestrian Center. We pay Intermountain Equestrian Center for the boarding of student horses for our equestrian program.Family members of Kelly Edwards (Officer) own Edwards Jet Center. Rocky Mountain College leases land and purchases fuel, services, and airplane parts from Edwards Jet Center.Mary Underriner is married to the owner of Underriner Motors. Rocky Mountain Colleges leases several vehicles from Underriner."
201721359349313602,310537516,"SCHEDULE L, PART III:",GRANTS OR ASSISTANCE BENEFITTING INTERESTED PERSONS:(D) TYPE OF ASSISTANCE: MERIT BASED SCHOLARSHIP(E) PURPOSE OF ASSISTANCE: MERIT BASED SCHOLARSHIP
201721359349313602,310537516,"SCHEDULE L, PART III:",GRANTS OR ASSISTANCE BENEFITTING INTERESTED PERSONS:(D) TYPE OF ASSISTANCE: MERIT BASED SCHOLARSHIP(E) PURPOSE OF ASSISTANCE: MERIT BASED SCHOLARSHIP - LEADERSHIP AWARD
201711359349302641,042104229,"SCHEDULE L, PART IV",BUSINESS TRANSACTIONS INVOLVING INTERESTED PERSONS: SUBSTANTIAL CONTRIBUTOR IS A COMPANY OWNED BY A TRUSTEE AND HIS FAMILY. STONEHILL COLLEGE PURCHASED PRODUCTS FROM THE COMPANY.
201731359349303048,041286950,"Schedule L, Part III, Line 1",Grants benefitting interested persons The college granted a merit scholarship to one student who is the child of a current member of the board of trustees. The college ensured the SCHOLARSHIP was awarded based on merit to the eligible student who met the required academic standing. The trustee does not have any influence in the decision making process for awarding scholarships.
201721359349308927,042103544,"SCHEDULE L, PART IV, BUSINESS TRANSACTION INVOLVING INTERESTED PERSONS","(A) NAME OF PERSON: JANICE BELL (B) RELATIONSHIP BETWEEN INTERESTED PERSON AND ORGANIZATION: SPOUSE OF THE FORMER PROVOST (C) AMOUNT OF TRANSACTION $458,663 (D) DESCRIPTION OF TRANSACTION: FACULTY WAGES PAID (E) SHARING OF ORGANIZATION REVENUES? - NO (A) NAME OF PERSON: DANIEL LAMERE (B) RELATIONSHIP BETWEEN INTERESTED PERSON AND ORGANIZATION: SON OF TRUSTEE (C) AMOUNT OF TRANSACTION $15,243 (D) DESCRIPTION OF TRANSACTION: COMPENSATION (E) SHARING OF ORGANIZATION REVENUES? - NO (A) NAME OF PERSON: GILBANE CONSTRUCTION (B) RELATIONSHIP BETWEEN INTERESTED PERSON AND ORGANIZATION: TRUSTEE IS OWNER (C)AMOUNT OF TRANSACTION: $4,105,487 (D)DESCRIPTION OF TRANSACTION: CONSTRUCTION SERVICES - TRANSACTION BETWEEN BABSON COLLEGE AND GILBANE CONSTRUCTION WAS REVIEWED USING NORMAL PROCUREMENT PROCEDURES. TRANSACTION WAS ARMS-LENGTH AND AT FAIR MARKET VALUE (E) SHARING OF ORGANIZATION REVENUES? - NO"
201721029349300107,590624458,"Schedule L, Part IV - Lines 2, 5-9, 12, 14, Col B",Family member of trustee.
201721029349300107,590624458,"Schedule L, Part IV - Lines 1, 3-4, 10, 11, 13-14, Col B",Family member of officer.
201721029349300107,590624458,"Schedule L, Part IV - Lines 1-14, Col D",Family member employment.
201731329349301538,390826049,Grants or Assistance Benefiting Interested Persons,"Schedule L, Part III, Line 1 Trustee Penelope Green's son received a $2,250 scholarship as determined by the financial aid office of Ripon College."
201731329349307453,350869045,"Schedule L, Part II GRANTS OR ASSISTANCE BENEFITING INTERESTED PERSONS","PER THE IRS INSTRUCTIONS FOR SCHEDULE L, COLLEGES, UNIVERSITIES, AND PRIMARY AND SECONDARY SCHOOLS ARE NOT REQUIRED TO IDENTIFY INTERESTED PERSONS TO WHOM THEY PROVIDED SCHOLARSHIPS, FELLOWSHIPS, AND SIMILAR FINANCIAL ASSISTANCE. INSTEAD, THESE ORGANIZATIONS MUST GROUP EACH TYPE OF FINANCIAL ASSISTANCE PROVIDED TO INTERESTED PERSONS IN SEPARATE LINES. FOR EACH LINE, THE SCHOOL IS TO REPORT IN COLUMN (C) THE TYPE OF ASSISTANCE AND AGGREGATE DOLLAR AMOUNT OF THAT ASSISTANCE; COLUMNS (A) AND (B) ARE TO BE LEFT BLANK."
201731359349308693,660277132,"SCHEDULE L, PART V","TO COMPLETE PART IV: BUSINESS TRANSACTIONS INVOLVING INTERESTED PERSONS (A) NAME OF INTERESTED PERSON: NIEVES ESTATE PROPERTIES, INC. (B) RELATIONSHIP BETWEEN INTERESTED PERSON AND THE ORGANIZATION: ENTITY MORE THAN 35% OWNED BY GLADYS T. VAZQUEZ-FORMER CHAIR OF THE BOARD OF TRUSTEES (C) AMOUNT OF TRANSACTION: 651,840 (D) DESCRIPTION OF TRANSACTION: RENTAL OF REAL PROPERTY (E) SHARING OF ORGANIZATION'S REVENUES? NO TO COMPLETE PART IV: BUSINESS TRANSACTIONS INVOLVING INTERESTED PERSONS (A) NAME OF INTERESTED PERSON: SNOW VALLEY INVESTMENTS, INC. (B) RELATIONSHIP BETWEEN INTERESTED PERSON AND THE ORGANIZATION: ENTITY MORE THAN 35% OWNED BY GLADYS T. NIEVES-OFFICER (C) AMOUNT OF TRANSACTION: 141,600 (D) DESCRIPTION OF TRANSACTION: RENTAL OF REAL PROPERTY (E) SHARING OF ORGANIZATION'S REVENUES? NO TO COMPLETE PART IV: BUSINESS TRANSACTIONS INVOLVING INTERESTED PERSONS (A) NAME OF INTERESTED PERSON: SANND CORPORATION (B) RELATIONSHIP BETWEEN INTERESTED PERSON AND THE ORGANIZATION: ENTITY MORE THAN 35% OWNED BY GLADYS T. VAZQUEZ-FORMER CHAIR OF THE BOARD OF TRUSTEES (C) AMOUNT OF TRANSACTION: 45,600 (D) DESCRIPTION OF TRANSACTION: RENTAL OF REAL PROPERTY (E) SHARING OF ORGANIZATION'S REVENUES? NO"
201731359349304658,990113930,"SCHEDULE L, PART IV, COLUMN (D)","BUSINESS TRANSACTIONS WITH RELATED PERSONS (1) UIO IN SARA LIAO-TROTH IS A FAMILY MEMBER OF OFFICER MATTHEW LIAO TROTH, PROVOST & VP ACADEMIC AFFAIRS AND RECEIVES COMPENSATION AS AN EMPLOYEE OF HAWAI'I PACIFIC UNIVERSITY. (2) SUBSTANTIAL CONTRIBUTOR #29 IS A GENERAL CONTRACTOR PROVIDING CONSTRUCTION MANAGEMENT AND SERVICES TO HAWAI'I PACIFIC UNIVERSITY ALOHA TOWER MARKETPLACE."
201701359349312770,260664313,"SCHEDULE L, PART V",THE SUPERINDENT OF PHOENIX ELEMENTARY SCHOOL DISTRICT (PESD) IS ALSO A BOARD MEMBER OF ASU PREP. ASU PREP HAS ENTERED INTO A COLLABORATION AGREEMENT WITH PESD IN WHICH IT PAYS AN ANNUAL ADMINISTRATIVE FEE TO PESD FOR ITS USE OF A SCHOOL FACILITY.
201711359349300901,240795686,"SCH L, PART IV, BUSINESS TRANSACTIONS INVOLVING INTERESTED PERSONS:",DONNA KRIVOSKI IS EMPLOYED BY THE COLLEGE AS THE DIRECTOR OF PARENT RELATIONS.
201731359349311778,420707120,"SCHEDULE L, PART V","ADDITIONAL INFORMATION FOR: SCHEDULE L, PART IV, LINE (1), COLUMN (B): MAHASKA COMMUNICATION GROUP (MCG) IS A WHOLLY OWNED SUBSIDIARY OF MUSCO CORPORATION. JOE CROOKHAM, BOARD OFFICER, AND HIS IMMEDIATE FAMILY ARE THE MAJORITY SHAREHOLDERS OF MUSCO CORPORATION. JOE CROOKHAM IS ALSO PRESIDENT AND CEO OF BOTH ENTITIES."
201741319349303819,010211781,"Schedule L, Part IV","Line (1)(d) - Trustee John Gillespie served as the managing member of an investment company that managed an investment vehicle that was liquidated during the tax year for $120,995."
201731329349305733,160743209,"FORM 990, SCHEDULE L, PART IV","ADD'L SUPP INFORMATION WEGMANS- TRUSTEE DANIEL R. WEGMAN IS AN OFFICER, DIRECTOR AND OWNER OF WEGMANS. VALLEY PROPANE AND FUELS- TRUSTEE PHILIP SAUNDERS IS A GREATER THAN 35% OWNER OF VALLEY PROPANE AND FUELS."
201701329349304465,610444695,"SCHEDULE L, PART III","$30,852 OF TUITION WAIVER ASSISTANCE WAS PROVIDED TO THE SON OF AN OFFICER ON THE SAME TERMS AVAILABLE TO ALL QUALIFYING EMPLOYEES. A TUITION WAIVER EXCHANGE WAS PROVIDED TO THE DAUGTHER OR AN OFFICER ON THE SAME TERMS AVAILABLE TO ALL QUALIFYING EMPLOYEES. HOWEVER, THE DAUGHTER ATTENDED CAMPBELLSVILLE UNIVERSITY AND DIRECT ASSISTANCE WAS NOT PROVIDED BY GEORGETOWN COLLEGE."
201701329349306275,880435559,"SCH L, PART IV, SUPPLEMENTAL INFORMATION:","THE UNIVERSITY ENTERED INTO THE LEASE AGREEMENT WITH STONEROSE RESEARCH LAB, LLC IN 2012 PRIOR TO THE OWNER, DAVID STEINBERG, JOINING THE UNIVERSITY BOARD OF TRUSTEES IN 2014. THE UNIVERSITY ENTERED INTO THE LEASE AGREEMENT WITH SUNSET VISTA PROFESSIONAL PARK II, LLC IN 2010 PRIOR TO THE OWNER, DAVID STEINBERG, JOINING THE UNIVERSITY BOARD OF TRUSTEES IN 2014."
201701329349306425,314379560,"Schedule L, Part III GRANTS OR ASSISTANCE BENEFITING INTERESTED PERSONS","COLLEGES AND UNIVERSITIES ARE NOT REQUIRED TO IDENTIFY INTERESTED PERSONS TO WHOM THEY PROVIDED SCHOLARSHIPS, GRANTS, FELLOWSHIPS AND SIMILAR FINANCIAL ASSISTANCE. PER INSTRUCTIONS, PART III, COLUMNS (A) AND (B) DO NOT IDENTIFY THE NAME OF THE INTERESTED PERSON. THE GRANTS WERE PROVIDED TO DEPENDENTS OF UNIVERSITY EMPLOYEES WHO ARE ALSO LISTED AS INTERESTED PERSONS ON SCHEDULE VII."
201701329349303175,042103578,"Schedule L, Part IV","The College has invested in Adage Capital Partners LP since October 2001. This investment was vetted by Cambridge Associates LLC, an independent advisory firm that performs due diligence and makes recommendations for investments. The husband of Trustee Elizabeth Cochary Gross is a partner at Adage Capital Management."
