object_id,ein,FrmAndLnRfrncDsc,ExplntnTxt
201632419349300203,471994752,PART IV (1),TIM HUGGINS IS A DIRECTOR OF THE ORGANIZATION AND PART OWNER OF THE
201632419349300203,471994752,PART IV (1),"INTERESTED PERSON, MISSIONARY AVIATION LLC. MISSIONARY AVIATION LLC"
201632419349300203,471994752,PART IV (1),OWNS AIRCRAFT AND LEASES THEM TO THE COLLEGE FOR A VERY INEXPENSIVE RATE
201632419349300203,471994752,PART IV (1),RATE OF $40.00 PER HOUR.
201632419349300203,471994752,PART IV (2),FRANK SMITH IS A DIRECTOR OF THE ORGANIZATION AND PART OWNER OF THE
201632419349300203,471994752,PART IV (2),"INTERESTED PERSON, FDS MANAGING LLC. FDS MANAGING LLC OWNS A HOUSE"
201632419349300203,471994752,PART IV (2),AND RENTS IT TO THE ORGANIZATION FOR STUDENT HOUSING FOR $600.00 PER MONTH
201602459349300930,350715530,VESTIL MANUFACTURING CORP,BOARD MEMBERS RALPH TRINE AND SHERI TRINE HAVE A >35% OWNERSHIP IN VESTIL MANUFACTURING CORP.
201622889349301537,420680323,"SCH L, PART IV, BUSINESS TRANSACTIONS INVOLVING INTERESTED PERSONS","(A) NAME OF PERSON: COTTINGHAM & BUTLER/SISCO BENEFITS(B) RELATIONSHIP BETWEEN INTERESTED PERSON AND ORGANIZATION: JOHN E. BUTLER, TRUSTEE IS >35% OWNER, CHAIRMAN, AND CEO OF COTTINGHAM & BUTLER AND SISCO BENEFITS (SUBSIDIARY).(D) DESCRIPTION OF TRANSACTION: THE ORGANIZATION PURCHASES INSURANCE PRODUCTS AND HEALTH INSURANCE CLAIM ADMINISTRATION SERVICES FROM COTTINGHAM & BUTLER/SISCO BENEFITS.(A) NAME OF PERSON: ROY BUOL(B) RELATIONSHIP BETWEEN INTERESTED PERSON AND ORGANIZATION: FAMILY MEMBER OF DEBORAH BUOL, ASSISTANT SECRETARY.(D) DESCRIPTION OF TRANSACTION: ROY BUOL IS A PAID EMPLOYEE OF THE UNIVERSITY OF DUBUQUE.(A) NAME OF PERSON: SHANE BESLER(B) RELATIONSHIP BETWEEN INTERESTED PERSON AND ORGANIZATION: FAMILY MEMBER OF DEBORAH BUOL, ASSISTANT SECRETARY.(D) DESCRIPTION OF TRANSACTION: SHANE BESLER IS A PAID EMPLOYEE OF THE UNIVERSITY OF DUBUQUE."
201603129349302435,136171197,"Schedule L, Part IV, Column D","BUSINESS TRANSACTIONS INVOLVING INTERESTED PARTIES: NAME OF INTERESTED PERSON: GARY B. DAVIS OFFICER KENNETH DAVIS HAS A FAMILY RELATIONSHIP WITH GARY B. DAVIS WHO IS EMPLOYED BY ICAHN SCHOOL OF MEDICINE AT MOUNT SINAI. NAME OF INTERESTED PERSON: ELISSA G. FRIEDMAN TRUSTEE ROBERT FRIEDMAN HAS A FAMILY RELATIONSHIP WITH ELISSA G. FRIEDMAN WHO IS EMPLOYED BY ICAHN SCHOOL OF MEDICINE AT MOUNT SINAI. NAME OF INTERESTED PERSON: MARGARET RUTTENBERG TRUSTEE ERIC RUTTENBERG HAS A FAMILY RELATIONSHIP WITH MARGARET RUTTENBERG WHO IS EMPLOYED BY ICAHN SCHOOL OF MEDICINE AT MOUNT SINAI. NAME OF INTERESTED PERSON: JULIA HART TRUSTEE STEPHEN SCHWARTZ HAS A FAMILY RELATIONSHIP WITH JULIA HART WHO IS EMPLOYED BY ICAHN SCHOOL OF MEDICINE AT MOUNT SINAI. NAME OF INTERESTED PERSON: IRWIN GRIBETZ TRUSTEE JUDAH GRIBETZ, HAS A FAMILY RELATIONSHIP WITH IRWIN BRIBETZ WHO IS EMPLOYED BY ICAHN SCHOOL OF MEDICINE AT MOUNT SINAI. NAME OF INTERESTED PERSON: ALEX CHARNEY OFFICER DENNIS CHARNEY HAS A FAMILY RELATIONSHIP WITH ALEX CHARNEY WHO IS EMPLOYEED BY ICAHN SCHOOL OF MEDICINE AT MOUNT SINAI."
201603209349300635,470424785,"Schedule L, Part IV, Line 1",Lloyd Meyer was the Treasurer on the College of Saint Mary Board of Directors. His term ended in November 2012.
201603099349300500,362167792,"Schedule L, Part V Supplemental Information","Loans to OfficersTo assist the president in obtaining a home adjacent to the Institute, the trustees approved a loan from the Institute in the amount of $500,000. This note has a rate of 4.0% per annum and is held as part of the Institute notes in the Operating fund. The president is currently paying interest only."
201632889349301163,161476258,"Schedule L, Part IV","1. James DuRoss is employed by a company (Temco service industries, Inc.) that provides janitorial, landscape and building maintenance services to the college. 2. Bernadette Clark is the wife of Harold T. Clark, Managing Agent for Adron LLC. The College has a rental Agreement with Adron to lease space. 3. Todd's wife, Nancy Hutton, receives compensation from the college in the form of a contribution to the 403B retirement plan. 4. Jeremy Thurston is a trustee & Majority owner of the Haynor Hoyt Company - Construction Contract. 5. Marianne Gaige is the President and CEO of a company that provided Printing & Mailing services for the College. 6. Laura Casamento is the Executive Vice President and Chief Advancement Officer of Utica College and her son, Brian Marcantonio is the head soccer coach of Utica College."
201633149349300528,350885591,PART IV,"Paul Anthes serves as President of Financial Advisory Corporation (FAC) and serves as Secretary of Board of Trustees at IWU. FAC provides investment advisory services for University endowment funds. FAC does not serve as custodian or manager of invested funds and only provides advisory services which custodian(s) and/or fund manager(s) use. The University receives monthly investment statements directly from the custodian of the funds independent of FAC. Additionally, the University has adopted an investment management policy and regularly reviews investment performance and asset allocation within the parameters of this policy. Finally, as an additional measure of independence, FAC receives a set fee for their services and not a percentage of the earnings on the invested funds. Mr. Anthes does not serve on the investment committee of the board. Gary Ott is the President of Tender Love and Care Management, which manages the Wesleyan Retirement Center. CARL SHEPHERD AND DALE SLOAN, BOTH TRUSTEES OF INDIANA WESLEYAN UNIVERSITY, HAVE FAMILY MEMBERS WHO ARE EMPLOYED BY THE UNIVERSITY."
201623209349306522,260069167,"SCHEDULE L, PART V",THE PRESIDENT OF THE COLLEGE IS A DIRECTOR OF NEW PEOPLES BANK AND THE COLLEGE DOES BUSINESS WITH NEW PEOPLES BANK.
201633209349316463,650216638,"SCHEDULE L, PART V","1.A)OLYMPUS LAKELAND LTD (B) CHANCELLOR/VICE PRESIDENT HAS AN OWNERSHIP INTEREST (C) 1,237,219 (D) RENT ON LAKELAND CAMPUS BUILDING (E) NO 2.A) 16120, LTD B) CHANCELLOR/VICE PRESIDENT HAS AN OVERSHIP INTEREST (C) 398,533 (D) RENT ON CLEARWATER (E) NO 3.A)DEMETER PEMBROKE PINES LTD (B) CHANCELLOR/VICE PRESIDENT HAS AN OWNERSHIP INTEREST (C) 1,652,412 (D) RENT ON PEMBROKE PINES CAMPUS (E) NO 4.A)UNIVERSITY COMMONS OFFICE CTR (B) CHANCELLOR/VICE PRESIDENT HAS AN OWNERSHIP INTEREST (C) 869,642 (D) RENT ON SARASOTA CAMPUS BUILDING (E) NO 5.A)LWR COMMONS LTD (B) CHANCELLOR/VICE PRESIDENT HAS AN OWNERSHIP INTEREST (C) 1,433,381 (D) RENT ON SARASOTA CAMPUS BUILDING (E) NO 6(A) ATHENA VISTA LTD (B) CHANCELLOR/VICE PRESIDENT HAS AN OWNERSHIP INTEREST (C) 1,153,646 (D) RENT ON WEST PALM BEACH CAMPUS BUILDING (E) NO 7.A) BEST ROOFING B) OWNED BY TRUSTEE GREGG WALLICK (C) 12,768 (D) REPAIRS AND MAINTENANCE (E) NO 8.A)NINETEEN HUNDRED BLDG ASSOC LTD (B) CHANCELLOR/VICE PRESIDENT HAS AN OWNERSHIP INTEREST (C) 2,023,013 (D) RENT ON OFFICE OF THE CHANCELLOR AND ON-LINE DIVISION (E) NO 9.A)SPECTRUM 1500 BUILDING (B) CHANCELLOR/VICE PRESIDENT HAS AN OWNERSHIP INTEREST (C) 2,622,730 (D) RENT ON FT LAUDERDALE MAIN CAMPUS (E) NO 10.(A)DAYTONA EDUCATION ASSOC LTD (B) CHANCELLOR/VICE PRESIDENT HAS AN OWNERSHIP INTEREST (C) 473,141 (D) RENT ON DAYTONA BEACH CAMPUS (E) NO 11.(A)VENUS INVESTMENT PROPERTIES LTD (B) CHANCELLOR/VICE PRESIDENT HAS AN OWNERSHIP INTEREST (C) 1,554,116 (D) RENT ON TAMPA CAMPUS (E) NO 12. (A) KEISER SCHOOL, INC. (B) CHANCELLOR/VICE PRESIDENT HAS AN OWNERSHIP INTEREST (C) 10,500,760 (D) INTEREST ON NOTES PAYABLE-INHERENT CONTRIBUTION (E) NO 13.(A) HERCULES PROPERTIES LTD (B) CHANCELLOR/VICE PRESIDENT HAS AN OWNERSHIP INTEREST (C) 1,669,985 (D) RENT ON ORLANDO CAMPUS (2 BUILDINGS) (E) NO 14(A) PARKLAND EDUCATION (B) CHANCELLOR/VICE PRESIDENT HAS AN OWNERSHIP INTEREST (C) 1,328,485 (D) RENT ON MELBOURNE CAMPUS (E) NO 15 (A) KEISER COMMONS LTD (B) CHANCELLOR/VICE PRESIDENT HAS AN OWNERSHIP INTEREST (C) 770,618 (D) RENT ON TALLAHASSEE BUILDING 1 (E) NO 16 (A) RUDNICK DEVELOPMENT (B) CHANCELLOR/VICE PRESIDENT HAS AN OWNERSHIP INTEREST (C) 238,266 (D) RENT ON TALLAHASSEE BUILDING 2 (E) NO 17 (A) EVERGLADES MANAGEMENT INC (B) CHANCELLOR/VICE PRESIDENT HAS AN OWNERSHIP INTEREST (C) 1,256,641 (D) CHARTER AIRCRAFT AND OTHER TRAVEL (E) NO 18 (A) CAPITAL HOLDINGS 129 LLC (B) CHANCELLOR/VICE PRESIDENT HAS AN OWNERSHIP INTEREST (C) 145,368 (D) CHARTER AIRCRAFT (E) NO 19 (A) HERMES AIRCRAFT LLC (B) CHANCELLOR/VICE PRESIDENT HAS AN OWNERSHIP INTEREST (C) 270,000 (D) CHARTER AIRCRAFT (E) NO 20 (A)HOLIDAY INN EXPRESS FORT LAUDERDALE (B) CHANCELLOR/VICE PRESIDENT HAS AN OWNERSHIP INTEREST (C) 267,951 (D) LODGING (E) NO 21 (A)KEISER COMPUTERS INC (B) OWNED BY FAMILY MEMBER RELATED TO CHANCELLOR (C) 73,427 (D) COMPUTERS (E) NO 22 (A)FOSTER LEARNING CORPORATION (B) OWNED BY BOARD MEMBER TOM FOSTER (C) 3,252 (D) MANAGEMENT CONSULTING/MANAGEMENT EDUCATION (E) NO 23 (A) HORNER XPRESS SOUTH FLORIDA (B) OWNED BY BOARD MEMBER WILLIAM KENT (C) 30,409 (D) NET SHARE OF INCOME FROM THE AQUATIC ENGINEERING PROGRAM (E) YES 24 (A) CUTTING EDGE RECRUITING SOLUTIONS/ARA (B) OWNED BY FAMILY MEMBER RELATED TO ANDREW WRIGHT (C) 19,830 (D) TEMPORARY STAFFING COMPANY (E) NO 25 (A)DELPHI FORT MYERS LTD (B) CHANCELLOR/VICE PRESIDENT HAS AN OWNERSHIP INTEREST (C) 709,914 (D) RENT ON FORT MYERS CAMPUS (E) NO 26 (A) BAR EDUCATION, INC. (B)CHANCELLOR/VICE PRESIDENT HAS AN OWNERSHIP INTEREST (C) 337,311 (D) INTEREST ON LOAN (E) NO 27 (A) BAR EDUCATION, INC. (B) CHANCELLOR/VICE PRESIDENT HAS AN OWNERSHIP INTEREST (C) 193,763 (D) LEASEHOLD IMPROVEMENTS ACQUIRED FROM TAMPA CAMPUS (E) NO 28 (A) BAR EDUCATION, INC. (B) CHANCELLOR/VICE PRESIDENT HAS AN OWNERSHIP INTEREST (C) 867,425 (D) ALLOCATION OF OPERATING EXPENSES (E) NO 29 (A) BAR EDUCATION, INC. (B) CHANCELLOR/VICE PRESIDENT HAS AN OWNERSHIP INTEREST (C) 823,228 (D) EXPENSES PAID ON BEHALF OF SCHOOL (E) NO 30 (A) BAR EDUCATION, INC. (B) CHANCELLOR/VICE PRESIDENT HAS AN OWNERSHIP INTEREST (C) 59,615 (D) BOOKSTORE INVENTORY PURCHASED (E) NO 31 (A) BAR EDUCATION, INC. (B) CHANCELLOR/VICE PRESIDENT HAS AN OWNERSHIP INTEREST (C) 1,916,500 (D) ACQUISITION OF SCHOOL PROGRAMS (E) NO 32 (A) BAR EDUCATION, INC. (B) CHANCELLOR/VICE PRESIDENT HAS AN OWNERSHIP INTEREST (C) 150,000 (D) ADMINISTRATIVE SUPPORT (E) NO 33 (A) PARKLAND EDUCATION, LLC (B) CANCELLOR/VICE PRESIDENT HAS AN OWNERSHIP INTEREST (C) 210,000 (D) DEPOSIT FOR PURCHASE OF REAL ESTATE (E) NO"
201643199349310564,560767736,"SCHEDULE L, PART V","O'CONNOR: WITH THE APPROVAL OF THE COLLEGE BOARD OF TRUSTEES, THE PRESIDENT'S WIFE RECEIVES 25,000 IN TAXABLE INCOME ANNUALLY FROM THE COLLEGE FOR THE PERFORMANCE OF CERTAIN OFFICIAL DUTIES AS THE SPOUSE OF THE PRESIDENT. READ: WITH COMPENSATION OF 30,744 SET BY THE PRESIDENT, MS. READ, THE SPOUSE OF THE VP OF ACADEMIC AFFAIRS AND DEAN OF THE COLLEGE, IS EMPLOYEED AS THE PHYSICAL EDUCATION DEPARTMENT PROGRAM COORDINATOR. OWENS: WITH COMPENSATION OF 35,700, THE SPOUSE OF THE VP OF ADMIN/FINANCE IS EMPLOYEED AS THE ATHLETIC CREW SUPERVISOR AND RECRUITING SPECIALIST."
201643199349306039,472237488,"Schedule L, Part IV, Column (d) Description of Transaction","ECMC Group, Inc., a related organization, has a consulting contract with a company owned by a former director and president. For transparency of operation, the contract is reported in this Form 990 filing as ECMC Group, Inc. is the parent and supporting entity of Educational Credit Management Corporation and Zenith Education Group, Inc. and the parent organization of ECMC Foundation. The contract is for advisory services to ECMC Group, Inc. and began after the officer retired from the organization on February 1, 2014. The proposed terms of the contract were reviewed by the Governance & Compensation Committee of the ECMC Group, Inc. Board of Directors which is wholly comprised of independent, outside directors. The Committee reviewed the business terms, tasks, duration of the proposed agreement and comparability data. They also heard from compensation consultants and outside counsel. The Committee made a recommendation that was then approved by the full ECMC Group, Inc. Board of Directors."
201623339349300732,610492351,"SCHEDULE L, PART V","PART IV, BUSINESS TRANSACTIONS INVOLVING INTERESTED PERSONS: (A) NAME OF PERSON: ROBERT FINLEY - OPPENHEIMER & COMPANY (D) DESCRIPTION OF TRANSACTION: ROBERT FINLEY IS A PAID BROKER/INVESTMENT ADVISOR FOR THE COLLEGE THROUGH OPPENHEIMER & COMPANY. ROBERT FINLEY, BOARD MEMBER, IS AN EMPLOYEE OF OPPENHEIMER & COMPANY WHO HANDLES THE COLLEGE'S INVESTMENTS. (A) NAME OF PERSON: JAMES O. STEPP (B) RELATIONSHIP BETWEEN INTERESTED PERSON AND ORGANIZATION: EXCUTIVE VICE PRESIDENT (D) DESCRIPTION OF TRANSACTION: JAMES O. STEPP RECEIVES TAXABLE COMPENSATION FROM THE COLLEGE AS THE EXECUTIVE VICE PRESIDENT AND HAS BEEN EMPLOYED WITH THE COLLEGE SINCE 1985 AND IS THE BROTHER TO THE PRESIDENT, JOE A. STEPP. W-2 WAGES FOR 2015 WERE 94,049."
201710399349301816,956002328,"SCHEDUL L, PART II, LOAN TO AND FROM INTERESTED PERSONS:",(A) NAME OF PERSON: DEAN LEWIS(C) PURPOSE OF LOAN: GENERAL ADMINISTRATIVE EXPENSES
201720419349301672,042104258,"Schedule L, Part IV",Two relatives of officers are also employed by Gordon College.
201700139349300315,580644897,"SCH L, PART IV",TRUSTEE IS AN OFFICER OF THE BANK AND TRUSTEE IS A PARTNER IN THE FINANCIAL SERVICES FIRMFIRMS RECEIVE INVESTMENT ADVISORY AND MANAGEMENT FEES STANDARD IN INDUSTRY UNDER AGREEMENTS APPROVED BY MANAGEMENT AND BOARD.
201710279349300136,272793072,"SCHEDULE L, PART V","FIVE MEMBERS OF THE CENTER'S BOARD OF TRUSTEES ARE THE PRESIDENTS OR DELEGATED SENIOR LEADERS OF THE UNIVERSITY CENTER MEMBER UNIVERSITIES/COLLEGES. THE FUNDAMENTAL MISSION AND CORPORATE STRUCTURE OF THE UNIVERSITY CENTER OF GREENVILLE IS TO UTILIZE A CONSORTIUM OF UNIVERSITIES/COLLEGES TO BRING HIGHER EDUCATION PROGRAMS TO GREATER GREENVILLE SOUTH CAROLINA IN ORDER TO ADVANCE THE ACCESS AND ATTAINMENT OF HIGHER EDUCATIONS DEGREES FOR THE BENEFIT OF THE REGION'S CITIZENS AND ECONOMIC COMMUNITY. THEREFORE, THE CENTER HAS BOTH REVENUE AND EXPENSE RELATIONSHIPS WITH THE MEMBER UNIVERSITIES/COLLEGES; RESULTING IN A BUSINESS TRANSACTION RELATIONSHIP WITH THE ENTITIES THAT UNIVERSITY/COLLEGE BOARD MEMBERS REPRESENT."
201700469349301030,590949880,"SCHEDULE L, PART IV","MR. DOMINIC MINIACI IS A MEMBER OF THE BOARD OF TRUSTEES AND HIS FAMILY BUSINESS, PARAMOUNT REFRESHMENTS, HAS A CONTRACT WITH ST. THOMAS UNIVERSITY ON A COMPETITIVE BID PROCESS. ST. THOMAS UNIVERSITY PAID PARAMOUNT REFRESHMENTS $35,073 DURING FISCAL YEAR 2016."
201700319349300110,370864020,"Schedule L, Part IV","Kathleen Viollt was employed at RMUI before Michael Viollt, and worked at the institution many years before his position as President or Chancellor of the University. Legal fees paid to McDermott Will & Emery LLP are at fair market value."
201700799349300310,135562314,"SCHEDULE L, PART IV, COLUMN A",THE NAMES OF SUBSTANTIAL CONTRIBUTORS HAVE NOT BEEN PRESENTED ON SCHEDULE L. SUCH INFORMATION IS PRESENTED ELSEWHERE WITHIN FORM 990 AND/OR IS NOT CONSIDERED PUBLIC INFORMATION SIMILAR TO INFORMATION INCLUDED ON SCHEDULE B.
201710459349302281,430356250,BUSINESS TRANSACTIONS WITH INTERESTED PERSONS,"TRANSACTION 1 (A) CHRISTINE MORGAN (B) CHRISTINE MORGAN IS A SPOUSE OF JEFFREY MORGAN, A KEY EMPLOYEE OF ATSU (C) $102,350 (D) CHRISTINE MORGAN IS AN EMPLOYEE OF ATSU (E) NO"
201730799349300038,540646523,"SCHEDULE L, PART IV:",JAMES SKEEN'S LAW FIRM SERVED AS THE UNIVERSITY'S ATTORNEY IN SEVERAL MATTERS WHERE THE FIRM HAD PARTICULAR EXPERTISE.
201700459349302615,586055244,"SCHEDULE L, PART V",PETER KARANJA IS DR. BENSON KARANJA'S SON. PETER SERVES AS THE ORGANIZATION'S VICE PRESIDENT OF OPERATIONS. THE BOARD HAS APPROVED HIS EMPLOYMENT AND BELIEVE THERE IS NO EXCESS BENEFIT INVOLVED IN HIS COMPENSATION.
201730469349303193,930401259,"Schedule L, Part II","The University provides an Employee Home Loan Program to assist employees in purchasing a home in the neighborhoods surrounding campus. The program is meant to help recruit and retain employees, as well as assist them in creating healthier lifestyles. It is available with identical terms to all full-time employees in good standing after a probationary period. One sixtieth of the loan amount is forgiven each month for five years while the employee remains employed and maintains the home as their primary residence. Monthly forgiveness is treated as taxable income with all necessary withholding and reporting. As of 6/30/2016, total employee home loans of $279,026.50 were outstanding, of which $5,250 pertained to individuals reportable in Part VII or Schedule J."
201710449349302236,470378777,"Schedule L, Part IV",All transactions with interested persons are at arm's length. Regent Bonnie Meyer is a partner in Meyer Partners LLC.
201710799349300201,750851900,"Schedule L, Part V Supplemental Information","Part III, Additional Information:Merit based scholarships are awarded to relatives of trustees and officers in the same manner as other students and are based on academic achievements, leadership qualities, commitment to service, and potential for success at ACU.Tuition discount is awarded to employees of the University and their dependents based on the number of years employed. During the first year of employment, a 50% discount is awarded. Thereafter, a 75% discount is awarded.Part IV, Additional Information:DANNY PHILLIPS - HUSBAND OF CAROLE PHILLIPS, TRUSTEEMARCIA STRAUGHN - WIFE OF GREGORY STRAUGHN, FORMER PROVOSTBRAD CRISP - SON IN LAW OF ROYCE MONEY, CHANCELLORCARA LEE CRANFORD - DAUGHTER OF GARY MCCALEB, VICE PRESIDENT"
201720629349300907,540505977,PART II - LOANS TO AND/OR FROM INTERESTED PERSONS,"WASHINGTON AND LEE PROVIDES HOUSING LOANS TO FULL-TIME EMPLOYEES. SUCH LOANS MAY BE USED TO PURCHASE, BUILD, OR IMPROVE A PRINCIPAL RESIDENCE IN THE LEXINGTON ROCKBRIDGE COUNTY AREA. INTEREST RATES ON LOANS ARE 25 PERCENT LESS THAN THE INTEREST RATE CHARGED BY LEXINGTON FINANCIAL INSTITUTIONS FOR RESIDENTIAL MORTGAGE LOANS. IMPUTED INTEREST INCOME RELATED TO A UNIVERSITY-PROVIDED HOUSING LOAN IS INCLUDED IN EMPLOYEE W-2S, AS APPLICABLE, EACH YEAR. AS OF 6/30/16, THE UNIVERSITY HAD 267 EMPLOYEES WITH HOME LOANS OUTSTANDING. THE LOAN PROGRAM IS APPROVED BY THE BOARD OF TRUSTEES AND REVIEWED AS PART OF THE INVESTMENT PORTFOLIO OF THE UNIVERSITY BY THE INVESTMENT COMMITTEE."
201740459349303514,231352652,"SCH L, PART III, GRANTS OR ASSISTANCE BENEFITTING INTERESTED PERSONS:","(C) AMOUNT OF GRANTS $44,000(D) TYPE OF ASSISTANCE: SCHOLARSHIPS/AWARDS(E) PURPOSE OF ASSISTANCE: TUITION"
201720629349300812,160743942,"PART IV, BUSINESS TRANSACTIONS INVOLVING INTERESTED PERSONS:",(A) NAME OF PERSON: ADPRO SPORTS (B) RELATIONSHIP BETWEEN INTERESTED PERSON AND THE ORGANIZATION: GREATER THAN 35% CONTROLLED ENTITY BY RONALD RACCUIA (TRUSTEE).(D) DESCRIPTION OF TRANSACTION: SALES OF ATHLETIC APPAREL.
201720629349300812,160743942,"PART IV, BUSINESS TRANSACTIONS INVOLVING INTERESTED PERSONS:",(A) NAME OF PERSON: UNILAND DEVELOPMENT CO.(B) RELATIONSHIP BETWEEN INTERESTED PERSON AND THE ORGANIZATION: GREATER THAN 35% CONTROLLED ENTITY BY MICHAEL MONTANTE (TRUSTEE).(D) DESCRIPTION OF TRANSACTION: RENTAL AND CONSTRUCTION PROJECTS.
201720459349301102,314379435,PART III - GRANTS BENEFITING INTERESTED PERSONS:,"EDUCATIONAL ORGANIZATIONS ARE NOT REQUIRED TO IDENTIFY INTERESTED PERSONS TO WHOM THEY PROVIDED SCHOLARSHIPS, FELLOWSHIPS, AND SIMILAR FINANCIAL ASSISTANCE PURSUANT TO THE INSTRUCTIONS FOR FORM 990, SCHEDULE L. AS SUCH, COLUMNS (A) AND (B) HAVE BEEN LEFT BLANK IN PART III."
201730449349300628,390833608,"Schedule L, Part III","There were various employees and relatives of employees that have a relationship to the school, and the disclosure of the type of assistance and amount of assistance granted are subject to FERPA law."
201700469349300720,150532239,"Schedule L, Part IV","In the fiscal year 2016, the university paid the president's spouse, Lynn Fox, $23,200 in consulting fees and associated travel expenses of $17,003 pursuant to a contract. The university has long held investments with Angelo Gordon and the 6/30/16 value of such investments was $11,862,126. John Angelo was co-owner of Angelo Gordon until his death in 2016. Both he and his wife, Judy Angelo Cowen are alumni of the university. Ms. Cowen's charitable trust donated $252,437 to the university in 2016. Trustee James Tyler is president and owner of Northland Associates which owns JDS Construction. In 2016, the university solicited proposals for renovations to its riding arena. After careful review by senior management and the board, JDS Construction, was selected for the project and the university entered a contract in the amount of $191,765. In 2016, Mr. Tyler made a charitable donation of $5,000 and Northland Associations made a charitable donation of $45,000."
201710699349300426,231352641,LOANS TO AND/OR FROM INTERESTED PERSONS,"GGP PROMISSORY NOTE: GETTYSBURG GREAT PRODUCTIONS (GGP), A DISREGARDED ENTITY OF GETTYSBURG COLLEGE, RECEIVED LOAN PROCEEDS FROM CERTAIN INTERESTED PARTIES TO PARTIALLY FUND A FEATURE LENGTH FILM THAT FURTHER RAISES THE NATIONAL VISIBILITY OF GETTYSBURG COLLEGE. LOANS ACCRUE INTEREST AT THE RATE OF 6% PER ANNUM. PRINCIPAL AND INTEREST ON THESE NOTES ARE PAYABLE FROM AVAILABLE REVENUES GENERATED FROM FILM DISTRUBITION AS DEFINED BY THE PROMISSORY AND SUBORDINATED PROMISSORY NOTE AGREEMENTS."
201730339349300208,231352698,BUSINESS TRANSACTIONS INVOLVING INTERESTED PERSONS,"SCHEDULE L, PART IV, Line 1 DURING THE YEARS ENDED JUNE 30, 2016 AND 2015, THE COLLEGE PAID APPROXIMATELY $10,056,316 AND $1,305,000 RESPECTIVELY, TO CONSTRUCTION AND ARCHITECTURAL DESIGN COMPANIES OWNED BY AN Emeritus BOARD MEMBER OF THE COLLEGE. AS OF JUNE 30, 2016 AND 2015, APPROXIMATELY $1,826,000 AND $25,000, RESPECTIVELY, WERE PAYABLE TO THESE COMPANIES."
201730339349300208,231352698,ROBERT KINSLEY,ROBERT KINSLEY IS THE CHAIRMAN OF KINSLEY CONSTRUCTION AND A non-voting emeritus MEMBER OF YORK COLLEGE OF PENNSYLVANIA'S BOARD OF TRUSTEES. KINSLEY CONSTRUCTION IS AN INDEPENDENT BUILDING CONTRACTOR WHICH SERVED AS THE GENERAL CONTRACTOR FOR SEVERAL PROJECTS INCLUDING THE DAY SCHOOL PROJECT.
201730339349300208,231352698,"Schedule L, PART IV, LINE 2","DURING THE YEAR, THE COLLEGE LEASED/PURCHASED $347,897 OF COPIER/PRINTING EQUIPMENT FROM A SUBSTANTIAL CONTRIBUTOR TO THE COLLEGE."
201730339349301338,231522643,"SCH L, PART IV, BUSINESS TRANSACTIONS INVOLVING INTERESTED PERSONS:","(D) DESCRIPTION OF TRANSACTION: JAMES SWEENEY IS A TRUSTEE OF ALVERNIA AND THE PRESIDENT OF DISTRIBUTED SYSTEMS, INC. (DSS). ALVERNIA PAID DSS $538,000 FOR OUTSOURCED IT SERVICE DESK, CIO, AND A PROJECT MANAGER DURING THE FISCAL YEAR ENDING JUNE 30, 2016.JEFFREY RUSH IS A TRUSTEE OF ALVERNIA AND THE REGIONAL PRESIDENT OF FULTON BANK. ALVERNIA PAID FULTON BANK $403,164 FOR INTEREST EXPENSES ON THEIR OUTSTANDING LINE OF CREDIT AND LONG-TERM DEBT DURING THE FISCAL YEAR ENDING JUNE 30, 2016."
201710459349302586,350868086,"Schedule L, Part III GRANTS OR ASSISTANCE BENEFITTING INTERESTED PERSONS","PER IRS INSTRUCTIONS, COLLEGES, UNIVERSITIES, AND PRIMARY AND SECONDARY SCHOOLS ARE NOT REQUIRED TO IDENTIFY INTERESTED PERSONS TO WHOM THEY PROVIDED SCHOLARSHIPS, FELLOWSHIPS, AND SIMILAR FINANCIAL ASSISTANCE. INSTEAD, THESE ORGANIZATIONS MUST, IN PART III, GROUP EACH TYPE OF FINANCIAL ASSISTANCE (FOR EXAMPLE, NEED-BASED SCHOLARSHIPS, MERIT SCHOLARSHIPS, DISCOUNTED TUITION) PROVIDED TO INTERESTED PERSONS IN SEPARATE LINES. FOR EACH LINE, THE SCHOOL SHOULD REPORT IN COLUMN (C) THE AGGREGATE DOLLAR AMOUNT OF EACH TYPE OF ASSISTANCE, THE TYPE OF ASSISTANCE IN COLUMN (D), AND THE PURPOSE OF THE ASSISTANCE IN COLUMN (E), UNLESS SUCH REPORTING WOULD BE AN UNAUTHORIZED DISCLOSURE OF STUDENT EDUCATION RECORDS UNDER THE FAMILY EDUCATIONAL RIGHTS AND PRIVACY ACT (FERPA). COLUMNS (A) AND (B) SHOULD BE LEFT BLANK FOR THESE LINES."
201700729349300710,530196549,Business Transactions with Interested Persons,"Schedule L, Part IV TRANSACTIONS WITH JP MORGAN CHASE - PETER SCHER IS A TRUSTEE OF AMERICAN UNIVERSITY AND A KEY EMPLOYEE OF JP MORGAN CHASE. THE UNIVERSITY HAS ENGAGED A BANK LOAN WITH JP MORGAN CHASE. THE LOAN WAS BASED ON A COMPETITIVE BID PROCESS RESULTING IN THE MOST FAVORABLE RATE AND TERMS. THE TRUSTEE SCHER RECUSED HIMSELF FROM THE BOARD OF TRUSTEES' DECISION TO ACCEPT THE JP MORGAN CHASE LOAN."
201720419349301657,381624684,"Schedule L, Part V Supplemental Information","Northwood University leases office/classroom space for it's Grand Rapids location, Mr. DeVos is 1/3 owner of the management company that manages the building.Northwood trustee Richard Guirlinger is the owner of Bourke Services, LLC. Northwood hires and pays Bourke Services, LLC to do presentations in the University of The Aftermarket sessions offered by Northwood University. Richard Guirlinger is the presenter for those sessions. The payment includes fees and expenses."
201720529349300707,362167048,LOANS TO AND/OR FROM INTERESTED PERSONS,"SCHEDULE L, PART II Pursuant to University policy, members of the University's full-time faculty and staff, including officers, key employees and highly compensated employees, are eligible for an interest-free loan towards the purchase of personal computer equipment. The policy limits outstanding loan amounts to no more than $2,500, requires repayments be made via mandatory payroll deductions, limits the repayment period to no longer than two years and requires the employee to sign a promissory note. Loan applications must be approved by both the employee's immediate supervisor and the University's human resources department. As of June 30, 2016, there were no outstanding loans for any interested person."
