object_id,ein,FrmAndLnRfrncDsc,ExplntnTxt
201841099349300449,231365966,"Part I, Line 2:","All students applying for federal funds are required to submit the Free Application for Federal Student Aid (""FAFSA""). The office reviews the results of the FAFSA, which dictates what and how much federal funding the individual student is eligible for. If the student is determined to be in compliance with all federal regulations, as determined by the Dept. of Ed., the aid office awards the student the appropriate funding. Student files regarding eligibility are maintained by the student financial aid office."
201801159349300345,570314380,"Part I, Line 2:",Procedures for monitoring the Use of grant funds: Financial aid guidelines are utilized to determine the qualifications of each recipient. The guidelines are published in Converse College's Academic Catalog and comply with eligibility requirements published by the U.S. Department of Education and the South Carolina Department of Revenue. Annual compliance audits are completed by an independent accounting firm. The grants and scholarships are applied by the Financial Aid department directly against the student's account.
201801299349301640,042321292,"PART I, LINE 2:",THE COLLEGE RECORDS AND TRACKS GRANTS AND ASSISTANCE.
201841359349306019,952786163,"Part I, Line 2:","FOR ADMINISTERING GOVERNMENT GRANT FUNDS, DEAN OF STUDENT AFFAIRS REVIEWS THE DO-NOT-USE VENDOR LIST PUBLISHED BY THE GOVERNMENT TO BE IN COMPLIANCE WITH G5 (SAM) REQUIREMENTS. Financial aids disbursements are posted to student's account based on the approved cost of attendance for each student. The posted financial aid is then used to offset the cost of tuition and other education related expenses."
201841239349301464,060646701,"Schedule I, Part I, Line 2","The University utilizes several procedures and reports on an annual basis to monitor financial aid. The University has internal controls in place to ensure amounts are awarded to students who continue to meet and maintain eligibility requirements. These controls are administered through the Financial Aid office. Also, Independent Auditors complete the A-133 Audit relating to federal and state student aid."
201841209349300804,390808497,"PART I, LINE 2:","GRANTS ARE AWARDED IN THE FORM OF FINANCIAL ASSISTANCE TOWARDS THE PAYMENT OF TUITION AND FEES IN WHICH CASE THE GRANT AMOUNTS ARE APPLIED DIRECTLY TO THE STUDENT'S ACCOUNT. OTHER GRANTS ARE AWARDED FOR VARIOUS REASONS TO STUDENTS, FACULTY AND STAFF FOR EDUCATIONAL OR WORK RELATED ACTIVITIES. IN THESE CASES EXPENSE VERIFICATION IS REQUIRED IN THE FORM OF RECEIPTS AND OTHER APPROPRIATE DOCUMENTATION."
201841359349302159,221508627,"SCHEDULE I, PART I; QUESTION 2","SAINT PETER'S UNIVERSITY (""UNIVERSITY"") PROVIDES SCHOLARSHIPS TO STUDENTS MATRICULATING AT THE UNIVERSITY FOR VARIOUS REASONS INCLUDING, BUT NOT LIMITED TO, ACADEMIC PERFORMANCE, STUDENT INSTITUTIONAL AID AND ATHLETICS. THEREFORE, ALL FUNDS GRANTED ARE USED TO DEFRAY THE COST OF TUITION AND NO FURTHER MONITORING OF THE GRANTS IS REQUIRED."
201821349349302557,240795460,"Schedule I, Part I, Line 2","Moravian College follows state and federal regulations in administering scholarship and grants as well as institutional policy when administering college funds. Moravian follows federal methodology to determine financial need for awarding federal funds and need-based institutional funds. All students applying for financial aid follow an annual application process by completing the Free Application for Federal Student Aid (FAFSA). Files are reviewed for conflicting information and to complete required verification of application data. Moravian credits all financial aid awards, except for work study, directly to students' receivable account offsetting charges for tuition, fees and campus room and board. Changes in student enrollment status are reviewed to ensure that students remain eligible for financial aid and awards are adjusted as necessary. Any refunds from student accounts are done in compliance with state and federal regulations."
201841359349310144,750818183,Part III Line 1,"All scholarships are awarded based upon specific criteria maintained by the financial aid office. Requirements for receiving scholarships depends on other factors such as grade point average, family income or economic need. The Colleges finanial aid staff monitors guidelines to ensure compliance. The College also undergoes the required Uniform Guidance audit annually."
201801229349300940,256068246,Additional Supplemental Information,"The agency has written contracts with all of the recipients that clearly identify the responsibilities of both parties, the contract amount and how it must be drawn down. The recipients must submit adequate documentation to support all requests for funds associated with their contracts before payment is made. The agency also conducts on-site fiscal monitoring of its recipients at least once a year, with the exception of the organizations receiving On the Job Training Wage Reimbursements. The OJT Wage contracts are very straightforward and the required documentation for payment provides sufficient controls over these funds."
201801299349303405,341018992,"Schedule I, Part III, Column (b) Estimated Number Of Recipients",TUITION AND FEES : Estimate is based on the percentage of students who received assistance for tuition and fees in the prior year.
201801299349303405,341018992,"Schedule I, Part III, Column (b) Estimated Number Of Recipients",FELLOWS - TUITION AND FEES : Estimate is based on the percentage of students who received fellowships for tuition and fees in the prior year.
201801299349303405,341018992,"Schedule I, Part III, Column (b) Estimated Number Of Recipients",STIPENDS AND ALLOWANCES : Estimate is based on the percentage of students who received stipends in the prior year.
201801299349303405,341018992,"Schedule I, Part I, Line 2 Procedures for monitoring use of grant funds.","The Office of Sponsored Projects administration directs and facilitates pre- and post-award processes by ensuring compliance with federal, state and University guidelines. It also oversees regulatory compliance activities to ensure safe, ethical and responsible conduct of research. In addition, the office is responsible for enhancing the research infrastructure of the institution as well as developing and monitoring policies related to the stewardship of research activities."
201831169349300748,480556716,"SCHEDULE I, PART I, LINE 2",ALL GRANTS ARE INSTITUTIONAL FINANCIAL AID AND APPLIED DIRECTLY TO THE STUDENT'S ACCOUNT BY THE UNIVERSITY.
201841359349312804,591157081,"PART I, LINE 2:",THE COLLEGE'S GRANTS ARE PRIMARILY MONITORED IN THE FINANCIAL AID DEPARTMENT THROUGH THE UTILIZATION OF WRITTEN AND ELECTRONIC DOCUMENTATION. STUDENTS RECEIVING GRANTS AND SCHOLARSHIPS ARE DEEMED WORTHY BY THE COLLEGE'S ASSESSMENT ON THE BASIS OF ACHIEVEMENT AND FINANCIAL NEED.
201801319349304465,640303069,"SCHEDULE I, PART I, LINE 2","THE UNIVERSITY MAINTAINS STUDENT FINANCIAL AID RECORDS AND FOLLOWS APPROPRIATE SELECTION CRITERIA FOR ALL GRANTS AND ASSISTANCE AWARDED TO STUDENTS. THE UNIVERSITY HAS AN ANNUAL COMPLIANCE AUDIT CONDUCTED IN ACCORDANCE WITH OMB CIRCULAR A-133 EACH YEAR. FOR THE YEAR ENDED 6/30/2017, THE AUDIT REPORTED THAT THE UNIVERSITY COMPLIED, IN ALL MATERIAL RESPECTS, WITH THE COMPLIANCE REQUIREMENTS OF ITS MAJOR FEDERAL PROGRAMS."
201801319349304455,362593545,"Schedule I, Part I, Line 2 Procedures for monitoring use of grant funds.","Scholarship funds can be used for tuition, books and living expenses. In general they are applied first to tuition and balances sent to students. It is reviewed every school term and is monitored in compliance with student aid protocols. All payments are monitored and approved by Student Services and Finance before payment is applied or paid to the student. All students receiving scholarships have been selected on a non-discretionary basis. The student loan program is audited every year in compliance with federal single audit standards"
201801349349305610,050258810,PROCEDURES TO MONITOR THE USE OF GRANT FUNDS IN THE U.S.,"PART I, LINE 2 ALL FEDERAL TITLE IV FUNDS RECEIVED BY BRYANT UNIVERSITY ARE MANAGED IN STRICT COMPLIANCE WITH ALL REQUIREMENTS SET FORTH IN THE PROGRAM PARTICIPATION AGREEMENT, A FORMAL AGREEMENT BETWEEN BRYANT UNIVERSITY AND THE U.S. DEPARTMENT OF EDUCATION. THE PROGRAM PARTICIPATION AGREEMENT IS PERSONALLY ENDORSED BY BOTH THE CHIEF EXECUTIVE OFFICER OF BRYANT UNIVERSITY AND THE SECRETARY OF THE U.S. DEPARTMENT OF EDUCATION. COMPLIANCE WITH ALL TITLE IV REQUIREMENTS IS MONITORED BY THE DIRECTOR OF FINANCIAL AID WITH THE ASSISTANCE OF FOUR (EXEMPT) PROFESSIONAL FINANCIAL AID ADMINISTRATORS AND FOUR (NON-EXEMPT) SUPPORT STAFF MEMBERS. COMPLIANCE CAPABILITY IS GREATLY ENHANCED THROUGH THE USE OF THE BANNER INTEGRATED MANAGEMENT INFORMATION SYSTEM AND ITS EFFECTIVE INTERFACE WITH OTHER DEPARTMENT OF EDUCATION SYSTEMS. THE UNIVERSITY PROVIDES ASSISTANCE FOR COMMUNITY SUPPORT TO VARIOUS ORGANIZATIONS THROUGH THEIR FUNDRAISING EVENTS. IN THE CURRENT YEAR, NO ORGANIZATION RECEIVED OVER $5,000 FROM THE UNIVERSITY IN THIS CAPACITY."
201801349349303220,030179414,"Schedule I, Part I, Line 2 Procedures for monitoring use of grant funds.","ALL GRANTS TO INDIVIDUALS REPRESENT SCHOLARSHIP/FINANCIAL ASSISTANCE TO U.S. STUDENTS TO ATTEND THE COLLEGE IN THE UNITED STATES. BENNINGTON MONITORS THE USE OF FUNDS THROUGH THE ANALYSIS OF TRANSCRIPTS, GRADES, AND WRITTEN NARRATIVES BY BOTH FACULTY AND STUDENTS. PROGRESS TOWARD THE REQUIREMENTS TO COMPLETE A DEGREE IS CLOSELY MONITORED. GRANTS ARE ONLY PROVIDED TO CURRENTLY ENROLLED STUDENTS."
201801349349310750,141338587,"Schedule I, Part I, Line 2","Vassar College raises funds for, and makes contributions to, a wide variety of 501(c)(3) organizations in the Greater Poughkeepsie area. These organizations are selected annually by a committee of employees and students after review of their activities and mission. Employees and students also volunteer time at each organization. Funds are collected annually from the gifts of employees, students, trustees, and friends of Vassar as part of the ""Community Works"" campaign. Vassar also makes small contributions to other local non-profit and governmental entities who are not part of the campaign."
201801349349310750,141338587,"Schedule I, Part III",Students who are awarded scholarships have funds credited to their account and the use is restricted to purposes related to enrollment in a program of study. Recipients of fellowships are required to submit periodic written reports of their activities to the College.
201821349349305072,460224600,"PART I, LINE 2:","FOR FEDERAL AND PASS-THROUGH GRANTS FOR PROGRAMS, EACH GRANT HAS A GRANT MANAGER. ON A MONTHLY BASIS, THE BUSINESS OFFICE STAFF RECONCILES EXPENSES INCURRED FOR EACH GRANT AND VERIFIES WITH THE RESPECTIVE GRANT MANAGER. ONCE CONFIRMED, THE BUSINESS OFFICE STAFF REQUESTS REIMBURSEMENT FROM THE RESPECTIVE AWARDING AGENCY. FOR SCHOLARSHIPS, FINANCIAL AID OFFICE STAFF REVIEWS THE SPECIFIC CRITERIA FOR AWARDING TO STUDENTS. THE BUSINESS OFFICE STAFF DOES A RECONCILIATION OF EXPENSES (FINANCIAL AID AWARDED) BEFORE DRAWING DOWN ACTUAL DOLLARS FROM THE ENDOWMENT AND FEDERAL FINANCIAL AID. FOR PROGRAM ENDOWMENTS, THERE ARE TWO DIFFERENT METHODS USED. SOME PROGRAMS HAVE ""BUDGET MANAGERS"" WHO ARE AWARE OF THE FUNDS AVAILABLE VIA THE BUSINESS OFFICE STAFF AND SPEND ACCORDINGLY. FOR THOSE PROGRAMS WITHOUT ""BUDGET MANAGERS AND FOR UNRESTRICTED ENDOWMENTS, THE BUSINESS OFFICE STAFF ENSURES THAT THERE ARE EXPENSES INCURRED IN THOSE SPECIFIC DEPARTMENTS BEFORE DRAWING DOWN ACTUAL DOLLARS. IN ALL CASES FOR THE ENDOWMENTS, THE BUSINESS OFFICE STAFF DOES A RECONCILIATION TO ENSURE THAT THE PROPER DOLLAR AMOUNT IS CALCULATED, AWARDED/EXPENSED, AND DRAWN DOWN."
201801349349301940,362174823,"Part I, Line 2:",Rush provides grants and assistance to organizations that are recognized public charities and to individuals primarily associated with the medical field. Rush maintains contact with the grantees through the performance of its exempt purpose.
201821349349306427,620479542,"SCHEDULE I, PAGE 1, PART I, LINE 2",GRANTS AND SCHOLARSHIPS ARE NETTED AGAINST STUDENT TUITION ACCOUNTS.
201821349349305067,131967321,"SCHEDULE I, PART III",SCHOLARSHIPS AND DISCOUNTS ARE BASED ON ACADEMIC PERFORMANCE AND FINANCIAL NEED AND ARE ADMINISTERED BY THE OFFICES OF ADMISSIONS AND STUDENT SERVICES.
201801349349304915,230596940,"SCHEDULE I, PART I, QUESTION 2",GRANTS ARE MONITORED BY THE ORGANIZATION'S FINANCE PERSONNEL THROUGH THE UTILIZATION OF COST CENTERS AND OTHER INFORMATION; INCLUDING WRITTEN DOCUMENTATION AND RECEIPTS.
201801319349302100,160871487,"Schedule I, Part I, Line 2",Grants received are applied directly to student tuition invoices. The grants are used to gap the bridge between financial aid and the full amount of tuition due.
201801349349305825,550561496,"SCHEDULE I, PAGE 1, PART I, LINE 2",THE ORGANIZATION MAKES GRANTS AND CONTRIBUTIONS TO THOSE SEPARATE ORGANIZATIONS AND INDIVIDUALS FOR WHICH IT HAS KNOWLEDGE OF THE ENTITY'S OR INDIVIDUAL'S OPERATIONS AND SUFFICIENT CONTINUED ASSOCIATION TO ENABLE THE EVALUATION OF THE EFFECTIVENESS OF THE ORGANIZATION'S SPECIFIC GRANT OR CONTRIBUTION. THE ORGANIZATION DOES NOT MAKE CONTRIBUTIONS OF ANY SIGNIFICANCE UNLESS IT HAS THE OPPORTUNITY TO SO MONITOR ITS EFFECTIVENESS.
201801349349308605,954625327,"Part I, Line 2:","Keck Graduate Institute of Applied Life Sciences awards scholarships only to individual graduate students enrolled at the Institute. The scholarships are awarded in the admissions process based upon academic merit, financial need, and availability of funds. The Institute monitors that each student receiving a scholarship maintains satisfactory academic progress. In awarding donor-funded scholarships, the Institute also monitors that students selected for those scholarships meet any donor stipulations as to academic preparation or field of study."
201821349349306487,251024358,"Part I, Line 2:",SCHOLARSHIP FUNDS ARE AWARDED TO STUDENTS WHO MEET THE FINANCIAL REQUIREMENTS AS DEMONSTRATED BY THE RESULTS FROM FEDERAL FREE APPLICATION FOR FEDERAL STUDENT AID. ENDOWED SCHOLARSHIP RECIPIENTS ALSO MEET THE SPECIFIC CRITERIA AS IDENTIFIED BY THE DONORS.
201821349349303362,131624225,"SCHEDULE I, PART I, LINE 2",YESHIVA UNIVERSITY CONDUCTS SITE VISITS AND FOLLOW-UP DISCUSSIONS WITH THE MANAGEMENT OF GRANTEES TO ASSURE THAT GRANT FUNDS ARE USED FOR THE INTENDED TAX-EXEMPT PURPOSES. THE ACTIVITIES OF FELLOWSHIP RECIPIENTS ARE MONITORED TO ENSURE COMPLIANCE WITH THE INTENTIONS AND GUIDELINES OF THE FELLOWSHIP GRANT.
201821349349303362,131624225,"SCHEDULE I, PART III","THE $79,097,221 IN GRANTS AND ASSISTANCE REPRESENT STUDENT FINANCIAL AID, SCHOLARSHIPS AND FELLOWSHIPS, INCLUDING EMERGENCY STUDENT ASSISTANCE GRANTS. FINANCIAL AID IS AWARDED BASED UPON FINANCIAL NEED AND ACADEMIC ACHIEVEMENT. NEED BASED AID IS AWARDED BASED ON ELIGIBILITY DETERMINED BY THE US DEPARTMENT OF EDUCATION'S FREE APPLICATION FOR FEDERAL AID (FAFSA). ACADEMIC BASED AID IS AWARDED BY THE DISTINGUISHED SCHOLARS COMMITTEE. BOTH FACULTY AND ENROLLMENT SERVICES ADMINISTRATORS COMPRISE THE COMMITTEE."
201801349349306125,060776644,"Part I, Line 2:","THE THREE AREAS OF FINANCIAL ASSISTANCE TO STUDENTS ARE LOANS, GRANTS, AND EMPLOYMENT (WORK-STUDY). THESE ARE GENERALLY AWARDED ON THE BASIS OF FINANCIAL NEED, DETERMINED BY AN ANALYSIS OF FAMILY INCOME AND ASSETS. SCHOLARSHIPS ARE ANOTHER SOURCE OF FINANCIAL ASSISTANCE, AWARDED ON THE BASIS OF ACADEMIC ACHIEVEMENT, ATHLETICS OR PERFORMING ARTS, COMMUNITY SERVICE OR LEADERSHIP. CRITERIA FOR MERIT BASED AWARDS MAY ALSO INCLUDE A FINANCIAL NEEDS REQUIREMENT. THE UNIVERSITY MONITORS THE AMOUNT ISSUED BY CALCULATING A COST OF ATTENDANCE, ASSESSING AN ESTIMATED FAMILY CONTRIBUTION (EFC), AND DERIVING A LEVEL OF FINANCIAL NEED. ONCE THE AMOUNT OF AID HAS BEEN DETERMINED FOR THE INDIVIDUAL, IT IS DISPERSED TO THE STUDENT'S ACCOUNT AND IS CONTROLLED BY THE BURSAR'S OFFICE. SEVERAL REPORTS/SURVEYS ARE USED ANNUALLY TO MONITOR THE DISTRIBUTION OF GRANT ASSISTANCE; FOR EXAMPLE, FISAP REPORT TO USDE, A-133 AUDIT, FEDERAL IPEDS REPORT, STATE ANNUAL AUDIT, AND VARIOUS SURVEYS THAT TYPICALLY USE INFORMATION FROM THE COMMON DATA SET (CDS)."
201821349349306022,133297197,"Part I, Line 2:","PROCEDURES FOR MONITORING USE OF GRANT FUNDS IN U.S. Grants and other assistance awarded to individuals in the U.S. represent student financial aid. Student financial aid awards are determined by the university's assessment of academic achievement, financial need and other similar standards. Student financial services continuously monitors student eligibility for these awards. Student financial services is responsible for regulatory compliance. Student financial services ensures equity by applying all need analysis formulas consistently across the institution's population of student financial aid applicants and provides services that do not discriminate on the basis of race, gender ethnicity, sexual orientation, religion, disability, age, or economic status. The university receives various forms of financial aid from the government to support financial assistance provided to the students. The types of government assistance the university receives include the following: -Federal Pell Grant -Federal Supplemental Educational Opportunity Grant (SEOG) -Federal Direct Loan Program -Federal Work Study Program The university receives government funding to support its organized research programs. These governmental grants help to further the university's mission by supporting organized research efforts in the areas of education, training, and public services. The public agencies that support the university's research activities are: -National Science Foundation -Department of Health and Human Services -United States Department of Education -United States Environmental Protection Agency -United States Department of Defense -The National Endowment for the Arts -The National Endowment for the Humanities"
201801349349306430,720642832,"PART I, LINE 2:",PRIVATE GRANTS - THE UNIVERSITY FOLLOWS THE TERMS OF THE PROVIDER IN THE POSTING AND RELEASING OF GRANT FUNDS. FEDERAL GRANTS - THE UNIVERSITY FOLLOWS THE DEPARTMENT OF EDUCATION REGULATIONS TO ENSURE THAT GRANTS ARE UTILIZED APPROPRIATELY. THE NSLDS SYSTEM HELPS THE UNIVERSITY IDENTIFY ANY STUDENT THAT HAS BEEN POTENTIALLY AWARDED MORE THAN THEY ARE ELIGIBLE FOR.
201801349349306430,720642832,"SCHEDULE I, PART III","QUALIFICATIONS TO RECEIVE PAYMENTS: GOVERNMENT GRANTS ARE AWARDED IN ACCORDANCE WITH APPROPRIATE FEDERAL REGULATIONS. SCHOLARSHIPS ARE BASED ON ACT TEST SCORES, ACADEMIC STANDING, AS SHOWN BY HIGH SCHOOL TRANSCRIPTS, AS WELL AS COMMUNITY INVOLVEMENT. GRANTS ARE AWARDED IN RECOGNITION OF THE QUALITY PAST ACADEMIC ACHIEVEMENT AT THE UNIVERSITY OF HOLY CROSS, FINANCIAL NEED AS DETERMINED BY THE SUBMISSION OF THE FREE APPLICATION FOR FEDERAL STUDENT AID, AND COMMUNITY INVOLVEMENT."
201801349349308385,236002304,"Schedule I, Part I, Line 2","Haverford College scholarships are based solely on need. The College does not award any grant aid based on merit. Applicants can be asked to file the College Board Profile and the FAFSA. If eligible for federal aid, parent and student personal and business tax returns must be provided. Supplements for business and forms for non-custodial parents may also be required based on circumstances. Students may appeal award decisions to the Financial Aid Committee made up of the Vice President and Dean of Admission and Financial Aid, the Dean of the College, and the Senior Vice President for Administration and Finance. Haverford scholarships are credited directly to the student's account for tuition, room, board, fees, and other billed charges. Supplemental Education Opportunity Grants (SEOG) are awarded based on family contribution. Eligibility is determined by the FAFSA and regulations determined by the U.S. Department of Education. Per the Department of Education regulations, students who receive Pell Grants must be provided FSEOG funds first. If the student is selected to receive these awards other verification forms may be required including the Verification Statment, parent and student tax returns, and non-tax filer statements. FSEOG awards are credited directly to the students account for tuition, room, board and other billed charges. FSEOG awards are audited annually by the College's outside auditors in conjunction with the Single Audit. Student internships are awarded through an application and committee review process. The internship awards are paid directly to the student for travel, room, board or other fees. This assistance enables the students to engage in unpaid internships in a variety of domestic and international locations. Some of the areas of study include Humanities, Sciences, Global Citizenship and Entrepreneruship."
201821349349306367,630312914,"Schedule I, Part I, Line 2 Procedures for monitoring use of grant funds.","Funds are credited to the students' accounts for tuition and fees, room and board, books and other supplies. The Office of Student Financial Services consists of both Financial Aid and Bursar functions, who work closely together to ensure proper usage of grant funds."
201821349349309792,570314390,"Part I, Line 2:",The College monitors enrollment and the Financial Aid Office of the College keeps the requisite records in either an electronic or hard copy form.
201801349349306260,560529961,GRANT SUBSTANTIATION,"SCHEDULE I, PART I, LINE 2 DAVIDSON COLLEGE FOLLOWS FEDERAL, STATE AND INSTITUTIONAL GUIDELINES AND METHODOLOGIES FOR DETERMINING ELIGIBILITY AND AWARDING OF NEED-BASED FINANCIAL AID. FOR MERIT-BASED GRANTS, DAVIDSON AWARDS THE GRANTS IN COMPLIANCE WITH THE STIPULATIONS OF THE UNDERLYING GOVERNING INSTRUMENT (I.E. DONOR ENDOWMENT AGREEMENTS AND OTHER DONOR DOCUMENTATION). DAVIDSON MAINTAINS DETAILED RECORDS OF COMPLIANCE FOR ALL GRANTS DISBURSED."
201801349349300410,221487164,"Part I, Line 2:","Drew University granted funds to students in the form of scholarships, fellowships, student loans, as well as other financial aid. Financial aid is granted to students based on eligibility guidelines as defined by the federal department of education as well as the state of New Jersey. If a student is not eligible to receive federal or state based financial aid, the aid will not be applied to the student's account. In addition, Drew University grants funds to students in the form of institutional aid based on merit and need criteria."
201801349349308770,951664123,"Part I, Line 2:",Use of grant funds is monitored through student financial aid and billing process.
201821349349306907,560594591,"SCHEDULE I, PAGE 1, PART I, LINE 2","PIU EVALUATES ELIGIBILITY BY RECEIVING WRITTEN REPRESENTATIONS AND FROM REVIEW OF A STUDENTS FILE. ITEMS TO BE CHECKED INCLUDE PIUS APPLICATION, HIGH SCHOOL DIPLOMA, DROP/ADD FORMS, AND WITHDRAWAL FORMS. ONCE A STUDENT HAS COMPLETED THE FREE APPLICATION FOR FEDERAL STUDENT AID (FAFSA) APPLICATION, PIU SUBMITS IT ELECTRONICALLY TO ED. ONCE IT IS PROCESSED THE STUDENT WILL RECEIVE A STUDENT AID REPORT AND THE SCHOOL WILL RECEIVE AN ISIR. THE ISIR IS KEPT IN THE STUDENTS FINANCIAL AID FILE. THE ISIR CONTAINS THE EFC AMOUNT, WHICH IS THE AMOUNT THE STUDENT IS EXPECTED TO PAY, THE COST OF ATTENDANCE IS FOUND ON WORKSHEETS GENERATED BY WEBER. THE EFC AND COA ARE BOTH USED TO CALCULATE FINANCIAL NEED. THE ISIR ALSO PROVIDES FINANCIAL AID HISTORY, MATCHES SOCIAL SECURITY DATA, SELECTIVE SERVICE DATA AND CHECKS CITIZENSHIP. FFEL- CHECKS FROM LOAN INSTITUTIONS ARE REQUESTED FROM STUDENTS THROUGH LOAN APPLICATIONS. LOAN APPLICATIONS ARE CERTIFIED BY PIU AND SENT BY STUDENT FINANCIAL AID OFFICE. MONEY IS DEPOSITED INTO A SEPARATE BANK ACCOUNT USING ACH/EFT SYSTEM. ONCE PIU RECEIVES THE DISBURSEMENT RECORD FROM THE LENDER, THE FINANCIAL AID OFFICE BATCHES THE LOANS AND SENDS THEM TO THE BUSINESS OFFICE. THE BUSINESS OFFICE VERIFIES FUNDS AND THEN CREDITS THE STUDENTS ACCOUNT. SOMETIMES CHECKS ARE SENT IN THE STUDENTS AND PIUS NAME. THESE ARE DEPOSITED SEPARATELY INTO THE BANK ACCOUNT BY THE BUSINESS OFFICE. CHECKS ARE SIGNED BY THE STUDENT, AND PIU POSTS CHECKS TO THE STUDENT'S ACCOUNT. LOANS COME IN TWO DISBURSEMENTS - GENERALLY ONE FOR FIRST SEMESTER AND ONE FOR SECOND. THE WHOLE DISBURSEMENT IS APPLIED TO THE STUDENTS ACCOUNT. COST OF ATTENDANCE IS ALWAYS GREATER THAN LOAN PROCEEDS AND ALL OTHER FINANCIAL ASSISTANCE. ANY EXCESS CAN BE WITHDRAWN BY THE STUDENT FOR LIVING EXPENSES. PELL, SEOG & FWS - PIU IS GIVEN AN INITIAL AUTHORIZATION FOR FUNDS BY THE DEPARTMENT OF EDUCATION FOR WHICH IT CANNOT EXCEED. PIU CALLS DOWN THE FUNDS THROUGH GAPS AND THE MONEY IS ELECTRONICALLY DEPOSITED INTO A SEPARATE FEDERAL FUNDS ACCOUNT AT LEXINGTON STATE BANK, THEN THEY ARE SWEPT INTO AN INVESTMENT ACCOUNT EACH NIGHT BY THE BANK. THE FUNDS ARE ONLY REQUESTED AFTER DISBURSEMENT TO STUDENTS ACCOUNT, PER FWS, FUNDS ARE PAID TO THE STUDENTS THROUGH PIU PAYROLL AS EARNED."
201801349349306060,231352661,"Schedule I, Part I, Line 2",Student financial need is substantiated based on information provided in the Free Application for Federal Student Aid -- FAFSA. Additionally some aid is given based on High School GPA or standardized test (SAT or ACT) scores. Title IV funds are handled in accordance with applicable provisions. The Financial Aid program is audited in compliance with the Federal OMB A-133 guidelines and no deficiencies were found during the time period covered by this filing.
