object_id,ein,FrmAndLnRfrncDsc,ExplntnTxt
201831009349301028,620535755,"PART I, LINE 2:","THE COLLEGE DOES NOT GIVE ANY NON-CASH SCHOLARSHIPS. SCHOLARSHIPS ARE DISBURSED TO STUDENTS THROUGH CREDITING THEIR STUDENT ACCOUNTS. IF THE STUDENT HAS ANY EXCESS SCHOLARSHIP FUNDS OVER THEIR CHARGES, THESE FUNDS ARE DISBURSED TO THE STUDENT BY CHECK. THE COLLEGE'S PROCEDURES FOR MONITORING GRANT FUNDS IN THE U.S. ARE AS FOLLOWS: THE COLLEGE HAS APPOINTED DIRECTORS, WHO REPORT TO THE APPROPRIATE VICE PRESIDENTS, OVER ALL FEDERAL GRANT PROGRAMS. THESE DIRECTORS ARE CHARGED WITH PERFORMING ALL GRANT-RELATED ACTIVITIES INCLUDING APPLICATION, MONITORING OF EXPENDITURES AND REPORTING, WITH THE EXCEPTION OF DRAW-DOWNS OF FEDERAL FUNDS. DRAW-DOWNS ARE PERFORMED BY THE COLLEGE'S CONTROLLER AFTER REQUESTS ARE MADE BY THE DIRECTOR TO THE CONTROLLER. THE CONTROLLER REVIEWS THE REQUESTS FOR DRAW-DOWNS, WHICH INCLUDE DOCUMENTATION OF ALL DIRECT AND INDIRECT PROGRAM EXPENSES, BEFORE MAKING THE DRAW-DOWNS. A SINGLE AUDIT IS PERFORMED ANNUALLY BY THE COLLEGE'S INDEPENDENT AUDITORS."
201810999349300221,581216007,"PART I, LINE 2","PROCEDURES FOR MONITORING THE USE OF GRANT FUNDS Annually tuition discount expenditures are projected and budgeted for the upcomiNg budget cycle. Projections are prepared by the Director of Student Administrative Services, delivered to the Director of Budget and submitted for approval to the Executive Vice President of Finance and the Board of Trustees. Various constituencies across campus are ""allocated"" a certain amount of funding to award to students, within the budgeted amounts. These awards are submitted to the Executive Vice President of Finance for approval and then routed to the Director of Student Administrative Services who then, through the Director of Financial Aid, oversees the packaging of these awards and integration with other financial aid awards to insure that no students with federal financial aid are over-awarded. Since these awards are tuition-based, they are posted to students' accounts each quarter once schedules are locked and total tuition amounts can be verified by the Director of Student Accounts and staff. Quarterly, the Director of Student Administrative Services compares actual expenses to budgeted amounts and alerts the budget manager of any potential overages. The budget is reviewed in each case to make sure overages will not cause fiscal issues. If it appears that they will, adjustments are recommended by the Director of Budget to the Executive Vice President of Finance."
201801029349300045,440567385,"FORM 990, SCHEDULE I, PART I, LINE 2",MONITORING OF GRANT USE: ALL GRANTS ARE APPLIED TO STUDENT ACCOUNTS AFTER VERIFYING ENROLLMENT STATUS ON AN INDIVIDUAL BASIS.
201840659349300859,440483220,"PART I, LINE 2:",THE ORGANIZATION GIVES TUITION REDUCTION SCHOLARSHIPS TO INDIVIDUALS BASED ON NEED AND ACADEMIC EXCELLENCE.
201830759349300838,363005527,"Part I, Line 2:","The Chicago School of Professional Psychology gives need-based and merit-based scholarships. Need-based scholarships are monitored through the Department of Education FAFSA form. Students With $0 estimated family contribution (EFC), based on the Department of Education guidelines, will be automatically awarded a need-based scholarship. Merit-based scholarships are granted to students who submit all required documentation by certain deadlines and apply with a 4.0 undergraduate GPA or GRE score of 1300 (test taken prior to August 1, 2011) or a combined GRE score of 314 (test taken on or after August 1, 2011). The Chicago School and its partners award fellowships to students who contribute to the academic community in and outside the classroom. Fellowship recipients dedicate 10 to 15 hours a week of work to the specific department through which the fellowship is offered. Applicants are judged on their ability to demonstrate a commitment to learning, developing, and participating in the programmatic, research, and administrative activities within the department office."
201800759349301200,952592468,"Part I, Line 2:","Santa Barbara & Ventura Colleges of Law provides scholarships to new and continuing students. These scholarships are dependent upon factors such as alumni recommendations, academic standing, and other criteria related to admission/participation in the program. Santa Barbara & Ventura Colleges of Law maintains records of the scholarship award amounts, evidence of good academic standing and criteria for scholarship selection."
201820739349300342,710239576,"Part I, Line 2:","Although students and their families bear the primary responsibility for meeting costs, many find they cannot pay the full cost of an education by themselves. In most cases a financial aid package will involve family contributions, acceptance of federal assistance (including grants and loans), and financial aid from John Brown University. These financial assistance programs help fill the gap between the amount a family is expected to pay and the total educational cost. The amount the family is expected to pay is based on information provided on the Free Application for Federal Student Aid (FAFSA)."
201820819349301002,161554414,"Schedule I, Part I, Line 2",Our financial aid office awards scholarships to students based on submitted FAFSA data and academic performance. The financial aid office is responsible for ensuring compliance with all relevant state and federal requirements relative to grant-based aid.
201801029349300930,750800689,"SCHEDULE I, PAGE 1, PART I, LINE 2","THE UNIVERSITY PROVIDES FINANCIAL AID TO STUDENTS TO ENABLE THEM TO ATTEND THE UNIVERSITY. ALL FINANCIAL AID RECIPIENTS ARE SELECTED ON AN EQUAL OBJECTIVELY DETERMINABLE BASIS WITH OTHER RECIPIENTS. THAT IS, ALL STUDENTS RECEIVING SCHOLARSHIPS AND FELLOWSHIPS ARE JUDGED WORTHY BASED ON THE UNIVERSITY'S ASSESSMENT OF ACADEMIC ACHIEVEMENT, FINANCIAL NEED AND OTHER SIMILAR STANDARDS. A LIST OF RECIPIENTS OF SCHOLARSHIPS AND FELLOWSHIPS IS MAINTAINED IN THE UNIVERSITY'S FINANCIAL AID OFFICE."
201820979349300602,381367080,"Part I, Line 2:","STUDENTS RECEIVE SCHOLARSHIPS AS CREDITS AGAINST TUITION. THESE SCHOLARSHIPS CAN BE BASED ON NEED, ACADEMIC PERFORMANCE, AND/OR ATHLETICS."
201801029349301355,570314406,"Part I, Line 2:","The financial aid planning office requires students to complete the free application for federal student aid (FAFSA) form to determine eligibility for federal, state and institutional grants, scholarships and loans. This is an equitable formula that measures all assets consistently. In addition to this form, the institution does require some other guidelines in the event that funds are offered based on certain academic credentials or performance in a university sponsored activity or athletic event. These credentials are clearly stated in the university catalog and the university website. Enrollment and eligibility are monitored by the University."
201840449349300544,042620216,"Part I, Line 2:",THE college PROVIDES ONGOING OVERSIGHT AND MONITORING TO ASSURE THE ACHIEVEMENT OF THE INTENDED PURPOSES AND TIMELY EXPENDITURES OF GRANT FUNDS.
201810819349301201,340714818,"PART I, LINE 2:","THESE FUNDS REPRESENT FINANCIAL AID ISSUED TO STUDENTS IN THE FORM OF FEDERAL AND STATE GRANTS, SCHOLARSHIPS, TUITION DISCOUNTS, AND INSTITUTIONAL FINANCIAL AID. STUDENTS RECEIVING SCHOLARSHIPS AND GRANTS FROM FRANCISCAN UNIVERSITY ARE MONITORED TO ENSURE THEY MEET THE ACADEMIC REQUIREMENTS OR OTHER CRITERIA ASSOCIATED WITH THE RESPECTIVE AWARD. ALL AID IS PROCESSED THROUGH THE FINANCIAL AID OFFICE AND IS POSTED TO THE STUDENTS' RECEIVABLE ACCOUNTS."
201840679349300319,941156485,"PART I, LINE 2:","CCA MERIT SCHOLARSHIPS ARE AWARDED TO STUDENTS THAT COMPLETE ADMISSION APPLICATION REQUIREMENTS BY THE PUBLISHED DEADLINE AND ARE BASED ON ACADEMIC ACHIEVEMENT AND PORTFOLIO REVIEW. NEED-BASED SCHOLARSHIPS ARE AWARDED TO STUDENTS WITH DEMONSTRATED FINANCIAL NEED AND ACADEMIC ACHIEVEMENT. RECIPIENTS OF NEED-BASED SCHOLARSHIPS AND SEOG FUNDS MUST COMPLETE A FAFSA APPLICATION, BE US CITIZENS OR ELIGIBLE NON-CITIZENS, AND BE ENROLLED FULL-TIME."
201841029349300239,020263136,"Schedule I, Part I, Line 2",All assistance is in the form of grants and scholarships. These funds are applied directly to the student's account.
201840979349300004,630288841,"Part I, Line 2:","Disbursements in furtherance of the institution's exempt programs are made in accordance with procedures or subject to conditions established by the institution's governing board designed to insure that individuals and organizations receiving disbursements from this organization in furtherance of its exempt programs are adequately investigated to insure that they are qualifying recipients as to academic achievement, financial need, and other similar standards."
201810559349300511,610466713,"Part I, Line 2:",SCHOLARSHIPS ARE MONITORED BY THE FINANCIAL AID OFFICE AND THE BUSINESS OFFICE. THE FINANCIAL AID OFFICE AWARDS ALL SCHOLARSHIPS TO STUDENTS BASED ON THEIR FINANCIAL NEED AND ACADEMIC MERIT. THE BUSINESS OFFICE MONITORS SCHOLARSHIPS BASED ON THE SATISFACTORY ACADEMIC PROGRESS POLICY INSTITUTED BY THE INSTITUTION. BOTH THE FINANCIAL AID OFFICE AND BUSINESS OFFICE RECONCILE ALL SCHOLARSHIPS EACH SEMESTER TO VERIFY THAT THEY INDEED ARE CORRECT ON THE STUDENTS ACCOUNT AND IN THE G/L SYSTEM.
201830759349300128,942155109,"Part I, Line 2:",Saybrook keeps detailed records for all student grants. Records include the need of the students and their progress toward a degree.
201800969349300110,160759798,"Schedule I, Part I, Line 2",Student financial aid is credited to the individual student accounts and their net balances are monitored by the Business Office.
201810579349301301,350868074,Grantmaker's Description of How Grants are Used,"THE UNIVERSITY EXECUTES SUB-AWARD AGREEMENTS WITH THE GRANTEES THAT OUTLINE AWARD EXPECTATIONS. GRANTEES SUBMIT DETAILED INVOICES THAT ARE APPROVED FOR PAYMENT BY THE PRINCIPAL INVESTIGATORS AND THE OFFICE OF FISCAL AFFAIRS AND ADMINISTRATION. PAYMENT IS MADE ON A REIMBURSEMENT BASIS ONLY. GRANTEES ARE REQUIRED TO SUBMIT PROJECT REPORTS PERIODICALLY TO PRINCIPAL INVESTIGATORS. GRANTEES RECEIVING FEDERAL FUNDS AS SUBRECIPIENTS ARE REQUIRED TO PROVIDE AN OMB CIRCULAR A-133 COMPLIANCE LETTER ANNUALLY, ALONG WITH A COPY OF AUDIT REPORTS."
201810789349300901,540646523,"PART I, LINE 2:","THE MAJORITY OF INSTITUTIONAL AID AWARDED TO STUDENTS IS BASED ON ACADEMIC MERIT, FOR WHICH THE UNIVERSITY HAS A PREDETERMINED GRID THAT PROVIDES THE AMOUNTS TO BE AWARDED BASED ON THE STUDENTS ACTUAL GPA AND TEST SCORES AND AS NEEDED, EVALUATION BY THE UNIVERSITY'S SCHOLARSHIP COMMITTEE. OTHER INSTITUTIONAL AID CONSISTS OF RETURN MISSIONARY, TALENT AND OTHER NEED-BASED GRANTS. RETURNED MISSIONARY SCHOLARSHIPS ARE AWARDED IN THE AMOUNT OF $1,500 PER YEAR TO ALL FULL-TIME STUDENTS WHO HAVE COMPLETED A MISSION FOR THE CHURCH OF JESUS CHRIST OF LATTER-DAY SAINTS. TALENT SCHOLARSHIPS ARE AWARDED IN VARIOUS AMOUNTS, TYPICALLY BETWEEN $500 AND $2,000 PER STUDENT, AND ARE AWARDED BASED ON THE NOMINATION OF THE UNIVERSITY FACULTY, ART/THEATRE/MUSIC DIRECTOR, ETC. AND APPROVAL OF THE FINANCIAL AID COMMITTEE. UNIVERSITY GRANTS AND VARIOUS OTHER GRANTS ARE AWARDED AS DETERMINED BY THE FINANCIAL AID DIRECTOR. FEDERAL & STATE GRANTS, INCLUDING PELL, SEOG, SMART, AND VTAG ARE AWARDED TO STUDENTS WHO COMPLETE A FREE APPLICATION FOR FEDERAL STUDENT AID (FAFSA) AND MEET THE VARIOUS QUALIFICATIONS. FEDERAL AND STATE GRANTS ARE VERIFIED INTERNALLY BY OUR FINANCIAL AID STAFF. THE DEPARTMENT OF EDUCATION (DOE) SELECTS A MINIMUM 30% OF ALL STUDENTS WHO COMPLETE A FAFSA TO VERIFY. THE UNIVERSITY PROVIDES THE APPROPRIATE VERIFICATION DOCUMENTATION TO THE DOE AND MAINTAINS A COPY OF THESE DOCUMENTS ON FILE."
201810089349300091,362177133,"PART I, LINE 2:","THE UNIVERSITY'S OFFICE OF FINANCIAL AID ADMINISTERS A WIDE VARIETY OF FEDERAL, STATE, INSTITUTIONAL AND PRIVATE FINANCIAL ASSISTANCE PROGRAMS. ITS MAJOR OBJECTIVE IS THE EQUITABLE DISTRIBUTION OF FINANCIAL AID TO ALL STUDENTS WITH AN ULTIMATE GOAL OF HELPING THEM FINANCE THEIR EDUCATION. RECIPIENTS ARE DETERMINED BY ACADEMIC MERIT AS WELL AS FEDERAL, STATE AND INSTITUTIONAL GUIDELINES AND RECIPIENTS MUST MAINTAIN CERTAIN ELIGIBILITY REQUIREMENTS TO RECEIVE FINANCIAL AID AND SCHOLARSHIPS."
201820549349300637,390477970,"Part I, Line 2:","For federal and state financial aid grants, individual FAFSA and personal tax returns are verified for recipient eligibility. Several layers of supervisory approvals are built into the internal financial aid process. For other federally funded grants (NIH, etc.), activity is administered by a dedicated employee, subject to several layers of supervisory review and approval. Payroll costs and other allocated expenditures are documented and reviewed by the Finance Dept. as well at external auditors."
201810519349300881,730739626,"Part I, Line 2:",The University makes occasional donations to charitable organizations which are not monitored beyond the original grant determination process.
201820529349300207,592961536,"PART I, LINE 2:","PRIMARILY STUDENTS ARE AWARDED BEACON SCHOLARSHIP AND GRANT AID (DISCOUNTED EDUCATION COSTS) BASED ON DEMONSTRATING FINANCIAL NEED AS DEFINED BY FEDERAL STUDENT AID GUIDELINES. THE DISCOUNT APPLIED IS AWARDED ON A FORMULA ASSIGNING THE LARGEST BEACON DISCOUNT TO THE NEEDIEST STUDENTS. THERE ARE A FEW SCHOLARSHIPS(DISCOUNTS) AWARDED BASED ON RECOMMENDATIONS FROM EDUCATIONAL PROFESSIONALS(PROFESSIONAL EDUCATOR SCHOLARSHIP)AND/OR A GRANT (RAISE ME) OFFERED TO STUDENTS WHO ACHIEVED SPECIFIC ACCOMPLISHMENTS IN HIGH SCHOOL. IN THESE CASES EVERYONE AUTOMATICALLY RECEIVES THE SAME LEVEL OF REDUCTION BASED ON PREDETERMINED CRITERIA. INTERNATIONAL STUDENTS ARE ALSO ELIGIBLE TO RECEIVE AN EDUCATIONAL COST REDUCTION BY DEMONSTRATING FINANCIAL NEED. THESE GRANTS VARY AND ARE DETERMINED BY THE STUDENT'S FINANCIAL CIRCUMSTANCES. IN ORDER FOR STUDENTS TO CONTINUE TO RECEIVE NEED-BASED BEACON COLLEGE GRANTS AND SCHOLARSHIPS, STUDENTS MUST RE-APPLY EACH YEAR USING THE FEDERAL APPLICATION FOR STUDENT AID. STUDENTS MUST ALSO REMAIN IN GOOD ACADEMIC STANDING AS DESCRIBED IN THE BEACON ACADEMIC CATALOG. SHOULD THE STUDENT/FAMILY FINANCIAL CIRCUMSTANCE CHANGE, THE STUDENT MAY RECEIVE A REDUCTION OR INCREASE IN A BEACON GRANT. IN THE CASE OF NON-NEED BASED BEACON COLLEGE GRANTS; STUDENTS ARE MONITORED ANNUALLY TO ASSURE THEY ARE MAINTAINING GOOD ACADEMIC STANDING."
201840819349300544,381945965,"Part I, Line 2:","DAVENPORT UNIVERSITY PROVIDES FUNDING FOR STUDENT SCHOLARSHIPS AND TUITION DISCOUNTS BASED ON MERIT, FINANCIAL NEED, SPECIAL CRITERIA BASED ON RESTRICTED ENDOWMENT FUNDS, AND INFORMATION PROVIDED BY THE STUDENT ON THE SCHOLARSHIP APPLICATION. ALLOCATIONS ARE DETERMINED FOR EACH ACCOUNT BY THE ACCOUNTING AND ALUMNI AND DEVELOPMENT OFFICES AND DISTRIBUTED TO THE FINANCIAL AID OFFICER RESPONSIBLE FOR SCHOLARSHIPS. THE FINANCIAL AID OFFICE IS RESPONSIBLE FOR COMMUNICATING AWARD GUIDELINES, PROCEDURES, AND REQUIREMENTS, AS WELL AS AWARD AMOUNTS, TO ACCOUNTS RECEIVABLE AND OTHER DEPARTMENTS AS NECESSARY TO ENSURE THE ACCURACY OF THE AWARDS. IN ADDITION, THE FINANCIAL AID OFFICE IS RESPONSIBLE FOR ENSURING THAT AWARDS ARE MADE IN CONJUNCTION WITH THE SCHOLARSHIP CRITERIA AND AWARDED IN THE AMOUNT APPROVED BY THE ALUMNI AND DEVELOPMENT OFFICE."
201840819349300344,610448560,"PART I, LINE 2:",ALL STUDENT AID AND SCHOLARSHIPS ARE USED FOR TUITION AND RELATED EXPENSES AT THE COLLEGE.
201830649349300718,520591694,"Part I, Line 2:","A list of scholarship recipients is on file at the institution and is available on request. All recipients are selected on an equal, objectively determinable basis according to the requirements for each scholarShip and/or aid for which the recipient is applying. That is, all students receiving scholarships and fellowships are judged worthy by the institution's assessment on the basis of academic achievement, financial need, and other similar standards. All scholarships and financial aid have academic requirements which the recipients need to maintain to continue receiving aid. students do not receive cash grants. rather, all financial aid is treated as a reduction to tuition."
201840879349300324,930386858,"Part I, Line 2:","ASSISTANCE IS GIVEN TO INDIVIDUALS IN THE FORM OF CREDITS TOWARD THE COST OF TUITION, AND A RECORD OF THE ASSISTANCE PROVIDED IS RECORDED IN SEPARATE ACCOUNTS MAINTAINED FOR EACH STUDENT/RECIPIENT."
201800729349300230,570314365,Grantmaker's Description of How Grants are Used,"The College's procedures for monitoring the use of grant funds requires verification of 1) enrollment status, 2) number of hours enrolled, 3) number of earned credit hours, 4) GPA, and 5) housing status. In addition, a review of student academic performance and grades of incomplete, if applcable, is conducted each semester to determine overall standing in relation to College's established Satisfactory Academic Policy (SAP)."
201800729349300415,410854766,"Sch. I, Part 1, line 2:",All scholarships and grants made by the Seminary are to its students to cover costs of tuition and related expenses. All students who apply follow established financial aid and scholarship policies and procedures. Students also complete the FAFSA as part of this process.
201810689349301181,470376524,"PART I, LINE 2:","ALL SCHOLARSHIP AND GRANTS ARE AWARDED TO STUDENTS BASED ON CRITERIA AS SET BY THE STUDENT FINANCIAL AID POLICIES. THESE SCHOLARSHIPS AND GRANTS ARE POSTED DIRECTLY TO THE STUDENT'S ACCOUNT TO BE APPLIED AGAINST CHARGES FOR TUITION, FEES, ROOM, AND BOARD."
201810689349301256,364682140,"Part I, Line 2:",Grant funds consist mainly of institutional discounts for employees of APUC. The scholarships are applied directly to students' accounts.
201830479349300723,430652649,PART III,ALL STUDENT AID AWARD LETTERS ARE PREPARED BY LINDENWOOD COLLEGE'S FINANCIAL AID OFFICE. EACH AWARD LETTER HAS A STATEMENT OF CONDITIONS AND IS SIGNED BY THE STUDENT. THE BUSINESS OFFICE POSTS ALL AID TO THE STUDENT'S ACCOUNT FOR ACADEMIC USAGE. BOTH THE BUSINESS OFFICE AND THE FINANCIAL AID OFFICE MONITOR THESE FUNDS.
201820959349300342,480623882,"SCHEDULE I, PART I, LINE 2",GRANT EXPENDITURES ARE AUTHORIZED BY THE PI; ACCOUNTING DEPT VERIFIES EXP BEFORE DRAWING FUNDS. GRANTS APPLICABLE TO EACH PROGRAM WITH STANDARDS SET FORTH IN OMB CIRCULAR A-133. SCHOLARSHIPS ARE GRANTS TO STUDENTS AND ARE APPLIED DIRECTLY TO THE STUDENT'S ACCOUNT BY THE COLLEGE.
201830819349300548,135562314,MONITORING USE OF GRANT FUNDS IN THE US,"THE UNIVERSITY AWARDS FEDERAL AND STATE FINANCIAL AID FUNDS EACH YEAR BASED YPON A STUDENT'S FINANCIAL NEED. ADDITIONALLY, THE UNIVERSITY PROVIDES INSTITUTIONAL AID VIA UNIVERSITY GRANTS ON THE BASIS OF ACADEMIC ACHIEVEMENTS, FINANCIAL NEED, AND OTHER STANDARDS. THE OFFICE OF FINANCIAL AID VERIFIES THE ACADEMIC ACHIEVEMENTS AND THE PERSONAL INCOME DATA PROVIDED FOR ON THE FREE APPLICATION FOR FEDERAL STUDENT AID (FAFSA) OF EACH STUDENT TO DETERMINE THE AMOUNT OF AID AWARDED ON AN AS NEEDED BASIS. THE UNIVERSITY ALSO OFFERS SCHOLARSHIPS FUNDED THROUGH SPECIAL ENDOWMENTS AND DONATIONS, WHICH ARE AWARDED BASED ON SIMILAR STANDARDS AS WELL AS DONOR'S CRITERIA. THE OFFICES OF FINANCIAL AID AND FINANCE CONTINUOUSLY MONITOR STUDENT ELIGIBILITY FOR THESE AWARDS."
201840089349300414,590624401,"PART I, LINE 2:","GRANTS ARE APPLIED DIRECTLY TO STUDENT ACCOUNTS. THE COLLEGE MONITORS STUDENT TUITION ACCOUNTS FOR ANY STUDENT WHO RECEIVED A SCHOLARSHIP OR TUITION CREDIT. THE BURSAR'S OFFICE AND THE FINANCIAL AID OFFICE ENSURE THAT STUDENTS WHO RECEIVE SCHOLARSHIPS OR TUITION CREDITS MAINTAIN FULL-TIME OR PART-TIME STUDENT STATUS AND MEET ALL OTHER REQUIREMENTS, AS REQUIRED BY THE AWARDED SCHOLARSHIP, SO THAT THE FUNDS ARE USED FOR THEIR INTENDED PURPOSE."
201800609349301550,951643992,GRANT RECORDS/MONITORING,"SCHEDULE I, PART I, LINE 2 GRANTS AND OTHER ASSISTANCE REPRESENT STUDENT FINANCIAL AID. WHEN AWARDING AID, CHAPMAN UNIVERSITY FOLLOWS ALL LAWS AND REGULATIONS OF FEDERAL AND STATE OF CALIFORNIA AID PROGRAMS. FOR MORE INFORMATION, VISIT OUR WEBSITE AT WWW.CHAPMAN.EDU."
201800559349300805,381359083,"SCHEDULE I, PAGE 1, PART I, LINE 2",SCHOLARSHIPS AND AWARDS ARE PLACED DIRECTLY INTO EACH STUDENT'S ACCOUNT WITH THE COLLEGE. THE SCHOLARSHIPS AND AWARDS ARE USED TO PAY THE COST OF TUITION AND FEES OF THE COLLEGE.
201820649349300312,460283336,"PART I, LINE 2:","THE COLLEGE HAS A NUMBER OF FEDERAL AND STATE GRANTS. WITH THE ISSUANCE OF EACH AWARD A TEMPORARILY RESTRICTED ACCOUNT IS CREATED IN THE DATABASE. AWARD LETTERS ARE KEPT IN A SEPARATE FILE WITH THE PRIMARY CONTACT INFORMATION. IF THE GRANTEE DOES NOT HAVE ELIGIBILITY THE GRANT IS NOT AWARDED. IF THE ELIGIBILITY OF THE GRANTEE HAS CHANGED THE INSTITUTION RETURNS THE AWARDED FUNDS. THE GRANTS ARE BASED ON FAMILY INCOME CONTRIBUTIONS, AND/OR ACADEMIC STANDING, AND/OR ATHLETIC ABILITY, AND/OR INDIVIDUAL TALENT."
201800749349300505,340714687,"SCHEDULE I, PART I, LINE 2","PROCEDURES FOR MONITORING THE USE OF GRANT FUNDS TO U.S. AFTER A STUDENT HAS BEEN ACCEPTED TO THE UNIVERSITY OF MOUNT UNION, THEY MUST FILE A FAFSA. MOUNT UNION CONSIDERS ACADEMIC SCHOLARSHIPS, OUTSIDE SCHOLARSHIPS, FEDERAL GRANTS AND STATE ELIGIBILITY IN THAT RESPECTIVE ORDER. IF THE STUDENT NEEDS FURTHER ASSISTANCE, THE COLLEGE OFFERS FEDERAL LOANS, COLLEGE GRANTS AND EMPLOYMENT OPPORTUNITIES. FINANCIAL AID BASED ON NEED IS AWARDED ON FAFSA CALCULATIONS AND THE RESULTING FINANCIAL AID THAT IS TO BE MET. ACADEMIC SCHOLARSHIPS ARE AWARDED BASED ON HIGH SCHOOL GPA, CLASS RANK AND STANDARD TEST SCORES. NEED-BASED GRANTS CAN BE ALLOCATED TO RETURNING STUDENTS BASED ON PREVIOUS YEARS AS LONG AS FINANCIAL NEED IS STILL PRESENT. ACADEMIC SCHOLARSHIPS CONTINUE BASED ON THE STUDENT'S CUMULATIVE GPA AT THE END OF THE YEAR."
201840579349301209,390833608,"Schedule I, Part I, Line 2","CUI awards scholarships and financial aid to students based on financial need, talent, and/or other academic merit and programs. Federal and State programs are awarded based on respective program requirements. Federal and State programs are compliance tested yearly in conjunction with the independent audit and auditor reports/newsletters are submitted to all organizations as required by the programs."
201820579349300852,231352620,"Schedule I, Part I, Line 2","Arcadia University awards both need-based and merit-based financial aid to students in good academic standing. The University maintains records to quantify the dollar amount of the financial assistance awarded, the number of recipients per grant/scholarship, and the selection criteria. All grants and scholarships awarded to students are credited directly to the student's billing account."
201820399349300947,382410852,"Schedule I, Part I, Line 2",The grants are distributed to the student accounts as payments to offset tuition costs.
201820399349301062,440545914,"SCHEDULE I, PART I, LINE 2",THE SCHOLARSHIPS/FINANCIAL AID AWARDED TO STUDENTS IS APPLIED AGAINST THEIR TUITION ACCOUNTS.
201820269349300207,560554199,"PART I, LINE 2:","STUDENTS ARE REQUIRED TO COMPLETE A FAFSA. ELIGIBILITY FOR SCHOLARSHIPS IS DETERMINED BY THE APPLICABLE FEDERAL AND STATE GUIDELINES, BY THEIR ACADEMIC CREDENTIALS, AND FINANCIAL NEED. STUDENTS ARE APPROPRIATELY AWARDED SCHOLARSHIPS IN THE FINANCIAL AID OFFICE AND THE AWARDS ARE TRANSFERRED TO THE STUDENTS' ACCOUNTS IN THE BUSINESS OFFICE. ALL SCHOLARSHIP AND GRANT FUNDS ARE RECONCILED EACH SEMESTER AND REPORTED TO THE APPROPRIATE AUTHORITIES OR AGENCIES. FUNDS ARE ALSO AUDITED ANNUALLY."
201830449349300318,480543736,"SCHEDULE I, PAGE 4, PART IV","ALL SCHOLARSHIPS & GRANTS ARE AWARDED TO STUDENTS ATTENDING MCPHERSON COLLEGE. THESE SCHOLARSHIPS & GRANTS ARE NON-CASH AWARDS, REQUIRING THE AWARDS TO BE USED AS A DIRECT REDUCTION IN TUITION COST."
201800539349300635,751081109,"SCHEDULE I, PART I, LINE 2","GRANTS ARE AWARDED BASED ON ESTABLISHED CRITERIA FOR EACH GRANT. THE AVAILABILITY OF FUNDS, THE NEED PER FAFSA, AND THE DATE OF THE APPLICATION ARE ALSO CONSIDERED. THE FUNDS ARE AWARDED AND DISBURSED AFTER ALL ELIGIBILITY CRITERIA HAVE BEEN CONFIRMED. TUITION WAIVERS MUST FOLLOW THE APPROVAL PROCESS OUTLINED IN THE HUMAN RESOURCES HANDBOOK. WAIVERS ARE AWARDED AND DISBURSED BASED ON THE SCHOOL YEAR AND SEMESTER REGISTRATION."
201702799349300445,741180151,"PART I, LINE 2:","THE UNIVERSITY ABIDES BY THE REGULATORY PROVISIONS SET ASIDE IN ALL GRANT AWARDS TO ENSURE PROPER FINANCIAL AND PROGRAMMATIC REPORTING. THE UNIVERSITY'S OFFICE OF SPONSORED PROGRAMS (OSP) PROVIDES OVERSIGHT AND MONITORING OF ALL GRANTS. OSP RECEIVED MONTHLY, QUARTERLY, AND ANNUAL REPORTS FROM ALL GRANTS FUNDED PROJECT DIRECTORS (PD) AND PROJECT INVESTIGATORS (PI) ASSOCIATED WITH THE IMPLEMENATION OF THE GRANT AWARDS. OSP MEETS WITH THE PDS AND PIS WEEKLY TO ENSURE THAT THE GRANTS ARE ON TARGET FOR COMPLETION. OSP WORKS CONJUNCTIVELY WITH THE DEPARTMENT OF ADMINISTRATION AND FINANCE TO MONITOR AND RECONCILE ALL FINANCIAL OBLIGATIONS WITHIN GRANTS AND CONTRACTS."
