object_id,ein,DsrgrddEnttyNm_BsnssNmLn1Txt,USAddrss_AddrssLn1Txt,USAddrss_CtyNm,USAddrss_SttAbbrvtnCd,USAddrss_ZIPCd,IdRltdTxExmptOrg_EIN,IdRltdTxExmptOrg_PrmryActvtsTxt,IdRltdTxExmptOrg_LglDmclSttCd,IdRltdTxExmptOrg_ExmptCdSctnTxt,IdRltdTxExmptOrg_PblcChrtySttsTxt,IdRltdTxExmptOrg_DrctCntrllngNACd,IdRltdTxExmptOrg_CntrlldOrgnztnInd
202121349349302757,311308555,ST MARY'S HEALTH CARE SYSTEM INC,1230 BAXTER STREET,ATHENS,GA,30606,580566223,HEALTH CARE AND HOSPITAL SERVICES,GA,501(C)(3),LINE 3,TRINITY HEALTH CORPORATION,1
202121349349302757,311308555,ST MARY'S HIGHLAND HILLS INC,1230 BAXTER STREET,ATHENS,GA,30606,020576648,SENIOR LIVING COMMUNITY,GA,501(C)(3),LINE 3,ST MARY'S HEALTH CARE SYSTEM INC,1
202121349349302757,311308555,ST MARY'S MEDICAL GROUP INC,1230 BAXTER STREET,ATHENS,GA,30606,261858563,HEALTH CARE SERVICES,GA,501(C)(3),LINE 3,ST MARY'S HEALTH CARE SYSTEM INC,1
202121349349302757,311308555,ST MARY'S SACRED HEART HOSPITAL INC,367 CLEAR CREEK PARKWAY,LAVONIA,GA,30553,473752176,HEALTH CARE AND HOSPITAL SERVICES,GA,501(C)(3),LINE 3,ST MARY'S HEALTH CARE SYSTEM INC,1
202121349349302757,311308555,ST PETER'S HEALTH PARTNERS,315 SOUTH MANNING BLVD,ALBANY,NY,12208,453570715,HEALTH CARE SYSTEM MANAGEMENT AND SUPPORT,NY,501(C)(3),"LINE 12B, II",TRINITY HEALTH CORPORATION,1
202121349349302757,311308555,ST PETER'S HEALTH PARTNERS MEDICAL ASSOCIATES PC,315 SOUTH MANNING BLVD,ALBANY,NY,12208,461177336,HEALTH CARE SERVICES,NY,501(C)(3),LINE 3,ST PETER'S HEALTH PARTNERS,1
202121349349302757,311308555,ST PETER'S HOSPITAL,315 SOUTH MANNING BLVD,ALBANY,NY,12208,141348692,HEALTH CARE AND HOSPITAL SERVICES,NY,501(C)(3),LINE 3,ST PETER'S HEALTH PARTNERS,1
202121349349302757,311308555,ST PETER'S HOSPITAL FOUNDATION INC,310 SOUTH MANNING BLVD,ALBANY,NY,12208,222262982,FOUNDATION,NY,501(C)(3),LINE 7,ST PETER'S HEALTH PARTNERS,1
202121349349302757,311308555,SUNNYVIEW HOSPITAL AND REHABILITATION CENTER,1270 BELMONT AVENUE,SCHENECTADY,NY,12308,141338386,HEALTH CARE AND HOSPITAL SERVICES,NY,501(C)(3),LINE 3,ST PETER'S HEALTH PARTNERS,1
202121349349302757,311308555,SUNNYVIEW HOSPITAL AND REHABILITATION CENTER FOUNDATION INC,1270 BELMONT AVE,SCHENECTADY,NY,12308,222505127,FOUNDATION,NY,501(C)(3),LINE 7,SUNNYVIEW HOSPITAL AND REHABILITATION CENTER,1
202121349349302757,311308555,THE AUXILIARY OF ST JOSEPH'S HOSPITAL HEALTH CENTER INC,301 PROSPECT AVENUE,SYRACUSE,NY,13203,203018640,VOLUNTEER SERVICE AUXILIARY,NY,501(C)(3),LINE 10,ST JOSEPH'S HOSPITAL HEALTH CENTER FOUNDATION INC,1
202121349349302757,311308555,THE BURDETT CARE CENTER INC,2215 BURDETT AVE,TROY,NY,12180,272153849,HEALTH CARE SERVICES,NY,501(C)(3),LINE 3,SAMARITAN HOSPITAL,1
202121349349302757,311308555,THE COMMUNITY HOSPICE FOUNDATION INC,445 NEW KARNER RD,ALBANY,NY,12205,222692940,FOUNDATION,NY,501(C)(3),LINE 7,THE COMMUNITY HOSPICE INC,1
202121349349302757,311308555,THE COMMUNITY HOSPICE INC,445 NEW KARNER RD,ALBANY,NY,12205,141608921,HOSPICE SERVICES,NY,501(C)(3),LINE 3,ST PETER'S HEALTH PARTNERS,1
202121349349302757,311308555,THE FOUNDATION OF SAINT JOSEPH REGIONAL MEDICAL CENTER INC,707 EAST CEDAR STREET STE 175,SOUTH BEND,IN,46617,351654543,FOUNDATION,IN,501(C)(3),LINE 7,SAINT JOSEPH REGIONAL MEDICAL CENTER INC,1
202121349349302757,311308555,THE JAMES A EDDY MEMORIAL GERIATRIC CENTER INC,2256 BURDETT AVE,TROY,NY,12180,222570478,LONG TERM CARE,NY,501(C)(3),LINE 10,LTC (EDDY) INC,1
202121349349302757,311308555,THE MARJORIE DOYLE ROCKWELL CENTER INC,421 WEST COLUMBIA ST,COHOES,NY,12047,141793885,LONG TERM CARE,NY,501(C)(3),LINE 10,LTC (EDDY) INC,1
202121349349302757,311308555,THE MERCY HOSPITAL INC,114 WOODLAND STREET,HARTFORD,CT,06105,043398280,HEALTH CARE AND HOSPITAL SERVICES,MA,501(C)(3),LINE 3,TRINITY HEALTH OF NEW ENGLAND CORP INC,1
202121349349302757,311308555,THE NORTHEAST HEALTH FOUNDATION INC,310 SOUTH MANNING BLVD,ALBANY,NY,12208,222743478,FOUNDATION,NY,501(C)(3),LINE 7,ST PETER'S HEALTH PARTNERS,1
202121349349302757,311308555,THE WOMEN'S AUXILIARY OF SAINT FRANCIS HOSPITAL AND MEDICAL CENTER INC,114 WOODLAND STREET,HARTFORD,CT,06105,060660403,VOLUNTEER SERVICE AUXILIARY,CT,501(C)(3),"LINE 12B, II",N/A,0
202121349349302757,311308555,THHS OAKLAND FKA CRANBROOK HOSPICE CARE,20555 VICTOR PARKWAY,LIVONIA,MI,48152,383320699,HOSPICE SERVICES (INACTIVE),MI,501(C)(3),LINE 10,TRINITY HOME HEALTH SERVICES,1
202121349349302757,311308555,TRI-HOSPITAL EMERGENCY MEDICAL SERVICES,309 GRAND RIVER,PORT HURON,MI,48060,382485700,HEALTH CARE SERVICES,MI,501(C)(3),"LINE 12A, I",N/A,0
202121349349302757,311308555,TRINITY CONTINUING CARE SERVICES,PO BOX 9184,FARMINGTON HILLS,MI,48333,382559656,LONG TERM CARE,MI,501(C)(3),LINE 10,TRINITY HEALTH CORPORATION,1
202121349349302757,311308555,TRINITY CONTINUING CARE SERVICES - INDIANA,PO BOX 9184,FARMINGTON HILLS,MI,48333,930907047,LONG TERM CARE,IN,501(C)(3),LINE 10,TRINITY CONTINUING CARE SERVICES,1
202121349349302757,311308555,TRINITY CONTINUING CARE SERVICES - MASSACHUSETTS,PO BOX 9184,FARMINGTON HILLS,MI,48333,824005577,LONG TERM CARE,MI,501(C)(3),LINE 10,TRINITY CONTINUING CARE SERVICES,1
202121349349302757,311308555,TRINITY HEALTH - MICHIGAN,20555 VICTOR PARKWAY,LIVONIA,MI,48152,382113393,HEALTH CARE AND HOSPITAL SERVICES,MI,501(C)(3),LINE 3,TRINITY HEALTH CORPORATION,1
202121349349302757,311308555,TRINITY HEALTH CORPORATION,20555 VICTOR PARKWAY,LIVONIA,MI,48152,351443425,HEALTH CARE SYSTEM MANAGEMENT AND SUPPORT,IN,501(C)(3),"LINE 12B, II",CATHOLIC HEALTH MINISTRIES,1
202121349349302757,311308555,TRINITY HEALTH LIFE PENNSYLVANIA INC,PO BOX 9184,FARMINGTON HILLS,MI,48333,475244984,PACE PROGRAM,PA,501(C)(3),LINE 10,TRINITY HEALTH PACE,1
202121349349302757,311308555,TRINITY HEALTH OF NEW ENGLAND CORPORATION INC,114 WOODLAND STREET,HARTFORD,CT,06105,061491191,HEALTH CARE SYSTEM MANAGEMENT AND SUPPORT,CT,501(C)(3),"LINE 12C, III-FI",TRINITY HEALTH CORPORATION,1
202121349349302757,311308555,TRINITY HEALTH OF NEW ENGLAND EMERGENCY MEDICAL SERVICES INC,114 WOODLAND STREET,HARTFORD,CT,06105,833546613,HEALTH CARE SERVICES,CT,501(C)(3),LINE 10,TRINITY HEALTH OF NEW ENGLAND CORP INC,1
202121349349302757,311308555,TRINITY HEALTH OF NEW ENGLAND PROVIDER NETWORK ORGANIZATION INC,114 WOODLAND STREET,HARTFORD,CT,06105,061450168,HEALTH CARE SERVICES,CT,501(C)(3),LINE 3,TRINITY HEALTH OF NEW ENGLAND CORP INC,1
202121349349302757,311308555,TRINITY HEALTH OF THE MID-ATLANTIC REGION,ONE WEST ELM STREET SUITE 100,CONSHOHOCKEN,PA,19428,232212638,HEALTH CARE SYSTEM MANAGEMENT AND SUPPORT,PA,501(C)(3),"LINE 12B, II",TRINITY HEALTH CORPORATION,1
202121349349302757,311308555,TRINITY HEALTH PACE,PO BOX 9184,FARMINGTON HILLS,MI,48333,473073124,PACE PROGRAM,MI,501(C)(3),"LINE 12B, II",TRINITY HEALTH CORPORATION,1
202121349349302757,311308555,TRINITY HEALTH WELFARE BENEFIT TRUST,20555 VICTOR PARKWAY,LIVONIA,MI,48152,208151733,RETIREE MEDICAL AND RETIREE LIFE INSURANCE,MI,501(C)(9),N/A,TRINITY HEALTH CORPORATION,1
202121349349302757,311308555,TRINITY HOME HEALTH SERVICES,PO BOX 9184,FARMINGTON HILLS,MI,48333,382621935,MANAGEMENT SERVICES FOR HOME HEALTH SYSTEM,MI,501(C)(3),LINE 10,TRINITY HEALTH CORPORATION,1
202121349349302757,311308555,VILLA MARY IMMACULATE,301 HACKETT BLVD,ALBANY,NY,12208,141438749,LONG TERM CARE,NY,501(C)(3),LINE 3,ST PETER'S HOSPITAL,1
202011969349301046,660259904,PADRES DOMINICOS DE PUERTO RICO INC,DEL CARIBE,URB VALENCIA,BAYAMON,PR,00930,RELIGIOUS,PR,N/A,false
202011969349302061,381988915,SIXTY PLUS INC,300 S CAPITOL AVE 6TH FLOOR,LANSING,MI,48933,382245744,LEGAL SERVICES FOR THE ELDERLY,MI,501(C)(3),7,1
202021829349301112,350715530,INDEPENDENT COLLEGES OF INDIANA INC,30 SOUTH MERIDIAN STREET STE 800,INDIANAPOLIS,IN,46204,310901001,EDUCATION,IN,501(c)(3),12,NA,false
202131379349303208,823859330,BREWTON-PARKER COLLEGE INC,PO BOX 197,MOUNT VERNON,GA,304450197,580619030,POST SECONDARY EDUCATION,GA,501(C)(3),LINE 2,0
202021359349300947,591083502,NSU Health Professions Division Foundation Inc,3200 South University Dr,Fort Lauderdale,FL,33328,650456144,Support Org,FL,501 (c) (3),"Line 12c, III-FI",Nova Southeastern University,0
202011339349301211,391596986,AFFINITY HEALTH SYSTEM,1506 Oneida St,Appleton,WI,54915,391568866,HEALTH SYSTEM,IL,501(c)(3),Type II,MINISTRY HEALTH CARE INC,true
202011339349301211,391596986,AGAPE COMMUNITY CENTER OF MILWAUKEE INC,6100 NORTH 42ND STREET,MILWAUKEE,WI,53209,391641846,COMMUNITY CENTER,WI,501(c)(3),7,MINISTRY HEALTH CARE INC,true
202011339349301211,391596986,ALABAMA PROVIDENCE HEALTHCARE SERVICES,6801 AIRPORT BLVD,MOBILE,AL,36608,462847744,SUPPORT PROVIDENCE HOSPITAL,AL,501(c)(3),10,GULF COAST HEALTH SYSTEM,true
202011339349301211,391596986,ALEXIAN BROTHERS - AHS MIDWEST REGION HEALTH CO,2601 Navistar Drive,Lisle,IL,60532,472360513,JOINT OPERATING COMPANY,IL,501(c)(3),Type II,NA,false
202011339349301211,391596986,ALEXIAN BROTHERS AMBULATORY GROUP,2601 Navistar Drive,Lisle,IL,60532,364336931,PHYSICIAN SERVICES,IL,501(c)(3),3,Alexian Brothers Health System,true
202011339349301211,391596986,ALEXIAN BROTHERS BEHAVIORAL HEALTH HOSPITAL,1650 Moon Lake Blvd,Hoffman Estates,IL,60169,364251848,BEHAVIORAL HEALTH HOSPITAL,IL,501(c)(3),3,Alexian Brothers Health System,true
202011339349301211,391596986,ALEXIAN BROTHERS BONAVENTURE HOUSE,825 Wellington Avenue,Chicago,IL,60657,363527899,HOUSING AND SUPPORTIVE CARE SERVICES FOR PERSONS WITH HIV/AIDS,IL,501(c)(3),10,Alexian Brothers Health System,true
202011339349301211,391596986,ALEXIAN BROTHERS CENTER FOR MENTAL HEALTH,3436 N Kennicott Avenue,Arlington Heights,IL,60004,363045007,OUTPATIENT COMMUNITY MENTAL HEALTH SERVICES,IL,501(c)(3),10,Alexian Brothers Health System,true
202011339349301211,391596986,ALEXIAN BROTHERS COMMUNITY SERVICES,12250 Weber Hill Rd Ste 200,St Louis,MO,63127,364344423,PACE- COMPREHENSIVE & COORDINATED COMMUNITY BASED SERVICES,TN,501(c)(3),10,Ascension Health Senior Care,true
202011339349301211,391596986,ALEXIAN BROTHERS HEALTH SYSTEM,200 South Wacker Drive,Chicago,IL,60606,363260495,SUPPORTS THE PROVISION OF HEALTHCARE SERVICES FOR RELATED CORPORATIONS FOR WHICH IT IS A MEMBER,IL,501(c)(3),Type III-FI,Ascension Health,true
202011339349301211,391596986,ALEXIAN BROTHERS HOSPITAL NETWORK,2601 Navistar Drive,Lisle,IL,60532,363276552,SUPPORTS THE PROVISION OF HEALTHCARE SERVICES FOR RELATED CORPORATIONS,IL,501(c)(3),Type III-FI,Alexian Brothers Health System,true
202011339349301211,391596986,ALEXIAN BROTHERS LANSDOWNE VILLAGE,12250 Weber Hill Rd Ste 200,ST LOUIS,MO,63127,431470362,SKILLED NURSING FACILITY,MO,501(c)(3),10,ASCENSION HEALTH SENIOR CARE,true
202011339349301211,391596986,ALEXIAN BROTHERS MEDICAL CARE GROUP NFP,2601 Navistar Drive,Lisle,IL,60532,471930457,PHYSICIAN SERVICES,IL,501(c)(3),3,Alexian Brothers Health System,true
202011339349301211,391596986,ALEXIAN BROTHERS MEDICAL CENTER,800 Biesterfield Road,Elk Grove Village,IL,60007,362596381,ACUTE CARE HOSPITAL,TX,501(c)(3),3,Alexian Brothers Health System,true
202011339349301211,391596986,ALEXIAN BROTHERS MEDICAL GROUP SPECIALTY CARE,2601 Navistar Drive,Lisle,IL,60532,811110738,SPECIALTY PHYSICIAN PRACTICE GROUP,IL,501(c)(3),3,ALEXIAN BROTHERS HEALTH SYSTEM,true
202011339349301211,391596986,ALEXIAN BROTHERS OF SAN JOSE INC,2601 Navistar Drive,Lisle,IL,60532,941530037,ACUTE CARE HOSPITAL (SOLD IN 1998),TX,501(c)(3),Type I,Alexian Brothers Health System,true
202011339349301211,391596986,ALEXIAN BROTHERS SENIOR MINISTRIES,12250 Weber Hill Rd Ste 200,ST LOUIS,MO,63127,364484290,SUPPORTS THE PROVISION OF HEALTHCARE FOR RELATED CORPORATIONS,IL,501(c)(3),Type II,Alexian Brothers Health System,true
202011339349301211,391596986,ALEXIAN BROTHERS SERVICES INC,3040 W Salt Creek Ln,Arlington Heights,IL,60005,431295333,HUD HOUSING,MO,501(c)(3),10,Alexian Brothers Health System,true
202011339349301211,391596986,ALEXIAN BROTHERS SHERBROOKE VILLAGE,12250 Weber Hill Rd Ste 200,St Louis,MO,63127,431592502,SKILLED NURSING FACILITY,MO,501(c)(3),10,ASCENSION HEALTH SENIOR CARE,true
202011339349301211,391596986,ALEXIAN BROTHERS SPECIALTY GROUP,2601 Navistar Drive,Lisle,IL,60532,800710751,SPECIALTY PHYSICIAN PRACTICE GROUP,IL,501(c)(3),3,Alexian Brothers Health System,true
202011339349301211,391596986,ALEXIAN VILLAGE OF MILWAUKEE INC,12250 Weber Hill Rd Ste 200,St Louis,MO,63127,391351584,CONTINUING CARE RETIREMENT COMMUNITY,WI,501(c)(3),10,ASCENSION HEALTH SENIOR CARE,true
202011339349301211,391596986,ALEXIAN VILLAGE OF TENNESSEE,12250 Weber Hill Rd Ste 200,St Louis,MO,63127,621136742,CONTINUING CARE RETIREMENT COMMUNITY,TN,501(c)(3),10,ASCENSION HEALTH SENIOR CARE,true
202011339349301211,391596986,ALVERNO PROVENA HOSPITAL LABORATORIES INC,2434 Interstate Plaza Drive,Hammond,IN,46234,203238867,HEALTH CARE,IN,501(c)(3),3,Presence Central & Suburban Hospitals Network AND PRESENCE CHICAGO HOSPITAL,S NETWORK,true
202011339349301211,391596986,AMERICAN SPORTS MEDICINE INSTITUTE,2660 10TH AVENNUE SOUTH NO 505,BIRMINGHAM,AL,35205,630952490,SPORTS MEDICINE,AL,501(c)(3),7,ST VINCENT'S BIRMINGHAM,true
202011339349301211,391596986,ARTHUR MERKLE - CLARA KNIPPRATH NURSING HOME,1190 E 2900 N ROAD,CLIFTON,IL,60927,362841358,RETIREMENT COMMUNITY,IL,501(c)(3),10,PRESENCE LIFE CONNECTIONS,true
202011339349301211,391596986,ASCENSION MICHIGAN CMG,28000 DEQUINDRE ROAD,WARREN,MI,48092,382601348,HEALTH CARE,MI,501(c)(3),10,ST JOHN PROVIDENCE,true
202011339349301211,391596986,ASCENSION ALL SAINTS HOSPITAL INC,3801 SPRING STREET,RACINE,WI,53405,391264986,HOSPITAL,WI,501(c)(3),3,WHEATON FRANCISCAN HEALTHCARE-SOUTHEAST WISCONSIN INC,true
202011339349301211,391596986,ASCENSION ARIZONA,2202 N FORBES BLVD,TUCSON,AZ,85745,860455920,HOSPITAL,AZ,501(c)(3),3,ASCENSION HEALTH,true
202011339349301211,391596986,ASCENSION BORGESS FOUNDATION,1521 GULL ROAD,KALAMAZOO,MI,49048,237222558,FUNDRAISING,MI,501(c)(3),Type III-FI,ASCENSION BORGESS HOSPITAL,true
202011339349301211,391596986,ASCENSION BORGESS HOSPITAL,1521 GULL ROAD,KALAMAZOO,MI,49048,381360526,HEALTHCARE SERVICES,MI,501(c)(3),3,ASCENSION MICHIGAN,true
202011339349301211,391596986,ASCENSION BORGESS LEE FOUNDATION,420 W HIGH STREET,DOWAGIAC,MI,49047,382860459,FUNDRAISING,MI,501(c)(3),Type III-FI,ASCENSION BORGESS-LEE HOSPITAL,true
202011339349301211,391596986,ASCENSION BORGESS-LEE HOSPITAL,420 WEST HIGH STREET,DOWAGIAC,MI,49047,381490190,HEALTHCARE SERVICES,MI,501(c)(3),3,ASCENSION MICHIGAN,true
202011339349301211,391596986,ASCENSION BRIGHTON CENTER FOR RECOVERY,12851 GRAND RIVER,BRIGHTON,MI,48116,381576680,HOSPITAL,MI,501(c)(3),3,ASCENSION MICHIGAN,true
202011339349301211,391596986,ASCENSION CALUMET HOSPITAL INC,614 MEMORIAL DRIVE,CHILTON,WI,53014,390905385,HOSPITAL,WI,501(c)(3),3,MINISTRY HEALTH CARE INC,true
202011339349301211,391596986,ASCENSION CARE MANAGEMENT INSURANCE HOLDINGS (FKA GLOBAL HEALTH PARTNERSHIP,),101 South Hanley Ste 450,St Louis,MO,63105,461121862,HEALTH CARE,MO,501(c)(3),7,Ascension Health Alliance,true
202011339349301211,391596986,ASCENSION EAGLE RIVER HOSPITAL INC,201 HOSPITAL ROAD,EAGLE RIVER,WI,54521,390985690,HOSPITAL,WI,501(c)(3),3,MINISTRY HEALTH CARE INC,true
202011339349301211,391596986,ASCENSION EASTWOOD BEHAVIORAL HEALTH,28000 DEQUINDRE ROAD,WARREN,MI,48092,381958763,HEALTH CARE,MI,501(c)(3),10,ST JOHN PROVIDENCE,true
202011339349301211,391596986,ASCENSION GENESYS FOUNDATION,ONE GENESYS PARKWAY,GRAND BLANC,MI,484398065,383591148,FOUNDATION,MI,501(c)(3),Type I,GENESYS HEALTH SYSTEM,true
202011339349301211,391596986,ASCENSION GENESYS HOSPITAL,ONE GENESYS PARKWAY,GRAND BLANC,MI,484398065,382377821,HOSPITAL,MI,501(c)(3),3,ASCENSION MICHIGAN,true
202011339349301211,391596986,ASCENSION GOOD SAMARITAN HOSPITAL INC,601 SOUTH CENTER AVENUE,MERRILL,WI,54452,390808503,HOSPITAL,WI,501(c)(3),3,MINISTRY HEALTH CARE INC,true
202011339349301211,391596986,ASCENSION HEALTH,PO BOX 45998,ST LOUIS,MO,63145,311662309,NATIONAL HEALTH,MO,501(c)(3),Type I,ASCENSION HEALTH ALLIANCE,false
202011339349301211,391596986,ASCENSION HEALTH - IS INC,PO BOX 45998,ST LOUIS,MO,63145,651257719,SUPPORTING ORGANIZATION,MO,501(c)(3),Type I,ASCENSION HEALTH ALLIANCE,true
202011339349301211,391596986,ASCENSION HEALTH ALLIANCE,PO BOX 45998,ST LOUIS,MO,63145,453358926,NATIONAL HEALTH SYSTEM,MO,501(c)(3),Type I,NA,false
202011339349301211,391596986,ASCENSION HEALTH ALLIANCE PROFESSIONAL & GENERAL LIABILITY SELF-INSURANCE T,RUST,4600 EDMUNDSON RD,ST LOUIS,MO,63134,367046706,SUPPORTING ORGANIZATION,MO,501(c)(3),Type I,ASCENSION HEALTH ALLIANCE,true
202011339349301211,391596986,ASCENSION HEALTH GLOBAL MISSION,101 SOUTH HANLEY,SUITE 450,ST LOUIS,MO,63105,651205990,SUPPORTING ORGANIZATION,MO,501(c)(3),Type I,ASCENSION HEALTH ALLIANCE,true
202011339349301211,391596986,ASCENSION HEALTH SENIOR CARE,12250 Weber Hill Road,St Louis,MO,63127,431227406,PARENT COMPANY,MO,501(c)(3),Type I,ASCENSION HEALTH,true
202011339349301211,391596986,ASCENSION WELFARE BENEFITS TRUST,PO BOX 46944,ST LOUIS,MO,63146,431601369,TRUST,MO,501(c)(9),ASCENSION HEALTH,true
202011339349301211,391596986,ASCENSION LIVING - LAKESHORE AT SIENA INC,12250 Weber Hill Rd Ste 200,ST LOUIS,MO,63127,824710412,RETIREMENT COMMUNITY,WI,501(c)(3),10,ASCENSION HEALTH SENIOR CARE,true
202011339349301211,391596986,ASCENSION MACOMB OAKLAND HOSPITAL,28000 DEQUINDRE ROAD,WARREN,MI,48092,383322109,HOSPITAL,MI,501(c)(3),3,ASCENSION MICHIGAN,true
202011339349301211,391596986,ASCENSION MEDICAL GROUP MICHIGAN,28000 Dequnidre Rd,WARREN,MI,48092,383494637,HEALTH CARE,MI,501(c)(3),10,ST JOHN PROVIDENCE,true
202011339349301211,391596986,ASCENSION MEDICAL GROUP PROMED,1521 GULL ROAD,KALAMAZOO,MI,49048,383193801,HEALTHCARE SERVICES,MI,501(c)(3),10,BORGESS HEALTH ALLIANCE INC,true
202011339349301211,391596986,ASCENSION MEDICAL GROUP-FOX VALLEY WISCONSIN INC,1570 APPLETON RD,MENASHA,WI,54952,391127163,CLINICAL HEALTHCARE SERVICES,WI,501(c)(3),3,AFFINITY HEALTH SYSTEM,true
202011339349301211,391596986,ASCENSION MEDICAL GROUP-NORTHERN WISCONSIN INC,824 ILLINOIS AVENUE,STEVENS POINT,WI,54481,391965593,MEDICAL GROUP,WI,501(c)(3),Type III-FI,MINISTRY HEALTH CARE INC,true
202011339349301211,391596986,ASCENSION MEDICAL GROUP-SOUTHEAST WISCONSIN INC,400 WEST RIVER WOODS PARKWAY,GLENDALE,WI,53212,391791586,MEDICAL GROUP,WI,501(c)(3),3,WHEATON FRANCISCAN HEALTHCARE-SOUTHEAST WISCONSIN INC,true
202011339349301211,391596986,ASCENSION MICHIGAN,28000 DEQUINDRE ROAD,WARREN,MI,48092,382631907,HEALTH CARE,MI,501(c)(3),Type I,ASCENSION HEALTH,true
202011339349301211,391596986,ASCENSION MINISTRY AND MISSION FUND,PO BOX 45998,ST LOUIS,MO,63145,273174701,SUPPORTING ORGANIZATION,MO,501(c)(3),Type I,ASCENSION HEALTH ALLIANCE,true
202011339349301211,391596986,ASCENSION NE WISCONSIN INC,1506 S ONEIDA STREET,APPLETON,WI,54915,390816818,HOSPITAL,WI,501(c)(3),3,MINISTRY HEALTH CARE INC,true
202011339349301211,391596986,ASCENSION OUR LADY OF VICTORY HOSPITAL INC,1120 PINE STREET,STANLEY,WI,54768,390807065,HOSPITAL,WI,501(c)(3),3,MINISTRY HEALTH CARE INC,true
202011339349301211,391596986,ASCENSION PROVIDENCE,6901 MEDICAL PARKWAY,WACO,TX,76712,741109636,HEALTHCARE SERVICES,TX,501(c)(3),3,ASCENSION TEXAS,true
202011339349301211,391596986,ASCENSION PROVIDENCE FOUNDATION,22101 MOROSS,DETROIT,MI,48236,383526629,FUNDRAISING,MI,501(c)(3),Type III-FI,ST JOHN PROVIDENCE,true
202011339349301211,391596986,ASCENSION PROVIDENCE HOSPITAL,16001 WEST NINE MILE ROAD,SOUTHFIELD,MI,48037,381358212,HOSPITAL,MI,501(c)(3),3,ASCENSION MICHIGAN,true
202011339349301211,391596986,ASCENSION PROVIDENCE ROCHESTER FOUNDATION FKA CRITTENTON HOSPITAL MEDICAL C,ENTER FOUNDATION,1101 WEST UNIVERSITY DR,ROCHESTER,MI,48307,382627336,SUPPORTING,MI,501(c)(3),Type I,ASCENSION PROVIDENCE ROCHESTER HOSPITAL,true
202011339349301211,391596986,ASCENSION PROVIDENCE ROCHESTER HOSPITAL,1101 W UNIVERSITY DR,ROCHESTER,MI,48307,381359247,GENERAL HOSPITAL,MI,501(c)(3),3,ASCENSION MICHIGAN,true
202011339349301211,391596986,ASCENSION RIVER DISTRICT HOSPITAL,4100 RIVER ROAD,EAST CHINA,MI,48054,383160564,HOSPITAL,MI,501(c)(3),3,ASCENSION MICHIGAN,true
202011339349301211,391596986,ASCENSION SACRED HEART-STMARY'S HOSPITALS INC,PO BOX 347,STEVENS POINT,WI,54481,391390638,HOSPITAL,WI,501(c)(3),3,MINISTRY HEALTH CARE INC,true
202011339349301211,391596986,ASCENSION SE WISCONSIN HOSPITAL INC,5000 WEST CHAMBERS STREET,MILWAUKEE,WI,53210,390816857,HOSPITAL,WI,501(c)(3),3,WHEATON FRANCISCAN HEALTHCARE-SOUTHEAST WISCONSIN INC,true
202011339349301211,391596986,ASCENSION SETON,1345 PHILOMENA STREET,AUSTIN,TX,78723,741109643,DELIVERY OF HEALTH CARE SERVICES,TX,501(c)(3),3,ASCENSION TEXAS,true
202011339349301211,391596986,ASCENSION SOUTHEAST MICHIGAN COMMUNITY HEALTH,28000 DEQUINDRE ROAD,WARREN,MI,48092,382262856,HEALTH CARE,MI,501(c)(3),3,ST JOHN PROVIDENCE,true
202011339349301211,391596986,ASCENSION ST CLARE'S HOSPITAL INC,3400 MINISTRY PARKWAY,WESTON,WI,54476,721531917,HOSPITAL,WI,501(c)(3),3,MINISTRY HEALTH CARE INC,true
202011339349301211,391596986,ASCENSION ST FRANCIS HOSPITAL INC,3237 SOUTH 16TH STREET,MILWAUKEE,WI,53215,390907740,HOSPITAL,WI,501(c)(3),3,WHEATON FRANCISCAN HEALTHCARE-SOUTHEAST WISCONSIN INC,true
202011339349301211,391596986,ASCENSION ST JOHN FOUNDATION,22101 MOROSS,DETROIT,MI,48236,202961579,FUNDRAISING,MI,501(c)(3),7,ST JOHN PROVIDENCE,true
202011339349301211,391596986,ASCENSION ST JOHN HOSPITAL,28000 DEQUINDRE ROAD,WARREN,MI,48092,381359063,HEALTH CARE,MI,501(c)(3),3,ASCENSION MICHIGAN,true
202011339349301211,391596986,ASCENSION ST JOSEPH FOUNDATION,200 HEMLOCK ROAD,TAWAS CITY,MI,48763,010790428,FUNDRAISING,MI,501(c)(3),Type I,ASCENSION ST JOSEPH'S HOSPITAL,true
202011339349301211,391596986,ASCENSION ST JOSEPH'S HOSPITAL,200 HEMLOCK ROAD,TAWAS CITY,MI,48763,381443395,HEALTH CARE,MI,501(c)(3),3,ASCENSION MICHIGAN,true
202011339349301211,391596986,ASCENSION ST MARY'S FOUNDATION,800 S WASHINGTON AVENUE,SAGINAW,MI,48601,382246366,FUNDRAISING,MI,501(c)(3),Type II,ASCENSION ST MARY'S HOSPITAL,true
202011339349301211,391596986,ASCENSION ST MARY'S HOSPITAL,800 S WASHINGTON AVENUE,SAGINAW,MI,48601,380997730,HOSPITAL,MI,501(c)(3),3,ASCENSION MICHIGAN,true
202011339349301211,391596986,ASCENSION ST MICHAEL'S HOSPITAL INC,900 ILLINOIS AVENUE,STEVENS POINT,WI,54481,390808443,HOSPITAL,WI,501(c)(3),3,MINISTRY HEALTH CARE INC,true
202011339349301211,391596986,ASCENSION STANDISH HOSPITAL,805 WEST CEDEAR STREET,STANDISH,MI,48658,381671120,HOSPITAL,MI,501(c)(3),3,ASCENSION MICHIGAN,true
202011339349301211,391596986,ASCENSION TEXAS,1345 PHILOMENA STREET,AUSTIN,TX,78723,454364243,DELIVERY OF HEALTH CARE SERVICES,TX,501(c)(3),Type I,ASCENSION HEALTH,true
202011339349301211,391596986,ASCENSION VIA CHRISTI HEALTH PARTNERS INC,8200 E THORN DRIVE,WICHITA,KS,67226,480958974,MANAGEMENT COMPANY,KS,501(c)(3),10,ASCENSION VIA CHRISTI HEALTH INC,true
202011339349301211,391596986,ASCENSION VIA CHRISTI HEALTH INC,8200 E THORN DRIVE,WICHITA,KS,67226,481172107,HEALTH SYSTEM PARENT,KS,501(c)(3),Type III-FI,ASCENSION HEALTH,true
202011339349301211,391596986,ASCENSION VIA CHRISTI HOSPITAL MANHATTAN INC,1823 COLLEGE AVENUE,MANHATTAN,KS,66502,481186704,HOSPITAL,KS,501(c)(3),3,ASCENSION VIA CHRISTI HEALTH INC,true
202011339349301211,391596986,ASCENSION VIA CHRISTI HOSPITAL PITTSBURG INC,1 MT CARMEL WAY,PITTSBURG,KS,66762,480543778,HOSPITAL,KS,501(c)(3),3,ASCENSION VIA CHRISTI HEALTH INC,true
202011339349301211,391596986,ASCENSION VIA CHRISTI HOSPITAL WICHITA ST TERESA INC,14800 W ST TERESA,WICHITA,KS,67235,271965272,HOSPITAL,KS,501(c)(3),3,ASCENSION VIA CHRISTI HEALTH INC,true
202011339349301211,391596986,ASCENSION VIA CHRISTI HOSPITALS WICHITA INC,929 N SAINT FRANCIS,WICHITA,KS,67214,481172106,HOSPITAL,KS,501(c)(3),3,ASCENSION VIA CHRISTI HEALTH INC,true
202011339349301211,391596986,ASCENSION VIA CHRISTI PROPERTY SERVICES INC,8200 E THORN DRIVE,WICHITA,KS,67226,480948571,PROPERTY MANAGEMENT,KS,501(c)(4),ASCENSION VIA CHRISTI HOSPITALS WICHITA INC,true
202011339349301211,391596986,ASCENSION VIA CHRISTI REHABILITATION HOSPITAL INC,1151 N ROCK ROAD,WICHITA,KS,67206,481158274,REHABILITATION HOSPITAL,KS,501(c)(3),3,ASCENSION VIA CHRISTI HOSPITALS WICHITA INC,true
202011339349301211,391596986,ASCENSION WISCONSIN LABORATORIES INC,3237 SOUTH 16TH STREET,MILWAUKEE,WI,53215,391701402,LABORATORY,WI,501(c)(3),10,WHEATON FRANCISCAN HEALTHCARE-SOUTHEAST WISCONSIN INC,true
202011339349301211,391596986,ASCENSION WISCONSIN PHARMACYINC,19525 WEST NORTH AVENUE,BROOKFIELD,WI,53005,391613624,PHARMACY,WI,501(c)(3),10,WHEATON FRANCISCAN HEALTHCARE-SOUTHEAST WISCONSIN INC,true
202011339349301211,391596986,BAPTIST HEALTH CARE AFFILIATES INC,2000 CHURCH STREET,NASHVILLE,TN,37236,581509251,COMMUNITY HEALTH PROMOTION,TN,501(c)(3),Type I,SAINT THOMAS NETWORK,true
202011339349301211,391596986,BAPTIST HOSPITAL FOUNDATION OF NASHVILLE INC,2000 CHURCH STREET,NASHVILLE,TN,37236,581861378,INACTIVE,TN,501(c)(3),Type I,SAINT THOMAS MIDTOWN HOSPITAL,true
202011339349301211,391596986,BLUE LADIES MINERALS INC,1345 PHILOMENA STREET,AUSTIN,TX,78723,742971975,"OWN OIL AND MINERAL RIGHTS, REAL ESTATE",TX,501(c)(3),Type III-FI,SETON FUND OF THE DAUGHTERS OF CHARITY OF ST VINCENT DE PAUL INC,true
202011339349301211,391596986,BORGESS AMBULATORY CARE CORPORATION,1521 GULL ROAD,KALAMAZOO,MI,49048,382468823,HOLDING COMPANY,MI,501(c)(3),3,BORGESS HEALTH ALLIANCE INC,true
202011339349301211,391596986,BORGESS HEALTH ALLIANCE INC,1521 GULL ROAD,KALAMAZOO,MI,49048,382335286,HEALTH SYSTEM PARENT,MI,501(c)(3),Type III-FI,ASCENSION MICHIGAN,true
202011339349301211,391596986,BORGESS NURSING HOME INC,12250 Weber Hill Rd Ste 200,ST LOUIS,MO,63127,382555589,SKILLED NURSING FACILITY,MI,501(c)(3),3,ASCENSION HEALTH SENIOR CARE,true
202011339349301211,391596986,CARONDELET FOUNDATION INC,2202 N FORBES BLVD,TUSCON,AZ,85716,860749574,FOUNDATION,AZ,501(c)(3),Type I,ASCENSION ARIZONA,true
202011339349301211,391596986,CARONDELET HEALTH,1000 CARONDELET DRIVE,KANSAS CITY,MO,63145,431276738,HEALTH SYSTEM PARENT,MO,501(c)(3),Type III-FI,ASCENSION HEALTH,true
202011339349301211,391596986,CARONDELET HEART & VASCULAR INSTITUTE,2202 N FORBES BLVD,TUCSON,AZ,85745,561943271,INACTIVE HOSPITAL,AZ,501(c)(3),3,ASCENSION ARIZONA,true
