object_id,ein,FrmAndLnRfrncDsc,ExplntnTxt
202021269349301812,362167725,"Schedule I, Part I, Line 2 Procedures for monitoring use of grant funds.","Scholarships and stipends are available to undergraduate students and graduate students through the admissions process. Once awarded, depending on the type of aid, payment is credited to either the student account or directly to the student. All payments are monitored and approved by the Financial Services department before payment is applied or paid to the student. All students receiving scholarships and stipends have been selected on a non-discriminatory basis. Faculty enrichment grant opportunities are available to full-time and part-time faculty teaching in a degree program. Selections are based on the merit of the proposal and reviewed by members of a selection committee. Payment are monitored by the Dean's office and all payments are approved by the Vice Provost and School Finance department before payment is made."
202021919349302497,200118161,"PART I, LINE 2:",THE FOUNDATION DOES NOT AWARD GRANTS BUT PROVIDES OTHER ASSISTANCE IN THE FORM OF CONTRIBUTIONS AND NON-CASH CONTRIBUTIONS TO THE UNIVERSITY AND ITS EDUCATION FOUNDATION AS SUPPORT FOR THE UNIVERSTIY AS OUR 509(A)(3) STATUS REQUIRES.
201923189349304737,251065148,"PART I, LINE 2:","ALL SCHOLARSHIPS ARE PROVIDED AS A CREDIT TO THE STUDENT TO COVER CHARGES OF TUITION, ROOM AND BOARD, AND OTHER FEES RELATED TO THE COST OF ATTENDANCE."
202040249349300009,860711495,Grantmaker's Description of How Grants are Used,"Phoenix Seminary, Inc. students must submit applications for specific scholarships available each semester. Once the scholarship applications are submitted, the scholarship committee reviews and scores the applications based on the answers provided by the students. The scholarship committee then awards the scholarships based on the students meeting the scholarship criteria. Scholarships are disbursed based on the amount of funds available and the number of students meeting the scholarship criteria that apply."
202041979349304134,570314395,"Schedule I, Part I, Line 2 Procedures for monitoring use of grant funds.","FURMAN PROVIDES SCHOLARSHIPS AND FINANCIAL AID TO INDIVIDUALS IN THE UNITED STATES TO ATTEND THE UNIVERSITY. THE SCHOLARSHIPS AND AID FOR SUCH STUDENTS ARE AWARDED BASED ON NEED AND MERIT AND COVER THE COSTS OF TUITION, ROOM AND BOARD. THE SCHOLARSHIP AND/OR FINANCIAL AID IS AWARDED BASED ON INSTITUTIONAL POLICY AND STANDARDS SET FORTH BY THE DEPARTMENT OF EDUCATION AND THE STATE OF SOUTH CAROLINA. THE UNIVERSITY'S FINANCIAL AID DEPARTMENT MONITORS THE COMPLIANCE WITH SUCH REGULATIONS. THE SCHOLARSHIP AND/OR FINANCIAL AID IS APPLIED BY THE FINANCIAL AID DEPARTMENT DIRECTLY AGAINST THE STUDENT'S ACCOUNT WITH THE UNIVERSITY AS A REDUCTION IN FEES. AS A RESULT, THE GRANT CAN ONLY BE USED FOR ITS INTENDED PURPOSE (I.E. COST OF ATTENDANCE) AND CANNOT BE DIVERTED FROM THIS USE. OTHER TYPES OF GRANTS PROVIDED CONSIST OF RESEARCH, INTERNSHIP OR FELLOWSHIP GRANTS TO STUDENTS. SUCH GRANTS ARE GIVEN AND MONITORED BY THE ACADEMIC DEPARTMENT GIVING THE GRANT OR THE UNDERGRADUATE RESEARCH AND INTERNSHIP DEPARTMENT. SPONSORSHIPS PAID TO ORGANIZATIONS ARE MADE UNDER WRITTEN AGREEMENTS BETWEEN THE PARTIES AND SUPPORT COMMUNITY EVENTS AND PROVIDE A PRESENCE FOR FURMAN IN THE AREA. COMMUNITY ENGAGEMENT IS A SIGNIFICANT ASPECT OF THE FURMAN ADVANTAGE. THESE SPONSORSHIPS WITH GREENVILLE BUSINESSES THEREFORE SERVE TO ADVANCE THE FURMAN ADVANTAGE FOR OUR STUDENTS AND THE COMMUNITY."
201923029349301652,541919810,"PART I, LINE 2:","ALL STUDENTS RECEIVING SCHOLARSHIPS ARE DETERIMINED BY THE COLLEGE'S ASSESSMENT ON THE BASIS OF ACADEMIC ACHIEVEMENT, FINANCIAL NEED, OR OTHER CRITERIA ESTABLISHED BY THE DONOR OR INSTITUTION."
201943129349303514,942427596,"PART I, LINE 2:","THE COLLEGE'S FINANCE OFFICE AND SCHOLARSHIP COMMITTEE MAINTAIN A RECORD OF ALL COMMITTEE AUTHORIZED AND EXECUTIVE OFFICE APPROVED SCHOLARSHIPS, THE AWARD LETTERS, AND THE FINAL ENROLLMENT REPORTS, INDICATING THE PARTICIPANT'S NAME, COURSE AND DOLLAR AMOUNT OF THE AWARD. THESE RECORDS ARE THEN COMPARED TO THE OFFICE CLASS ROSTER TO VERIFY COURSE ATTENDANCE AND SUCCESSFUL COMPLETION."
202012279349300331,237135915,"SCHEDULE I, PAGE 1, PART I, LINE 2","TO RECEIVE A STIPEND, THE INDIVIDUAL MUST BE A STUDENT AND MEET THE REQUIRED GUIDELINE FROM THE AWARDING AGENCY. EACH DEPARTMENT CHAIR VERIFIES THAT THE STUDENT MEETS THE AWARDING AGENCY'S GUIDELINES. THE BUSINESS OFFICE MONITORS THE PAYMENTS. SCHOLARSHIPS ARE AWARDED BASED ON SPECIFIC GUIDELINES CREATED BY THE SOURCE OF FUNDING. THE FINANCIAL AID DEPARTMENT DETERMINES ELIGIBILITY AND MONITORS USE OF FUNDS."
202030639349300003,202394341,"Monitoring procedures (Part I, line 2)",Grants are made to students currently attending the Seminary to enable them to live and study near the Puritan Reformed Theological Seminary. The Seminary is aware of the needs of the students and is able to monitor the use of the funds provided.
202012469349300421,540646523,"PART I, LINE 2:","A SIGNIFICANT PORTION OF INSTITUTIONAL AID AWARDED TO STUDENTS IS BASED ON ACADEMIC MERIT, FOR WHICH THE UNIVERSITY HAS A PREDETERMINED GRID THAT PROVIDES THE AMOUNTS TO BE AWARDED BASED ON THE STUDENT'S ACTUAL GPA AND TEST SCORES AND, AS NEEDED, EVALUATION BY THE UNIVERSITY'S SCHOLARSHIP COMMITTEE. OTHER INSTITUTIONAL AID CONSISTS OF RETURNED MISSIONARY SCHOLARSHIPS, TALENT, AND OTHER NEED-BASED GRANTS. RETURNED MISSIONARY SCHOLARSHIPS ARE AWARDED IN THE AMOUNT OF $1,500 PER YEAR TO ALL FULL-TIME STUDENTS WHO HAVE COMPLETED A MISSION FOR THE CHURCH OF JESUS CHRIST OF LATTER-DAY SAINTS OR SIMILAR SERVICE. TALENT SCHOLARSHIPS ARE AWARDED IN VARIOUS AMOUNTS, TYPICALLY BETWEEN $500 AND $2,000 PER STUDENT, AND ARE AWARDED BASED ON THE NOMINATION OF THE UNIVERSITY FACULTY, ART/THEATRE/MUSIC DIRECTOR, ETC. AND APPROVAL OF THE FINANCIAL AID COMMITTEE. UNIVERSITY NEED BASED GRANTS AND VARIOUS OTHER GRANTS ARE AWARDED AS DETERMINED BY THE FINANCIAL AID DIRECTOR. FEDERAL & STATE GRANTS, INCLUDING PELL, SEOG, AND VTAG ARE AWARDED TO STUDENTS WHO COMPLETE THE FREE APPLICATION FOR FEDERAL STUDENT AID (FAFSA) AND MEET THE VARIOUS QUALIFICATIONS. FEDERAL AND STATE GRANTS ARE VERIFIED INTERNALLY BY OUR FINANCIAL AID STAFF AS DICTATED BY APPLICABLE REGULATION."
202020719349301312,391319049,"SCHEDULE I, PAGE 1, PART I, LINE 2","WISCONSIN SCHOOL OF PROFESSIONAL PSYCHOLOGY OFFERS A MINORITY SCHOLARSHIP AND VARIOUS ACADEMIC SCHOLARSHIPS TO QUALIFIED INCOMING STUDENTS. ELIGIBILITY FOR THE MINORITY SCHOLARSHIP IS BASED UPON MINORITY STATUS, PROVEN ACADEMIC EXCELLENCE, AS WELL AS FINANCIAL NEED. ACADEMIC SCHOLARSHIPS ARE BASED ON NEED AND ACADEMIC ACHIEVMENTS."
201923199349312582,540568200,"PART I, LINE 2:","SCHOLARSHIPS ARE AWARDED TO STUDENTS BASED ON EITHER THE SPECIFIC CRITERIA OF THE SCHOLARSHIP FUNDING, ACADEMIC MERIT, OR TALENT. THE COLLEGE'S FINANCIAL AID OFFICE MONITORS SCHOLARSHIP FUND AVAILABILITY, MAKES SCHOLARSHIP AWARDS, AND MAINTAINS AN ON-GOING AWARENESS OF STUDENT ELIGIBILITY FOR SCHOLARSHIPS."
202020439349300942,222586208,"Schedule I, Part I, Line 2",The College manages Federal Title IV grant and loan funds in accordance with Title IV regulations. The College undergoes an annual A-133 audit to monitor the use of these funds.
202041719349301204,310820394,"FORM 990, SCHEDULE I, PART IV:","SCHOLARSHIPS AND SIMILAR ALLOCATIONS ARE AWARDED BASED ON A VARIETY OF REQUIREMENTS THAT ARE RELATIVE ONLY TO THE PARTICULAR TYPE OF AWARD TO BE GRANTED. VARIOUS SCHOLARSHIPS AND SIMILAR ALLOCATIONS CAN BE AWARDED BASED ON THE FINANCIAL NEED OF THE STUDENT, THE STUDENT'S YEAR IN SCHOOL, OR ANY OTHER REQUIREMENT THAT MAY BE SPECIFICALLY NOTED IN AN ENDOWMENT."
201943179349308369,237034324,"PART I, LINE 2:",THE UNIVERSITY COMPLIES WITH ALL CONTRACTUAL AND FEDERAL REQUIREMENTS WHEN DETERMINING ELIGIBILITY OF SCHOLARSHIP RECIPIENTS.
202002139349301310,650000627,"PART I, LINE 2:","THE FINANCIAL AID DIRECTOR AT EACH CAMPUS IS GIVEN AN AMOUNT THAT MAY BE AWARDED AT THEIR CAMPUS FOR THE FISCAL YEAR, WITH A CHART OF HOW MANY STUDENTS AND THE AMOUNT FOR EACH TERM."
202031769349300203,540534105,"SCHEDULE I, PART I, LINE 2","INSTITUTIONAL MERIT SCHOLARSHIPS ARE AWARDED ON THE BASIS OF DEMONSTRATED ACADEMIC EXCELLENCE AND PROMISE FOR FUTURE SUCCESS AT THE COLLEGE. WHILE A NUMBER OF FACTORS ARE CONSIDERED, THE COLLEGE RELIES HEAVILY ON THE EVALUATION OF HIGH SCHOOL COURSEWORK, HIGH SCHOOL GRADE POINT AVERAGES AND CLASS RANK, STANDARDIZED TEST SCORES, WRITTEN WORK AND LETTERS OF RECOMMENDATION. EXTRACURRICULAR INVOLVEMENT THAT DEMONSTRATES A PROMISE FOR SUCCESS AT THE COLLEGIATE LEVEL IS ALSO CONSIDERED. SCHOLARSHIP AWARDS ARE APPLIED TO THE STUDENT'S ACCOUNT FOR PAYMENT TOWARD TUITION, ROOM, BOARD AND FEES."
202000649349300020,566049935,"PART I, LINE 2:","ELIGIBILITY FOR NEED-BASED SCHOLARSHIPS AND GRANTS IS DETERMINED ANNUALLY BASED UPON THE RESULTS OF THE FREE APPLICATION FOR FEDERAL STUDENT AID (FAFSA). ACADEMIC SCHOLARSHIPS ARE AWARDED UPON ENROLLMENT AND ELIGIBILITY IS FOR THE EIGHT SEMESTERS. AT THE END OF EACH SEMESTER, THE FINANCIAL PLANNING DEPARTMENT VERIFIES SATISFACTORY ACADEMIC PROGRESS HAS BEEN MAINTAINED IN ORDER TO DETERMINE CONTINUATION OF ALL SCHOLARSHIPS."
202040589349301414,030482006,"SCHEDULE I, PART I, LINE 2","THE OFFICE OF FINANCIAL AID DETERMINES A STUDENT'S ELIGIBILITY BASED ON THE FAMILY'S FINANCIAL STRENGTH, WHICH INCLUDES CONSIDERATION OF FAMILY INCOME AND ASSETS, NUMBER OF CHILDREN IN COLLEGE AND, IF APPROPRIATE, SPECIAL CIRCUMSTANCES. FINANCIAL AID WILL BE REVOKED WITHOUT ADEQUATE PROGRESS."
202010979349300716,362191252,Additional Supplemental Information,CWS awards are allocated back to wages as required by IPEDs reporting.
202030979349301043,221494428,"Schedule I, Part I, Line 2 Procedures for monitoring use of grant funds.",THE ORGANIZATION ISSUES GRANTS TO QUALIFIED INDIVIDUALS. THE GRANT FUNDS ARE THEN USED DIRECTLY AGAINST THE STUDENT'S ACCOUNT AS PAYMENT TOWARDS HIS OR HER COLLEGE EDUCATION.
202031819349301908,150532200,"Schedule I, Part I, Line 2","The College follows federal guidelines for determining the financial need of each student. The College Board Profile and the FAFSA (Free Application for Federal Student Aid) provides information to determine financial need. Grants and scholarships are awarded based on the demonstrated need of each student. The College has a Town Gown Committee which awards small grants to local community organizations based on submitted proposals. The total amount of such grants is less than $100,000."
202041779349300719,742606557,Pt I Line 2,"The Organization provided different aids to individuals and families, such as food, clothes, medicals, and money to pay for utilities, etc., which no individual totaled more than $5,000.00 per the year. The total was $56,800.88 for different individuals and families and there was no individual total more than $5,000.00 that needed to be reported."
202040739349300039,236002304,"PART I, LINE 2:","HAVERFORD COLLEGE SCHOLARSHIPS ARE BASED SOLELY ON NEED. HAVERFORD DOES NOT AWARD ANY GRANT AID BASED ON MERIT. APPLICANTS CAN BE ASKED TO FILE THE COLLEGE BOARD PROFILE AND THE FAFSA. IF ELIGIBLE FOR FEDERAL AID, PARENT AND STUDENT PERSONAL AND BUSINESS TAX RETURNS MUST BE PROVIDED. SUPPLEMENTS FOR BUSINESS AND FORMS FOR NON-CUSTODIAL PARENTS MAY ALSO BE REQUIRED BASED ON CIRCUMSTANCES. STUDENTS MAY APPEAL AWARD DECISIONS TO THE FINANCIAL AID COMMITTEE INCLUDING THE VICE PRESIDENT AND DEAN OF ADMISSION AND FINANCIAL AID, THE DEAN OF THE COLLEGE, AND THE SENIOR VICE PRESIDENT FOR ADMINISTRATION AND FINANCE. HAVERFORD SCHOLARSHIPS ARE CREDITED DIRECTLY TO THE STUDENT'S ACCOUNT FOR TUITION, ROOM, BOARD, FEES AND OTHER BILLED CHARGES. SUPPLEMENTAL EDUCATION OPPORTUNITY GRANTS (SEOG) ARE AWARDED BASED ON FAMILY CONTRIBUTION. ELIGIBILITY IS DETERMINED BY THE FAFSA AND REGULATIONS DETERMINED BY THE U.S. DEPARTMENT OF EDUCATION. PER THE DEPARTMENT OF EDUCATION REGULATIONS, STUDENTS WHO RECEIVE PELL GRANTS MUST BE PROVIDED SEOG FUNDS FIRST. IF THE STUDENT IS SELECTED TO RECEIVE THESE AWARDS OTHER VERIFICATION FORMS MAY BE REQUIRED INCLUDING THE VERIFICATION STATEMENT, PARENT AND STUDENT TAX RETURNS, AND NON-TAX FILER STATEMENTS. SEOG AWARDS ARE CREDITED DIRECTLY TO THE STUDENTS ACCOUNT FOR TUITION, ROOM, BOARD AND OTHER BILLED CHARGES. SEOG AWARDS ARE AUDITED ANNUALLY BY THE COLLEGE'S OUTSIDE AUDITORS IN CONJUNCTION WITH THE SINGLE AUDIT."
202010949349300536,370864020,"Schedule I, Part I, Line 2","Robert Morris University Illinois provides a number of grants/scholarship awards to eligible students based on various criteria such as financial need, merit, academic ability, academic major, and location of attendance. This gift assistance is support by two important sources: the University reserves a portion of its budget for grants/scholarships, and financial support is contributed by faculty, staff, alumni and friends of the University."
202010949349300801,561065978,"PART I, LINE 2:","THE UNIVERSITY DOES NOT GIVE ANY NON-CASH SCHOLARSHIPS. SCHOLARSHIPS ARE DISBURSED TO STUDENTS THROUGH CREDITING THEIR STUDENT ACCOUNTS. IF THE STUDENT HAS EXCESS SCHOLARSHIP FUNDS AS THE RESULT OF TITLE IV AID, THEN THESE FUNDS ARE AUTOMATICALLY DISBURSED TO THE STUDENT BY CHECK WITHIN FOURTEEN DAYS. IF THE EXCESS FUNDS ARE THE RESULT OF SOMETHING OTHER THAN TITLE IV AID, THE STUDENT MUST REQUEST A REFUND AND THESE FUNDS ARE DISBURSED TO THE STUDENT BY CHECK. THE UNIVERSITY'S PROCEDURES FOR MONITORING GRANT FUNDS IN THE U.S. ARE AS FOLLOWS: THE UNIVERSITY HAS APPOINTED DIRECTORS, WHO REPORT TO THE APPROPRIATE VICE PRESIDENTS OVER ALL FEDERAL GRANT PROGRAMS. THESE DIRECTORS ARE CHARGED WITH PERFORMING ALL GRANT-RELATED ACTIVITIES INCLUDING APPLICATION, MONITORING OF EXPENDITURES AND REPORTING, WITH THE EXCEPTION OF DRAW-DOWNS OF FEDERAL FUNDS. DRAW-DOWNS ARE PERFORMED BY THE UNIVERSITY'S CONTROLLER AFTER REQUESTS ARE MADE BY THE DIRECTOR TO THE CONTROLLER. THE CONTROLLER REVIEWS THE REQUESTS FOR DRAW-DOWNS, WHICH INCLUDE DOCUMENTATION OF ALL DIRECT AND INDIRECT PROGRAM EXPENSES, BEFORE MAKING THE DRAW-DOWNS. A SINGLE AUDIT IS PERFORMED ANNUALLY BY THE UNIVERSITY'S INDEPENDENT AUDITORS."
202010949349300821,560530242,"PART I, LINE 2:","MEREDITH COLLEGE FINANCIAL ASSISTANCE OFFICE HAS SYSTEMS AND INTERNAL PROCEDURES IN PLACE THAT ENSURES THE PROPER DETERMINATION, DISBURSEMENT AND MONITORING OF GRANTS AND SCHOLARSHIPS. THESE SYSTEMS AND PROCEDURES COMPLY WITH THE FEDERAL STUDENT TITLE IV AID REGULATIONS, NORTH CAROLINA STATE EDUCATION ASSISTANCE AUTHORITY RULES, AND INSTITUTIONAL POLICIES."
202032469349301663,451171945,"PART I, LINE 2:",CLAREMONT LINCOLN UNIVERSITY PROVIDES FINANCIAL ASSISTANCE TO QUALIFIED STUDENTS IN ACCORDANCE WITH GUIDELINES SET FORTH BY THE DEPARTMENT OF EDUCATION. CLU ENSURES THAT ALL STUDENTS ARE QUALIFIED TO RECEIVE SUCH ASSISTANCE. ASSISTANCE IS PROVIDED THROUGH DIRECT REDUCTION TO TUITION FOR STUDENTS.
202031209349300938,221500645,"Part I, Line 2","All University spending must be approved by a manager or higher level, depending on the amount of the expenditure. Any expenditure of $1,000 or above would have to be approved by a Dean or other budget center manager. An expenditure in excess of $10,000 must be approved by a Vice President (or that person's designee) or the President. Grants or assistance to outside organizations are segregated in the University's financial accounting system through the use of a separate account code, which allows for review by University's central Finance Department. Scholarships are provided to students who are required to matriculate in the University, thereby ensuring that the funds are expended for the intended purposes."
202031209349300938,221500645,"Part II, Line 2, (h) Purpose of grant assistance:","South Orange Performing Arts Center, Inc. (SOPAC) - Construction of South Orange Performing Arts Center."
202041279349302129,810420650,"PART I, LINE 2:","MONITORING THE EXPENDITURES OF GRANT FUNDS IS DONE IN ACCORDANCE WITH STONE CHILD COLLEGE'S FINANCIAL POLICIES AND PROCEDURES MANUAL, SECTION III - FINANCIAL. ALSO, AS A CONDITION FOR RECEIPT OF GRANT FUNDS, THE COLLEGE MUST ALLOCATE THESE FUNDS ACCORDING TO THE REQUIREMENTS OF EACH SPECIFIC FEDERAL GRANT AND ENSURE COMPLIANCE WITH FEDERAL REGULATIONS FOR USES OF THESE FUNDS. THE BUSINESS OFFICE PROVIDES FISCAL OVERSIGHT FOR ALL FINANCIAL AFFAIRS TO ENSURE THAT THESE FUNDS ARE BEING USED IN COMPLIANCE WITH ALL POLICIES AND PROCEDURES. THE APPROVAL PROCESS FOR ALL EXPENDITURES REQUIRE THREE SIGNATURES: THE PERSON REQUESTING THE USE OF FUNDS, THE PROJECT COORDINATOR/DIRECTOR, THEN THE PRESIDENT HAS THE FINAL APPROVAL. A MONTHLY EXPENDITURE REPORT FOR ALL PROGRAMS ADMINISTERED BY THE COLLEGE AND A MONTHLY CHECK REGISTER IS PROVIDED TO THE COLLEGE'S GOVERNING BOARD FOR THEIR REVIEW AND APPROVAL AT THEIR MONTHLY MEETINGS."
202041679349300814,660201206,"Schedule I, Part I, Line 2","Financial aid assistance is awarded based on US Federal, State, and Private guidelines as required by the corresponding type of assistance."
202001009349300800,160746864,"PART I, LINE 2:","A LIST OF SCHOLARSHIP AND FELLOWSHIP RECIPIENTS IS ON FILE AT ST. JOHN COLLEGE AND IS AVAILABLE UPON REQUEST. THE COLLEGE RUNS AN ACADEMIC PROGRESS REPORT EVERY YEAR TO DETERMINE EACH STUDENT'S AID ELIGIBILITY. ALTHOUGH THERE MAY BE RECIPIENTS WHO ARE RELATED TO PERSONS HAVING INTEREST IN THE INSTITUTION, SUCH RECIPIENTS ARE SELECTED ON AN EQUAL, OBJECTIVELY DETERMINABLE BASIS WITH OTHER RECIPIENTS. THAT IS, ALL STUDENTS RECEIVING SCHOLARSHIPS AND FELLOWSHIPS ARE JUDGED WORTHY ON THE BASIS OF ACADEMIC ACHIEVEMENT, FINANCIAL NEED, AND OTHER SIMILAR STANDARDS."
202020809349300922,350868086,"Schedule I, Part I, Line 2 Procedures for monitoring use of grant funds.",The Financial Aid Office and Business Office operate together to ensure grants are used for educational purposes. Grants are applied to students' accounts by the Business Office after the grants are approved and disbursed by the Financial Aid Office.
202031009349301553,560529940,"FORM 990, SCHEDULE I, PART I, LINE 2:","CAMPBELL UNIVERSITY PARTICIPATES IN BOTH FEDERAL AND STATE GRANT PROGRAMS. ALL GRANT PROGRAMS INCLUDE ELIGIBILITY REQUIREMENTS, REPORTING REQUIREMENTS AND FUND MANAGEMENT REGULATIONS AND GUIDELINES. STUDENTS ARE AWARDED ACCORDING TO EACH PROGRAM'S GUIDELINES ONCE ELIGIBILITY HAS BEEN DETERMINED FOR THAT FUND. ELIGIBILITY IS REVIEWED BEFORE TRANSMITTAL/DISBURSEMENT TO THE STUDENT'S ACCOUNT. EACH FEDERAL AND STATE PROGRAM HAS PREDETERMINED REPORTING GUIDELINES AND STANDARDS. THE FUNDS ARE RECONCILED AND FUND BUDGETS ARE REVIEWED MONTHLY."
202020919349300502,231352641,"SCHEDULE I, PART I, LINE 2","GETTYSBURG COLLEGE'S FINANCIAL AID PROCEDURES FOR MONITORING THE USE OF GRANT FUNDS ARE DESCRIBED ON SCHEDULE F, PART V."
202010879349300301,131740469,"Schedule I, part I","THE COLLEGE PROVIDES SCHOLARSHIPS TO STUDENTS MATRICULATING AT THE COLLEGE BASED ON NEED AND/OR MERIT. THE COLLEGE MONITORS STUDENTS' FILES TO ENSURE THAT THE STUDENT RECEIVES NECESSARY FINANCIAL ASSISTANCE BASED ON GRADES, COURSE OF STUDY AND FINANCIAL NEED. ALL FUNDS GRANTED ARE REQUIRED TO BE USED TO DEFRAY THE COSTS OF ATTENDANCE; FUNDS MAY NOT BE SPENT ON DISCRETIONARY ITEMS."
202011299349300336,741109620,"Schedule I, Part I, Line 2 Procedures for monitoring use of grant funds.","Institutional need and merit awards, government grants and outside scholarships provided aid to 4,189 students during the year. Federally subsidized loans are awarded to eligible students based on need. Over $20 million was paid directly to students (Form 990, Part III, line 4a) with the remainder applied internally to tuition, fees, and room and board."
202040919349300834,590624401,"PART I, LINE 2:","GRANTS ARE APPLIED DIRECTLY TO STUDENT ACCOUNTS. THE COLLEGE MONITORS STUDENT TUITION ACCOUNTS FOR ANY STUDENT WHO RECEIVED A SCHOLARSHIP OR TUITION CREDIT. THE BURSAR'S OFFICE AND THE FINANCIAL AID OFFICE ENSURE THAT STUDENTS WHO RECEIVE SCHOLARSHIPS OR TUITION CREDITS MAINTAIN FULL-TIME OR PART-TIME STUDENT STATUS AND MEET ALL OTHER REQUIREMENTS, AS REQUIRED BY THE AWARDED SCHOLARSHIP, SO THAT THE FUNDS ARE USED FOR THEIR INTENDED PURPOSE."
202010089349300531,660177776,"Schedule I, Part I, Line 2","Financial Aid Assistance are awarded based on US, State, and private guidelines as required by the type or source of assistance."
202001409349301025,340714600,"PART I, LINE 2:",MONITORING USE OF GRANT FUNDS - CLEVELAND INSTITUTE OF MUSIC CREDITS THE GRANTS AND OTHER ASSISTANCE DIRECTLY TO THE STUDENTS' ACCOUNTS AND THEREFORE ENSURES THAT THE FUNDS ARE SPENT FOR EDUCATIONAL PURPOSES. WORK-STUDY AND AUDITION ASSISTANCE ARE PAID DIRECTLY TO THE STUDENTS WHEN EARNED OR INCURRED.
202030769349301568,131740445,GRANTS AND OTHER ASSISTANCE IN THE UNITED STATES,"FORM 990, SCHEDULE I, PART I, LINE 2 THE COLLEGE PROVIDES SCHOLARSHIPS TO STUDENTS MATRICULATING AT THE COLLEGE; THESE SCHOLARSHIPS MAY ONLY BE USED BY STUDENTS TO DEFRAY THE COSTS OF TUITION AND/OR ROOM AND BOARD. SINCE THE STUDENTS MAY NOT EXERCISE ANY DISCRETION ON HOW THE FUNDS ARE SPENT, THE COLLEGE IS NOT REQUIRED TO MONITOR THE GRANTS (OTHER THAN TO ENSURE THAT THE STUDENT IS FULFILLING THE REQUIREMENTS FOR EARNING THE SCHOLARSHIP)."
202020649349300537,311048513,"Schedule I, Part I, Line 2",Financial aid to students.
202000519349300500,930391586,"SCHEDULE I, PART I, LINE 2",GRANTS AND SCHOLARSHIPS ARE MONITORED FOR APPROPRIATE USE BY VALIDATING REGISTRATION AND SATISFACTORY PROGRESS TOWARDS COMPLETION OF EDUCATIONAL REQUIREMENTS.
202041679349300939,756114836,"Part I, Line 2:",Financial aid awards are granted to students based on the general criteria for institutional financial aid. No cash changes hands as financial aid is applied directly to student accounts through the college's academic management system.
202000219349300920,610444825,"Schedule I, Part I, Line 2","The Office of Financial Aid maintain records to substantiate the amount of the grants or assistance disbursed to students, the students' eligibility for the grants or assistance, and the selection criteria used to award the grants or assistance."
202031339349301123,590624364,"Part I, Line 2:","The University awards grants, scholarships & student loans based on various, predefined criteria. Students must qualify for the assistance. Student enrollment and continuing eligibility are verified on an ongoing basis. Any amounts in excess of $600.00 are reported on Form 1098-T. No cash changes hands and funds are directly applied to student accounts."
202040909349300604,381358014,"Schedule I, Part I, Line 2","Scholarships are awarded based on established criteria, including donor restrictions."
202040869349300824,010263385,"PART I, LINE 2:",THE COLLEGE'S FINANCIAL AID OFFICE AWARDS SCHOLARSHIPS TO STUDENTS BASED ON ESTABLISHED FEDERAL AND COLLEGE POLICIES. AWARDS ARE CREDITED TO THE STUDENTS' ACCOUNT AT THE COLLEGE AS CREDITS TO TUITION AND OTHER FEES.
202041819349300909,156019050,"PART I, LINE 2:","AWARDING OF INSTITUTIONAL AID IS DRIVEN BY THE AWARD THE STUDENT RECEIVES UPON ENTRANCE TO DAVIS COLLEGE. COMING IN AS A NEW STUDENT, THE ADMISSIONS AND FINANCIAL AID SCHOLARSHIP COMMITTEE FIRST DETERMINES IF THE STUDENT IS ELIGIBLE FOR MERIT BASED AWARDS. THESE AWARDS ARE BASED ON ACADEMIC AND CO-CURRICULAR ACTIVITIES. EACH STUDENT IS THEN COMPARED TO A FINANCIAL AID AWARDING MATRIX WHICH IS COMPRISED OF VARYING NEED LEVELS FOR GRANT FUNDING, CAMPUS BASED AID AND CAMPUS EMPLOYMENT. STUDENTS ARE PLACED ON THIS GRID BY USING THE ADMISSIONS SCHOLARSHIP CRITERIA TO DETERMINE THEIR RATING AND THEN THEIR FINANCIAL NEED FACTOR AS DETERMINED BY THE FREE APPLICATION FOR FEDERAL STUDENT AID (FAFSA) FOR THAT ACADEMIC YEAR."
202021359349302367,231352661,"Schedule I, Part I, Line 2",Student financial need is substantiated based on information provided in the Free Application for Federal Student Aid -- FAFSA. Additionally some aid is given based on High School GPA or standardized test (SAT or ACT) scores. Title IV funds are handled in accordance with applicable provisions. Student Financial Aid is treated as a reduction to tuition. The Financial Aid program is audited in compliance with the Federal OMB A-133 guidelines and no deficiencies were found during the time period covered by this filing.
202001359349300440,383001876,"Schedule I, Part I, Line 2","Student financial aid is awarded after an application and verification process, using FAFSA for establishing financial need, GPA and recommendations to establish merit. Competitions and other award qualifications are used to determine eligibility where applicable. Records are maintained in the Financial Aid office; scholarships and awards are applied directly to student accounts."
202030579349300223,440545914,"SCHEDULE I, PART I, LINE 2",THE SCHOLARSHIPS/FINANCIAL AID AWARDED TO STUDENTS IS APPLIED AGAINST THEIR TUITION ACCOUNTS.
202031699349300433,134304343,"Schedule I, Part I, Line 2",Keep Record of air tickets of persons participating in Bangladesh mission.
202021359349302327,050306206,"PART I, LINE 2:",PART II - THE OFFICE OF THE CHANCELLOR MONITORS ALL FUNDS ALLOCATED TO EXTERNAL ORGANIZATIONS. PART III- THE UNIVERSITY PROVIDES ASSISTANCE IN THE FORM OF SCHOLARSHIPS THAT ARE ALL APPLIED TO STUDENTS' ACCOUNTS RECEIVABLE BALANCES.
202011819349301651,060646520,"PART I, LINE 2:",THE COLLEGE MAINTAINS A LISTING OF FINANCIAL AID AWARDED TO EACH STUDENT.
