object_id,ein,FrmAndLnRfrncDsc,ExplntnTxt
202011969349305211,930398802,Additional Supplemental Information,"All grant funds received by the university are overseen by our Financial Aid Department. The Director of Financial Aid works closely with the Dept of Education and our Student Accounts Department to ensure proper management of the students' funds. As funds are approved and released, disbursement reports are given to our Student Accounts Department and funds are electronically uploaded to the individual student tuition accounts and verified for accuracy. All funds are uploaded within the prescribed window of three business days and all funds are available to the student with 14 days of disbursement to their account."
202041959349303504,135562308,"PART I, LINE 2:","GRANTS AND OTHER ASSISTANCE AWARDED TO INDIVIDUALS IN THE UNITED STATES REPRESENT STUDENT FINANCIAL AID. STUDENTS RECEIVING FINANCIAL AID ARE DETERMINED TO BE WORTHY BY THE UNIVERSITY'S ASSESSMENT ON THE BASIS OF ACADEMIC ACHIEVEMENT, FINANCIAL NEED AND OTHER SIMILAR STANDARDS. THE OFFICE OF FINANCIAL AID AND THE FINANCE OFFICE FOR EACH COLLEGE CONTINUOUSLY MONITOR STUDENT ELIGIBILITY FOR THESE AWARDS."
202000909349300820,270869586,"PART I, LINE 2:",EACH GRANTEE IS ONLY GIVEN FUNDS AFTER THEY PROVIDE THE COLLEGE-READY PROMISE WITH A DETAILED ACCOUNT OF WHAT THE FUNDS HAVE EITHER BEEN SPENT ON PREVIOUSLY OR WHAT THEY WILL BE SPENT ON IN THE FUTURE.
202031979349306413,160743996,"PART I, LINE 2:","RECORDS OF GRANTS PROVIDED TO STUDENTS ARE MAINTAINED BY THE FINANCIAL AID OFFICE, AND ARE PERIODICALLY RECONCILED WITH BUSINESS OFFICE RECORDS, INCLUDING THE STUDENT ACCOUNTS AND INSTITUTIONAL BUDGET."
201933179349303313,381619831,"Monitoring procedures (Part I, line 2)","Scholarships are determined by FAFSA requirements, and need base."
202041979349304744,510305893,"PART I, LINE 2:","SCHOLARSHIPS ARE AWARDED BASED UPON MERIT OR FINANCIAL NEED. STUDENTS APPLY FOR INDIVIDUAL SCHOLARSHIPS THROUGH THE OFFICE OF INSTITUTIONAL ADVANCEMENT AND ARE AWARDED BASED UPON THE CRITERIAL FOR EACH INDIVIDUAL SCHOLARSHIP THEY ARE AWARDED BY A COMMITTEE. ATHLETIC SCHOLARSHIPS ARE AWARDED DURING THE RECRUITMENT PROCESS AND ARE AWARDED BASED UPON MERIT. FRESHMAN ENROLLMENT SCHOLARSHIPS ARE OFFERED TO INCOMING FRESHMEN BASED UPON THEIR INDIVIDUAL HIGH SCHOOL PERFORMANCE, SAT SCORES, AND FINANCIAL NEEDS. THE UNIVERSITY PROVIDES SCHOLARSHIPS TO STUDENT MATRICULATION AT THE COLLEGE, THEREFORE, ALL FUNDS GRANTED ARE USED TO DEFRAY THE COST OF TUITION AND NO FURTHER MONITORING OF THE GRANTS IS REQUIRED."
202030859349300133,570324906,"Part I, Line 2:","The Office of Financial Aid and Scholarships at Anderson University requires students to complete the Free Application for Federal Student Aid (FAFSA) form to determine eligibility for federal, state and institutional grants, scholarships and loans. This is an equitable formula that measures all assets consistently. In addition to this form, the University does require some other guidelines in the event that funds are offered based upon certain academic credentials or performance in a University sponsored activity or athletic event. These credentials are clearly stated in the University catalog and the University website. Enrollment and eligibility are monitored by the University to ensure students remain eligible for funds awarded."
202031369349303453,350868188,"Schedule I, Part II, Line 1(h) Explanation of purpose of grant or assistance","Payments related to work performed on research subcontract related to federal, state or private grant originally made to the University and other assistance in accordance with the University's exempt mission."
202031369349303453,350868188,"Schedule I, Part I, Line 2 Procedures for monitoring use of grant funds.","ALL GRANTS MADE FOR RESEARCH ACTIVITIES ARE INITIATED BY A FORMAL SUB-CONTRACT EXECUTED BY BOTH PARTIES. THE TERMS AND CONDITIONS OF EACH GRANT CONTAIN ALL THE GUIDELINES FOR INVOICING, BILLING, RECORD RETENTION, AUDITS, ETC. RESEARCH AND SPONSORED PROGRAMS ACCOUNTING (""RSPA"") AND THE NOTRE DAME RESEARCH OFFICE WORK IN TANDEM TO ENSURE THE GUIDELINES ARE ADHERED TO. ALMOST ALL SUBCONTRACTS FOR RESEARCH ACTIVITIES ARE PAID ON A COST REIMBURSEMENT BASIS. ALL INVOICES PAID FOR COSTS ARE APPROVED BY THE PRINCIPAL INVESTIGATOR BASED ON COMPLETION OF WORK, DELIVERABLES MET, ETC. IN ADDITION, RSPA MONITORS THE PAYMENTS AGAINST THE TOTAL BUDGET TO ENSURE PAYMENT IS NOT MADE ABOVE THE STIPULATED CEILING. THE UNIVERSITY HAS A POLICY CONTAINING GUIDELINES SURROUNDING SUB-CONTRACTS, SOME OF WHICH WERE ADDRESSED ABOVE. THIS POLICY CAN BE FOUND AT: HTTP://CONTROLLER.ND.EDU/ASSETS/91679/SUBRECIPIENT_MONITORING.PDF. CHARITABLE ORGANIZATIONS THAT RECEIVE CONTRIBUTIONS FROM THE UNIVERSITY ARE CAREFULLY SELECTED AND REQUIRE DOCUMENTATION TO SUPPORT THE UNIVERSITY'S INTEREST IN THE ORGANIZATION TO ENSURE CONSISTENCY WITH THE CORE VALUES OF THE UNIVERSITY. CHARITABLE CONTRIBUTIONS ALSO REQUIRE THE APPROVAL OF THE EXECUTIVE VICE PRESIDENT, EXCEPT FOR THOSE CHARITABLE CONTRIBUTIONS MADE THROUGH THE UNIVERSITY'S DONOR ADVISED FUND PROGRAM, WHICH UNDERGO A THOROUGH VETTING PROCESS BY THE UNIVERSITY'S TAX DEPARTMENT TO ENSURE THE RECIPIENT ORGANIZATION MEETS THE IRS'S DEFINITION OF A 501(C)(3) NOT FOR PROFIT CHARITABLE ORGANIZATION. THE UNIVERSITY PROVIDES FUNDING TO STUDENTS AND OTHER RELATED INDIVIDUALS FOR RESEARCH AND OTHER ACTIVITIES TO SUPPORT THE FURTHERANCE OF THEIR EDUCATION. FUNDS PROVIDED ARE MONITORED THROUGH APPLICATIONS, BUDGETS AND A REQUIREMENT TO DOCUMENT THE USE OF FUNDS EITHER PRIOR TO THE DISTRIBUTION OF FUNDS OR UPON COMPLETION OF THE ACTIVITY."
202001419349301235,111797182,"Schedule I, Part I, Line 2","The College follows federal, state and institutional policies and regulations to monitor grants and funds: 1) the student applies for the grants; 2) grants are awarded from the various funding sources depending on need and/or academic standing; 3) the student's eligibility is verified through federal, state and institutional requirements, matriculation, registration, attendance and academic progress; 4) grants and awards are processed onto the student's account; 5) where loans are involved, the College follows up with the regulatory requirements after graduation. The Free Application for Federal Student Aid (FAFSA) is an integral part of this process."
202031059349301903,951684793,"Schedule I, Part I, Line 2",Institutional scholarships and grants are monitored by disbursing funds from financial aid to the business office.
202030919349300118,470376551,"PART I, LINE 2:","MIDLAND UNIVERSITY OFFERS SCHOLARSHIPS AND GRANTS TO QUALIFIED STUDENTS TO HELP REDUCE THEIR OUT-OF-POCKET TUITION COSTS. STUDENTS RECEIVING FINANCIAL ASSISTANCE OF THIS FORM MUST MEET SPECIFIC CRITERIA SUCH AS ACADEMIC ACHIEVEMENT, FINANCIAL NEED AND OTHER SIMILAR STANDARDS WHETHER PUT IN PLACE BY THE COLLEGE OR BY DONORS OF RESTRICTED FUNDS."
202021919349302757,741109641,"SCHEDULE I, PART I, LINE 2","ST. EDWARD'S UNIVERSITY'S OFFICE OF STUDENT FINANCIAL SERVICES MONITORS THE USE OF GRANT FUNDS USING A TASK FOR ENROLLMENT MANAGEMENT, COMPLIANCE AND FUNDS MANAGEMENT, AND ANNUAL INDEPENDENT AUDITS. THE ENROLLMENT COMMITTEE REVIEWS AWARDING AND RENEWAL POLICIES FOR THE UNIVERSITY GRANTS AND SCHOLARSHIPS AND ESTABLISHES FRESHMEN AND TRANSFER ENROLLMENT GOALS ALONG WITH THE FINANCIAL AID PACKAGING STRATEGY NECESSARY TO ACHIEVE THESE GOALS. THE COMMITTEE ENGAGES A NATIONALLY RECOGNIZED LEADER IN THE ENROLLMENT MANAGEMENT CONSULTING FIELD TO ASSIST IN THE ESTABLISHMENT AND MONITORING OF FRESHMEN AND TRANSFER ENROLLMENT GOALS AND FINANCIAL AID PACKAGING. EACH COMMITTEE MEMBER AND OTHER KEY UNIVERSITY PERSONNEL RECEIVE WEEKLY REPORTS THROUGHOUT THE FINANCIAL AID AWARDING CYCLE. THE TASK FOR ENROLLMENT MANAGEMENT IS COMPRISED OF THE PROVOST, VICE PRESIDENT STUDENT AFFAIRS, VICE PRESIDENT FINANCE AND ADMINISTRATION, VICE PRESIDENT ENROLLMENT MANAGEMENT, VICE PRESIDENT MARKETING AND COMMUNICATIONS, VICE PRESIDENT INSTITUTIONAL EFFECTIVENESS AND PLANNING, ASSOCIATE VICE PRESIDENTS ACADEMIC SERVICES, ASSOCIATE VICE PRESIDENTS ACADEMIC AFFAIRS, ASSOCIATE VICE PRESIDENT ATHLETICS AND THE DIRECTOR OF STUDENT FINANCIAL AID. TO ENSURE COMPLIANCE AND PROPER FUND MANAGEMENT, THE UNIVERSITY USES AN ENTERPRISE SOFTWARE TO TRACK ALL FUNDING SOURCES FOR SCHOLARSHIPS FROM UNIVERSITY, FEDERAL, STATE, LOCAL AND PRIVATE SOURCES. THE SOFTWARE HAS A COMPREHENSIVE COMPLIANCE AND FUNDS MANAGEMENT MODULE AND ALLOWS STAFF TO ADD ADDITIONAL FUNCTIONALITY AS NECESSARY. THE COMPLIANCE MODULE IDENTIFIES GRANT AND SCHOLARSHIP OFFERS THAT FAIL TO MEET AWARDING CRITERIA AND PREVENTS FINANCIAL AID FROM BEING APPLIED TO A STUDENT IF THE STUDENT DOES NOT MEET THE DISBURSING CRITERIA. FINANCIAL AID RECORDS AND UNIVERSITY GENERAL LEDGER RECORDS ARE RECONCILED USING THE FUNDS MANAGEMENT FUNCTION. ADDITIONAL MONITORING IS ACCOMPLISHED THROUGH DIAGNOSTIC REPORTS BY FINANCIAL AID IDENTIFYING CODES, TYPES OF GRANTS, FORMS OF GRANTS AND INDIVIDUAL FUNDING SOURCES. ANNUAL AUDITS ARE PERFORMED BY AN INDEPENDENT PUBLIC ACCOUNTING FIRM THAT RENDERS AN OPINION AS TO WHETHER FEDERAL AND CERTAIN STATE FUNDED FINANCIAL AID PROGRAMS ARE EXERCISED IN COMPLIANCE WITH APPLICABLE LAWS AND REGULATIONS GOVERNING SAID PROGRAMS."
202001339349302510,941358307,"PART I, LINE 2:","EACH TRANSACTION INVOLVING GRANTS, SCHOLARSHIPS, OR FINANCIAL AID IS MONITORED THROUGH THE STUDENT ACCOUNT. IN ADDITION, THE UNIVERSITY UNDERGOES ANNUAL AUDITS OF ITS FINANCIAL AID PROCESSES AND PROCEDURES. THE AUDITORS TEST THE UNIVERSITY'S COMPLIANCE WITH APPLICABLE RULES AND REGULATIONS."
202041349349302854,231352635,"PART I, LINE 2:",STUDENT SCHOLARSHIPS ARE APPLIED DIRECTLY TO STUDENT ACCOUNTS. TRAVEL AND STUDENT RESEARCH GRANTS REQUIRE SUBSTANTIATION.
202041349349302854,231352635,PART III: ACCOUNTING FOR CASH AND NONCASH ASSISTANCE:,"PAYMENTS/REIMBURSEMENTS DIRECTLY TO RECIPIENTS ARE CONSIDERED CASH ASSISTANCE. PAYMENTS TO VENDORS TO BENEFIT RECIPIENTS, OR THE PURCHASE OF NONCASH ITEMS TO BE GIVEN TO RECIPIENTS, ARE CONSIDERED NONCASH ASSISTANCE."
202041349349302854,231352635,"PART III, COLUMN B: NUMBER OF RECIPIENTS","THE NUMBER OF RECIPIENTS FOR STUDENT SCHOLARSHIPS IS BASED ON FINANCIAL AID RECORDS OF RECIPIENTS. THE NUMBER OF RECIPIENTS FOR PRIZES AND AWARDS IS ESTIMATED BASED ON THE NUMBER OF PAYEES (CASH PRIZES/AWARDS), AND THE NUMBER OF RECIPIENTS BENEFITTED OR NUMBER OF ITEMS PURCHASED (NONCASH PRIZES/AWARDS). THE NUMBER OF RECIPIENTS FOR STUDENT RESEARCH AND TRAVEL GRANTS IS ESTIMATED BASED ON THE NUMBER OF PAYEES (CASH GRANTS), AND/OR THE NUMBER OF RESEARCH PROJECTS FUNDED (CASH AND NONCASH GRANTS)."
202021919349302017,560529933,"PART I, LINE 2:",SCHOLARSHIPS AND FINANCIAL AID FUNDS ARE AWARDED BY THE FINANCIAL AID DEPARTMENT AND APPLIED DIRECTLY TO STUDENT ACCOUNTS. STUDENT ACCOUNT BALANCES ARE THEN MONITORED BY THE BUSINESS OFFICE AND STUDENT ELIGIBILITY AND ACADEMIA ARE MONITORED BY THE REGISTRAR.
202011959349302526,341695897,"SCHEDULE I, PART I, LINE 2",THE UNIVERSITY OF NORTHWESTERN OHIO AWARDS FINANCIAL AID GRANTS TO STUDENTS IN ACCORDANCE WITH THE UNIVERSITY'S INSTITUTIONAL FINANCIAL AID POLICIES.
202030719349300213,060646829,"SCHEDULE I, PART I, LINE 2",MONITORING THE USE OF GRANT FUNDS: THE UNIVERSITY'S GRANTS IN THE U.S. CONSIST OF FINANCIAL AID AWARDS WHICH ARE APPLIED AGAINST STUDENTS' RECEIVABLE BALANCES DUE TO THE UNIVERSITY. THE UNIVERSITY MONITORS THESE GRANTS BY CONTROLLING THE APPLICATION OF GRANTS TO STUDENTS' BALANCES.
201942979349300724,350869063,"PART I, LINE 2:","AN INDEPENDENT SCHOLARSHIP COMMITTEE REVIEWS ALL APPLICANTS AND AWARDS THE SCHOLARSHIP AMOUNTS. ALL APPLICATIONS FOR FINANCIAL AID AND SCHOLARSHIPS ARE REVIEWED BY THE FINANCIAL AID OFFICE. STUDENTS WHO ARE QUALIFIED FOR SCHOLARSHIPS ARE REVIEWED BY THE INDEPENDENT SCHOLARSHIP COMMITTEE FOR RECOMMENDATION, FINAL RECOMMENDATIONS ARE THEN REFERRED TO THE FINANCIAL AID OFFICE FOR AWARDING."
202042039349300854,480554341,"PART I, LINE 2:",STUDENTS FILL OUT A FAFSA TO SEE WHAT GOVERNMENT AID THEY QUALIFY FOR. THE DIRECTOR FOR FINANCIAL AID AWARDS THE GOVERNMENT AID BASED ON TITLE IV RULES AND REGULATIONS AND AID FROM THE COLLEGE BASED ON COLLEGE POLICY. RECORDS ON FINANCIAL AID AWARDS ARE MAINTAINED IN STUDENT FILES. THE FINANCIAL AID DEPARTMENT IS AUDITED ANNUALLY.
202021369349300122,310536640,"PART I, LINE 2:","THE UNIVERSITY FOLLOWS GUIDELINES SET BY THE DEPARTMENT OF EDUCATION, AND STATE GOVERNMENTS, TO ENSURE THAT GRANTS TO STUDENTS ARE AWARDED TO ELIGIBLE RECIPIENTS. ALL DOCUMENTATION REGARDING THE AWARDING OF THESE GRANTS IS MAINTAINED IN THE STUDENT FILE."
202021619349301317,751596658,"PART I, LINE 2:",THE UNIVERSITY HAS A SCHOLARSHIP COMMITTEE THAT SELECTS ALL SCHOLARSHIP RECIPIENTS. THE UNIVERSITY AWARDS SCHOLARSHIPS AND GRANTS TO STUDENTS BASED ON BOTH MERIT AND NEED.
202040299349301204,420680466,"PART I, LINE 2:","STUDENTS RECEIVING SCHOLARSHIPS AND FELLOWSHIPS ARE DETERMINED BY THE OFFICE OF FINANCIAL AID THROUGH CAREFUL STUDY OF THE INFORMATION ON THE FREE APPLICATION FOR FEDERAL STUDENT AID (FAFSA), THE STUDENT'S ACADEMIC RECORD, TEST SCORES, AND RECOMMENDATIONS. DETAILED RECORDS AND STATISTICS ARE MAINTAINED BY THE OFFICE OF FINANCIAL AID AND THE OFFICE OF ASSESSMENT AND INSTITUTIONAL RESEARCH IN REGARDS TO ALL FINANCIAL AID AWARDED TO STUDENTS OF THE COLLEGE, INCLUDING GRANTS AND SCHOLARSHIPS."
202001349349302850,383071514,"PART I, LINE 2:","THE METHOD USED TO MONITOR FUNDS INCORPORATE THE FOLLOWING CORE CONCEPTS: A) EXPECTATIONS ARE DOCUMENTED, B) A BUDGET IS ESTABLISHED, C) WRITTEN REPORTS ARE REQUIRED, D) THE COLLEGE BUDGET OFFICER REVIEWS REPORTS AND MONITORS THE RELATED BUDGET, E) THE COLLEGE BUDGET OFFICER CONTACTS OVERSEAS ORGANIZATIONS TO VERIFY THAT THE RECIPIENT IS ENGAGED AS PLANNED. METHOD 2: IN CASE OF STUDENT FINANCIAL AID, ACADEMIC PROGRESS IS MONITORED."
202021339349301337,231177930,"PART I, LINE 2:","URSINUS COLLEGE PROVIDED GRANTS TOTALING $83,864 TO 91 URSINUS COLLEGE STUDENTS IN GOOD ACADEMIC STANDING FOR CAMPUS HOUSING, PRIMARILY FOR SUMMER RESEARCH. THE GRANTS ARE APPLIED DIRECTLY TO THE STUDENTS' ACCOUNTS AT URSINUS COLLEGE. URSINUS COLLEGE PROVIDED GRANTS TOTALING $45,680,938 TO 1,593 URSINUS COLLEGE STUDENTS IN GOOD ACADEMIC STANDING FOR TUITION, FEES, AND ROOM AND BOARD FOR THE ACADEMIC YEAR 2018-19. THE GRANTS ARE APPLIED DIRECTLY TO THE STUDENTS' ACCOUNTS AT URSINUS COLLEGE. URSINUS COLLEGE PROVIDED GRANTS TOTALING $183,500 TO 99 URSINUS COLLEGE STUDENTS IN GOOD ACADEMIC STANDING FOR STIPENDS WHILE ENGAGED IN SUMMER RESEARCH PROJECTS ON CAMPUS. THE STIPENDS ARE DISBURSED VIA PAYROLL TO THE INDIVIDUAL STUDENTS."
202001339349302650,760196908,"PART I, LINE 2:",GRANTS ARE FOR TUITION AND FEES THAT ARE DISBURSED IN THE BUSINESS OFFICE TO THE STUDENTS' ACCOUNTS. THE FINANCIAL AID OFFICE ENSURES THAT THE STUDENTS ARE WITHIN THEIR BUDGET ALLOWANCE. ADDITIONAL GRANTS ARE GIVEN TO PAY FOR BOOKS.
202041369349301804,132676570,MONITORING GRANTS,"FORM 990, SCHEDULE I, PART I, LINE 2 SINCE ITS INCEPTION, MANAGEMENT REVIEWS REQUESTS FOR GRANTS. THE COLLEGE MONITORS ALL REQUESTS FOR USE OF GRANT FUNDS AGAINST THE SUBMITTED BUDGETS FOR THE RESPECTIVE GRANTS. PRIOR TO SUBMISSION OF REQUESTS FOR REIMBURSEMENT, ADDITIONAL REVIEW OF EXPENDED FUNDS IS PERFORMED TO ENSURE COMPLIANCE WITH GRANT AND COLLEGE GUIDELINES. STUDENTS ARE AWARDED TUITION DISCOUNTS BASED ON VARIOUS CRITERIA. THE DISCOUNTS ARE CREDITED TO THE STUDENT'S ACCOUNTS."
202041289349301719,430655867,"Schedule I, Part I, Line 2 Procedures for monitoring use of grant funds.","The college receives grant funds from the U.S. Department of Education through the Title III and IV programs. The college awards federal financial aid to students based on eligibility criteria specified by federal regulations. The college has sophisticated internal processes to determine a student's eligibility for federal financial aid, and to monitor compliance."
202030839349300408,160759798,"Schedule I, Part I, Line 2",Student financial aid is credited to the individual student accounts and their net balances are monitored by the Business Office.
202040909349301109,364682140,"Part I, Line 2:",Grant funds consist mainly of institutional discounts for employees of Los Angeles Pacific University. The scholarships are applied directly to students' accounts.
202020569349301472,410747165,"PART I, LINE 2:","BETHAN LUTHERAN COLLEGE OFFERS SCHOLARSHIPS AND GRANTS TO QUALIFIED STUDENTS TO HELP REDUCE THEIR OUT OF POCKET TUITION COSTS. STUDENTS RECEIVING FINANCIAL ASSISTANCE OF THIS FORM MUST MEET SPECIFIC CRITERIA SUCH AS ACADEMIC ACHIEVEMENT, FINANCIAL NEED, AND OTHER SIMILAR STANDARDS WHETHER PUT IN PLACE BY THE COLLEGE OR BY DONORS OF RESTRICTED FUNDS. THESE AWARDS ARE MONITORED AND AWARDED BY THE DIRECTOR OF FINANCIAL AID."
202031309349300108,237225104,"PART I, LINE 2:","THE AWARDING OF STUDENT FINANCIAL AID GRANTS UNDER THE U.S. DEPARTMENT OF EDUCATION'S STUDENT FINANCIAL ASSISTANCE PROGRAM IS MONITERED BY NEC'S FINANCIAL AID OFFICE, WHICH ENSURES THAT NEC MEETS THE COMPLIANCE REQUIREMENTS OF TITLE 2 U.S. CODE OF FEDERAL REGULATIONS (CFR) PART 200. NEC'S FINANCIAL AID OFFICE AND BUSINESS OFFICE ARE RESPONSIBLE FOR ESTABLISHING AND MAINTAINING EFFECTIVE INTERNAL CONTROLS OVER COMPLIANCE WITH THE REQUIREMENTS OF LAWS, REGULATIONS, CONTRACTS, AND GRANTS APPLICABLE TO FEDERAL PROGRAMS. ONLY CURRENT NEC STUDENTS IN GOOD STANDING ARE PROVIDED SCHOLARSHIP GRANTS OR OTHER FINANCIAL ASSISTANCE. GRANTS AND ASSISTANCE TO NEC COLLEGE STUDENTS ARE IN THE FORM OF INSTITUTIONAL SCHOLARSHIPS. ALL COLLEGE SCHOLARSHIPS ARE ADMINISTERED THROUGH NEC'S FINANCIAL AID SYSTEM. INSTITUTIONAL SCHOLARSHIPS ARE CREDITED TO THE STUDENT'S INTERNAL TUITION ACCOUNT AND REPRESENT AN OFFSET TO TUITION AND OTHER FEES ASSESSED BY NEC. PREPARATORY PROGRAM, CONTINUING EDUCATION PROGRAM AND SUMMER SESSION SCHOLARSHIPS ARE TRACKED SEPARATELY AND ADMINISTERED THROUGH NEC'S STUDENT BILLING SYSTEM. PREPARATORY PROGRAM, CONTINUING EDUCATION PROGRAM AND SUMMER SESSION SCHOLARSHIPS ARE CREDITED TO THE STUDENT'S INTERNAL TUITION ACCOUNT AND REPRESENT AN OFFSET TO TUITION AND OTHER FEES ASSESSED BY NEC. GRANTS AND ASSISTANCE TO NEC STAFF AND THEIR ELIGIBLE SPOUSES AND DEPENDENTS ARE IN THE FORM OF STAFF TUITION WAIVERS, PURSUANT TO A WRITTEN BENEFITS PLAN. STAFF TUITION WAIVERS ARE ADMINISTERED THROUGH THE CONSERVATORY'S BENEFITS SYSTEM AND, LIKE INSTITUTIONAL SCHOLARSHIPS FOR STUDENTS, ARE CREDITED TO THE INDIVIDUAL'S INTERNAL ACCOUNT TO OFFSET TUITION CHANGES. ALL STUDENTS RECEIVING SCHOLARSHIPS AND FELLOWSHIPS ARE JUDGED WORTHY BY THE INSTITUTION'S ASSESSMENT ON THE BASIS OF ACADEMIC ACHIEVEMENT, FINANCIAL NEED AND OTHER SIMILAR STANDARDS."
202011709349301801,361408475,"FORM 990, SCHEDULE I, LINE 2","ORGANIZATION'S PROCEDURES TO MONITOR GRANT USE ALL GRANTS AND SCHOLARSHIPS ARE AWARDED ON A NONDISCRIMINATORY BASIS. AMOUNTS ARE APPLIED DIRECTLY TOWARDS A STUDENT'S TUITION, ROOM, AND BOARD COSTS, THEREBY ENSURING THE FUNDS ARE USED AS INTENDED. ADDITIONALLY, ANY ORGANIZATIONS AND ENTITIES RECEIVING SUBCONTRACT GRANTS FROM LOYOLA UNIVERSITY CHICAGO ARE REQUIRED TO SUBMIT ANNUAL PROGRESS REPORTS ON THE USE OF THESE FUNDS. THESE PROGRESS REPORTS ARE MONITORED AND REVIEWED BY THE PRINCIPAL INVESTIGATORS TO ENSURE FUNDS ARE BEING USED APPROPRIATELY."
202031939349300723,231352689,"Part I, Line 2:",Budgeted amounts are awarded to eligible students who apply for financial aid (selected by committee or using packaging rules). Awarded students are checked to ensure that they are still eligible to receive these funds during the course of the academic year. The scholarships are applied directly to each student's account.
202001089349300505,141468399,"Schedule I, Part I, Line 2 Procedures for monitoring use of grant funds.",The organization has rules in place to ensure that scholarship aid provided to students is used for authorized purposes. Additional detail is available upon request.
202000569349300100,431007642,"PART I, LINE 2:","ALL STUDENT AWARDS ARE MAINTAINED IN THE UNIVERSITY'S FINANCIAL AID SOFTWARE SYSTEM. FEDERAL AWARDS ARE BASED ON FINANCIAL AND OTHER DATA PROVIDED BY THE STUDENT AND VERIFIED, AS APPROPRIATE, BY THE UNIVERSITY. FEDERAL AWARDS ARE SUBJECT TO AN ANNUAL AUDIT BASED ON STANDARDS FOUND IN THE UNIFORM GUIDANCE AND PERFORMED BY AN INDEPENDENT AUDITOR. SELECTION CRITERIA FOR DONOR-FUNDED SCHOLARSHIPS ARE MOSTLY DETERMINED BY THE DONOR AND IS AVAILABLE IN THE FINANCIAL AID OFFICE. SELECTION CRITERIA FOR FEDERAL AND STATE AID IS ALSO FOUND IN THE FINANCIAL AID OFFICE AND AVAILABLE TO THE PUBLIC ON THE INTERNET."
202041199349300124,240795445,"SCHEDULE I, PART III",INDIVIDUALS IN THE U.S. ARE DEFINED AS THOSE LIVING IN THE U.S. AT THE TIME THE AID WAS AWARDED. THE ABOVE IS A BEST ESTIMATE BASED ON CERTAIN ASSUMPTIONS REGARDING WHERE PERSONS WERE LIVING WHEN THE AID WAS AWARDED AND DOES NOT REPRESENT THE DEGREE TO WHICH AID IS AWARDED TO INTERNATIONAL STUDENTS.
202041199349300124,240795445,"SCHEDULE I, PART I","Subrecipient grants - Lehigh University maintains a policy defining its procedures for monitoring the use of sponsored funds by subrecipients who are performing a portion of a sponsored project externally awarded to Lehigh. The policy provides guidance to ensure that subrecipients conduct their portions of sponsored projects in compliance with laws, regulations, terms and conditions of awards and subawards, and that reimbursed costs incurred by subrecipients are allowed. Other Assistance - Undergraduate assistance offered from institutional funds to our undergraduate students is awarded on the basis of merit and/or financial need. The selection criteria is based on the calculated expected family contribution, which is derived by using complex formulas involving families' income, assets, and household sizes. The student financial aid office administers and monitors these grants using system-generated reviews, along with cross checks on an ad hoc basis. Results from these reviews are regularly evaluated. Subsequently, follow-up corrective actions are taken when appropriate, and potentially include award revisions or cancellations. These provisions are designed to help ensure that student assistance funds are awarded to eligible recipients, in accordance with applicable federal, state, institutional, and other program legislation, as well as relevant internal university policies and operational guidelines. Graduate assistance offered from institutional funds to our students consists of assistantships, fellowships and scholarships. Students can also apply for a variety of private, external fellowships and scholarships."
202040539349300719,420686467,"PART I, LINE 2:","COE COLLEGE RECEIVES VARIOUS FEDERAL GRANTS FROM NSF, DEPT OF EDUCATION AND OTHER AGENCIES OR BRANCHES OF THE US GOVERNMENT. SEPARATE ACCOUNTS ARE USED FOR EACH GRANT TO MONITOR RECEIPTS AND DISBURSEMENTS. THE COLLEGE FOLLOWS APPROPRIATE ACCOUNTING AND INTERNAL CONTROL PROCEDURES. ALL REQUIRED FINANCIAL REPORTING TO THE GRANT PROVIDER ARE COMPLETED TIMELY AND AUDITS BY AN INDEPENDENT CPA FIRM ARE DONE WHEN REQUIRED. THE COLLEGE ANNUALLY COMPLETES FILINGS REQUIRED BY UNIFORM GUIDANCE. DISTRIBUTIONS TO STUDENTS ARE MADE ACCORDING TO GRANT REQUIREMENTS."
201921789349300112,446000294,"SCHEDULE I, PART I, LINE 2","AS PART OF OUR MISSION, SCHOLARSHIPS ARE AWARDED BASED ON SELECTION BY A COMMITTEE UPON SUBMISSION OF AN APPLICATION TO BE USED TOWARDS THE COST OF ATTENDANCE. THESE SCHOLARSHIPS ARE AWARDED ON A TRIMESTER BASIS. ADDITIONALLY, TUITION LEVERAGE AWARDS ARE OFFERED BASED ON MERIT. THESE AWARDS ARE FOR TUITION ONLY AND FOLLOW THE STUDENT FOR THEIR PERIOD OF ENROLLMENT AS LONG AS THEY MAINTAIN GOOD STANDING."
201943059349300819,750959996,Grantmaker's Description of How Grants are Used,"BAPTIST MISSIONARY ASSOCIATION THEOLOGICAL SEMINARY UTILIZES A SPECIALIZED SOFTWARE PROGRAM TO TRACK THE USE OF FINANCIAL AID FUNDS. A PROSPECTIVE RECIPIENT APPLIES ONLINE THROUGH A GOVERNMENT WEB SITE WHO THEN SENDS THE INFORMATION TO THE SEMINARY. INFORMATION ON THE APPLICATION IS VERIFIED INTERNALLY AND, BASED ON GUIDELINES IN THE FEDERAL STUDENT FINANCIAL AID HANDBOOK, IT IS DETERMINED THE AMOUNT OF AID THE RECIPIENT QUALIFIES FOR. UPON RECEIPT OF THE FUNDS, PROCEDURES ARE IN PLACE TO ENSURE THAT THE FUNDS ARE CREDITED DIRECTLY TO THE RECIPIENTS ACCOUNT."
202000699349300920,160743140,"Schedule I, Part III NUMBER OF RECIPIENTS",THE UNIVERSITY ESTIMATES THE NUMBER OF RECIPIENTS FROM RECORDS MAINTAINED IN OUR FINANCIAL AID (SCHOLARSHIPS) AND ACCOUNTS PAYABLE SYSTEM (GRADUATE RESEARCH ASSISTANCE STIPENDS AND FELLOWSHIPS) WHICH HAVE BEEN CLASSIFIED BY THE TYPE OF ASSISTANCE.
202000699349300920,160743140,"Schedule I, Part I, Line 2 Procedures for monitoring use of grant funds.","SCHOLARSHIPS, FELLOWSHIPS, AND OTHER STUDENT RELATED FINANCIAL AID MUST BE USED FOR EDUCATIONAL PURPOSES. SCHOLARSHIPS AND GRANTS ARE CREDITED DIRECTLY TO STUDENT ACCOUNTS THROUGH AN AUTOMATED SYSTEM AUTHORIZED BY THE UNIVERSITY'S OFFICE OF FINANCIAL AID AND SCHOLARSHIPS."
202001839349302160,446000294,"SCHEDULE I, PART I, LINE 2","AS PART OF OUR MISSION, SCHOLARSHIPS ARE AWARDED BASED ON SELECTION BY A COMMITTEE UPON SUBMISSION OF AN APPLICATION TO BE USED TOWARDS THE COST OF ATTENDANCE. THESE SCHOLARSHIPS ARE AWARDED ON A TRIMESTER BASIS. ADDITIONALLY, TUITION LEVERAGE AWARDS ARE OFFERED BASED ON MERIT. THESE AWARDS ARE FOR TUITION ONLY AND FOLLOW THE STUDENT FOR THEIR PERIOD OF ENROLLMENT AS LONG AS THEY MAINTAIN GOOD STANDING."
