object_id,ein,FrmAndLnRfrncDsc,ExplntnTxt
202011059349301951,250981156,"PART I, LINE 2:","FINANCIAL AID IS AWARDED TO INCOMING FIRST YEAR STUDENTS ON THE BASIS OF THE RESULTS OF THE FREE APPLICATION FOR FEDERAL STUDENT AID (FAFSA) AND BY THE USE OF A FINANCIAL AID MATRIX. THE FINANCIAL AID MATRIX IS BASED ON ACADEMIC ABILITY AND FINANCIAL NEED. WITHIN EACH CELL OF THE MATRIX THERE IS A FLOOR AND A CEILING RANGE USED FOR THE AWARDING OF INSTITUTIONAL FUNDS. A STUDENT IS PLACED INTO A FINANCIAL AID MATRIX CELL BASED ON BOTH HIGH SCHOOL GRADE POINT AVERAGE AND SAT AND/OR ACT SCORES. THE AMOUNT A STUDENT IS AWARDED BETWEEN THE FLOOR AND CEILING VALUE IN THE CELL IS BASED ON FINANCIAL NEED AS DETERMINED BY THE FAFSA. INSTITUTIONAL MERIT AWARDS (AWARDED BY ADMISSIONS) THESE ARE AWARDED TO STUDENTS REGARDLESS OF FINANCIAL NEED. MERIT SCHOLARSHIPS (UNFUNDED AID) ACCEPTED FIRST YEAR STUDENTS ARE AWARDED A MERIT SCHOLARSHIP DETERMINED BY WHERE THEY FALL IN THE MATRIX BASED ON HIGH SCHOOL GRADE POINT AVERAGE AND SAT AND/OR ACT SCORES. THE MERIT SCHOLARSHIP AWARD IS THE FLOOR VALUE FROM THE RESPECTIVE MATRIX CELL. STUDENTS WHO MEET THE REQUIREMENTS FOR THE TOP MERIT SCHOLARSHIP ARE FURTHER CONSIDERED BY THE SCHOLARSHIP REVIEW COMMITTEE FOR WESTMINSTER COLLEGE'S FULL TUITION SCHOLARSHIPS, THE PRESIDENTIAL AND THE LEMMON SCHOLARSHIPS. THERE ARE A LIMITED NUMBER OF EACH OF THESE SCHOLARSHIPS AWARDED ON AN ANNUAL BASIS. NOMINATED MERIT BASED SCHOLARSHIPS (UNFUNDED AID) THE NOMINATED SCHOLARSHIPS AVAILABLE TO INCOMING FIRST YEAR STUDENTS ARE: 1) THE YOUNG PRESBYTERIAN SCHOLARSHIP -TO BE ELIGIBLE A STUDENT MUST BE A MEMBER OF THE PRESBYTERIAN CHURCH USA, BE NOMINATED BY HIS/HER CHURCH AND PRESENT A MINIMUM GPA OF 3.5. 2) JERB MILLER SCHOLARSHIP -TO BE ELIGIBLE A STUDENT MUST BE NOMINATED BY AN EDUCATOR WHO IS A WESTMINSTER COLLEGE GRADUATE AND PRESENT A MINIMUM GPA OF 3.5. 3) LEGACY SCHOLARSHIP (FUNDED AID) -TO BE ELIGIBLE A STUDENT MUST PRESENT A CUMULATIVE GPA OF 3.0 AND HAVE A PARENT OR GRANDPARENT WHO EARNED A DEGREE FROM WESTMINSTER COLLEGE. 4) PRESBYTERIAN HERITAGE SCHOLARSHIP -TO BE ELIGIBLE A STUDENT MUST PRESENT A CUMULATIVE GPA OF 3.5, BE A MEMBER OF A PRESBYTERIAN CHURCH (NON PCUSA) AND BE NOMINATED BY HIS/HER CHURCH MERIT SCHOLARSHIPS ARE RENEWABLE FOR UP TO THREE YEARS. THE STUDENT NEEDS TO MAINTAIN THE REQUIRED SCHOLARSHIP GPA (IF ONE EXISTS), OTHERWISE REMAIN IN GOOD ACADEMIC STANDING. INSTITUTIONAL NEED BASED AWARDS (UNFUNDED AID) NEED BASED INSTITUTIONAL FINANCIAL AID IS AWARDED TO STUDENTS BASED ON THE RESULTS OF THE FAFSA AND THE DETERMINATION OF THE STUDENTS DEMONSTRATED NEED. A STUDENT IS REQUIRED TO FILE A FAFSA FORM IN ORDER TO BE CONSIDERED FOR NEED BASED FINANCIAL AID. THE RESULTS OF THE FAFSA DETERMINE THE STUDENT'S EXPECTED FAMILY CONTRIBUTION (EFC). THE CALCULATION USED TO DETERMINE THE STUDENT'S FINANCIAL NEED IS: DIRECT COST OF ATTENDANCE* - EFC = STUDENT'S NEED (*DIRECT COST OF ATTENDANCE: TUITION & FEES, ROOM & BOARD FOR RESIDENT AND OFF CAMPUS STUDENTS, TUITION & FEES ONLY FOR COMMUTERS) THE CALCULATED STUDENT NEED IS REDUCED BY: FEDERAL NEED BASED FINANCIAL AID STATE NEED BASED FINANCIAL AID FUNDED GIFT AID INSTITUTIONAL MERIT THE REMAINING UNMET NEED, AFTER THE REDUCTIONS, IS MET BY USING INSTITUTIONAL NEED BASED GIFT AID WITH THE TOTAL OF INSTITUTIONAL AID BEING CAPPED BY THE CEILING VALUE FROM THE MATRIX CELL FOR THE STUDENT. INSTITUTIONAL NEED BASED AWARDS ARE USUALLY RENEWED PROVIDED THAT THE STUDENT CONTINUES TO DEMONSTRATE FINANCIAL NEED. FINANCIAL AID PACKAGING STUDENTS RECEIVE A FINANCIAL AID PACKAGE ANNUALLY WHICH INCLUDES ALL SOURCES OF FINANCIAL AID THAT THEY ARE ELIGIBLE AND QUALIFY FOR. AWARDS THAT MAY BE INCLUDED IN A FINANCIAL AID PACKAGE ARE: FEDERAL GRANTS (PELL AND SEOG) STATE GRANTS INSTITUTIONAL MERIT AWARDS INSTITUTIONAL NEED BASED AWARDS INSTITUTIONAL ENDOWED AWARDS FEDERAL DIRECT STAFFORD LOANS FEDERAL WORK STUDY THE COLLEGE CONTROLLER DETERMINES THE AMOUNT AVAILABLE IN ALL INSTITUTIONAL FUNDS ON AN ANNUAL BASIS. WESTMINSTER COLLEGE UNFUNDED AND FUNDED AID IS PORTABLE FOR OFF-CAMPUS STUDIES IF THE PROGRAM IS REQUIRED BY THE STUDENT'S MAJOR. THESE FUNDS ARE PORTABLE UP TO THE LESSER OF 1) THE TUITION OF THE OFF CAMPUS STUDIES PROGRAM, OR 2) THE LIMIT OF A STUDENT'S WESTMINSTER COLLEGE AWARDED AID WHERE A PARTICULAR STUDY-ABROAD PROGRAM'S TUITION IS GREATER THAN THE WESTMINSTER COLLEGE AID THE STUDENT IS ELIGIBLE TO RECEIVE FOR THE SAME PERIOD OF ENROLLMENT. BEFORE THESE FUNDS WILL BE PAID TO THE STUDY ABROAD PROGRAM ON THE STUDENT'S BEHALF, THE STUDENT IS REQUIRED TO PROVIDE A COPY OF THE INVOICE FOR THE STUDY ABROAD PROGRAM, WITH A SEPARATE LINE ITEM FOR TUITION. STUDENTS ARE REQUIRED TO HAVE THE INSTITUTION PROVIDE A COPY OF THE ACADEMIC TRANSCRIPTS FOR THE TERM(S) ABROAD TO WESTMINSTER COLLEGE. WESTMINSTER COLLEGES FINANCIAL AID OFFICE USES THE FINANCIAL AID MANAGEMENT SYSTEM POWERFAIDS TO MAINTAIN FINANCIAL AID AWARD RECORDS AND AMOUNTS."
201923189349314362,263162145,"Schedule I, Part I, Line 2 - Org.'s Proc. for Mon. the Use of Grant Funds","Although IU Health Arnett does not monitor the use of grant funds once distributed, through due diligence the organization has reasonably confirmed that the entities to which the contributions are made are highly reputable in the community and use the funds for the purposes intended."
202042129349300209,237242844,"PART I, LINE 2:","THE COLLEGE, THROUGH ITS FINANCIAL AID OFFICE, MAINTAINS RECORDS TO SUBSTANTIATE AMOUNTS, ELIGIBILITY, AND SELECTION CRITERIA USED FOR SCHOLARSHIPS. THE COLLEGE MONITORS THE ASSISTANCE BY REVIEWING GRADE TRANSCRIPTS AND ATTENDANCE RECORDS ON A QUARTERLY BASIS. FOR TUITION DISCOUNTS, IT IS THE STUDENT'S RESPONSIBILITY TO COMPLETE THE APPROPRIATE DOCUMENTATION PRIOR TO THE BEGINNING OF THE QUARTER FOR WHICH THE DISCOUNT IS REQUESTED. THE DEAN OF STUDENTS AND THE STUDENT RECEIVING THE DISCOUNT IS RESPONSIBLE FOR NOTIFYING THE FINANCIAL AID OFFICE ON A TIMELY BASIS OF ANY CHANGE IN THE STUDENT'S PERSONAL STATUS THAT WOULD HAVE BEARING ON THE STUDENT'S ENTITLEMENT TO THE DISCOUNT."
202040769349301389,350868158,"Schedule I, Part I, Line 2 Procedures for monitoring use of grant funds.","A list of scholarship recipients is on file at the institution and is available upon request. Although there may be recipients who are related to persons having an interest in the institution, such recipients are selected on an equal, objectively determinable basis with other recipients. Saint Mary's College is committed to making it possible for qualified students to enroll at the college regardless of financial circumstances. As part of this commitment, Saint Mary's College offers various levels of academic scholarships, need-based scholarships and institutional grants. Academic scholarship recipients are selected at the time of admission, on the basis of their academic achievements in high school. Need-based scholarships are named for a specific donor or group, and are awarded as part of need-based institutional grant assistance, in accordance with the specific requirements of the scholarship donor. Institutional grants are awarded primarily on financial need as the College is committed to making a Saint Mary's education a possibility for students who demonstrate financial need; each student who applies for financial aid receives consideration for grant assistance. All students receiving scholarships are judged worthy by the institution's assessment on the basis of academic achievement, financial need or other similar standards. Criteria for all scholarships is published and made available to all students and their families. Grant funds/scholarships are credited directly to a student's account to ensure they are used appropriately and for their intended purpose."
202000349349300770,410970173,"PART I, LINE 2:","THE COLLEGE PROVIDES 10% TUITION DISCOUNTS TO ELIGIBLE ALUMNI, PERSONS OFFICIALLY REGISTERED AS A MEMBER OF A NATIVE AMERICAN TRIBAL GROUP, PERSONS WHO ARE ACTIVE IN OR AN HONORABLY DISCHARGED VETERAN OF A BRANCH OF THE MILITARY AND THEIR SPOUSES, AND PERSONS CURRENTLY EMPLOYED WITH A COMMUNITY PARTNER ORGANIZATION. EMPLOYEES OF COMMUNITY PARTNER ORGANIZATIONS MUST REAPPLY FOR THE DISCOUNT EACH TERM TO VERIFY CONTINUED EMPLOYMENT. ALL OTHER ELIGIBLE PERSONS APPLY FOR THE DISCOUNT WHEN THEY ENROLL."
202000349349300790,560554199,"PART I, LINE 2:","STUDENTS ARE REQUIRED TO COMPLETE A FAFSA. ELIGIBILITY FOR SCHOLARSHIPS IS DETERMINED BY THE APPLICABLE FEDERAL AND STATE GUIDELINES, BY THEIR ACADEMIC CREDENTIALS, AND FINANCIAL NEED. STUDENTS ARE APPROPRIATELY AWARDED SCHOLARSHIPS IN THE FINANCIAL AID OFFICE AND THE AWARDS ARE TRANSFERRED TO THE STUDENTS' ACCOUNTS IN THE BUSINESS OFFICE. ALL SCHOLARSHIP AND GRANT FUNDS ARE RECONCILED EACH SEMESTER AND REPORTED TO THE APPROPRIATE AUTHORITIES OR AGENCIES. FUNDS ARE ALSO AUDITED ANNUALLY."
202000249349300400,310840764,"PART I, LINE 2:",THE COLLEGE STUDENT FINANCIAL AID OFFICE MAINTAINS RECORDS TO SUBSTANTIATE THE AMOUNTS OF TUITION ASSISTANCE INCLUDING ELIGIBILITY CRITERIA. THIS OFFICE ENSURES THAT FUNDS ARE PROPERLY CREDITED TO STUDENT ACCOUNTS AND MONITORS STUDENTS' CONTINUING ELIGIBILITY TO RECEIVE FINANCIAL ASSISTANCE.
202030589349300823,560530003,MONITORING THE USE OF GRANTS,"SCHEDULE I, PART I, LINE 2 Scholarships and fellowships are awarded by Queens University of Charlotte to students based on their academic achievement, talent in the fine arts, and participation in intercollegiate athletics. The awards are based on their performance levels. Students are also awarded need-based scholarships and grants based on their need as established by completing the Free Application for Federal Student Aid (FAFSA) and, if applicable, by specific criteria and guidelines for other Institutional, federal and state programs."
202030949349300023,351087173,"Part I, Line 2:","The College's financial aid department determines all federal and state financial aid for students based on the respective laws and regulations. The remaining need for financial assistance is then determined by the College and is based on criteria such as student activities (athletics, etc.), the academic program the student is enrolled in, the student's academic performance, and the income level of the student. These factors are then considered along with the available insitutional scholarship and grant funds in determining institutional financial assistance provided to the students."
202041339349303014,203823825,"FORM 990, SCHEDULE I","SCHOLARSHIPS ARE AWARDED TO ELIGIBLE STUDENTS OF THE CHRIST COLLEGE OF NURSING AND HEALTH SCIENCES BASED ON SCHOLARSHIP CRITERIA. THE NUMBER OF SCHOLARSHIPS IN PART III, COLUMN (B) IS ACTUAL SCHOLARSHIPS AWARDED DURING THE YEAR."
202010589349300411,237373765,"PART I, LINE 2:","ALL STUDENT AID, GRANTS, WORK STUDY AND SCHOLARSHIPS ARE GIVEN ON BEHALF OF STUDENTS ATTENDING SITTING BULL COLLEGE. THE FUNDS ARE APPLIED DIRECTLY TO THE TUITION, BOOKS, AND FEES FOR THE CORRESPONDING STUDENT TO ENSURE THAT IT IS USED FOR THE APPROPRIATE PURPOSES."
202011279349301111,240795460,"Schedule I, Part I, Line 2","Moravian College follows state and federal regulations in administering scholarships and grants as well as institutional policy when administering college funds. The college follows federal methodology to determine financial need for awarding federal funds and need-based institutional funds. All students applying for financial aid follow an annual application process by completing the Free Application for Federal Student Aid (FAFSA). Files are reviewed for conflicting information and to complete required verification of application data. Moravian credits all financial aid awards, except for work study, directly to students' receivable account offsetting charges for tuition, fees and campus room and board. Changes in student enrollment status are reviewed to ensure that students remain eligible for financial aid and awards are adjusted as necessary. Any refunds from student accounts are done in compliance with state and federal regulations."
202001359349303465,560529988,"PART I, LINE 2:",ALL GRANTS ARE SCHOLARSHIPS MADE TO STUDENTS AT THE UNIVERSITY. STUDENTS MUST MAINTAIN ENROLLMENT AND CERTAIN REQUIREMENTS TO MAINTAIN THEIR SCHOLARSHIPS. STUDENTS MUST SUBMIT FINANCIAL INFORMATION TO ESTABLISH QUALIFICATIONS FOR NEEDS BASED SCHOLARSHIPS.
202031979349302188,131624225,"SCHEDULE I, PART I, LINE 2",YESHIVA UNIVERSITY CONDUCTS SITE VISITS AND FOLLOW-UP DISCUSSIONS WITH THE MANAGEMENT OF GRANTEES TO ASSURE THAT GRANT FUNDS ARE USED FOR THE INTENDED TAX-EXEMPT PURPOSES. THE ACTIVITIES OF FELLOWSHIP RECIPIENTS ARE MONITORED TO ENSURE COMPLIANCE WITH THE INTENTIONS AND GUIDELINES OF THE FELLOWSHIP GRANT.
202031979349302188,131624225,"SCHEDULE I, PART III","THE $95,162,657 IN GRANTS AND ASSISTANCE REPRESENT STUDENT FINANCIAL AID, SCHOLARSHIPS AND FELLOWSHIPS, INCLUDING EMERGENCY STUDENT ASSISTANCE GRANTS. FINANCIAL AID IS AWARDED BASED UPON FINANCIAL NEED AND ACADEMIC ACHIEVEMENT. NEED BASED AID IS AWARDED BASED ON ELIGIBILITY DETERMINED BY THE US DEPARTMENT OF EDUCATION'S FREE APPLICATION FOR FEDERAL AID (FAFSA). ACADEMIC BASED AID IS AWARDED BY THE DISTINGUISHED SCHOLARS COMMITTEE. BOTH FACULTY AND ENROLLMENT SERVICES ADMINISTRATORS COMPRISE THE COMMITTEE."
202031359349301613,131740451,"SCHEDULE I, PART I, LINE 2","GRANT MONITORING: ANY ORGANIZATION OR ENTITY THAT RECEIVES SUBAWARDS FROM FORDHAM UNIVERSITY IS REQUIRED TO SUBMIT BOTH FINANCIAL AND PROGRAM PROGRESS REPORTS, EITHER ON A MONTHLY OR QUARTERLY BASIS, AS TO THE USE OF FUNDS. THE REQUIRED FREQUENCY OF REPORTING, AS WELL AS OTHER MONITORING CONTROLS, ARE DEPENDENT UPON REQUIREMENTS OF THE PRIMARY GRANTING AGENCY AND UPON THE RESULTS OF A PREAWARD RISK ASSESSMENT, WHICH IS PERFORMED ON ALL SUBRECIPIENTS PRIOR TO ISSUING AWARDS. FINANCIAL AND PROGRAM PROGRESS REPORTS RECEIVED FROM GRANTEES ARE MONITORED AND REVIEWED BY PRINCIPAL INVESTIGATORS, THE OFFICE OF SPONSORED PROGRAMS AND THE GRANTS ACCOUNTING OFFICE TO ENSURE FUNDS ARE USED APPROPRIATELY. IN ADDITION, PRINCIPAL INVESTIGATORS MEET REGULARLY WITH SUBGRANTEES, WHICH INCLUDES FIELD VISITS TO OBSERVE ACTIVITIES ON A FIRST-HAND BASIS. SCHOLARSHIP GRANT MONITORING: FORDHAM PROVIDES VARIOUS TYPES OF FINANCIAL ASSISTANCE TO PROMOTE ACCESS AND AFFORDABILITY TO STUDENTS. FORDHAM'S STUDENT FINANCIAL AID DEPARTMENT WORKS WITH STUDENTS TO HELP THEM DEVISE A PLAN TO FUND THEIR EDUCATION. ASSISTANCE MAY INCLUDE A COMBINATION OF GRANTS, LOANS AND PAYMENT PLANS DEPENDING ON INDIVIDUAL CIRCUMSTANCES AND RESOURCES. SCHOLARSHIP GRANTS ARE AWARDED ON THE BASIS OF FINANCIAL NEED AND/OR SCHOLASTIC ACHIEVEMENT, AND ON A NON-DISCRIMINATORY BASIS. STUDENTS MUST COMPLETE CERTAIN QUESTIONNAIRES AND APPLICATIONS TO DEMONSTRATE THEIR QUALIFICATION OR VARIOUS TYPES OF FEDERAL, STATE, LOCAL, AND INSTITUTIONAL FINANCIAL ASSISTANCE. THE VARIOUS FINANCIAL ASSISTANCE PROGRAMS HAVE PARTICULAR ELIGIBILITY AND MONITORING REQUIREMENTS, SUCH AS THOSE PROVIDED BY THE CODE OF FEDERAL REGULATIONS. THESE REQUIREMENTS MAY INCLUDE A MINIMUM COURSE LOAD, DEMONSTRATED ACADEMIC PROGRESS, AND OTHER SIMILAR REQUIREMENTS. SCHOLARSHIP GRANTS ARE APPLIED DIRECTLY TOWARD A STUDENT'S TUITION AND ROOM AND BOARD COSTS, THEREBY INSURING THE FUNDS ARE USED AS INTENDED."
202001959349300610,231352651,"SCHEDULE I, PART I, LINE 2",GRANTS ARE MONITORED BY THE ORGANIZATION'S FINANCE PERSONNEL THROUGH THE UTILIZATION OF COST CENTERS AND OTHER INFORMATION; INCLUDING WRITTEN DOCUMENTATION AND RECEIPTS.
202010999349300801,251120678,"PART I, LINE 2:","GRANTS (FEDERAL/STATE) PASSED THROUGH TO STUDENTS ARE MONITORED USING OUR INTERNAL APPLICATION (POWERFAIDS), THE STATE (PHEAA) AND FEDERAL (COD-COMMON ORIGINATION AND DISBURSEMENT) ELECTRONIC SYSTEMS. A VALIDATION OF RECORDS AMONG ALL THREE SYSTEMS IS CONDUCTED PERIODICALLY THROUGHOUT THE ACADEMIC YEAR AND FOR SEMESTER END RECONCILIATIONS. THOSE SYSTEMS VERIFY THE CRITERIA FOR THE GRANTS HAVE BEEN MET AND THE DOLLAR AMOUNTS RECEIVED HAVE BEEN DISTRIBUTED APPROPRIATELY."
201903199349310165,391620530,"PART I, LINE 2:",MOST GRANTS AND SCHOLARSHIPS ADMINISTERED BY BELLIN COLLEGE FOLLOW A SCORING GRID BASED ON A VARIETY OF FACTORS. SOME ARE AUTOMATIC BASED ON THE INCOMING STUDENTS ACADEMIC RECORD AND OTHER REQUIRE THE STUDENT TO APPLY FOR THE SCHOLARSHIP. THE BURSAR AND DIRECTOR OF FINANCIAL AID RECONCILE AWARDS/PAYMENTS ON A REGULAR BASIS TO ENSURE ACCURACY ON STUDENTS' ACCOUNTS.
202041009349300024,750827465,"Schedule I, Part I, Line 2 Procedures for monitoring use of grant funds.","By institutional policy, TCU's office of scholarship and financial aid acts as the final approval authority for all financial aid eligibility determination. Each student's award package is reviewed to ensure compliance with applicable regulatory requirements, and in the case of restricted institutional funds, with the donor's intent and wishes. Academic scholarship eligibility is based on a scoring matrix that evaluates an individual student's success using national test scores, high school GPA, and rigor of curriculum. Those who have excelled academically are generally given the largest share of university funded dollars. Institutionally funded need-based financial aid programs are based on eligibility established by use of an Institutional Methodology, with family financial information submitted to the CSS Profile. The financial aid office also works closely with the donor relations division of university advancement to ensure that our donors' wishes are met when matching funds to students. All donors of endowed awards are provided with a ""scholarship agreement"" outlining the university's understanding of the donor's intent. These agreements must be approved by both the director of financial aid, and the vice-chancellor for advancement, to ensure that the university has the capability to identify appropriate recipients. In addition to institutionally funded grants and scholarships, TCU manages and accepts fiduciary responsibility for a variety of federal and state funded financial aid programs. Eligibility for all federal and state funded financial aid is based solely on the results of the FAFSA, using required Federal Methodology. Prior to disbursement, each recipient must pass a variety of edit checks, or ""disbursement rules"" to ensure that the student is enrolled in classes and has submitted all required documentation needed to satisfy program eligibility. After disbursement, student aid recipients are reviewed at the end of the 100% tuition refund period for a final enrollment status determination. Students who received aid based on projected full-time enrollment, but who have dropped below 12 credit hours, are subject to an adjustment of their aid package. At the end of the 25%, and final refund period, students are again reviewed and subject to aid adjustment based on final costs for the term. Aid recipients are monitored on a regular basis throughout the academic year. Files are reviewed weekly to identify updated FAFSA and Profile applications, and adjustments are made when required. Reports are submitted to the Texas higher education coordinating board periodically for review of state aid recipients, and the university is subject to periodic audits and reviews from both entities. Academic success is the ultimate goal of all aid programs, and satisfactory academic progress is reviewed at the end of each term. At a minimum, full-time students are required to complete at least 75% of attempted hours and obtain a 2.00 GPA to meet renewal requirements. Most TCU funded awards require a minimum GPA of 2.50. Academic scholarships require a 3.25 GPA. Once posted to student accounts, the office of student financial services also monitors award amounts in relation to specific charges. Award amounts that appear to be out of norm are referred back to the financial aid office for review"
202040519349301014,263586792,"PART I, LINE 2:","NEW COLLEGE FRANKLIN OFFERS TWO KINDS OF SCHOLARSHIPS - ACADEMIC AND NEED BASED. ACADEMIC SCHOLARSHIPS ARE AWARDED TO FIRST TIME, FULL TIME STUDENTS WHO MEET CERTAIN STANDARDS. ACADEMIC SCHOLARSHIPS ARE AUTOMATICALLY RENEWED FOR UP TO FOUR CONSECUTIVE YEARS AS LONG AS THE STUDENT MAINTAINS A CUMULATIVE GPA OF 3.3 OR GREATER AND REMAINS IN GOOD STANDING FOR THE BA DEGREE. NEED BASED SCHOLARSHIPS ARE AWARDED ANNUALLY TO CURRENT AND INCOMING STUDENTS WHO COMPLETE THE FINANCIAL AID APPLICATION AND DEMONSTRATE SIGNIFICANT FINANCIAL NEED."
202011299349301031,352158366,"Schedule I, Part I, Line 2 Procedures for monitoring use of grant funds.",Grant funds and scholarships are credited directly to the students' accounts to ensure the appropriate use of funds.
202010989349301321,620518288,"Schedule I, Part I, Line 2","The school's Financial Aid Office plus the Financial Services Office follow detailed procedures which ensure the federal grant regulations are followed. These offices are audited each year by an independent external CPA firm and reported thereon to the federal government. There were ""no findings"" on the financial aid portion of this audit for the fiscal year being reported on."
202011329349301411,431633187,"PART I, LINE 2:",FINANCIAL AID IS AWARDED BY FINANCIAL PROFESSIONAL IN ACCORDANCE WITH COLLEGE POLICIES.
202010949349300021,750983821,"Part I, Line 2:",There is a publication of available scholarships and the criteria to qualify for each one. Students complete an application indicating which scholarship(s) they are applying for. These applications are reviewed by the registrar's office during the registration process and qualifying students are determined. Financial assistance awarded during the FYE 5/31/19 was applied as a credit against the students' tuition.
202030439349301143,430610813,"PART I, LINE 2:",THE COLLEGE MAINTAINS RECORDS WITHIN ITS FINANCIAL AID SOFTWARE TO ACCOUNT FOR ALL GRANTS AND SCHOLARSHIPS AWARDED TO EACH STUDENT.
202011549349301706,030179593,"PART I, LINE 2:",THE STUDENTS MUST APPLY FOR THE GRANTS AND MEET THE REQUIREMENTS OF THE VARIOUS GRANTS. THE PROCESS BY WHICH EACH GRANT IS AWARDED AND MONITORED IS FORMALIZED IN A POLICY WHICH IS UPDATED BY THE DIRECTOR OF FINANCIAL AID.
202011009349300821,240795506,"PART I, LINE 2:",WILKES UNIVERSITY MAINTAINS A COMPREHENSIVE PROGRAM OF FINANCIAL AID TO ASSIST STUDENTS IN THE FINANCING OF THEIR EDUCATIONAL PROGRAMS. THE UNIVERSITY AWARDS BOTH MERIT SCHOLARSHIPS AND NEED-BASED GRANTS TO UNDERGRADUATE AND GRADUATE STUDENTS. UNDERGRADUATE MERIT AWARDS ARE BASED ON HIGH SCHOOL ACHIEVEMENT INCLUDING SAT SCORES AND HIGH SCHOOL CLASS RANK. STUDENTS MUST COMPLETE THE FREE APPLICATION FOR FEDERAL STUDENT AID TO HAVE THEIR ELIGIBILITY FOR NEED-BASED DETERMINED. GRADUATE SCHOLARSHIPS ARE AWARDED TO STUDENTS ENROLLED IN THE DISTANCE EDUCATION PROGRAM.
202031069349301408,951643334,"FORM 990, SCHEDULE I, PART I, LINE 2","THE UNIVERSITY AWARDS GRANTS/SCHOLARSHIPS ACCORDING TO UNIVERSITY POLICY. GRANTS AND SCHOLARSHIPS AWARDED TO STUDENTS ARE MONITORED BY MANAGEMENT. RECONCILIATION BETWEEN FINANCIAL AID AND ACCOUNTING ARE DONE ON A MONTHLY BASIS. SCHEDULE I, PART III CASH GRANTS ARE CREDITED TO STUDENT ACCOUNTS."
202040239349301019,233069199,"PART I, LINE 2:",PAY-IT FORWARD SCHOLARSHIPS ARE AWARDED BASED ON A STUDENT'S STATEMENT OF NEED.
202040239349301019,233069199,"PART I, LINE 1:",PAY-IT FORWARD SCHOLARSHIPS ARE AWARDED BASED ON A STUDENT'S STATEMENT OF NEED.
202031359349301583,741233796,"PART I, LINE 2:","THE UNIVERSITY AWARDS VARIOUS FEDERAL, STATE, AND PRIVATE SCHOLARSHIPS, LOANS, AND STUDENT WORK PROGRAMS AS PART OF ITS OVERALL FINANCIAL AID PROGRAM. THE UNIVERSITY FINANCIAL AID OFFICE IS RESPONSIBLE FOR MANAGEMENT OF ALL FINANCIAL AID PROGRAMS. THE UNIVERSITY USES THE DEPARTMENT OF EDUCATION METHODOLOGY TO DETERMINE FAMILY NEED FOR AWARDING NEED-BASED AWARDS. MERIT BASED AWARDS ARE DETERMINED BASED ON VARIOUS ACADEMIC (GPA, RANK IN CLASS, ETC.) AS WELL AS OTHER QUALITATIVE MEASURES. IT IS THE RESPONSIBILITY OF THE FINANCIAL AID OFFICE TO ENSURE COMPLIANCE WITH FEDERAL AND STATE REGULATIONS ON FINANCIAL AID, AND THE UNIVERSITY POLICY AND INTERNAL CONTROL OBJECTIVES. THE FINANCIAL AID OFFICE AND ITS OPERATIONS ARE SUBJECT TO INTERNAL CONTROL REVIEW BY THE UNIVERSITY'S EXTERNAL AUDITORS AS PART OF THE ANNUAL FINANCIAL STATEMENT AUDIT. ADDITIONAL MONITORING IS ALSO PROVIDED THROUGH THE REVIEW AND OVERSIGHT OF SENIOR MANAGEMENT, SENIOR STAFF, THE VICE PRESIDENT OF ENROLLMENT SERVICES, AND THE BUSINESS OFFICE, ALL OF WHICH ARE UNDER THE PURVIEW OF THE AUDIT COMMITTEE AND THE BOARD OF TRUSTEES' FISCAL AFFAIRS COMMITTEE. ADDITIONALLY, THE UNIVERSITY'S AWARDING AND MANAGEMENT OF FINANCIAL AID AWARDS IS SUBJECT TO AN ANNUAL SINGLE AUDIT (CIRCULAR A-133) AND STATE OF TEXAS AUDITS (FOR VARIOUS STATE FINANCIAL AID PROGRAMS). RESULTS OF THESE AUDITS ARE REPORTED TO THE UNIVERSITY SENIOR STAFF, THE BOARD OF TRUSTEES' AUDIT COMMITTEE, AND THE BOARD OF TRUSTEES FISCAL AFFAIRS COMMITTEE."
202030719349301423,610448560,"PART I, LINE 2:",ALL STUDENT AID AND SCHOLARSHIPS ARE USED FOR TUITION AND RELATED EXPENSES AT THE UNIVERSITY.
202032479349300418,810378823,"PART I, LINE 2:","2 MEMBERS OF THE BOARD OF DIRECTORS FOR THE ORGANIZATION ARE ALSO BOARD OF DIRECTORS FOR SALISH KOOTENAI COLLEGE FOUNDATION AND THEY OVERSEE AND ENSURE THAT FUNDS ARE UTILIZED PROPERLY. SCHOLARSHIPS AND GRANTS ARE AWARDED TO STUDENTS OF THE COLLEGE BASED ON VARIOUS CRITERIA. THESE CRITERIA INCLUDE FINANCIAL NEED, GRADE POINT AVERAGE, AND OTHERS AS ESTABLISHED BY THE SCHOLARSHIP AND GRANT DOCUMENTS. SCHOLARSHIPS ARE APPLIED TO THE INDIVIDUAL STUDENTS' ACCOUNTS TO PAY TUITION, ROOM AND BOARD EXPENSES."
