DsAssssmntsAmt|Dues, assessments and similar amounts from members
NnDdctblLbbyngPltclCYAmt|Current year
NnDdLbbyngPltclCyvAmt|Carryover from last year
NnDdctblLbbyngPltclTtAmt|Total
AggrgtRprtdDsNtcAmt|Aggregate amount reported in section 6033(e)(1)(A) notices of nondeductible section 162(e) dues
CrrdOvrAmt|If notices were sent and the amount on line 2c exceeds the amount on line 3, what portion of that amount does the organization agree to carryover to the reasonable estimate of nondeductible lobbying and political expenditure next year?
TxblAmt|Taxable amount of lobbying and political expenditures (line 2c total minus 3 and 4)
