object_id,ein,FrmAndLnRfrncDsc,ExplntnTxt
201443219349309969,510305893,"PART II, LINE 9:","THE ORGANIZATION DOES NOT REPORT ITS CONSERVATION EASEMENTS IN ITS REVENUE AND EXPENSE STATEMENT OR ITS BALANCE SHEET. ADDITIONALLY, THERE IS NO FOOTNOTE IN THE ORGANIZATION'S FINANCIAL STATEMENTS DESCRIBING THE FACT THAT THERE IS NO ACCOUNTING FOR SUCH EASEMENTS."
201443219349309969,510305893,"PART III, LINE 4:","THE UNIVERSITY HOLDS A RARE COLLECTION OF BOOKS AND SPECIMENS THAT IT HAS OWNED FOR OVER 100 YEARS. IN ADDITION, SEVERAL BUILDINGS ON THE UNIVERSITY'S CAMPUS HAVE BEEN RECOGNIZED AS HISTORICAL SITES IN THE HISTORICAL REGISTRY. IN 1723, NICHOLAS LOOCKERMAN PURCHASED 600 ACRES OF LAND KNOWN AS ""THE RANGE."" FOLLOWING HIS DEATH IN 1771, THE PROPERTY PASSED TO HIS GRANDSON, VINCENT LOOCKERMAN JUNIOR. EVIDENCE SUGGESTS THAT HE BUILT THE GEORGIAN-STYLE MANSION KNOWN TODAY AS LOOCKERMAN HALL SOON AFTER INHERITING THE PROPERTY. ON AUGUST 24, 1891, 95 ACRES OF THE OLD PLANTATION WHERE SLAVES HAD ONCE TOILED WERE PURCHASED FOR THE PURPOSE OF ESTABLISHING THE ""DELAWARE COLLEGE FOR COLORED STUDENTS."" LOOCKERMAN HALL BECAME THE CENTER OF THE CAMPUS, SERVING VARIOUSLY AS A DORMITORY, CLASSROOM, AND ADMINISTRATION BUILDING. IN 1971, THE STRUCTURE WAS PLACED ON THE NATIONAL REGISTER OF HISTORIC PLACES BY THE NATIONAL PARK SERVICE."
201443219349309969,510305893,"PART V, LINE 4:",INTENDED USES OF THE UNIVERSITY'S ENDOWMENT FUNDS IS TO OFFER STUDENT SCHOLARSHIPS AND SUPPORT ACADEMIC PROGRAMS.
201443219349309969,510305893,"PART X, LINE 2:","THE UNIVERSITY IS EXEMPT FROM FEDERAL INCOME TAXES UNDER SECTION 501(C) (3) OF THE INTERNAL REVENUE CODE AND IS RECOGNIZED AS SUCH BY THE INTERNAL REVENUE SERVICE. THE PROVISIONS INCLUDED IN ACCOUNTING PRINCIPLES GENERALLY ACCEPTED IN THE UNITED STATES OF AMERICA PROVIDE CONSISTENT GUIDANCE FOR THE ACCOUNTING FOR UNCERTAINTY IN INCOME TAXES RECOGNIZED IN AN ENTITY'S FINANCIAL STATEMENTS AND PRESCRIBE A THRESHOLD OF ""MORE LIKELY THAN NOT"" FOR RECOGNITION OF TAX POSITIONS TAKEN OR EXPECTED TO BE TAKEN IN A TAX RETURN. THE UNIVERSITY PERFORMED AN EVALUATION OF UNCERTAIN TAX POSITIONS AS OF JUNE 30, 2014, AND DETERMINED THAT THERE WERE NO MATTERS THAT WOULD REQUIRE RECOGNITION IN THE FINANCIAL STATEMENTS OR WHICH MAY HAVE ANY EFFECT ON ITS TAX-EXEMPT STATUS. AS OF JUNE 30, 2014, THE STATUTE OF LIMITATIONS FOR TAX YEARS 2011 THROUGH 2014 REMAINS OPEN WITH THE U.S. FEDERAL JURISDICTION OR THE VARIOUS STATES AND LOCAL JURISDICTIONS IN WHICH THE UNIVERSITY FILES TAX RETURNS. RECLASSIFICATIONS CERTAIN RECLASSIFICATIONS WERE MADE TO 2013 AMOUNT TO CONFORM WITH 2014 PRESENTATION."
201443219349309969,510305893,"PART XI, LINE 2D - OTHER ADJUSTMENTS:","SCHOLARSHIP EXPENSES -23,684,821."
201443219349309969,510305893,"PART XII, LINE 4B - OTHER ADJUSTMENTS:","SCHOLARSHIP EXPENSES 23,684,821."
201443539349300524,132513162,PART XI. LINE 2A,"ADJUSTMENTS TO NET ASSETS: UNREALIZED GAINS ON INVESTMENTS 2,113,632"
201413569349300716,560532296,V 4,The Endowment Funds shown are considered Permanently Restricted. The College does not intend to use the funds.
201413569349300716,560532296,X 2,"The Colleges policy is to record a liability for any tax position taken that is beneficial to the College, including any related interest and penalties, when it is more likely than not the position taken by management with respect to a transaction or class of transactions will be overturned by a taxing authority upon examination. Management believes there are no such positions as of June 30, 2014 and accordingly, no liability has been accrued."
201433499349301358,720467515,"PART III, LINE 1A:","SIX ORIGINAL ETCHINGS OF SALVADOR DALI, ONE MERRITT CHASE OIL PAINTING, AND VARIOUS OTHER SMALL PIECES OF ARTWORK."
201433499349301358,720467515,"PART V, LINE 4:",TO PROVIDE FUNDS FOR SCHOLARSHIPS TO BE ISSUED TO ELIGIBLE STUDENTS MEETING ALL NECESSARY REQUIREMENTS.
201433499349301358,720467515,"PART XI, LINE 2D - OTHER ADJUSTMENTS:",COST OF GOODS SOLD
201433499349301358,720467515,"PART XII, LINE 2D - OTHER ADJUSTMENTS:",COST OF GOODS SOLD
201433499349301358,720467515,"PART XII, LINE 2D- OTHER",COST OF GOODS SOLD THROUGH BOOKSTORE.
201443189349304694,540646523,"PART V, LINE 4:","SOUTHERN VIRGINIA UNIVERSITY'S ENDOWMENT CONSISTS OF ONE DOZEN INDIVIDUAL FUNDS ESTABLISHED FOR A VARIETY OF PURPOSES, PRIMARILY STUDENT SCHOLARSHIPS."
201443189349304694,540646523,"PART X, LINE 2:","MANAGEMENT HAS EVALUATED THE UNIVERSITY'S TAX POSITIONS AND HAS CONCLUDED THAT THE UNIVERSITY HAS TAKEN NO UNCERTAIN TAX POSITIONS THAT REQUIRE ADJUSTMENT TO THE FINANCIAL STATEMENTS TO COMPLY WITH THE PROVISIONS OF THIS GUIDANCE. THE UNIVERSITY FILES TAX RETURNS WITH U.S. FEDERAL AND VIRGINIA TAX AUTHORITIES IN WHICH THE STATUTE OF LIMITATIONS MAY GO BACK TO THE TAX YEAR ENDED JUNE 30, 2011."
201443189349304694,540646523,"PART XI, LINE 2D - OTHER ADJUSTMENTS:","SVU GRANTS NETTED AGAINST REVENUE ON AUDIT -4,729,369. ROUNDING -1."
201443189349304694,540646523,"PART XI, LINE 4B - OTHER ADJUSTMENTS:","COGS FOR INVENTORY SALES NETTED ON 990 -446,900. SPECIAL EVENTS EXPENSES REPORTED IN REVENUES ON THE TAX RETURN -78,391. RUSSELL CLARK REALTY CO. K-1 (NOT INCLUDED IN FINANCIAL STATEMENTS) 5,124."
201443189349304694,540646523,"PART XII, LINE 2D - OTHER ADJUSTMENTS:","COGS FOR INVENTORY SALES NETTED ON 990 446,900. SPECIAL EVENTS EXPENSES REPORTED IN REVENUES ON THE TAX RETURN 78,391. ROUNDING -1."
201443189349304694,540646523,"PART XII, LINE 4B - OTHER ADJUSTMENTS:","SVU GRANTS NETTED AGAINST REVENUE ON AUDIT 4,729,369."
201443189349304694,540646523,"PART XI, LINE 8",NON-CASH INCOME FROM RUSSELL CLARK REALTY CO. K-1.
201443189349304694,540646523,"PART XII, LINE 2D AND PART XIII, LINE 4B","SCHOLARSHIPS PAID OUT TO STUDENTS, NETTED WITH REVENUES ON THE REPORT."
201443189349304694,540646523,"PART XII, LINE 4B AND PART XIII, LINE 2D",COST OF GOODS SOLD INCLUDED IN EXPENSES ON THE REPORT.
201403219349306475,381673400,"PART V, LINE 4:","PRIMARILY, THE EARNINGS GENERATED BY ENDOWED FUNDS ARE INTENDED TO PROVIDE SCHOLARSHIPS FOR THE STUDENTS OF GRACE BIBLE COLLEGE."
201403219349306475,381673400,"PART X, LINE 2:","THE INTERNAL REVENUE SERVICE HAS DETERMINED THE COLLEGE TO BE EXEMPT FROM FEDERAL INCOME TAX UNDER SECTION 501(C)(3) OF THE INTERNAL REVENUE CODE. IN ADDITION, THE COLLEGE QUALIFIES FOR THE CHARITABLE CONTRIBUTION DEDUCTION UNDER SECTION 170(B)(1)(A) AND HAS BEEN CLASSIFIED AS AN ORGANIZATION THAT IS NOT A PRIVATE FOUNDATION UNDER SECTION 509(A)(2). THEREFORE, NO PROVISION FOR INCOME TAXES IS MADE IN THE ACCOMPANYING FINANCIAL STATEMENTS. TAX POSITIONS TAKEN ARE ASSESSED FOR UNCERTAINTY AND A PROVISION MAY BE RECORDED IF A TAX POSITION IS NOT LIKELY TO BE SUSTAINED UPON EXAMINATION. WITH LIMITED EXCEPTIONS, THE COLLEGE IS NO LONGER SUBJECT TO AUDITS BY FEDERAL AUTHORITIES FOR YEARS PRIOR TO 2010."
201403219349306475,381673400,"PART XI, LINE 2D - OTHER ADJUSTMENTS:","UNREALIZED GAIN ON BENEFICIAL INTEREST 37,492."
201403219349306475,381673400,"PART XI, LINE 4B - OTHER ADJUSTMENTS:","SPECIAL EVENTS - DIRECT EXPENSES -26,067."
201403219349306475,381673400,"PART XII, LINE 2D - OTHER ADJUSTMENTS:","SPECIAL EVENTS - DIRECT EXPENSES 26,067."
201413469349300316,237013253,"Schedule D, Part V, Line 4, Intended uses of endowment funds",THE YOMINE ENDOWMENT FUND AND THE KAULE ENDOWMENT FUND ARE USED TO PROVIDE SCHOLARSHIPS TO MBA STUDENTS.
201413469349300316,237013253,"Schedule D, Part X, Line 2, FIN 48 (ASC 740) footnote","THE SCHOOL HAS RECEIVED A DETERMINATION LETTER FROM THE INTERNAL REVENUE SERVICE INDICATING THAT IT IS A NOT-FOR-PROFIT ENTITY AS DESCRIBED IN SECTION 501(C)(3) OF THE INTERNAL REVENUE CODE (""IRC"") AND IS EXEMPT FROM FEDERAL INCOME TAXES ON RELATED INCOME PURSUANT TO SECTION 501(A) OF THE IRC, EXCEPT FOR TAXES PERTAINING TO UNRELATED BUSINESS INCOME. THE SCHOOL FOLLOWS GUIDANCE WITH RESPECT TO ACCOUNTING FOR UNCERTAIN TAX POSITIONS. NO PROVISION HAS BEEN MADE FOR INCOME TAXES IN THE ACCOMPANYING FINANCIAL STATEMENTS, AS THE SCHOOL HAS HAD NO SIGNIFICANT UNRELATED BUSINESS INCOME. IF THE SCHOOL INCURS INTEREST AND PENALTIES, THE SCHOOL RECOGNIZES INTEREST AND PENALTIES RELATED TO UNRECOGNIZED TAX BENEFITS IN INTEREST AND INCOME TAX EXPENSE, RESPECTIVELY. THE SCHOOL HAS NO AMOUNTS ACCRUED FOR INTEREST OR PENALTIES AS OF JUNE 30, 2014 OR 2013. THE SCHOOL HAS NOT BEEN EXAMINED BY ANY TAX JURISDICTION. THE SCHOOL HAS NO ONGOING FEDERAL, STATE OR LOCAL TAX AUDITS, HOWEVER, THE SCHOOL'S TAX RETURNS FOR 2011 AND SUBSEQUENT YEARS ARE OPEN TO EXAMINATION. THE SCHOOL DOES NOT EXPECT THE TOTAL AMOUNT OF UNRECOGNIZED TAX BENEFITS TO SIGNIFICANTLY CHANGE IN THE NEXT 12 MONTHS."
201413469349300316,237013253,"Schedule D, Part XI, Line 2d, Other revenues in audited financial statements not in form 990",FUNDRAISING EXPENSES - 41554;
201413469349300316,237013253,"Schedule D, Part XI, Line 4b, Other revenues in form 990 not in audited financial statements",SCHOLARSHIPS - 350051;
201413469349300316,237013253,"Schedule D, Part XII, Line 2d, Other expenses in audited financial statements not in form 990",FUNDRAISING EXPENSES - 41554;
201413469349300316,237013253,"Schedule D, Part XII, Line 4b, Other expenses in form 990 not in audited financial statements",SCHOLARSHIPS - 350051;
201403529349300320,620475691,"Schedule D, Part III, Line 4","The fine art collection is held for public exhibition and/or education. The Maryville College Clayton Center for the Arts has increased the desire and ability to share with the region, art work with educational value. The College's collection consists of two sculptures and one painting at this time."
201403529349300320,620475691,"Schedule D, Part V, Line 4","The endowed funds of the College are used for student scholarships, buildings maintenance an various program support."
201403529349300400,741357323,"Part V, Line 4: Intended uses of the endowment fund.","SUPPORT ENDOWED CHAIRS, SCHOLARSHIPS, AND UNDERWRITE GENERAL OPERATING COSTS."
201403529349300400,741357323,"Part XI, Line 2d: Other revenue amounts included in F/S but not included on form 990",CHANGE IN VALUE OF OIP CHARITABLE TRUST $2629940 SPECIAL EVENTS EXPENSES $69021
201403529349300400,741357323,"Part XI, Line 4b: Other revenue amounts included on 990 but not included in F/S",TUITION ASSISTANCE $174540 LOSS ON UNCOLLECTIBLE PLEDGES $36600
201403529349300400,741357323,"Part XII, Line 2d: Other expenses and losses per audited F/S",SPECIAL EVENTS EXPENSES $69021
201403529349300400,741357323,"Part XII, Line 4b: Other revenue amounts included on 990 but not included in F/S",TUITION ASSISTANCE $174540
201443219349302154,416011702,"PART III, LINE 1A:","MAYO CLINIC PERIODICALLY RECEIVES WORKS OF ART FROM VARIOUS BENEFACTORS. THESE ITEMS ARE UNIQUE IN NATURE AND ARE HELD ON DISPLAY FOR THE BENEFIT AND ENJOYMENT OF MAYO'S PATIENTS. IT IS MAYO'S POLICY TO NEITHER CAPITALIZE CONTRIBUTED WORKS OF ART, NOR RECORD THE RELATED CONTRIBUTION REVENUE."
201443219349302154,416011702,"PART III, LINE 4:","THE PRIMARY MISSION OF MAYO CLINIC IS EXCELLENCE IN PATIENT CARE, YET ITS FOUNDERS RECOGNIZED THAT CARING FOR THE WHOLE PATIENT EXTENDS BEYOND TREATING PHYSICAL AILMENTS. SINCE ITS INCEPTION, MAYO HAS USED ART, ARCHITECTURE AND BEAUTY IN SURROUNDINGS TO ADDRESS THE ""SPIRITUAL ASPECTS"" OF MEDICAL CARE. BENEFACTOR GIFTS FROM PATIENTS, FRIENDS, EMPLOYEES OR ALUMNI HELP MAYO SUPPORT THE ACQUISITION OF ART USED TO HUMANIZE THE MEDICAL ENVIRONMENT AND COMPLEMENT THE BELIEF THAT RESTORING THE MIND AND SPIRIT IS AN IMPORTANT PART OF MAKING THE BODY WELL. WORKS OF ART DISPLAYED ACROSS THE MAYO CAMPUS PROVIDE BEAUTY, PRESERVATION OF HERITAGE AND RESPECT FOR THE DIVERSITY OF PATIENTS, VISITORS AND STAFF."
201443219349302154,416011702,"PART V, LINE 4:",THE ENDOWMENT FUNDS PROVIDE A STABLE FUNDING SOURCE FOR RESEARCH AND EDUCATION PROGRAMS.
201443219349302154,416011702,"PART X, LINE 2:","AT DECEMBER 31, 2013 AND 2012, THERE WAS NO SIGNIFICANT LIABILITY FOR UNRECOGNIZED TAX BENEFITS FOR THE FILING ORGANIZATION. PORTION OF INCOME TAX FOOTNOTE FROM MAYO CLINIC CONSOLIDATED AUDITED FINANCIALS STATEMENTS: MOST OF THE INCOME RECEIVED BY THE CLINIC AND ITS SUBSIDIARIES IS EXEMPT FROM TAXATION UNDER SECTION 501(A) OF THE INTERNAL REVENUE CODE. SOME OF ITS SUBSIDIARIES ARE TAXABLE ENTITIES, AND SOME OF THE INCOME RECEIVED BY OTHERWISE EXEMPT ENTITIES IS SUBJECT TO TAXATION AS UNRELATED BUSINESS INCOME (UBI). THE CLINIC OR ITS SUBSIDIARIES FILE INCOME TAX RETURNS IN THE U.S. FEDERAL, VARIOUS STATE, AND FOREIGN JURISDICTIONS. THE STATUTES OF LIMITATIONS FOR TAX YEARS 2010 THROUGH 2012 REMAIN OPEN IN THE MAJOR U.S. TAXING JURISDICTIONS IN WHICH THE CLINIC AND SUBSIDIARIES ARE SUBJECT TO TAXATION. IN ADDITION, FOR ALL TAX YEARS PRIOR TO 2010 GENERATING OR UTILIZING A NET OPERATING LOSS (NOL), TAX AUTHORITIES CAN ADJUST THE AMOUNT OF NOL CARRYFORWARD TO SUBSEQUENT YEARS. THE INTERNAL REVENUE SERVICE (IRS) PERFORMED AN EXAMINATION OF THE TAX AND INFORMATION RETURNS OF THE CLINIC AND TWO SUBSIDIARIES FOR 2005 AND 2006. AS A RESULT OF THE AUDIT BY THE IRS, ONE REMAINING ENTITY HAS EXTENDED THE STATUTES OF LIMITATIONS FOR 2005 THROUGH 2009 UNTIL JUNE 30, 2014. AS OF DECEMBER 31, 2013, ONE AUDIT REMAINS OPEN, AND THE IRS HAS PROPOSED ONE ADJUSTMENT THAT MANAGEMENT HAS TAKEN INTO CONSIDERATION DURING ITS DETERMINATION OF UNRECOGNIZED TAX BENEFITS SINCE THE PROPOSED ISSUE HAS NOT BEEN SETTLED AND WILL BE LITIGATED IF ASSESSED. AT DECEMBER 31, 2013 AND 2012, THE RESERVE FOR UNRECOGNIZED TAX BENEFITS WAS NOT SIGNIFICANT, AND AS A RESULT, THERE IS NO LONGER A RESERVE FOR UNRECOGNIZED TAX BENEFITS RECORDED. THE CLINIC'S PRACTICE IS TO RECOGNIZE INTEREST AND/OR PENALTIES RELATED TO INCOME TAX MATTERS IN INCOME TAX EXPENSE."
201422479349300537,540808239,"PART V, LINE 4:",SCHOLARSHIPS AND AID FOR MINISTERS AND CHURCH PROFESSIONALS IN VIP CARE'S TRAINING PROGRAM.
201443189349306734,550357056,"SCHEDULE D, PAGE 3, PART X","THE COLLEGE IS CLASSIFED AS A TAX-EXEMPT ORGANIZATION UNDER SECTION 501(C) (3) OF THE INTERNAL REVENUE CODE AND, THEREFORE, IS NOT SUBJECT TO TAXES ON INCOME DERIVED FROM ITS EXEMPT ACTIVITIES. THE ORGANIZATION HAS BEEN CLASSIFED AS AN ORGANIZATION THAT IS NOT A PRIVATE FOUNDATION UNDER SECTION 509(A)(2). THE COLLEGE IS GENERALLY NO LONGER SUBJECT TO EXAMINATION BY INCOME TAXING AUTHORITIES FOR YEARS ENDED PRIOR TO JUNE 30, 2011."
201443189349306734,550357056,"SCHEDULE D, PAGE 4, PART XI, LINE 2D","NET GAIN ON BENEFICIAL INTEREST IN TRUST 1,020,530 CHANGE IN VALUE OF SPLIT INTEREST AGREEMENTS 192,062"
201443189349306734,550357056,"SCHEDULE D, PAGE 4, PART XI, LINE 4B","SCHOLARSHIPS AND AWARDS 21,868,158"
201443189349306734,550357056,"SCHEDULE D, PAGE 4, PART XII, LINE 4B","SCHOLARSHIPS AND AWARDS 21,868,158"
201413459349300011,450306841,"PART IV, LINE 2B:",THE FUNDS HELD IN CUSTODY FOR OTHERS INCLUDE SCHOLARSHIPS THAT WILL BE APPLIED TO THE STUDENT ACCOUNTS AS QUALIFIED EDUCATION EXPENSES ARE INCURRED.
201413459349300011,450306841,"PART V, LINE 4:",THE COLLEGE MAINTAINS THE ENDOWMENT FUNDS TO SUPPORT THE PROGRAMMATIC ACTIVITIES AND AS DESIGNATED BY DONOR SPECIFIED OBJECTIVES.
201413459349300011,450306841,"PART X, LINE 2:","THE COLLEGE IS A NONPROFIT ORGANIZATION THAT IS EXEMPT FROM FEDERAL INCOME TAX UNDER INTERNAL REVENUE CODE SECTION 501(C)(3). THE COLLEGE FOLLOWS THE PROVISIONS OF THE FASB ACCOUNTING STANDARDS CODIFICATION TOPIC, ACCOUNTING FOR UNCERTAINTY IN INCOME TAXES. THE IMPLEMENTATION OF THIS STANDARD HAD NO IMPACT ON THE FINANCIAL STATEMENTS. AS OF AS OF JUNE 30, 2014 AND 2013 THE UNRECOGNIZED TAX BENEFIT ACCRUAL WAS ZERO. THE COLLEGE WILL RECOGNIZE FUTURE ACCRUED INTEREST AND PENALTIES RELATED TO THE UNRECOGNIZED TAX BENEFITS IN INCOME TAX EXPENSE IF INCURRED. THE COLLEGE IS NO LONGER SUBJECT TO FEDERAL TAX EXAMINATIONS BY TAX AUTHORITIES FOR YEARS ENDED BEFORE JUNE 30, 2010."
201413459349300011,450306841,"PART XI, LINE 2D - OTHER ADJUSTMENTS:","COST OF BOOK STORE SALES 16,256."
201413459349300011,450306841,"PART XII, LINE 2D - OTHER ADJUSTMENTS:","COST OF BOOK STORE SALES 16,256."
201403579349300505,200258004,"PART V, LINE 4:",THE DONORS OF THESE ASSETS PERMIT THE COLLEGE TO USE THE INVESTMENT RETURN ON THESE ASSETS TO SUPPORT PROGRAM ACTIVITIES.
201403579349300505,200258004,"PART X, LINE 2:","U.S. GENERALLY ACCEPTED ACCOUNTING PRINCIPLES REQUIRES COLLEGE MANAGEMENT TO EVALUATE TAX POSITIONS TAKEN BY THE COLLEGE AND RECOGNIZE A TAX LIABILITY (OR ASSET) IF THE COLLEGE HAS TAKEN AN UNCERTAIN TAX POSITION THAT MORE THAN LIKELY WOULD NOT BE SUSTAINED UPON THE EXAMINATION BY THE IRS. THE COLLEGE'S MANAGEMENT HAS ANALYZED THE TAX POSITIONS TAKEN BY THE COLLEGE, AND HAS CONCLUDED THAT AS OF JUNE 30, 2014, THERE ARE NO UNCERTAIN TAX POSITIONS TAKEN OR EXPECTED TO BE TAKEN THAT WOULD REQUIRE RECOGNITION OF A LIZBILITY (OR ASSET) OR DISCLOSURE IN THE FINANCIAL STATEMENTS. THE COLLEGE IS SUBJECT TO ROUTINE AUDITS BY TAXING JURISDICTIONS, HOWEVER, THARE ARE CURRENTLY NO AUDITS FOR ANY TAX PERIODS IN PROGRESS. THE COLLEGE BELIEVES IT IS NO LONGER SUBJECT TO INCOME TAX EXAMINATIONS FOR YEARS PRIOR TO 2011."
201403579349300505,200258004,"PART XI, LINE 4B - OTHER ADJUSTMENTS:","STUDENT AID 669,947."
201403579349300505,200258004,"PART XII, LINE 4B - OTHER ADJUSTMENTS:","STUDENT AID 669,947."
201413469349300116,570324915,"Part X, Line 2:","The College has determined that there are no significant uncertain positions taken or expected to be taken requiring recognition as liabilities or disclosure in the financial statements. The College is subject to routine audits by taxing jurisdictions; however, there are currently no audits for any tax periods in progress. Management believes it is no longer subject to income tax examinations for years prior to 2011."
201413469349300116,570324915,"Part XI, Line 2d - Other Adjustments:","Scholarships and student aid -8,943,797. Unrealized gain on interest rate swap agreements 97,894. Change in value of split-interest agreements -32,519."
201413469349300116,570324915,"Part XI, Line 4b - Other Adjustments:","Rental expenses -35,825. Special event expenses -13,347."
201413469349300116,570324915,"Part XII, Line 2d - Other Adjustments:","Rental expenses 35,825. Special event expenses 13,347."
201413469349300116,570324915,"Part XII, Line 4b - Other Adjustments:","Scholarships and student aid 8,943,797."
201423219349305487,476025325,"PART X, LINE 2:","AS OF JUNE 30, 2014, THE ORGANIZATION HAD NO UNCERTAIN TAX POSITIONS THAT QUALIFY FOR EITHER RECOGNITION OR DISCLOSURE IN THE FINANCIAL STATEMENTS. THE ORGANIZATION'S INCOME TAX FILINGS ARE SUBJECT TO AUDIT BY VARIOUS TAX AUTHORITIES. THE ORGANIZATION IS NO LONGER SUBJECT TO FEDERAL AND STATE INCOME TAX EXAMINATIONS BY TAXING AUTHORITIES FOR YEARS BEFORE 2011. MANAGEMENT CONTINUALLY EVALUATES EXPIRING STATUTES OF LIMITATIONS, AUDITS, PROPOSED SETTLEMENTS, CHANGES IN TAX LAW AND NEW AUTHORITATIVE RULINGS. THE ORGANIZATION BELIEVES THEIR ESTIMATES ARE APPROPRIATE BASED ON CURRENT FACTS AND CIRCUMSTANCES. INTEREST AND PENALTIES ASSESSED BY INCOME TAXING AUTHORITIES, IF ANY, ARE INCLUDED IN INTEREST EXPENSE."
201423219349305487,476025325,"PART XI, LINE 2D - OTHER ADJUSTMENTS:",FUNDRAISING EXPENSES 20804. COST OF GOODS SOLD 600.
201423219349305487,476025325,"PART XI, LINE 4B - OTHER ADJUSTMENTS:",SCHOLARSHIPS & WAIVERS 25979.
201423219349305487,476025325,"PART XII, LINE 2D - OTHER ADJUSTMENTS:",FUNDRAISING EXPENSES 20804. COST OF GOODS SOLD 600.
201423219349305487,476025325,"PART XII, LINE 4B - OTHER ADJUSTMENTS:",SCHOLARSHIPS & WAIVERS 25979.
201423189349300632,550525724,Part X : FIN48 Footnote,The annual audit and financial statements of UHC are prepared on a consolidated basis as a member of the WV United Health System (WVUHS). WVUHS accounts for uncertainty in income taxes using a recognition threshold of more-likely-than not to be sustained upon examination by the appropriate taxing authority. Measurement of the tax uncertainty occurs if the recognition threshold is met. There were no tax uncertainties for UHC that met the recognition threshold in 2013.
201423189349302672,470418641,"PART V, LINE 4:",ENDOWMENT FUNDS RECEIVED ARE FOR SPECIFIC SUPPORT OF THE INSTITUTION AND ITS STUDENTS ACADEMICS AND RELATED NEEDS.
201423189349302672,470418641,"PART X, LINE 2:","ACCOUNTING PRINCIPLES GENERALLY ACCEPTED IN THE UNITED STATES OF AMERICA REQUIRE THE COLLEGE'S MANAGEMENT TO EVALUATE TAX POSITIONS TAKEN BY THE COLLEGE AND RECOGNIZE A TAX LIABILITY (OR ASSET) IF THE COLLEGE HAS TAKEN AN UNCERTAIN POSITION THAT MORE LIKELY THAN NOT WOULD NOT BE SUSTAINED UPON EXAMINATION BY THE INTERNAL REVENUE SERVICE. THE COLLEGE IS SUBJECT TO ROUTINE AUDITS BY TAXING JURISDICTIONS; HOWEVER, THERE ARE CURRENTLY NO AUDITS FOR ANY TAX PERIODS IN PROGRESS. THE COLLEGE'S MANAGEMENT BELIEVES IT IS NO LONGER SUBJECT TO INCOME TAX EXAMINATIONS FOR YEARS PRIOR TO 2011. THE COLLEGE'S POLICY IS TO INCLUDE PENALTIES AND INTEREST ASSOCIATED WITH INCOME TAX OR INCOME TAX EXPENSE AND INTEREST EXPENSE RESPECTIVELY. THE COLLEGE DID NOT INCUR ANY PENALTIES OR INTEREST OR INCOME TAXES FOR THE PERIODS BEING REPORTED."
201423189349302672,470418641,"PART XI, LINE 2D - OTHER ADJUSTMENTS:",COST OF GOODS SOLD
201423189349302672,470418641,"PART XII, LINE 2D - OTHER ADJUSTMENTS:",COST OF GOODS SOLD EXTRAORDINARY LOSS ON DEBT REFINANCING
201423189349302067,470378779,"PART V, LINE 4:","TEMPORARILY RESTRICTED FUNDS ARE HELD FOR CAPITAL ACQUISITION, SCHOLARSHIPS, EDUCATION AND COMMUNITY HEALTH CARE. PERMANENTLY RESTRICTED FUND ASSETS ARE HELD IN PERPETUITY WITH THE INCOME USED FOR HOSPITAL OPERATIONS, SCHOLARSHIPS AND RESEARCH."
201423189349302067,470378779,"PART X, LINE 2:","THE HOSPITAL IS A NOT-FOR-PROFIT CORPORATION AS DESCRIBED IN SECTION 501(C)(3) OF THE INTERNAL REVENUE CODE. THE HOSPITAL HAS RECEIVED A DETERMINATION LETTER THAT IT IS EXEMPT FROM FEDERAL INCOME TAXES ON RELATED INCOME PURSUANT TO SECTION 501(A) OF THE INTERNAL REVENUE CODE. THE INTERNAL REVENUE SERVICE HAS ESTABLISHED STANDARDS TO BE MET TO MAINTAIN TAX-EXEMPT STATUS. IN GENERAL, SUCH STANDARDS REQUIRE THE HOSPITAL TO MEET A COMMUNITY BENEFIT STANDARD AND COMPLY WITH VARIOUS LAWS AND REGULATIONS. THE HOSPITAL ACCOUNTS FOR UNCERTAINTIES IN ACCOUNTING FOR INCOME TAX ASSETS AND LIABILITIES USING GUIDANCE INCLUDED IN FINANCIAL ACCOUNTING STANDARDS BOARD (FASB) ACCOUNTING STANDARDS CODIFICATION ASC 740, INCOME TAXES. THE HOSPITAL RECOGNIZES THE EFFECT OF INCOME TAX POSITIONS ONLY IF THOSE POSITIONS ARE MORE LIKELY THAN NOT OF BEING SUSTAINED. AT DECEMBER 31, 2013, THE HOSPITAL HAD NO UNCERTAIN TAX POSITIONS ACCRUED. WITH FEW EXCEPTIONS, THE HOSPITAL IS NO LONGER SUBJECT TO INCOME TAX EXAMINATIONS BY U.S. FEDERAL, STATE OR LOCAL AUTHORITIES FOR YEARS BEFORE 2010."
201423189349302067,470378779,"PART V, LINE 3A(II):","MARY LANNING HEALTHCARE FOUNDATION AND MARY LANNING HOSPITAL TRUST HOLD ENDOWMENT FUNDS RESTRICTED TO DISTRIBUTION TO MARY LANNING HEALTHCARE. THESE FUNDS ARE REFLECTED ON MARY LANNING HEALTHCARE'S BALANCE SHEET IN ""INVESTMENTS - OTHER SECURITIES"" AND ARE SHOWN ON SCHEDULE D, PART VII. THESE FUNDS ARE NOT UNDER THE CONTROL OF MARY LANNING HEALTHCARE."
201403189349300910,581581103,Part X : FIN48 Footnote,"Accounting for Income Taxes - University Health Services is exempt from federal income tax under Section 501(a) as organizations described in Section 501(c)(3) of the Internal Revenue Code of 1986, as amended. Accordingly, the accompanying financial statements do not reflect a provision or liability for federal and state income taxes. University Health Services has evaluated their tax positions and determined that they do not have any material unrecognized tax benefits or obligations as of December 31, 2013. Fiscal years ended on or after December 31, 2010 remain subject to examination by federal and state authorities.There is presently no taxation imposed by the government of the Cayman Islands on income or premiums of WWI. As a result, no tax liability or expense has been recorded."
201403359349300030,160909446,"PART V, LINE 4:","ENDOWMENT FUNDS ARE RESTRICTED FOR TIME BY THE US DEPARTMENT OF EDUCATION, AND AFTER A CERTAIN POINT, THE COLLEGE CAN USE THEM FOR UNRESTRICTED PURPOSES."
201403359349300030,160909446,"PART XI, LINE 4B - OTHER ADJUSTMENTS:",COLLEGE FUNDED SCHOLARSHIPS ETC
201403359349300030,160909446,"PART XII, LINE 4B - OTHER ADJUSTMENTS:",COLLEGE FUNDED SCHOLARSHIPS ETC
201403359349300030,160909446,"PART XI, LINE 2D -OTHER ADJUSTMENTS:",NET UNREALIZED GAINS ON INVESTMENT
201403219349306015,362167800,FIN 48 (ASC740) Footnote,"PRESENCE HEALTH AND AFFILIATES RECOGNIZES THE TAX BENEFIT FROM AN UNCERTAIN TAX POSITION ONLY IF IT IS MORE LIKELY THAN NOT THAT THE TAX POSITION WILL BE SUSTAINED ON EXAMINATION BY THE TAXING AUTHORITIES, BASED ON THE TECHNICAL MERITS OF THE POSITION. AS OF DECEMBER 31, 2013 AND 2012, PRESENCE HEALTH AND AFFILIATES DOES NOT HAVE ANY LIABILITIES FOR UNRECOGNIZED TAX BENEFITS."
201423189349308757,956120642,"Part V, Line 4: Intended uses of the endowment fund.","Part V: Endowment FundsLine 4Interest earned on endowment funds is used for restricted scholarships to students as approved by the governing board.Part VI: Line 2d; Prior year adjustment to investment income.Part VII: Line 2d; Fund raising expenses reported as a reduction of fund raising income-that is, fund raising income is reported on Form 990, page 1, net of fund raising expenses."
201423189349308757,956120642,"Part XI, Line 2d: Other revenue amounts included in F/S but not included on form 990",Fundraising Expenses $48098
201423189349308757,956120642,"Part XI, Line 4b: Other revenue amounts included on 990 but not included in F/S",Prior year adjustments $2098
201423189349308757,956120642,"Part XII, Line 2d: Other expenses and losses per audited F/S",Fundraising Expenses $48098
