object_id,ein,FrmAndLnRfrncDsc,ExplntnTxt
201433159349300938,660277396,"Schedule D, Part V, Line 4","THE CENTER IS THE SOLE BENEFICIARY OF THE CENTROS SOR ISOLINA FERRE ENDOWMENT TRUST, THE ASSETS OF WHICH ARE NOT IN POSESSION OF THE CENTERS."
201433159349300938,660277396,"Schedule D, Part XI, Line 4b","($86,993) IS A DECREASE IN TEMPORARILY RESTRICTED NET ASSETS. $155,729 IS AN INCREASE IN PERMANENTLY RESTRICTED ASSETS."
201433159349300938,660277396,"Schedule D, Part XII, Line 2d","62,134 net unrealized losses on investment. 1,216 loss on retirement of property"
201443179349306519,200180768,"PART V, LINE 4:",THE SEMINARY'S ENDOWMENTS ARE INTENDED TO BE USED FOR SCHOLARSHIPS CURRENTLY AND FOR FUTURE PROJECTS TO BE DETERMINED BY THE BOARD.
201443179349306519,200180768,"PART X, LINE 2:","THE SEMINARY EVALUATES ALL SIGNIFICANT TAX POSITIONS AS REQUIRED BY ACCOUNTING PRINCIPLES GENERALLY ACCEPTED IN THE UNITED STATES OF AMERICA. AS OF JUNE 30, 2014, THE SEMINARY DOES NOT BELIEVE THAT IT HAS TAKEN ANY POSITIONS THAT WOULD REQUIRE THE RECORDING OF ANY ADDITIONAL TAX LIABILITY (OR ASSET) OR DISCLOSURE IN THE FINANCIAL STATEMENTS. THE SEMINARY IS SUBJECT TO ROUTINE AUDITS BY TAXING JURISDICTIONS; HOWEVER, THERE ARE CURRENTLY NO AUDITS FOR ANY TAX PERIODS IN PROGRESS. MANAGEMENT BELIEVES IT IS NO LONGER SUBJECT TO INCOME TAX EXAMINATIONS FOR YEARS PRIOR TO 2011."
201443179349306519,200180768,"PART XI, LINE 2D - OTHER ADJUSTMENTS:","BANQUET EXPENSES NOT NETTED AGAINST REVENUE ON FINANCIAL STATEMENTS 5,066."
201443179349306519,200180768,"PART XII, LINE 2D - OTHER ADJUSTMENTS:","BANQUET EXPENSES NOT NETTED AGAINST REVENUE ON FINANCIAL STATEMENTS 5,066."
201433179349303858,742128239,"Part V, Line 4: Intended uses of the endowment fund.","Endowment funds are restricted for scholarships, parent resource office, library, adult program and building maintenance."
201433179349303858,742128239,"Part XI, Line 4b: Other revenue amounts included on 990 but not included in F/S",Financial Aid $69087
201433179349303858,742128239,"Part XII, Line 4b: Other revenue amounts included on 990 but not included in F/S",Financial Aid $69087
201413289349300436,610466713,"PART V, LINE 4:","PRESERVATION OF CAPITAL - OVER THE INVESTMENT TIME HORIZON, CAPITAL GAINS ARE TO BE PROTECTED. A POSITIVE RETURN IS EXPECTED OVER THE INVESTMENT TIME HORIZON; ALTHOUGH THERE MAY BE PERIODS WITH NEGATIVE RETURNS. DURING THE INTERIM, THE FUND MAY SACRIFICE SOME POSITIVE RETURNS IN ORDER TO PROTECT AGAINST LOSSES. PRESERVATION OF PURCHASING POWER - ASSET GROWTH, EXCLUSIVE OF CONTRIBUTIONS AND WITHDRAWALS, SHOULD EXCEED THE RATE OF INFLATION IN ORDER TO PRESERVE PURCHASING POWER OF THE FUND'S ASSETS. THE FUND IS WILLING TO ASSUME A MODERATE AMOUNT OF RISK IN ORDER TO REACH ITS LONG-TERM GROWTH OBJECTIVES. ANNUAL SPENDABLE INCOME - AN ANNUAL SPENDABLE INCOME (EARNED INCOME AND REALIZED GAINS) AS APPROVED BY THE FINANCE COMMITTEE WILL SUPPORT THE COLLEGE GENERAL OPERATIONS AND RESTRICTED PROGRAMS IN ACCORDANCE WITH THE DONOR SPECIFICATIONS."
201413289349300436,610466713,"PART X, LINE 2:","THE COLLEGE IS EXEMPT FROM INCOME TAXES UNDER SECTION 501(C)(3) OF THE INTERNAL REVENUE CODE (IRC) AND A SIMILAR PROVISION OF STATE LAW. THE COLLEGE HAS BEEN CLASSIFIED AS A PUBLIC CHARITY QUALIFIED FOR CHARITABLE CONTRIBUTIONS UNDER IRC SECTION 170. HOWEVER THE COLLEGE IS SUBJECT TO FEDERAL INCOME TAX ON ANY UNRELATED BUSINESS TAXABLE INCOME. THE COLLEGE IS NOT CONSIDERED TO BE A PRIVATE FOUNDATION. THE COLLEGE FILES TAX RETURNS IN THE US FEDERAL JURISDICTION. WITH FEW EXCEPTIONS, THE COLLEGE IS NO LONGER SUBJECT TO US FEDERAL INCOME TAX EXAMINATIONS BY TAX AUTHORITIES FOR YEARS BEFORE 2011."
201413289349300436,610466713,"PART XI, LINE 2D - OTHER ADJUSTMENTS:","SPECIAL EVENT EXPENSE 8,544."
201413289349300436,610466713,"PART XI, LINE 4B - OTHER ADJUSTMENTS:","STUDENT AID DISCOUNTS 5,600,342. NON-OPERATING INVESTMENT INCOME 20,389."
201413289349300436,610466713,"PART XII, LINE 2D - OTHER ADJUSTMENTS:","SPECIAL EVENT EXPENSE 8,544."
201413289349300436,610466713,"PART XII, LINE 4B - OTHER ADJUSTMENTS:","STUDENT AID DISCOUNTS 5,600,342."
201423169349302177,131740126,INTENDED USE OF ENDOWMENT FUNDS,"FORM 990, SCHEDULE D, PART V, LINE 4 THE ENDOWMENT FUND OF THE HOSPITAL HAS BEEN ESTABLISHED TO PROVIDE FUNDING FOR PROGRAMS SUPPORTED BY ITS ENDOWMENT OR TO PROVIDE EMERGENCY FUNDS FOR USAGE TO BE APPROVED BY THE FINANCE COMMITTEE ON AN EMERGENCY BASIS."
201423169349302177,131740126,ACCOUNTING FOR UNCERTAINTY IN INCOME TAXES,"FORM 990, SCHEDULE D, PART X, LINE 2 THE HOSPITAL IS A NOT-FOR-PROFIT CORPORATION AS DESCRIBED IN SECTION 501(C)(3) OF THE CODE, AND IS EXEMPT FROM FEDERAL AND STATE INCOME TAXES PURSUANT TO SECTION 501(A) OF THE CODE. THERE ARE CERTAIN TRANSACTIONS THAT COULD BE DEEMED ""UNRELATED BUSINESS INCOME"" AND WOULD RESULT IN A TAX LIABILITY. MANAGEMENT REVIEWS TRANSACTIONS TO ESTIMATE POTENTIAL TAX LIABILITIES USING A THRESHOLD OF MORE LIKELY THAN NOT OF BEING SUSTAINED. IT IS MANAGEMENT'S ESTIMATION THAT THERE ARE NO MATERIAL TAX LIABILITIES THAT NEED TO BE RECORDED."
201443179349304359,351065063,"Schedule D, Part III, Line 1","The College's collections are made up of rare books, art objects and artifacts of historical significance that are held for educational and curatorial purposes. Most of the items are cataloged. All items are preserved, cared for and activities verifying their existence and assessing their condition are performed continuously. The collection items are not recognized as assets in the statement of financial position and contributions of collection items are not recognized in the statement of activities. Purchases of collection items are recorded as decreases in unrestricted net assets in the year in which the items are acquired. Assets uses to purchase collection items are reflected as temporarily or permanently restricted net assets if they are restricted for such purposes by the donors. Proceeds from deaccessions or insurance recoveries are reflected as increases in the appropriate net asset classes. The College requires that proceeds for the sale of collection items be used to acquire other collection items, unless otherwise specified by the donor."
201443179349304359,351065063,"Schedule D, Part III, Line 4","The College's collections are made up of rare books, art objects and artifacts of historical significance that are held for educational and historical value for current and future generations of Saint Mary-of-the-Woods college students and alumni."
201443179349304359,351065063,"Schedule D, Part V, Line 4","The endowments are restricted for the following uses: Instructional Support, Taking the Lead Campaign Goals, Scholarship and Award programs, Facilities Maintenance and any other activity that supports the mission of the college."
201443179349304359,351065063,"Schedule D, Part X, Line 2","The College is exempt from federal income taxes under Section 501(c)(3) of the U.S. Internal Revenue Code. The College is not considered to be a private foundation. Current accounting standards require the College to disclose the amount of potential benefit or obligation to be realized as a result of an examination performed by a taxing authority. For the years ended June 30, 2014 and 2013, management has determined that the College does not have any tax positions that result in any uncertainties regarding the possible impact on the College's financial statements. The College does not expect the total amount of unrecognized tax benefits to significantly change in the next 12 months. The College is no longer subject to examination by taxing authorities for years before 2011."
201443179349304359,351065063,"Schedule D, Part XI, Line 2d",College Funded Scholarships
201443179349304359,351065063,"Schedule D, Part XII, Line 4b",College funded scholarships
201443159349300979,942515428,"PART V, LINE 4:","ENDOWMENT FUNDS ARE USED TO PROVIDE STUDENT SCHOLARSHIPS, OTHER EXPENDITURES FOR FACILITIES AND PROGRAMS, ADMINISTRATIVE/GENERAL EXPENSES."
201443159349300979,942515428,"PART X, LINE 2:","THE FOUNDATION AND THE COLLEGE ARE RECOGNIZED AS EXEMPT FROM FEDERAL INCOME TAXES UNDER SECTION 501(C)(3) OF THE INTERNAL REVENUE CODE. THE FOUNDATION AND COLLEGE MAY BE SUBJECT TO FEDERAL AND STATE INCOME TAXES ON ANY NET INCOME FROM UNRELATED BUSINESS ACTIVITIES. THE FOUNDATION AND COLLEGE FILE A FORM 990 (RETURN OF ORGANIZATION EXEMPT FROM INCOME TAX) ANNUALLY AND UNRELATED BUSINESS INCOME (UBI) IS REPORTED ON FORM 990-T, AS APPROPRIATE. MANAGEMENT HAS EVALUATED THEIR MATERIAL TAX POSITIONS, WHICH INCLUDE SUCH MATTERS AS THE TAX EXEMPT STATUS OF EACH ENTITY AND VARIOUS POSITIONS RELATIVE TO POTENTIAL SOURCES OF UBI. AS OF JUNE 30, 2014 AND 2013, THERE WERE NO UNCERTAIN TAX BENEFITS IDENTIFIED AND RECORDED AS A LIABILITY. FORMS 990 AND 990-T FILED BY THE FOUNDATION AND COLLEGE ARE NO LONGER SUBJECT TO EXAMINATION BY THE INTERNAL REVENUE SERVICE FOR THE FISCAL YEARS ENDED JUNE 30, 2010 AND PRIOR."
201443159349300979,942515428,"PART XI, LINE 4B - OTHER ADJUSTMENTS:","INSTITUTIONAL GRANTS 549,022. NON CASH CONTRIBUTIONS 9,835."
201443159349300979,942515428,"PART XII, LINE 4B - OTHER ADJUSTMENTS:","INSTITUTIONAL GRANTS 549,022."
201443169349304464,880121831,"Schedule D, Part V, Line 4","The intended uses of the organization endowment funds are: Entrepreneurship Chair, Visiting Scholars, Student Aid, Environmental Studies and Tahoe Forum."
201443169349304464,880121831,"Schedule D, Part XI, Line 2d","Tuition Discount of $6,451,888 is subtracted from the revenue on the Audited Financial Statements."
201443169349304464,880121831,"Schedule D, Part XI, Line 4b","Form 990 includes expenses shown on line 6b of $483,004, 8b of $181,808 and 10b of $1,090,856 which reduce Form 990 total revenue by$1,755,668."
201443169349304464,880121831,"Schedule D, Part XII, Line 2d","Form 990 includes expenses shown on line 6b of $483,004, 8b of $181,808 and 10b of $1,090,856 which reduce Form 990 total revenue by$1,755,668."
201443169349304464,880121831,"Schedule D, Part XII, Line 4b","Tuition Discount of $6,451,888 is subtracted from the revenue on the Audited Financial Statements."
201413259349300406,042702102,"PART V, LINE 4:",THE SCHOOLS ENDOWMENT FUNDS ARE PRIMARILY INTENDED TO SUPPORT SCHOLARSHIPS FOR STUDENTS AND ACADEMIC PROGRAMS.
201413259349300406,042702102,"PART XI, LINE 2D - OTHER ADJUSTMENTS:","FINANCIAL AID -1,078,224. LOSS ON SPLIT INTEREST AGREEEMENT -1,824."
201413259349300406,042702102,"PART XI, LINE 4B - OTHER ADJUSTMENTS:","COST OF GOODS SOLD -7,200."
201413259349300406,042702102,"PART XII, LINE 2D - OTHER ADJUSTMENTS:","COST OF GOODS SOLD 7,200."
201413259349300406,042702102,"PART XII, LINE 4B - OTHER ADJUSTMENTS:","FINANCIAL AID 1,078,224."
201403159349302455,160743134,"PART V, LINE 4:","THE INTENDED USE OF THE ORGANIZATION'S ENDOWMENT FUNDS INCLUDE: 1) CAPITAL EXPANSION AND IMPROVEMENT, AND 2) ADVANCEMENT OF MEDICAL EDUCATION AND RESEARCH AND HEALTH CARE SERVICES"
201403159349302455,160743134,"PART XI, LINE 2D - OTHER ADJUSTMENTS:","WESTERN NEW YORK REVENUE 8,170,769."
201403159349302455,160743134,"PART XI, LINE 4B - OTHER ADJUSTMENTS:","CONTRIBUTION FOR CAPITAL ACQUISITIONS FROM FOUNDATION 558,427. GRANTS 304,544. RECLASSED FROM EXPENSE 777,481."
201403159349302455,160743134,"PART XII, LINE 2D - OTHER ADJUSTMENTS:","WESTERN NEW YORK EXPENSES 9,719,030."
201403159349302455,160743134,"PART XII, LINE 4B - OTHER ADJUSTMENTS:","RECLASSED TO REVENUES 777,481."
201423169349302427,590972013,"SCHEDULE D, PAGE 3, PART X","THE FOUNDATION IS EXEMPT FROM INCOME TAXES UNDER SECTION 501(C)(3) OF THE INTERNAL REVENUE SERVICE CODE. ITS SUBSIDIARY IS A FOR-PROFIT CORPORATION AND IS SUBJECT TO FEDERAL AND STATE INCOME TAXES. THE FOUNDATION DOES NOT FILE A CONSOLIDATED TAX RETURN WITH ITS SUBSIDIARY. THE SUBSIDIARY FILES ITS OWN FEDERAL AND STATE INCOME TAX RETURNS. THE SUBSIDIARY PROVIDES FOR DEFERRED INCOME TAXES UNDER THE ASSET AND LIABILITY METHOD OF ACCOUNTING. THIS METHOD REQUIRES THE RECOGNITION OF DEFERRED INCOME TAXES, BASED UPON THE TAX CONSEQUENCES OF ""TEMPORARY DIFFERENCES"" BY APPLYING ENACTED STATUTORY TAX RATES APPLICABLE TO FUTURE YEARS TO DIFFERENCES BETWEEN THE FINANCIAL STATEMENT CARRYING AMOUNTS AND THE TAX BASES OF EXISTING ASSETS AND LIABILITIES. THE DEFERRED TAXES REPRESENT THE FUTURE TAX RETURN CONSEQUENCES OF THE DIFFERENCES BETWEEN THE BASIS OF CERTAIN ASSETS AND LIABILITIES FOR FINANCIAL AND TAX REPORTING. THE FOUNDATION AND ITS SUBSIDIARY HAVE ADOPTED ACCOUNTING STANDARDS CODIFICATION ASC 740-10, INCOME TAXES AS IT RELATES TO UNCERTAIN TAX POSITIONS, AND HAS EVALUATED ITS TAX POSITIONS TAKEN FOR ALL OPEN TAX YEARS. CURRENTLY, THE LAST THREE TAX YEARS ARE OPEN AND SUBJECT TO EXAMINATION BY THE INTERNAL REVENUE SERVICE. HOWEVER, THE FOUNDATION IS NOT CURRENTLY UNDER AUDIT NOR HAS THE FOUNDATION BEEN CONTACTED BY ANY TAX JURISDICTION. MANAGEMENT IS RESPONSIBLE FOR EVALUATING THE FOUNDATION'S AND ITS SUBSIDIARY'S UNCERTAIN TAX POSITIONS. ACCRUED INTEREST RELATED TO UNRECOGNIZED TAX POSITIONS, IF ANY, ARE RECOGNIZED IN INTEREST EXPENSE AND PENALTIES IN OPERATING EXPENSES. BASED ON AN EVALUATION OF THE FOUNDATION'S TAX POSITIONS, MANAGEMENT BELIEVES ALL POSITIONS TAKEN WOULD BE UPHELD UNDER AN EXAMINATION. THEREFORE, NO PROVISION FOR THE EFFECTS OF UNCERTAIN TAX POSITIONS HAS BEEN RECORDED FOR THE YEAR ENDED JUNE 30, 2014."
201443179349306614,131662715,PART V - LINE 4,THE PERMANENTLY AND TEMPORARILY RESTRICTED FUNDS ARE RESTRICTED BY DONORS PRIMARILY FOR SCHOLARSHIPS AND THE BOARD DESIGNATED FUNDS ARE RESTRICTED BY THE BOARD OF TRUSTEES FOR SCHOLARSHIPS AND LIBRARY ACQUISITIONS. THE FUNDS ARE HELD IN INVESTMENT ACCOUNTS AND WILL BE USED ONLY FOR PURPOSES STIPULATED BY THE DONORS OR AS DESIGNATED BY THE BOARD OF TRUSTEES.
201443179349306614,131662715,PART X - LINE 2,"As of June 30, 2014, no amounts have been recognized for uncertain income tax positions. The School's tax returns for the 2011 fiscal year and forward are subject to the usual review by the appropriate taxing authorities."
201443179349306614,131662715,PART XI - LINES 2D & 4B,"2D. DIRECT SPECIAL EVENT EXPENSES: 70,373. 4B. INVESTMENT MANAGEMENT FEES: 200,495."
201443179349306614,131662715,PART XII - LINES 2D & 4B,"2D. DIRECT SPECIAL EVENT EXPENSES: 70,373. 4B. INVESTMENT MANAGEMENT FEES: 200,495."
201433179349303933,420504780,"PART V, LINE 4:","THE ORGANIZATION RETAINS FUNDS FOR INTENDED FUTURE USES, INCLUDING PURCHASE OF EQUIPMENT, INDIGENT CARE, FUNDING OF MISSION RELATED OPERATIONS, AND HEALTH EDUCATION. IN ADDITION, SOME FUNDS ARE HELD FOR INVESTMENT IN PERPETUITY."
201433179349303933,420504780,"PART X, LINE 2:","UNITYPOINT HEALTH AND MOST OF ITS SUBSIDIARIES ARE CLASSIFIED AS TAX-EXEMPT ORGANIZATIONS AS DESCRIBED IN SECTIONS 501(C)(3) AND 501(C)(2) OF THE INTERNAL REVENUE CODE (THE CODE). TAX-EXEMPT ORGANIZATIONS ARE NOT SUBJECT TO FEDERAL AND STATE INCOME TAXES ON RELATED INCOME, PURSUANT TO SECTION 501(A) OF THE CODE. THESE ORGANIZATIONS ARE SUBJECT TO FEDERAL AND STATE INCOME TAXES TO THE EXTENT THEY HAVE UNRELATED BUSINESS INCOME AS DESCRIBED UNDER PROVISIONS OF SECTION 511 OF THE CODE. THE SYSTEM FILES FORM 990 FOR SUBSTANTIALLY ALL OF ITS OPERATING ENTITIES IN THE U.S. FEDERAL JURISDICTION AND IS NO LONGER SUBJECT TO EXAMINATION BY TAX AUTHORITIES FOR THE YEARS BEFORE 2010. THE SYSTEM HAS NO MATERIAL UNCERTAIN TAX POSITIONS. CERTAIN SUBSIDIARIES ARE SUBJECT TO FEDERAL AND STATE INCOME TAXES. SOME OF THESE CORPORATIONS HAVE ACCUMULATED NET OPERATING LOSS CARRYFORWARDS THAT ARE AVAILABLE TO OFFSET FUTURE TAXABLE INCOME DURING THE CARRYFORWARD PERIOD. NO INCOME TAX BENEFIT HAS BEEN RECOGNIZED FOR THE NET OPERATING LOSS CARRYFORWARDS OR OTHER POTENTIAL DEFERRED TAX ASSETS IN THE CONSOLIDATED FINANCIAL STATEMENTS BECAUSE THE SYSTEM BELIEVES REALIZATION OF THESE BENEFITS IS UNLIKELY."
201433179349303933,420504780,"PART XI, LINE 2D - OTHER ADJUSTMENTS:","COST OF GOODS SOLD 685,578. REVENUES IN TEMPORARILY RESTRICTED FUND BALANCE 1,555,085. ROUNDING 3,150."
201433179349303933,420504780,"PART XI, LINE 4B - OTHER ADJUSTMENTS:","REVENUES IN UNRESTRICTED FUND BALANCE 14,281,836. IOWA HEALTH SYSTEM CONTRACTING SERVICES, LC PURCHASE REBATES 1,121,325. PHARMACY RECLASSIFICATION 16,392,390."
201433179349303933,420504780,"PART XII, LINE 2D - OTHER ADJUSTMENTS:","COST OF GOODS SOLD 685,578. ROUNDING 312."
201433179349303933,420504780,"PART XII, LINE 4B - OTHER ADJUSTMENTS:","EXPENSES IN UNRESTRICTED FUND BALANCE 9,311,258. IOWA HEALTH SYSTEM CONTRACTING SERVICES, LC PURCHASE REBATES 1,121,325. PHARMACY RECLASSIFICATION 16,392,390. EXPENSES IN TEMPORARILY RESTRICTED FUND BALANCE 197,000."
201433179349304333,250965603,"PART III, LINE 4:","WAYNESBURG UNIVERSITY IS A PRIVATE, INDEPENDENT, COEDUCATIONAL UNIVERSITY AND SHOWCASES ARTIFACTS, POTTERY, AND RECORDS DATING FROM 1817 TO THE PRESENT IN THE UNIVERSITY MUSEUM AVAILABLE FOR STUDENT AND PUBLIC VIEWING. THE LIBRARY MAINTAINS A COLLECTION OF OLD BOOKS FOR RESEARCH."
201433179349304333,250965603,"PART V, LINE 4:","THE ENDOWMENT FUND REPRESENTS AN IMPORTANT POOL OF FINANCIAL RESOURCES NEEDED TO ACHIEVE AND SUSTAIN THE HIGHEST LEVELS OF ACADEMIC EXCELLENCE IN ACCORDANCE WITH THE WAYNESBURG UNIVERSITY MISSION STATEMENT. THIS DOCUMENT PROVIDES A SET OF GENERAL GUIDELINES THAT WILL PERMIT THE BOARD OF TRUSTEES OF WAYNESBURG UNIVERSITY, WITH THE ADVICE AND RECOMMENDATIONS OF THE FINANCE AND PROPERTY COMMITTEE, TO OVERSEE THE INVESTMENT OF THE ENDOWMENT FUND FOR THE BENEFIT OF THE UNIVERSITY. THIS FUND IS A PERMANENT FUND WITH DISCIPLINED INVESTMENT OBJECTIVES AND CONSISTENT MONEY MANAGEMENT STRATEGIES THAT CAN ACCOMMODATE ANY RELEVANTLY REASONABLE OR PROBABLE EVENTS."
201433179349304333,250965603,"PART X, LINE 2:","THE UNIVERSITY ACCOUNTS FOR UNCERTAINTIES IN INCOME TAXES IN ACCORDANCE WITH THE AUTHORITATIVE GUIDANCE, WHICH PRESCRIBES A RECOGNITION THRESHOLD OF MORE-LIKELY-THAN-NOT TO BE SUSTAINED UPON EXAMINATION BY THE APPROPRIATE TAXING AUTHORITY. MEASUREMENT OF THE TAX UNCERTAINTY OCCURS IF THE RECOGNITION THRESHOLD HAS BEEN MET. MANAGEMENT DETERMINED THERE WERE NO TAX UNCERTAINTIES THAT MET THE RECOGNITION THRESHOLD AT JUNE 30, 2014 AND 2013. THE UNIVERSITY'S FEDERAL EXEMPT ORGANIZATION BUSINESS INCOME TAX RETURNS REMAIN SUBJECT TO EXAMINATION BY THE IRS FOR THE YEARS SUBSEQUENT TO JUNE 30, 2010."
201433179349304333,250965603,"PART XI, LINE 2D - OTHER ADJUSTMENTS:","STUDENT AID -10,813,624."
201433179349304333,250965603,"PART XI, LINE 4B - OTHER ADJUSTMENTS:","RENTAL EXPENSES -26,258. DIRECT FUNDRAISING EXPENSES -23,400. PASS-THROUGH LOSS NOT RECORDED ON BOOKS -99,633."
201433179349304333,250965603,"PART XII, LINE 2D - OTHER ADJUSTMENTS:","RENTAL EXPENSES 26,258. DIRECT FUNDRAISING EXPENSES 23,400."
201433179349304333,250965603,"PART XII, LINE 4B - OTHER ADJUSTMENTS:","STUDENT AID 10,813,624."
201433179349305423,391620530,"PART V, LINE 4:",THE ENDOWMENT FUNDS ARE USED FOR OPERATION EXPENSES AND SCHOLARSHIPS.
201433179349305423,391620530,"PART X, LINE 2:","IN ORDER TO ACCOUNT FOR UNCERTAIN TAX POSITIONS, THE COLLEGE DETERMINES WHETHER IT IS MORE LIKELY THAN NOT THAT A TAX POSITION WILL BE SUSTAINED UPON EXAMINATION BY THE TAXING AUTHORITIES, BASED ON THE TECHNICAL MERITS OF THE POSITION, ASSUMING THE TAXING AUTHORITY HAS FULL KNOWLEDGE OF ALL INFORMATION. IF THE TAX POSITION DOES NOT MEET THE MORE-LIKELY-THAN-NOT RECOGNITION THRESHOLD, THE BENEFIT OF THE TAX POSITION IS NOT RECOGNIZED IN THE FINANCIAL STATEMENTS. THE COLLEGE HAS NOT RECORDED ANY ASSETS OR LIABILITIES RELATED TO UNCERTAIN TAX POSITIONS OR UNRECOGNIZED TAX BENEFITS AS OF JUNE 30, 2014 AND 2013. THE COLLEGE'S FEDERAL TAX RETURNS FOR THE YEARS 2011 AND BEYOND REMAIN SUBJECT TO EXAMINATION BY THE APPLICABLE TAXING AUTHORITIES."
201433179349305423,391620530,"PART XI, LINE 2D - OTHER ADJUSTMENTS:","INVESTMENT EXPENSES -68,135."
201433179349305423,391620530,"PART XI, LINE 4B - OTHER ADJUSTMENTS:","SPECIAL EVENT EXPENSE -33,463. LIBRARY INTERCOMPANY CHARGES 321,146."
201433179349305423,391620530,"PART XII, LINE 2D - OTHER ADJUSTMENTS:","SPECIAL EVENTS EXPENSE 33,463. LIBRARY INTERCOMPANY CHARGES -321,146."
201433179349305423,391620530,"PART XII, LINE 4B - OTHER ADJUSTMENTS:","INVESTMENT EXPENSES 68,135."
201423169349304852,810231774,"PART III, LINE 4:",VARIOUS ART PIECES ARE DISPLAYED ON CAMPUS.
201423169349304852,810231774,"PART V, LINE 4:",THE ENDOWMENT WILL BE USED TO FUND SCHOLARSHIPS AND GENERAL OPERATIONS OF THE COLLEGE AND SUPPORTS EDUCATION.
201423169349304852,810231774,"PART X, LINE 2:","THE FINANCIAL ACCOUNTING STANDARDS BOARD (FASB) HAS ISSUED AN INTERPRETATION ON ACCOUNTING FOR UNCERTAINTY IN INCOME TAXES. THIS INTERPRETATION ADDRESSES THE ACCOUNTING FOR UNCERTAINTIES IN INCOME TAXES RECOGNIZED IN AN ENTITY'S FINANCIAL STATEMENTS AND PRESCRIBES A THRESHOLD OF MORE-LIKELY-THAN-NOT FOR RECOGNITION AND A DE-RECOGNITION OF TAX POSITIONS TAKEN OR EXPECTED TO BE TAKEN IN A TAX RETURN. THE COLLEGE'S POLICY IS TO EVALUATE THE LIKELIHOOD THAT ITS UNCERTAIN TAX POSITIONS WILL PREVAIL UPON EXAMINATION BASED ON THE EXTENT TO WHICH THOSE POSITIONS HAVE SUBSTANTIAL SUPPORT WITHIN THE INTERNAL REVENUE CODE AND REGULATIONS, REVENUE RULINGS, COURT DECISIONS AND OTHER EVIDENCE. IT IS THE OPINION OF MANAGEMENT THAT THE COLLEGE HAS NO UNCERTAIN TAX POSITIONS. WITH FEW EXCEPTIONS, THE COLLEGE IS NO LONGER SUBJECT TO EXAMINATIONS BY FEDERAL TAX AUTHORITIES FORYEARS BEFORE 2010."
201423169349304852,810231774,"PART XI, LINE 2D - OTHER ADJUSTMENTS:","COST OF GOODS SOLD 754,565. RENTAL EXPENSES NETTED ON RETURN 206,086."
201423169349304852,810231774,"PART XI, LINE 4B - OTHER ADJUSTMENTS:","COLLEGE FUNDED SCHOLARSHIPS AND GRANTS 17,611,532."
201423169349304852,810231774,"PART XII, LINE 2D - OTHER ADJUSTMENTS:","COST OF GOODS SOLD 754,565. RENTAL EXPENSES NETTED ON RETURN 206,086. ROUNDING -2."
201423169349304852,810231774,"PART XII, LINE 4B - OTHER ADJUSTMENTS:","COLLEGE FUNDED SCHOLARSHIPS AND GRANTS 17,611,532."
201423169349303627,350886846,"Schedule D, Part III, Line 4","The University of Saint Francis Art Collection is made up of over 5,000 works of art. The majority of the work is photographs, ceramics and prints representing local, regional, national and international artists. Also, included is an antique billiards table. Ninety-five percent of the collection is work from living artists. The purpose of the collection is to support the educational endeavors by students and faculty across campus. The collection more specifically supports the work of the students and faculty in the School of Creative Arts. The collection is displayed in the John Weatherhead Gallery, the Lupke Gallery, the Gold Fish Gallery and the Ian and Mimi Rolland gallery, which are open to the public."
201423169349303627,350886846,"Schedule D, Part V, Line 4","The University's endowment consists of approximately 80 individual funds established for a variety of purposes (Scholarships, Capital Expenditures and Educational Programs). The endowment includes donor-restricted and Board-designated endowment funds. As required by accounting principles generally accepted in the United States of America (GAAP), net assets associated with endowment funds are classified and reported based on the existence or absence of donor-imposed restrictions."
201423169349303627,350886846,"Schedule D, Part XI, Line 2d",Student Financial Aid is reported as part of Net Tuition on the financial statements but is recorded as expense on Form 990.
201423169349303627,350886846,"Schedule D, Part XI, Line 4b","Contributions from our sponsoring organization are recorded as other activities on the financial statement, but are included as revenue on Form 990. Additionally, realized gains are also recorded as other activities on the financial statements, but as revenue on Form 990. Lastly, rent expenses are included as a reduction to Form 990 revenue, but are not included in financial statement revenue."
201423169349303627,350886846,"Schedule D, Part XII, Line 4b","Student financial aid is reported as part of Net Tuition on the financial statements, but is recorded as an expense on Form 990. Additionally, rental expenses are netted against revenue on Form 990, but are recorded as an expense on the financial statements."
201443169349303414,541031437,"PART V, LINE 4:",THE COLLEGE'S ENDOWMENT CONSISTS OF FUNDS ESTABLISHED MAINLY FOR SCHOLARSHIPS.
201443169349303414,541031437,"PART XI, LINE 2D - OTHER ADJUSTMENTS:",SCHOLARSHIPS NETTED AGAINST TUITION REVENUE CHANGE IN VALUE OF SPLIT INTEREST AGREEMENTS
201443169349303414,541031437,"PART XII, LINE 4B - OTHER ADJUSTMENTS:",SCHOLARSHIPS NETTED AGAINST TUITION REVENUE
201443159349301729,450231180,"Part IV, Line 2b:","University of Jamestown chartered clubs, student academic associations, and approved faculty and staff associations have established agency accounts."
201443159349301729,450231180,"Part V, Line 4:","Endowment Funds are to be invested according to the Board approved Investment Policy Statement. Distributions from the fund are also made according the Investment Policy Statement and used for the purposes set by the donors, including items such as scholarships, facility maintenance and programs. In FYE 2013, the College changed its methodology of reporting the endowment funds. The change as been accounted for in 'Other expenditures for facilities and programs' resulting in a decrease of $319,707 in the 'Three Years Back' column. This change is also reflected in the beginning of year balances for the current year, prior year, and two years back columns."
