object_id,ein,FrmAndLnRfrncDsc,ExplntnTxt
201402949349300735,561065978,"PART V, LINE 4:","THE PERMANENTLY RESTRICTED NET ASSETS (""ENDOWMENTS"") ARE COMPOSED OF FUNDS RESTRICTED FOR SCHOLARSHIPS, FACULTY SCHOLARSHIPS, MISSIONS AND GENERAL USE. THE ENDOWMENTS REPRESENT FUNDS RECEIVED WITH DONOR IMPOSED STIPULATIONS THAT THEY BE MAINTAINED IN PERPETUITY BY THE UNIVERSITY. THE UNIVERSITY DETERMINES NET ASSET CLASSIFICATION AND ENDOWMENT SPENDING POLICY IN ACCORDANCE WITH THE HISTORIC DOLLAR VALUE OF THE GIFTS THAT CREATED THE ENDOWMENTS."
201402949349300735,561065978,"PART X, LINE 2:","NOTE 14 - UNCERTAIN TAXES THE UNIVERSITY FOLLOWS FASB ASC, WHICH PROVIDES GUIDANCE ON ACCOUNTING FOR UNCERTAINTY IN INCOME TAXES RECOGNIZED IN AN ORGANIZATION'S FINANCIAL STATEMENTS. AS OF JUNE 30, 2014 AND 2013, THE UNIVERSITY HAD NO UNCERTAIN TAX POSITIONS THAT QUALIFY FOR EITHER RECOGNITION OR DISCLOSURE IN THE UNIVERSITY'S CONSOLIDATED FINANCIAL STATEMENTS. THE UNIVERSITY'S POLICY IS TO RECOGNIZE INTEREST AND PENALTIES ON UNRECOGNIZED TAX BENEFITS IN INCOME TAX EXPENSE IN THE CONSOLIDATED FINANCIAL STATEMENTS. NO INTEREST OR PENALTIES WERE RECORDED DURING THE YEARS ENDED JUNE 30, 2014 AND 2013. GENERALLY, THE TAX YEARS BEFORE 2011 ARE NO LONGER SUBJECT TO EXAMINATION BY FEDERAL TAXING AUTHORITIES."
201402949349300735,561065978,"PART XI, LINE 2D - OTHER ADJUSTMENTS:","REVENUE OF MID-ATLANTIC CHRISTIAN UNIVERSITY FOUNDATION, INC. 380,361."
201402949349300735,561065978,"PART XI, LINE 4B - OTHER ADJUSTMENTS:","SCHOLARSHIPS OFFSETTING STUDENT TUITION AND FEES 326,159. GRANT FROM MID-ATLANTIC CHRISTIAN UNIVERSITY FOUNDATION, INC. 83,321."
201402949349300735,561065978,"PART XII, LINE 2D - OTHER ADJUSTMENTS:","EXPENSES OF MID-ATLANTIC CHRISTIAN UNIVERSITY FOUNDATION, INC. 26,896."
201402949349300735,561065978,"PART XII, LINE 4B - OTHER ADJUSTMENTS:","SCHOLARSHIPS OFFSETTING STUDENT TUITION AND FEES 326,159. TRANSFER TO MID-ATLANTIC CHRISTIAN UNIVERSTIY FOUNDATION, INC. 1,262."
201403219349307960,710236867,"SCHEDULE D, PAGE 2, PART III, LINE 4",ROCK & MINERAL COLLECTION - ENHANCES SCIENCE CLASS EDUCATION (SPECIFICALLY GEOLOGY) WATERCOLOR PAINTING COLLECTION - ENHANCES THE LEARNING ENVIRONMENT OF ART STUDENTS AND SERVES AS AN EXAMPLE OF WHAT CAN BE CREATED PFEFFER COLLECTION - ENHANCES THE LEARNING ENVIRONMENT OF ART AND HISTORY STUDENTS AND A GREAT EXAMPLE OF FINE ART
201403219349307960,710236867,"SCHEDULE D, PAGE 2, PART V, LINE 4","ENDOWMENT FUNDS ARE USED TO PROVIDE SCHOLARSHIPS, PROFESSORSHIPS, AND MAINTENANCE OF CAMPUS FACILITIES."
201403219349307960,710236867,"SCHEDULE D, PAGE 3, PART X","THE UNIVERSITY OF THE OZARKS IS EXEMPT FROM FEDERAL INCOME TAX UNDER SECTION 501(C)(3) OF THE INTERNAL REVENUE CODE EXCEPT TO THE EXTENT THE UNIVERSITY HAS UNRELATED BUSINESS INCOME. THERE WAS NO PROVISION FOR INCOME TAXES DUE ON UNRELATED BUSINESS INCOME IN THE CURRENT YEAR. THE UNIVERSITY HELD NO UNCERTAIN TAX POSITIONS AT JUNE 30, 2014 THAT WOULD RESULT IN MATERIAL UNRECOGNIZED TAX BENEFITS OR COSTS. THE UNIVERSITY'S TAX YEARS AFTER 2009 ARE OPEN FOR EXAMINATION BY FEDERAL AND STATE AUTHORITIES."
201403219349307960,710236867,"SCHEDULE D, PAGE 4, PART XI, LINE 2D","SCHOLARSHIP ALLOWANCE -8,856,107 WISP SCHOLARSHIP ALLOWANCE -498,260"
201403219349307960,710236867,"SCHEDULE D, PAGE 4, PART XI, LINE 4B","RENTAL EXPENSE -507,815 FOOD SERVICE COST -1,226,671 BOOKSTORE EXPENSES -6,884"
201403219349307960,710236867,"SCHEDULE D, PAGE 4, PART XII, LINE 2D","RENTAL EXPENSE 507,815 FOOD SERVICE COST 1,226,671 BOOKSTORE EXPENSE 6,884"
201403219349307960,710236867,"SCHEDULE D, PAGE 4, PART XII, LINE 4B","SCHOLARSHIP ALLOWANCE 8,856,107 WISP SCHOLARSHIP ALLOWANCE 498,260"
201403119349301460,135648615,"Schedule D, Part V, Line 4","The Word of Life Endowment Fund is focused on securing, from a human perspective, Word of Life's ability to provide scholarship for Bible Institute students and youth campers in the future. The investment income from the invested funds can be used to provide scholarships"
201403119349301460,135648615,"Schedule D, Part X, Line 2","Word of Life's current accounting policy is to disclose liabilities for uncertain tax positions when a liability is probable and estimable. Management is not aware of any violation of its tax status as an organization exempt from income taxes, nor is it aware of any exposure to unrelated business income tax."
201403119349301460,135648615,"Schedule D, Part XI, Line 2d","Change in value of gift annuities, change in value of properties subject to life estates, and other gains and losses from investments"
201403119349301460,135648615,"Schedule D, Part XI, Line 4b",Scholarships are not reflected as expenses for the audit report but are reflected as income and expenditures on the 990.
201403119349301460,135648615,"Schedule D, Part XII, Line 4b",Grants reflected on 990 as income and expenditures and not reflected on the audited statements
201403219349308850,230973290,"PART X, LINE 2:",MANAGEMENT HAS REVIEWED THE TAX POSITIONS FOR EACH OF THE OPEN TAX YEARS (2011-2013) OR EXPECTED TO BE TAKEN IN THE UNIVERSITY'S 2014 TAX RETURN AND HAS CONCLUDED THAT THERE ARE NO SIGNIFICANT UNCERTAIN TAX POSITIONS THAT WOULD REQUIRE RECOGNITION IN THE FINANCIAL STATEMENTS.
201403219349308850,230973290,"PART XI, LINE 2D - OTHER ADJUSTMENTS:","REVENUE FROM AFFILIATE NOT INCLUDED ON FORM 990 436,639. SPECIAL EVENTS 33,456. CONTRIBUTION FROM AFFILIATE ELIMINATED IN CONSOLIDATION -114,320."
201403219349308850,230973290,"PART XI, LINE 4B - OTHER ADJUSTMENTS:","FINANCIAL AID 7,951,097."
201403219349308850,230973290,"PART XII, LINE 2D - OTHER ADJUSTMENTS:","EXPENSES FROM AFFILIATE NOT INCLUDED ON THE FORM 990 331,365. SPECIAL EVENTS 33,456. CONTRIBUTION TO AFFILIATE ELIMINATED IN CONSOLIDATION -114,320."
201403219349308850,230973290,"PART XII, LINE 4B - OTHER ADJUSTMENTS:","FINANCIAL AID 7,951,097."
201403169349301835,390806325,"PART V, LINE 4:",THE ENDOWMENT FUNDS ARE USED TO SUPPORT ACADEMIC PROGRAMS AND SCHOLARSHIPS.
201403169349301835,390806325,"PART X, LINE 2:","THE UNIVERSITY FOLLOWS THE ACCOUNTING STANDARDS FOR CONTINGENCIES IN EVALUATING UNCERTAIN TAX POSITIONS. THE GUIDANCE PRESCRIBES RECOGNITION THRESHOLD PRINCIPLES FOR THE FINANCIAL STATEMENT RECOGNITION OF TAX POSITIONS TAKEN OR EXPECTED TO BE TAKEN ON A TAX RETURN THAT ARE NOT CERTAIN TO BE REALIZED. NO LIABILITY HAS BEEN RECOGNIZED BY THE UNIVERSITY FOR UNCERTAIN TAX POSITIONS AS OF JUNE 30, 2014 AND 2013. THE TAX RETURNS FOR THE CURRENT YEAR AS WELL AS FISCAL YEARS 2011 AND THEREAFTER ARE OPEN TO EXAMINATION BY FEDERAL AND STATE AUTHORITIES."
201403169349301835,390806325,"PART XI, LINE 2D - OTHER ADJUSTMENTS:","CHANGES IN VALUES OF SPLIT INTEREST AGREEMENTS 254,930."
201403169349301835,390806325,"PART XI, LINE 4B - OTHER ADJUSTMENTS:","OTHER DIRECT FUND RAISING EXPENSE -26,376. GRANTS AND OTHER ASSISTANCE TO INDIVIDUALS 32,968,139. EXCESS WITHDRAWALS OVER INCOME EARNED -406,243."
201403169349301835,390806325,"PART XII, LINE 2D - OTHER ADJUSTMENTS:","OTHER DIRECT FUND RAISING EXPENSE 26,376. EXCESS WITHDRAWALS OVER INCOME EARNED 406,243."
201403169349301835,390806325,"PART XII, LINE 4B - OTHER ADJUSTMENTS:","GRANTS AND OTHER ASSISTANCE TO INDIVIDUALS 32,968,139."
201403179349302875,610444780,"Schedule D, Part III, Line 4, Collections of art - description of collections",THE COLLECTION FURTHERS STUDENT EXPERIENCE AND LEARNING BY EXPOSING UNDERGRADUATE AND GRADUATE STUDENT TO VARIOUS WORKS OF ART.
201403179349302875,610444780,"Schedule D, Part V, Line 4, Intended uses of endowment funds",THE PURPOSE OF THE UNIVERSITY'S ENDOWMENT IS TO PROVIDE FUNDING FOR THE SCHOLARSHIP PROGRAMS AND OTHER RESTRICTED PURPOSES WITH THE GOAL OF SUPPORTING THE MISSION OF SPALDING UNIVERSITY. FOR THE QUASI ENDOWMENT IT IS TO PROVIDE A SAFETY NET FOR THE UNIVERSITY AND ITS USE IS BOARD DESIGNATED.
201403179349302875,610444780,"Schedule D, Part X, Line 2, FIN 48 (ASC 740) footnote","THE UNIVERSITY IS A NOT-FOR-PROFIT CORPORATION AND HAS BEEN RECOGNIZED BY THE INTERNAL REVENUE SERVICE TO BE EXEMPT FROM FEDERAL INCOME TAXES UNDER SECTION 501(C)(3) OF THE INTERNAL REVENUE CODE. ACCOUNTING PRINCIPLES GENERALLY ACCEPTED IN THE UNITED STATES OF AMERICA PRESCRIBE RECOGNITION THRESHOLDS AND MEASUREMENT ATTRIBUTES FOR THE FINANCIAL STATEMENT RECOGNITION AND MEASUREMENT OF A TAX POSITION TAKEN OR EXPECTED TO BE TAKEN IN A TAX RETURN. TAX BENEFITS OR LIABILITIES WILL BE RECOGNIZED ONLY IF THE TAX POSITION WOULD ""MORE-LIKELY-THAN-NOT"" BE SUSTAINED IN A TAX EXAMINATION, WITH A TAX EXAMINATION BEING PRESUMED TO OCCUR. THE AMOUNT RECOGNIZED WILL BE THE LARGEST AMOUNT OF TAX BENEFIT OR LIABILITY THAT IS GREATER THAN 50% LIKELY OF BEING REALIZED ON EXAMINATION. FOR TAX POSITIONS NOT MEETING THE MORE-LIKELY-THAN-NOT TEST, NO TAX BENEFIT OR LIABILITY WILL BE RECORDED. MANAGEMENT HAS CONCLUDED THAT THEY ARE UNAWARE OF ANY TAX BENEFITS OR LIABILITIES TO BE RECOGNIZED AT JUNE 30, 2014 AND 2013 AND DOES NOT EXPECT THIS TO CHANGE IN THE NEXT 12 MONTHS. THE UNIVERSITY WOULD RECOGNIZE INTEREST AND PENALTIES RELATED TO UNCERTAIN TAX POSITIONS IN INTEREST AND INCOME TAX EXPENSE, RESPECTIVELY. THE UNIVERSITY DOES NOT HAVE AMOUNTS ACCRUED FOR INTEREST OR PENALTIES AS OF JUNE 30, 2014 AND 2013. THE UNIVERSITY IS NO LONGER SUBJECT TO EXAMINATION BY TAXING AUTHORITIES FOR THE YEARS BEFORE JUNE 30, 2011."
201403179349302875,610444780,"Schedule D, Part XI, Line 2d, Other revenues in audited financial statements not in form 990",FUNDRAISING EVENT EXPENSE - 48656; GAMING EXPENSE - 42382; CHANGE IN VALUE OF SPLIT INTEREST AGREEMENT - 2993; CHANGE IN VALUE OF SWAP - 171528;
201403179349302875,610444780,"Schedule D, Part XI, Line 4b, Other revenues in form 990 not in audited financial statements",GRANTS TO INDIVIDUALS - 6147797; SPONSORSHIP EXPENSE NETTED WITH SPONSOR PROGRAMS - 26278;
201403179349302875,610444780,"Schedule D, Part XII, Line 2d, Other expenses in audited financial statements not in form 990",FUNDRAISING EVENT EXPENSE - 48656; GAMING EXPENSE - 42382;
201403179349302875,610444780,"Schedule D, Part XII, Line 4b, Other expenses in form 990 not in audited financial statements",GRANTS TO INDIVIDUALS - 6147797; SPONSORSHIP EXPENSE NETTED WITH SPONSORED PROGRAMS - 26278;
201403219349309665,650216638,"SCHEDULE D, PAGE 4, PART XI, LINE 4B","SCHOLOARSHIP REVENUE INCLUDED ON RETURN 35,637,890"
201403219349309665,650216638,"SCHEDULE D, PAGE 4, PART XII, LINE 4B","SCHOLARSHIP EXPENSE INCLUDED ON RETURN 35,637,890"
201403219349309665,650216638,"SCHEDULE D, PAGE 4, PART XIII","EXPENSES INCLUDE 250,088,435 WHICH RELATES TO A MARKET IMPAIRMENT TO THE INTANGIBLE ASSETS OF THE ORGANIZATION."
201403149349300920,640876425,"PART X, LINE 2:","THE FOOTNOTE RELATING TO UNCERTAIN TAX POSITIONS IN THE FINANCIAL STATEMENT READS AS FOLLOWS: THE ACADEMY IS A NOT-FOR-PROFIT CORPORATION THAT IS EXEMPT FROM FEDERAL INCOME TAXES UNDER SECTION 501(C)(3) OF THE INTERNAL REVENUE CODE (""IRC"") WHEREBY ONLY UNRELATED BUSINESS INCOME AS DEFINED BY SECTION 512(A)(1) OF THE IRC IS SUBJECT TO FEDERAL INCOME TAX. THE ACADEMY HAD NO UNRELATED BUSINESS INCOME FOR THE YEAR ENDED DECEMBER 31, 2013. ACCORDINGLY, NO PROVISION FOR INCOME TAX HAS BEEN MADE. THE FINANCIAL ACCOUNTING STANDARDS BOARD REQUIRES MANAGEMENT TO ANNUALLY EVALUATE THE ACADEMY'S TAX POSITIONS, INCLUDING ACCOUNTING AND MEASUREMENT OF UNCERTAIN TAX POSITIONS. FOR THE YEAR ENDING DECEMBER 31, 2013 MANAGEMENT CONCLUDED THAT NO UNCERTAIN TAX POSISIONS HAD BEEN TAKEN THAT WOULD REQUIRE ADJUSTMENT TO OR DISCLOSURE IN THE FINANCIAL STATEMENTS. WITH FEW EXCEPTIONS, THE ACADEMY IS NO LONGER SUBJECT TO INCOME TAX EXAMINATIONS BY FEDERAL, STATE, OR LOCAL TAX AUTHORITIES FOR YEARS BEFORE 2010."
201403149349300920,640876425,"PART XI, LINE 2D - OTHER ADJUSTMENTS:","COST OF GOODS SOLD 44,944."
201403149349300920,640876425,"PART XII, LINE 2D - OTHER ADJUSTMENTS:","COST OF GOODS SOLD- BOOKSTORE 44,944."
201403179349304225,420698265,"PART V, LINE 4:","THE ORGANIZATION RETAINS FUNDS FOR INTENDED FUTURE USES, INCLUDING PURCHASE OF EQUIPMENT, INDIGENT CARE, FUNDING OF MISSION RELATED OPERATIONS, AND HEALTH EDUCATION. IN ADDITION, SOME FUNDS ARE HELD FOR INVESTMENT IN PERPETUITY."
201403179349304225,420698265,"PART X, LINE 2:","UNITYPOINT HEALTH AND MOST OF ITS SUBSIDIARIES ARE CLASSIFIED AS TAX-EXEMPT ORGANIZATIONS AS DESCRIBED IN SECTIONS 501(C)(3) AND 501(C)(2) OF THE INTERNAL REVENUE CODE (THE CODE). TAX-EXEMPT ORGANIZATIONS ARE NOT SUBJECT TO FEDERAL AND STATE INCOME TAXES ON RELATED INCOME, PURSUANT TO SECTION 501(A) OF THE CODE. THESE ORGANIZATIONS ARE SUBJECT TO FEDERAL AND STATE INCOME TAXES TO THE EXTENT THEY HAVE UNRELATED BUSINESS INCOME AS DESCRIBED UNDER PROVISIONS OF SECTION 511 OF THE CODE. THE SYSTEM FILES FORM 990 FOR SUBSTANTIALLY ALL OF ITS OPERATING ENTITIES IN THE U.S. FEDERAL JURISDICTION AND IS NO LONGER SUBJECT TO EXAMINATION BY TAX AUTHORITIES FOR THE YEARS BEFORE 2010. THE SYSTEM HAS NO MATERIAL UNCERTAIN TAX POSITIONS. CERTAIN SUBSIDIARIES ARE SUBJECT TO FEDERAL AND STATE INCOME TAXES. SOME OF THESE CORPORATIONS HAVE ACCUMULATED NET OPERATING LOSS CARRYFORWARDS THAT ARE AVAILABLE TO OFFSET FUTURE TAXABLE INCOME DURING THE CARRYFORWARD PERIOD. NO INCOME TAX BENEFIT HAS BEEN RECOGNIZED FOR THE NET OPERATING LOSS CARRYFORWARDS OR OTHER POTENTIAL DEFERRED TAX ASSETS IN THE CONSOLIDATED FINANCIAL STATEMENTS BECAUSE THE SYSTEM BELIEVES REALIZATION OF THESE BENEFITS IS UNLIKELY."
201403179349304225,420698265,"PART XI, LINE 2D - OTHER ADJUSTMENTS:","COST OF GOODS SOLD 140,258. RENTAL EXPENSES REPORTED AS OFFSET TO RENTAL INCOME 50."
201403179349304225,420698265,"PART XI, LINE 4B - OTHER ADJUSTMENTS:","REVENUES IN UNRESTRICTED FUND BALANCE 2,211,998. IOWA HEALTH SYSTEM CONTRACTING SERVICES, LC PURCHASE REBATES 610,249. ROUNDING 726. REVENUES IN TEMPORARILY RESTRICTED FUND BALANCE 4,131. EXPENSES TO ALLEN COLLEGE NETTED IN REVENUES 44,971."
201403179349304225,420698265,"PART XII, LINE 2D - OTHER ADJUSTMENTS:","COST OF GOODS SOLD 140,258. RENTAL EXPENSES REPORTED AS OFFSET TO RENTAL INCOME 50."
201403179349304225,420698265,"PART XII, LINE 4B - OTHER ADJUSTMENTS:","EXPENSES IN UNRESTRICTED FUND BALANCE 7,784,701. IOWA HEALTH SYSTEM CONTRACTING SERVICES, LC PURCHASE REBATES 610,249. ROUNDING 359. EXPENSES TO ALLEN COLLEGE NETTED IN REVENUES 44,971."
201403079349301575,742568941,"SCHEDULE D, PART X","ASC 740, INCOME TAXES, REQUIRES ORGANIZATIONS TO RECOGNIZE THE TAX BENEFITS OF CERTAIN TAX POSITIONS ONLY WHEN THE POSITION IS ""MORE LIKELY THAN NOT"" TO BE SUSTAINED, ASSUMING EXAMINATION BY THE TAX AUTHORITIES. THE TAX BENEFIT RECOGNIZED IS THE LARGEST AMOUNT OF BENEFIT THAT IS GREATER THAN 50% LIKELY OF BEING RECOGNIZED UPON ULTIMATE SETTLEMENT. IN ACCORDANCE WITH ASC 740, THE FOUNDATION RECOGNIZES INTEREST AND PENALTIES, IF ANY, RELATED TO TAX LIABILITIES AS INCOME TAX EXPENSE ON THE STATEMENT OF ACTIVITIES. THE FOUNDATION HAS CONCLUDED THAT THERE ARE NO SIGNIFICANT UNCERTAIN TAX POSITIONS THAT WOULD REQUIRE RECOGNITION IN THE ACCOMPANYING FINANCIAL STATEMENTS. THE FOUNDATION REMAINS SUBJECT TO EXAMINATION BY U.S. FEDERAL TAX AUTHORITIES FOR THE 2010 THROUGH 2013 TAX YEARS, AND 2009 THROUGH 2013 FOR COLORADO STATE TAX AUTHORITIES. THE FOUNDATION IS CURRENTLY UNDER EXAMINATION BY THE INTERNAL REVENUE SERVICE FOR THE 2011 TAX YEAR."
201403079349301575,742568941,"Schedule D, Part XI, Line 4b & PART XII, LINE 4B","Loss on disposal of PP&E $129,217."
201402269349300205,136192377,Part X : FIN48 Footnote,"The College has determined that there are no material uncertain tax positions that require recognition or disclosure in the financial statements. Periods ending December 31, 2010 and subsequent remain subject to examination by the applicable taxing authorities."
201402269349300205,136192377,"Part XI, Line 4b: Other revenue amounts included on 990 but not included in F/S",Student aid $3517248
201402269349300205,136192377,"Part XII, Line 4b: Other revenue amounts included on 990 but not included in F/S",Student aid $3517248
201401919349300620,161411935,"Part X, Line 2:","Accounting standards require entities to disclose in their financial statements the nature of any uncertain tax positions. Tax years including the year ended December 31, 2010 and later are subject to examination by tax authorities. Areas that IRS and state tax authorities consider when examining tax returns of a charity include, but may not be limited to, tax-exempt status and the existence and amount of unrelated business income. The Organization does not believe that it has any uncertain tax positions with respect to these or other matters, and has not recorded any unrecognized tax benefits or liability for penalties or interest. The Organization is not aware of any circumstances or events, that make it reasonably possible that tax benefits may increase or decrease within 12 months of the date of these financial statements."
201402049349300960,620730291,Part X : FIN48 Footnote,"The Institution files its tax returns with the U.S. federal and various state and local tax jurisdictions. With few exceptions, the Institution is no longer subject to examinations by major tax jurisdictions for years prior to 2010.The Institution includes accrued interest and penalties related to unrecognized tax benefits in operating expenses. The expense for interest and penalties related to unrecognized tax benefits amounts to $0 for the years ended December 31, 2013 and 2012, respectively."
201412539349300806,340909974,"PART V, LINE 4:","THE ENDOWMENT FUNDS ARE RESTRICTED FOR ANY PURPOSE THAT FURTHERS THE ORGANIZATION'S MISSION AND EXEMPT PURPOSE, WHICH IS THEN SUBJECT TO APPROVAL BY THE BOARD OF TRUSTEES."
201413149349300801,340737794,"PART V, LINE 4","Malone University has a policy of appropriating for expenditure each year 5% of its invested endowment fund's average fair value over the prior three years. A diversified asset allocation is targeted that places a greater emphasis on equity-based investments. Appropriations are used primarily to fund scholarships, and for the renovation of buildings and equipment replacement."
201413149349300801,340737794,ASC 740 FOOTNOTE,"Management has evaluated their income tax positions under the guidance included in ASC 740. Based on their review, management has not identified any material uncertain tax positions to be recorded or disclosed in the financial statements. PART XI, LINE 2D RENT EXPENSE $77,708 PART XI, LINE 4B FINANCIAL AID 17,533,596 OUTSIDE SCHOLARSHIPS 516,470 TOTAL: $18,050,066 PART XII, LINE 2D RENT EXPENSE $77,708 PART XII, LINE 4B FINANCIAL AID 17,533,596 OUTSIDE SCHOLARSHIPS 516,470 TOTAL: $18,050,066"
201413149349301031,461812625,"SCHEDULE D, PAGE 4, PART XII, LINE 4B","BOOK / TAX DEPRECIATION DIFFERENCE 93,189"
201413039349300316,231937954,"PART XI, LINE 4B - OTHER ADJUSTMENTS:","FINANCIAL ASSISTANCE - $584,464"
201413039349300316,231937954,"PART XII, LINE 4B - OTHER ADJUSTMENTS:","FINANCIAL ASSISTANCE - $584,464"
201413149349301236,570314415,"Schedule D, Part V, Line 4",The majority of the endowment funds are donor designated to provide scholarship assistance to students. A few endowments are donor designated to support SMC programs and building maintenance.
201413149349301236,570314415,"Schedule D, Part X, Line 2","The College follows the provisions of FASB guidance on income taxes related to the accounting for uncertainty in income taxes. This guidance clarifies the accounting for uncertainty in income taxes recognized in an entity's financial statements by prescribing a recognition threshold and measurement attribute for the financial statement recognition and measurement of a tax position taken or expected to be taken in a tax return. The College's policy is to record a liability for any tax position taken that is beneficial to the College, including any related interest and penalties, when it is more likely than not the position taken by management with respect to a transaction or class of transactions will be overturned by a taxing authority upon examination. Management believes there are no such positions as of June 30, 2014 and 2013 and, accordingly, no liability has been accrued. Tax years ended June 30, 2010 or later remain open to examination by taxing authorities."
201413149349301236,570314415,"Schedule D, Part XI, Line 2d","Change in value of split interest agreements $39,835 plus change in valuation of pledges $53,678."
201413149349301236,570314415,"Schedule D, Part XI, Line 4b","Tuition Discounts of $5,264,689 less direct expense of fundraising of $17,943."
201413149349301236,570314415,"Schedule D, Part XII, Line 2d","Direct expense related to fundraising event $17,943."
201413149349301236,570314415,"Schedule D, Part XII, Line 4b","Tuition discounts of $5,264,689."
201413109349301966,271503981,"PART X, LINE 2:","THE FOUNDATION FOLLOWS THE ACCOUNTING STANDARD ON ACCOUNTING FOR UNCERTAINTY IN INCOME TAXES, WHICH ADDRESSES THE DETERMINATION OF WHETHER TAX BENEFITS CLAIMED OR EXPECTED TO BE CLAIMED ON A TAX RETURN SHOULD BE RECORDED IN THE FINANCIAL STATEMENTS. UNDER THIS GUIDANCE, THE FOUNDATION MAY RECOGNIZE THE TAX BENEFIT FROM AN UNCERTAIN TAX POSITION ONLY IF IT IS MORE LIKELY THAN NOT THAT THE TAX POSITION WILL BE SUSTAINED ON EXAMINATION BY TAXING AUTHORITIES, BASED ON THE TECHNICAL MERITS OF THE POSITION. EXAMPLES OF TAX POSITIONS INCLUDE THE TAX-EXEMPT STATUS OF THE FOUNDATION AND VARIOUS POSITIONS RELATED TO THE POTENTIAL SOURCES OF UNRELATED BUSINESS TAXABLE INCOME. THE TAX BENEFITS RECOGNIZED IN THE FINANCIAL STATEMENTS FROM SUCH A POSITION ARE MEASURED BASED ON THE LARGEST BENEFIT THAT HAS A GREATER THAN 50 PERCENT LIKELIHOOD OF BEING REALIZED UPON ULTIMATE SETTLEMENT. THERE WERE NO UNRECOGNIZED TAX BENEFITS IDENTIFIED OR RECORDED AS LIABILITIES DURING THE PERIODS COVERED BY THESE FINANCIAL STATEMENTS. THE FOUNDATION IS EXEMPT FROM INCOME TAXES UNDER SECTION 501(C)(3) OF THE INTERNAL REVENUE CODE AND QUALIFIES FOR CHARITABLE CONTRIBUTION DEDUCTIONS. THE FOUNDATION HAS BEEN CLASSIFIED AS AN ORGANIZATION THAT IS NOT A PRIVATE FOUNDATION UNDER SECTION 509(A) OF THE INTERNAL REVENUE CODE. THE FOUNDATION IS NO LONGER SUBJECT TO U.S. FEDERAL INCOME TAX EXAMINATIONS FOR THE YEARS ENDING THROUGH DECEMBER 31, 2009. THE FOUNDATION IS SUBJECT TO WISCONSIN INCOME TAX EXAMINATIONS FOR YEARS ENDED 2010-2013."
201412879349300416,381359570,"SCHEDULE D, PAGE 4, PART XI, LINE 2D","MANNERHEIM, INC. - CONSOLIDATED FOR FINANCIAL STATEMENT 512,988"
201412879349300416,381359570,"SCHEDULE D, PAGE 4, PART XII, LINE 2D","MANNERHEIM, INC. - CONSOLIDATED FOR FINANCIAL STATEMENTS 595,281 ROUNDING 0"
201412879349300846,410694721,"PART IV, LINE 2B:",FUNDS HELD IN CUSTODY FOR OTHERS RELATES TO AGENCY FUNDS THAT AUGSBURG COLLEGE HELPS TO ADMINISTER. THERE ARE APPROXIMATELY 20 AGENCIES THAT AUGSBURG COLLEGE CURRENTLY WORKS WITH IN THIS TYPE OF RELATIONSHIP.
201412879349300846,410694721,"PART V, LINE 4:",THE COLLEGE ENDOWMENT CONSISTS OF APPROXIMATELY 350 INDIVIDUAL FUNDS ESTABLISHED FOR A VARIETY OF PURPOSES BASED ON DONOR RESTRICTIONS AND BOARD DESIGNATIONS.
201412879349300846,410694721,"PART X, LINE 2:","THE COLLEGE HAS RECEIVED A DETERMINATION LETTER FROM THE INTERNAL REVENUE SERVICE INDICATING IT IS A TAX-EXEMPT ORGANIZATION UNDER SECTION 501(C)(3) OF THE INTERNAL REVENUE CODE AND IS SUBJECT TO FEDERAL AND STATE INCOME TAX ONLY ON NET UNRELATED BUSINESS INCOME. THE COLLEGE ENGAGES IN ACTIVITIES THAT ARE CONSIDERED UNRELATED TO ITS EXEMPT PURPOSE. THESE ACTIVITIES ARE SUBJECT TO FEDERAL AND STATE INCOME TAXES. SUCH ACTIVITIES GENERATED A LOSS POSITION IN FISCAL 2013 AND 2012. FURTHER, THE COLLEGE HAS A NET OPERATING LOSS CARRYFORWARD AVAILABLE TO OFFSET ANY TAXABLE INCOME FROM THESE UNRELATED ACTIVITIES. ACCORDINGLY, NO FEDERAL OR STATE TAX PROVISION IS REQUIRED. THE NET OPERATING LOSSES BEGIN TO EXPIRE IN 2020. THE COLLEGE ADOPTED ACCOUNTING STANDARDS FOR CONTINGENCIES IN EVALUATING UNCERTAIN TAX POSITIONS AND FILES AS A TAX EXEMPT ORGANIZATION. NO ADJUSTMENTS TO THE FINANCIAL STATEMENTS WERE REQUIRED AS A RESULT OF THE IMPLEMENTATION OF THIS STANDARD. THE COLLEGE HAS NO CURRENT OBLIGATION FOR UNRELATED BUSINESS INCOME TAX. THE COLLEGE TAX RETURNS ARE SUBJECT TO REVIEW AND EXAMINATION BY FEDERAL AUTHORITIES. SHOULD THAT STATUS BE CHALLENGED IN THE FUTURE, THE TAX RETURNS FOR THE YEARS 2011 THROUGH 2013 ARE SUBJECT TO REVIEW BY FEDERAL AUTHORITIES."
201412879349300846,410694721,"PART XI, LINE 2D - OTHER ADJUSTMENTS:","ADJUSTMENT OF ACTUARIAL LIABILITY 31,645. CHANGE IN ALLOWANCE FOR UNCOLLECTIBLE PLEDGES -197,149. SPECIAL EVENT EXPENSES 102,103. RENTAL EXPENSES 912,990."
201412879349300846,410694721,"PART XI, LINE 4B - OTHER ADJUSTMENTS:","SCHOLARSHIPS AND GRANTS 28,144,656. LOSS ON DISPOSAL OF FIXED ASSETS -333,957. ENDOWMENT INCOME AND GAINS 345,081. ENDOWMENT GAINS 3,722,291."
201412879349300846,410694721,"PART XII, LINE 2D - OTHER ADJUSTMENTS:","SPECIAL EVENT EXPENSES 102,103. RENTAL EXPENSES 912,990. LOSS ON DISPOSAL OF FIXED ASSETS 333,957. EXPENSES OF AFFILIATE REPORTED ON A SEPARATE RETURN 10,028."
201412879349300846,410694721,"PART XII, LINE 4B - OTHER ADJUSTMENTS:","SCHOLARSHIPS AND GRANTS 28,144,656."
201413169349303271,370706154,"PART III, LINE 4:",THE COLLECTIONS ARE DONATED WORKS OF ART FOR EDUCATIONAL PURPOSES ONLY.
201413169349303271,370706154,"PART V, LINE 4:","THE INCOME FROM ENDOWMENT FUNDS IS USED FOR STUDENT SCHOLARSHIPS AND AWARDS, PROFESSORSHIPS, LIBRARY OPERATIONS, AND VARIOUS OTHER PURPOSES INCLUDING MAINTENANCE OF BUILDINGS."
