object_id,ein,FrmAndLnRfrncDsc,ExplntnTxt
201443179349303609,210634462,"Schedule L, Part IV","With regard to conflicts of members of the board of trustees, the board policy on duality and conflict of interest requires trustees to disclose all relationships that may cause a conflict. The audit and ethics committee of the board of trustees reviews transactions that may involve a conflict of interest of an officer, director, trustee or key employee. These procedures are designed to provide for independent review of the transaction, determination of the availability of alternative transactions that do not pose a conflict of interest, and preservation of the organization's best interests in transactions where non-conflicting alternatives are not reasonably attainable. The audit and ethics committee makes a recommendation to the board of trustees with regard to such transactions, which then makes a determination whether the transaction is in the organization's best interest, whether the transaction is fair and reasonable and whether there is a legitimate business interest for such transaction. Any trustee with a conflict of interest with regard to such matter may not vote on such transaction."
201443179349303609,210634462,"Schedule L, Part IV","Footnote # 1: The amount noted in Part IV, Column (c): $473,669 represents the amount paid by Cooper Health System to Conner Strong & Buckelew for insurance brokerage, consulting, risk manager and safety services. It should be additionally noted that Cooper's relationship with Conner Strong & Buckelew and its predecessors extends back approximately twenty five years and predates Mr. Norcross' board membership. Mr. Norcross is not personally involved either in the procurement, performance or supervision of any services rendered by Conner Strong & Buckelew to Cooper. The Conner Strong & Buckelew relationship has been annually reviewed by Cooper's independent audit/ethics committee and consulting and brokerage services have been periodically subjected to a competitive bidding process."
201443179349303609,210634462,"Schedule L, Part IV","Footnote #2: Parker McCay PA (Parker) has been providing legal services to Cooper for more than twenty five years, predating George Norcross' membership on the Cooper Health System Board of Trustees. Mr. Norcross' brother, Philip, is a shareholder and a managing officer of Parker, but did not become such until well after the firm began providing legal services to Cooper. Parker's primary function as outside counsel is representing the Cooper Health System and its employees in defense of professional liability claims. Philip Norcross is not involved in the assignment, performance, or supervision of that work."
201443179349303609,210634462,"Schedule L, Part IV","Footnote #3: Cardiovascular Associates of the Delaware Valley (CADV), a professional association, provides interventional and other cardiology services to patients. CHS, under an agreement for professional services (leased physicians), provides cardiothoracic surgical physicians' services on a part-time basis to CADV. Harvey A. Snyder, CHS Trustee, is a greater than 5% owner of CADV. During the tax year, CHS paid CADV $15,910 for services related to billings/collections and office space and associated support. CADV paid CHS $47,634 for the leased physicians arrangement. The figure reflected in Schedule L is the addition of $15,910 and $47,634 or $63,544."
201433189349308163,141338413,Thomas Murphy is a director on the Glens Falls Hospital Board who is,"also President of Glens Falls National Bank. Glens Falls Hospital has a business relationship with Glens Falls National Bank. John C. Bieniek is a director on the Glens Falls Hospital Board who is a V/P and partner at Cool Insuring Agency. The Hospital engages the Cool Insuring Agency for many of its business related insurance needs. James Cullum is the Chairman of the Glens Falls Hospital Board. Mr. Cullum is a partner with the law firm McPhillips, Fitzgerald & Cullum. Glens Falls Hospital engages McPhillips, Fitzgerald & Cullum for malpractice litigation. Michael Clarke is the Vice Chairman of the Glens Falls Hospital Board, who is also on the Board of Arrow Financial Group which is the parent of Glens Falls National Bank. All of Glens Falls Hospital Board members are required to sign a conflict of interest policy, to ensure that the Hospital operates in a manner consistent with its charitable purposes. Activities, arrangements and services are the result of arms length bargaining reflecting reasonable payments for goods and services. Board bylaws stipulate that board members recuse themselves regarding any subject that pertains to a potential conflict of interest."
201413119349301266,540715569,PART IV,"BUSINESS TRANSACTIONS (A) Name of Person: Lynchburg Pulmonary Associates (B) Relationship Between Interested Person and Organization: Board member Albert Baker, MD is partial owner of Lynchburg Pulmonary Associates (C) Amount of Transaction: $1,409,464 (D) Description of Transaction: Payments for coverage of patients in critical care units rendered to Centra Health, Inc. in Lynchburg, VA (E) Sharing of Organization Revenues?: No (A) Name of Person: Orthopaedic Center of Central Virginia (B) Relationship Between Interested Person and Organization: Board member Michael Diminick, MD is shareholder of Orthopaedic Center of Central Virginia (C) Amount of Transaction: $528,072 (D) Description of Transaction: Payment for medical services rendered to Centra Health, Inc (E) Sharing of Organization Revenues?: No (A) Name of Person: Medical Associates of Central Virginia (B) Relationship Between Interested Person and Organization: Board member Scott Wade, MD is a partial owner of Medical Associates of Central Virginia (C) Amount of Transaction: $9,707,038 (D) Description of Transaction: Payment for medical services rendered to Centra Health, Inc. (E) Sharing of Organization Revenues? No (A) Name of Person: Scott Insurance (B) Relationship Between Interested Person and Organization: Board member Walker Sydnor serves as President & Chairman of the Board of Scott Insurance. (C) Amount of Transaction: $1,036,058 (D) Description of Transaction: Payment of insurance premiums provided to Centra Health, Inc. (E) Sharing of Organization Revenues?: No (A) Name of Person: PATHOLOGY CONSULTANTS OF CENTRAL VIRGINIA (B) Relationship Between Interested Person and Organization: FAMILY MEMBER OF BOARD MEMBER ROBERT COOK, MD IS > 5% OWNER OF PATHOLOGY CONSULTANTS OF CENTRAL VIRGINIA. (C) Amount of Transaction: $1,413,430 (D) Description of Transaction: Payment FOR MEDICAL SERVICES RENDERED to Centra Health, Inc. (E) Sharing of Organization Revenues?: No (A) Name of Person: Mark C. Addison (B) Relationship Between Interested Person and Organization: Family member of Lewis Addison, Officer of Centra Health, Inc. (C) Amount of Transaction: $27,431 (D) Description of Transaction: Compensation as employee of Centra Health, Inc. (E) Sharing of Organization Revenues?: No (A) Name of Person: Mark A. McKinney (B) Relationship Between Interested Person and Organization: Family member of E.W. Tibbs, Officer of Centra Health, Inc. (C) Amount of Transaction: $109,422 (D) Description of Transaction: Compensation as employee of Centra Health, Inc. (E) Sharing of Organization Revenues?: No"
201443189349304404,953797687,"SCHEDULE L, PART III:","BECAUSE OF THE FAMILY EDUCATIONAL RIGHTS AND PRIVACY ACT (FERPA), SCHOOLS ARE NOT REQUIRED TO IDENTIFY INTERESTED PERSONS TO WHOM THEY PROVIDE FINANCIAL ASSISTANCE ON FORM 990. IN 2013, A FAMILY MEMBER OF A LISTED PERSON QUALIFIED FOR FEDERAL FINANCIAL AID AND GIA PROVIDED A 25% MATCH AS REQUIRED UNDER THE FEDERAL FINANCIAL AID PROGRAM. THE FINANCIAL AID PROVIDED WAS THE SAME AS THAT PROVIDED TO ANY OTHER SIMILARLY-SITUATED STUDENT."
201443189349304404,953797687,"SCHEDULE L, PART IV:","(A) NAME OF PERSON: KELLY YANTZER - DIRECTOR, GLOBAL EDUCATIONAL STANDARDS (B) RELATIONSHIP BETWEEN INTERESTED PERSON AND ORGANIZATION:FAMILY MEMBER OF PHILLIP YANTZER, KEY EMPLOYEE(C) AMOUNT OF TRANSACTION: $123,154(D) DESCRIPTION OF TRANSACTION: MS. YANTZER IS GIA'S DIRECTOR OF GLOBAL EDUCATION STANDARDS. HER COMPENSATION IS REASONABLE IN LIGHT OF THE VALUE OF HER SERVICES TO THE INSTITUTE. SHE IS SUPERVISED BY, AND HER COMPENSATION LEVEL IS SET BY, GIA'S VICE PRESIDENT OF EDUCATION.THE INSTITUTE STRIVES TO MAINTAIN A BOARD OF GOVERNORS COMPOSED OF OUTSTANDING INDIVIDUALS WITH VARIED BACKGROUNDS WHO ARE ABLE TO CONTRIBUTE IMPORTANTLY TO THE ACCOMPLISHMENT OF THE INSTITUTE'S EXEMPT PURPOSES. THESE INCLUDE EXPERTS FROM THE FIELDS OF SCIENCE, ACADEMIA, FINANCE AND BUSINESS. THE INSTITUTE IS ALSO FORTUNATE TO HAVE BEEN ABLE TO RECRUIT A NUMBER OF OUTSTANDING EXPERTS (BOTH RETIRED AND ACTIVE) IN THE VARIOUS ASPECTS OF GEMS AND JEWELRY. THEREFORE, IT IS NOT SURPRISING THAT FIRMS ASSOCIATED WITH SOME OF THESE GOVERNORS HAVE PARTICIPATED IN THE INSTITUTE'S THREE EXEMPT ACTIVITIES PREVIOUSLY REPORTED TO AND APPROVED BY THE IRS: EDUCATION, RESEARCH, AND GEM LABORATORY ACTIVITIES. (IN ADDITION, A RELATIVELY SMALL PORTION OF THE TRANSACTIONS INVOLVED SALES OF GEMOLOGICAL INSTRUMENTS, BOOKS AND SUPPLIES WHICH HAVE BEEN REPORTED AS NONEXEMPT ACTIVITIES.) SUCH PARTICIPATION BY THESE FIRMS, HOWEVER, BEGAN BEFORE THE ELECTION OF THESE INDIVIDUALS TO THE BOARD OF GOVERNORS AND REPRESENTS A TINY FRACTION OF THE TOTAL ACTIVITIES REPORTED ON FORM 990. OBVIOUSLY, TO BAR FIRMS AFFILIATED WITH BOARD MEMBERS FROM UTILIZING THE SERVICES OF THE INSTITUTE THEY HAD PREVIOUSLY ENJOYED WOULD LIKELY DEPRIVE GIA OF THE SERVICES OF COMMITTED AND TALENTED LEADERS SUCH AS THESE. IN 2013, ONE FIRM ASSOCIATED WITH A MEMBER OF THE BOARD OF GOVERNORS RECEIVED A PAYMENT RELATED TO GEM LABORATORY SERVICES. THE PAYMENT WAS APPROVED IN ADVANCE BY MANAGEMENT AND DISINTERESTED MEMBERS OF THE BOARD OF GOVERNORS BASED ON EXPERT OPINION THAT THE AMOUNT WAS REASONABLE. THIS FIRM ALSO PAID FEES RELATED TO LABORATORY SERVICES TO GIA. THE FEES PAID TO GIA WERE THE SAME AS THOSE PAID BY ANY OTHER SIMILARLY-SITUATED CLIENT. THIS FIRM WAS A CLIENT OF THE GIA LABORATORY BEFORE THE AFFILIATED INDIVIDUAL BECAME A MEMBER OF THE BOARD OF GOVERNORS.GOVERNOR: EPHRAIM ZIONAFFILIATED FIRM: DEHRES LIMITED AGGREGATE AMOUNT PAID BY GIA: $1,265,256AGGREGATE AMOUNT PAID TO GIA: $119,768GENERAL COMMENTSMR. ZION IS THE MANAGING DIRECTOR OF DEHRES LTD. THE INSTITUTE UNDERSTANDS THAT MR. ZION HAS AN INTEREST IN DEHRES LTD. THROUGH SHARES HELD BY A FAMILY TRUST. THE FOREGOING TRANSACTIONS DID NOT INVOLVE A SHARING OF THE INSTITUTE'S REVENUE.ALSO IN 2013, A FIRM AFFILIATED WITH A DIFFERENT MEMBER OF THE BOARD OF GOVERNORS PAID FEES RELATED TO LABORATORY SERVICES TO GIA. THE FEES PAID TO GIA WERE THE SAME AS THOSE PAID BY ANY OTHER SIMILARLY-SITUATED CLIENT. THIS FIRM WAS A CLIENT OF THE GIA LABORATORY BEFORE THEAFFILIATED INDIVIDUAL BECAME A MEMBER OF THE BOARD OF GOVERNORS.GOVERNOR: ELLIOT TANNENBAUMAFFILIATED FIRM: LEO SCHACHTER DIAMOND GROUPAGGREGATE AMOUNT PAID TO GIA: $277,888GENERAL COMMENTSMR. TANNENBAUM IS SENIOR PRINCIPAL OF LEO SCHACHTER DIAMOND GROUP. THE FOREGOING TRANSACTIONS DID NOT INVOLVE A SHARING OF THE INSTITUTE'S REVENUE."
201443219349307559,310621866,Part IV,"Julie Sackett is a family member of Walter Sackett, Key Employee"
201443219349307559,310621866,Part IV,"Rachel Drusen is a family member of Brenda Kuhn, Key employee"
201443219349307559,310621866,Part IV,"Jared Keresoma is a family member of Fred Manchur, Board Member"
201443169349304594,111633486,BUSINESS TRANSACTIONS INVOLVING INTERESTED PARTIES,NAME OF INTERESTED PERSON: KATHERINE M. WALLACE-HARNICK IS A FAMILY MEMBER OF PAUL HARNICK. NAME OF INTERESTED PERSON: DENISE LONG IS A FAMILY MEMBER OF PATRICK K. LONG. NAME OF INTERESTED PERSON: HEATHER RUOFF IS A FAMILY MEMBER OF CHARLES RUOFF. NAME OF INTERESTED PERSON: LINDA J. MARTINEZ IS A FAMILY MEMBER OF JOHN F. ALOIA. NAME OF INTERESTED PERSON: ALICIA C. STRAIN IS A FAMILY MEMBER OF CHARLES STRAIN. NAME OF INTERESTED PERSON: JENNIFER L. SULLIVAN IS A FAMILY MEMBER OF THOMAS E. SULLIVAN. NAME OF INTERESTED PERSON: CLIFFORD F. COLLINS IS A FAMILY MEMBER OF JOHN COLLINS. NAME OF INTERESTED PERSON: MARIA C. LOPES IS A FAMILY MEMBER OF PALMIRA CATALIOTTI.
201413199349300016,200471061,"Schedule L, Part V Supplemental Information",MR. LANE IS THE PRESIDENT OF SILVERGATE BANK AND ALSO THE ACTIVE CHAIRMAN OF THE BOARD OF TRUSTEES FOR JOHN PAUL THE GREAT CATHOLIC UNIVERSITY.
201443189349302509,135564934,"SCHEDULE L, PART IV, LINE 1 - DONALD GOGEL",BIMC PURCHASES A PORTION OF ITS FOOD FROM US FOODSERVICE. ALL SUCH PURCHASES ARE MADE UNDER A GROUP PURCHASING ORGANIZATION (GPO) ARRANGEMENT THAT HAS BEEN NEGOTIATED WITH US FOODS. THESE GPO PRICES ARE AVAILABLE TO BIMC AND ALL OTHER MEMBERS OF THE LOCAL HEALTHCARE ASSOCIATION. MR. DONALD J. GOGEL IS CEO OF A FIRM THAT IS INDIRECTLY A GREATER-THAN-35% OWNER OF US FOODS. MR. GOGEL WAS NOT INVOLVED IN DECISIONS RELATED TO THE ORGANIZATION'S PURCHASES FROM U.S. FOODS.
201443189349302509,135564934,"SCHEDULE L, PART IV, LINE 2 - JOHN HESS","THE ORGANIZATION PURCHASED NATURAL GAS AND FUEL OIL FROM HESS CORPORATION. MR. HESS IS CHIEF EXECUTIVE OFFICER OF, AND HAS A FINANCIAL INTEREST IN, HESS CORPORATION AND REMAINS UNINVOLVED IN THE ORGANIZATION'S DECISIONS RELATED TO HESS CORPORATION."
201443219349302734,210634484,"CORE FORM, PART VI, SECTION A; QUESTION 1 AND SCHEDULE L; PART IV","THE ORGANIZATION IS AN AFFILIATE WITHIN THE INSPIRA HEALTH NETWORK; A TAX-EXEMPT INTEGRATED HEALTHCARE DELIVERY SYSTEM (""SYSTEM""). INSPIRA HEALTH NETWORK, INC. (""NETWORK"") IS THE TAX-EXEMPT PARENT ENTITY OF THE SYSTEM. FOR THE PERIOD JANUARY 1, 2013 THROUGH DECEMBER 31, 2013 AND DURING THE ORDINARY COURSE OF BUSINESS, THE ORGANIZATION MAY ENGAGE IN ONE OR MORE TRANSACTIONS WITH COMPANIES THAT: (1) ARE OWNED BY AN INDIVIDUAL WHO IS A MEMBER OF THE BOARD OF DIRECTORS OF THIS ORGANIZATION OR A RELATED NOT-FOR-PROFIT ORGANIZATION, (2) ARE OWNED BY A FAMILY MEMBER OF AN INDIVIDUAL WHO IS A MEMBER OF THE BOARD OF DIRECTORS OF THIS ORGANIZATION OR A RELATED NOT-FOR-PROFIT ORGANIZATION, OR (3) WHEREIN A BOARD MEMBER OF THIS ORGANIZATION OR A FAMILY MEMBER OF A BOARD MEMBER OF THIS ORGANIZATION IS EITHER AN OFFICER, DIRECTOR, TRUSTEE OR KEY EMPLOYEE OF A COMPANY WITH WHICH THIS ORGANIZATION OR A RELATED NOT-FOR-PROFIT ORGANIZATION TRANSACTS BUSINESS. IN THESE SITUATIONS, ANY GOODS PURCHASED OR SERVICES PERFORMED ARE DONE SO AT FAIR MARKET VALUE RATES PURSUANT TO ARM'S LENGTH NEGOTIATIONS. ANY SUCH TRANSACTIONS ARE DISCLOSED TO, REVIEWED AND APPROVED BY THE NETWORK'S GOVERNANCE COMMITTEE. THE ORGANIZATION MAINTAINS A WRITTEN CONFLICT OF INTEREST POLICY AND QUESTIONNAIRE AND USES REASONABLE EFFORTS TO OBTAIN THIS INFORMATION FROM THE MEMBERS OF ITS BOARD OF DIRECTORS. THE ORGANIZATION FOLLOWS A FORMALIZED BID PROCESS WHEREIN ALL TRANSACTIONS OF THIS NATURE ARE SENT OUT TO BID. IF IT IS DETERMINED THAT THE ORGANIZATION WILL ENTER INTO A TRANSACTION IDENTIFIED ABOVE, IT IS SENT TO THE NETWORK'S GOVERNANCE COMMITTEE FOR REVIEW AND APPROVAL. THE INTERESTED PERSON IN THESE CASES RECUSES THEMSELVES FROM THE VOTING PROCESS. THIS RECUSAL PROCESS IS OUTLINED IN THE ORGANIZATION'S WRITTEN CONFLICT OF INTEREST POLICY WHICH ALL BOARD MEMBERS AND SENIOR MANAGEMENT REVIEW ANNUALLY. DURING 2013 THE ORGANIZATION OR A RELATED NOT-FOR-PROFIT ORGANIZATION ENGAGED IN THE FOLLOWING TRANSACTIONS WITH INTERESTED PERSONS: PAYMENT BY INSPIRA HEALTH NETWORK, INC. & AFFILIATES IN THE AMOUNT OF $823,103 OF WHICH INSPIRA MEDICAL CENTERS, INC. PAID $760,067 TO SOUTH JERSEY GAS COMPANY FOR UTILITIES DURING 2013. DAVID ROBBINS, JR. IS AN OFFICER OF SOUTH JERSEY GAS COMPANY AND A BOARD MEMBER OF INSPIRA MEDICAL CENTERS, INC. PAYMENT BY INSPIRA HEALTH NETWORK, INC & AFFILIATES IN THE AMOUNT OF $418,129 OF WHICH INSPIRA MEDICAL CENTERS, INC. PAID $208,238 TO PERFORMANCE MARKETING FOR MARKETING SERVICES DURING 2013. MICHAEL M. ROSSI, III'S SPOUSE IS AN EMPLOYEE OF PERFORMANCE MARKETING. MICHAEL M. ROSSI, III IS A BOARD MEMBER OF INSPIRA MEDICAL CENTERS, INC. THE KIDNEY CENTER AT MILLVILLE, L.L.C.; AN AFFILIATE WITHIN INSPIRA HEALTH NETWORK, INC. & AFFILIATES, HAS A DEPOSITORY ACCOUNT AND AN OUTSTANDING LOAN WITH COLONIAL BANK. INSPIRA MEDICAL CENTERS, INC. IS A 50% MEMBER OF THE KIDNEY CENTER AT MILLVILLE, L.L.C. AND GUARANTOR OF 50% OF THE LOAN. THE TOTAL BALANCE OF THE LOAN AS OF DECEMBER 31, 2013 WAS $1,403,234. GREGORY FACEMYER, CPA AND PAUL J. RITTER, III ARE BOTH MEMBERS OF THE BOARD OF DIRECTORS FOR COLONIAL BANK AND MEMBERS OF THE BOARD OF DIRECTORS FOR INSPIRA MEDICAL CENTERS, INC. BRUNO A. BASILE HAS A DAUGHTER THAT IS EMPLOYED BY INSPIRA MEDICAL CENTERS, INC. AS A PHARMACIST FOR WHICH SHE RECEIVED FORM W-2, BOX 5 MEDICARE WAGES IN THE AMOUNT OF $67,882 DURING 2013. BRUNO A. BASILE IS A BOARD MEMBER OF INSPIRA MEDICAL CENTERS, INC. PAYMENT BY INSPIRA MEDICAL CENTERS, INC. IN THE AMOUNT OF $44,177 TO GATEWAY COMMUNITY ACTION PARTNERSHIP DURING 2013. EDWARD BETHEA IS AN EMPLOYEE OF GATEWAY COMMUNITY ACTION PARTNERSHIP AND A BOARD MEMBER OF INSPIRA MEDICAL CENTERS, INC. PAYMENT BY INSPIRA MEDICAL CENTERS, INC. IN THE AMOUNT OF $2,870 TO PREMIER ORTHOPEDIC ASSOCIATES OF SOUTHERN NEW JERSEY FOR MEDICAL SERVICES DURING 2013. JOHN CATALANO, M.D. IS AN EMPLOYEE OF PREMIER ORTHOPEDIC ASSOCIATION AND A BOARD MEMBER OF INSPIRA MEDICAL CENTERS, INC. PAYMENT BY INSPIRA HEALTH NETWORK, INC. & AFFILIATES IN THE AMOUNT OF $62,506 OF WHICH INSPIRA MEDICAL CENTERS, INC. PAID $48,911 TO ARCHER & GREINER, P.C. FOR LEGAL SERVICES DURING 2013. JOHN H. FISCHER, III IS AN EMPLOYEE OF ARCHER & GREINER, P.C. AND A BOARD MEMBER OF INSPIRA MEDICAL CENTERS, INC. JOHN H. FISCHER, III'S DAUGHTER IN LAW IS EMPLOYED BY INSPIRA MEDICAL CENTERS, INC. FOR WHICH SHE RECEIVED FORM W-2, BOX 5 MEDICARE WAGES IN THE AMOUNT OF $391 DURING 2013. JOHN H. FISCHER, III IS A BOARD MEMBER OF INSPIRA MEDICAL CENTERS, INC. DAVID W. GALETTO, M.D.'S SPOUSE IS EMPLOYED BY INSPIRA MEDICAL CENTERS, INC. AS A PER-DIEM NURSE FOR WHICH SHE RECEIVED FORM W-2, BOX 5 MEDICARE WAGES IN THE AMOUNT OF $31,688 DURING 2013. DAVID W. GALETTO, M.D. IS A BOARD MEMBER OF INSPIRA MEDICAL CENTERS, INC. LENDING OF MONEY PURSUANT TO A PRACTICE SUPPORT AGREEMENT BETWEEN INSPIRA MEDICAL CENTER, INC. AND CUMBERLAND INTERNAL MEDICINE. THE ORIGINAL AMOUNT OF THE LOAN WAS $ 41,554. THE LOAN WAS SET UP IN ORDER TO ASSIST THE PRACTICE IN THE OPERATION OF INTERNAL MEDICINE/INFECTIOUS DISEASE SERVICES. THE TOTAL AMOUNT DUE FROM THE PRACTICE AT DECEMBER 31, 2013 WAS $285,997. PAYMENT BY INSPIRA HEALTH NETWORK, INC. & AFFILIATES IN THE AMOUNT OF $357,125 OF WHICH INSPIRA MEDICAL CENTERS, INC. PAID $290,058 TO CUMBERLAND INTERNAL MEDICINE FOR MEDICAL SERVICES DURING 2013. DAVID W. GALETTO, M.D. IS AN EMPLOYEE OF CUMBERLAND INTERNAL MEDICINE AND A BOARD MEMBER OF INSPIRA MEDICAL CENTERS, INC. SYSTEM ENTITIES HAVE BORROWED FUNDS FROM SUN NATIONAL BANK. INSPIRA MEDICAL CENTERS, INC. HAS AN OUTSTANDING UEZ LOAN WITH SUN NATIONAL BANK WITH A PRINCIPAL BALANCE OF $391,891 AT DECEMBER 31, 2013. PETER GALETTO, JR., COUSIN OF DAVID W. GALETTO, M.D., IS A BOARD MEMBER OF SUN NATIONAL BANK. IN ADDITION, BRANDON KALETKOWSKI, SON OF CHESTER B. KALETKOWSKI, IS AN EMPLOYEE OF SUN NATIONAL BANK. BOTH DAVID W. GALETTO, M.D. AND CHESTER B. KALETKOWSKI ARE BOARD MEMBERS OF INSPIRA MEDICAL CENTERS, INC. PAYMENT BY INSPIRA MEDICAL CENTERS, INC. IN THE AMOUNT OF $16,470 TO CUMBERLAND CAPE ATLANTIC YMCA FOR CERTAIN PUBLIC HEALTH INITIATIVES. PETER GALETTO, JR. IS A BOARD MEMBER OF CAPE ATLANTIC YMCA AND COUSIN OF DAVID W. GALETTO, M.D.; A BOARD MEMBER OF INSPIRA MEDICAL CENTERS, INC. PAYMENT BY INSPIRA MEDICAL CENTERS, INC. IN THE AMOUNT OF $171,391 TO STANKER AND GALETTO, INC. DURING 2013 FOR RENOVATIONS AND CONSTRUCTION SERVICES. PETER GALETTO, JR. IS AN OWNER OF STANKER AND GALETTO, INC. AND COUSIN OF DAVID W. GALETTO, M.D.; A BOARD MEMBER OF INSPIRA MEDICAL CENTERS, INC. INSPIRA MEDICAL CENTERS, INC. RENTS OFFICE SPACE AT THE ELMER MEDICAL OFFICE BUILDING FROM GALETTO REALTY COMPANY. TOTAL PAYMENTS TO GALETTO REALTY COMPANY AMOUNTED TO $9,241 DURING 2013. PETER GALETTO, JR. IS AN OWNER OF GALETTO REALTY COMPANY AND COUSIN OF DAVID W. GALETTO, M.D.; A BOARD MEMBER OF INSPIRA MEDICAL CENTERS, INC. PAYMENT BY INSPIRA HEALTH NETWORK & AFFILIATES, INC. IN THE AMOUNT OF $191,163 OF WHICH INSPIRA MEDICAL CENTER,S INC. PAID $190,943 TO CUMBERLAND COMMUNITY COLLEGE FOR VARIOUS SERVICES. THOMAS ISEKENEGBE, M.D. IS AN EMPLOYEE OF CUMBERLAND COUNTY COLLEGE AND A BOARD MEMBER OF INSPIRA MEDICAL CENTERS, INC. PAYMENT BY INSPIRA MEDICAL CENTERS, INC. IN THE AMOUNT OF $53,027 TO DAVID SHIELDS, M.D. FOR PHYSICIAN SERVICES. JACK M. SHIELDS, M.D. IS THE BROTHER OF DAVID SHIELDS, M.D. AND A BOARD MEMBER OF INSPIRA MEDICAL CENTERS, INC. JACK M. SHIELDS, M.D. HAS A FAMILY MEMBER THAT IS EMPLOYED BY INSPIRA MEDICAL CENTERS, INC. AS A PER DIEM RECEPTIONIST FOR WHICH HE RECEIVED FORM W-2, BOX 5 MEDICARE WAGES IN THE AMOUNT OF $3,318 DURING 2013. JACK M. SHIELDS IS A BOARD MEMBER OF INSPIRA MEDICAL CENTERS, INC."
201412379349300321,454620000,"RELATIONSHIP INFORMATION: PART VI, COLUMN B-","ENTITY OWNED BY (1) RICHARD FESSLER, (2) CAROLOYN FESSLER, (3) BRENT FESSLER AND (4) JOE FISHER."
201402559349300200,350715530,VESTIL MANUFACTURING CORP,BOARD MEMBERS RALPH TRINE AND SHERI TRINE HAVE A >35% OWNERSHIP IN VESTIL MANUFACTURING CORP.
201433179349303858,742128239,"Schedule L, Part V Supplemental Information","Spencer Bynes is the managing partner at Accendo International and also a Neuhaus board member. Neuhaus Memorial Foundation paid the firm $145,039 in consulting fees during 2013.Suzanne Carreker receives royalty payments for educational materials developed to support Neuhaus programs. These materials were developed outside the scope of the work for which she was hired and continue to be used and sold by Neuhaus. Contractually, Neuhaus agreed to pay royalty payments based on future revenues from the sales of the materials. No royalties are paid for programs that were developed within the scope of the work for which she was hired."
201423169349302177,131740126,BUSINESS TRANSACTIONS,"SCHEDULE L, PART IV (1) MR. ROY ASHIKARI IS ON THE ST. JOHN'S RIVERSIDE HOSPITAL (SJRH) BOARD OF DIRECTORS AND IS ALSO A PARTNER AT ASHIKARI & KELEMAN PC, A BREAST CENTER WHICH DOES BUSINESS WITH THE HOSPITAL. (2) IN 2013, SJRH PAID INSURANCE PREMIUMS TO A RELATED, TAXABLE ENTITY RIVERSIDE HEALTH CARE SYSTEMS BERMUDA. THE FOLLOWING SJRH BOARD OF DIRECTOR MEMBERS SERVED ON THE RIVERSIDE HEALTH CARE SYSTEMS BERMUDA BOARD OF DIRECTORS: KEVIN FAY, RICHARD FONTANA, AND GERALD MALONE. THE FOLLOWING SJRH CORPORATE OFFICERS SERVED ON THE RIVERSIDE HEALTH CARE SYSTEMS BERMUDA BOARD OF DIRECTORS: RONALD CORTI, SJRH PRESIDENT/CEO, AND DENNIS KEANE, SJRH VP FINANCE/CFO. The following SJRH Key Employee served on the Riverside Health Care Systems Bermuda Board of Directors: Paul Antonecchia, MD. (3) IN 2013, SJRH MADE INTEREST PAYMENTS TO HUDSON VALLEY BANK. CECILE SINGER, SJRH BOARD MEMBER, IS A DIRECTOR AT HUDSON VALLEY BANK; GREG HOLCOMBE, SJRH BOARD MEMBER, IS A DIRECTOR AT HUDSON VALLEY BANK; RON CORTI, SJRH PRESIDENT/CEO, IS AN ADVISORY BOARD MEMBER AT HUDSON VALLEY BANK AND SJRH KEY EMPLOYEE EDWARD BROWN'S SISTER IS AN OFFICER AT HUDSON VALLEY BANK. (4) IN 2013, EMPRESS AMBULANCE SERVICE PROVIDED SERVICES TO SJRH. EMPRESS AMBULANCE SERVICE IS OWNED BY THE SONS OF LENORE MINERVA, SJRH BOARD MEMBER. (5) NANCY ANNABI IS AN EMPLOYEE OF SJRH AND IS THE WIFE OF SJRH BOARD MEMBER, DR. IYAD ANNABI."
201433179349301288,131624135,"SCHEDULE L, PART IV, (1) - 143 Sound Beach Avenue Associates, L.P.","HSS subleases physician office space from HSS Properties Corporation, an affiliate, which, in turn, leases physician office space from 143 Sound Beach Avenue Associates, L.P., the lessor. A son of Russell F. Warren, M.D. is a part owner of the lessor. Dr. Warren is a former Surgeon-in-Chief of HSS and an elected member of HSS' Board of Trustees. HSS Properties Corporation entered into the original lease in October 2000, following a lengthy search for suitable office space in the area, and after an independent valuation of the terms of the lease by a professional, commercial real estate firm confirmed the fair market value of the terms. At that time, Dr. Warren was the Surgeon-in-Chief of HSS and an ex officio member of HSS' Board of Trustees. The potential conflict of interest was disclosed to the HSS' Board of Trustees and to the Board of Trustees of HSS Properties Corporation. Dr. Warren recused himself from the review, deliberation and vote on the transaction. In 2010, HSS Properties renewed the lease through 2021, at a reduced rental rate that reflected a change in the real estate market from the time of the original lease, as confirmed by an independent professional real estate firm. The same due diligence, disclosure and review process (including recusal of Dr. Warren) was followed when the lease was renewed in June 2010. The approvals of the original lease and of the renewal were made by the vote of the disinterested members of the respective Boards of HSS and HSS Properties Corporation. AMOUNT OF TRANSACTION: $338,406 DESCRIPTION OF TRANSACTION: HSS Properties Corporation (an affiliate of HSS) made lease payments in 2013 of $338,406 for physician office space it leases that is owned by 143 Sound Beach Avenue Associates, L.P. HSS Properties subleases the space to HSS."
