object_id,ein,ExpnsAmt,GrntAmt,RvnAmt,Dsc
201913519349300816,750827421,2906616,164000,469643,"PUBLIC SERVICE: Hendricks Center for Christian Leadership and Cultural Engagement pursues the development of effective Christian leadership in order to build leaders of integrity and impact. ACADEMIC SUPPORT: The library holds over 355,000 items, provides access to electronic resources and has special rare volumes. The media and computer lab allows students to use computer equipment, audio and video media."
202030989349301708,391353508,2886543,2615229,FINANCIAL AID AND RECORDS
202030989349301708,391353508,222256,LIBRARY AND LEARNING RESOURCE CENTER
202041979349307414,951664112,41226545,1102419,"OTHER PUBLIC SERVICE, INSTITUTIONAL SUPPORT,"
202041979349307414,951664112,& ACADEMIC SUPPORT
202031969349302723,580603153,12584082,12584082,"FINANCIAL AID - SCHOLARSHIPS AND OTHER FINANCIAL ASSISTANCE FOR STUDENTS ATTENDING THE UNIVERSITY. (1,566 STUDENTS)"
202001909349302800,942340692,18273229,215504,9804741,"PAU MASTER'S PROGRAMS: M.A. IN COUNSELING: THIS PROGRAM OFFERS AN MASTER OF ARTS IN COUNSELING IN ONE OF TWO AREAS OF EMPHASIS: ""MARRIAGE, FAMILY AND CHILD"", OR ""CLINICAL MENTAL HEALTH"". BOTH EMPHASIS AREAS ARE CACREP ACCREDITED SINCE JANUARY 2017, AND PREPARE STUDENTS TO PURSUE LICENSURE IN COUNSELING. THE PROGRAM HAS BEEN WASC ACCREDITED SINCE 2009 FOR DISTANCE LEARNING, AND SINCE 2011 FOR THE RESIDENTIAL VERSION. DURING THE 18-19 ACADEMIC YEAR, THIS PROGRAM WELCOMED A NEW COHORT OF 94 STUDENTS, GRADUATED 86 STUDENTS, EXPERIENCED 21 WITHDRAWALS OF THE 344 STUDENTS IN THE PROGRAM (6% ATTRITION).M.S. IN PSYCHOLOGY: THE M.S. IN PSYCHOLOGY IS PRIMARILY A PREPARATORY PROGRAM FOR STUDENTS SEEKING ENTRANCE TO THE PH.D. PROGRAM. PAU WAS GRANTED WASC ACCREDITATION FOR A DISTANCE EDUCATION M.S. IN PSYCHOLOGY DEGREE PROGRAM IN 2000. DURING THE 18-19 ACADEMIC YEAR, THIS PROGRAM WELCOMED A NEW COHORT OF 17 STUDENTS, GRADUATED 9 STUDENTS, EXPERIENCED 2 WITHDRAWALS OF THE 39 STUDENTS IN THE PROGRAM (5% ATTRITION).PAU UNDERGRADUATE PROGRAMS:PAU OFFERS TWO SEPARATE DEGREE COMPLETION PROGRAMS AT THE UNDERGRADUATE LEVEL. ENTERING STUDENTS ARE REQUIRED TO HAVE COMPLETED FRESHMAN AND SOPHOMORE GENERAL EDUCATION REQUIREMENTS AT ANOTHER ACCREDITED INSTITUTION. THE UNIVERSITY MAINTAINS COOPERATIVE AGREEMENTS WITH LOCAL COMMUNITY COLLEGES TO OFFER CLASSES FOR THIS PROGRAM ON THEIR CAMPUSES (DE ANZA COLLEGE IN CUPERTINO, FOOTHILL COLLEGE IN LOS ALTOS HILLS, AND COLLEGE OF SAN MATEO IN SAN MATEO), WHICH FACILITATES THE TRANSFER PROCESS AND DEGREE COMPLETION OPTIONS FOR COMMUNITY COLLEGE STUDENTS.B.S. IN PSYCHOLOGY AND SOCIAL ACTION:PAU WAS GRANTED WASC APPROVAL FOR A BACHELOR OF SCIENCE IN PSYCHOLOGY AND SOCIAL ACTION ONSITE DEGREE PROGRAM IN 2006, FOLLOWED BY APPROVAL TO OFFER A DISTANCE EDUCATION VERSION STARTING IN 2011. DURING THE 18-19 ACADEMIC YEAR, THIS PROGRAM WELCOMED A NEW COHORT OF 33 STUDENTS, GRADUATED 38 STUDENTS, EXPERIENCED 5 WITHDRAWALS OF THE 85 STUDENTS IN THE PROGRAM (5.8% ATTRITION).B.S. IN BUSINESS PSYCHOLOGY:PAU WAS GRANTED WASC APPROVAL FOR A BACHELOR OF SCIENCE IN BUSINESS PSYCHOLOGY ONSITE DEGREE PROGRAM IN 2009, FOLLOWED BY APPROVAL TO OFFER A DISTANCE EDUCATION VERSION STARTING IN 2011. DURING THE 18-19 ACADEMIC YEAR, THIS PROGRAM WELCOMED A NEW COHORT OF 19 STUDENTS, GRADUATED 21 STUDENTS, EXPERIENCED 0 WITHDRAWALS OF THE 57 STUDENTS IN THE PROGRAM (0% ATTRITION)."
202020699349301007,042111203,13291544,0,15237355,"Auxiliary Services includes providing high quality residence halls, food service, and campus store services to Clark students. There are program expenditures of $13,291,544 and offsetting revenue of $15,237,355."
202020699349301007,042111203,14884855,0,1998500,"Student Services programs support an environment for students that encourages them to become active, involved and responsible citizens in global communities. Resources are expended to provide support to students in achieving their non-academic goals and providing a balanced and healthy social environment."
202020319349300222,620485733,16980716,"ACADEMIC SUPPORT:INCLUDES ACADEMIC COUNSELING & TESTING SERVICES, ACADEMIC PROGRAM DEVELOPMENT, UNIVERSITY DEANS, INSTRUCTIONAL TECHNOLOGY, LIBRARY SERVICES, AND OTHER AREAS DESIGNED TO ENHANCE A STUDENT'S LEARNING EXPERIENCE AND THE OVERALL QUALITY OF A STUDENT'S EDUCATION."
202020319349300222,620485733,1995962,"PUBLIC SERVICES:INCLUDES COMMUNITY OUTREACH ACTIVITIES, SPIRITUAL FORMATION ACTIVITIES, AND SUSTAINABILITY WHERE LIPSCOMB CAN POSITIVELY IMPACT COMMUNITIES AND THE ENVIRONMENT."
202020319349300222,620485733,RESEARCH:INCLUDES POTENTIAL DISCOVERIES OF NEW OUTCOMES WITH A GOAL OF ADVANCING PROGRESS BOTH INSTITUTIONALLY AND GLOBALLY.
201933269349301003,930386890,416849,474010,"THE WARNER PACIFIC BOOKSTORE IS FULLY ONLINE, ENSURING THAT EDUCATIONAL TOOLS AND RESOURCES ARE READILY AVAILABLE TO STUDENTS AT A REASONABLE COST. BY OFFERING ONLINE SALES, STUDENTS ARE ABLE TO COMPARISON SHOP FOR THE BEST PRICES TO STRETCH THEIR EDUCATION DOLLARS FURTHER AND EXPLORE MODERN OPTIONS LIKE TEXT BOOK RENTALS AND E-BOOKS TO STAY WITHIN THEIR FINANCIAL GOALS."
201942949349301614,640579585,"AUXILIARY ENTERPRISES CONSIST OF STUDENT HOUSING AND OTHER ESSENTIALLY SELF-SUPPORTING OPERATIONS THAT EXIST TO PROVIDE SERVICES TO STUDENTS, FACULTY OR STAFF, AND THAT CHARGE A FEE THAT IS RELATED TO THE COST OF THE SERVICE."
202011689349300911,630312914,9173158,15717577,SAMFORD UNIVERSITY MAINTAINS A BEAUTIFUL CAMPUS OF ACADEMIC AND ADMINISTRATIVE BUILDINGS AND STUDENT HOUSING.
201913119349301796,810231774,1993021,1028079,OTHER PROGRAMS
202040949349300014,560556753,GRANT TO RELATED ORG TO COVER CERTAIN SHARED ADMINISTRATIVE COSTS.
202000379349300105,131624158,38885968,9036972,AUXILIARY ENTERPRISES-HOUSING ON CAMPUS FOR SINGLE AND MARRIED STUDENTS;OFF CAMPUS HOUSING FOR FACULTY AND OTHER UNIVERSITY PERSONNEL; FOOD SERVICE CONSISTS OF CAFETERIA DINING FACILITIES; PRESS INCLUDES JOURNALS AND SUBSCRIPTIONS.
202010919349301701,952962604,13685599,139176,857765,"HIGHER EDUCATION ACADEMIC SUPPORT DEPARTMENTS INCLUDE UNIVERSITY LIBRARY, COMPUTER & MEDIA LABS, AND FACULTY DEVELOPMENT PROGRAMS. PUBLIC SERVICE DEPARTMENTS INCLUDE THE DAY CARE CENTER, KCLU (PUBLIC RADIO STATION) AND EVENT SERVICES TO SERVE THE COMMUNITY."
201933199349317668,521241927,0,0,0,N/A
202021489349300987,420703280,11179446,17101719,"AUXILIARY ENTERPRISES & ACTIVITIES: ST. AMBROSE UNIVERSITY PROVIDES FOOD SERVICE AND HOUSING FOR AN APPROXIMATE CAPACITY OF 1,700 STUDENTS."
202021489349300987,420703280,207325,INSTITUTIONAL SUPPORT OF THE UNIVERSITY IS ALSO PROVIDED BY THE OFFICES OF THE VICE PRESIDENT FOR ACADEMIC AND STUDENT AFFAIRS AND THE VICE PRESIDENT OF ENROLLMENT MANAGEMENT.
202021489349300987,420703280,2379946,OTHER PROGRAM SERVICES INCLUDES INTEREST EXPENSE.
202021489349300987,420703280,4303239,ACADEMIC SUPPORT
202010729349300726,840402707,17090738,6025550,18527232,CCLS AND CCIS
202040839349300359,410694747,16997052,78000,0,"STUDENT SERVICES: PROGRAMS DESIGNED TO SUPPORT THE CARLETON COLLEGE STUDENT LIFE EXPERIENCE INCLUDING CO-CURRICULAR AND RECREATIONAL OPPORTUNITIES (2,005 STUDENTS)."
202040839349300359,410694747,4067010,243523,0,RESEARCH - FACULTY AND STUDENT RESEARCH TO ENHANCE THE ACADEMIC INSTRUCTIONAL EXPERIENCE.
202040839349300359,410694747,1142037,135905,1363510,"SUMMER LIBERAL ACADEMIC PROGRAMS - PROGRAMS FOR HIGH SCHOOL STUDENTS AND WORKSHOPS FOR TEACHERS OF ADVANCED PLACEMENT ENRICHED OR ACCELERATED CLASSES IN GRADES 7-12 TO DEVELOP SKILLS FOR RIGOROUS ACADEMIC PROGRAMS (1,057 ATTENDEES)."
202041359349301949,591023117,1699715,0,2716234,"CLASSICAL MUSIC IS PROVIDED TO THE UNIVERSITY COMMUNITY AS WELL AS THE GENERAL PUBLIC BY STUDENTS AND FACULTY IN THE LYNN UNIVERSITY CONSERVATORY OF MUSIC. ADDITIONALLY, PROFESSIONAL ACTORS AND MUSICIANS PERFORM ON CAMPUS IN THE PERFORMING ARTS CENTER. MANY OPPORTUNITIES ARE PROVIDED IN THE REALM OF ""IDEAS,"" THROUGH LECTURES AND COMMUNITY DISCOURSE. DURING THE SUMMER MONTHS BETWEEN ACADEMIC YEARS FOR TRADITIONAL COLLEGE STUDENTS, A PORTION OF THE UNIVERSITY'S EDUCATIONAL FACILITIES ARE USED TO PROVIDE INSTRUCTION TO A COMBINED ENROLLMENT OF APPROXIMATELY 1,500 CHILDREN ATTENDING THREE THREE-WEEK SUMMER CAMP SESSIONS AND TO GROUPS OF ADULTS ENROLLED IN SPECIAL EDUCATIONAL PROGRAMS."
201933129349301853,042104451,4490586,11379570,"AUXILIARY ENTERPRISES: PROVIDE DINING SERVICES, RESIDENTIAL HALL SERVICES, CHILDREN'S LEARNING CENTER,FOR APPROXIMATELY 3,000 STUDENTS AND LIFELONG LEARNING PROGRAM FOR COMMUNITY."
201933129349301853,042104451,24563410,24563410,OTHER PROGRAM SERVICES: SCHOLARSHIP AND GRANTS TO APPROXIMATELY 2000 STUDENTS
202011919349301236,131624067,5915460,0,444813,Student Performing Arts Productions
202011919349301236,131624067,5089919,0,14161463,International Education
202041979349301854,210634501,239478000,9434000,12954000,"OTHER PROGRAM SERVICES - INCLUDES ACADEMIC SUPPORT ACTIVITIES SUCH AS ACADEMIC ADMINISTRATION, RESEARCH ADMINISTRATION, AND THE PRINCETON UNIVERSITY ART MUSEUM; STUDENT SERVICES SUCH AS ADMISSION, FINANCIAL AID, REGISTRAR, CAREER SERVICES, HEALTH SERVICES AND ATHLETICS; AND PUBLIC SERVICE."
202021409349300347,362181973,4648168,0,5681477,"OTHER PROGRAM SERVICE REVENUES AND EXPENSES INCLUDE INTEREST ON STUDENT LOANS AND PENALTIES, STUDENT HOUSING REVENUE AND OTHER PROGRAM SERVICES."
201923199349305957,231352008,382917,222560,The College's Customized Corporate Consulting Center provides customized training and education to client companies in the financial services arena utilizing its full-time and adjunct faculty and state-of-the-art learning center to make their employees better educated and more productive.
202041979349301799,510067938,658230,0,353775,"Delmarva Health Network, LLC"
202041979349301799,510067938,1363131,0,0,Community Outreach
202041979349301799,510067938,715534,0,128226,Adult Day Care - Gull House
202010219349301106,620502739,10029903,13904646,"AUXILIARY SERVICES - OPERATED FOR THE CONVENIENCE OF STUDENTS, FACULTY, AND STAFF INCLUDING RESIDENCE HALLS, DINING HALLS, CAMPUS BOOKSTORE, AND THE TELEPHONE SYSTEM."
202010099349300401,061149131,6645,EDUCATION OF MEN TO THE ROMAN CATHOLIC PRIESTHOOD.
202011059349300036,160755807,12950054,1977758,"STUDENT SERVICES INCLUDE ADMINISTRATION OF FINANCIAL AID PROGRAMS, ORIENTATION PROGRAMS, STUDENT COUNSELING, ADMISSIONS, AND RECORDS OFFICE."
202010429349300541,231352664,10228779,0,0,"Operation and maintenance of physical plant: educational and administrative buildings and grounds (97 buildings). The beautiful 91 acre campus is highlighted by Gothic architecture and its signature historical buildings the Haas College Center, Baker Center for the Arts and Egner Memorial Chapel. Recent additions include a state of the art science building, additions to the Seegers Union building including a beautiful new campus restaurant, and eight spectacular new residence halls over the past decade."
202011269349302156,480547702,542113,0,377078,MISCELLANEOUS
202010989349300831,930386858,18672834,19580706,"AUXILIARY SERVICES RELATED TO AND SUPPORTING OUR EDUCATIONAL PURPOSE SUCH AS STUDENT HOUSING, FOOD SERVICE, CAMPUS BOOKSTORE, PARKING AND TRANSPORTATION, AND SUMMER CONFERENCES."
202031699349301613,390806428,648674,0,0,"ACADEMIC SUPPORT - THE ACADEMIC DEAN'S OFFICE, LIBRARY SERVICES, AND ACADEMIC TECHNOLOGY, SUPPORTS THE INSTRUCTIONAL PROGRAM BY PROVIDING RESOURCES TO RECRUIT AND DEVELOP FACULTY AND OFFER ADDITIONAL LEARNING OPPORTUNITIES TO STUDENTS. OPPORTUNITIES ABROAD HAVE INCREASED FOR STUDENTS THROUGH MORE FORMAL COLLABORATIVE INSTRUCTIONAL AGREEMENTS WITH PARTNERS THAT ALLOW STUDENTS TO PARTICIPATE IN SEMESTERS AWAY, IN COUNTRIES/REGIONS WHOSE ECOLOGICAL SYSTEMS PRESENT RICH AND UNIQUE LEARNING OPPORTUNITIES. PUBLIC SERVICE THROUGH THE SIGURD OLSON ENVIRONMENTAL INSTITUTE, MARY GRIGGS BURKE CENTER FOR FRESHWATER INNOVATION, NATIVE AMERICAN INDIGENEOUS CULTURES CENTER, AND CENTER FOR RURAL COMMUNITIES, PROVIDE COURSES, INTERNSHIPS, AND OPPORTUNITIES FOR STUDENTS TO SERVE THE REGION VIA GRANT-FUNDED, EXPERIENTIAL PROJECTS THAT SUPPORT SUSTAINABILITY AND IMPROVE THE ENVIRONMENT."
202031699349301613,390806428,1029931,0,0,OTHER PROGRAMS - RESEARCH & ACADEMIC SUPPORT
202021049349300412,237223216,552603,0,1630798,other programs
202040849349300734,410695524,5084718,0,0,"Gustavus offers a number of activities that enhance the curricular program, including various public service events and miscellaneous services provided to students."
202030289349301768,420681046,6814355,655697,"STUDENT SERVICES: ATHLETICS, HEALTH SERVICES, ADMISSIONS AND FINANCIAL AID."
202031979349304623,570324915,3302508,3169599,"AUXILIARY ENTERPRISES - EXPENDITURES FOR THE OPERATION OF STUDENT HOUSING, FOOD SERVICES, TELEPHONE SYSTEM, AND CAMPUS SHOP"
202031979349304623,570324915,1118053,ACADEMIC SUPPORT - EXPENDITURES IN CONNECTION WITH THE OPERATION OF THE COLLEGE'S LIBRARY.
202041339349302344,250969449,21989857,0,13973514,"OTHER PROGRAM SERVICES:OTHER FEES AND MEMBERSHIPS, EXTERNAL SUPPORT AND SERVICES AND OTHER MISCELLANEOUS PROGRAM SERVICE REVENUE THAT SUPPORTS THE INSTRUCTION, RESEARCH, AND AUXILIARY FUNCTIONS OF THE UNIVERSITY."
202020289349301027,363657734,Community Service Block Grants-Transitional Jobs Program-is designed and hands-on trainings have been developed in partnership with local industry and continuosly updated by community business leaders to ensure that the skills participants develop in class are marketable and meet current industry standards.
202011069349300716,411607453,1905736,114655,"-CONSTRUCTION OF THE ENTREPRENEURIAL STUDIES INFILL AND RENOVATION DURING THE SUMMER OF 2017.-COMPLETED THE FINAL DESIGN AND BIDDING FOR THE MORRISON ROOF REHABILITATION PROJECT. (COMPLETED SUMMER OF 2018).-THREE ROOF REPLACEMENTS THAT INCLUDED APARTMENT 150, MAINTENANCE BUILDING, AND A PORTION OF THE LIBRARY ROOF.-INSTALLATION AND IMPLEMENTATION OF CARD ACCESS ON THE EXTERIOR DOORS OF EVERY APARTMENT BUILDING ON CAMPUS.-DESIGN AND PLANNING FOR RENOVATING SPACE FOR A NEW PRODUCT DESIGN PROGRAM. (CONSTRUCTION IS PLANNED FOR THE SUMMER OF 2019).-UPDATED THE FACILITIES MASTER PLAN INCLUDING A SPACE OPTIMIZATION ANALYSIS. FINAL APPROVAL OF THE MASTER PLAN IS ANTICIPATED IN THE SPRING OF 2019.-UPDATED THE ANNUAL DEFERRED MAINTENANCE ANALYSIS WHICH CATALOGS THE OVERALL BUILDING CONDITIONS AND CAPITAL RENEWAL BACKLOG OF ALL CAMPUS PROPERTIES.-MANAGED THE DESIGN AND PLANNING FOR RENOVATING THE LIBRARY AND ADDING TWO ADDITIONAL E-CLASSROOMS. THIS PLANNING WILL BE INCORPORATED INTO A FINAL MASTER PLAN. -DEVELOPED A DESIGN PROCESS AND DESIGN SCHEDULE TO ANALYZE AND RENOVATE THE STUDENT CENTER AND CAFETERIA. FURTHER DESIGN AND PLANNING IS SCHEDULED FOR THE FALL OF 2018.-VARIOUS ENERGY PROJECTS WERE CONDUCTED THAT RESULTED IN ENERGY SAVINGS AND ENERGY REBATES."
201943189349301319,470385129,65229258,2425,32715591,"OTHER PROGRAM SERVICES OF RWMC INCLUDE THE SCHOOL OF NURSING, WHICH IS OPERATED IN PARTNERSHIP WITH WESTERN NEBRASKA COMMUNITY COLLEGE (WNCC), AND UNMC. SOME OF THE OTHER PROGRAMS INCLUDE THE OVERHEAD DEPARTMENTS OF RWMC: FACILITIES MANAGEMENT, BIO-MEDICAL, SECURITY, HOUSEKEEPING, LINEN, PURCHASING, REGISTRATION, CODING, INFORMATION AND TECHNOLOGY SERVICES, PATIENT FINANCIAL SERVICES, FINANCE, CASE MANAGEMENT, QUALITY, HUMAN RESOURCES, ADMINISTRATION, MARKETING, PROJECT MANAGEMENT, EDUCATION AND OUTREACH SERVICES. THE EDUCATION DEPARTMENT SERVICES NOT ONLY THE EMPLOYEES OF RWMC AND AFFILIATED ORGANIZATIONS, BUT ALSO PROVIDES ONGOING TRAINING AND EDUCATION FOR REGIONAL HEALTH CARE PROFESSIONALS, VOLUNTEERS, STUDENTS AND THE COMMUNITY THROUGH CPR, ATLS, PALS, AND NRP CLASSES IN PARTNERSHIP WITH AREA EMT'S, WNCC, AND SCHOOOLS. THROUGH THE OUTREACH SERVICES DEPARTMENT RWMC HAS NETWORK AFFILIATIONS WITH FIVE CRITICAL ACCESS HOSPITALS (CAHS) WITHIN ITS SERVICE REGION. RWMC PROVIDED NEEDED MANAGEMENT EXPERTISE AND CERTAIN MEDICAL SUPPORT SERVICES INCLUDING PHARMACY, OCCUPATIONAL THERAPY, BLOOD PROCESSING & COLLECTION, AND LABORATORY MANAGEMENT SERVICES THROUGH CONTRACT AGREEMENTS WITH THE CAHS. THE CONTINUED OPERATION AND SUCCESS OF THE CAHS IS CRUCIAL TO MINIMIZE THE DISTANCE AND TIME PATIENTS WOULD HAVE TO TRAVEL FOR MEDICAL CARE. SERVICES TO CAHS ARE PROVIDED AT OR BELOW OPERATING COSTS TO RWMC."
202031979349303368,570314404,154486,"Public ServiceNOTEWORTHY:Newberry College Professor Elected to Old Exchange Building CommissionFebruary 23, 2019Dr. J. Tracy Power, assistant professor of history and director of the Newberry College Archives, has been elected by the General Assembly to serve on the Old Exchange Building Commission.Newberry College President Named to NECU Executive CommitteeFebruary 19, 2019Newberry College President Dr. Maurice W. Scherrens has been elected to the executive committee of the board of directors for the Network of ELCA Colleges and Universities (NECU).RETAIN Hosts Conference for Newberry Alumni TeachersFebruary 12, 2019The RETAIN Center of Excellence Mentoring and Induction Teachers will host the 2019 Coming Home Conference for Newberry College Teacher Education alumni on Saturday, Feb. 25, at the Center for Teacher Excellence.Newberry College Hosts Black History Month Event SeriesFebruary 7, 2019Newberry College will mark Black History Month throughout February with a series of events to celebrate important people and events in the history of African-Americans and the African diaspora."
202030579349301648,942356338,203380,13934,STUDENT SERVICES
202021269349302062,540505945,4359369,0,0,"Other - Research, Public Support and Academic Support"
202011369349303136,920158414,1410687,TO PROVIDE HIGH QUALITY EDUCATION AND VOCATIONAL/TECHNICAL TRANING THAT HELPS STUDENTS GAIN EMPLOYMENT.
202031119349301618,956151774,6602250,0,0,"CHARLES R. DREW UNIVERSITY IS ACTIVELY COMMITTED TO TRAINING FUTURE GENERATIONS TO MAKE A DIFFERENCE THROUGH A NUMBER OF NOVEL AND INNOVATIVE YOUTH EDUCATION ""PIPELINE PROGRAMS"" WHICH ARE UNIQUE AMONG MEDICAL EDUCATION PROGRAMS IN SOUTHERN CALIFORNIA. THE PIPELINE PROGRAMS HAVE TWO IMPORTANT GOALS: EXPOSE URBAN MINORITY STUDENTS TO SCIENCE STUDIES WHILE HELPING THEM DEVELOP A STRONG INTEREST IN SCIENCE AND RESEARCH, AND IMPROVE OPPORTUNITIES FOR URBAN MINORITY STUDENTS WHO WISH TO PURSUE CAREERS IN MEDICINE AND SCIENCE. THE PROGRAMS ARE A SERIES OF EDUCATIONAL STEPS THAT ESTABLISH AN ACADEMIC CONTINUUM IN MEDICAL EDUCATION. THE ACADEMIC CONTINUUM STARTS AT PRESCHOOL WITH THE SATURDAY SCIENCE ACADEMY (SSA) PROGRAMS, INCLUDING THE SSA JUNIOR WHITE COAT CEREMONY, AND EXTENDS UPWARD THROUGH THE LINCOLN-DREW ELEMENTARY SCHOOL (GRADES K-6). LINCOLN-DREW MIDDLE SCHOOL (GRADES 7 THROUGH 9) AND THE KING/DREW MAGNET HIGH SCHOOL OF MEDICINE AND SCIENCE (GRADES 10 THROUGH 12). THE WHITE COAT CEREMONY IS A NATIONWIDE MEDICAL SCHOOL ACTIVITY TO SIGNAL THE TRANSITION OF MEDICAL STUDENTS FROM BOOK LEARNING AND LAB WORK TO THE WORLD OF CLINICAL PRACTICE AND DIRECT INTERACTION WITH REAL PATIENTS. THE SSA JUNIOR WHITE COAT CEREMONY SEEKS TO EMBRACE THE SPIRIT OF THIS EXERCISE THROUGH ENCOURAGING STUDENTS TO COMMIT TO LIFELONG LEARNING."
202000719349301410,730739626,2756303,4557405,"Golden Eagle Broadcasting America - Costs to broadcast television programming that seeks to equip, empower, and educate through Spirit-Empowered Edu-tainment that will help viewers to live well - Spirit, Mind, and Body."
202000719349301410,730739626,101944,"Research - Costs incurred to conduct biomedical, academic, and other related research."
202031429349300148,930386892,4185595,3632201,CLINICS-PART OF CURRICULUM
202001349349302790,111630822,46983129,0,22725800,Student & Auxiliary Services
202041329349301204,470376583,19457120,0,16489057,Sponsored Research and Other Education and General
202021329349300207,250965591,681545451,207249580,139555457,"EXPENSES GRANTS REVENUESTUDENT SERVICES 191,001,040 SCHOLARSHIPS AND FELLOWSHIPS 205,961,760 205,961,760AUXILIARY ENTERPRISES 146,981,625 139,555,457LIBRARIES 48,798,846PUBLIC SERVICE 88,802,180 1,287,820"
202010509349301301,910564993,5852224,0,5708068,"HIGHER EDUCATION: AUXILIARY SERVICES INCLUDING FOOD SERVICE, BOOKSTORE AND STUDENT HOUSING."
201913179349303056,150532245,22143386,73488476,"OTHER PROGRAM SERVICES INCLUDE EMERGENCY ROOM, REFERRED AMBULATORY, CLINICS, FAMILY PRACTICE, SPORTS MEDICINE CENTER, COLLEGE OF NURSING, INTERNS AND RESIDENTS, AND HOME HEALTH AGENCY"
202030869349300818,030197728,75974,"COSTS TO OPERATE AND MAINTAIN FACILITIES, INCLUDES A LIBRARY FOR THE CONTINUED EDUCATION AND USE OF STUDENTS."
202010429349300906,391399196,36696656,36696656,0,"Student Financial Aid Programs, General/Other: Scholarships and grants (2,004 students)"
202041979349304134,570314395,3330285,MISCELLANEOUS REVENUE FROM CONTRACTS AND FEES FROM EXEMPT FUNCTION UNIVERSITY ACTIVITIES
202020459349300222,430652667,5970338,1238499,"OTHER: OTHER SERVICES, INCLUDING ACADEMIC SUPPORT"
202012309349300816,381948285,22848544,"EACH OF FOCUS: HOPES CORE PROGRAM AREAS ARE TIED TOGETHER BY A RANGE OF EMPOWERMENT INITIATIVES DESIGNED TO DEVELOP COMMUNITY LEADERSHIP AND PROMOTE ECONOMIC PROSPERITY OF PROGRAM PARTICIPANTS AS FOCUS: HOPE ENGAGES IN ADVOCACY TOWARD EQUITABLE SYSTEMS CHANGE. THESE INITIATIVES CONSISTS ECONOMIC EMPOWERMENT OFFERINGS, YOUTH LEADERSHIP AS ACTIVISM AND OF A MIX OF ANTI-RACISM DISCUSSIONS AND ACTIVITIES ENGAGING COLLEAGUES ALONG WITH THE PUBLIC."
202001289349302225,526072925,634889,"PRESERVATION AND DOCUMENTATION:-AFI COLLECTION: THIS VITAL AND INDISPENSABLE PART OF THE LIBRARY OF CONGRESS ARCHIVE CONTINUES TO ACQUIRE AND PRESERVE FILMS AS PART OF ITS ONGOING MISSION TO MAINTAIN AMERICA'S FILM HERITAGE. THE COLLECTION INCLUDES OVER 27,500 TITLES, CONSISTING PRIMARILY OF THEATRICAL FEATURES AND SHORTS, AS WELL AS SUBSTANTIAL NUMBERS OF NEWSREELS, DOCUMENTARIES AND TELEVISION PROGRAMS.-AFI CATALOG: THIS DEFINITIVE ONLINE DATABASE SETS THE STANDARD AS THE SOURCE FOR ACCURATE INFORMATION ON THE ENTIRE HISTORY OF AMERICAN FILM. IT HAS BEEN CALLED ""THE AUTHORITATIVE OXFORD ENGLISH DICTIONARY OF AMERICAN FILM."""
202020439349300942,222586208,557540,50600,1449169,Other programs offered during the year
201921839349301152,132905207,OPERATES A COLLEGE LEVEL SCHOOL WITH A POSTGRADUATE PROGRAM
202000089349301105,953104298,2942522,"TEACHING CHRISTIAN THEOLOGICAL THEORY, CHURCH MUSIC, EARLY CHILDHOOD EDUCATION AND MINISTRY FOR THE BACHELOR AND MASTER'S DEGREE."
202041679349300814,660201206,18447503,1793920,104010,"Student Service - These are the expenditures for activities other than formal instruction that contribute to the student's emotional and physical well-being and to their intellectual, cultural and social development such as: student activities, cultural events, intramural athletics and others."
202041679349300814,660201206,7332107,371695,27754297,"Academic Support - These are the expenditures incurred for activities and services to pursue the primary mission of the institution: instruction and research. Includes expenditures such as library books, audiovisual materials, those related to students retention, preservation and display of educational and historical materials, scientific displays and art objects."
202041679349300814,660201206,6384768,204326,2518573,"Public Services - These are the expenditures mainly incurred for the operation of a non commercial television station providing educational and cultural programs to students and the community. Also included under this category are expenditures from activities developed for community service, mainly high school dropout students, socially and economically challenged students, academically outstanding students, and others."
202041679349300814,660201206,2397043,113148,300668,Research - These are expenditures incurred for activities developed to generate research outcomes that are carried out within academic departments. The research projects are commissioned by external agencies or separately budgeted by an organizational unit within the Institutions.
202041679349300814,660201206,880785,25311,2570361,"Auxiliary Enterprises - These are the expenditures incurred for essentially self supporting operations that exist to furnish a service to students, faculty and staff, and incidentally to the general public. They include cafeterias, parkings, bookstores, and a printing shop."
202001009349300800,160746864,13990308,1328677,STUDENT SERVICES: TO SUPPORT THE INSTRUCTION FUNCTION.
202001359349300440,383001876,600308,0,0,Other program services
202011369349302556,231365971,333222000,155365000,142703000,OTHER PROGRAM SERVICES Listed Below:
202040569349300809,410693960,8389678,0,4397255,"Hamline University provides auxiliary services to students which are essentially the self supporting operations of the University. These services charge a fee to students that is directly related to, although not necessarily equal to, the cost of providing the service. Examples are residence halls, food services, student health services, and the campus bookstore."
202040569349300809,410693960,3736791,0,0,Expenditures of those offices and activities whose primary purpose is to support the program activities of the University.
202040369349300509,520743814,751671,266355,205447,"PROGRAM SUPPORT TO NIH: FAES PROVIDES FUNDING, FOOD, AND ADMINISTRATIVE SUPPORT FOR A VARIETY OF PROGRAMS, ACTIVITIES AND EVENTS IN SUPPORT OF NIH SUCH AS THE OFFICE OF INTRAMURAL TRAINING AND EDUCATION (OITE) COMMUNITY COLLEGE DAY, GRADUATE PARTNERSHIP PROGRAM (GPP) RECRUITING, COMMUNITY BUILDING, AND SYMPOSIA, SUPPORT FOR THE NIH ANNUAL RESEARCH FESTIVAL, CLASSICAL AND JAZZ MUSIC PERFORMANCES, NIH TAKE YOUR CHILD TO WORK DAY, WEDNESDAY AFTERNOON LECTURES (WALS), ADMINISTRTION OF MEMORIALS, AND MORE. FAES ALSO PROVIDED LOW COST HOUSING TO 64 NIH FELLOWS DURING THE YEAR."
