object_id,ein,ExpnsAmt,GrntAmt,RvnAmt,Dsc
202041959349303889,030179592,2364868,392179,1951219,"SIT Graduate Institute - The SIT Graduate Institute offers graduate students and professionals internationally focused full-time and low-residency accredited master's degrees, as well as certificate and professional development programs. Program options are provided in Vermont and Washington, DC. The Institute's mission: prepare students to be inter-culturally effective leaders, professionals, and citizens. In doing so, WL fosters a worldwide network of individuals and organizations committed to responsible global citizenship. Programs include international education, NGO and nonprofit management, sustainable development, social justice in intercultural relations, conflict transformation, and Teaching English to Speakers of Other Languages (TESOL). SIT alumni and partners are engaged in creating, leading and developing social justice, educational and international development organizations around the world. Degree candidates, include high-ranking government officials and leaders in civil society from the developing world, come from more than 35 countries and collectively speak over 60 languages. SIT served as a training center for early Peace Corps volunteers and attracts many returned volunteers as staff and students. WL's academic programs offered through SIT (founded as the School for International Training) are accredited by the New England Association of Schools and Colleges through its Commission on Institutions of Higher Education. Learn more at https://graduate.sit.edu/."
202041959349303889,030179592,7590640,0,1358784,"Other program services, including SIT program support, private exchange programs, and auxiliary student services."
202011399349300021,250496976,577453,0,0,"OTHER PROGRAM SERVICES RESEARCH:RESEARCH IS CONDUCTED ON A PROJECT BASIS, PRIMARILY BY MEMBERS OF THE SCHOOLS OF SCIENCE AND ENGINEERING. PROJECTS ARE SUPPORTED BY GRANTS, PRINCIPALLY FROM LOCAL INDUSTRIES AND REGIONAL BUSINESS DEVELOPMENT ORGANIZATIONS."
202021969349302647,951890710,7114119,14667277,"CBU PROVIDES SUPPORTING SERVICES FOR THE INSTITUTION'S PRIMARY PROGRAMS OF INSTRUCTION. IT INCLUDES ADVISING, LIBRARY, REGISTRAR, STUDENT SUCCESS, TECHNOLOGY LABS AND THE WRITING CENTER."
202032549349300528,135648615,17509363,9819966,0,"Missions activities: Includes grants to missions activities established in 81 countries. The purpose is the same and the program activities are the same as those carried out in the US. The program activities include camps and conferences, youth programs in churches, Bible institutes and training centers, evangelistic events, sports evangelism and travelling music and drama teams. Also includes short term missions activities for youth and adult work and medical teams"
202032549349300528,135648615,575609,0,7062,Other ministry activities includes rallies and evangelist outreaches in local area as well as concerts and other ministry related activities
201923139349300707,420681049,6442163,7843405,AUXILIARY SERVICES AVAILABLE TO STUDENTS INCLUDING ROOM AND BOARD.
201923139349300707,420681049,38228,MANAGEMENT FEES ON THE PROGRAM RELATED PORTION OF THE ENDOWMENT.
202041209349301534,370661496,988373,PUBLIC SERVICE EVENTS CONSIST OF MUSIC AND/OR COMEDY CONCERTS AND FAMILY FUN NIGHTS WHICH PROVIDE ENTERTAINMENT/ACTIVITIES THAT ARE OPEN TO THE GENERAL PUBLIC. DIFFERENT EVENTS ARE OPEN TO THE GENERAL PUBLIC. DIFFERENT EVENTS ARE HELD THROUGHOUT THE ENTIRE ACADEMIC YEAR.
202031989349301008,310604719,411793,THE UNIVESITY PROVIDES POST SECONDARY EDUCATION TO MINORITY STUDENTS FROM VARIOUS PARTS OF THE UNINTED STATES.
202021399349301552,381374230,17044169,25000,14010342,"THESE ADDITIONAL PROGRAM SERVICE EXPENSES INCLUDE, BUT ARE NOT LIMITED TO, AUXILIARY SERVICES (BOOKSTORE, RESIDENTIAL, DINING) AND PLAN AND MAINTENANCE OF CAMPUS GROUNDS AND BUILDINGS."
202021369349304527,581216007,626185,94500,RESEARCH
202031979349302288,530196640,4472275,3349241,"AUXILIARY ENTERPRISES - THE COLLEGE'S DORMITORIES, DINING HALL AND THE TRINITY CENTER FOR WOMEN AND GIRLS IN SPORTS ARE THE MAJOR AUXILIARY ENTERPRISES SERVING THE CAMPUS COMMMUNITY. STUDENTS HAVE LIVING QUARTERS IN FOUR BUILDINGS ON CAMPUS."
202031979349302288,530196640,"ACADEMIC SUPPORT INCLUDES A 200,000 VOLUME ON-LINE LIBRARY, COMPUTER CENTER AND ADMINISTRATIVE OFFICE."
202021409349300727,370663567,48620599,0,88892515,"Other Health Care Services: HSHS St. Elizabeth's Hospital delivers a comprehensive array of healthcare services to both inpatients and outpatients. It is our mission to serve the sick, especially the poor, with quality healthcare services and healthcare education. Our accredited programs have consistently demonstrated quality outcomes that positively impact our patients, their families and the entire community. We provide quality medical healthcare regardless of race, creed, sex, national origin, handicap, age, or ability to pay. The recently opened HSHS St. Elizabeth's Hospital fulfills our health care Mission through advanced technologies, professional, skilled and compassionate caregivers, and the highest level of quality service. Our new hospital and physicians' office building opened in November 2017 to offer our patients the highest quality care in a new, comfortable and healing setting. The healing environment combines the newest technology and efficiencies to provide region leading, high-quality care. We offer state-of-the-art technologies that provide advanced services in surgery, medical imaging, laboratory, physical therapy and the emergency department, just to name a few. With 144 all private patient rooms, efficiently designed clinical areas, which allow nurses to spend more time with their patients at the bedside, and the deluxe amenities offered in our Women and Infants Center, our staff continues to deliver the difference in quality, safe care. We also proudly partner with top providers such as HSHS Medical Group, Prairie Heart & Vascular Institute, SSM Health Cardinal Glennon, Vituity and SLU Family Medicine Residency Program. Our main service lines continue to grow to provide high-quality procedures close to home. In addition to the hospital itself, HSHS St. Elizabeth's also continues to serve the Belleville community through HSHS St. Elizabeth's Belleville Health Center, located in downtown Belleville at 180 S. Third Street, Belleville. The convenient, outpatient services available at this location include: physical and occupational therapy, laboratory, x-ray and 3D mammography services, a walk-in clinic and physician offices. HSHS St. Elizabeth's Hospital currently staffs 144 inpatient beds. The hospital employs 1,621 colleagues. Inpatient admissions for Fiscal Year 2019 were 9,484. Total Outpatient visits for the hospital were 175,138."
202031369349303093,580566133,40890287,40890287,0,"Higher Education: Scholarships and Student Aid allow Berry to meet its goal of making an excellent private liberal-arts education accessible to talented students from a wide range of social and economic backgrounds. (2,027 students)"
202031369349303093,580566133,0,0,1688490,Higher Education: Other program service revenue.
202001369349303875,954559065,DEPRECIATION
202021149349301027,610673886,1050961,17583,415447,"COMMUNITY AND YOUTH SERVICES provides services for youth in the community. Youth Leadership Development works with youth to build leadership and conduct community service projects. In addition we serve troubled adolescents and their families through the Homeward Bound Shelter for runaway and homeless youth (Northern Kentucky's only shelter specifically for youth), and Independent Living Program for youth at risk of becoming homeless. Our outreach programs include Street Outreach Program (SOP) and Project Safe Place, a crisis intervention program in which over 153 local businesses participate. SOP is street based outreach and education for homeless youth and youth adults through identifying where they congregate, and 196 youth were engaged and 97 were assessed for additional services. Teens Linked to Care (TLC) is focused on prevention services for teens related to substance abuse and HIV/STD's in northern Campbell County; and engaged 19 youth through the Youth Community Advisory Board, and 22 adults through the Community Advisory Board. In Fiscal Year 2019, 5,021 individuals were served through Community and Youth Services programs. Youth Leadership Development reported 77% of youth achieving social competencies, Homeward Bound Shelter helped 92% of youth exit counseling to ensure safe and appropriate stable living arrangement, and the Independent Living Program had 100% of youth gain employment within 90 days of enrolling and demonstrated basic life skills needed to live in the community."
202021149349301027,610673886,657237,12715,101601,"FINANCIAL WELLNESS & VOLUNTEER ENGAGEMENT provides both a continuum of financial services, as well as volunteer opportunities within Brighton Center and throughout Northern Kentucky. Financial Wellness works on improving credit, budgeting, getting banked, savings, making good financial decisions, assisting with asset building, and preparing individuals and families for homeownership. Volunteer Income Tax Assistance (VITA) Sites are offered to assist with tax preparation in Campbell, Boone, and Grant counties, and provided 755 individuals with free tax preparation services which resulted in a total of $980,345 in combined tax returns. 468 individuals attended a financial education workshop with 100% increasing their knowledge of and skills with budgeting, credit, and banking. 50 individuals received foreclosure prevention counseling. In addition, Volunteer Engagement services are responsible for the oversight of approximately 2,954 volunteers each year who assist our programs. Also, Brighton Center has over 356 volunteers serving at local non-profits through our Retired and Senior Volunteer Program (RSVP). We also educated 2,864 seniors on the issue of Medicare fraud. In addition, 192 seniors were served through Senior Support with 164 of them thriving in place due to services. In Fiscal Year 2019, Financial Wellness & Volunteer Engagement worked with 12,582 individuals."
202021149349301027,610673886,2342947,163441,59673,"FAMILY CENTER programs assist families to reach financial self-sufficiency through supportive intensive case management, training, and education. An emergency assistance program offers help with food through our Choice Food Pantry and USDA Commodities programs; clothing through our Clothing Closet and other basic needs through financial assistance. Every Child Succeeds (ECS) provides home visitation for first time moms. Home Instruction for Parents of Pre-school Youngsters (HIPPY) provides home visitation to families with children ages 3 to 5. In Fiscal Year 2019, 20,941 individuals were served through Family Center programs. Of those, 6,093 individuals received help through Emergency Assistance, Commodities, and Stabilization services. Of the parents engaged in ECS, 97% had no substantiations of child protection investigations after enrollment; and 88% of the children enrolled in HIPPY for a year were assessed age-appropriate in cognitive and language skills."
202021149349301027,610673886,277446,3000,121778,Services provided through other related entities
202021149349301027,610673886,1588546,65655,"KENTUCKY CAREER CENTERS serves as the Operator and Direct Service provider for Workforce Innovation and Opportunity Act (WIOA) services in the eight counties of Northern Kentucky. Talent Development Services provides WIOA services to adult, youth and dislocated workers, as well as employers. The Kentucky Career Center Operator coordinates the delivery of services between partners in Covington, Florence, Carrollton, and Grant County. Of those served, 95% of individuals maintained employment for six months. For nearly 40 years, we have conducted job training programs for adults and youth. In Fiscal Year 2019, 4,538 individuals were served through programs and services."
202021509349301027,480577656,4589748,4808,38768,"INSTITUTIONAL SUPPORT - FOR CENTRAL CHRISTIAN COLLEGE OF KANSAS IS PROVIDED BY THE VARIOUS ADMINISTRATIVE OFFICES INCLUDING PRESIDENT, BUSINESS OFFICE, AND THE DEVELOPMENT OFFICE. IN ADDITION TO PROVIDING THE GENERAL ADMINISTRATION OF THE INSTITUTION, THESE SUPPORT OFFICES ARE ALSO INSTRUMENTAL IN RAISING THE ADDITIONAL CONTRIBUTED FUNDS THAT ARE NECESSARY FOR CONTINUED EXISTENCE OF THE COLLEGE."
202041619349301324,430719506,2036153,1992976,"Academic support: The College works to provide students with academic support at every stage of their Covenant education. In addition to highly qualified staff, the Covenant library is networked with more than 18,000 other institutions worldwide, providing interlibrary loan access and document delivery services to over 1.3 billion library items. Our library was eleventh in the world to go live with the Online Computer Library Center's new cloud-based operating system, Web-scale Management Service. Covenant's writing center is located in the library, providing students one-on-one tutoring for essays, research papers, and any writing-related assignments. The Office of Academic Affairs at Covenant works to provide support for deans and faculty members as they seek to provide a rigorous education to Covenant students. Covenant's master of education and master of arts in teaching degrees offered by the graduate school of education at Covenant provide students with the exceptional opportunity of completing a master's degree in one year.Covenant's Maclellan Scholars program offers courses designed to encourage critical thinking and develop the skills of potential Christian leaders. Students in the program travel internationally while at Covenant and demonstrate leadership through student-initiated projects."
202041069349300219,042108346,9747100,10479282,"AUXILIARY ENTERPRISES - DORMITORY, DINING HALLS, BOOKSTORE, STUDENT CENTER, ANIMAL HOSPITAL & CLINIC, DAYCARE CENTER, AND SNACKBAR"
202020499349301762,880435559,3113229,PUBLIC SERVICES
202011059349300936,362167770,4994718,16220,"Academic support includes the cost of the library (facilities, salaries, acquisitions), other types of academic support for students and the costs of administration in academics (e.g. administrative assistants, hiring expenses, personnel of Deans offices)."
201943199349309934,390806297,5573542,1802278,PROVIDE ACADEMIC SUPPORT TO APPROXIMATELY 1500 STUDENTS THROUGH LIBRARY FACILITIES AND INSTRUCTIONAL COMPUTER SERVICE AND PROVIDE PUBLIC SERVICE THROUGH OUR BJORKLUDEN CAMPUS IN DOOR COUNTY.
202011329349302301,042103607,39983879,0,"OPERATING SUPPORT:OPERATING SUPPORT CONSISTS OF ALL OTHER AREAS OF THE MUSEUM. INCLUDING PROTECTIVE SERVICES, FACILITIES AND OTHER AREAS WHICH SUPPORT THE OPERATIONS OF THE MUSEUM AND ITS MISSION."
202011329349302301,042103607,1408089,4392556,"PARKING FACILITIES:THE MUSEUM OWNS A PARKING GARAGE AND HAS TWO OPEN-AIR PARKING LOTS. ALL OF THESE FACILITIES ARE OPEN TO MEMBERS AND VISITORS TO THE MUSEUM. THE OPERATION OF ADJACENT PARKING LOTS BY THE MUSEUM, IN AREAS OF INSUFFICIENT PARKING SPACES FOR THE USE OF ITS VISITORS, CONTRIBUTES IMPORTANTLY TO THE MUSEUM'S EXEMPT PURPOSE BY ENCOURAGING VISITATION AND LONGER PERIODS VIEWING OF ITS COLLECTIONS, AND SPECIAL EXHIBITIONS. ANY PROFITS FROM THE FEE CHARGED FOR THE USE OF THE LOT IS PLACED IN THE GENERAL OPERATING FUND."
202011329349302301,042103607,1201758,2909052,"FOOD SERVICES: THE MUSEUM IS ORGANIZED AND OPERATED AS AN ART MUSEUM. THE EATING FACILITIES ARE OPEN TO THE MUSEUM STAFF, EMPLOYEES, AND MEMBERS OF THE PUBLIC VISITING THE MUSEUM AND ARE OF A SIZE COMMENSURATE WITH ACCOMMODATION OF THESE SPECIAL GROUPS OF PATRONS. THE FACILITIES ARE ACCESSIBLE FROM THE MUSEUM'S GALLERIES AND OTHER PUBLIC AREAS BUT NOT DIRECTLY ACCESSIBLE FROM THE STREET. THE PATRONAGE OF THE EATING FACILITIES BY THE GENERAL PUBLIC IS NOT DIRECTLY SOLICITED NOR ARE THE FACILITIES CONTEMPLATED OR DESIGNED TO SERVE AS A PUBLIC RESTAURANT BUT MERELY TO SERVE THE EXEMPT PURPOSES OF THE MUSEUM. THIS ALLOWS VISITORS TO DEVOTE MORE TIME TO THE MUSEUM'S EDUCATIONAL EXHIBITS, AND ENHANCES EFFICIENT MUSEUM OPERATION BY ENABLING STAFF TO REMAIN ON-SITE THROUGHOUT THE DAY. THE OPERATING OF THE EATING FACILITIES WITHIN THE MUSEUM PREMISES HELPS TO ATTRACT VISITORS TO THE MUSEUM EXHIBITS. AS THERE ARE PLACES OF REFRESHMENT IN THE MUSEUM, VISITORS ARE ABLE TO SPEND A GREATER PORTION OF THEIR TIME AND ATTENTION TO THE MUSEUM'S COLLECTION, EXHIBITS AND OTHER EDUCATIONAL FACILITIES. THE MUSEUM CREATES AN EDUCATION PROGRAM FOR ITS PARTICIPANTS, FOCUSING ON AN EXHIBIT, LECTURE OR TOUR FOR PRIVATE AND CORPORATE FUNCTIONS."
202011329349302301,042103607,3531040,7960429,"MEMBERSHIP & VISITORS:OVER 1,352,000 VISITORS ATTENDED THE MUSEUM DURING FISCAL YEAR 2019. DURING THE FISCAL YEAR 2019, THERE WERE MORE THAN TEN COMMUNITY DAYS DURING WHICH ADMISSION CHARGES WERE WAIVED, AND THE MUSEUM HAS FREE ADMISSION ""PAY AS YOU WISH"" PERIODS EACH WEDNESDAY EVENING. THE MUSEUM HAS OVER 70,000 ACTIVE MEMBER HOUSEHOLDS. THERE ARE 8 LEVELS OF ANNUAL MEMBERSHIP WITH FEES RANGING FROM $75 TO $3,000. EACH CATEGORY OFFERS A WIDE VARIETY OF PRIVILEGES, SUCH AS FREE ADMISSION, PUBLICATIONS, RECIPROCAL MEMBER BENEFITS AT OTHER MAJOR ART MUSEUMS AROUND THE U.S. AND SPECIAL EVENTS."
202011329349302301,042103607,5361930,5852328,OTHER MISC. PROGRAM SERVICES
202041089349300129,951643389,17350911,0,70387,PUBLIC SUPPORT AND STUDENT SERVICES.
202021479349300707,620479189,60196586,24715829,"CARSON-NEWMAN COLLEGE INTEGRATES ITS STUDENTS INTO BENEVOLENT MINISTRIES THAT IT OPERATES TO SERVICE THE INDIGENT (APPALACHIAN OUTREACH SPONSORS MISSION TRIPS, PROVIDES HOME REPAIR, A FOOD PANTRY, CLOTHING, HOUSEHOLD GOODS AND EDUCATIONAL PROGRAMS THAT INCLUDE TUTORING AND LIFE SKILLS TRAINING AND ITS SAMARITAN HOUSE PROVIDES TEMPORARY HOUSING FOR HOMELESS FAMILIES IN EAST TENNESSEE)."
202041069349300829,341018992,81436403,43240939,"OTHER SPONSORED PROGRAMS: THE UNIVERSITY'S LIBRARY SYSTEM IS COMPOSED OF FOUR PRIMARY UNITS: THE UNIVERSITY LIBRARY, THE CLEVELAND HEALTH SCIENCES LIBRARY, THE SCHOOL OF LAW LIBRARY AND THE LILLIAN & MILFORD HARRIS LIBRARY IN THE MANDEL SCHOOL OF APPLIED SOCIAL SCIENCES. THE LIBRARIES OF THE UNIVERSITY SUPPORT THE UNDERGRADUATE, GRADUATE AND PROFESSIONAL PROGRAMS AND CONTAIN OVER 3 MILLION VOLUMES. CASE WESTERN RESERVE UNIVERSITY OFFERS ASSISTANCE TO ITS STUDENTS TO HELP MEET FINANCIAL NEED OR TO RECOGNIZE OUTSTANDING ACADEMIC ACHIEVEMENT AND PROMISE. ACADEMIC EXCELLENCE IS RECOGNIZED BY THE ACADEMIC AWARDS PROGRAM AND OTHER SCHOLARSHIP PROGRAMS OF THE UNDERGRADUATE COLLEGES AND BY VARIOUS ASSISTANTSHIPS, FELLOWSHIPS, SCHOLARSHIPS AND OTHER AWARDS OF INDIVIDUAL DEPARTMENTS IN THE SCHOOL OF GRADUATE STUDIES AND SEVERAL OF THE PROFESSIONAL SCHOOLS. CASE WESTERN RESERVE UNIVERSITY ACTIVELY PROMOTES THE DEVELOPMENT OF SERVICES AND PROGRAMS TO SUPPORT THE PHYSICAL, EMOTIONAL AND INTELLECTUAL WELL-BEING OF ITS STUDENTS.' THE PROGRAMS AND SERVICES ARE AVAILABLE TO UNDERGRADUATE, GRADUATE AND PROFESSIONAL STUDENTS ALIKE AND ARE DESIGNED TO PROVIDE POSITIVE, DEVELOPMENTAL OPPORTUNITIES BOTH TO SUPPLEMENT THE ACADEMIC EXPERIENCE AND ENRICH CAMPUS LIFE."
202030659349301558,390821861,7768509,1585772
202042319349300104,042103612,909506,44476,4283908
202011959349302841,250967480,313109,0,847983,"PATHWAYS AT THE WILLOWS, A MEMORY CARE COMMUNITY:PATHWAYS AT THE WILLOWS IS AN EXCEPTIONAL OPTION FOR SENIORS WITH MEMORY IMPAIRMENTS, ONE THAT PROVIDES MAXIMUM COMFORT FOR RESIDENTS, AND PEACE OF MIND FOR FAMILIES. THE PATHWAYS PROGRAM OFFERS A STATE-OF-THE-ART RESIDENCE DESIGNED FOR THE SPECIFIC NEEDS OF SENIORS WITH ALZHEIMER'S OR RELATED DEMENTIA. OUR MEMORY CARE RESIDENCE HAS BEEN DESIGNED TO CREATE MEANINGFUL AND PERSONAL ROUTINES BASED ON EACH RESIDENT'S LIFE STORY AND HISTORY. OUR PATHWAYS PROGRAM OFFERS A HOME-LIKE ENVIRONMENT CONDUCIVE TO BOTH YOUR EMOTIONAL HEALTH AND WELL-BEING. EVERY ROOM AT PATHWAYS HAS BEEN DESIGNED TO STIMULATE THE SENSES AND INVOKE A FEELING OF FAMILIARITY AND WARMTH."
202031969349301103,516000297,86040072,Academic Support
202031969349301103,516000297,52242357,Extension and Public Service
202031969349301103,516000297,45219602,45151461,Student Services
202031969349301103,516000297,192783600,185078186,Student Aid
202041489349300984,860294012,469447,636660,558397,OTHER PROGRAM SERVICES FOR EXTENDED STUDIES AND LIFELONG LEARNING CENTER THE COURSES CAN VARY FROM LOCAL COMMUNITY-BASED TO TRAVEL PROGRAMS THE COURSES ARE SET UP TO BE NON-CREDIT AND NON-DEGREE THIS PROGRAM IS ACADEMIC IN NATURE FOR NON-DEGREE SEEKING STUDENTS COURSES REFLECT THE COLLEGES MISSION IN NATURE.
202041029349301104,361521940,1649242,1608239,"AUXILIARY ENTERPRISES - NUHS JOURNALS, RESIDENCE HALLS, RENTAL PROPERTIES, PARKING LOTS, CAMPUS STORE"
202041029349301104,361521940,1408469,"ACADEMIC SUPPORT - LEARNING RESOUCE CENTER, TRAINING AND ASSESSMENT CENTER"
202041029349301104,361521940,439825,"RESEARCH - GENERAL RESEARCH, RESEARCH GRANTS"
202011839349300011,580619030,2041064,3192881,"AUXILIARY ENTERPRISES - AT BREWTON-PARKER COLLEGE, CAMPUS LIFE IS MORE THAN JUST ATTENDING CLASSES AND STUDYING IN THE LIBRARY. OUR STUDENT BODY IS ACTIVE EVERY WEEK IN INTRAMURAL SPORTS, SERVICE CLUBS, CHRISTIAN ORGANIZATIONS, COLLEGIATE ATHLETICS, AND VARIOUS OTHER FUN ACTIVITIES."
202001329349303050,710239576,5908118,"Academic Support - JBU enriches the students' educational experience through academic support in the form of library services, registrar services, IT support, and faculty professional development."
202001329349303050,710239576,2561906,2689273,"Public Service- The University is also the home to two endowed centers, The Center for Healthy Relationships and the Milestone Leadership. The University also owns and operates KLRC radio, a 100,000 watt FM radio station."
202000809349301200,370661494,14395716,4349836,2463242,"INTERCOLLEGIATE ATHLETICS - PROVIDES FOR INTERCOLLEGIATE ATHLETIC ACTIVITY DIVISION I SPORTS OF MEN'S BASKETBALL, TRACK, GOLF, BASEBALL, AND SOCCER AND WOMEN'S BASKETBALL, VOLLEYBALL, CROSS-COUNTRY, GOLF, SOFTBALL, AND TENNIS."
202000809349301200,370661494,1329676,503338,"OTHER EDUCATIONAL BENEFITS - PROVIDES TECHNICAL SUPPORT FOR FACULTY, STAFF AND STUDENTS, CHILDCARE CENTER FOR TRAINING OPPORTUNITIES, AND EMPLOYMENT CENTER FOR STUDENTS."
202000809349301200,370661494,5173871,5849292,"OTHER DEPARTMENT PROGRAMS - PROVIDES SERVICES FOR TRANSCRIPTS, CULTURAL PROGRAMS OFFERED TO CAMPUS AND PUBLIC, CONTINUING EDUCATION PROGRAMS, AND MISCELLANEOUS OTHER PROGRAMS."
202000509349300730,390806154,9182540,ALL OTHER PROGRAM SERVICES.
202011059349301801,240795495,16495921,0,1616144,"HIGHER EDUCATION, ACADEMIC SUPPORT - INCLUDES EXPENSES APPLICABLE TO AN INTEGRAL PART OF THE UNIVERSITY'S PRIMARY MISSION OF INSTRUCTION, RESEARCH, OR PUBLIC SERVICE THAT ARE NOT CHARGED DIRECTLY TO THESE PROGRAMS."
202011059349301801,240795495,"HIGHER EDUCATION, LIBRARY EXPENSES - INCURRED IN OPERATING AN 80,000 SQ. FT. UNIVERSITY LIBRARY. THE LIBRARY CONTAINS OVER 633,035 VOLUMES, 203,507 FULL-TEXT ONLINE BOOKS, AND A MEDIA COLLECTION HOLDING 22,544 NON-PRINT ITEMS AND 9,085 STREAMING MEDIA PROGRAMS FOR STUDENT AND GENERAL PUBLIC STUDY AND RESEARCH."
202011059349301801,240795495,"HIGHER EDUCATION, PUBLIC SERVICE - FUNDS EXPENDED FOR ACTIVITIES ESTABLISHED PRIMARILY TO PROVIDE NON-INSTITUTIONAL SERVICES BENEFICIAL TO INDIVIDUALS AND GROUPS EXTERNAL TO THE UNIVERSITY. THESE EXPENSES DO NOT INCLUDE OVER 175,000 COMMUNITY SERVICE HOURS PROVIDED BY UNIVERSITY STUDENTS."
202011059349301801,240795495,"HIGHER EDUCATION, RESEARCH - INCLUDES THE COST ASSOCIATED WITH GRANTS/AWARDS TO PRODUCE RESEARCH EITHER FUNDED INTERNALLY OR COMMISSIONED BY AN AGENCY EXTERNAL TO THE UNIVERSITY."
202020839349300142,570314374,2027735,2027735,THE UNIVERSITY PROVIDED SUPPORT TO PANTHER HEALTH PARTNERS INC. TO FACILITATE NEW MARKET TAX CREDIT TRANSACTIONS FOR THE BUILDING OF A HEALTH AND WELLNESS CENTER TO SERVE THE UNIVERSITY AND THE ORANGEBURG COMMUNITY.
202011959349302226,362182171,5554000,487190,7772646,"ARTIST SERIES, THE COMMUNITY SCHOOL OF THE ARTS AND SUMMER SPORTS CAMPS. MINOR PROGRAMS, APPLICATION FEES, TUITION INSTALLMENT PLAN FEES, PARKING FINES, PARKING PERMITS AND LIBRARY FINES. THE COLLEGE SOLICITS A VARIETY OF CONTRIBUTIONS FOR ITS PROGRAMS INCLUDING DONOR-ADVISED FUNDS. DONOR-ADVISED FUND CONTRIBUTIONS RECEIVED ARE ACCOUNTED FOR AS OTHER INVESTMENTS. DONOR-ADVISED FUNDS ALLOW FOR THE DONOR TO RECOMMEND DISTRIBUTIONS TO COLLEGE PROGRAMS OR OTHER CHARITABLE ORGANIZATIONS. ALTHOUGH THE COLLEGE GENERALLY COMPLIES WITH THE DONOR'S RECOMMENDATION, THEY ARE SUBJECT TO APPROVAL BY THE COLLEGE'S CHARITY SELECTION COMMITTEE. THE COLLEGE'S POLICY IS TO DISTRIBUTE A MAXIMUM OF 75% - 90% OF DONOR-ADVISED FUND CONTRIBUTIONS TO UNRELATED THIRD PARTIES."
202011059349301951,250981156,4565747,3679341,"ACADEMIC SUPPORT - SUPPORT FOR INSTRUCTION AND RESEARCH BY THE FOLLOWING DEPARTMENTS: DEAN OF THE COLLEGE, LIBRARY, INFORMATION TECHNOLOGY SERVICES, FACULTY DEVELOPMENT, ART GALLERY, HONORS PROGRAM, CHEMICAL HYGIENE, CULTURAL ARTIFACTS AND ACADEMIC SUCCESS CENTER."
202000249349300400,310840764,674568,0,334111,STUDENT SERVICES
202030949349300023,351087173,4315043,0,353329,Auxiliary Enterprises and Other Miscellaneous Revenue
202010999349300801,251120678,54511760,0,1102820,"AUXILIARY ENTERPRISES: RESIDENCE HALLS, DINING HALLS, RECREATIONAL"
