object_id,ein,ExpnsAmt,GrntAmt,RvnAmt,Dsc
202022389349300047,410682405,"Community Care and Community Benefit:To meet our commitment to the mission and underlying charitable purpose of the Hazelden Betty Ford Foundation, we invest time, financial resources and energy in helping people and communities understand and address addiction as a treatable disease, and we spread the word that recovery is possible. ""Be of Service"" is an integral core value that we demonstrate in a variety of ways. The Foundation provides treatment services to individuals and families who seek and qualify for care but are unable to pay the full cost. The Foundation's patient aid policy provides that the Foundation will annually establish a target amount of patient financial assistance. In addition to its annual provision for charity care, the Foundation provides a variety of other benefits for the public good including:Butler Center for Research -The Butler Center for Research (BCR) is dedicated to improving recovery from addiction by conducting clinical and institutional research, collaborating with other research centers and communicating scientific findings. It is the Center's vision that sustained recovery for all who seek help will be achieved through advancements in knowledge and integration of research into practice.-In 2019, the BCR participated in the following activities:-As part of the Hazelden Betty Ford Foundation's commitment to evidence-based practice, a variety of projects were conducted to inform clinical care and academic programming, identify treatment needs, drive data-based decision making, and contribute to the professional and public knowledge of addiction treatment. Projects included data analyses, and industry trend reports, among others. -The BCR collaborated with researchers from the Mayo Clinic who obtained a government grant to study the use of acamprosate, an FDA-approved medication targeting alcohol craving. Funded by the National Institute on Alcohol Abuse and Alcoholism (NIAAA), this project will work to identify biomarkers that may predict patient response to the use of the medication, with the hope of finding new genes linked to alcoholism treatment response. The project was successfully launched in July of 2019 with recruitment ongoing through 2020. Findings from this study could have substantial impact and inform substance use treatment on a national scale.-The BCR also collaborated on another NIAAA grant-funded study with researchers from Virginia Commonwealth University. Titled, ""Genes, addiction, and personality,"" this study is part of a genome-wide association study to learn more about the relationships between personality, mental health, substance use and genes. Data collection was successful in 2019 and will be ongoing into 2020. -Research Updates were disseminated to professionals, educators, researchers, students and other stakeholders. These two-page summaries of scientific findings from the field of addiction treatment research are provided at no cost as a community benefit to policymakers, treatment professionals and the public at large. Research Updates are also available on the BCR web page at www.hazeldenbettyford.org/education/bcr/addiction-research. One new Research Updates was created in 2019 on Vaping and E-cigarettes.-In addition to the new Research Update, the BCR published a manuscript in the September 2019 issue of the Journal of Substance Abuse of a feasibility study of Hazelden Betty Ford Foundation's comprehensive model for treating opioid use disorder, the Comprehensive Opioid Response with Twelve Steps framework (COR-12).Community Education and Relations:-We presented free, public talks at our Minnesota Speaker Series held in St. Paul on select Tuesdays; at our Oregon Speaker Series held twice a month in the Portland metro area; and at our monthly Second Sunday speaker series held in Center City, Minnesota.-Our Speakers Bureau helped place the organization's many spokespeople at events, with 95 different employees delivering 194 presentations in three countries, 26 states and 73 cities, as well as 21 virtual presentations available globally. -We also provided education and support at our free, open-to-the-public Caring Families groups, facilitated once a month in Plymouth, Minnesota and once a week in Fort Myers, Florida - as well as weekly in an online format at www.TheDailyPledge.org.-Our Visitors Program in Center City, Minnesota, scheduled and conducted 72 tours for 358 individuals. At the Betty Ford Center in Rancho Mirage, California, staff scheduled and conducted 65 tours. -Volunteers at facilities in California, Colorado, Illinois, Florida, Minnesota, New York and Oregon donated 13,177 hours, valued at more than $335,085. -In addition, educational scholarships from the Hazelden Betty Ford Foundation totaling $5,200 were awarded to students at six high schools in the Twin Cities and Center City areas of Minnesota, as well as two western Wisconsin high schools. -In Florida, Hazelden Betty Ford is an active member of the Collier Community Drug Response Team, an action-oriented work group that analyzes data and mobilizes support to overdose hotspots. And, for the 25th year, we co-sponsored and hosted our Women's Health Conference, a free, twice-annual community event that brings together medical providers and public health departments in Center City, Minnesota.-In addition, the Foundation hosted its own music festival, HazelFest, in Center City, Minnesota, providing more than 1,100 people from the surrounding communities a family friendly, alcohol-free entertainment experience while also educating festival-goers and thousands of other marketing and press consumers about the promise and possibility of recovery. We also sponsored community events like the Minnesota Walk for Recovery, which attracted 5,000 people. The Children's Program:-The Betty Ford Center Children's Program provides prevention and education services to children and families with addiction. Programs are located in California, Minnesota and Colorado. No child has ever been turned away because of lack of financial ability to pay, and over 90 percent attend on scholarships. In 2019, 1,051 children and family members participated in the program. Web and Social Networks: -The corporate website, www.HazeldenBettyFord.org, continued to grow in 2019 with nearly 8 million sessions, an increase of 25% over 2018. ""Thought for the Day"" remained the most popular feature on the website, with an average of 13,000 visitors each day. ""Thought for the Day"" provides daily inspirational readings from one of six Hazelden Publishing meditation books.-Over 3 million individuals from across the world visited the website seeking information on a variety of addiction-related topics, including treatment, recovery, education, public advocacy and products in our online bookstore. Seventy-five percent of all visits to the hazeldenbettyford.org website were from mobile or tablet devices. Only 25% of sessions were from a desktop or laptop computer.-The Hazelden Betty Ford Foundation's online social community-TheDailyPledge.org-features discussion boards, chatrooms, blogs and online meetings accessible at no cost to anyone anywhere in the world. The Daily Pledge continued to offer a supportive home on the web for people in or seeking recovery, as well as a growing number of family members of those in or seeking recovery. In 2019, nearly 12,000 users visited the community and the number of registered members climbed over 10,000. Members made 8,500 daily pledges of sobriety and attended more than 250 scheduled recovery meetings.-Hazelden Betty Ford Foundation's Facebook, Twitter, Instagram, YouTube, LinkedIn and other social media accounts, which have more than 97,000 followers, along with its award-winning mobile apps, offered additional access to recovery resources, providing daily inspiration, information and fellowship.Resource Center:-In 2019, Hazelden Betty Ford's Resource Center received 185,192 calls from people seeking information, assistance and products related to substance use and addiction. Hazelden Betty Ford Library:-In addition to its core mission of fulfilling the informational needs of Hazelden Betty Ford Foundation staff and students, our Addiction Research Library-accessible at www.hazeldenbettyford.org/education/bcr/addiction-research-library serves the public by:-Working daily with information sharing and advocacy efforts in the regional Minitex, national Docline, and international SALIS (Substance Abuse Librarians and Information Specialists) networks.-Facilitating on our website the preservation and access of archived versions of the ETOH and CORK addiction-related journal databases, free to all internet users and available nowhere else online.-Providing scholarships, via the A.A. Heckman Endowed Fellowship Fund, to help individuals study the addiction-related archives housed on our campus in Center City, Minnesota."
202031509349301318,250965600,27697070,113049,25201551,"OTHER PROGRAM SERVICES INCLUDE A MULTITUDE OF ACTIVITIES PERFORMED BY THE HOSPITAL TO DO BUSINESS IN THE COMMUNITY AND PROVIDE VALUABLE COMMUNITY BENEFITS. ACTIVITIES IN THIS CATEGORY INCLUDE, BUT ARE NOT LIMITED TO, A TEENAGE ABSTINENCE EDUCATION PROGRAM, A FAMILY PRACTICE RESIDENCY PROGRAM, A SCHOOL OF NURSING, A SCHOOL FOR X-RAY TECHNICIANS, HOSPICE SERVICES, CERTAIN EMERGENCY DEPARTMENT SERVICES, OPERATION OF A WELLNESS CENTER, RENTAL ACTIVITIES, AND OPERATION OF AN EMPLOYEE CAFETERIA."
202031979349305568,660349669,5513142,6048735
201941339349302304,231365971,317538000,153372000,125750000,OTHER PROGRAM SERVICES Listed Below:
202041349349301004,231355135,346689,220094,CONTINUING MEDICAL EDUCATION
202010249349300211,231352648,47298,Food Service- Catering
202010249349300211,231352648,42017,IU Cash receipts
202010249349300211,231352648,54665,Bookstore Commission
202010249349300211,231352648,7080,Vending and Non Credit Workshops
202010249349300211,231352648,13988,Forfeit Student Deposits
202010249349300211,231352648,29350,Transcript Income
202010249349300211,231352648,39800,Parking Fee/Permits
202010249349300211,231352648,133080,All other revenue
202000669349301115,362755187,92034,0,50520,"PROGRAMS THAT PROVIDE ECONOMIC ENHANCEMENT OPPORTUNITIES THROUGH EDUCATION, CAPACITY BUILDING, LEADERSHIP AND WORKFORCE SERVICES."
202001749349301215,580566167,41245753,Research
202001749349301215,580566167,56451979,40036758,Auxiliary Services
202001749349301215,580566167,26998753,Student Services
202001749349301215,580566167,8132259,5001221,6427989,Other
202000769349301805,741277664,4998461,"ANNUAL SUPPORT FROM THE UNIVERSITY'S ENDOWMENT FOR STUDENT SCHOLARSHIPS, ENDOWED DEPARTMENTAL CHAIRS, FACULTY DEVELOPMENT, ENDOWED LECTURES, AND MAINTENANCE OF CAMPUS FACILITIES"
202041979349304914,060646927,15078795,STUDENT SERVICES
202041979349304914,060646927,5758927,INSTITUTIONAL SUPPORT
202041979349304914,060646927,1548743,PUBLIC SERVICE
202041339349302554,620528217,2186710,"INSTITUITONAL SUPPORT - SUPPORT TO THE COLLEGE, INCLUDING IT SERVICES, BENEFITS, MAIL AND PRINTING"
202041339349302554,620528217,ADVANCEMENT
202041339349302554,620528217,2087940,ACADEMIC SUPPORT
202040939349300614,420680400,53527,0,1912985,Expenses consist of a Fair Value Hedge expense interest due to an interest rate exchange agreement for some longterm debt and a number of other smaller transactions
201901309349303300,420680387,16414204,0,17933583,OTHER PROGRAM SERVICES INCLUDE AUXILIARY ENTERPRISES SUCH AS HOUSING AND FOOD SERVICES.
202042269349302299,060646715,143820361,3500,184060928,"Midstate Medical Center is a 156-bed acute care hospital located in Meriden, Connecticut, with satellite offices in Cheshire, Wallingford and Southington. Midstate Medical Center provides a broad spectrum of services that meets the needs of the community it serves. In towns across Central Connecticut, Midstate Medical Center is committed and focused on efforts to promote health and wellness. In addition to the programs referred to above, the Hospital provides services/programs including but not limited to the following:*Behavioral Health*Cancer Care*Cardiology & Heart Care*Cosmetic & Reconstructive Surgery*Diabetes & Endocrinology*Digestive Health*Emergency Services*Headache Center*Imaging Services*Mako System*Maternity*Medical Weight Loss*MediQuick*Movement Disorders Center*Neuroscience Institute*Neurosciences*Neurosurgery*Orthopaedics*Pain Treatment*Physical Rehabilitation*Podiatry*Primary Care & Family Medicine*Sleep Care*Spine Care*Stroke*Surgical Services*Surgical Weight Loss*Travel Clinic & Infectious Diseases*Urgent / Walk-in Care*Urology & Kidney*Women's Health*Wound Care"
202041929349301624,470757164,471011899,153146,203380284,"ALEGENT CREIGHTON HEALTH GIVES BACK TO OUR COMMUNITY THROUGH A VARIETY OF MEDICAL SERVICES AND PARTNERSHIPS. ALEGENT HEALTH QUICK CARE PROVIDES URGENT MEDICAL TREATMENTS, SCREENINGS AND ADULT IMMUNIZATIONS FOR PATIENTS 18 MONTHS AND OLDER. THROUGH OUR COLLABORATION WITH OTHER LOCAL COMMUNITY ORGANIZATIONS SUCH AS BOYS TOWN, CREIGHTON UNIVERSITY, OUR HEALTHY COMMUNITY PARTNERSHIP AND ONE WORLD COMMUNITY HEALTH CENTER, ALEGENT CREIGHTON HEALTH IS HELPING TO IDENTIFY AND ADDRESS COMMUNITY HEALTH NEEDS. IN ADDITION, ALEGENT CREIGHTON HEALTH ALSO PROVIDES THE FOLLOWING SERVICES: MATERNITY CARE SERVICES, MENTAL AND BEHAVIORAL HEALTH CARE, ONCOLOGY, PROCEDURE CENTER AND INPATIENT FACILITIES INCLUDING INTENSIVE CARE."
202040379349301654,930386839,19225963,0,2265463,"ADMISSIONS, HOUSING, FOOD SERVICE AND MANAGEMENT & GENERAL."
201931349349305608,430743910,155535,32955,"Athletics: Providing varsity sports programs, NCCAA Division 2 athletics, including Men's & Women's Basketball."
202011969349305016,951690977,879727,729345,Other program service revenues also include residents housing and miscellaneous tuition and education income.
202041959349303504,135562308,2203112937,14694872,781355763,STUDENT SERVICES; STUDENT AID; LIBRARY; AND OPERATION AND MAINTENANCE OF PLANT.
202031979349306413,160743996,5240770,OTHER PROGRAM SERVICES
202001439349301870,931040479,425742,"MAPOF AND ADVANCED CERTIFICATE DEGREES OFFERED WITH APPROXIMATELY 70 STUDENTS, WEEKEND WORKSHOPS, AND A FOUR WEEK INTENSIVE CLASS WITH APPROXIMATELY 30 STUDENTS. TOTAL NUMBER OF STUDENTS IS APPROXIMATELY 100."
202041349349302854,231352635,23458071,203561,25078076,"AUXILIARY OPERATIONS: ACADEMIC SUPPORT, RESEARCH, PUBLIC SERVICE, AND INSTITUTIONAL SUPPORT."
202021919349302017,560529933,8777423,"STUDENT SERVICES; ENROLLMENT SERVICES, FINANCIAL AID, POST OFFICE, CO-CURRICULAR ACTIVITIES IN STUDENT LIFE, AND COLLEGIATE ATHLETICS (NCAA DIVISION II WITH 8 MEN'S VARSITY TEAMS AND 8 WOMEN'S VARSITY TEAMS)."
202042039349300854,480554341,567457,135475,OPERATIONS AND MAINTENANCE OF FACILITY
202021619349301317,751596658,1213768,105188,605121,"THER PROGRAM SERVICES-OTHER PROGRAM SERVICES INCLUDE PARKER'S MASSAGE THERAPY PROGRAM, AND CHIROPRACTIC RESEARCH."
202040299349301204,420680466,389270,"PUBLIC SERVICE: OFFERINGS TO THE BROADER COMMUNITY INCLUDE A COLLEGE RADIO STATION, CONFERENCES AND SEMINARS, A PERFORMING ARTS SERIES AND A VARIETY OF PROGRAMS IN THE ARTS, ATHLETICS, SCIENCES, AND LEADERSHIP DEVELOPMENT FOR HIGH SCHOOL STUDENTS."
202040299349301204,420680466,385790,"RESEARCH: THE COLLEGE RECEIVES GRANTS FOR FACULTY/STUDENT RESEARCH COLLABORATION, PARTICULARLY IN THE SCIENCES. THE COLLEGE DEDICATES SPACE, RESOURCES, AND FACULTY TIME FOR COLLABORATIVE INVESTIGATION WITH STUDENTS. RESEARCH PROJECTS ACROSS THE CURRICULUM OCCUR DURING THE ACADEMIC YEAR AND IN THE SUMMER."
202001349349302850,383071514,6172210,1148300,969756,"OTHER UNIVERSITY EXPENSES INCLUDE, BUT ARE NOT LIMITED TO AUXILIARY SERVICES, RESEARCH, MAINTENANCE OF GROUNDS AND BUILDINGS, AND PUBLIC SERVICES."
202020569349301472,410747165,OTHER PROGRAM SERVICES INCLUDE OPERATIONS AND MAINTENANCE OF PLANT AND INSTITUTIONAL SUPPORT. THESE PROGRAMS PROVIDE SERVICES TO OPERATE AND MAINTAIN BUILDINGS AND GROUNDS AND TO SUPPORT INSTITUTIONAL OPERATIONS OTHER THAN MANAGEMENT AND GENERAL.
202031309349300108,237225104,914645,0,1563970,"CONCERTS AND HALL RENTALS: OTHER PROGRAM SERVICES INCLUDE EXPENSES RELATED TO OVER 1,000 FREE NEC CONCERTS PERFORMED BY STUDENTS, FACULTY AND GUEST ARTISTS PER YEAR AND EXPENSES FOR CONCERTS AT NEC PERFORMED BY OUTSIDE ORGANIZATIONS. THESE OUTSIDE ORGANIZATIONS PAY NEC HALL RENTAL FEES AND OTHER ASSOCIATED RENTAL COSTS, SUCH AS SECURITY AND LIGHTING/TECHNICAL SERVICES, RELATED TO THEIR PERFORMANCES."
202031939349300723,231352689,6751,21931,"Upholding the Truth, LLC or ""UTT""The purpose of UTT is to study, promote, and advance the truth and ethics of a biblically consistent worldview in all spheres of life and when appropriate, to do so with allied individuals, groups, and organizations that are committed to the same perspective. Representative projects include an annual conference devoted to the intersection of science and faith."
202031939349300723,231352689,73215,144240,"Student HousingWTS offers limited housing for up to 21 students at our Church Road campus in Glenside: 11 male students in Machen Hall; 5 male students in SeokNam House; and 5 women students in the Church Road Gate House. In addition, WTS owns 5 condominiums at 1600 Church Road in Wyncote, Pennsylvania and can house up to 1 student plus his/her family of either gender. These are intended to help the international student."
202001209349301605,521010577,249301,42026,COMMUNITY EDUCATION: COMMUNITY EDUCATION AND CONTINUING EDUCATION PROGRAMS ARE PROVIDED TO THE GENERAL PUBLIC AND ALUMNI.
202001089349300505,141468399,386510,0,1099986,"OTHER SOURCES OF INCOME SUCH AS COMMUNITY EDUCATION, SUMMER CAMPS, AND INDIRECT COST RECOVERY."
202021839349301637,410684657,478849,0,205566,"WORKSITE WELLNESS - CONSISTENT WITH ITS MISSION TO PROMOTE HEALTH AND WELLNESS IN THE COMMUNITY AND TO SUPPORT THE PROFESSIONS FOR WHICH IT TRAINS STUDENTS, THE UNIVERSITY BEGAN A PROGRAM OF WORKSITE WELLNESS SERVICES IN SEPTEMBER 2015. UNDER THAT PROGRAM, THE UNIVERSITY CONTRACTED WITH AN UNRELATED CORPORATION TO PROVIDE WORKSITE CHIROPRACTIC AND WELLNESS SERVICES TO THE CORPORATION'S EMPLOYEES AT THREE OF ITS MANUFACTURING FACILITIES."
201913199349310616,237001501,1130042,22200,812562,PROVIDE RESEARCH BASED AND VALIDATED ASSESSMENT TOOLS FOR BOTH THE OVERALL CLASSROOM AND INDIVIDUAL STUDENTS AND CONFERENCES IN THE FIELD OF EARLY CHILDHOOD EDUCATION.
202021629349301692,310536647,8421878,"STUDENT SERVICES: AT CEDARVILLE, WE ARE A"
202021629349301692,310536647,COMMUNITY OF BELIEVERS ACCOUNTABLE TO ONE
202021629349301692,310536647,"ANOTHER, CALLED TO REFLECT THE CHARACTER OF"
202021629349301692,310536647,JESUS CHRIST AND TO BE OBEDIENT TO HIS WORD.
202021629349301692,310536647,WE WILL BE FAITHFUL IN OUR SUPPORT FOR THE
202021629349301692,310536647,LOCAL CHURCH AND IN OUR PRACTICE OF SPIRITUAL
202021629349301692,310536647,DISCIPLINES. WE WILL PRACTICE BIBLICAL
202021629349301692,310536647,"PRINCIPLES OF ENCOURAGEMENT, EXHORTATION,"
202021629349301692,310536647,AND RECONCILIATION. WE COMMIT OURSELVES
202021629349301692,310536647,"TO INTEGRITY, KINDNESS, PURITY, AND"
202021629349301692,310536647,SELF-CONTROL AND TO CONTINUAL GROWTH IN
202021629349301692,310536647,"SCHOLARSHIP, LEADERSHIP, AND SERVICE."
202031049349300833,570474291,2108198,95534,"Academic Support:The University library (approximately 250,000 volumes held) is support for the principal academic divisions. The L. Mendel Rivers Library includes a coffeehouse, Java City, on the main floor and a study lounge on the second floor. Java City features an espresso bar, fresh-baked pastries and desserts. Charleston Southern University students may access the Internet within limitations to facilitate diversity and personal growth in technology, informational research skills, and communication skills. Access is provided free of charge to all students in the computer labs and library except for pre-determined lab fees that are required for some classes. Access in the residence halls is provided free of charge to all registered resident students. We continue to increase the number of e-books and electronic databases as move of the academic literature is becoming available online rather than in printed format. The L. Mendel Rivers Library is open until midnight through the week for students to study individually or in groups; the Reference Desk remains staffed in person and online for student assistance and our library staff are all credentialed and granted faculty status. The Library is also open to the public during normal operating hours."
202010849349300101,610444708,2324763,80371,THE UNIVERSITY PROVIDES AUXILIARY SERVICES FOR STUDENTS AND FACULTY. THESE SERVICES INCLUDE FOOD SERVICES AND RESIDENCE HALL ACTIVITIES.
202031359349303738,840404231,47271047,0,61619570,"2018-2019 ACADEMIC YEAR: THE AUXILLARY ENTERPRISES AT THE UNIVERSITY OF DENVER EXIST TO FURNISH GOODS OR SERVICES TO STUDENTS, FACULTY, STAFF, INSTITUTIONAL DEPARTMENTS AND THE PUBLIC. THE MOST PROMINENT OF THESE ENTERPRISES PROVIDE SUPPORT TO OUR STUDENTS WHICH INCLUDES; A UNIVERSITY HEALTH CENTER AND RESIDENCE AND FOOD FACILITIES. THE UNIVERSITY ALSO HAS A PERFORMING ARTS CENTER THAT HOSTS PERFORMANCES BY THE FACULTY AND STUDENTS OF THE UNIVERSITY AND THE REGION'S FINEST PERFORMING ARTS ORGANIZATIONS. A SMALL CONFERENCE AND EVENTS SERVICES DEPARTMENT ROUNDS OUT THE UNIVERSITY'S AUXILARY ENTERPRISE ACTIVITIES."
202031359349303738,840404231,33945277,0,39370900,"THE UNIVERSITY OF DENVER FACULTY MEMBERS RECEIVED SUBSTANTIAL FUNDING FROM GOVERNMENTAL AND PRIVATE SOURCES TO SUPPORT THEIR SCHOLARSHIP. THE UNIVERSITY HAS LONG PROMOTED A TEACHER/SCHOLAR MODEL FOR ITS FACULTY, ENCOURAGING PROFESSIONS TO EXCEL IN THE CLASSROOM AND IN RESEARCH. MUCH OF THE FACULTY SCHOLARSHIP CONTRIBUTES TO THE UNIVERSITY OF SERVING THE PUBLIC GOOD."
202021199349301122,540505922,11203475,0,0,"Includes student services which consists of enrollment services, registrar, health and counseling services, student activities, sports, and recreation."
202021199349301122,540505922,4316346,0,0,"Includes academic support which consists of the University's library, art gallery, academic advising, career services, and other support services for the academic divisions."
202041339349302559,410693970,28259410,3374618,"OTHER PROGRAM SERVICES: ACADEMIC SUPPORT PROVIDED TO THE UNIVERSITY COMMUNITY INCLUDING LIBRARY FACILITIES, ACADEMIC ADVISING, AND THE FACULTY DEVELOPMENT CENTER. THE UNIVERSITY PROVIDES PUBLIC SERVICES INCLUDING THE SENIOR CITIZEN CENTER, LOAVES AND FISHES, SERVICE LEARNING, AND VISION TRIPS. THE UNIVERSITY ALSO PROVIDES OTHER PROGRAMS TO FURTHER THEIR EDUCATIONAL PURPOSES."
202000599349300830,610444650,11227190,1625785,"ACADEMIC SUPPORT - INCLUDES EXPENDITURES FOR THE ACADEMIC VICE PRESIDENT AND DEAN OF FACULTY'S OFFICE, LIBRARY, MEDIA SERVICES, STUDENT LAPTOP COMPUTER PROGRAM, AND OTHER RELATED ACTIVITIES THAT SUPPORT THE INSTRUCTIONAL MISSION OF THE COLLEGE."
202000599349300830,610444650,9976495,9472182,RESIDENCE HALLS AND DINING SERVICE FOR STUDENTS.
202000599349300830,610444650,5139758,3584298,STUDENT INDUSTRIES COST OF OPERATIONS (EXCLUDING COST OF SALES) WHICH PROVIDE LABOR OPPORTUNITIES FOR STUDENTS.
202000599349300830,610444650,2978961,2988536,3200000,"STUDENT AID-EXPENDITURES FOR SCHOLARSHIPS, GRANTS AND AWARDS TO STUDENTS. EXPENSES REPORTED INCLUDE PRIMARILY DIRECT STUDENT AID TO ASSIST WITH ROOM AND BOARD, BOOKS AND SUPPLIES. IN ADDITION, ALL DEGREE-SEEKING BEREA COLLEGE STUDENTS RECEIVE A FULL-TUITION SCHOLARSHIP, ALSO KNOWN AS A COST OF EDUCATION SCHOLARSHIP, THAT IS FUNDED PRIMARILY FROM THE SPENDABLE RETURN FROM THE ENDOWMENT. THE AMOUNT OF FULL-TUITION SCHOLARSHIPS FOR THE FISCAL YEAR WAS $70,310,600. THESE EXPENSES ARE PRIMARILY INCLUDED IN THE AREAS OF INSTRUCTION, STUDENT SERVICES, ACADEMIC SUPPORT, ETC."
202002309349303565,132905207,OPERATES A COLLEGE LEVEL SCHOOL WITH A POSTGRADUATE PROGRAM
201903189349303195,620789275,180545,"Other program services consist of other fees, Federal Work Study reimbursement, and miscellaneous revenues."
202000929349300905,042199867,6846790,192541,0,ACADEMIC SUPPORT
202030929349300223,756001300,7202304,14054519,"AUXILIARY SERVICES - IN ORDER TO PROMOTE INTEGRATION OF FAITH AND LEARNING IN THE ACADEMIC SETTING, DBU PROVIDES AUXILIARY SERVICES TO OUR STUDENTS IN THE FORM OF RESIDENCE HALLS, APARTMENTS, TOWNHOMES AND DINING SERVICES. THESE SERVICES CREATE A COMFORTABLE ENVIRONMENT FOR ACADEMIC PURSUITS WHILE FOSTERING A SENSE OF COMMUNITY AMONG OUR STUDENT POPULATION, ENRICH THE COLLEGE EXPERIENCE AND PROVIDE LEADERSHIP OPPORTUNITIES TO SERVE THE ON-CAMPUS STUDENT BODY."
202041959349303889,030179592,5228965,1434481,3740858,"The Experiment in International Living - World Learning's founding program has been offering immersive cross-cultural exchanges, fun and thought-provoking adventures, and experiential learning programs since 1932. Today, EIL provides three-to-five-week summer programs for high school students in over 25 countries worldwide. The program's mission: create meaningful, dynamic experiences for students eager to challenge themselves and engage their sense of global citizenry. Each program is an authentic journey challenging participants to develop a close connection with the people and culture of another country. Through home stays, community service, language training, outdoor adventure, art, and experiential learning, students build leadership and communication skills, gain essential international experience, increase self-confidence, and enhance global awareness. The Experiment has introduced more than 70,000 young people to international issues. Annually, over $1.5 million in scholarships are funded by the philanthropic generosity of former Experimenters and other World Learning supporters. Learn more at https://www.experiment.org/."
