object_id,ein,ExpnsAmt,GrntAmt,RvnAmt,Dsc
201903199349319925,363196629,"CHRONIC DISEASE. THE HOSPITAL IMPLEMENTS THE TRANSITION SUPPORT PROGRAM, A PROGRAM THAT FOLLOWS-UP WITH DISCHARGED PATIENTS EXPERIENCING CHRONIC DISEASES AND FREQUENT READMISSION HISTORIES (READMITTED WITHIN 30 DAYS AFTER DISCHARGE FOR ALL CAUSES). THE PROGRAM UTILIZES VOLUNTEERS TO SUPPORT PATIENTS IN KEEPING FOLLOW-UP APPOINTMENTS AFTER DISCHARGE AS A FIRST STEP IN CHRONIC DISEASE MANAGEMENT. HOSPITAL VOLUNTEERS MEET WITH PATIENTS, ASSIST WITH MAKING A FOLLOW-UP APPOINTMENT AND MAKE REMINDER CALLS. THE PROGRAM, WHICH BEGAN IN 2017, HAS NOW SERVED 4,416 INPATIENTS AND OUTPATIENTS, INCLUDING PROVIDING REFERRALS.MENTAL HEALTH FIRST AID (MHFA). MHFA IS AN EVIDENCE-BASED 8-HOUR TRAINING PROGRAM DESIGNED TO PROVIDE EDUCATION, REDUCE STIGMA AND PROVIDE TRAINEES WITH TOOLS AND RESOURCES TO ASSIST SOMEONE EXPERIENCING MENTAL HEALTH ISSUES OR A CRISIS. THE PROGRAM IS BEING OFFERED TO TARGETED COMMUNITY MEMBERS WITHIN THE PRIMARY SERVICE AREA. COMMUNITIES TARGETED FOR THIS INTERVENTION WERE SELECTED BY USING 2015 HEALTHY COMMUNITIES INSTITUTE DATA THAT IDENTIFIES ZIP CODES WITH HIGHER UTILIZATION OF MENTAL HEALTH SERVICES. THE TRAININGS WILL FOCUS ON LEADERS IN THOSE COMMUNITIES, INCLUDING FAITH LEADERS, TEACHERS AND COACHES. TWO HIGH NEED AREAS HAVE BEEN IDENTIFIED AND FIVE, EIGHT-HOUR TRAININGS WERE OFFERED IN 2018. EMPLOYMENT. ADVOCATE ILLINOIS MASONIC SERVES AS A SITE FOR THE HEALTHCARE WORKFORCE COLLABORATIVE. THIS PROJECT RECRUITS, TRAINS AND HIRES COMMUNITY MEMBERS SEEKING EMPLOYMENT OPPORTUNITIES IN THE HEALTHCARE INDUSTRY. EMPLOYMENT OPPORTUNITIES FOCUS ON ADVOCATE ILLINOIS MASONIC, OTHER ADVOCATE HEALTH CARE LOCATIONS AND HEALTH CARE PROVIDERS IN THE COMMUNITY. AN INCUMBENT WORKER STRATEGY (NAVIGATE) IS OFFERED TO THE FRONT-LINE WORKFORCE AT ADVOCATE ILLINOIS MASONIC WHICH INCLUDES SOFT-SKILLS TRAINING, TOOLS AND RESOURCES TO HELP EXISTING STAFF DEVELOP A CAREER LADDER PATH. ADVOCATE ILLINOIS MASONIC COLLABORATES WITH COMMUNITY ORGANIZATIONS TO RECRUIT AND TRAIN COMMUNITY MEMBERS. BOTH PROGRAMS FOCUS ON IMPROVING CAREER OPPORTUNITIES FOR INDIVIDUALS FROM LOW-INCOME ZIP CODES WITHIN THE MEDICAL CENTER'S SERVICE AREA.GOAL B: UNDERTAKE OR SUPPORT INITIATIVES THAT ENHANCE ACCESS TO HEALTH CARE, PREVENTION AND WELLNESS SERVICES ACROSS THE LIFESPAN AND WITHIN THE DIVERSE COMMUNITIES ADVOCATE SERVES.IN ADDITION TO ADVOCATE ILLINOIS MASONIC'S VERY GENEROUS CHARITY CARE PROGRAM AS PREVIOUSLY DESCRIBED IN PART III, PROGRAM SERVICE ACCOMPLISHMENTS, LINE 4.A, THE MEDICAL CENTER HAS MANY PROGRAMS AND SERVICES DEVOTED TO PREVENTION AND WELLNESS, AND THAT IMPROVE ACCESS TO CARE, FOR WHICH SOME SPECIFIC EXAMPLES FOLLOW. FIRST ACCESS. GIVEN THE HIGH NUMBER OF ADMISSIONS AND EMERGENCY DEPARTMENT (ED) VISITS FOR BEHAVIORAL HEALTH CONDITIONS AT ADVOCATE ILLINOIS MASONIC AND THE HIGH NUMBER OF DISCHARGED PATIENTS THAT WERE NOT KEEPING THEIR OUTPATIENT FOLLOW-UP APPOINTMENTS, THE HOSPITAL'S BEHAVIORAL HEALTH SERVICES DEPARTMENT CREATED THE FIRST ACCESS PROGRAM IN 2013. THE GOAL OF FIRST ACCESS IS TO PROVIDE IMMEDIATE ACCESS TO FOLLOW-UP BEHAVIORAL HEALTH SERVICES TO SUPPORT RECOVERY AND PREVENT RELAPSES. THROUGH FIRST ACCESS, BEHAVIORAL HEALTH ED PATIENTS, AS WELL AS PATIENTS REFERRED BY THE HOSPITAL'S INPATIENT PSYCHIATRIC UNIT, MEDICAL FLOORS AND PHYSICIANS, ARE LITERALLY WALKED OVER TO OUTPATIENT CARE BY A STAFF MEMBER TO ENSURE SAME DAY FOLLOW-UP FOR OUTPATIENT APPOINTMENTS. SINCE ITS IMPLEMENTATION, FIRST ACCESS HAS CONSISTENTLY INCREASED BEHAVIORAL HEALTH PATIENTS' APPOINTMENT FOLLOW-THROUGH RATES FROM 40 PERCENT IN 2013 TO OVER 90 PERCENT IN 2018. IN A 2018 SAMPLE REPRESENTATIVE POPULATION, 91 PERCENT SHOWED DECREASED ED UTILIZATION FROM PRE-FIRST ACCESS TO POST-FIRST ACCESS. IN 2018, FIRST ACCESS INTERVENTIONS DEMONSTRATED AT LEAST AN 80% DECREASE IN DEPRESSION SYMPTOMS AMONG THE FIRST ACCESS POPULATION.LANGUAGE ASSISTANCE/INTERPRETER SERVICES. ADVOCATE ILLINOIS MASONIC PROVIDES CARE FOR PATIENTS FROM MANY DIFFERENT ETHNIC AND CULTURAL BACKGROUNDS. IN ORDER TO MEET THE UNIQUE COMMUNICATION NEEDS OF POPULATIONS ACCESSING CARE AT THE MEDICAL CENTER, ADVOCATE ILLINOIS MASONIC EMPLOYS SPANISH, POLISH AND AMERICAN SIGN LANGUAGE INTERPRETERS TO PROVIDE INTERPRETATION SERVICES AS NEEDED. IN ADDITION, AS WITH ALL HOSPITALS IN THE SYSTEM, ADVOCATE ILLINOIS MASONIC OFFERS TELEPHONIC AND/OR VIDEO INTERPRETING IN MORE THAN 200 LANGUAGES.MEDICATION ASSISTANCE PROGRAM. THE MEDICATION ASSISTANCE PROGRAM PROVIDES FINANCIAL AS WELL AS RESOURCE NAVIGATION HELP TO PATIENTS WHO ARE UNABLE TO AFFORD THEIR MEDICATION. MEDICAL CENTER STAFF WORK WITH PHARMACEUTICAL COMPANIES TO OBTAIN MEDICATIONS AT NO OR LOW COSTS FOR PATIENTS AS WELL AS FINANCIALLY SUPPORTING THE PURCHASE OF SOME MEDICATIONS. IN 2018, ADVOCATE ILLINOIS MASONIC ASSISTED 750 PATIENTS THROUGH THIS PROGRAM.DISASTER COORDINATION. ADVOCATE ILLINOIS MASONIC'S EMERGENCY MEDICAL SERVICES STAFF TRAIN CITY AND PRIVATE AMBULANCE AND FIRE DEPARTMENT PARAMEDICS. AS ONE OF ONLY ELEVEN HOSPITALS IN ILLINOIS DESIGNATED AS A RESOURCE HOSPITAL COORDINATOR CENTER (RHCC), THE MEDICAL CENTER IS RESPONSIBLE FOR COORDINATING MEDICAL RESPONSE WITHIN A DENSELY POPULATED REGION OF CHICAGO. THIS INCLUDES COORDINATING EMERGENCY MEDICAL RESPONSE EFFORTS AT MAJOR EVENTS, SUCH AS THE CHICAGO MARATHON AND DURING VISITS OF NATIONAL AND INTERNATIONAL LEADERS. THE HOSPITAL ALSO SERVES AS THE LEAD HOSPITAL FOR DISASTERS OCCURRING IN CHICAGO, INCLUDING O'HARE AIRPORT.SPECIAL NEEDS DENTISTRY PROGRAM. THE GOAL OF THE SPECIAL NEEDS DENTISTRY PROGRAM AT ADVOCATE ILLINOIS MASONIC IS TO IMPROVE ACCESS TO ORAL HEALTH FOR CHILDREN AND ADULTS WITH SPECIAL NEEDS. THE PROGRAM PROVIDES ORAL HEALTH CARE TO PATIENTS WITH DEVELOPMENTAL DISABILITIES INCLUDING DOWN SYNDROME, CEREBRAL PALSY AND SEIZURE DISORDER. SPECIAL NEEDS PATIENTS AND THEIR FAMILIES MAY OVERLOOK ESSENTIAL DENTAL CARE IN THE FACE OF MORE URGENT HEALTH NEEDS. MANY DENTISTS LACK THE TRAINING, RESOURCES AND/OR SUPPLIES NEEDED TO EFFECTIVELY SERVE SPECIAL NEEDS PATIENTS AND, AS A RESULT, MANY PEOPLE WITH DISABILITIES LACK ACCESS TO EVEN BASIC ROUTINE DENTAL CARE. PATIENTS WITH SPECIAL NEEDS ALSO MAY NOT UNDERSTAND THE NEED FOR DENTAL CARE OR COOPERATE WHILE A DENTIST TRIES TO EXAMINE THE MOUTH AND TEETH. IN ADDITION, TO TREATING PATIENTS IN THE DENTAL CENTER, THE SPECIAL NEEDS DENTISTRY PROGRAM PROVIDES OUTREACH SCREENING SERVICES AT SITES THAT SUPPORT PERSONS WITH DEVELOPMENTAL DISABILITIES. IN 2018, THERE WERE 2,589 PATIENT VISITS THAT SERVED 187 CHILDREN AND 2,402 ADULTS WITH SPECIAL NEEDS. MORE THAN 300 INDIVIDUALS WITH SPECIAL NEEDS WERE SCREENED AT SHORE TRAINING CENTER, CHICAGO LIGHTHOUSE FOR THE BLIND, SHORE LOIS LLOYD CENTER AND VICTOR C. NEUMANN ASSOCIATION. GOAL C: POSITIVELY AFFECT THE HEALTH STATUS AND QUALITY OF LIFE OF INDIVIDUALS AND POPULATIONS IN COMMUNITIES SERVED BY ADVOCATE THROUGH EVIDENCE-BASED PROGRAMS, ADDRESSING IDENTIFIED NEEDS AND A COMMITMENT TO HEALTH EQUITY.BABY FRIENDLY HOSPITAL. ADVOCATE ILLINOIS MASONIC IS CERTIFIED AS BABY FRIENDLY, A DESIGNATION FROM THE WORLD HEALTH ORGANIZATION RECOGNIZING THE HIGHEST LEVEL OF SUPPORT FOR BREASTFEEDING MOTHERS AND BABIES. THIS DESIGNATION AND RELATED PRACTICES ARE A STRONG STEP FORWARD IN ADDRESSING THE CITY'S CHILDHOOD OBESITY EPIDEMIC. PROVIDING INFANTS WITH HUMAN MILK GIVES THEM THE MOST COMPLETE NUTRITION POSSIBLE BECAUSE IT PROVIDES THE BEST MIX OF NUTRIENTS FOR EACH BABY TO THRIVE. THE BABY FRIENDLY DESIGNATION, WHICH IS GRANTED BY BABY-FRIENDLY USA, RECOGNIZES THE MEDICAL CENTER'S SUCCESS AT PROVIDING AN OPTIMAL LEVEL OF SUPPORT FOR BREASTFEEDING MOTHERS AND BABIES. THE DESIGNATION WAS ACHIEVED AFTER A RIGOROUS FOUR-PHASE PROCESS CULMINATING WITH COMPREHENSIVE ON-SITE EVALUATION. SCIENTIFIC STUDIES HAVE SHOWN THAT BREASTFED CHILDREN HAVE FAR FEWER AND LESS SERIOUS ILLNESS THAN THOSE WHO NEVER RECEIVED BREAST MILK, INCLUDING A REDUCED RISK OF SIDS, CHILDHOOD CANCER AND DIABETES.DEAF AND HARD OF HEARING PROGRAM. THROUGH A SPECIAL PROGRAM IN 2018, ADVOCATE ILLINOIS MASONIC PROVIDED MENTAL HEALH CARE IN AMERICAN SIGN LANGUAGE TO 87 PATIENTS THAT ARE DEAF, HARD OF HEARING OR DEAF-BLIND CHILDREN, ADOLESCENTS OR ADULTS. THE MEDICALLY INTEGRATED CRISIS COMMUNITY SUPPORT (MICCS) PROGRAM. THE MICCS PROGRAM IS A SERVICE WHICH FOLLOWS ACUTELY BEHAVIORALLY ILL PATIENTS, A PORTION OF WHOM ARE HOMELESS, WHO HAVE A COMORBID PHYSICAL ILLNESS OR ADDICTION, AND A PATTERN OF SEEKING PRIMARY AND BEHAVIORAL HEALTH CARE IN THE ED, INPATIENT PSYCHIATRIC UNIT OR MEDICAL UNIT OF COMMUNITY HOSPITALS. THE MULTIDISCIPLINARY TEAM WORKING WITH THE CLIENTS IS COMPRISED OF CLINICIANS, CLERGY AND OTHER ASSOCIATES WHO ARE IN DAILY CONTACT WITH THE CLIENTS. IN 2018, THE TEAM ASSISTED 165 CLIENTS WITH THEIR INDIVIDUAL NEEDS SUCH AS HOUSING AND MEDICATION STABILIZATION. THE PROGRAM HAS CONSISTENTLY DECREASED EMERGENCY DEPARTMENT UTILIZATION FOR THE CLIENTS SERVED."
201903199349319925,363196629,"MOBILE DENTAL VAN. THE MOBILE DENTAL VAN PROGRAM AT ADVOCATE ILLLINOIS MASONIC MEDICAL CENTER PROVIDES ACCESS TO ORAL HEALTH SERVICES FOR UNDERSERVED AND UNINSURED INDIVIDUALS. THE GOAL OF THE MOBILE DENTAL VAN IS TO IMPROVE THE ORAL HEALTH OF VULNERABLE POPULATIONS, SUCH AS LOW-INCOME CHILDREN AND FAMILIES, HOMELESS INDIVIDUALS, OLDER ADULTS AND PERSONS WITH SPECIAL NEEDS. SERVICES PROVIDED INCLUDE PREVENTIVE CARE, RESTORATIVE TREATMENT AND ORAL SURGERY. THE MOBILE DENTAL VAN SEES PATIENTS FIVE DAYS PER WEEK. IN 2018, THE PROGRAM SERVED 18 SITES INCLUDING HIGH SCHOOLS, ELEMENTARY SCHOOLS, ORGANIZATIONS THAT SERVE THE HOMELESS, COMMUNITY HEALTH CENTERS, AS WELL AS ORGANIZATIONS THAT SERVE INDIVIDUALS WITH MENTAL ILLNESS, DEVELOPMENTAL DISABILITIES, AND SENIORS. IN 2018, THE PROGRAM SERVED 654 UNIQUE PATIENTS, PROVIDING 1,558 PATIENT VISITS AND PROVIDING 3,428 SERVICES.PEDIATRIC DEVELOPMENT CENTER. APPROPRIATE DIAGNOSIS OF DEVELOPMENTAL CHALLENGES IS CRITICAL TO ASSISTING THESE INDIVIDUALS IN LIVING THEIR ""BEST"", MOST HEALTHY LIFE. THIS PROGRAM DIAGNOSES CHILDREN AND ADOLESCENTS FROM BIRTH TO AGE 18 WHO FACE DEVELOPMENTAL CHALLENGES. POST-DIAGNOSIS, THE PROGRAM PROVIDES SPECIALIZED TREATMENT PROGRAMS AS WELL AS TRAINING, EDUCATION AND SUPPORT FOR THE ENTIRE FAMILY, INCLUDING ""SIBSHOPS"" FOR SIBLINGS OF DEVELOPMENTALLY DISABLED CHILDREN.SCHOOL-BASED HEALTH CENTERS. ADVOCATE ILLINOIS MASONIC PROVIDES CLINICAL PSYCHOLOGISTS TO SCHOOL-BASED HEALTH CENTERS AT AMUNDSEN AND LAKEVIEW HIGH SCHOOLS IN CHICAGO TO ASSIST IN SUPPORTING THE MENTAL HEALTH OF STUDENTS. THERE WERE 3,334 GROUP ENCOUNTERS AND AN ADDITIONAL 1,223 INDIVIDUAL MEETINGS WITH STUDENTS IN 2018. THE STAFF OF THE HEALTH CENTER WORKS WITH THE CHICAGO PUBLIC SCHOOL STAFF SO THE STUDENT DOES NOT HAVE TO MISS A HALF DAY OF SCHOOL FOR AN APPOINTMENT WITH A CLINICIAN OUTSIDE OF SCHOOL. NAVIGATION SUPPORT FOR PATIENTS WITH CHALLENGES NAVIGATING HEALTH SERVICES: THE TRANSITION SUPPORT PROGRAM (TSP) IS A NAVIGATION SERVICE THAT ASSISTS WITH THE COORDINATION OF FOLLOW-UP CARE. PRIOR TO THE PROJECT, ADVOCATE ILLINOIS MASONIC'S COMMUNITY HEALTH COUNCIL IDENTIFIED CHRONIC DISEASE MANAGEMENT AS A KEY HEALTH DISPARITY FOR ITS PRIMARY SERVICE AREA. THE COMMUNITY HEALTH NEEDS ASSESSMENT CONCLUDED THAT PATIENTS IN THE MEDICAL CENTER'S PRIMARY SERVICE AREA WITH CHRONIC ILLNESSES EXPERIENCE SIGNIFICANT BARRIERS NAVIGATING THE HEALTH CARE SYSTEM, INCLUDING BARRIERS RELATED TO REFERRALS, APPOINTMENTS, INSURANCE, TRANSPORTATION, LANGUAGE AND MEDICATION ACCESS. BY PROVIDING STRENGTH-BUILDING AND CULTURALLY- AND LINGUISTICALLY-COMPETENT NAVIGATION OF A COMPLEX HEALTH CARE SYSTEM, THE TSP AIMS TO REDUCE READMISSIONS AND EMERGENCY ROOM VISITS AND IMPROVE CARE TRANSITIONS ACROSS THE CONTINUUM FOR PATIENTS AND FAMILIES, REGARDLESS OF INSURANCE OR CIRCUMSTANCE. THE PROGRAM, WHICH BEGAN IN 2017, HAS NOW SERVED 2,446 PATIENTS IN 2018, INCLUDING PROVIDING REFERRALS.FIRST EPISODE PSYCHOSIS (FEP): FIRST EPISODE PSYCHOSIS WORKS WITH YOUNGER PEOPLE SUFFERING FROM THE ONSET OF PSYCHOSIS. IT IS OF SIGNIFICANT BENEFIT TO THESE INDIVIDUALS BECAUSE ITS GOAL IS TO ENSURE THAT THE PSYCHOSIS DISEASE IS CAUGHT AND MANAGED EARLY, SO THAT THE PATIENTS CAN LEAD NORMAL LIVES INSTEAD OF BECOMING DISABLED AND RELYING ON ER/INPATIENT PSYCH IN THE FUTURE. THERE WERE 49 PATIENTS SERVED IN 2018.GOAL D: EXAMINE AND ADDRESS IN PARTNERSHIP WITH OTHERS THE ROOT CAUSES OF HEALTH INEQUITIES IN ADVOCATE COMMUNITIES INCLUDING, BUT NOT LIMITED TO, UNEMPLOYMENT, LACK OF EDUCATION, POVERTY, ENVIRONMENTAL INJUSTICE AND RACISM.SERVICES FOR THE LGBTQ COMMUNITY. PROVIDING A SAFE, WELCOMING (COMFORTABLE) AND LGBTQ-AFFIRMING (FRIENDLY) HEALTH CARE ENVIRONMENT IS PART OF THE EMBRACING CULTURE AT ADVOCATE ILLINOIS MASONIC, LOCATED IN THE HEART OF CHICAGO'S LAKEVIEW NEIGHBORHOOD, ONE OF THE LARGEST LGBTQ COMMUNITIES IN THE MIDWEST. THE MEDICAL CENTER'S PROACTIVE PUSH FOR EQUALITY IS HELPING TO CLOSE THE HEALTH CARE DISPARITIES FACED BY THE LGBTQ COMMUNITY ACROSS CHICAGO AND BEYOND. ADVOCATE ILLINOIS MASONIC HAS BEEN NAMED A LEADER IN LGBTQ HEALTH CARE EQUALITY BY THE HUMAN RIGHTS CAMPAIGN'S HEALTHCARE EQUALITY INDEX FOR 12 YEARS, BEGINNING IN 2008. NONDISCRIMINATORY HEALTH CARE IS A RIGHT, AND THE MEDICAL CENTER STRIVES TO DELIVER EQUAL TREATMENT TO ALL PEOPLE, NO MATTER THEIR SEXUAL ORIENTATION OR GENDER PREFERENCES. COMPREHENSIVE, COMPASSIONATE CARE FOR LGBTQ PATIENTS IS GUARANTEED AT THE MEDICAL CENTER BY ALL OF THE MEDICAL CENTER'S PHYSICIANS, MANY OF WHOM HAVE RECEIVED SPECIAL TRAINING IN CARING SPECIFICALLY FOR THE LGBTQ COMMUNITY AND THE UNIQUE ISSUES IT FACES.PARTNERSHIP WITH HOWARD BROWN/SEXUAL HARM RESPONSE PROJECT. ADVOCATE ILLINOIS MASONIC'S EMERGENCY DEPARTMENT PARTNERED WITH HOWARD BROWN HEALTH CLINIC TO DEVELOP AND OFFER THE FIRST LGBTQ SPECIFIC SEXUAL ASSAULT RESPONSE PROGRAM IN THE NATION. THE ED STAFF HAVE BEEN TRAINED BY HOWARD BROWN AND PROVIDE THE EMERGENCY CARE. HOWARD BROWN PROVIDES COUNSELING AND CREATES A LINKAGE TO THE HOSPITAL SO THAT ALL VICTIMS FEEL SAFE.GOAL E: LEVERAGE RESOURCES AND MAXIMIZE COMMUNITY ENGAGEMENT BY BUILDING AND STRENGTHENING COMMUNITY PARTNERSHIPS WITH HEALTH DEPARTMENTS AND OTHER DIVERSE COMMUNITY ORGANIZATIONS.PARTNERSHIP WITH THE MEDICAL ORGANIZATION FOR LATINO ADVANCEMENT (MOLA). TARGETING LATINO AT-RISK YOUTH, ADVOCATE ILLINOIS MASONIC IN PARTNERSHIP WITH MOLA PROVIDES OUTREACH IN HEALTH EDUCATION AND SCREENING IN UNDERSERVED AREAS OF CHICAGO. THE MEDICAL CENTER ALSO IN PARTNERING WITH MOLA PROVIDES MEDICAL EDUCATION OPPORTUNITIES FOR UNDERREPRESENTED LATINO/LATINA STUDENTS INTERESTED IN HEALTH CARE CAREERS, AS WELL AS OPPORTUNITIES FOR INTERNATIONAL MEDICAL GRADUATES TO GAIN VALUABLE USA HOSPITAL EXPERIENCE THROUGH VARIOUS RESOURCE AND VOLUNTEER PROGRAMS (I.E., TRANSITION SUPPORT PROGRAM).GOAL F: PROMOTE ACCOUNTABILITY FOR SYSTEM AND SITE ALIGNMENT BY INCREASING PROGRAM COORDINATION AND DEVELOPING STRONG GOVERNANCE RELATIONSHIPS.STRENGTHENED GOVERNANCE RELATIONSHIPSCOMMUNITY HEALTH COUNCIL. ADVOCATE ILLINOIS MASONIC'S COMMUNITY HEALTH PROGRAMMING IS OVERSEEN BY A COMMUNITY HEALTH COUNCIL MADE UP OF DIVERSE PARTNERS FROM THE COMMUNITY AS DESCRIBED EARLIER UNDER GOAL A. THE COUNCIL OVERSEES THE ONGOING COMMUNITY HEALTH NEEDS ASSESSMENT PROCESS, WHICH INVOLVES EXAMINATION OF HOSPITAL AND COMMUNITY DATA AND SURVEYS TO IDENTIFY AND ANALYZE COMMUNITY HEALTH NEEDS. GOVERNING COUNCIL. AS WITH THE OTHER HOSPITALS IN THE ADVOCATE HEALTH CARE SYSTEM, THE ADVOCATE ILLINOIS MASONIC CHNA REPORT, AND ITS COMMUNITY HEALTH IMPLEMENTATION PLAN STRATEGY, IS ENDORSED BY ITS GOVERNING COUNCIL. HOSPITAL PLANS ARE ALSO SHARED PERIODICALLY WITH THE MEDICAL CENTER'S LEADERSHIP TEAM, THE SYSTEM LEVEL EXECUTIVE MANAGEMENT TEAM AND WITH ADVOCATE HEALTH CARE'S MISSION AND SPIRITUAL CARE COMMITTEE OF THE BOARD. ALIGNMENT OF SITE AND SYSTEM COMMUNITY HEALTH STRATEGYCOMMUNITY HEALTH DEPARTMENT. WITH DEVELOPMENT OF A SYSTEM-LEVEL COMMUNITY HEALTH DEPARTMENT FOR ADVOCATE HEALTH CARE IN 2016, ADVOCATE ILLINOIS MASONIC'S COMMUNITY HEALTH STAFF NOW REPORT TO ADVOCATE'S VICE PRESIDENT OF COMMUNITY HEALTH AND FAITH OUTREACH. COMMUNITY HEALTH STAFF FROM ALL ADVOCATE HOSPITALS ALSO MEET MONTHLY TO PLAN COMMUNITY HEALTH STRATEGIES. THE FOCUS OF THE NEW DEPARTMENT WAS TO COMPLETE AND POST THE HOSPITAL CHNA'S IN 2016, INCLUDING GAINING APPROVAL OF STRATEGIES TO ADDRESS IDENTIFIED HEALTH PRIORITY NEEDS MOVING FORWARD WITH A FOCUS ON HEALTH INEQUITY. THIS IS THE FOUNDATION ON WHICH THE HOSPITALS' IMPLEMENTATION PLANS WERE DEVELOPED.GOAL G: PROMOTE THE TRAINING OF FUTURE HEALTH PROFESSIONALS. NURSING EDUCATION. ADVOCATE ILLINOIS MASONIC'S NURSE RESIDENCY PROGRAM IS AN EVIDENCE-BASED, 15-WEEK PRECEPTED ORIENTATION AND A 12-MONTH RESIDENCY PROGRAM FOR NEWLY LICENSED REGISTERED NURSES (NLRN). THE GOAL OF THE PROGRAM IS TO ENHANCE NLRN PROFESSIONAL DEVELOPMENT AND INCREASE ORGANIZATIONAL ENGAGEMENT SO THAT THE NLRN PROVIDES SAFE AND CONFIDENT CARE TO PATIENTS. THE MEDICAL CENTER PROVIDED 3 CLASSES (COHORTS) IN 2018. ALTHOUGH THIS PROGRAM IS NOT INCLUDED IN THE FINANCIAL NUMBERS FOR HEALTH PROFESSIONAL'S EDUCATION, THIS PROGRAM INCREASES ADVOCATE NURSES' PROFICIENCY AND SKILLS FOR CURRENT AND FUTURE NURSING ROLES. IN ADDITION TO THE NURSE RESIDENCY PROGRAM, THE MEDICAL CENTER TRAINS NURSING STUDENTS (NON-RESIDENT) FROM FIVE AREA COLLEGES/UNIVERSITIES FOR WHICH STAFF TEACHING TIME IS REPORTED AS COMMUNITY BENEFIT."
201903199349319925,363196629,"HEALTHY FAMILIES. THE ADVOCATE ILLINOIS MASONIC HEALTHY FAMILIES PROGRAM IS A SUPPORT PROGRAM FOR YOUNG PARENTS, PROVIDING INTENSIVE HOME VISITING SERVICES FOR AT-RISK FAMILIES. THE PROGRAM MODEL IS ROOTED IN THE BELIEF THAT EARLY, NURTURING RELATIONSHIPS ARE THE FOUNDATION FOR LIFE-LONG, HEALTHY DEVELOPMENT. THE PROGRAM PROVIDES THREE KEY SERVICES: 1) FREE PRENATAL CLASSES OPEN TO THE COMMUNITY; 2) DOULA SERVICES PROVIDING HOME VISITS AND ON-CALL LABOR/DELIVERY SUPPORT; AND 3) PARENT COACHING HOME VISITATION FOR UP TO THE FIRST THREE YEARS OF A CHILD'S LIFE. ALL SERVICES ARE GRANT-FUNDED, FREE TO THE COMMUNITY AND AVAILABLE IN ENGLISH/SPANISH. IN ADDITION TO THE MANY PROGRAMS AND SERVICES LISTED ABOVE, THE MEDICAL CENTER OFFERS A MYRIAD OF OTHER COMMUNITY SERVICES INCLUDING: HUMAN BREAST MILK DEPOT; BIKE HELMET FITTING EVENTS; THE BETTER BREATHERS CLUB (ASSISTS COMMUNITY MEMBERS WITH RESPIRATORY ISSUES); QUARTERLY BLOOD DRIVES; CAR SEAT SAFETY CHECKS; PROVISION OF MEETING SPACE FOR COMMUNITY ORGANIZATIONS; CPR, CHOKING AND BLEEDING CONTROL TRAININGS FOR THE COMMUNITY; INCONTINENCE SEMINARS; CONTENT TARGETED GOLDEN AGE SENIOR SEMINARS; SEMINARS FOR CHICAGO HOUSING AUTHORITY RESIDENTS ON VARIOUS HEALTH ISSUES; STROKE EDUCATION SEMINARS; AND MULTIPLE DISEASE SPECIFIC SUPPORT GROUPS.THE MEDICAL CENTER ALSO CONTINUES TO ADDRESS THE FOLLOWING KEY HEALTH ISSUES.HEART DISEASE. GIVEN THAT HEART DISEASE IS THE SECOND LEADING CAUSE OF DEATH IN THE HOSPITAL'S PRIMARY SERVICE AREA, ADVOCATE ILLINOIS MASONIC ESTABLISHED A HEART AND VASCULAR INSTITUTE. AS ONE OF THE AREA'S FIRST MEDICAL CENTERS TO PERFORM OPEN HEART SURGERY, ADVOCATE ILLINOIS MASONIC OFFERS A COMPLETE RANGE OF STATE-OF-THE-ART CARDIAC SERVICES. MEDICAL CENTER STAFF ALSO PARTICIPATE IN ILLINOIS HEART RESCUE, A PROGRAM THAT SEEKS TO IMPROVE OUT-OF-HOSPITAL SURVIVAL RATES RELATED TO CARDIAC ARREST. CANCER. THE CRETICOS CANCER CENTER, LOCATED ON THE ADVOCATE ILLINOIS MASONIC CAMPUS, UNITES ALL CANCER CARE AND RESEARCH UNDER ONE ROOF FOR MORE EFFICIENT AND PERSONALIZED PLANNING AND TREATMENT. THE CENTER OFFERS A WEALTH OF SERVICES TO ADDRESS THE UNIQUE NEEDS OF CANCER PATIENTS THROUGHOUT THE CONTINUUM OF CARE. THE CENTER FOR ADVANCED CARE, WHICH OPENED IN 2015, ENABLED ADVOCATE ILLINOIS MASONIC TO EXPAND AND CENTRALIZE OUTPATIENT SURGERY, DIGESTIVE HEALTH AND CANCER SERVICES INTO ONE LOCATION, CREATING IMPROVED ACCESS TO CARE, CONTINUITY AMONG DISCIPLINES, ENHANCED EFFICIENCIES AND A BETTER OVERALL EXPERIENCE FOR PATIENTS AND THEIR FAMILIES. AT ADVOCATE ILLINOIS MASONIC, THERE IS AN EXTENSIVE RANGE OF CANCER SUPPORT SERVICES, INCLUDING BILINGUAL SPANISH/ENGLISH PSYCHOSOCIAL SUPPORT, COUNSELING AND FINANCIAL NAVIGATION. NURSE NAVIGATORS PROVIDE LINKAGE WITH COMMUNITY PROGRAMS, PHYSICAL MEDICINE, REHABILITATION, PAIN MANAGEMENT SERVICES, PALLIATIVE CARE, HOSPICE AND HOME CARE PROGRAMS. THE CENTER HOSTS THE AMERICAN CANCER SOCIETY'S LOOK GOOD, FEEL BETTER PROGRAM. EACH YEAR AT THE MEDICAL CENTER, THE AMBER FOUNDATION FACILITATES THE SPONSORSHIP OF FREE MAMMOGRAMS, COUNSELING AND EDUCATION REGARDING BREAST CANCER TARGETING THE POLISH COMMUNITY IN CHICAGO. THE CANCER CENTER PROVIDES A LUNG SCREENING PROGRAM AND A DIRECT ACCESS SCREENING PROGRAM FOR COLORECTAL CANCER. THE DIRECT ACCESS PROGRAM ALLOWS PATIENTS TO SCHEDULE COLONOSCOPIES WITHOUT FIRST HAVING A FACE-TO-FACE CONSULTATION WITH A GASTROENTEROLOGIST.PRIMARY STROKE CENTER. COMMUNITY ENGAGEMENT WITHIN THE STROKE PROGRAM IS A KEY INITIATIVE. ADVOCATE ILLINOIS MASONIC PARTNERS WITH MANY ORGANIZATIONS TO ENSURE OUTREACH EDUCATION IS PROVIDED FOR ALL AGES AS STROKE CAN HAPPEN AT ANY AGE. OUR PARTNERSHIPS INCLUDE NURSING HOMES, ASSISTED LIVING COMMUNITIES, CHICAGO HOUSING AUTHORITY COMMUNITIES (>50 AT RISK POPULATIONS); HEALTH FAIRS; AND EDUCATION DAYS WITH THE CHICAGO FIRE DEPARTMENT AND THE CHICAGO POLICE DEPARTMENT. A FEW EVENTS THAT THE MEDICAL CENTER ATTENDED ARE AHA/ASA CYCLE NATION, AHA HEART AND STROKE WALK, BLACK WOMEN'S EXPO, LATINO GAY FESTIVAL AND MANY OTHERS. IN 2018, APPROXIMATELY 1,100 INDIVIDUALS WERE REACHED THROUGH ADVOCATE ILLINOIS MASONIC'S PRIMARY STROKE CENTER PROGRAMS. THE OUTREACH AND EDUCATION PROGRAMS INCLUDE: STROKE RISK SCREENING; STROKE IDENTIFICATION AND TREATMENT EDUCATION; AND WELLNESS SCREENINGS/TALKS (BLOOD PRESSURE, DIET, MANAGING OBESITY, SMOKING CESSATION).CANCER SUPPORT PROGRAMS. THE MEDICAL CENTER WORKS CLOSELY WITH THE ILLINOIS BREAST AND CERVICAL CANCER PROGRAM TO ENSURE THAT UNINSURED WOMEN HAVE ACCESS TO SCREENING AND TREATMENT FOR BREAST OR CERVICAL CANCER. ADVOCATE ILLLINOIS MASONIC ALSO HAS A BREAST CANCER SUPPORT GROUP FOR LATINAS AND IS DEVELOPING A CANCER SUPPORT GROUP FOR THE LGBTQ COMMUNITY."
202030839349300558,530199507,7909011,112582,175697,RESEARCH
202030839349300558,530199507,4939098,3561,1165902,PUBLIC SERVICES
202010869349300601,580593414,6746067,355759,"STUDENT SERVICES: FUNDS EXPENDED FOR INNOVATIVE PROGRAMS AND SERVICES WHICH CHALLENGE STUDENTS CULTURALLY, ATHLETICALLY AND SPIRITUALLY. THE COLLEGE STRIVES TO RECRUIT AND RETAIN EXCELLENT STUDENTS AND EMPOWER THEM TO REACH THEIR FULL POTENTIAL. THESE EXPENDITURES PROVIDE SUPPORT FOR EXTRACURRICULAR ACTIVITIES AND STUDENT RELATED SERVICES AT THE COLLEGE WHICH ARE ESSENTIAL TO THE STUDENTS' WELL BEING AND CONTRIBUTE TO THE QUALITY OF LIFE OUTSIDE THE FORMAL ACADEMIC PROGRAMS. ALSO, EXPENDITURES FOR STUDENT INVOLVEMENT IN PROJECTS THAT IMPACT THE LOCAL COMMUNITY ARE INCLUDED."
202010869349300601,580593414,7102338,8433312,"AUXILIARY SERVICES: FUNDS EXPENDED FOR MEAL SERVICES AND THE OPERATION, REPAIR AND MAINTENANCE OF THE COLLEGE'S RESIDENCE HALLS, CAMPUS CENTER AND DINING HALL, AND RECREATION FACILITY."
202011059349301911,750926755,2008033,61718,1776605,NEUHOFF SCHOOL OF MINISTRY
202011059349301911,750926755,8734888,125192,860750,OTHER
202020349349301102,362662739,5504045,2277800
202041429349301504,590704726,6746400,1434013,STUDENT SERVICES: STUDENTS ARE INVOLVED IN A VARIETY OF CULTURAL AND SOCIAL PROGRAMS TO ENRICH THEIR EDUCATIONAL EXPERIENCES. SUPPORT FOR STUDENTS WITH LEARNING AND PHYSICAL DISABILITIES ARE ALSO PROVIDED. VARIOUS COMPUTER LABS AND A 24-HOUR LIBRARY ARE OPEN TO ALL STUDENTS TO SUPPORT THEIR EDUCATIONAL EXPERIENCE. BETHUNE-COOKMAN UNIVERSITY ALSO HAS A ROTC OFFICE AVAILABLE TO STUDENTS.
202021369349305222,540505990,57625860,51400828,"STUDENT SERVICES - ALL OFFICES WHICH RENDER SERVICES TO THE EMOTIONAL WELL-BEING OF OUR STUDENTS: VICE PRESIDENT FOR STUDENT AFFAIRS, DEAN OF ADMISSIONS, REGISTRAR, TESTING, ETC."
202001339349302120,350868107,13577476,19263371,"COMMUNITY SERVICES IS THE PUBLIC SERVICE ARM OF THE UNIVERSITY. IT CONSISTS OF PROVIDING SERVICE TO THE COMMUNITY AT LARGE, ESPECIALLY PROVIDING SERVICES FOR THE AGING THROUGH THE CENTER FOR AGING AND COMMUNITY. THROUGH GRANT AND CONTRACTS WITH THE STATE AND PRIVATE AGENCIES, ASSISTANCE AND TRAINING IS PROVIDED FOR THE AGING BOTH IN QUALITY OF LIVING AND STAYING ENGAGED IN THE WORKFORCE. AUXILIARY SERVICES CONSIST MAINLY OF THE HOUSING AND DINING FACILITIES THAT SERVE STUDENTS ON CAMPUS. THE MAIN FUNCTION IS TO PROVIDE A HEALTHY AND PLEASANT ENVIRONMENT TO ENHANCE THE STUDENTS' ACADEMIC AND SOCIAL NEEDS."
202021969349303432,430743910,130146,17593,"Athletics: Providing varsity sports programs, NCCAA Division 2 athletics, including Men's & Women's Basketball."
202001399349300870,310537177,6251444
202010729349300801,410695527,8276201,"INSTITUTIONAL SUPPORT, INCLUDING OPERATION OF PLANT AND DEPRECIATION"
201922899349301302,850197752,250746,0,0,Ser National implements various education programs throughout the year.
202011199349301501,420680344,1697172,1697164,GOVERNMENT-SPONSORED TRIO PROGRAMS - EXPENSES OF FEDERAL GRANT PROGRAM
