object_id,ein,LqdtnOfAsstsDtl_AsstsDstrOrExpnssPdDsc,LqdtnOfAsstsDtl_DstrbtnDt,LqdtnOfAsstsDtl_FrMrktVlOfAsstAmt,LqdtnOfAsstsDtl_MthdOfFMVDtrmntnTxt,BsnssNm_BsnssNmLn1Txt,USAddrss_AddrssLn1Txt,USAddrss_CtyNm,USAddrss_SttAbbrvtnCd,USAddrss_ZIPCd
202023299349300432,510581154,"CASH NONINTEREST BEARING, PLEDGES AND GRANTS RECEIVABLE, PREPAID EXPENSES AND DEFERRED CHARGES, BUILDINGS AND EQUIPMENT, ACCUMULATED DEPRECIATION, ACCOUNTS PAYABLE AND ACCRUED EXPENSES, DUE TO AFFILIATES, AND LONG-TERM DEBT.",2019-12-31,1680448,COST,472892698,ALLIANCE COLLEGE-READY PUBLIC SCHOOLS FKA ALLIANCE MARINE - INNOVATION,601 S FIGUEROA STREET 4TH FLOOR,LOS ANGELES,CA,90017,501(C)(3)
202100429349200300,454563243,PAYOFF LOAN,2020-06-30,1000,CASH,PAUL UHLIG,1227 N RIVER BLVD,WICHITA,KS,67203
202100429349200300,454563243,DONATION,2020-06-30,1360,CASH,UNIVERSITY OF KANSAS,1450 JAYHAWK BLVD,LAWRENCE,KS,66045
202033299349300503,943477000,"CASH NONINTEREST BEARING, PLEDGES AND GRANTS RECEIVABLE, PREPAID EXPENSES AND DEFERRED CHARGES, BUILDINGS AND EQUIPMENT, ACCUMULATED DEPRECIATION, ACCOUNTS PAYABLE AND ACCRUED EXPENSES, DUE TO AFFILIATES, AND LONG-TERM DEBT.",2019-12-31,4423412,COST,472892698,ALLIANCE COLLEGE-READY PUBLIC SCHOOLS FKA ALLIANCE MARINE - INNOVATION,601 S FIGUEROA STREET 4TH FLOOR,LOS ANGELES,CA,90017,501(C)(3)
202101009349200530,522441035,CLOSED OUT THE OPERATIONS OF THE NON PROFIT,2020-11-30,141958264,MANASSAS MUSLIM ASSOCIATION,PO BOX 697,MANASSAS,VA,20113,501C3
202130139349200343,205649821,ACCOUNTS RECEIVABLE,2020-12-19,26284,ACV,741742036,AUSTIN COMMUNITY COLLEGE,5930 MIDDLE FISKVILLE RD,AUSTIN,TX,78752,GOVERNMENT
202011979349300726,042452884,"THE COLLEGE SOLD ITS EQUIPMENT AND FIXTURES WITH A NBV OF $1,501,618 TO THE PUBLIC FOR $230,898.",2019-06-30,230898,PROCEEDS RECEIVED FOR DISPOSAL OF EQUIPMENT AND FIXTURES,VARIOUS - VARIOUS ADDRESSES,1309 BEACON STREET,BROOKLINE,MA,02446
202141319349302724,202834636,"ASSETS, LIABILITIES & NET ASSETS",2020-06-30,4270265,BOOKS & RECORDS,953522679,LOMA LINDA UNIVERSITY MEDICAL CENTER INC,11234 ANDERSON ST,LOMA LINDA,CA,92354,501(C)3
202111339349305271,464993761,CASH,2020-06-30,26747,311425735,CAMPUS PARTNERS FOR COMMUNITY URBAN REDEVELOPMENT,1556 N HIGH ST,COLUMBUS,OH,43201,501C(3)
202111339349305271,464993761,CASH,2020-06-30,36509,316025986,THE OHIO STATE UNIVERSITY,410 W 10TH AVE,COLUMBUS,OH,43210,501C(3)
202111339349305271,464993761,CASH,2020-06-30,13537,316025986,THE OHIO STATE UNIVERSITY,100 W 18TH AVE,COLUMBUS,OH,43210,501C(3)
202111339349305271,464993761,CASH,2020-06-30,2051,311458153,SCIENCE & TECHNOLOGY CAMPUS CORPORATION,1275 KINNEAR RD,COLUMBUS,OH,43212,501C(3)
202121379349305807,061614887,EQUIPMENT AND OTHER ASSETS USED TO PROVIDE DISTANCE EDUCATION,2019-07-01,78749863,BOOK VALUE,060646701,QUINNIPIAC UNIVERSITY,275 MOUNT CARMEL AVE,HAMDEN,CT,06518,501(C)(3)
202033299349301103,943477005,"CASH NONINTEREST BEARING, PLEDGES AND GRANTS RECEIVABLE, PREPAID EXPENSES AND DEFERRED CHARGES, BUILDINGS AND EQUIPMENT, ACCUMULATED DEPRECIATION, ACCOUNTS PAYABLE AND ACCRUED EXPENSES, DUE TO AFFILIATES, AND LONG-TERM DEBT.",2019-12-31,590828,COST,472892698,ALLIANCE COLLEGE-READY PUBLIC SCHOOLS FKA ALLIANCE MARINE - INNOVATION,601 S FIGUEROA STREET 4TH FLOOR,LOS ANGELES,CA,90017,501(C)(3)
202101059349301665,370661217,VARIOUS REMAINING ASSETS DISTRIBUTED IN TERMINATION,2020-05-31,2955869,CASH
202033189349305873,453247157,"N/A, ZERO ASSETS",2019-12-31,-1
202130829349300018,475684669,NOT APPLICABLE,2020-01-01,COMPARABLES,NONE,100,MARIETTA,GA,30060,INDIVIDUAL
202012559349300536,841123408,CASH,2019-12-23,91425,FAIR MARKET VALUE OF CASH BEFORE DISTRIBUTION.,421354468,THE OKINAGA FOUNDATION,446 N WOODLAND ST,ENGLEWOOD,NJ,07631,501(C)(3)
202100859349301535,510174094,All via merger,2020-12-31,7107837,GAAP,620485733,Lipscomb University,One University Park Dr,Nashville,TN,37204,501(c)(3)
202131329349304293,462558352,SCHOOL CLOSED. ALL LIABILITIES PAID OUT AND REMAINING CASH RETURNED TO STATE OF OHIO DEPARTMENT OF EDUCATION.,2020-06-30,0,AUDIT REPORT,OHIO DEPARTMENT OF EDUCATION,25 SOUTH FRONT STREET,COLUMBUS,OH,432154183
