object_id,ein,FrmAndLnRfrncDsc,ExplntnTxt
201403179349302875,610444780,"Form 990, Part VI, Sec B, Line 15b, Process to establish compensation of other employees","THE UNIVERSITY PRESIDENT, PROVOST AND HUMAN RESOURCES MANAGER REVIEW AND DETERMINE THE COMPENSATION OF THE OTHER OFFICERS AND KEY EMPLOYEES USING CUPA SALARY SCALES AND OTHER RELEVANT ECONOMIC AND INDUSTRY DATA. DOCUMENTATION OF DELIBERATIONS WERE RETAINED IN EACH RELEVANT MEETING'S NOTES. PROCESS WAS LAST CONDUCTED IN JUNE 2014."
201403179349302875,610444780,"Form 990, Part VI, Sec C, Line 19, Required documents available to the public","FINANCIAL STATEMENTS, GOVERNING DOCUMENTS, AND CONFLICT OF INTEREST POLICIES ARE NOT REQUIRED DISCLOSURES PURSUANT TO INTERNAL REVENUE CODE (IRC) SECTION 6104."
201403179349302875,610444780,"Form 990 , Part XI, Line 9, Other changes in net assets or fund balances",CHANGE IN VALUE OF SPLIT INTEREST AGREE - 2993; CHANGE IN VALUE OF SWAP AGREEMENT - 171528;
201403219349205260,463187118,"Form 990EZ, Part I, Line 16",INTERNET/WED EXP. 54. BANK SERVICE CHARGES 40. AMORTIZATION 139.
201403219349205260,463187118,"Form 990EZ, Part II, Line 24",INCORPORATION COST 861.
201403219349309665,650216638,FORM 990 - ORGANIZATION'S MISSION,"KEISER UNIVERSITY AND EVERGLADES UNIVERSITY ARE REGIONALLY ACCREDITED PRIVATE CAREER UNIVERSITIES THAT PROVIDE EDUCATIONAL PROGRAMS AT THE UNDERGRADUATE AND GRADUATE LEVELS FOR A DIVERSE STUDENT BODY IN TRADITIONAL, NONTRADITIONAL AND ONLINE DELIVERYFORMATS. THE MAIN CAMPUS IS LOCATED IN FORT LAUDERDALE, WITH CAMPUSES LOCATED THROUGHOUT THE STATE OF FLORIDA AND INTERNATIONALLY. THROUGH QUALITY TEACHING, LEARNING AND RESEARCH, THE UNIVERSITY IS COMMITTED TO PROVIDE STUDENTS WITH OPPORTUNITIES TO DEVELOP THE KNOWLEDGE, UNDERSTANDING AND SKILLS NECESSARY FOR SUCCESSFUL EMPLOYMENT. COMMITTED TO A ""STUDENTS FIRST"" PHILOSOPHY, KEISER UNIVERSITY PREPARES GRADUATES FOR CAREERS IN BUSINESS, CRIMINAL JUSTICE, HEALTH CARE, TECHNOLOGY, HOSPITALITY, EDUCATION AND CAREER-FOCUSED STUDIES. THE MISSION OF EVERGLADES UNIVERSITY IS TO PROVIDE QUALITY EDUCATION TO ADULT LEARNERS OF DIVERSE BACKGROUNDS IN A COLLABORATIVE ENVIRONMENT WHERE EACH INDIVIDUAL HAS THE OPPORTUNITY TO ACHIEVE PERSONAL GROWTH. THE UNIVERSITY SEEKS TO ACCOMPLISH ITS MISSION BY COMBINING SMALL CLASS SIZES AND INNOVATIVE PROGRAMS WITH TRADITIONAL ACADEMIC VALUES. THE UNIVERSITY SUPPORTS THE ACADEMIC ENDEAVOR THROUGH RESEARCH, SCHOLARLY CONTRIBUTION, AND SERVICE TO DELIVER GRADUATE AND UNDERGRADUATE PROGRAMS ON CAMPUS AND ONLINE."
201403219349309665,650216638,FORM 990,"IN 2013, EVERGLADES COLLEGE HAD 3,496 PARTICIPANTS IN THE PEO WHICH IS RESPONSIBLE FOR REPORTING ON ALL W-2'S AND THE W-3 FOR THE COLLEGE. THE NAME OF THE PROFESSIONAL EMPLOYER ORGANIZATION IS OASIS OUTSOURCING. FORM 990, PART III, LINE 2 NEW PROGRAM SERVICES ADDED IN 2013: 1. BA IN BUSINESS ANALYTICS 2. PHD IN CURRICULUM AND INSTRUCTION 3. MSED IN EDUCATION, ALLIED HEALTH TEACHING AND LEADERSHIP 4. MSED IN EDUCATION, ONLINE TEACHING AND LEARNINGS 5. BS IN EXERCISE SCIENCE 6. AA IN GENERAL STUDIES 7. MA IN HOMELAND SECURITY 8. AA IN HOSPITALITY 9. MSED, MBA JOINT MASTER OF SCIENCE IN EDUCATION - MASTER OF BUSINESS ADMINISTRATION 10. MS IN NURSING, FAMILY NURSE PRACTITIONER 11. MS IN ORGANIZATIONAL PSYCHOLOGY 12. BA IN POLITICAL SCIENCE 13. BS IN SOCIAL MEDIA COMMUNICATIONS"
201403219349309665,650216638,"FORM 990, PAGE 6, PART VI, LINE 11B","THE 990 IS REVIEWED BY THE BOARD, PRESIDENT , VICE PRESIDENT, TREASURER AND LEGAL COUNSEL PRIOR TO FILING."
201403219349309665,650216638,"FORM 990, PAGE 6, PART VI, LINE 12C","OFFICERS, DIRECTORS, TRUSTEES AND KEY EMPLOYEES ARE QUESTIONED ON POTENTIAL CONFLICTS OF INTEREST. THIS REVIEW IS PERFORMED BY THE OFFICE OF THE CHANCELLOR."
201403219349309665,650216638,"FORM 990, PAGE 6, PART VI, LINE 15A",THE PRESIDENT'S COMPENSATION IS DISCUSSED AND APPROVED ANNUALLY WITH THE COMPENSATION COMMITTEE. THERE ARE APPROVED SALARY RANGES FOR ALL POSITIONS AS WELL AS AN ANNUAL REVIEW PROCESS. THE BOARD APPROVES THE SALARY RANGES EACH YEAR.
201403219349309665,650216638,"FORM 990, PAGE 6, PART VI, LINE 15B",THERE ARE APPROVED SALARY RANGES FOR ALL POSITIONS AS WELL AS AN ANNUAL REVIEW PROCESS. THE BOARD APPROVES THE SALARY RANGES EACH YEAR.
201403219349309665,650216638,"FORM 990, PAGE 6, PART VI, LINE 19","UPON REQUEST, THE FINANCIAL INFORMATION IS AVAILABLE UNDER THE SUNSHINE LAWS OF THE STATE OF FLORIDA."
201403219349309665,650216638,"FORM 990, PART XI, LINE 9","SCHOLOARSHIP REVENUE INCLUDED ON RETURN -35,637,890 SCHOLARSHIP EXPENSE INCLUDED ON RETURN 35,637,890"
201403179349303890,830434307,"FORM 990, PART VI, SECTION B, LINE 11",A DRAFT OF THE RETURN IS PROVIDED TO THE BOARD PRIOR TO ITS FILING.
201403179349303890,830434307,"FORM 990, PART VI, SECTION B, LINE 15",COMPENSATION PACKAGES FOR THE COLLEGE'S PRESIDENT AND ALL OTHER OFFICERS AND KEY EMPLOYEES IS DECIDED UPON BY AN INDEPENDENT COMPENSATION COMMITTEE. COMPARABILITY DATA IS OBTAINED AND REVIEWED. DELIBERATIONS AND DECISIONS ARE CONTEMPORANEOUSLY DOCUMENTED.
201403179349303890,830434307,"FORM 990, PART VI, SECTION C, LINE 19",ALL DOCUMENTS ARE AVAILABLE TO THE PUBLIC UPON REQUEST.
201403179349303890,830434307,"FORM 990, PART XII, LINE 2C:",THE AUDIT COMMITTEE OF THE BOARD OF DIRECTORS SELECTS THE INDEPENDENT ACCOUNTANT AND OVERSEES THE AUDIT.
201403219349302460,311813143,"FORM 990, PART I, LINE I, DESCRIPTION OF ORGANIZATION MISSION:","IMPLEMENTATION, AND COORDINATION OF SPONSORED RESEARCH AND NEW TECHNOLOGIES AT THE UNIVERSITY OF MISSISSIPPI IN THE FUTHERANCE OF THE UNIVERSITY'S EDUCATIONAL OBJECTIVES."
201403219349302460,311813143,"FORM 990, PART VI, SECTION A, LINE 6:",THE SOLE MEMBER OF THE FOUNDATION IS THE CHANCELLOR OF THE UNIVERSITY OF MISSISSIPPI.
201403219349302460,311813143,"FORM 990, PART VI, SECTION B, LINE 11:",SENT VIA E-MAIL TO CURRENT BOARD MEMBERS FOR REVIEW PRIOR TO SUBMISSION TO THE IRS.
201403219349302460,311813143,"FORM 990, PART VI, SECTION B, LINE 12C:",THE ORGANIZATION REGULARLY AND CONSISTENTLY MONITORS AND ENFORCES COMPLIANCE WITH THE CONFLICT OF INTEREST POLICY BY HAVING THE BOARD OF DIRECTORS ANNUALLY SIGN/ATTEST TO THE POLICY. THE POLICY STATES THAT THE BOARD MEMBERS MUST DISCLOSE ANY CONFLICTS OF INTEREST. PERSONS WITH A CONFLICT ARE PROHIBITED FROM PARTICIPATING IN THE DELIBERATIONS AND DECISIONS REGARDING THE TRANSACTIONS.
201403219349302460,311813143,"FORM 990, PART VI, SECTION B, LINE 15:","THE ORGANIZATION HAS NO EMPLOYEES. ALL LABOR IS PROVIDED FROM THE UNIVERSITY OF MISSISSIPPI, A RELATED ORGANIZATION AS DEFINED IN FORM 990 SCHEDULE R INSTRUCTIONS. THE UNIVERSITY OF MISSISSIPPI PERFORMS THE PROPER REVIEWS AS NECESSARY."
201403219349302460,311813143,"FORM 990, PART VI, SECTION C, LINE 19:",THESE DOCUMENTS ARE AVAILABLE UPON REQUEST AND ON OUR WEBSITE.
201403219349302460,311813143,"FORM 990, PART XII, LINE 2C:",PROCESS HAS NOT CHANGED FROM PRIOR YEAR.
201403149349302850,420730347,"FORM 990, PART I, LINE 6:VOLUNTEERS","VOLUNTEERS ARE MADE UP OF BOARD MEMBERS, GUEST CLASSROOM LECTURERS, PRECEPTORS FOR CLINICAL ROTATION AND STUDENT VOLUNTEERS FOR COMMUNITY SERVICE ACTIVITIES."
201403149349302850,420730347,"FORM 990, PART VI, SECTION B, LINE 11","BEFORE FORM 990 IS FILED, AN ELECTRONIC COPY IS MADE AVAILABLE TO ALL BOARD MEMBERS ON THE BOARD OF TRUSTEES' PORTAL. THE AUDIT AND COMPLIANCE COMMITTEE VOTES TO APPROVE FILING OF THE 990 PRIOR TO SUBMISSION."
201403149349302850,420730347,"FORM 990, PART VI, SECTION B, LINE 12C","IN ACCORDANCE WITH THE UNIVERSITY'S CONFLICT OF INTEREST POLICY, ALL PERSONS IN GOVERNANCE AND EXECUTIVE POSITIONS WITH THE UNIVERSITY COMPLETE AND SIGN A CONFLICT OF INTEREST DISCLOSURE STATEMENT ANNUALLY AND DISCLOSE ANY NEW POTENTIAL CONFLICTS AS THEY DEVELOP. FOR MEMBERS OF THE BOARD, THE AUDIT AND COMPLIANCE COMMITTEE REVIEWS THE DISCLOSURE STATEMENTS AND IMPLEMENTS THE POLICY. FOR MANAGEMENT PERSONNEL, THE DISCLOSURE STATEMENTS ARE ANNUALLY REVIEWED BY THE PRESIDENT AND CHIEF COMPLIANCE OFFICER. IF THERE ARE ANY MATTERS OF CONCERN, THIS INFORMATION WILL BE COMMUNICATED TO THE AUDIT AND COMPLIANCE COMMITTEE. ADDITIONALLY, THE UNIVERSITY'S EXTERNAL AUDIT FIRM REVIEWS THE DISCLOSURE STATEMENTS AS PART OF THEIR ANNUAL AUDIT AND REPORTS FINDINGS TO THE AUDIT AND COMPLIANCE COMMITTEE OF THE BOARD. A CONFLICT OF INTEREST EXISTS (1) WHEN AN INDIVIDUAL OBTAINS OR APPEARS TO OBTAIN AN IMPROPER GAIN OR ADVANTAGE AS A RESULT OF HIS/HER ACTIVITIES ON BEHALF OF THE UNIVERSITY, (2) WHEN HIS/HER ACTIVITIES ADVANCE OR APPEAR TO ADVANCE HIS/HER OWN INTERESTS OR THOSE OF ANOTHER RATHER THAN THE INTERESTS OF THE UNIVERSITY, OR (3) WHEN HIS/HER ACTIONS ADVERSELY AFFECT OR APPEAR TO ADVERSELY AFFECT THE BEST INTERESTS OF THE UNIVERSITY. INDIVIDUALS SHALL NOT PARTICIPATE IN DISCUSSIONS, VOTES, OR OTHER REPRESENTATIONS ON PREVIOUSLY DISCLOSED OR NEWLY DEVELOPED CONFLICTS OF INTEREST."
201403149349302850,420730347,"FORM 990, PART VI, SECTION B, LINE 15","THE ORGANIZATION HAS A METHOD AND PROCESS WHICH INCLUDES GATHERING COMPARATIVE DATA FROM EXTERNAL SOURCES FOR RATING POSITIONS AND DETERMINING COMPENSATION. SALARY RANGES HAVE BEEN ESTABLISHED FOR ALL UNIVERSITY POSITIONS BASED ON MARKET VALUE. IN INSTANCES WHERE SUFFICIENT COMPARATIVE DATA IS NOT AVAILABLE, THE ORGANIZATION UTILIZES MEMBERSHIP IN AN EMPLOYER'S ASSOCIATION WHICH PROVIDES HUMAN RESOURCES SERVICES IN SEVERAL AREAS INCLUDING HR CONSULTING, COMPENSATION, AND COMPLIANCE. THE EXECUTIVE COMMITTEE REVIEWS SALARIES AND RANGES OF OFFICERS AND KEY EMPLOYEES IN MAY FOR SALARIES EFFECTIVE THE FOLLOWING JULY 1ST. FOR THE UNIVERSITY PRESIDENT/CEO, THE EXECUTIVE COMMITTEE SERVES AS THE COMPENSATION COMMITTEE AND EVALUATES THE PRESIDENT'S CONTRACT AND ASSOCIATED SALARY BASED UPON COMPARABLE DATA AND ESTABLISHED RANGES. THE PERFORMANCE EVALUATION IS AN IMPORTANT COMPONENT OF THE EVALUATION PROCESS. THE BOARD OF TRUSTEES APPROVES PRESIDENT'S CONTRACT AND SALARY BASED UPON COMPARABLE DATA AND PRESIDENT'S PERFORMANCE EVALUATION."
201403149349302850,420730347,"FORM 990, PART VI, SECTION C, LINE 19",AUDIT REPORT IS MADE AVAILABLE ONLINE THROUGH THE MUNICIPAL SECURITIES RULEMAKING BOARD WEBSITE FOR ELECTRONIC MUNICIPAL MARKET ACCESS. GOVERNING DOCUMENTS AND CONFLICT OF INTEREST POLICY ARE NOT AVAILABLE TO THE PUBLIC.
201403149349302850,420730347,"FORM 990, PART XI, LINE 9:","UNREALIZED GAIN ON BOND INTEREST RATE SWAP -32,794. LOSSES ON UNCOLLECTIBLE PLEDGES -351,409."
201402269349300205,136192377,"Form 990, Part III, Line 4d: Other Program Services Description","OTHER PROGRAM SERVICES 4: student aid is awarded based on academic achievement, financial need and other similar standards. The College evaluates student eligibility at the end of each semester for the following term and also before disbursement of financial aid."
201402269349300205,136192377,"Form 990, Part VI, Line 11b: Form 990 Review Process",THE FORM 990 IS REVIEWED BY MANAGEMENT AND IS THEN DISTRIBUTED TO THE BOARD FOR THEIR REVIEW. ANY COMMENTS OR QUESTIONS ARE PRESENTED TO MANAGEMENT WHICH COMMUNICATES THE ISSUE DIRECTLY TO THE PREPARER.
201402269349300205,136192377,"Form 990, Part VI, Line 12c: Explanation of Monitoring and Enforcement of Conflicts","THE POLICY IS NOT UPDATED ANNUALLY, BUT THE POLICY CALLS FOR MEMBERS TO SUBMIT AN ANNUAL CERTIFICATION THAT EITHER THEY HAVE NO CONFLICTS Of INTEREST, OR DISCLOSING SUCH CONFLICTS."
201402269349300205,136192377,"Form 990, Part VI, Line 15b: Compensation Review and Approval Process for Officers and Key Employees","THE BOARD OF TRUSTEES IS RESPONSIBLE FOR REVIEWING THE COMPENSATION OF COLLEGE OFFICERS AND KEY EMPLOYEES WHO ARE IN A POSITION TO EXERCISE SUBSTANTIAL INFLUENCE OVER THE AFFAIRS OF THE COLLEGE, OR OTHERWISE DEFINED AS A DISQUALIFIED PERSON UNDER IRS CODE SECTION 4958(F)(1) (""DISQUALIFIED PERSONS""). AS PART OF THIS REVIEW, THE BOARD SHALL REVIEW COMPARABILITY DATA OF COMPENSATION PAID AT OTHER APPROPRIATE INSTITUTIONS FOR FUNCTIONALLY COMPARABLE SITUATIONS, USING PROCEDURES SET FORTH IN IRS CODE SECTION 4958. THIS PROCESS SHALL BE DOCUMENTED CONTEMPORANEOUSLY AND RECORDED IN BOARD MINUTES WITHIN 60 DAYS AFTER THE COMPENSATION DECISION, AND THE MINUTES APPROVED BY THE BOARD WITHIN A REASONABLE TIME THEREAFTER. COMPENSATION SHALL BE REVIEWED (1) PRIOR TO AWARDING AN EMPLOYMENT CONTRACT TO A DISQUALIFIED PERSON, EXCEPT FOR THE INITIAL CONTRACT, (2) WITHIN SIX MONTHS OF HIRING A DISQUALIFIED PERSON ON A NON-CONTRACT BASIS, AND (3) PRIOR TO AWARDING ANY INCREASE IN COMPENSATION TO A DISQUALIFIED PERSON OTHER THAN INCREASES SET FORTH BY CONTRACT, OR REGULAR COMPENSATION INCREASES AWARDED TO ALL EMPLOYEES GENERALLY, PROVIDED THAT SUCH INCREASES ARE LESS THAN 4% ANNUALLY."
201402269349300205,136192377,"Form 990, Part VI, Line 19: Other Organization Documents Publicly Available","THE PUBLIC MAY REQUEST TO SEE GOVERNING DOCUMENTS, POLICIES AND FINANCIAL STATEMENTS AT THE ADMINISTRATIVE OFFICES OR VIEW THEM ON GUIDESTAR'S WEBSITE. THE COLLEGE HAS PLANS TO MAKE SELECT DOCUMENTS AVAILABLE IN THE FUTURE ON THEIR WEBSITE."
201403219349312715,611531458,"Form 990, Part VI, Section A, Line 4",NEW BOARD OF DIRECTORS WERE ELECTED TO THE BOARD IN JANUARY 2013.
201403219349312715,611531458,"Form 990, Part VI, Section B,, Line 11b",FORM 990 IS REVIEWED BY MANAGEMENT AND THEN DISTRIBUTED TO THE BOARD OF DIRECTORS FOR THEIR REVIEW PRIOR TO FILING.
201403219349312715,611531458,"Form 990, Part VI, Section B,, Line 15b",SALARIES FOR UNAM USA EMPLOYEES ARE ESTABLISHED ANNUALLY DURING THE BUDGET PROCESS AND APPROVED BY UNAM MEXICO AND BOARD OF DIRECTORS.
201403219349312715,611531458,"Form 990, Part VI, Section C,, Line 19","UPON WRITTEN REQUEST, UNAM USA WILL MAKE AVAILABLE ITS GOVERNING DOCUMENTS, POLICIES, FINANCIAL STATEMENTS, AND FORM 990."
201403219349305780,112206183,"FORM 990, PART VI, SECTION A, LINE 7A",THE BOARD OF TRUSTEES OF THE PARENT ORGANIZATION DETERMINES THE ELECTION OF THE GOVERNING BODY.
201403219349305780,112206183,"FORM 990, PART VI, SECTION A, LINE 7B",DECISIONS OF THE GOVERNING BODY ARE SUBJECT TO APPROVAL BY THE BOARD OF TRUSTEES OF THE PARENT ORGANIZATION.
201403219349305780,112206183,"FORM 990, PART VI, SECTION B, LINE 11",A COPY OF THE FORM 990 IS MADE AVAILABLE FOR REVIEW BY THE SCHOOOL'S GOVERNING BODY.
201403219349305780,112206183,"FORM 990, PART VI, SECTION B, LINE 12C",THE ORGANIZATION ASKS ALL SUCH INDIVIDUALS ON A REGULAR BASIS TO DISCLOSE ANY POTENTIAL CONFLICTS OF INTEREST.
201403219349305780,112206183,"FORM 990, PART VI, SECTION B, LINE 15",THE OFFICER'S SALARY IS REVIEWED ANNUALLY BY THE SCHOOL'S GOVERNING BODY.
201403219349305780,112206183,"FORM 990, PART VI, SECTION C, LINE 19",THE ORGANIZATIONS GOVERNING DOCUMENTS ARE MADE AVAILABLE UPON REQUEST.
201403219349305780,112206183,"FORM 990, PART XII, LINE 2C:",THE BOARD OF DIRECTORS ASSUMES RESPONSIBIITY FOR OVERSIGHT OF THE AUDIT. THIS IS CONSISTENT WITH PRIOR YEARS.
201402269349302410,383064555,"FORM 990, PART I, LINE 1",TO INCREASE THE ACCESSIBILITY OF HIGHER EDUCATION FOR THE REGIONAL POPULATION OF THE NORTHERN LOWER THIRD OF MICHIGAN.
201402269349302410,383064555,"FORM 990, PART VI, SECTION B, LINE 11","ORGANIZATION'S PROCESS TO REVIEW FORM 990 AN INDEPENDENT CPA PREPARES THE FORM 990 AND PRESENTS A DRAFT OF THE DOCUMENT TO THE ORGANIZATION'S PRESIDENT, VICE-PRESIDENT AND TREASURER FOR REVIEW. AFTER THE OFFICERS HAVE REVIEWED THE DOCUMENT AND ALL QUESTIONS HAVE BEEN ADDRESSED AND CHANGES HAVE BEEN MADE, IF APPLICABLE, A DESIGNATED OFFICER SIGNS FORM 8879-EO AUTHORIZING THE CPA TO E-FILE THE RETURN."
201402269349302410,383064555,"FORM 990, PART VI, SECTION B, LINE 12C",ENFORCEMENT OF CONFLICTS POLICY ON AN ANNUAL BASIS A QUESTIONNAIRE IS GIVEN TO BOARD MEMBERS ASKING THEM TO DISCLOSE ANY CONFLICTS OF INTEREST. THE QUESTIONNAIRES ARE DATED AND FILED. BOARD MEMBERS EXCLUDE THEMSELVES FROM VOTING ON ANY ACTION ITEMS WHERE A CONFLICT OF INTEREST HAS BEEN DISCLOSED.
201402269349302410,383064555,"FORM 990, PART VI, SECTION B, LINE 15A","COMPENSATION PROCESS FOR TOP OFFICIAL THE EXECUTIVE DIRECTOR'S SALARY IS DETERMINED ANNUALLY BY THE BOARD OF DIRECTORS AFTER CONSIDERING FACTORS SUCH AS JOB PERFORMANCE, JOB ADHERENCE AND BUDGET CONSTRAINTS. A RECENT SURVEY OF SIMILAR ORGANIZATIONS SHOWED THAT THE CURRENT EXECUTIVE DIRECTOR IS COMPARABLE TO THE AVERAGE SALARY OF LIKE POSITION AT THESE ORGANIZATIONS."
201402269349302410,383064555,"FORM 990, PART VI, SECTION C, LINE 19",GOVERNING DOCUMENTS DISCLOSURE EXPLANATION THE UNIVERSITY CENTER AT GAYLORD'S GOVERNING DOCUMENTS ARE AVAILABLE UPON REQUEST.
201401909349300710,640961249,Form 990 governing body review Part VI line 11,Governing Body reviews tax return prior to filing.
201401909349300710,640961249,Conflict of interest policy compliance Part VI line 12c,"Organization has a policy in which it monitors and performs annual reviews regarding any transaction with its directors, officers, and employees."
201401909349300710,640961249,CEO executive director top management comp Part VI line 15a,The organization executive committee reviews and makes recommendations regarding compensation plans and arrangements with its officers and executive director. The organization makes comparable compensation comparisons with publish statistical data in its efforts to assure that the compensation arrangements are consistently in compliance.
201401909349300710,640961249,Other officer or key employee compensation Part VI line 15b,The organization executive committee reviews and makes recommendations regarding compensation plans and arrangements with its staff and employees. The organization makes comparable compensation comparisons with publish statistical data in its efforts to assure that the compensation arrangements are consistently in compliance.
201401909349300710,640961249,Governing documents etc available to public Part VI line 19,Organization's documents are available to the public upon request.
201401909349300710,640961249,List of other expenses Part IX line 24e,See attachments for other expenses
201401619349300410,593085435,"PART VI, SECTION A",NO REVIEU WAS OR WILL BE CONDUCTED
201401619349300410,593085435,"PART VI, SECTION B, LINE 15",NO REVIEU WAS OR WILL BE CONDUCTED
201401619349300410,593085435,"PART VI, SECTION C, LINE 18",PAPER FILE
201401619349300410,593085435,"PART VI, SECTION C, LINE 19",NO DOCUMENTS AVAILABLE TO THE PUBLIC
201402049349300960,620730291,"Form 990, Part VI, Line 11b: Form 990 Review Process",THE 990 IS REVIEWED BY THE PRESIDENT OF THE COLLEGE BEFORE IT IS SIGNED AND FILED.
201402049349300960,620730291,"Form 990, Part VI, Line 12c: Explanation of Monitoring and Enforcement of Conflicts","THE BYLAWS OF THE COLLEGE: SECTION 5.15 STATES ""NO MEMBER OF THE BOARD OF DIRECTORS MAY HAVE AN INTERNAL OR EXTERNAL INTEREST IN THE OPERATION OF THE COLLEGE."" THE BOARD OF DIRECTORS CONTINUALLY MONITOR FOR ANY INTERNAL OR EXTERNAL CONFLICTS."
201402049349300960,620730291,"Form 990, Part VI, Line 15a: Compensation Review & Approval Process - CEO, Top Management",THE BOARD OF DIRECTORS APPROVES THE SALARY OF PRESIDENT OF THE INSTITUTION.
201402049349300960,620730291,"Form 990, Part VI, Line 19: Other Organization Documents Publicly Available","ALL GOVERNING DOCUMENTS, POLICIES, AND FINANCIAL STATEMENTS ARE AVAILABLE TO THE PUBLIC UPON REQUEST."
201402049349300960,620730291,"Form 990, Part IX, Line 24e: Other Expenses",: Column (A) - Total = $0; Column (B) - Program Services = $0; Column (C) - Management & General = $0; Column (D) - Fundraising = $0
201402049349300960,620730291,"Form 990, Part IX, Line 24e: Other Expenses",: Column (A) - Total = $0; Column (B) - Program Services = $0; Column (C) - Management & General = $0; Column (D) - Fundraising = $0
201402049349300960,620730291,"Form 990, Part IX, Line 24e: Other Expenses",: Column (A) - Total = $0; Column (B) - Program Services = $0; Column (C) - Management & General = $0; Column (D) - Fundraising = $0
201402049349300960,620730291,"Form 990, Part IX, Line 24e: Other Expenses",: Column (A) - Total = $0; Column (B) - Program Services = $0; Column (C) - Management & General = $0; Column (D) - Fundraising = $0
201402049349300960,620730291,"Form 990, Part IX, Line 24e: Other Expenses",ACCREDITATION: Column (A) - Total = $1578; Column (B) - Program Services = $1578; Column (C) - Management & General = $0; Column (D) - Fundraising = $0
201402049349300960,620730291,"Form 990, Part IX, Line 24e: Other Expenses",ACQUISITIONS: Column (A) - Total = $2085; Column (B) - Program Services = $2085; Column (C) - Management & General = $0; Column (D) - Fundraising = $0
201402049349300960,620730291,"Form 990, Part IX, Line 24e: Other Expenses",ALUMNI: Column (A) - Total = $9797; Column (B) - Program Services = $0; Column (C) - Management & General = $0; Column (D) - Fundraising = $9797
201402049349300960,620730291,"Form 990, Part IX, Line 24e: Other Expenses",APARTMENT EXPENSE: Column (A) - Total = $7299; Column (B) - Program Services = $7299; Column (C) - Management & General = $0; Column (D) - Fundraising = $0
201402049349300960,620730291,"Form 990, Part IX, Line 24e: Other Expenses",BANK CHARGES: Column (A) - Total = $1323; Column (B) - Program Services = $0; Column (C) - Management & General = $1323; Column (D) - Fundraising = $0
201402049349300960,620730291,"Form 990, Part IX, Line 24e: Other Expenses",CHARITY: Column (A) - Total = $-60; Column (B) - Program Services = $0; Column (C) - Management & General = $-60; Column (D) - Fundraising = $0
201402049349300960,620730291,"Form 990, Part IX, Line 24e: Other Expenses",COLLECTION FEE: Column (A) - Total = $2120; Column (B) - Program Services = $0; Column (C) - Management & General = $2120; Column (D) - Fundraising = $0
201402049349300960,620730291,"Form 990, Part IX, Line 24e: Other Expenses",COMPUTER: Column (A) - Total = $13852; Column (B) - Program Services = $13852; Column (C) - Management & General = $0; Column (D) - Fundraising = $0
201402049349300960,620730291,"Form 990, Part IX, Line 24e: Other Expenses",CREDIT CARD DISCOUNT: Column (A) - Total = $2851; Column (B) - Program Services = $0; Column (C) - Management & General = $2851; Column (D) - Fundraising = $0
201402049349300960,620730291,"Form 990, Part IX, Line 24e: Other Expenses",DISPOSAL SERVICE: Column (A) - Total = $1311; Column (B) - Program Services = $1311; Column (C) - Management & General = $0; Column (D) - Fundraising = $0
201402049349300960,620730291,"Form 990, Part IX, Line 24e: Other Expenses",FINANCIAL AID SERVICE FEE: Column (A) - Total = $3095; Column (B) - Program Services = $3095; Column (C) - Management & General = $0; Column (D) - Fundraising = $0
201402049349300960,620730291,"Form 990, Part IX, Line 24e: Other Expenses",GENERAL SERVICES: Column (A) - Total = $13629; Column (B) - Program Services = $13629; Column (C) - Management & General = $0; Column (D) - Fundraising = $0
201402049349300960,620730291,"Form 990, Part IX, Line 24e: Other Expenses",GRADUATION: Column (A) - Total = $15339; Column (B) - Program Services = $15339; Column (C) - Management & General = $0; Column (D) - Fundraising = $0
201402049349300960,620730291,"Form 990, Part IX, Line 24e: Other Expenses",JANITORIAL: Column (A) - Total = $13741; Column (B) - Program Services = $2748; Column (C) - Management & General = $10993; Column (D) - Fundraising = $0
201402049349300960,620730291,"Form 990, Part IX, Line 24e: Other Expenses",MEMBERSHIP FEES: Column (A) - Total = $8255; Column (B) - Program Services = $0; Column (C) - Management & General = $8255; Column (D) - Fundraising = $0
201402049349300960,620730291,"Form 990, Part IX, Line 24e: Other Expenses",NATIONAL BOARD EXAM: Column (A) - Total = $18936; Column (B) - Program Services = $18936; Column (C) - Management & General = $0; Column (D) - Fundraising = $0
201402049349300960,620730291,"Form 990, Part IX, Line 24e: Other Expenses",Other Expenses: Column (A) - Total = $2002; Column (B) - Program Services = $0; Column (C) - Management & General = $2002; Column (D) - Fundraising = $0
201402049349300960,620730291,"Form 990, Part IX, Line 24e: Other Expenses",PAYROLL - SERVICE: Column (A) - Total = $2043; Column (B) - Program Services = $613; Column (C) - Management & General = $1430; Column (D) - Fundraising = $0
201402049349300960,620730291,"Form 990, Part IX, Line 24e: Other Expenses",POSTAGE: Column (A) - Total = $4086; Column (B) - Program Services = $409; Column (C) - Management & General = $3677; Column (D) - Fundraising = $0
201402049349300960,620730291,"Form 990, Part IX, Line 24e: Other Expenses",PROPERTY TAXES: Column (A) - Total = $8088; Column (B) - Program Services = $4044; Column (C) - Management & General = $4044; Column (D) - Fundraising = $0
201402049349300960,620730291,"Form 990, Part IX, Line 24e: Other Expenses",PUBLIC RELATIONS: Column (A) - Total = $278; Column (B) - Program Services = $0; Column (C) - Management & General = $278; Column (D) - Fundraising = $0
201402049349300960,620730291,"Form 990, Part IX, Line 24e: Other Expenses",SECURITY: Column (A) - Total = $19559; Column (B) - Program Services = $15647; Column (C) - Management & General = $3912; Column (D) - Fundraising = $0
201402049349300960,620730291,"Form 990, Part IX, Line 24e: Other Expenses",Student Activities: Column (A) - Total = $4690; Column (B) - Program Services = $4690; Column (C) - Management & General = $0; Column (D) - Fundraising = $0
201402049349300960,620730291,"Form 990, Part IX, Line 24e: Other Expenses",UTILITIES: Column (A) - Total = $29474; Column (B) - Program Services = $14737; Column (C) - Management & General = $14737; Column (D) - Fundraising = $0
201402049349300960,620730291,"Form 990, Part IX, Line 24e: Other Expenses",VEHICLE: Column (A) - Total = $6728; Column (B) - Program Services = $0; Column (C) - Management & General = $6728; Column (D) - Fundraising = $0
