object_id,ein,DsrgrddEnttyNm_BsnssNmLn1Txt,USAddrss_AddrssLn1Txt,USAddrss_CtyNm,USAddrss_SttAbbrvtnCd,USAddrss_ZIPCd,IdDsrgrddEntts_EIN,IdDsrgrddEntts_PrmryActvtsTxt,IdDsrgrddEntts_LglDmclSttCd,IdDsrgrddEntts_TtlIncmAmt,IdDsrgrddEntts_EndOfYrAsstsAmt,DrctCntrllngEnttyNm_BsnssNmLn1Txt
201731329349302058,131624225,480 WEST 187 I LLC,500 WEST 185TH STREET,NEW YORK,NY,10033,261607906,INACTIVE,NY,0,0,YU
201731329349302058,131624225,LAUREL HILL VENTURES LLC- sole member of,90 LAUREL HILL ASSOC-500 W 185 ST,NEW YORK,NY,10033,134074163,INACTIVE,NY,0,0,YU
201731329349302058,131624225,90 LAUREL HILL ASSOCIATES LLC,500 WEST 185TH STREET,NEW YORK,NY,10033,113490957,INACTIVE,NY,0,0,YU
201731329349302058,131624225,LAUREL HILL ESTATES I LLC,500 WEST 185TH STREET,NEW YORK,NY,10033,208218366,INACTIVE,NY,0,0,YU
201731329349302058,131624225,24 36 LAUREL HILL I LLC,500 WEST 185TH STREET,NEW YORK,NY,10033,208218753,REAL ESTATE,NY,655701,5786074,YU
201731329349302058,131624225,AE BLOCK HOLDING COMPANY LLC,500 WEST 185TH STREET,NEW YORK,NY,10033,131624225,INVESTMENT,DE,0,0,YU
201731329349302058,131624225,AE INTEREST HOLDING COMPANY,50 WEST 185TH STREET,NEW YORK,NY,10033,131624225,INVESTMENT,DE,0,0,YU
201731329349302058,131624225,39TH STREET AE LLC,500 WEST 185TH STREET,NEW YORK,NY,10033,131624225,INACTIVE,DE,0,0,YU
201731329349302058,131624225,38 STREET AE LLC,500 WEST 185TH STREET,NEW YORK,NY,10033,131624225,INACTIVE,DE,0,0,YU
201731329349302058,131624225,DELANCEY STREET AE LLC,500 WEST 185TH STREET,NEW YORK,NY,10033,131624225,INACTIVE,DE,0,0,YU
201731329349302058,131624225,40 WEST 25TH STREET AE LLC,500 WEST 185TH STREET,NEW YORK,NY,10033,131624225,INACTIVE,DE,0,0,YU
201731329349302058,131624225,BROADWAY AE LLC,500 WEST 185TH STREET,NEW YORK,NY,10033,131624225,INACTIVE,DE,0,0,YU
201731329349302058,131624225,24 WEST 25TH STREET AE LLC,500 WEST 185TH STREET,NEW YORK,NY,10033,300753000,INVESTMENT,DE,0,0,YU
201711359349312236,132676570,WARWICK ACADEMIC ASSOCIATES LLC,C/O TOURO COLLEGE 500 7TH AVE,NEW YORK,NY,10018,204236301,HOLDING CO.,NY,68102,43819,TOURO COLL
201711359349312236,132676570,CENTER FOR HEALTH OUTCOME RESEARCH LLC,C/O TOURO COLLEGE 500 7TH AVE,NEW YORK,NY,10018,272347268,RESEARCH CTR.,DE,0,TOURO COLL
201731359349306803,530196603,HOYA LLC,37TH AND O STREETS NW,202 Healy Hall,WASHINGTON,DC,20057,261564991,EDUCATION,DC,0,4452,GU
201731359349306803,530196603,GEORGETOWN DRUG DISCOVERY ACCELERATOR,160 GREENTREE DRIVE SUITE 101,DOVER,DE,19904,DRUG DSCVRY,DE,0,0,GU
201731359349306803,530196603,Georgetown Dogu Akdeniz Egitim Hizmetleri Ticaret Limited Sirketi,12 Kale Yolu 7411,Alanya/Antalya,TU,EDUCATION,TU,0,106306,GU
201731359349306803,530196603,THE UK FRIENDS OF GEORGETOWN LIMITED,16 OLD BAILEY,LONDON,UK,EC4M7EG,981028410,FUNDRAISING,UK,1031932,173599,GU
201731359349306803,530196603,Georgetown East Africa LLC,2711 Centerville Road Suite 400,Wilmington,DE,19808,Research,DE,131637,43367,GU
201721359349313602,310537516,NORWOOD CAFE LLC,3800 VICTORY PARKWAY,CINCINNATI,OH,452074531,260307190,HOSPITALITY ASSOCIATED WITH ART EXHIBITS AND OTHER XAVIER EVENTS,OH,-4139,45187,XAVIER UNIVERSITY
201721359349313602,310537516,3759 MONTGOMERY ROAD LLC,3759 MONTGOMERY ROAD,CINCINNATI,OH,452074531,REAL ESTATE,OH,0,0,XAVIER UNIVERSITY
201721359349310787,237050293,THE WINERY AT KIRKWOOD LLC,6301 KIRKWOOD BLVD SW,CEDAR RAPIDS,IA,52404,271418624,WINERY,IA,14243,69521,KIRKWOOD FACILITIES FOUNDATION
201711359349311656,050258810,BRU LLC,1150 DOUGLAS PIKE,SMITHFIELD,RI,02917,231386793,REAL ESTATE,RI,706013,BRYANT UNIV
201721029349300107,590624458,Biscayne View Properties LLC,1395 Brickell Avenue 14th Floor,Miami,FL,33131,590624458,Real Estate,FL,University of Miami
201721029349300107,590624458,Crestre LLC,1395 Brickell Avenue 14th Floor,Miami,FL,33131,202458426,Real Estate,FL,37095,678151,Biscayne View Properties LLC
201721029349300107,590624458,1509 Venture LLC,1395 Brickell Avenue 14th Floor,Miami,FL,33131,202458426,Real Estate,FL,1799583,Biscayne View Properties LLC
201721029349300107,590624458,East Urban LLC,1395 Brickell Avenue 14th Floor,Miami,FL,33131,202458426,Real Estate,FL,30874,1090004,Biscayne View Properties LLC
201721029349300107,590624458,Tripop LLC,1395 Brickell Avenue 14th Floor,Miami,FL,33131,202458426,Real Estate,FL,4314217,Biscayne View Properties LLC
201721029349300107,590624458,7th Avenue Market LLC,1320 South Dixie Hwy Suite 705,Coral Gables,FL,33146,202458426,Real Estate,FL,3021836,Biscayne View Properties LLC
201721029349300107,590624458,Equi Terra LLC,1395 Brickell Avenue 14th Floor,Miami,FL,33131,590624458,Real Estate,FL,University of Miami
201721029349300107,590624458,Ten Bor LLC,1395 Brickell Avenue 14th Floor,Miami,FL,33131,273025289,Real Estate,FL,Equi Terra LLC
201721029349300107,590624458,PT Property Holding LLC,1395 Brickell Avenue 14th Floor,Miami,FL,33131,273025289,Real Estate,FL,Equi Terra LLC
201721029349300107,590624458,University of Miami Preservation LLC,1252 Memorial Drive Room 230,Coral Gables,FL,33146,590624458,Hold UM Designated Easement,FL,University of Miami
201721029349300107,590624458,Boston House LLC,1395 Brickell Avenue 14th Floor,Miami,FL,33131,590624458,Real Estate,FL,University of Miami
201711369349301456,381550064,CCS COMMUNITY DEVELOPMENT LLC,201 E KIRBY,DETROIT,MI,48202,262730307,CONSTRUCTION DEVELOPMENT MANAGER,MI,512874,17,COLLEGE FOR CREATIVE STUDIES
201711369349301456,381550064,ARGONAUT BUILDING MASTER TENANT,201 E KIRBY,DETROIT,MI,48202,262958271,"MANAGE, LEASE AND MAINTAIN THE BUILDING",MI,COLLEGE FOR CREATIVE STUDIES
201711369349301456,381550064,USBCDE INVESTMENT FUND XXII,201 E KIRBY,DETROIT,MI,48202,261962040,INVESTMENT FUND,MI,COLLEGE FOR CREATIVE STUDIES
201711369349301456,381550064,ARGONAUT CAMPUS DEVELOPER LLC,201 E KIRBY,DETROIT,MI,48202,261097667,OWN AND REHABILITATE THE ARGONAUT BUILDING,MI,COLLEGE FOR CREATIVE STUDIES
201731359349301698,050258956,TECHNOLOGY AND DESIGN BUILDINGS LLC,2 COLLEGE STREET,PROVIDENCE,RI,02903,050258956,REAL ESTATE,RI,25648,0,RISD
201711359349307756,951642394,USC GATEWAY LLC,UNIVERSITY GARDENS - UGB203,LOS ANGELES,CA,90089,202108058,PROPERTY MGMT,CA,115582,USC
201711359349307756,951642394,USC VERDUGO HILLS HOSPITAL LLC,UNIVERSITY GARDENS - UGB205,LOS ANGELES,CA,90089,800912056,ACUTE CARE,CA,0,USC
201711359349305506,571102885,WUREF DEVELOPMENT LLC,701 OAKLAND AVENUE,ROCK HILL,SC,29733,571134334,SC,N/A
201711359349305506,571102885,WINTHROP REAL ESTATE LLC,701 OAKLAND AVENUE,ROCK HILL,SC,29733,200401028,SC,N/A
201731359349301818,591083502,NSU Grande Oaks LLC,3201 W Rolling Hills Circle,Fort Lauderdale,FL,33328,204811801,Golf Course,FL,4637069,38373126,Nova Southeastern University Inc
201731359349301818,591083502,NSU Park Plaza LLC,3301 College Ave,Fort Lauderdale,FL,33314,954893480,Commercial Real Estate,FL,1030012,11753080,Nova Southeastern University Inc
201731329349302298,231352651,JEFFHEDGE LLC,1301 2ND AVENUE 18TH FLOOR,SEATTLE,WA,98101,453214379,INVESTMENTS,DE,0,0,TJU
201731329349302298,231352651,BILDEX CORP,923-925 WALNUT ST,PHILADELPHIA,PA,19107,231718600,REAL ESTATE,PA,0,10855602,TJU
201731329349302298,231352651,925 WALNUT HOLDING LLC,1020 WALNUT ST 6TH FL,PHILADELPHIA,PA,19107,813840390,REAL ESTATE,PA,0,10682225,TJU
201731329349302298,231352651,TJU FAIRWATER LLC,1020 WALNUT ST 6TH FL,PHILADELPHIA,PA,19107,473445382,INVESTMENTS,NY,1030008,112358085,TJU
201721359349305367,030179414,BC CAMPUS HOLDINGS LLC (INACTIVE THROUGH 63016),177 CAMPUS ROAD,BENNINGTON,VT,05201,811952664,FINANCING,VT,0,0,BENNINGTON COLLEGE CORPORATION
201731359349310158,314379459,DENISON GOLF LLC,PO BOX 810,GRANVILLE,OH,43023,472203454,GOLF COURSE,OH,0,0,DENISON UNIV
201731359349304658,990113930,HAWAII LIFESTYLE RETAIL PROPERTIES,1 ALOHA TOWER DRIVE STE 3200,HONOLULU,HI,96813,320361534,REAL ESTATE,HI,-2715515,75003395,HPU
201741309349300634,237225104,Measure for Measure LLC,1209 Orange Street,Wilmington,DE,19801,237325104,To acquire & sell donated assets on behalf of NEC,DE,NEC
201701359349312770,260664313,GARY K HERBERGER YOUNG SCHOLARS ACA,4701 W THUNDERBIRD RD,GLENDALE,AZ,85306,452485965,SCHOOL,AZ,1139477,99560,ASU PREP
201711329349307266,341018992,ERIE TIMBER LLC,10900 EUCLID AVENUE,CLEVELAND,OH,44106,200409132,TIMBER FARM,OH,3321296,48609504,CASE WESTERN RESERVE UNIVERSITY
201711329349307266,341018992,ERIE FOREST INVESTMENTS LLC,10900 EUCLID AVENUE,CLEVELAND,OH,44106,205742452,TIMBER FARM,OH,0,0,ERIE TIMBER
201711329349307266,341018992,CASE DENTAL MEDICINE SUPPORT SERVICES LLC,1900 EUCLID AVENUE,CLEVELAND,OH,44106,264812902,HEALTH CARE,OH,948922,0,CASE WESTERN RESERVE UNIVERSITY
201711329349307266,341018992,CASE IMAGING CENTER LLC,1900 EUCLID AVENUE,CLEVELAND,OH,44106,205670613,EDUCATION/RESEARCH,OH,106151,0,CASE WESTERN RESERVE UNIVERSITY
201711329349307266,341018992,CWRU SCHOOL OF DENTISTRY ADMIN SUPPORT LLC,1900 EUCLID AVENUE,CLEVELAND,OH,44106,340437441,HEALTH CARE,OH,1509844,0,CASE WESTERN RESERVE UNIVERSITY
201711329349307266,341018992,Triangle Residential LLC (34-1018992),10900 Euclid Avenue,Cleveland,OH,44106,Real Estate Management,OH,0,0,Case Western Reserve University
201731359349311778,420707120,WPU REAL ESTATE FOUNDATION LLC,201 TRUEBLOOD AVENUE,OSKALOOSA,IA,52577,474400135,REAL ESTAT,IA,WPU
201741319349302464,541666531,535 WEST BROAD LLC,REAL ESTATE HOLDING COMPANY,VA,0,4556325,VIRGINIA COMMONWEALTH UNIVERSITY REAL ESTATE FOUNDATION
201741319349302464,541666531,VENTURE DEVELOPMENT LLC,REAL ESTATE HOLDING COMPANY,VA,0,0,VIRGINIA COMMONWEALTH UNIVERSITY REAL ESTATE FOUNDATION
201741319349302464,541666531,800 WBS LLC,474504437,REAL ESTATE HOLDING COMPANY,VA,0,0,VIRGINIA COMMONWEALTH UNIVERSITY REAL ESTATE FOUNDATION
201731329349305733,160743209,UNIVERSITY OF ROCHESTER INVESTMENT LLC,266 WALLIS HALL,ROCHESTER,NY,14627,160743209,INVESTING,DE,-2564,0,UNIV OF ROCH
201731329349305733,160743209,SPRUCE RISK PURCHASING GROUP LLC,263 WALLIS HALL,ROCHESTER,NY,14627,160743209,INSURANCE,NY,0,0,UNIV OF ROCH
201701329349306275,880435559,ROSEMAN MEDICAL AND EDUCATIONAL RESEARCH LLC (RMER),11 SUNSET WAY,HENDERSON,NV,89014,MEDICAL EDUCATION & RESEARCH,NV,10224,11504778,ROSEMAN UNIVERSITY OF HEALTH SCIENCES
201701329349306275,880435559,ROSEMONT ENTERPRISES II LLC,11 SUNSET WAY,HENDERSON,NV,89014,MEDICAL EDUCATION & RESEARCH,NV,0,0,ROSEMAN UNIVERSITY OF HEALTH SCIENCES
201701329349306275,880435559,ROSEMAN BIOTECHNOLOGIES LLC,11 SUNSET WAY,HENDERSON,NV,89014,MEDICAL EDUCATION & RESEARCH,NV,0,0,ROSEMAN UNIVERSITY OF HEALTH SCIENCES
201711329349304101,540505965,RICHMOND QUADRANGLE LLC,201 MARYLAND HALL,RICHMOND,VA,23173,200094353,PROPERTY MGMT,VA,3555313,25870486,UR
201711329349304101,540505965,SPIDER MANAGEMENT COMPANY LLC,201 MARYLAND HALL,RICHMOND,VA,23173,261501416,INVSTMNT MGMT,VA,13547016,1338398,UR
201711329349304101,540505965,RICHMOND FUND MANAGEMENT COMPANY LLC,201 MARYLAND HALL,RICHMOND,VA,23171,261501524,INVSTMNT MGMT,VA,13547016,1374019,SMC
201711329349304481,540505906,H-SC Poplar Hill LLC,P O Box 127,Hampden Sydney,VA,23943,Real Estate,VA,4500000,Hampden-Sydney College
201711329349304481,540505906,H-SC Fine Arts Project LLC,P O Box 127,Hampden Sydney,VA,23943,Real Estate,VA,Hampden-Sydney College
201741319349303659,430719506,Carter Hall Landlord LLC,14049 Scenic Highway,Lookout Mountain,GA,30750,300885287,Residence hall and dining hall services for Covenant College students,GA,-1272732,22163533,Covenant College
201741319349303659,430719506,Carter Hall Manager LLC,14049 Scenic Highway,Lookout Mountain,GA,30750,475304636,Residence hall and dining hall services for Covenant College students,GA,0,500,Covenant College
201741309349302099,150532082,CORNELL UNIVERSITY FOUNDATION UK LTD,19 NORCOTT ROAD,LONDON,UK,N16 78J,UK DONATIONS,UK,265928,12174,CORNELL UNIV
201741299349302849,590624412,JACKSONVILLE UNIVERSITY CLINIC LLC,2800 UNIVERSITY BOULEVARD NORTH,JACKSONVILLE,FL,32211,043648158,ORTHODONTIC CLINIC OPERATIONS,FL,3538817,470426,JU
201741299349302849,590624412,Jacksonville University Flight Team LLC,2800 University Boulevard North,Jacksonville,FL,32211,590624412,Flight Team Exercises,FL,0,0,JU
201711329349301041,340714654,Wooster Technology Group LTD,1101 North Bever Street,Wooster,OH,44691,263895769,Holds Patents,OH,318,40586,The College of Wooster
201711329349301041,340714654,The Wooster Inn Management Company LTD,1101 North Bever Street,Wooster,OH,44691,264321151,Inn Management,OH,29542,56788,The College of Wooster
201721329349300512,042103580,BEAU GESTE XXV LLC,HRES 1350 MASS AVE,CAMBRIDGE,MA,02138,202138990,REAL ESTATE,MA,28242990,63679963,PRESIDENT AND FELLOWS OF HARVARD COLLEGE
201721329349300512,042103580,DG EQUITY PARTICIPANTS II LLC,131 SOUTH DEARBORN ST 32 FL,CHICAGO,IL,60603,981167777,INVESTMENTS,DE,25370000,168361000,DG PARTICIPANTS LTD
201721329349300512,042103580,EGSI LLC,600 ATLANTIC AVE,BOSTON,MA,02210,813795256,INVESTMENTS,MA,0,0,PRESIDENT AND FELLOWS OF HARVARD COLLEGE
201721329349300512,042103580,FIELD COURSE LLC,1209 ORANGE ST THE CORP TRUST CO,WILMINGTON,DE,19801,001069145,ACADEMIC,DE,74771,110643,PRESIDENT AND FELLOWS OF HARVARD COLLEGE
201721329349300512,042103580,HARVARD INTERNATIONAL LLC,1350 MASS AVE STE 980,CAMBRIDGE,MA,02138,300459737,INTERNATIONAL SUPPORT,MA,0,0,PRESIDENT AND FELLOWS OF HARVARD COLLEGE
201721329349300512,042103580,HARVARD UNIVERSITY BEACON YARDS LLC,1033 MASS AVE 3RD FL,CAMBRIDGE,MA,02138,030517218,REAL ESTATE,MA,0,79744698,PRESIDENT AND FELLOWS OF HARVARD COLLEGE
201721329349303462,581357177,SAVANNAH MEDIA SERVICES LLC,PO BOX 3146,SAVANNAH,GA,31402,271079682,SUPPORT,GA,0,0,SAVANNAH COLLEGE OF ART AND DESIGN INC
201721329349303462,581357177,SCAD MUSEUM LLC,PO BOX 3146,SAVANNAH,GA,31402,273916875,MUSEUM,GA,0,26418805,SAVANNAH COLLEGE OF ART AND DESIGN INC
201721329349303462,581357177,MUSEUM CAFE LLC,PO BOX 3146,SAVANNAH,GA,31402,463951516,SUPPORT,GA,0,0,SAVANNAH COLLEGE OF ART AND DESIGN INC
201741669349300719,310707369,Franklin University - Urbana LLC,dba Urbana University,201 South Grant Avenue,Columbus,OH,43215,810997614,Institution of higher education,OH,16248675,13807321,Franklin University
201711359349311011,540946734,C&C AVIATION,1971 UNIVERSITY BLVD,LYNCHBURG,VA,24515,540946734,AIRFARE FOR UNIVERSITY AFFAIRS,VA,-883832,2858377,LIBERTY UNIVERSITY INC
201711359349311011,540946734,IVY HILL RECREATION LLC,1971 UNIVERSITY BLVD,LYNCHBURG,VA,24515,460903360,RECREATION,VA,-19799,2781373,LIBERTY UNIVERSITY INC
201711359349311011,540946734,LIBERTY MOUNTAIN CONFERENCE CENTER LLC,1971 UNIVERSITY BLVD,LYNCHBURG,VA,24515,275427434,CENTER FOR EDUCATIONAL CONFERENCES,VA,-1433,1107161,LIBERTY UNIVERSITY INC
201711359349311011,540946734,LIBERTY RIDGE LLC,1971 UNIVERSITY BLVD,LYNCHBURG,VA,24515,270714028,REAL ESTATE HOLDINGS,VA,168756,1843762,LIBERTY UNIVERSITY INC
201711359349311011,540946734,LU CANDLERS STATION HOLDINGSLLC,1971 UNIVERSITY BLVD,LYNCHBURG,VA,24515,271753489,REAL ESTATE HOLDINGS,VA,776009,24140368,LIBERTY UNIVERSITY INC
201711359349311011,540946734,LU PLAZA HOLDINGSLLC,1971 UNIVERSITY BLVD,LYNCHBURG,VA,24515,270217985,REAL ESTATE HOLDINGS,VA,202492,19959035,LIBERTY UNIVERSITY INC
201711359349311011,540946734,LU RACQUET SPORTS LLC,1971 UNIVERSITY BLVD,LYNCHBURG,VA,24515,274785690,RECREATION,VA,0,0,LIBERTY UNIVERSITY INC
201711359349311011,540946734,MORNING STAR BROADCASTING LLC,1971 UNIVERSITY BLVD,LYNCHBURG,VA,24515,463731118,TELEVISION BROADCASTING,VA,-339989,1728448,LIBERTY UNIVERSITY INC
201711359349311011,540946734,CROSSROADS INVESTMENTS LLC,1971 UNIVERSITY BLVD,LYNCHBURG,VA,24515,473991939,REAL ESTATE HOLDINGS,VA,3510,347512,LIBERTY UNIVERSITY INC
201711359349311011,540946734,LIBERTY MOUNTAIN MEDICAL GROUP LLC,1971 UNIVERSITY BLVD,LYNCHBURG,VA,24515,472935244,MEDICAL EDUCATION,VA,-715549,634289,LIBERTY UNIVERSITY INC
201711359349311011,540946734,BURTON REALTY I,1971 UNIVERSITY BLVD,LYNCHBURG,VA,24515,540946734,REAL ESTATE HOLDINGS,VA,59192,7969823,LIBERTY UNIVERSITY INC
201711359349311011,540946734,BURTON REALTY II,1971 UNIVERSITY BLVD,LYNCHBURG,VA,24515,540946734,REAL ESTATE HOLDINGS,VA,61711,8308964,LIBERTY UNIVERSITY INC
201711359349311011,540946734,BURTON REALTY III,1971 UNIVERSITY BLVD,LYNCHBURG,VA,24515,540946734,REAL ESTATE HOLDINGS,VA,1259,169571,LIBERTY UNIVERSITY INC
201711359349311011,540946734,BURTON REALTY IV,1971 UNIVERSITY BLVD,LYNCHBURG,VA,24515,540946734,REAL ESTATE HOLDINGS,VA,1259,169571,LIBERTY UNIVERSITY INC
201711359349311011,540946734,BURTON REALTY V,1971 UNIVERSITY BLVD,LYNCHBURG,VA,24515,540946734,REAL ESTATE HOLDINGS,VA,1259,169571,LIBERTY UNIVERSITY INC
201711359349311011,540946734,BURTON REALTY VI,1971 UNIVERSITY BLVD,LYNCHBURG,VA,24515,540946734,REAL ESTATE HOLDINGS,VA,1259,169571,LIBERTY UNIVERSITY INC
201711359349311011,540946734,LIBERTY MOTION PICTURE COMPANY,1971 UNIVERSITY BLVD,LYNCHBURG,VA,24515,465653798,CINEMATIC ARTS,VA,0,56351,LIBERTY UNIVERSITY INC
201711359349311011,540946734,AIRPORT PLAZA HOLDINGS LLC,1971 UNIVERSITY BLVD,LYNCHBURG,VA,24515,471347963,REAL ESTATE HOLDINGS,VA,393060,6618790,LIBERTY UNIVERSITY INC
201711359349311011,540946734,RED TIE MUSIC LLC,1971 UNIVERSITY BLVD,LYNCHBURG,VA,24515,461340766,MUSIC EDUCATION,VA,118887,86147,LIBERTY UNIVERSITY INC
201711359349311011,540946734,LIBERTY HEALTH SERVICES LLC,1971 UNIVERSITY BLVD,LYNCHBURG,VA,24515,475575947,MEDICAL HEALTH EDUCATION,VA,45314,2159222,LIBERTY UNIVERSITY INC
201731309349301618,141442493,VAYU LLC,3399 NORTH ROAD,POUGHKEEPSIE,NY,12601,EDUCATIONAL,NY,14769292,MARIST COL
201741359349302949,200909475,DOVER GREENS LLC (FKA OLIVET MGMT LLC),73 WHEELER ROAD,WINGDALE,NY,12594,463068978,MANAGING CAMPUS PROPERTY,DE,-561244,13814709,OLIVET UNIVERSITY
201741359349302949,200909475,DOVER WINGDALE PROPERTIES LLC,73 WHEELER ROAD,WINGDALE,NY,12594,475159062,NOT YET DETERMINED,DE,OLIVET UNIVERSITY
201731359349301753,010211497,Elm City LLC,4120 Mayflower Hill,Waterville,ME,04901,473103849,Real Estate Development,ME,0,537000,The President & Trustees of Colby College
201731359349301753,010211497,Elm City 9 LLC,4120 Mayflower Hill,Waterville,ME,04901,474327488,Real Estate Development,ME,0,218000,The President & Trustees of Colby College
201731359349301753,010211497,Elm City 173 LLC,4120 Mayflower Hill,Waterville,ME,04901,474313598,Real Estate Development,ME,0,239000,The President & Trustees of Colby College
201731359349301753,010211497,Elm City 20 LLC,4120 Mayflower Hill,Waterville,ME,04901,474888049,Real Estate Development,ME,0,116000,The President & Trustees of Colby College
201731359349301753,010211497,Elm City 13 LLC,4120 Mayflower Hill,Waterville,ME,04901,475277633,Real Estate Development,ME,0,438000,The President & Trustees of Colby College
201731359349301753,010211497,Elm City 14 LLC,4120 Mayflower Hill,Waterville,ME,04901,810865849,Real Estate Development,ME,0,183000,The President & Trustees of Colby College
201741319349303099,530196584,DYNAMO BRASIL VII LLC,CORP TST CTR 1209 ORANGE ST,WILMINGTON,DE,19801,INVESTMENTS,DE,5322398,8044039,GW
201741319349303099,530196584,GEORGE WASHINGTON WORLDWIDE LLC,2121 EYE STREET NW,WASHINGTON,DC,20052,INTL EDUC,DC,360883,GW
201731329349304438,050259080,SRU HOLDINGS LLC,100 OCHRE POINT AVENUE,NEWPORT,RI,02840,050259080,REAL ESTATE HOLDING CORP.,RI,9438000,N/A
201721329349306747,951667177,OTWAY PROPERTIES LLC,7435 NORTH FIGUEROA STREET,LOS ANGELES,CA,90041,813103529,REAL PROPERTIES,CA,0,0,OCCIDENTAL COLLEGE
201721319349305802,042103634,TUDC LLC,169 HOLLAND STREET,SOMERVILLE,MA,02144,043056113,REAL ESTATE DEVELOPMENT,MA,0,0,TRUSTEES OF TUFTS COLLEGE
201721319349305802,042103634,TUFTS MEDIA LLC,169 HOLLAND STREET,SOMERVILLE,MA,02144,042103634,CONSUMER PUBLISHING & MEDIA,DE,4052187,3039597,TRUSTEES OF TUFTS COLLEGE
201721319349305802,042103634,AZULUNA BRANDS LLC,169 HOLLAND STREET,SOMERVILLE,MA,02144,042103634,AGRICULTURE,MA,-16332,0,TRUSTEES OF TUFTS COLLEGE
201721319349305802,042103634,TUFTS HEALTH AND WELLNESS SERVICES LLC,169 HOLLAND STREET,SOMERVILLE,MA,02144,800754011,HEALTH AND WELLNESS SERVICES,MA,0,0,TRUSTEES OF TUFTS COLLEGE
201711329349305706,042103594,MIT Foundation (UK) Limited,19 Norcott Road,London,UK,981192046,MIT Support,UK,430898,17856,Massachusetts Institute of Technology
201711329349305706,042103594,MIT Private Equity LLC,238 Main Street,c/o MIT,Cambridge,MA,01242,043490003,Investments,DE,8920,40696,Massachusetts Institute of Technology
201711329349305706,042103594,MIT Private Equity Management Company LLC,238 Main Street,c/o MIT,Cambridge,MA,01242,043490002,Investments,DE,40571,157219,Massachusetts Institute of Technology
201711329349305706,042103594,MIT Private Equity Management Company II LLC,238 Main Street,c/o MIT,Cambridge,MA,01242,431964717,Investments,DE,33029,86769,Massachusetts Institute of Technology
201711329349305706,042103594,MIT Private Equity Management Company III LLC,238 Main Street,c/o MIT,Cambridge,MA,01242,204639870,Investments,DE,399177,912915,Massachusetts Institute of Technology
201711329349305706,042103594,MIT Private Equity Management Company IV LLC,238 Main Street,c/o MIT,Cambridge,MA,01242,261356780,Investments,DE,130421,290299,Massachusetts Institute of Technology
201711329349305706,042103594,Blue Jay Associates LLC,238 Main Street,c/o MIT,Cambridge,MA,01242,042103594,Investments,DE,0,0,Massachusetts Institute of Technology
201711329349305706,042103594,Meadowlark Associates LLC,238 Main Street,c/o MIT,Cambridge,MA,01242,042103594,Investments,DE,-5561650,137893232,Massachusetts Institute of Technology
201711329349305706,042103594,12 Emily Street Leasehold LLC,238 Main Street,c/o MIT,Cambridge,MA,01242,464257627,Real Estate,MA,-133715,9100000,Massachusetts Institute of Technology
201711329349305706,042103594,134 Massachusetts Avenue Fee Owner LLC,238 Main Street,c/o MIT,Cambridge,MA,01242,464682035,Real Estate,MA,120,2429,Massachusetts Institute of Technology
201711329349305706,042103594,134 Massachusetts Avenue Leasehold LLC,238 Main Street,c/o MIT,Cambridge,MA,01242,464695223,Real Estate,MA,-1594440,0,Massachusetts Institute of Technology
201711329349305706,042103594,177 Massachusetts Avenue Leasehold LLC,238 Main Street,c/o MIT,Cambridge,MA,01242,464279029,Real Estate,MA,0,0,Massachusetts Institute of Technology
201711329349305706,042103594,281-295 Albany Street Leasehold LLC,238 Main Street,c/o MIT,Cambridge,MA,01242,464298517,Real Estate,MA,1943887,22000000,Massachusetts Institute of Technology
201711329349305706,042103594,424-456 Massachusetts Avenue Leasehold LLC,238 Main Street,c/o MIT,Cambridge,MA,01242,464509441,Real Estate,MA,1116582,19925000,Massachusetts Institute of Technology
201711329349305706,042103594,610 Main Street North Leasehold LLC,238 Main Street,c/o MIT,Cambridge,MA,01242,464624112,Real Estate,MA,0,0,Massachusetts Institute of Technology
201711329349305706,042103594,610 Main Street South Leasehold LLC,238 Main Street,c/o MIT,Cambridge,MA,01242,463904926,Real Estate,MA,10229785,296000000,Massachusetts Institute of Technology
201711329349305706,042103594,610 Main Street South Trustee LLC,238 Main Street,c/o MIT,Cambridge,MA,01242,042103594,Real Estate,MA,0,0,Massachusetts Institute of Technology
201711329349305706,042103594,610-700 Main Garage Leasehold LLC,238 Main Street,c/o MIT,Cambridge,MA,01242,463997167,Real Estate,MA,0,0,Massachusetts Institute of Technology
201711329349305706,042103594,610-700 Main Garage Trustee LLC,238 Main Street,c/o MIT,Cambridge,MA,01242,042103594,Real Estate,MA,0,0,Massachusetts Institute of Technology
201711329349305706,042103594,620 Memorial Leasehold LLC,238 Main Street,c/o MIT,Cambridge,MA,01242,464249493,Real Estate,MA,3198728,71600000,Massachusetts Institute of Technology
201711329349305706,042103594,650 Main Street Leasehold LLC,238 Main Street,c/o MIT,Cambridge,MA,01242,042103594,Real Estate,MA,0,0,Massachusetts Institute of Technology
201711329349305706,042103594,700 Main Street Leasehold LLC,238 Main Street,c/o MIT,Cambridge,MA,01242,463910601,Real Estate,MA,7489908,159000000,Massachusetts Institute of Technology
201711329349305706,042103594,700 Main Street Trustee LLC,238 Main Street,c/o MIT,Cambridge,MA,01242,042103594,Real Estate,MA,0,0,Massachusetts Institute of Technology
201711329349305706,042103594,MIT 12 Emily Street LLC,238 Main Street,c/o MIT,Cambridge,MA,01242,464268263,Real Estate,MA,10,201,Massachusetts Institute of Technology
201711329349305706,042103594,MIT 128 Sidney Leasehold LLC,238 Main Street,c/o MIT,Cambridge,MA,01242,464318943,Real Estate,MA,2137721,26500000,Massachusetts Institute of Technology
201711329349305706,042103594,MIT 128 Sidney SPE LLC,238 Main Street,c/o MIT,Cambridge,MA,01242,464329881,Real Estate,MA,120,2365,Massachusetts Institute of Technology
201711329349305706,042103594,MIT 130 Brookline Leasehold LLC,238 Main Street,c/o MIT,Cambridge,MA,01242,811727616,Real Estate,MA,2699995,45600000,Massachusetts Institute of Technology
201711329349305706,042103594,MIT 130 Brookline LLC,238 Main Street,c/o MIT,Cambridge,MA,01242,464339718,Real Estate,MA,20,408,Massachusetts Institute of Technology
201711329349305706,042103594,MIT 148 Sidney Leasehold LLC,238 Main Street,c/o MIT,Cambridge,MA,01242,464350211,Real Estate,MA,678687,11000000,Massachusetts Institute of Technology
201711329349305706,042103594,MIT 148 Sidney SPE LLC,238 Main Street,c/o MIT,Cambridge,MA,01242,464400934,Real Estate,MA,120,2365,Massachusetts Institute of Technology
201711329349305706,042103594,MIT 149 Sidney Leasehold LLC,238 Main Street,c/o MIT,Cambridge,MA,01242,464419735,Real Estate,MA,1678568,23530000,Massachusetts Institute of Technology
201711329349305706,042103594,MIT 149 Sidney SPE LLC,238 Main Street,c/o MIT,Cambridge,MA,01242,464439009,Real Estate,MA,120,2365,Massachusetts Institute of Technology
201711329349305706,042103594,MIT 17 Tudor Leasehold LLC,239 Main Street,c/o MIT,Cambridge,MA,01242,811419417,Real Estate,MA,644130,8930000,Massachusetts Institute of Technology
201711329349305706,042103594,MIT 170171 Sidney LLC,238 Main Street,c/o MIT,Cambridge,MA,01242,464653513,Real Estate,MA,140437,6620000,Massachusetts Institute of Technology
