object_id,ein,DsrgrddEnttyNm_BsnssNmLn1Txt,USAddrss_AddrssLn1Txt,USAddrss_CtyNm,USAddrss_SttAbbrvtnCd,USAddrss_ZIPCd,IdDsrgrddEntts_EIN,IdDsrgrddEntts_PrmryActvtsTxt,IdDsrgrddEntts_LglDmclSttCd,IdDsrgrddEntts_TtlIncmAmt,IdDsrgrddEntts_EndOfYrAsstsAmt,DrctCntrllngEnttyNm_BsnssNmLn1Txt
201622569349300722,650267991,HootInsight Music Publishing LLC,777 Glades Road,Boca Raton,FL,33431,201565200,The education of students and faculty at Florida Atlantic University,FL
201622569349300722,650267991,HootWisdom Music Publishing LLC,777 Glades Road,Boca Raton,FL,33431,201565359,The education of students and faculty at Florida Atlantic University,FL
201622569349300722,650267991,HootWisdom Recording LLC,777 Glades Road,Boca Raton,FL,33431,201565424,The education of students and faculty at Florida Atlantic University,FL
201642529349300604,650267991,HootInsight Music Publishing LLC,777 Glades Road,Boca Raton,FL,33431,201565200,The education of students and faculty at Florida Atlantic University,FL
201642529349300604,650267991,HootWisdom Music Publishing LLC,777 Glades Road,Boca Raton,FL,33431,201565359,The education of students and faculty at Florida Atlantic University,FL
201642529349300604,650267991,HootWisdom Recording LLC,777 Glades Road,Boca Raton,FL,33431,201565424,The education of students and faculty at Florida Atlantic University,FL
201602459349300930,350715530,EDUCATION ONE,1 UNIVERSITY AVENUE,ANGOLA,IN,46703,350715530,EDUCATION,IN,39070,148165,TRINE UNIV
201602459349300930,350715530,INNOVATION ONE,1 UNIVERSITY AVENUE,ANGOLA,IN,46703,350715530,EDUCATION,IN,9637,8448,TRINE UNIV
201623069349300122,980149857,iniciativas agrotropicales sa,po box 4442-1000,san jose,CS,Inactive,CS,184,0,na
201623069349300122,980149857,Fideicomiso EARTH Programa de Atencion,PO BOX 4442-1000,San Jose,CS,Loan Granting,CS,24129,0,NA
201603189349300805,201612906,LONGWOOD HOUSING FOUNDATION LLC,315 WEST THIRD STREET,FARMVILLE,VA,23901,HOUSING,VA,9638792,107957116,NA
201603189349300805,201612906,LONGWOOD WOODLAND POND HOUSING,FOUNDATION LLC,315 WEST THIRD STREET,FARMVILLE,VA,23901,HOUSING,VA,128029,2023298,NA
201603189349300805,201612906,LONGWOOD WOODLAND POND DEVELOPMENT,FOUNDATION LLC,315 WEST THIRD STREET,FARMVILLE,VA,23901,LAND,VA,315000,NA
201603129349302435,136171197,MOUNT SINAI CARE LLC,1 GUSTAVE LEVY PLACE BOX 1061,NEW YORK,NY,10029,454492275,ACCT CARE ORG,NY,0,0,ISMMS
201633149349300528,350885591,IWU HOLDINGS LLC,4201 S WASHINGTON ST,MARION,IN,46936,471041098,EDUCATION,IN,2436767,6592538,IWU
201633149349300528,350885591,RON BLUE INSTITUTE FOR FINANCIAL PLANNIN,4201 S WASHINGTON ST,MARION,IN,46953,473753426,EDUCATION,IN,553519,175077,IWU
201613209349304496,274967732,CKI EVENTS LLC,1320 N COURTHOUSE RD STE 500,ARLINGTON,VA,22201,274967732,SCHOOL EVENTS,DE,0,0,CKI
201613209349304496,274967732,WEB MEDIA LLC,1320 N COURTHOUSE RD STE 500,ARLINGTON,VA,22201,WEB HOSTING,DE,0,0,CKI
201623169349302802,541863192,CNU BARCLAY LLC,ONE UNIVERSITY PLACE,NEWPORT NEWS,VA,23606,542060797,REAL ESTATE HOLDING COMPANY,VA,402099,2358307,CNU REAL ESTATE FOUNDATION
201623169349302802,541863192,CNU COMMERCIAL LLC,ONE UNIVERSITY PLACE,NEWPORT NEWS,VA,23606,REAL ESTATE HOLDING COMPANY,VA,CNU REAL ESTATE FOUNDATION
201623169349302802,541863192,CNU COMPLEX LLC,ONE UNIVERSITY PLACE,NEWPORT NEWS,VA,23606,REAL ESTATE HOLDING COMPANY,VA,CNU REAL ESTATE FOUNDATION
201623169349302802,541863192,CNU HIDEN HUSSEY LLC,ONE UNIVERSITY PLACE,NEWPORT NEWS,VA,23606,REAL ESTATE HOLDING COMPANY,VA,CNU REAL ESTATE FOUNDATION
201623169349302802,541863192,CNU PROPERTIES LLC,ONE UNIVERSITY PLACE,NEWPORT NEWS,VA,23606,542058704,REAL ESTATE HOLDING COMPANY,VA,636522,896227,CNU REAL ESTATE FOUNDATION
201623169349302802,541863192,CNU POST OFFICE LLC,ONE UNIVERSITY PLACE,NEWPORT NEWS,VA,23606,263606745,REAL ESTATE HOLDING COMPANY,VA,92446,CNU REAL ESTATE FOUNDATION
201623169349302802,541863192,CNU SOC LLC,ONE UNIVERSITY PLACE,NEWPORT NEWS,VA,23606,REAL ESTATE HOLDING COMPANY,VA,0,901070,CNU REAL ESTATE FOUNDATION
201623169349302802,541863192,CNU SPCOM LLC,ONE UNIVERSITY PLACE,NEWPORT NEWS,VA,23606,743143811,REAL ESTATE HOLDING COMPANY,VA,0,797648,CNU REAL ESTATE FOUNDATION
201623169349302802,541863192,CNU VILLAGE LLC,ONE UNIVERSITY PLACE,NEWPORT NEWS,VA,23606,REAL ESTATE HOLDING COMPANY,VA,CNU REAL ESTATE FOUNDATION
201623169349302802,541863192,CNU VILLAGE LAND LLC,ONE UNIVERSITY PLACE,NEWPORT NEWS,VA,23606,383697295,REAL ESTATE HOLDING COMPANY,VA,3558852,22514591,CNU REAL ESTATE FOUNDATION
201623169349302802,541863192,CNU WARWICK LLC,ONE UNIVERSITY PLACE,NEWPORT NEWS,VA,23606,542058737,REAL ESTATE HOLDING COMPANY,VA,CNU REAL ESTATE FOUNDATION
201623169349302802,541863192,CNU UNIVERSITY APARTMENTS LLC,ONE UNIVERSITY PLACE,NEWPORT NEWS,VA,23606,542058705,REAL ESTATE HOLDING COMPANY,VA,1785874,9327575,CNU REAL ESTATE FOUNDATION
201623169349302802,541863192,RAPPAHANNOCK HALL AT CNU,ONE UNIVERSITY PLACE,NEWPORT NEWS,VA,23606,REAL ESTATE HOLDING COMPANY,VA,2600248,37845391,CNU REAL ESTATE FOUNDATION
201623169349302802,541863192,12396 WARWICK LLC,ONE UNIVERSITY PLACE,NEWPORT NEWS,VA,23606,REAL ESTATE HOLDING COMPANY,VA,11000,716994,CNU REAL ESTATE FOUNDATION
201623169349302802,541863192,CNU OFFICE PARK,ONE UNIVERSITY PLACE,NEWPORT NEWS,VA,23606,REAL ESTATE HOLDING COMPANY,VA,905000,10457731,CNU REAL ESTATE FOUNDATION
201623169349302802,541863192,HIDENWOOD LLC,ONE UNIVERSITY PLACE,NEWPORT NEWS,VA,23606,REAL ESTATE HOLDING COMPANY,VA,674406,12019928,CNU REAL ESTATE FOUNDATION
201623169349302802,541863192,WARRICK PROPERTIES EAST,ONE UNIVERSITY PLACE,NEWPORT NEWS,VA,23606,REAL ESTATE HOLDING COMPANY,VA,6051,427521,CNU REAL ESTATE FOUNDATION
201623209349312427,263162145,ARNETT CLINIC LLC,950 N MERIDIAN ST STE 800,INDIANAPOLIS,IN,46204,352030653,HEALTHCARE,IN,128326128,0,IUHA
201623209349312427,263162145,CAH PHYSICIANS LLC,950 N MERIDIAN ST STE 800,INDIANAPOLIS,IN,46204,262769447,HEALTHCARE,IN,0,0,IUHA
201623209349312427,263162145,CLARIAN-ARNETT OCCUP HEALTH CTRS LLC,950 N MERIDIAN ST STE 800,INDIANAPOLIS,IN,46204,271973115,HEALTHCARE,IN,1965795,0,IUHA
201633209349304203,620497990,101 Factory Street LLC,333 Murfreesboro Road,Nashville,TN,37210,620497990,Property development,TN,0,960000,Trevecca Nazarene University
201633209349304203,620497990,303 Murfreesboro Road LLC,333 Murfreesboro Road,Nashville,TN,37210,620497990,Property development,TN,81280,0,Trevecca Nazarene University
201633209349304203,620497990,411 Woodycrest LLC,333 Murfreesboro Road,Nashville,TN,37210,812607757,Property development,TN,5500,480000,Trevecca Nazarene University
201643199349310564,560767736,WARREN WILSON COLLEGE FOUND LLC,PO BOX 9000,ASHEVILLE,NC,28805,RENTAL,NC,301151,17590054,N/A
201643199349310374,350868181,Taylor Angel Fund LLC,236 West Read Ave,Upland,IN,46989,New business/research endeavors,IN,0,0,Taylor University
201643169349301529,580593438,WESLEYAN COLLEGE PRESS LLC,4760 FORSYTH ROAD,MACON,GA,31210,PUBLISHING,GA,NA
201613439349300326,590624459,BOULEVARD AND KENNEDY HOLDINGS LLC,401 W KENNEDY BLVD,TAMPA,FL,336061490,590624459,TO HOLD SEVERAL PARCELS OF REAL PROPERTY,FL,0,1315000,THE UNIVERSITY OF TAMPA INCORPORATED
201623499349300007,541031437,CHRISTENDOM COLLEGE LLC,134 CHRISTENDOM DRIVE,FRONT ROYAL,VA,22630,OPERATING CHRISTENDOM COLLEGE,VA,18669004,2573757,CHRISTENDOM EDUCATIONAL CORPORATION
201623489349300937,530196603,HOYA LLC,37TH AND O STREETS NW,WASHINGTON,DC,20057,261564991,EDUCATION,DC,0,5104,GU
201623489349300937,530196603,GEORGETOWN DRUG DISCOVERY ACCELERATOR,160 GREENTREE DRIVE SUITE 101,DOVER,DE,19904,DRUG DSCVRY,DE,0,0,GU
201623489349300937,530196603,GEORGETOWN DOGU ADKENIZ EGITIM HIZMETLER SIRKETI,12 Kale Yolu 7411,Alanya/Antalya,TU,EDUCATION,TU,364500,106306,GU
201623489349300937,530196603,UK FRIENDS OF GEORGETOWN LIMITED,16 OLD BAILEY,LONDON,UK,EC4M 7EG,981028410,FUNDRAISING,UK,1394710,177705,GU
201623569349300222,840442429,Jeffco Property Investors LLC,3801 E Florida Ave Ste 600,Denver,CO,80210,450851533,Real estate,CO,0,0,CCU
201623569349300307,593086453,UCF RESEARCH FOUNDATION REAL ESTATE LLC,12201 RESEARCH PARKWAY SUITE 501,ORLANDO,FL,328263257,REAL ESTATE,FL,0,0,UNIVERSITY OF CENTRAL FLORIDA RESEARCH FOUNDATION INC
201730139349301653,560532303,TRI-STATE REAL PROPERTIES LLC,615 S DUPONT HIGHWAY,DOVER,DE,19901,260353244,REAL ESTATE,DE,39086,459000,ELON UNIVERSITY
201730449349301208,135596846,JUMP START LLC,3 DAG HAMMARSKJOLD PLAZA 8 FL,NEW YORK,NY,100172303,135596846,THIS LLC OWNS A 1/3 INTEREST IN LIBANCERT SARL & HEALTHY BASKET SARL,DE,63392,24011,AMERICAN UNIVERSITY OF BEIRUT
201730449349301208,135596846,START UP LLC,3 DAG HAMMARSKJOLD PLAZA 8 FL,NEW YORK,NY,100172303,135596846,THIS LLC OWNS A 1/3 INTEREST IN LIBANCERT SARL & HEALTHY BASKET SARL,DE,63392,24011,AMERICAN UNIVERSITY OF BEIRUT
201730449349301208,135596846,NEW IDEAS LLC,3 DAG HAMMARSKJOLD PLAZA 8 FL,NEW YORK,NY,100172303,135596846,THIS LLC OWNS A 1/3 INTEREST IN LIBANCERT SARL & HEALTHY BASKET SARL,DE,63391,24012,AMERICAN UNIVERSITY OF BEIRUT
201710249349301326,581494136,MTSA HOLDINGS LLC,315 HOSPITAL DRIVE,MADISON,TN,37115,HOLDING CO,TN,14600,MTSA,MIDDLE TENNESSEE SCHOOL OF ANESTHES
201710339349300741,310840764,Chatfield FM Property LLC,20918 State Route 251,St Martin,OH,45118,471061694,"To invest in 1544 Central Parkway, LLC, which will develop and own property",OH,-28305,3829262,Chatfield College
201700459349302355,390477970,Historic Holdings LLC,1025 N Broadway,Milwaukee,WI,53202,"Acquire, own, operate MSOE property",WI,293715,3209960,Milwaukee School of Engineering
201700459349302355,390477970,MSOE Properties LLC,1025 N Broadway,Milwaukee,WI,53202,"Acquire, own, operate MSOE property",WI,0,409600,Milwaukee School of Engineering
201720139349300427,421457548,KRL SCIENCE MANAGEMENT,1609 GOLDEN ASPEN DRIVE SUITE 101,AMES,IA,50010,ADVANCING COMPUTATIONAL SCIENCE,IA,0,76975,THE KRELL INSTITUTE
201730099349300323,420680466,LUTHER COLLEGE WIND ENERGY PROJECT LLC,700 COLLEGE DRIVE,DECORAH,IA,52101,352366881,PRODUCTION OF ELECTRICITY,IA,259384,2586286,LUTHER COLLEGE VENTURES INC
201720699349300957,410795255,Mokahum Training Center,1600 Oak Hills Road SW,Bemidji,MN,56601,Discipleship Training Center,MN,8000,212500,Oak Hills Fellowship
201740459349302854,200118161,FMU STUDENT HOUSING LLC,PO BOX 100547,FLORENCE,SC,295020547,200118161,HOUSING,SC,6593517,25431781,FMU
201720449349300007,540505892,E&H 1836 LLC,PO BOX 947,EMORY,VA,24327,811665557,REAL ESTATE LEASING,VA,0,0,EMORY & HENRY COLLEGE
201710799349300201,750851900,ACU Management LLC,1600 Campus Court,Abilene,TX,79699,571136730,General partner of ACU Foundation Limited,TX,170290,N/A
201740649349300304,231352668,KINGSESSING REALTY LLC,600 SOUTH 43RD STREET,PHILADELPHIA,PA,19104,233067213,Real Estate,PA,27854,2340869,Usciences
201740649349300304,231352668,4605 Chester Realty LLC,600 SOUTH 43RD STREET,PHILADELPHIA,PA,19104,Inactive,PA,0,0,Usciences
201740649349300304,231352668,4107 Chester Realty LLC,600 SOUTH 43RD STREET,PHILADELPHIA,PA,19104,Inactive,PA,0,0,Usciences
201740649349300304,231352668,4203 Chester Realty LLC,600 SOUTH 43RD STREET,PHILADELPHIA,PA,19104,Inactive,PA,0,0,Usciences
201740649349300304,231352668,4300 Chester Realty LLC,600 SOUTH 43RD STREET,PHILADELPHIA,PA,19104,Inactive,PA,0,0,Usciences
201700629349300610,271870108,COLLEGE FOR CERTAIN LLC,1001 22ND AVENUE 100,OAKLAND,CA,94606,271870108,"HOLDS TITLE, MANAGES, OPERATES, LEASES PROPERTIES FOR ASPIRE PUBLIC SCHOOLS",CA,2642502,89162552,COLLEGE FOR CERTAIN INC
201700629349300610,271870108,COLLEGE FOR CERTAIN II LLC,1001 22ND AVENUE 100,OAKLAND,CA,94606,271870108,"HOLDS TITLE, MANAGES, OPERATES, LEASES PROPERTIES FOR ASPIRE PUBLIC SCHOOLS",CA,568043,23855239,COLLEGE FOR CERTAIN INC
201710559349300026,350868096,OLD MILL LLC,495 COLLEGE AVENUE,HANOVER,IN,47243,351920556,CATERING,IN,7265,1000,HANOVER COLL
201740469349303284,721304948,UNIVERSITY MEDICAL GROUP LLC,1542 TULANE AVE SUITE 123-HCN,NEW ORLEANS,LA,70112,721424889,PHYSICIAN HEALTH CARE SERVICES,LA,2038219,11221795,LSU SCHOOL OF MEDICINE IN NEW ORLEANS FACULTY GROUP PRACTICE
201740469349303284,721304948,LSUHN BILLING LLC,1542 TULANE AVE SUITE 123-HCN,NEW ORLEANS,LA,70112,261531455,BILLING COMPANY,LA,-2700224,6443836,LSU SCHOOL OF MEDICINE IN NEW ORLEANS FACULTY GROUP PRACTICE
201740469349303284,721304948,LSUHN VASCULAR LAB LLC,1542 TULANE AVE SUITE 123-HCN,NEW ORLEANS,LA,70112,271244610,VASCULAR LABORATORY,LA,LSU SCHOOL OF MEDICINE IN NEW ORLEANS FACULTY GROUP PRACTICE
201700469349300720,150532239,Laurentian Properties LLC,23 Romoda Dr,Canton,NY,13617,200803478,hotel and restaurant,NY,3532812,5449084,St Lawrence University
201710699349300426,231352641,GETTYSBURG HOTEL MANAGEMENT LLC,300 NORTH WASHINGTON STREET,GETTYSBURG,PA,17325,412224678,REAL ESTATE,PA,628212,2597269,GETTYSBURG C
201710699349300426,231352641,GETTYSBURG GREAT PRODUCTIONS LLC,300 NORTH WASHINGTON STREET,GETTYSBURG,PA,17325,900845620,FILM PRDN,PA,47828,451288,GETTYSBURG C
201700449349300620,250965576,TPR Development,75 College Avenue,Greenville,PA,16125,251401400,Natural Gas Well,PA,0,0,N/A
201720319349300847,570474291,Charleston Lodging Corporation LLC,9280 University Boulevard,Columbia,SC,29406,201990533,Real Estate,SC,103474,6753968,Charleston Interstate Development Corp
201740689349300309,951684064,ZSRS FUND LLC,15760 VENTURA BLVD SUITE 801,ENCINO,CA,91436,202587256,REAL ESTATE INVESTMENTS,CA,330686,12807364,AMERICAN JEWISH UNIVERSITY
201740689349300309,951684064,AJU BBI HOLDINGS LLC,15600 MULHOLLAND DRIVE,LOS ANGELES,CA,90077,TITLE HOLDING,CA,14666083,AMERICAN JEWISH UNIVERSITY
201700729349300710,530196549,American Univ at Connecticut Ave LLC,4400 Massachusetts Ave NW,Washington,DC,20016,455294959,Real Estate,DC,0,AU
201730479349301168,951643992,CHAPMAN UNIVERSITY CHARITABLE GIVING LLC,ONE UNIVERSITY DRIVE,ORANGE,CA,92866,330918653,FUNDRAISING,CA,1104468,14735460,CHAPMAN UNIV
201730479349301168,951643992,CHAPMAN SINGAPORE EDUCATION CENTRE PTE,9 BATTERY RD 15-01 STRAITS TRADING,BLDG,SINGAPORE,SN,049910,981102652,EDUCATION,SN,CHAPMAN UNIV
201740419349300424,750950119,34th and Frankford LLC,2611 Frankford Ave,Lubbock,TX,79407,750950119,Management,TX,1027,Lubbock Christian University
201730829349300518,540506306,Bridgewater College Properties LLC,402 East College Street,Bridgewater,VA,22812,540506306,Real estate,VA,204024,32118,Bridgewater College
201701299349301735,480543772,Ottawa Investment Management Services,1001 S Cedar 20,Ottawa,KS,66067,480543772,Investment,KS,0,0,Ottawa Univ
201741039349301049,464884633,USAC Chile,AV Repbulica 470 1 comuna,Santiago,CI,Study Abroad,CI,0,0,USAC
201741039349301049,464884633,USAC France - Pau,Universite de Pau de ladour,Pau,FR,64000,Study Abroad,FR,0,0,USAC
201741039349301049,464884633,USAC Germany,Scharnhorststrabe 1,Lueneburg,GM,21335,Study Abroad,GM,0,0,USAC
201741039349301049,464884633,USAC Ghana,University of Ghana,"Legon, Accra",GH,Study Abroad,GH,0,0,USAC
201741039349301049,464884633,USAC Italia,Via Ventimiglia 115,TORINO,IT,10126,Study Abroad,IT,0,0,USAC
201741039349301049,464884633,USAC Spain,Campus Univ Edificio Biblioteca Ce,Leioa,Bizkaia,SP,48940,Study Abroad,SP,0,0,USAC
201741039349301049,464884633,USAC France - Lyon,Universite Lumiere Lyon 2,Lyon,FR,69007,FR,USAC
201711079349300946,953075415,EXPLORER MARITIME LLC,2410 old ivy road,CHARLOTTESVILLE,VA,22903,261598279,OWNS SHIP USED FOR THE INSTITUTE FOR SHIPBOARD EDUCATION'S MISSION,DE,0,0,N/A
201741369349300449,370661219,McKBearcat LLC,1015 Belleville St,Lebanon,IL,62254,455529308,Operating a public golf club,IL,444109,1932095,McKendree University
201740909349300524,340714818,GOOD VENTURE ENTERPRISES LLC,1235 UNIVERSITY BOULEVARD,STEUBENVILLE,OH,43952,340714818,PROVIDE DORMITORY & SOCIAL SPACE FOR STUDENTS & GUESTS,OH,-1426644,23464618,N/A
201740909349300524,340714818,GOOD VENTURE HIH LLC,1235 UNIVERSITY BOULEVARD,STEUBENVILLE,OH,43952,261329844,PROVIDE HOTEL/REST SVC & LIMITED DORM SPACE FOR STUDENTS/GUESTS,OH,2845890,3893360,N/A
201740909349300524,340714818,GOOD VENTURE BELLEVIEW,1235 UNIVERSITY BOULEVARD,STEUBENVILLE,OH,43952,340714818,FUTURE DEVELOPMENT FOR CAMPUS EXPANSION,OH,0,2007865,N/A
201740909349300524,340714818,GOOD VENTURE PROPERTIES,1235 UNIVERSITY BOULEVARD,STEUBENVILLE,OH,43952,340714818,DEVELOPMENT FOR CAMPUS EXPANSION,OH,2,16340087,N/A
201740909349300524,340714818,GOOD VENTURE PARKVIEW CIRCLE LLC,1235 UNIVERSITY BOULEVARD,STEUBENVILLE,OH,43952,340714818,PROVIDE RESIDENTIAL AND ACADEMIC SPACE FOR STUDENTS,OH,18000,3643588,N/A
201740909349300524,340714818,GOOD VENTURE S8,1235 UNIVERSITY BOULEVARD,STEUBENVILLE,OH,43952,474901471,PROVIDE HOTEL/REST SVC & LIMITED DORM SPACE FOR STUDENTS/GUESTS,OH,349686,4114340
201701089349301005,570314406,Crusader Mountie LLC,PO BOX 332,Tigerville,SC,29688,471461194,Wastewater Treatment,SC,89753,1346832,North Greenville Univ
201701089349300625,590624440,Holt Properties LLC,1000 Holt Avenue - CB 2715,Winter Park,FL,327894499,461788412,Acquire Real Property; Commercial Property Rental,FL,181643,2815925,Rollins College
201701089349300625,590624440,Langford RCI LLC,1000 Holt Avenue - CB 2715,Winter Park,FL,327894499,461775419,Hotel and Conference Center,FL,1517786,44099915,Rollins College
201701089349300625,590624440,140 Fairbanks LLC,1000 Holt Avenue - CB 2715,Winter Park,FL,327894499,462057006,Commercial Property Rental,FL,57197,1075445,Rollins College
201701089349300625,590624440,200 Fairbanks LLC,1000 Holt Avenue - CB 2715,Winter Park,FL,327894499,462064681,Commercial Property Rental,FL,-249733,Rollins College
201701089349300625,590624440,220 Fairbanks LLC,1000 Holt Avenue - CB 2715,Winter Park,FL,327894499,462102091,Commercial Property Rental,FL,45267,902228,Rollins College
201701089349300625,590624440,400 Park South LLC,1000 Holt Avenue - CB 2715,Winter Park,FL,327894499,462075853,Commercial Property Rental,FL,1151564,11423626,Rollins College
201701089349300625,590624440,Lawrence Center LLC,1000 Holt Avenue - CB 2715,Winter Park,FL,327894499,462088367,Commercial Property Rental,FL,157715,1902543,Rollins College
201711049349300601,560556753,REESE HOLDINGS LLC,PO BOX 7164,HICKORY,NC,28603,560556753,HOLDING OF CONTRIBUTED REAL ESTATE,NC,0,663000,LENOIR RHYNE UNIVERSITY INC
201711079349300116,560547511,KENAN HALL SARE LLC,501 NORTH MAIN ST,LOUISBURG,NC,27549,462059052,"OWN, ENCUMBER, AND SELL THE KENAN HALL DORMITORY",NC,10,6004434
201711079349300116,560547511,LOUISBURG COLLEGE FOUNDATION LLC,501 NORTH MAIN ST,LOUISBURG,NC,27549,812734620,HOLD ASSETS THAT WILL BE USED AS COLLATERAL FOR USDA DEBT,NC,0,0
201741329349305774,131740451,FORDHAM AIRVANA HOLDINGS LLC,888 SEVENTH AVE 7TH FLOOR,NEW YORK,NY,10019,131740451,HOLDING CO.,NY,1501410,FORDHAM U
201701259349301880,421315493,MAHARISHI UNIVERSITY OF MANAGEMENT,REAL ESTATE CORPORATION,1000 NORTH 4TH ST,FAIRFIELD,IA,52557,812247449,RE HOLDING,IA,MAHARISHI
201701319349301740,042104329,Hickory Street Development LLC,263 Alden Street,Springfield,MA,01109,261851011,Real Estate holding company,MA,0,0,Springfield College
201701289349301055,510175975,BCSPE LLC,3755 BROADWAY,NEW YORK,NY,10032,SPE,NY,0,0,BORICUA
201701289349301055,510175975,JIBARO NY LLC,3755 BROADWAY,NEW YORK,NY,10032,INVESTMENT,DE,13454,36878578,BORICUA
201721019349300342,741143128,ST MARY'S HOLDINGS INC,ONE CAMINO SANTA MARIA,SAN ANTONIO,TX,78228,455275423,SUPPORT,TX,1224000,22154000,ST MARY'S U
201721039349300317,750827465,MCM FUNDING LLC,7106 NORTHAVEN ROAD,DALLAS,TX,75230,270632967,REAL ESTATE,TX,45003,725669,TCU
201721039349300317,750827465,MEQUITY LLC,7106 NORTHAVEN ROAD,DALLAS,TX,75230,460904495,REAL ESTATE,TX,219442,8966942,TCU
201701309349302710,010271210,HUSSON UNIVERSITY CONDOMINIUMS LLC,ONE COLLEGE CIRCLE,BANGOR,ME,04401,REAL ESTATE HOLDING,ME,HUSSON UNIVERSITY
201731079349300043,060653264,CIA SAN ANTONIO BEVERAGES LLC,312 PEARL PKWY,SAN ANTONIO,TX,78215,BEVERAGE CONCESSION MANAGEMENT SERVICES,TX,262102,147602,CULINARY INSTITUTE OF AMERICA
201731079349300043,060653264,CIA SAN ANTONIO MANAGEMENT LLC,312 PEARL PKWY,SAN ANTONIO,TX,78215,BEVERAGE CONCESSION MANAGEMENT SERVICES,TX,0,0,CULINARY INSTITUTE OF AMERICA
201731079349300043,060653264,CIA SAN ANTONIO OPERATIONS LLC,312 PEARL PKWY,SAN ANTONIO,TX,78215,BEVERAGE CONCESSION MANAGEMENT SERVICES,TX,0,0,CULINARY INSTITUTE OF AMERICA
201701309349303620,362177139,UCHICAGO ARGONNE LLC,5801 S ELLIS AVENUE,CHICAGO,IL,60637,680628477,MANAGE LAB,IL,731071725,UNIV OF CHICAGO
201701309349303620,362177139,UNIV OF CHICAGO FOUNDATION LTD,5TH FL ALDER CASTLE 10 NOBLE,LONDON,UK,980525557,FUNDRAISING,UK,1001605,41131,UNIV OF CHICAGO
201701309349303620,362177139,THEORY AND COMPUTING SCIENCES,5801 S ELLIS AVENUE,CHICAGO,IL,60637,516596577,RESEARCH BUILDING,IL,7506553,84612789,UNIV OF CHICAGO
201701309349303620,362177139,UCHICAGO TRADING,5801 S ELLIS AVENUE,CHICAGO,IL,60637,300517735,INVESTING,IL,-11212002,2187947,UNIV OF CHICAGO
201701309349303620,362177139,MAROON INVESTMENTS LLC,5801 S ELLIS AVENUE,CHICAGO,IL,60637,HOLDING COMPANY,DE,0,0,UNIV OF CHICAGO
201701309349303620,362177139,UCHICAGO IMPACT LLC,1307 E 60TH STREET,CHICAGO,IL,60637,611682394,EDUCATION,IL,8321273,9005108,UNIV OF CHICAGO
201701309349303620,362177139,HARPER COURT LLC,5801 S ELLIS AVENUE,CHICAGO,IL,60637,HOLDING COMPANY,IL,3212134,-13904027,UNIV OF CHICAGO
201701309349303840,956002998,VU HOLDINGS LLC,55 FAIR DRIVE,COSTA MESA,CA,92626,HOLDING OF ASSETS - OIL/GAS,CA,22693,2743,VANGUARD UNIVERSITY OF SO CAL
201701289349300805,340714687,RAIDERS CORNER LLC,1972 CLARK AVE,ALLIANCE,OH,44601,340714687,RENTAL,OH,216490,2104763,MOUNT UNION
201701039349301605,741159753,TR UA GEORGE AND SID JONES TRUST #0842,COMMUN BANK AND TRUST PO BOX 2303,WACO,TX,76703,746157568,GRANTOR TRUST IN SUPPORT OF BAYLOR,TX,56956,956129,BAYLOR UNIVERSITY
201701039349301605,741159753,MARY ANN KOKERNOT LAWRENCE LACY TRUST,COMM BANK AND TRUST PO BOX 2303,WACO,TX,76703,GRANTOR TRUST IN SUPPORT OF BAYLOR,TX,0,401625,BAYLOR UNIVERSITY
201741239349301679,381360586,Dexter Holdings LLC,651 E Jefferson,Detroit,MI,48226,381360586,Acts as agent of UDM in various transactions,MI,0,0,N/A
201741359349303614,410693970,CENTRAL ORONO LLC,2115 SUMMIT AVE AQU 216,ST PAUL,MN,55105,REAL ESTATE INVESTMENT,MN,0,0,UNIVERSITY OF ST THOMAS
201721149349300802,581216007,LIFE STRATEGIC ACCELERATOR LLC,1269 BARCLAY CIRCLE,MARIETTA,GA,30060,383976566,investments,GA,0,0,LIFE UNIV
201731219349300803,640902475,PINION PROPERTIES LLC,1310 25TH AVE,GULFPORT,MS,39502,050614917,REAL ESTATE RENTAL,MS,-3365397,24702
201731079349300708,141338562,SKIDMORE EN FRANCE,94 BOULEVARD SEBASTOPOL,PARIS,FR,981235361,SUPPORT FOR SKIDMORE PROGRAMS IN FRANCE,FR,124835,SKIDMORE COLLEGE
201731079349300118,560529999,1924 HOLDINGS LLC,ONE UNIVERSITY PARKWAY,HIGH POINT,NC,27268,900660924,RENTAL,NC,964951,7623465,HIGH POINT UNIVERSITY
201731079349300118,560529999,LONGLEAF PINE REALTY LLC,101 NORTH TRYON STREET,SUITE 1900,CHARLOTTE,NC,28246,REAL ESTATE PURCHASES,NC,0,0,HIGH POINT UNIVERSITY
201731079349300118,560529999,OLYMPUS REALTY LLC,101 NORTH TYRON STREET,SUITE 1900,CHARLOTTE,NC,28246,REAL ESTATE PURCHASES,NC,0,0,HIGH POINT UNIVERSITY
201731079349300118,560529999,LILY PAD INVESTORS LLC,P O BOX 1550,HIGH POINT,NC,27261,REAL ESTATE PURCHASES,NC,0,0,HIGH POINT UNIVERSITY
201741089349300319,042103545,BOSTON COLLEGE ALUMNI ASSOCIATION LLC,140 COMMONWEALTH AVENUE,CHESTNUT HILL,MA,02467,042103545,ALUM. REL,MA,0,BC
201721089349300537,430662529,OLD ORCHARD SHOPPING CENTER LLC,23 OLD ORCHARD AVENUE,WEBSTER GROVES,MO,63119,430662529,RENTAL,MO,4119,4718220,WEBSTER UNIV
201721189349300207,150532078,COLGATE INN LLC,11 PAYNE STREET,HAMILTON,NY,13346,161601117,LODGING/FOOD,NY,315770,9124109,COLGATE UNI
201721189349300207,150532078,HAMILTON INITIATIVE LLC,PO BOX 219,HAMILTON,NY,13346,161584169,REAL ESTATE,NY,470267,6575070,COLGATE UNI
201721189349300207,150532078,PALACE THEATER LLC,PO BOX 207,HAMILTON,NY,13346,010549094,ENTERTAINMENT,NY,12,1455174,COLGATE UNI
201721189349300207,150532078,HAMILTON THEATER LLC,PO BOX 1895 7 LEBANON STREET,HAMILTON,NY,13346,050535870,ENTERTAINMENT,NY,377887,1293159,COLGATE UNI
201741089349300974,930386972,Willamette Angel Fund LLC,900 State Street,Salem,OR,97301,271638088,Investment,OR,-4692,462686,Willamette University
201741089349300974,930386972,Willamette Angel Fund Conference 2010 LLC,900 State Street,salem,OR,97301,273724001,Investment,OR,0,10400,Willamette Angel Fund LLC
201741089349300974,930386972,Willamette Angel Fund Conference 2011 LLC,900 State Street,salem,OR,97301,453417723,investment,OR,0,21075,Willamette Angel Fund LLC
201741089349300974,930386972,Willamette Angel Fund AthletePath LLC,900 State Street,salem,OR,97301,371816514,investment,OR,0,32500,Willamette Angel Fund LLC
201710939349300401,340714681,THE 1886 COMPANY LTD (LLC),1 JOHN CARROLL BLVD,UNIVERSITY HEIGHTS,OH,44118,340714681,LESSOR,OH,1508853,11088020,Y
201710939349300401,340714681,IGNATIUS LLC,1 JOHN CARROLL BLVD,UNIVERSITY HEIGHTS,OH,44118,340714681,LESSOR,OH,478646,2081927,Y
201710939349300401,340714681,LOYOLA LLC,1 JOHN CARROLL BLVD,UNIVERSITY HEIGHTS,OH,44118,340714681,LESSOR,OH,632489,2477217,Y
201710939349300401,340714681,MANRESA LLC,1 JOHN CARROLL BLVD,UNIVERSITY HEIGHTS,OH,44118,340714681,LESSOR,OH,196490,1037988,Y
201710939349300401,340714681,INIGO LLC,1 JOHN CARROLL BLVD,UNIVERSITY HEIGHTS,OH,44118,340714681,LESSOR,OH,243685,1057446,Y
201710939349300401,340714681,CURA PERSONALIS LLC,1 JOHN CARROLL BLVD,UNIVERSITY HEIGHTS,OH,44118,340714681,LESSOR,OH,722179,3711496,Y
201710979349301116,941156610,200 VAN NESS AVENUE LLC,50 OAK STREET,SAN FRANCISCO,CA,94102,471872329,REAL ESTATE RENTAL,CA,327901,-721086,SAN FRANCISCO CONSERVATORY OF MUSIC
201710979349301116,941156610,214 VAN NESS AVENUE LLC,50 OAK STREET,SAN FRANCISCO,CA,94102,REAL ESTATE RENTAL,CA,300000,198578,SAN FRANCISCO CONSERVATORY OF MUSIC
201731089349301118,620465076,MIDTOWN CAPITAL INVESTMENTS LLC,2319 CRESTMOOR RD,NASHVILLE,TN,37215,DEVELOPMENT OF CAMPUS FACILITIES,TN,0,0,BELMONT UNIVERSITY
