object_id,ein,DsrgrddEnttyNm_BsnssNmLn1Txt,USAddrss_AddrssLn1Txt,USAddrss_CtyNm,USAddrss_SttAbbrvtnCd,USAddrss_ZIPCd,IdDsrgrddEntts_EIN,IdDsrgrddEntts_PrmryActvtsTxt,IdDsrgrddEntts_LglDmclSttCd,IdDsrgrddEntts_TtlIncmAmt,IdDsrgrddEntts_EndOfYrAsstsAmt,DrctCntrllngEnttyNm_BsnssNmLn1Txt
201721359349304687,210634501,MTP HOLDINGS LLC,18113 ALLISON SQ,WEST WINDSOR,NJ,08550,472275689,HOLDING,NJ,85,70339,PRINCETON U
201721359349304687,210634501,Princeton in Athens LLC,701 Carnegie Center,Princeton,NJ,08540,813650537,Programs,DE,0,0,Princeton U
201741319349305084,860931108,TOHONO O'ODHAM COMMUNITY COLLEGE DEVELOPMENT LLC,POST OFFICE BOX 3129,SELLS,AZ,856343129,383855650,CONSTRUCTION SERVICES AND OPERATION OF APPRENTICESHIP PROGRAMS,AZ,56035,128486,TOHONO O'ODHAM COMMUNITY COLLEGE
201741319349301929,340714777,URSULINE STUDENT LEARNING CENTER LLC,2550 LANDER ROAD,PEPPER PIKE,OH,44124,340714777,REAL ESTATE,OH,0,0,URSULINE COLLEGE
201731319349303098,430654872,Compton Properties,221 North Grand Boulevard,St Louis,MO,63103,431765509,Real Estate,MO,-1906,735164,SLU
201741669349301044,951644037,Wave Ventures LLC,24255 Pacific Coast Highway,mailbu,CA,90263,464526544,Support Pepperdine University,CA,0,0,Pepperdine University
201741309349302304,350868125,VU INT'L COLLABORATION LLC,1700 CHAPEL DRIVE,VALPARAISO,IN,46383,453588931,CHARITABLE,DE,-6703,25738,LUA
201741309349302304,350868125,VU PROPERTY HOLDINGS I LLC,1700 CHAPEL DRIVE,VALPARAISO,IN,46383,452856225,R/E HOLDINGS,IN,2089,0,LUA
201741309349302304,350868125,VU PROPERTY HOLDINGS II LLC,1700 CHAPEL DRIVE,VALPARAISO,IN,46383,455235826,R/E HOLDINGS,IN,-45392,62495,LUA
201741319349300419,020222111,Tuck Capital Partners Management LLC,100 Tuck Hall,Hanover,NH,03755,475516892,Investments,NH,0,99,Trustees of Dartmouth College
201741319349300419,020222111,TuckDEN Ventures Management LLC,100 Tuck Hall,Hanover,NH,03755,475535191,Investments,NH,0,99,Trustees of Dartmouth College
201741359349311949,840404231,HIGHLANDS RANCH GOLF CLUB,9000 CREEKSIDE WAY,HIGHLANDS RANCH,CO,80129,840404231,GOLF COURSE OPERATIONS,CO,2848834,4992606,COLORADO SEMINARY
201741359349311949,840404231,KNOEBEL EVENTS LLC,2199 S UNIVERSITY BLVD,DENVER,CO,80208,EDUCATIONAL EVENTS/RESTAURANT,CO,424939,0,COLORADO SEMINARY
201741299349300834,840402510,DALE STREET PROPERTIES LLC,116 EAST DALE STREET,COLORADO SPRINGS,CO,80903,202018989,REAL ESTATE,CO,0,0,COLORADO COLLEGE
201741309349301004,231355135,PCOM Student Loan LLC,4170 City Avenue,Philadelphia,PA,19131,300215557,Loans,PA,PCOM
201741309349301004,231355135,PCOM Technology LLC,4170 City Avenue,Philadelphia,PA,19131,233036589,Inactive,PA,PCOM
201741309349301004,231355135,PCOM Technology Subsidiary LLC,4170 City Avenue,Philadelphia,PA,19131,233036591,Inactive,PA,PCOM
201741309349301004,231355135,PCOM Technology Holding LLC,4170 City Avenue,Philadelphia,PA,19131,231883739,Inactive,PA,PCOM
201731299349302063,710236896,Mediterranean Investment Properties LLC,123 Black Oak Place,Searcy,AR,72143,272348256,Real estate investments,AR,Harding University Inc
201731299349302423,440562048,PARK VISTA LLC,8700 NW RIVER PARK DRIVE,PARKVILLE,MO,64152,440562048,LEASING,MO,PARK UNIV
201731299349302423,440562048,PARK VENTURES LLC,8700 NW RIVER PARK DRIVE,PARKVILLE,MO,64152,440562048,INVESTING,MO,300000,PARK UNIV
201731329349301108,540505941,INVESTMENT PROPERTIES OF LYNCHBURG LLC,2500 RIVERMONT AVENUE,LYNCHBURG,VA,24503,541900543,COMMERCIAL REAL ESTATE,VA,31200,719830,N/A
201731339349301213,150532081,SU SHERATON HOTEL & CONFERENCE CENTER,801 UNIVERSITY AVE,SYRACUSE,NY,132100801,161586346,ACCOMMODATION,NY,10776387,16110890,SU
201731339349301213,150532081,ORANGE INSURANCE COMPANY LLC,100 BANK ST STE 610,BURLINGTON,VT,05401,473844706,INSURANCE,VT,88536,660654,SU
201731289349302403,231352683,PARRISH LLC,500 COLLEGE AVE,SWARTHMORE,PA,19081,460563007,INN/RESTAURNT,PA,601164,-724149,SWARTHMORE
201731319349301523,042103547,BU FUNDING LLC,108 BAY STATE ROAD,BOSTON,MA,02215,870773653,LLC,MA,0,46827000,BU TRUSTEES
201731319349301523,042103547,PLEASANT VENTURES REALTY TRUST,125 BAY STREET,BOSTON,MA,02215,REAL ESTATE,MA,11738917,23646134,BU TRUSTEES
201731329349303163,231352685,LEARNING ALLIANCE LLC,1398 WLIMINGTON PIKE,WEST CHESTER,PA,19383,562351966,EDUCATIONAL,PA,22804,2826364,TRUSTEES
201731329349303163,231352685,RA BLYTHE REMAINDERCO LLC,890 E HOBSON WAY,BLYTHE,CA,92225,231352685,REMAINDER,CA,0,0,NA
201731329349303163,231352685,RA CITRUS-HEIGHT REMAINDERCO LLC,6162 SAN JUAN AVE,CITRUS HEIGHTS,CA,95610,134018559,REMAINDER,CA,0,0,NA
201731329349303163,231352685,RA CLAREMONT REMAINDERCO LLC,45-99 WASHINGTON STREET,CLAREMONT,NH,03743,231352685,REMAINDER,NH,0,0,NA
201731329349303163,231352685,RA FLINT REMAINDERCO LLC,5014 CLIO ROAD,FLINT,MI,48501,134018594,REMAINDER,MI,0,0,NA
201731329349303163,231352685,RA GIBBSTOWN REMAINDERCO LLC,380 HARMONY ROAD,GIBBSTOWN,NJ,08027,231352685,REMAINDER,NJ,0,0,NA
201731329349303163,231352685,RA03 NEW OXFORD REMAINDERCO LLC,5675 YORK ROAD,NEW OXFORD,PA,17350,231352685,REMAINDER,PA,0,0,NA
201731329349303163,231352685,UNIV OF PENN (HK) FND LIMITED,ROOM 8 7/F K WAH CENTRE,191 JAVA RD,HONG KONG,HK,981062727,CHARITY,HK,8148,1617172,TRUSTEES
201731329349303163,231352685,UNIV OF PENN USA FOUNDATION LTD,19 NORCOTT ROAD,LONDON,ENGLAND,UK,N167EJ,980387770,CHARITY,UK,-24142,660418,TRUSTEES
201731359349307463,540505990,HAMPTON ROADS PROTON THERAPY INSTITUTE AT HAMPTON UNIVERSITY LLC,40 ENTERPRISE PKWY,HAMPTON,VA,23666,TO PROVIDE PROTON THERAPY IN THE FIGHT AGAINST CANCER,VA,17681105,146776053,HAMPTON UNIVERSITY
201731359349307463,540505990,ATLANTIC REAL ESTATE LLC,100 EAST QUEEN STREET,HAMPTON,VA,23668,MULTI TENTANT OFFICE BUILDING,VA,-354340,21715665,HAMPTON UNIVERSITY
201731359349307463,540505990,HAMPTON BB COMPANY LLC,100 EAST QUEEN STREET,HAMPTON,VA,23668,OPERATE BLACKSBURG HILTON HOTEL,VA,42052,HAMPTON UNIVERSITY
201731359349307463,540505990,HAMPTON W COMPANY LLC,100 EAST QUEEN STREET,HAMPTON,VA,23668,OPERATE VIRGINIA BEACH WESTIN HOTEL,VA,152183,8255061,HAMPTON UNIVERSITY
201731359349307753,131624067,Scherzo LLC,60 Lincoln Center Plaza,New York,NY,10023,811344522,SUPPORT,NY,0,0,juilliard
201731319349303298,060776644,CORAM LANE LLC,5151 PARK AVE,FAIRFIELD,CT,05825,475563897,OPERATION OF GREAT RIVER GOLF CLUB,CT,763758,7043070,SACRED HEART UNIVERSITY
201731319349303298,060776644,UHS LLC,5151 PARK AVE,FAIRFIELD,CT,06925,611774411,ACTIVITIES RELATED TO GREAT RIVER GOLF CLUB,CT,0,0,SACRED HEART UNIVERSITY
201711369349300536,341226547,Lourdes Properties,6832 Convent Blvd,Sylvania,OH,43560,341968998,Public Apt Rentals,OH,409960,10469990,N/A
201711369349300536,341226547,Center Enterprises,6832 Convent Blvd,Sylvania,OH,43560,341809820,Catering services,OH,72368,118279,N/A
201711369349300536,341226547,Lourdes Main St Properties,6832 Convent Blvd,Sylvania,OH,43560,341226547,Hold property,OH,227,189207,N/A
201711359349308816,201304472,UNIVERSITY OF TOLEDO PHYSICIANS LLC,3355 GLENDALE AVE 3RD FLOOR,TOLEDO,OH,43614,341127097,DISREGARDED ENTITY FORMED TO CARRY OUT PURPOSES OF MEMBER,OH,87165225,35216773,100 UNIVERSITY OF TOLEDO PHYSICIANS CLINICAL FACULTY INC
201711359349308816,201304472,UTP PATHOLOGY SERVICES LLC,3355 GLENDALE AVE 3RD FLOOR,TOLEDO,OH,43614,264032238,DISREGARDED ENTITY FORMED TO CARRY OUT PURPOSES OF MEMBER,OH,2519390,0,100 UNIVERSITY OF TOLEDO PHYSICIANS CLINICAL FACULTY INC
201711359349308816,201304472,NORTHWEST OHIO MEDICINE INC,3355 GLENDALE AVE 3RD FLOOR,TOLEDO,OH,43614,020624653,DISREGARDED ENTITY FORMED TO CARRY OUT PURPOSES OF MEMBER,OH,0,205000,100 UNIVERSITY OF TOLEDO PHYSICIANS CLINICAL FACULTY INC
201711309349301421,590859121,ECKERD COLLEGE REAL ESTATE LLC,4200 54TH AVENUE SOUTH,ST PETERSBURG,FL,33711,272423823,R/E HOLDING,FL,-295380,1040387,ECKERD COLLE
201711309349303176,951643389,REDLANDS PROPERTY MANAGEMENT INC,PO BOX 3080,REDLANDS,CA,92373,330423448,TITLE HOLDING,CA,0,0,UNIVERSITY OF REDLANDS
201711309349303176,951643389,REDLANDS PROPERTY MANAGEMENT TRUST,PO BOX 3080,REDLANDS,CA,92373,336089947,TITLE HOLDING,CA,0,0,UNIVERSITY OF REDLANDS
201701329349301975,630417508,UNIVERSITY OF MOBILE,5735 COLLEGE PARKWAY,MOBILE,AL,366132842,631103521,DORMANT,AL,1000
201711319349302396,350868107,UINDY INTERNATIONAL LLC,1400 HANNA AVE,INDIANAPOLIS,IN,46227,350868107,EDUCATION,DE,0,5439,UNIVERSITY OF INDIANAPOLIS
201711319349302396,350868107,UINDY DINING SERVICES LLC,1400 HANNA AVE,INDIANAPOLIS,IN,46227,465359408,DINING SERVICES FOR THE UNIVERSITY,IN,2188277,134006,UNIVERSITY OF INDIANAPOLIS
201711329349306681,910564961,Rainer Heights Holdings LLC,600 University Street Suite 3600,Seattle,WA,98101,"Accept, manage, and liquidate real estate",WA,9582,2043554,The University of Puget Sound
201711329349306921,050306206,WILDCAT REALTY HOLDINGS LLC,8 ABBOTT PARK PLACE,PROVIDENCE,RI,02903,454834756,REAL ESTATE HOLDINGS,RI,2594684,JOHNSON & WALES UNIVERSITY
201701359349301240,310536647,CEDAR CARE LLC,340 VARSITY DR,CEDARVILLE,OH,45314,475053455,CONSULTING,OH,-23182,18120,CEDARVILLE
201711319349303091,630312914,SPCAMPUS I LLC,800 Lakeshore Dr,Birmingham,AL,35229,473344667,Rental Real Estate,AL,3026210,21953996,Samford University
201711319349303091,630312914,SPCAMPUS II LLC,800 Lakeshore Dr,Birmingham,AL,35229,473367549,Rental Real Estate,AL,1146735,11662770,Samford University
201711319349303091,630312914,SPCAMPUS III LLC,800 Lakeshore Dr,Birmingham,AL,35229,473334076,Real Estate Investment,AL,2271957,28694370,Samford University
201711319349303091,630312914,Samford Properties East LLC,800 Lakeshore Dr,Birmingham,AL,35229,473374730,Land held for use,AL,3130000,Samford University
201721309349301777,440546278,WS REALTY LLC,4415 WARWICK BLVD,KANSAS CITY,MO,64111,261566435,R.E. HLDG,MO,0,0,KCAI
201711329349303151,730579298,THE OAK COMPANY,800 S TUCKER DRIVE,TULSA,OK,74104,202311693,REAL ESTATE,OK,0,47310,UNIV TULSA
201711329349303671,720423889,TULANE INTERNATIONAL LLC,6823 ST CHARLES AVENUE,NEW ORLEANS,LA,70118,020794141,INTERNATIONAL PROGRAM ADMINISTRATION,LA,5001000,3133000,N/A
201711329349303671,720423889,RIVERSPHERE I LLC,6823 ST CHARLES AVENUE,NEW ORLEANS,LA,70118,REAL ESTATE OWNERSHIP,LA,168000,2269000,N/A
201711329349303671,720423889,RIVERSPHERE II LLC,6823 ST CHARLES AVENUE,NEW ORLEANS,LA,70118,REAL ESTATE OWNERSHIP,LA,40000,1123000,N/A
201711329349303671,720423889,SQUARE 245 LLC,6823 ST CHARLES AVENUE,NEW ORLEANS,LA,70118,REAL ESTATE OWNERSHIP,LA,0,11000,N/A
201711329349303671,720423889,TULANE UNIVERSITY PHYSICIAN ORGANIZATION LLC,6823 ST CHARLES AVENUE,NEW ORLEANS,LA,70118,INACTIVE,LA,0,0,N/A
201711329349303671,720423889,TULANE CARY LAND LLC,6823 St Charles Avenue,New Orleans,LA,70118,Real Estate Ownership,LA,2000,1872000,N/A
201711329349303671,720423889,TULANE CARY WORKING INTERESTS LLC,6823 St Charles Avenue,New Orleans,LA,70118,Oil investment holdings,LA,1000,8000,N/A
201711329349303671,720423889,TULANE CARY ROYALTY LLC,6823 St Charles Avenue,New Orleans,LA,70118,Oil Royalty Interests,LA,1000,13000,N/A
201711359349305216,586044761,Point University Golf Club LLC,2001 Country Club Road,Lanett,AL,36863,473728196,Golf course,AL,292703,31430,Point University
201711359349305641,951816009,LLU MOUNTAIN PARK MULTIFAMILY PROPERTY LLC,11145 ANDERSON STREET BC-200,LOMA LINDA,CA,92350,MULTIFAMILY RESIDENTIAL REAL ESTATE,GA,-434021,0,LLU
201711359349305641,951816009,LLU LAKESIDE LLC,11145 ANDERSON STREET BC-200,LOMA LINDA,CA,92350,MULTIFAMILY RESIDENTIAL REAL ESTATE,GA,-506279,10460340,LLU
201711359349305641,951816009,LLU 93 EAST MULTIFAMILY PROPERTY LLC,11145 ANDERSON STREET BC-200,LOMA LINDA,CA,92350,MULTIFAMILY RESIDENTIAL REAL ESTATE,GA,-40500,2492424,LLU
201711359349305641,951816009,LLU MADISON MULTIFAMILY PROPERTY LLC,11145 ANDERSON STREET BC-200,LOMA LINDA,CA,92350,MULTIFAMILY RESIDENTIAL REAL ESTATE,TN,0,0,LLU
201711359349305641,951816009,LLU SPINNAKER COVE LLC,11145 ANDERSON STREET BC-200,LOMA LINDA,CA,92350,MULTIFAMILY RESIDENTIAL REAL ESTATE,TN,0,0,LLU
201711359349305641,951816009,LLU PENINSULA MULTIFAMILY PROPERTY LLC,11145 ANDERSON STREET BC-200,LOMA LINDA,CA,92350,MULTIFAMILY RESIDENTIAL REAL ESTATE,GA,-558239,13139748,LLU
201711359349305641,951816009,LLC LINDBERGH MULTIFAMILY PROPERTY LLC,11145 ANDERSON STREET BC-200,LOMA LINDA,CA,92350,MULTIFAMILY RESIDENTIAL REAL ESTATE,GA,-14250,0,LLU
201711359349305641,951816009,LLU CHAZAL MULTIFAMILY PROPERTY LLC,11145 ANDERSON STREET BC-200,LOMA LINDA,CA,92350,MULTIFAMILY RESIDENTIAL REAL ESTATE,AZ,-150000,3353022,LLU
201711359349305641,951816009,LLU MULTIFAMILY PROPERTIES IV LLC,11145 ANDERSON STREET BC-200,LOMA LINDA,CA,92350,MULTIFAMILY RESIDENTIAL REAL ESTATE,WA,-207000,3185244,LLU
201711359349305641,951816009,LLU MULTIFAMILY PROPERTIES LLC (DAYTON),11145 ANDERSON STREET BC-200,LOMA LINDA,CA,92350,MULTIFAMILY RESIDENTIAL REAL ESTATE,CO,-213000,1628800,LLU
201711359349305641,951816009,LLU MULTIFAMILY PROPERTIES LLC (WOODSTREAM),11145 ANDERSON STREET BC-200,LOMA LINDA,CA,92350,MULTIFAMILY RESIDENTIAL REAL ESTATE,CO,-183000,1350800,LLU
201711359349305641,951816009,LOMA LINDA TEXAS PROPERTIES LLC,11145 ANDERSON STREET BC-200,LOMA LINDA,CA,92350,455362289,MULTIFAMILY RESIDENTIAL REAL ESTATE,TX,-218022,3284101,LLU
201711359349305641,951816009,LLU HOUSTON HOUSE LLC,11145 ANDERSON STREET BC-200,LOMA LINDA,CA,92350,MULTIFAMILY RESIDENTIAL REAL ESTATE,TX,-140000,6955634,LLU
201711359349305641,951816009,LLU LAKEVIEW MULTIFAMILY PROPERTY LLC,11145 ANDERSON STREET BC-200,LOMA LINDA,CA,92350,MULTIFAMILY RESIDENTIAL REAL ESTATE,CO,-315000,5142134,LLU
201711359349305641,951816009,LOMA LINDA TEXAS PROPERTIES III LLC,11145 ANDERSON STREET BC-200,LOMA LINDA,CA,92350,MULTIFAMILY RESIDENTIAL REAL ESTATE,TX,-105000,6793707,LLU
201711359349305641,951816009,LLU MULTIFAMILY PROPERTIES III LLC,11145 ANDERSON STREET BC-200,LOMA LINDA,CA,92350,460913765,MULTIFAMILY RESIDENTIAL REAL ESTATE,OR,-487500,5403266,LLU
201711359349305641,951816009,LLU RIVERBEND MULTIFAMILY PROPERTY LLC,11145 ANDERSON STREET BC-200,LOMA LINDA,CA,92350,MULTIFAMILY RESIDENTIAL REAL ESTATE,UT,-150000,3047427,LLU
201711359349305641,951816009,LLU SAN MIGUEL LLC,11145 ANDERSON STREET BC-200,LOMA LINDA,CA,92350,MULTIFAMILY RESIDENTIAL REAL ESTATE,TX,-115000,5392975,LLU
201711359349305641,951816009,LLU MULTIFAMILY PROPERTIES II LLC,11145 ANDERSON STREET BC-200,LOMA LINDA,CA,92350,MULTIFAMILY RESIDENTIAL REAL ESTATE,CO,-321144,1579950,LLU
201711359349305641,951816009,LLU TENNESSEE MULTIFAMILY PROPERTIES LLC,11145 ANDERSON STREET BC-200,LOMA LINDA,CA,92350,MULTIFAMILY RESIDENTIAL REAL ESTATE,TN,-38500,4186065,LLU
201711359349305641,951816009,LLU OPUS 29 LLC,11145 ANDERSON STREET BC-200,LOMA LINDA,CA,92350,MULTIFAMILY RESIDENTIAL REAL ESTATE,TN,0,7157835,LLU
201711359349305641,951816009,LLU OPUS 31 LLC,11145 ANDERSON STREET BC-200,LOMA LINDA,CA,92350,MULTIFAMILY RESIDENTIAL REAL ESTATE,TN,0,12049324,LLU
201711359349305641,951816009,LLU SIENNA VISTA MULTIFAMILY PROPERTY LLC,11145 ANDERSON STREET BC-200,LOMA LINDA,CA,92350,MULTIFAMILY RESIDENTIAL REAL ESTATE,CA,-170162,2210996,LLU
201711359349305641,951816009,LLU NORTH RIVER MULTIFAMILY PROPERTY LLC,11145 ANDERSON STREET BC-200,LOMA LINDA,CA,92350,MULTIFAMILY RESIDENTIAL REAL ESTATE,AL,-371076,5060245,LLU
201711359349305641,951816009,LLU WESTBURY MULTIFAMILY PROPERTY LLC,11145 ANDERSON STREET BC-200,LOMA LINDA,CA,92350,MULTIFAMILY RESIDENTIAL REAL ESTATE,CO,-207823,2480705,LLU
201711359349305641,951816009,LLU THORNBIRDGE MULTIFAMILY PROPERTY LLC,11145 ANDERSON STREET BC-200,LOMA LINDA,CA,92350,MULTIFAMILY RESIDENTIAL REAL ESTATE,CA,-454100,6149962,LLU
201711359349305641,951816009,LLU GATEWAY MULTIFAMILY PROPERTY LLC,11145 ANDERSON STREET BC-200,LOMA LINDA,CA,92350,MULTIFAMILY RESIDENTIAL REAL ESTATE,UT,0,26512303,LLU
201711359349305641,951816009,LLU VUE 25 MULTIFAMILY PROPERTY LLC,11145 ANDERSON STREET BC-200,LOMA LINDA,CA,92350,MULTIFAMILY RESIDENTIAL REAL ESTATE,WA,-30776,2901546,LLU
201711359349305641,951816009,LLU BRISTOL BAY MULTIFAMILY PROPERTY LLC,11146 ANDERSON STREET BC-200,LOMA LINDA,CA,92350,MULTIFAMILY RESIDENTIAL REAL ESTATE,NV,0,5674629,LLU
201711359349305641,951816009,LOMA LINDA TEXAS PROPERTIES II LLC,11147 ANDERSON STREET BC-200,LOMA LINDA,CA,92350,MULTIFAMILY RESIDENTIAL REAL ESTATE,TX,-121821,4733209,LLU
201711359349305641,951816009,LLU FARMGATE MULTIFAMILY PROPERTY LLC,11148 ANDERSON STREET BC-200,LOMA LINDA,CA,92350,MULTIFAMILY RESIDENTIAL REAL ESTATE,UT,0,11864817,LLU
201711359349305641,951816009,LLU FOUNTAIN GLEN MULTIFAMILY PROPERTY LLC,11149 ANDERSON STREET BC-200,LOMA LINDA,CA,92350,MULTIFAMILY RESIDENTIAL REAL ESTATE,CA,-379500,12287535,LLU
201711359349305641,951816009,LLU RAINIER POINTE MULTIFAMILY PROPERTY LLC,11150 ANDERSON STREET BC-200,LOMA LINDA,CA,92350,MULTIFAMILY RESIDENTIAL REAL ESTATE,WA,0,4046552,LLU
201711359349305641,951816009,LLU SAGEGATE MULTIFAMILY PROPERTY LLC,11151 ANDERSON STREET BC-200,LOMA LINDA,CA,92350,MULTIFAMILY RESIDENTIAL REAL ESTATE,UT,0,3798123,LLU
201711359349305641,951816009,LLU SONOMA RIDGE MULTIFAMILY PROPERTY LLC,11152 ANDERSON STREET BC-200,LOMA LINDA,CA,92350,MULTIFAMILY RESIDENTIAL REAL ESTATE,AZ,0,5163364,LLU
201711359349305641,951816009,LLU MAITLAND MULTIFAMILY PROPERTY LLC,11153 ANDERSON STREET BC-200,LOMA LINDA,CA,92350,MULTIFAMILY RESIDENTIAL REAL ESTATE,FL,0,4363591,LLU
201711359349305641,951816009,LLU COBBLEGATE MULTIFAMILY LLC,11154 ANDERSON STREET BC-200,LOMA LINDA,CA,92350,MULTIFAMILY RESIDENTIAL REAL ESTATE,UT,0,0,LLU
201711359349305641,951816009,LLU RIVERPOINTE MULTIFMAILY PROPERTY LLC,11155 ANDERSON STREET BC-200,LOMA LINDA,CA,92350,813031067,MULTIFAMILY RESIDENTIAL REAL ESTATE,WA,0,0,LLU
201711359349305641,951816009,LLU CROSSPOINTE MULTIFMAILY PROPERTY LLC,11156 ANDERSON STREET BC-200,LOMA LINDA,CA,92350,813022687,MULTIFAMILY RESIDENTIAL REAL ESTATE,WA,0,0,LLU
201711359349305641,951816009,LLU PHOENIX BALLPARK LLC,11157 ANDERSON STREET BC-200,LOMA LINDA,CA,92350,MULTIFAMILY RESIDENTIAL REAL ESTATE,AZ,0,0,LLU
201711359349305641,951816009,LLU MURAI MULTIFAMILY PROPERTY LLC,11158 ANDERSON STREET BC-200,LOMA LINDA,CA,92350,MULTIFAMILY RESIDENTIAL REAL ESTATE,CA,0,1250000,LLU
201711359349305641,951816009,LLU QUESTHAVEN MULTIFAMILY PROPERTY LLC,11159 ANDERSON STREET BC-200,LOMA LINDA,CA,92350,MULTIFAMILY RESIDENTIAL REAL ESTATE,CA,-30776,2000000,LLU
201711359349305641,951816009,LLU TUSCAN HEIGHTS MULTIFAMILY PROPERYT LLC,11160 ANDERSON STREET BC-200,LOMA LINDA,CA,92350,MULTIFAMILY RESIDENTIAL REAL ESTATE,CO,-106982,7212605,LLU
201711359349305641,951816009,SDF II TEI-2 LP CO STARWOOD CAPITAL GROUP,11160 ANDERSON STREET BC-200,LOMA LINDA,CA,92350,263581689,INVESTMENT,CT,86028,1161206,LLU
201711949349301211,362167817,Triad WIS NWU LLC,550 N Green Bay Rd,Lake Forest,IL,60045,473504918,Investment,IL,-1779,5048221,Northwestern University
201701319349305915,520591641,100 ST ALBANS LLC,4701 N Charles Street,BALTIMORE,MD,21212,520591641,HOLDING CO,MD,0,1951976,NDMU
201741779349300759,446000294,ACQUISITION 8205 LLC,10850 LOWELL AVE,OVERLAND PARK,KS,66210,205953399,REAL ESTATE,MO,-128320,4537095,NA
201732169349301453,310725957,MVNU Management LLC,800 Martinsburg Rd,Mount Vernon,OH,43050,472839129,Hospitality Management,OH,277536,190568,Mount Vernon Nazarene University
201732169349301453,310725957,Mount Vernon Grand Hotel LLC,800 Martinsburg Rd,Mount Vernon,OH,43050,814919801,Real Estate Holding and Management,OH,0,0,Mount Vernon Nazarene University
201711959349300831,900790361,EMORY SPECIALTY ASSOCIATES LLC,201 DOWMAN DRIVE,ATLANTA,GA,30322,204700877,MD PRACTICE,GA,102007358,17818133,NA
201711959349300831,900790361,DIALYSIS ACCESS CENTER OF ATLANTA LLC,1365 CLIFTON ROAD,ATLANTA,GA,30322,141862166,BILLING,GA,0,0,NA
201711959349300831,900790361,EMORY DIALYSIS LLC,201 DOWMAN DRIVE,ATLANTA,GA,30322,264296847,BILLING,GA,30779571,6401212,NA
201711959349300831,900790361,EMORY MEDICAL GROUP LLC,1365 CLIFTON ROAD,ATLANTA,GA,30322,208281993,BILLING,GA,0,0,NA
201711959349300831,900790361,EMORY PEDIATRICS LLC,1365 CLIFTON ROAD,ATLANTA,GA,30322,582619196,BILLING,GA,0,0,NA
201711959349300831,900790361,EMORY PHYSICAL THERAPY LLC,1365 CLIFTON ROAD,ATLANTA,GA,30322,200174459,BILLING,GA,9877231,0,NA
201711959349300831,900790361,EMORY SELECT SERVICES LLC,201 DOWMAN DRIVE,ATLANTA,GA,30322,273126414,BILLING,GA,3074865,0,NA
201711959349300831,900790361,EMORY CLINICALLY INTEGRATED NETWORK LLC,201 DOWMAN DRIVE 102 ADMIN,ATLANTA,GA,30322,454610047,SEE PART VII,GA,1447824,2184467,NA
201711959349300831,900790361,EMORY PATIENT-CENTERED PRIMARY CARE LLC,1365 CLIFTON ROAD,ATLANTA,GA,30322,452665462,BILLING,GA,1196971,0,NA
201711959349300831,900790361,DRUG INNOVATION VENTURES AT EMORY LLC,201 DOWMAN DRIVE 101 ADMIN,ATLANTA,GA,30322,455372942,SEE PART VII,GA,2096565,8652079,NA
201711959349300831,900790361,EHCA JOHNS CREEK LLC,201 DOWMAN DRIVE 101 ADMIN,ATLANTA,GA,30322,582433436,HOSPITAL,GA,0,0,NA
201711959349300831,900790361,EMORY JOHNS CREEK PHYSICIANS LLC,1365 CLIFTON ROAD,ATLANTA,GA,30322,800435462,MD PRACTICE,GA,403761,-599512,NA
201711959349300831,900790361,JOHNS CREEK FAMILY PHYSICIANS LLC,4049 PEACHTREE INDUSTRIAL BLVD SUIT,NORCROSS,GA,30071,352345865,MD PRACTICE,GA,0,-155624,NA
201711959349300831,900790361,EHCA JOHNS CREEK RADIATION THERAPY LLC,201 DOWMAN DRIVE,ATLANTA,GA,30322,364635047,BILLING,GA,0,0,NA
201711959349300831,900790361,THE MEDICAL GROUP OF SAINT JOSEPH'S LLC,5669 PEACHTREE DUNWOODY ROAD,ATLANTA,GA,30342,260857111,MD PRACTICE,GA,25381197,-70808319,NA
201711959349300831,900790361,SEE PART VII - #1,6335 HOSPITAL PARKWAY,JOHNS CREEK,GA,30097,800508326,MD PRACTICE,GA,908319,168768,NA
201711959349300831,900790361,EHCJOC HOLDINGS LLC,6325 HOSPITAL PARKWAY,JOHNS CREEK,GA,30097,582137993,SEE PART VII,GA,0,0,NA
201711959349300831,900790361,EHCA JOHNS CREEK HOLDINGS LLC,6325 HOSPITAL PARKWAY,JOHNS CREEK,GA,30097,452721833,SEE PART VII,GA,0,0,NA
201711959349300831,900790361,ESOP REHABILITATION LLC,201 DOWMAN DRIVE,ATLANTA,GA,30322,465090816,BILLING,GA,12956848,11097018,NA
201711959349300831,900790361,EMORY SLEEP CENTER LLC,201 DOWMAN DRIVE,ATLANTA,GA,30322,465090816,BILLING,GA,3463887,701127,NA
201711959349300831,900790361,EMORY AMBULATORY SURG CTR DUNWOODY LLC,201 DOWMAN DRIVE,ATLANTA,GA,30322,464115055,SURG CENTER,GA,11194160,5209845,NA
201711959349300831,900790361,EMORY EMPLOYER BASED HEALTH SVC LLC,1365 CLIFTON ROAD NE,ATLANTA,GA,30322,472061134,BILLING,GA,2901641,556907,NA
201711959349300831,900790361,EMORY REHABILITATION LLC,201 DOWMAN DRIVE,ATLANTA,GA,30322,582137993,SEE PART VII,GA,0,0,NA
201711959349300831,900790361,EMORY OPTICAL LLC,201 DOWMAN DRIVE,ATLANTA,GA,30322,813114162,HEALTHCARE,GA,0,0,NA
201732279349302713,136192275,Bar Ilan Research and Development Co,Bar Ilan University,Ramat Gan,IS,52900,RESEARCH,IS,0,0,Bar Ilan
201711299349302441,042121659,Gateway Park LLC,100 Institute Road,Worcester,MA,01609,043494779,Real Est. Dev,MA,498292,8590000,WPI
201711299349302441,042121659,Lancaster Island LLC,100 Institute Road,Worcester,MA,01609,001108846,Real Est. Dev,MA,0,0,Washburn Par
201703069349300010,650267991,HOOTINSIGHT MUSIC PUBLISHINGLLC,777 GLADES ROAD,BOCA RATON,FL,33431,201565200,THE EDUCATION OF STUDENTS AND FACULTY AT ATLANTIC UNIVERSITY,FL
201703069349300010,650267991,HOOTWISDOM MUSIC PUBLISHINGLLC,777 GLADES ROAD,BOCA RATON,FL,33431,201565359,THE EDUCATION OF STUDENTS AND FACULTY AT ATLANTIC UNIVERSITY,FL
201703069349300010,650267991,HOOTWISDOM RECORDINGLLC,777 GLADES ROAD,BOCA RATON,FL,33431,201565424,THE EDUCATION OF STUDENTS AND FACULTY AT ATLANTIC UNIVERSITY,FL
201722279349301627,237285905,YISSUM RESEARCH DEVELOPMENT COMPANY,GIVAT RAM,JERUSALEM,ISRAEL,IS,IS,21325000,61497000
201722279349301627,237285905,UNIVERSITY ASSET MANAGEMENT CO,JABOTINSKLY STREET,JERUSALEM,ISRAEL,IS,IS,1660000,957000
201722279349301627,237285905,ACADEMON LTD MOUNT SCOPUS,MOUNT SCOPUS,JERUSALEM,ISRAEL,IS,IS,1432000,343000
201722279349301627,237285905,THE HEBREW UNIVETSITY MAGNES PRESSLTD,JERUSALEM,JERUSALEM,ISRAEL,IS,IS,1511000,1407000
201722279349301627,237285905,THE CENTER FOR AGRICULATURAL ECONOMICS RESEARCH,JERUSALEM,JERUSALEM,ISRAEL,IS,IS,60000,1592000
201722279349301627,237285905,THE MAGID INSTITUTE FOR CONTINUING EDUCATION,JERUSALEM,JERUSALEM,JERUSALEM,IS,IS,5068000,2125000
201722279349301627,237285905,THE NATIONAL LIBRARY OF ISRAEL LTD,JERUSALEM,JERUSALEM,JERUSALEM,IS,IS
201711959349300411,580566256,GOIZUETA BUSINESS SCHOOL STUDENT INVEST,201 DOWMAN DRIVE,ATLANTA,GA,30322,580566256,INVESTMENTS,GA,127545,1815005,NA
201711959349300411,580566256,GOIZUETA BUSINESS SCHOOL REAL ESTATE,201 DOWMAN DRIVE,ATLANTA,GA,30322,261718943,INVESTMENTS,GA,27761,191657,NA
201711959349300411,580566256,EMORY UNIVERSITY STUDENT HEALTH COUNSEL,201 DOWMAN DRIVE,ATLANTA,GA,30322,271119602,HEALTHCARE,GA,2946862,280767,NA
201711959349300411,580566256,ROSE ACQUISITIONS LLC,201 DOWMAN DRIVE,ATLANTA,GA,30322,454889158,INVESTMENTS,GA,-1107491,74864205,NA
201711959349300411,580566256,EMORY INTEGRATED HEALTH SERVICES LLC,201 DOWMAN DRIVE,ATLANTA,GA,30322,580566256,HEALTH CLAIMS,GA,0,0,NA
201711959349300411,580566256,EUEP LLC,201 Dowman Drive,Atlanta,GA,30322,580566256,Real Estate,GA,2604019,50146565,NA
201741029349300414,710236897,The Village at Hendrix LLC,1600 Washington Avenue,Conway,AR,72032,204993068,Manage and sell real estate,AR,-412004,9096004,Hendrix College
201741029349301009,710239383,DR JACKS COFFEE LLC -46-3543773,410 OUACHITA ST,ARKADELPHIA AR,AR,71998,463543773,COFFEE SALES,AR,26512,30153,OUACHITA BAPTIST
201741029349301009,710239383,OUACHITA RESOURCE INVESTMENT CO LLC,22-3916245 410 OUACHITA ST,ARKADELPHIA AR,AR,71998,223916245,OIL & GAS INVESTMENT,AR,2571,OUACHITA BAPTIST
201741029349301009,710239383,OUACHITA PROPERTIES DEVELOPMENT LLC,22-3916243 410 OUACHITA ST,ARKADELPHIA AR,AR,71998,223916243,REAL ESTATE INVEST.,AR,1830,OUACHITA BAPTIST
201741949349300504,111788788,NYIT Global LLC,Northern Blvd Gerry House 200,Old Westbury,NY,11568,472303439,INACTIVE,NY,0,0,NYIT
201742219349301559,136171197,MOUNT SINAI CARE LLC,1 GUSTAVE LEVY PLACE BOX 1061,NEW YORK,NY,10029,454492275,ACCT CARE ORG,NY,0,0,ISMMS
